Tourist Attraction,Name,Rating,Date and criteria,Title,Review
Acropolis_Mall,annejang,4.0 of 5 bubbles,Oct 2016 • Friends,Good for shopping!,"The mall is beautiful and has many outlets such as shoppers stop, body shop and even a Spencers for your groceries. The food court is decent too.A good place for family or friends to spend time."
Acropolis_Mall,subrata c,5.0 of 5 bubbles,Jun 2017 • Friends,Great shopping mall,"Great shopping mall with lots of entertainment, nice place ,standard views, with all modern amenities"
Acropolis_Mall,SAIKAT KUNDU,4.0 of 5 bubbles,May 2017 • Family,NICE FOR TIMEPASS,I go to the Acropolis Mall regularly. Here you can find Showrooms of different renowned brands. I mainly come here to pass the time and eat foods.
Acropolis_Mall,snmn4,3.0 of 5 bubbles,May 2017 • Family,Acropolis mall,Mall with movie theater was an attraction for selecting the locality of hotel. Has sufficient stuffs for shopping and eating.Quite crowded on week ends.
Acropolis_Mall,stantp1916,5.0 of 5 bubbles,Jun 2017 • Family,Very good mall,The mall is pretty good and as big as south city itself. We went to barcelos restaurant on the top floor after a small mall hopping. You would find almost all domestic and international brands as well as retail chains in this mall. Good and attractive mall.
Acropolis_Mall,TariqTabib,4.0 of 5 bubbles,May 2017 • Family,Excellent destination for shopping & Entertainment with awesome food court...,"It's one of the posh mall at Kolkata having brand shops. The mall has beautiful interiors and decors and awesome food court... They often arrange fest at their Ground Floor. However, it's may be an excellent destination for shopping & Entertainment with awesome food court..."
Acropolis_Mall,Gigabyte,3.0 of 5 bubbles,May 2017 • Family,Nothing special,Not recommended.....over crowded.....worst parking facilities.....Restaurants are good .... overall mall is very unorganised.....shops visibility is very poor....
Acropolis_Mall,Debopam,4.0 of 5 bubbles,Apr 2017 • Family,New and Smart,"One of the newer malls in Kolkata, and its pretty smart and well planned. The parking is from the rear side of the mall, and off the main road and away from the traffic. The mall is well planned with a big Shopper Stop, Movie halls, a food court with ample options and a fine dining options on the top floor."
Acropolis_Mall,BHAVYA t,4.0 of 5 bubbles,Dec 2016 • Friends,It's a mall and the mall,One of the best mall in Kolkata and u can always refuel urself at the cheap but good food court..It has variety of shops an awesome cineplex and Continental food options
Acropolis_Mall,Georgio Valentino Rayala,4.0 of 5 bubbles,Oct 2016 • Friends,New Mall close to the Ruby Bypass Area,"This is a New Mall in kolkata and I visited this place along with a friend in October 2016 as we went to the VFS office for Thailand Visa and this mall is located right next to it.This is neither a Huge Mall like the South City nor as People friendly as the City Center One Mall but it has got good shopping options like Shoppers Stop,Spencers,Body Shop etc,Eating Options like Chillis,Barcelos,Asia Kitchen,Au Bon Pain etc,Cinepolis Multiplex,Time Zone Gaming Area for kids and a very nice food court.We went to the food court and tasted bengali food at Savourites [ 6 Ballygunge Place outlet], went to the spencers department store to buy some items for our trip to Thailand and also had cookies and Coffee at the Cookie Man Outlet."
Acropolis_Mall,HwenTsang,4.0 of 5 bubbles,Apr 2017 • Family,Smart and Trendy,"Refreshing Mall with a feel good factor..Intelligent use of space...Has some fashionable shops like Mark and Spencer apart from good old Spencer's chain and known brands...Food court is grand....Have a milk shake in Keventer's (especially for those who have a nostalgia for Darjeeling and Satyajit Ray) or view the Gitanjali grounds from the chocolate shop...Very trendy, smart and clean..Thumbs Up for the Management team"
Acropolis_Mall,Roy_CityOfJoy,4.0 of 5 bubbles,Mar 2017 • Friends,Newest Shopping Mall in City of Joy,"Great ambiance inside mall, not as big as South City or Mani Square but still its has everything you expect in a metro city shopping mall. I really like the food-court here, also the restaurants. The mall management is doing great job, organising many events time to time at atrium area and keeping the entire mall extremely well maintained. Its a great mall for shopping, hanging out with friends and family, eating out, watching movies at Cinepolis multiplex."
Acropolis_Mall,sourav2012,5.0 of 5 bubbles,Dec 2016,One of the most effectively designed recent malls of Kolkata!,"Acropolis Mall is the combination of wonderful utilization of space (considering its size),a very good mix of brands (right from major apparel brands, grocery stores,play areas, party zones, restaurants, food court to a beautiful multiplex) with an equally strategic location. When all these three factors fall in right places, then a mall can't go wrong! If you want to spend quality time while being in South Kolkata or somewhere near the Bypass, then this is the place to be! It may not match the grandeur of South City mall or the premium value of Quest Mall, but it will definitely leave you impressed,specially when you want to visit a good place to do shopping or just for hanging out with friends, without negotiating too much traffic (as in case of the other two malls as mentioned above).."
Acropolis_Mall,Ratan G,4.0 of 5 bubbles,Mar 2017 • Family,A new mall in city of joy,"We visited this mall for the first time last night. We were delighted with the shops, restaurants and ambience of the place. Car parking was good. The place is big, so did not feel crowded. Ver clean and many big names in retail sector are there.Nowadays individual shops are absent in the trendy malls, Acropolis is no exception. Certainly will visit this mall when we come to Calcutta again.Finally we had a nice dinner at Chilles restaurant there."
Acropolis_Mall,Jayant G,5.0 of 5 bubbles,Mar 2017 • Friends,Shopping in acropolis,"Acropolis is a best place for shopping in kolkata, you will find latest stock in all the showrooms.Food court is also good specially keventers you should try thick shakes there."
Acropolis_Mall,gopalmittal,3.0 of 5 bubbles,Feb 2017 • Friends,huge,its huge. parking area is super huge as the building is very big . many offices in the building plus sky bar.
Acropolis_Mall,sritanu,4.0 of 5 bubbles,Dec 2016 • Couples,1st visit,"Good atmosphere, Parking area is huge. Food court & Restaurant are really nice.Top brands are available. Good entertainment for KIDS"
Acropolis_Mall,Debapriya p,4.0 of 5 bubbles,Dec 2016 • Couples,good for heavy pocket owner,"it is a nice place to shop good brand,you also have shopping,food and enjoyment at same place.i love it.but you does not got any thing at cheap price.the multiplex is awesome here."
Acropolis_Mall,Vishal S,4.0 of 5 bubbles,Feb 2017,Trendy and secure nice one stop shopping ,"This my go too back to civilization rent a furnished apartment not too far away , has little of everything street is super busy the food courts have a decent variety from local to Kfc and subway momos funny-thing the momos joint has a promo running for bogo in the month of Feb from the 1-31 hahahaha guess they want extend the leap year . The cineplex is state of the art and a deligth for me is Spencers supermarket live it excellent job guys staff can be snobbish but the variety is super great . It's secure and room air conditioned the funny thing is there's no seating in the common areas it's kinda a standish mall . There's a Chillies (havnt tried it ) and Barcelos Spanish flame grilled chicken yummy hey don't forget to try cheesy masala popcorn in the theatres .It's hard to find Coke Zero or diet drinks need have it on the fountains in the food court ... A must visit "
Acropolis_Mall,PARTHAROY1992,5.0 of 5 bubbles,Dec 2016 • Friends,Acropolis mall,It's a new mall. New things happen each day. Very trendy. It has a good shopping ambiance. It also has a cinepolis multiplex.
Acropolis_Mall,Eimeargency,2.0 of 5 bubbles,Jul 2016 • Friends,"Good henna, bad overcharging on drinks","Although it is more difficult to get to and from Acropolis Mall (buses and taxis are available), I had been told by friends that the best henna in all of Kolkata could be done by a man in Acropolis Mall. It was so interesting to see how quick the man could create the beautiful designs. We also went to Hoppipola for drinks with friends while in Kolkata. Although the atmosphere there was good, prices seemed to vary on drinks and we did feel like we were charged more because we were tourists."
Acropolis_Mall,N P J,4.0 of 5 bubbles,Dec 2016 • Couples,Shopping shopping and food,We spent almost a full day in this mall. Started with food at the food forum on the top floor which offered a decent variety to choose from. Then we went for shopping. Most of the shops were branded ones but also had some local ones. The only complaint I have is the song that played in the mall...it was only one song that too with couple of lines playing whole day long...I believe there is a movie theatre as well but we were tourists and were not bothered to check it out.
Acropolis_Mall,KRISHNENDU B,1.0 of 5 bubbles,Jan 2017 • Family,Extremely Poor Multiplex,I went with my parents to see one of the movies in its Cinepolis ie multiples. My parents had high blood pressure & a little breathing problems. But after requesting to almost 7 staffs they denied to switch on the air conditioner. As it was an evening show and it was the month of January. They told that they do not switch on their air conditioner or exhaust fan. My father became so sick that we need to leave the movie on half. I cannot understand why they are cutting down their cost so much for the people who are spending a lot for their best seats. This is like murdering people & will never suggest anyone to go their specially during their night or evening shift. If anyone read this please share for this severe inhumanity.
Acropolis_Mall,Somosmita,4.0 of 5 bubbles,Nov 2016,Huge and imposing,A great place for interesting food and shops. Away from the heart of the city. Ambient atmosphere. Huge and spacious.
Acropolis_Mall,Avatima,4.0 of 5 bubbles,Oct 2016 • Couples,Spacious mall with good options for dining,"Location: On Rajdanga Connector, opposite Kasba New Market, not far from Ruby Hospital crossing in the EM Bypass.Ambiance and decor: Gorgeously lighted, has a lot of free walking space in each floor.Contains quite a few branded clothing shops, a movie multiplex, a food court, a hypermarket store from Spencer's a couple of Salons and spas and the usual filler stores.USP: Availability of multiple brands and does not give you that congested feeling of an over-discovered destination, just yet."
Acropolis_Mall,masterhari,5.0 of 5 bubbles,Oct 2016 • Business,Great food varaities in the food court.,This mall has great food options and at a reasonable rates. The restaurant Auntie Anne's which serves Cinnabon is a great restaurant which opens at 10.30 am. The other restaurants open at 11 am.
Acropolis_Mall,Sachin Kaluskar,5.0 of 5 bubbles,Sep 2016 • Business,Indeed a Mall of Joy!!! ,Acropolis is no doubt the Mall of Joy in the City of Joy Kolkata. It has all reputed brands you want. I loved it's Food Court. Good varieties of food. The Mall is big enough to explore things you need and small enough to not to make you feel tired. Looks like the design has been made keeping in customers comfort in mind. I didnt feel tired walking around. 
Acropolis_Mall,Sayan B,4.0 of 5 bubbles,Oct 2016 • Couples,Very happy to visit here,"Acropolis mall is very near to Siemens and Chakraborty para areas..very new, fresh and staff is well behaved..all big brands like Mark and Spencers, Praapti, Van Heusen, Louis  Phillipe and others are present here..the movie experience is also awesome but the best part is the food court with mouth watering Bengali, mughlai and Chinese food..Mainland China has also a Asia Kitchen in 4th floor.. Just hope that it keeps it up and some bookstore like Crossword or Starmark comes up.."
Acropolis_Mall,tripsmaker,4.0 of 5 bubbles,Aug 2016 • Solo,Walk around to New Mall,"It's a brand new mall, earlier I  visited probably last year, then it has only few shops. Now, there are many big brands. All major luxury brands, have outlets in this mall. There is a food court, good location, good ambience. Only negative part is, It has no grocery outlet available. "
Acropolis_Mall,alurdam,5.0 of 5 bubbles,Sep 2016,A mall minus the madding crowd,I visited in september. It was on a holiday but the mall was not overcrowded.Could dine and shop in quite comfort without rush.Food options excellent both fast food and fine dining.Recommend a visit
Acropolis_Mall,anshumanbanerjee,2.0 of 5 bubbles,Sep 2016 • Family,Mall without any utility,"I visit there often as it is closest to my home. Else, you do not have any reason to pay visit unless you are addicted to shop with a fat purse OR movie goers. The Mall authority should think about opening a grocery store or something where you need to visit the mall for some basics. Luxury shops may not help to get higher footprint. Restaurants and movie theaters are the reasons for most of the footfall today."
Acropolis_Mall,Doyel K,4.0 of 5 bubbles,Jul 2016,Best food court,This place has a different vibe as compared to other malls. The food court is more customised and offers a feel of an international charm combined with local and national cuisine. They also have some of the best restaurants in town.
Acropolis_Mall,Aparajita B,4.0 of 5 bubbles,May 2016 • Family,New mall..still 😊,"A new mall.. Still. Nearer for folks from North kolkata. Like to go here to cinepolis theatre.Food court is small.for a mall. Seating is never sufficient even on lean hoursRead good reviews of Chilis outlet here, need to visit again.Asia.kitchen from speciality restaurants is in this mall.Go.for it"
