Tourist Attraction,Name,Rating,Date and criteria,Title,Review
BBD_Bagh,Suzanne F,2.0 of 5 bubbles,Nov 2019,Very dirty,"My luxurious Hotel Lalit Great Eastern is located here. I thought it would be a nice area to walk in..NOT. The remaining British buildings are in disrepair, and most are boarded up. Although most of the streets in India are not tidy. This is a while new level. The streets are wide and very busy, with no crossing lights. Very difficult to walk here. "
BBD_Bagh,Sunita,4.0 of 5 bubbles,Nov 2019,Binay Badal Dinesh Memorial place,"After visiting, I spotted that this place happened to have been established in memory of bold Indian freedom-fighters, Binay-Badal-Dinesh."
BBD_Bagh,AshokArka,5.0 of 5 bubbles,Aug 2019,commercial Hub of KOLKATA,"Commercial Place, Old State Secretariat name Writers BuildingState Police Head Quarter.Head Post Office"
BBD_Bagh,Roopen Roy,5.0 of 5 bubbles,May 2019,BBD Bagh,The photograph is misleading. It used to be the seat of power of British India and subsequent provincial governments of Bengal. Much of it now is old and crumbling except the Raj Bhavan and the General Post Office. For visitors to the city a walk down the streets and allies is a great and nostalgic experience.
BBD_Bagh,Sudipta Shaheen,5.0 of 5 bubbles,Sep 2018 • Friends,Business Hub,This is one of the busiest place in kolkata. It is surrounded by old british buildings. This place is walking distance from Howrah bridge.
BBD_Bagh,kamakshi2015,5.0 of 5 bubbles,Jan 2019 • Friends,The hub of the city !,BBD Bagh is a landmark which moves the city . The impressive landmark offers the stunning feel of the old buildings and the businesses . The well connected area has the Tourism Dept . The museum of textiles and some well known offices . The conducted bus tours offered by 5he Dept . Of tourism start here . Parking could be a problem here . The impressive historical landmarks are dotted in this area . 
BBD_Bagh,gastronaut_11,4.0 of 5 bubbles,Jan 2019 • Couples,Great architecture,"Something not to be missed. Buildings have great architectural, historical significance. Might not be in great condition, but wonderful."
BBD_Bagh,Amolak Rattan K,5.0 of 5 bubbles,Dec 2018 • Friends,Surrounded by all Important and Historical buildings,"If you are in Kolkata, you must visit this Bagh which is now dedicated to three martyres who had challenged British Government. If you drive early morning before sunshine, you will experience as if you are driving in central London as the architectural view of the buildings is a replica of Britain. Each building is worth admiring .Amolak Rattan Kohli Former Governor of Mizoram"
BBD_Bagh,Chandan P,4.0 of 5 bubbles,Nov 2018 • Couples,Haritage area ok kolkata is BBd Bagh,After staying some time in the hotel we came out to explore BBd bagh. Here very old buildings were there and in good condition. Many street food were also here.
BBD_Bagh,Travel with Hemant,4.0 of 5 bubbles,Dec 2018,A walk to the CBD Area of kolkata,"This area is full of people and cars, buses, hawkers as well as office going people. You find many old building which were build during the British era. The structure of these building are fabulous. A round in the area gives a feel of different Kolkata. You can try food from different food stall  on footpath. "
BBD_Bagh,Indira2011,4.0 of 5 bubbles,Dec 2017 • Solo,Place of important buildings.,"General post office building and Reserve Bank of India is there. Earlier the Chief Minister would sit in Writers’ Building here, now no more. "
BBD_Bagh,aastha,4.0 of 5 bubbles,Jan 2018 • Family,Congested place,The place is quite congested and not exactly a tourist spot. However you can go there if you want a cool breeze of the ganges. The area is well connected but you won't get a lot of restaurants here. The bus service is however good in this region.
BBD_Bagh,Jishnudeb M,5.0 of 5 bubbles,Aug 2018 • Couples,Central business district, Central business district with many heritage buildings. Lots of companies have their head office here. It’s very crowded and parking is an issue.
BBD_Bagh,stantp1916,5.0 of 5 bubbles,Aug 2018 • Solo,The powerhouse of India during British rule,The Dalhousie square is now a very busy area of the city as it houses most of the trade headquarters of the city and couple of the country. The buildings have a distinct taste of British architecture and is quite evident even now when you stroll through the streets although most buildings are badly maintained.
BBD_Bagh,argha2715,4.0 of 5 bubbles,Aug 2018,About BBD Bagh,its a common place known by most of the people.the nearest metro station is central.you can also take mini buses to go there.
BBD_Bagh,Jkbagrodia,4.0 of 5 bubbles,Jul 2018 • Friends,a very busyy plsce,"you can find a lot of officrs here,predominantly it is a totally official place and on weekends it will be totally abandoned due to very less people out there and it being a totally official place."
BBD_Bagh,Amolak Rattan K,5.0 of 5 bubbles,Dec 2017 • Family,Replica of London,"If you drive early morning, when streets are empty, the architecture and layout reminds you of London . After 10 am , you are in abusy and crowded office area . It is fascinating part of Kolkata . Governor Amolak Rattan Kohli"
BBD_Bagh,Rohit B,5.0 of 5 bubbles,Mar 2018 • Friends,BBD,"Ancient Kolkata as we call it, where all the babu corporates are situated, nothing much for the traveller but is a commercial place"
BBD_Bagh,Shekhar Gangopadhaya,3.0 of 5 bubbles,Apr 2018 • Family,BBD Bag - Office Para (Mahalla / Area),"BBD Bagh is still have many offices, mostly Government and Private.It's a good place to explore street foods. Multiple options available during lunch time. Choices become very limited after office hours.This place is well connected with all parts of Kolkota by bus, taxi & fewer trams.Extended Metro Rail is under construction and soon be operation connecting far ends of Kolkata."
BBD_Bagh,Jayant1947,4.0 of 5 bubbles,Feb 2018 • Couples,Historic,"To see the old ""RAJ"" days buildings and the surrounding areas is worth a 1 hour walk. This has history of per British and current Kolkata."
BBD_Bagh,Ema Datshi,4.0 of 5 bubbles,Oct 2017 • Couples,Great architecture,"Before I went to Kolkata, I felt that I 'knew' the city through the many novels I'd read that were set there and so some of the places I sought to visit were places I knew from literature. One of my favourites Kolkata books is Chowringhee, so after walking through that area, I kept going to Dalhousie Square (aka BBD Bagh) in search of the 'Writers Building'. Dalhousie Square was named after one of the British Viceroys so there's a delicious irony that it's now renamed after three Bengali Freedom Fighters who killed the British Inspector General of Prisons. One generation's terrorist is another's hero and we see that happen all over the world.Name change or no, BBD Bagh is architecturally SO British that it almost makes you laugh. Like the Viceregal Lodge in Shimla or the High Court in Mumbai, it's deliciously Victorian Britain at its best or worst depending on your perspective.  Grand old buildings, many of them in need of repair, remind us of a time when Kolkata was the centre of the British Empire's influence in India and it's got an architectural grandeur that Delhi just didn't replicate when the capital moved there."
BBD_Bagh,Gilkumar,5.0 of 5 bubbles,Jan 2018 • Family,beautiful square,"This is a great place for a late afternoon stroll, as the setting sun highlights these old colonial building with light contrast. "
BBD_Bagh,Dr Anshuman Das,5.0 of 5 bubbles,Jan 2017 • Couples,Still prefer Dalhousie  square,"Although this place has been renamed BBD Bagh (Binay Badal Dinesh ) after three freedom fighters the old name has a kind of charisma to it. Once the British RAJ was ruled from here. Now it's the business district of Kolkata. Connected via trams, the Metro it's kind of easy to visit. Best is to walk it yourself and see the old buildings .....a mixture  of British and Indian architecture. "
BBD_Bagh,Sysilia,4.0 of 5 bubbles,Dec 2016 • Friends,Old Buildings,If you a fan of old building then this is the right place. Noon time is the best time to wander around since it's not too hot
BBD_Bagh,jonesharma29,4.0 of 5 bubbles,Sep 2016 • Family,BBD BAGH,Bbd bagh is famouse historical place name on Binoy Badal Dinesh.it's a old british era building and design are so on.go in evening here have many street food option available
BBD_Bagh,Lone_wolf99,4.0 of 5 bubbles,Aug 2017 • Solo,Part of history,"This is one of the major historic places in Kolkata. You can spend a few hours roaming the streets and see the numerous monuments all over. Numerous food options, cheap and more or less hygienic. Beware of pickpockets."
BBD_Bagh,N S,5.0 of 5 bubbles,Jul 2017 • Business,The business district still has the old buildings,"This is kolkata's business district and is busy during the day. The buildings date from the Colonial era , the british raj : General Post Office, Stephen House, Writers Building , Lal Bazar Police station.The Court House the Church at end of Brabourne road etc. An amazing place to visit. In the evening after office hours it is empty . you also have many small food places for office goes and if you adventourous , you can try the local road side food. which is pretty cheap."
BBD_Bagh,AMUK,4.0 of 5 bubbles,May 2017 • Solo,"It is the the central business district in Kolkata, West Bengal","B.B.D. stands for three young Indian independence freedom fighters — Benoy, Badal and Dinesh — who on 8 December 1930 shot dead the Inspector General of Prisons, N.S. Simpson, in the balconies of the Writers' Building of the then Dalhousie Square. It is the the central business district in Kolkata, West Bengal."
BBD_Bagh,Rohit Agarwal,5.0 of 5 bubbles,May 2017 • Business,Commercial Kolkata!,"This is place where all the commercial activity happens. Whether is share bazaar, trading, selling.. you name it and its there. Hub of computer related businesses."
BBD_Bagh,MAHENDRANATHAN,5.0 of 5 bubbles,Feb 2017,VICTORIAN ARCHITECTURE AT ITS BEST,"Dalhousie Square now currently known as BBD Bagh is located at the South end of Howrah Bridge which seems to be the epicentre of all prime locations and activities. We were not disappointed as the marvel of the Victorian sculptured buildings stood out magnificently against the backdrop other buildings.It is where all the State of Bengal government buildings are housed besides being the Central Business district for the city.You will also find the General Post Office located here and the whole area is charmed with the old and the past of British Colonialism,"
BBD_Bagh,Natalie1204,4.0 of 5 bubbles,May 2017 • Family,Taste of old Calcutta ,"This place has character - lots of it. In the daytime, being primarily an office area, it's crowded, noisy, chaotic and you don't really get to see much, also because of the hawkers etc I love to drive through at night or on a Sunday when it's peaceful. There's so much to see - so many of the Old Calcutta buildings etc right from   High court to Town Hall. Don't miss the Malai toast breakfast at stock exchange/share market "
BBD_Bagh,PammyMom,5.0 of 5 bubbles,May 2017,Reliving the old world splendours,"This is may be the single reason for coming to Calcutta, the best place ro understand the Raj effect in India. However, you need a very good and informed local / guide to show you around. Some early reading would be good for history buffs."
BBD_Bagh,book_of_dreams,5.0 of 5 bubbles,Dec 2016 • Couples,Great Walk,"The wide streets are filled with lovely trees, wide paths and beautiful, grand colonial buildings. Kolkata is a grand city and this is part of the old centre, a hove of activity with a touch of elegance."
BBD_Bagh,Sumit A,4.0 of 5 bubbles,Jan 2017 • Solo,Phonomenal heritage buildings at one place.,"Best place to view heritage buildings at one place.Why visit this place?This is practically official centre of the city.Formerly known as ""Dalhousie Square"", because of colonial heritage.Feel the colonial essence in this place.Do visit ""Writer's Building"", it is the most famous heritage buildings of all.Why not to visit this place? Can't find any reason unless you don't care :PUSEFUL TIPS / HACKS :Prefer a walk and you'll get more time to feel the soul of this place and you admire the heritage buildings at your own pace."
BBD_Bagh,Partha Ray,4.0 of 5 bubbles,Mar 2017 • Solo,The Official Hub of Kolkata,"BBD Bagh is the heart of Kolkata. On all directions, one can see and enjoy Kolkata's Heritage Buildings . It has the Kolkata GPO.,The Writers' Buildings, The Commercial Library, the Reserve bank of India, the Merchant Chambers of Commerce, Bengal Chamber of Commerce and the Indian Chamber of Commerce., and old heritage Churches."
BBD_Bagh,analytic10,5.0 of 5 bubbles,Mar 2017 • Solo,Heart of colonial buildings in Kolkata,"Each building around the square has an interesting of its own.. such as Writers Building.Imperial government offices, commercial establishments. Now called BBD Chowk, ironically to honour those freedom fighters who tried to assassinate Lord Dalhousie"
BBD_Bagh,susan19482014,3.0 of 5 bubbles,Feb 2017 • Friends,Back to colonial times!,"What a historic collection of buildings, going back to the East India  Company days! The area also includes the Law Courts and some positively Dickensian legal chambers, outside which men with typewriters are  preparing legal documents for queues of people."
BBD_Bagh,Sanjay J,3.0 of 5 bubbles,Feb 2017 • Family,British Legacy,This place is still the business hub of Kolkata. It still has some old British period edifices.It is in heart of the city. If a traveler wants to visit he/she is suggested to see only once that too in a cab.
BBD_Bagh,SydnTooli,3.0 of 5 bubbles,Feb 2017 • Couples,The CBD of this city,"It has important landmarks like the GPO, Reserve Bank, Telephone exchange and Writers building. Worth a drive around, especially on Sunday when the traffic flows."
BBD_Bagh,Swagata D,5.0 of 5 bubbles,Feb 2017,Heart of the City - BBD Bag,"Binay Badal Dinesh Bag aka BBD Bag is the heart of Kolkata. This place is an unique fusional hub of both old colonial Kolkata with the modern Kolkata. Armenian Church (also called 'Mother Church of the Indian Armenians'), Writers' Building, Currency Building, Laldighi, Grand Post Office (GPO) etc still represent the colonial architecture in this City. "
BBD_Bagh,Ayub J,5.0 of 5 bubbles,Feb 2017 • Family,a sight to behold,heritage buildings all around.a must watch in kolkata.old world charm surrounds this place.nostalgic for heritage lovers.
BBD_Bagh,Traveller,4.0 of 5 bubbles,Dec 2016 • Family,Lovely to walk around many colonial buildings,"Buildings are beautiful, area is also a commerical district so you walk through crowded street with officegoers. you get to see local life"
BBD_Bagh,Kit53,5.0 of 5 bubbles,Dec 2016 • Couples,Walking in Kolkata,We stayed at the Great Eastern Hotel recently and quickly found the location to be superb for a walking tour of the area. We didn't take an organised tour as they were very expensive but took the Lonely Planet Guide book and walked the area on our own. It is safe and relatively easy to explore this area on your own and as it turned out was a highlight of our trip to India. It isn't a threatening place to walk around and we were rewarded with a real discovery of the streets and buildings of this wonderful city.
BBD_Bagh,Bp-USA,4.0 of 5 bubbles,Nov 2016 • Family,Victorian architecture,"Lots of historical buildings, encapsulating British and Indian history. Even the change of name from Dalhousie Square to Binay, Badal, Dinesh Bagh expresses an important slice of Indian history.   "
BBD_Bagh,Park A,3.0 of 5 bubbles,Oct 2016 • Family,Bbd bagh,This place is historical place which tie with Kolkata history..now place is crowded with many commercial office and people
BBD_Bagh,Suhana_shirgrill,5.0 of 5 bubbles,May 2016 • Family,Old heritage structures,"The scene here is cleaner as it is the commercial part of the city. B.B.D.Bagh earlier called Dalhousie Square. It has a lot of offices, banks,Writers Building and Lal dighi. "
BBD_Bagh,shwetasharadsingh,4.0 of 5 bubbles,Nov 2016 • Business,busy street,"its a very busy street full of hawkers. fresh fruits, offices. Old time charm. liked the feel. must try few bread items. chai , cut fruits."
BBD_Bagh,SuvodipMoitra,4.0 of 5 bubbles,Oct 2016 • Friends,Historic Place,"Named after Binoy Badal Dinesh (BBD), this famous square is now part of the business capital of the city. A park, few tall buildings, banks, tram lines,etc. Still having an old charm."
BBD_Bagh,guddu1954,5.0 of 5 bubbles,Oct 2016 • Couples,hang around,you can reach here by tram and taxi and hand around for hours for there is plenty to see.Old buildings of British era and lot of local food.
BBD_Bagh,Adhip M,4.0 of 5 bubbles,Aug 2016 • Solo,outgoing glory,"the new generation is shunning this place. moving to new locales. but this where it's all at. the old calcutta. still incredibly crowded. and the list of do-ables here is simply endless. also the architecture, my god!"
BBD_Bagh,pankaj3b,4.0 of 5 bubbles,Oct 2015 • Solo,Office Hub of North Kolkata,"BBD Bag, dalhousie whatever name you say, this place is the hub for small offices ok Kolkata along with head office of Banks and may boards such as Tea Board of India. I had my office during article ship period and have enjoyed every moment here. The cheap street food of BBD bag is best on planet"
BBD_Bagh,Albia-Newton,4.0 of 5 bubbles,Jul 2016 • Family,The Brits built this - Can you tell !,Colonial Architecture at it's best - ots of old world charm.Worth walking past just to see the place.Would have been great to see it in its prime (now old and worn - but still loved).
BBD_Bagh,ankan146,4.0 of 5 bubbles,Jul 2016 • Business,lifeline of kolkata businessmen,"Stones throw away from,eden gardens. named after binoy badal dinesh .3revolutioanry youths frm bengal, BBD bagh area  includes gpo,writers building,reserve bank of india fort williams  shahidminar .calcutta stock exchange MILLENIUM PARK among others howrah station also nearbyon banks of GANGES. world famous burrabazar is also  nearby.TruelyCALLED AS ENTRAL BUSIness district and lifeline of kolkata business ,"
BBD_Bagh,Mandar Bose,4.0 of 5 bubbles,Nov 2015 • Family,Heritage,avoid during weekdays. otherwise a nice place to stroll during evening and early morning. good kolkata heritage. WBTDC booking centre is also nearby 
BBD_Bagh,Dishaa S,4.0 of 5 bubbles,Jun 2015 • Solo,old charm!!,"the landmark area of kolkata still retains its old charm of the British days. the colonial architecture, the red sandstone buildings in the area are the constant reminders of the day gone by..worth visiting."
BBD_Bagh,Shourjendra D,4.0 of 5 bubbles,May 2016 • Friends,Heart of Kolkata,"If really there is a heart of Kolkata,this is THE place then. Centrally located at one point of time,during the beginning of Kolkata,the place has evolved over the ages.This place is a Square,where there are important Government buildings surrounding this Square , like the Writer's Building,The GPO,the Reserve Bank of India, Telephone Bhawan, etc . In the center of this Square lies a huge,sweet water pond called the Lal Dighi ( meaning the Red Pool - there are innumerable reasons on the internet,as to why this was called a red pool ). Fishing/ Angling is done in a big way now, in this water body.Dalhousie Square (BBD Bagh, as it is called now) has tramlines on its side,bus and taxi stands as well,and also has plenty of eateries around it. A must visit place for tourists in KolkataBy the way,you need a ticket to go inside to do fishing"
BBD_Bagh,asiahand1,3.0 of 5 bubbles,Apr 2016 • Friends,All buildings can use a coat of paint,"Perhaps the heart as well as the underbelly of Kolkata. Crowded, noisy, people hustling, meandering. Among all this chaos, the city still apparently works"
BBD_Bagh,AyonTalukdar,5.0 of 5 bubbles,Apr 2016 • Family,START YOUR WALKING,"Once known as Dalhousie Square, this part of Kolkata was built around the Lal Dighi as a seat of power for British India. After India won independence, it was renamed B.B.D. Bagh in memory of Benoy Basu, Badal Gupta and Dinesh Gupta — three youths who were martyred after assassinating Colonel N S Simpson, then Inspector General of Prisons, who was infamous for the brutal oppression of prisoners. There’s more to this square than just its rich heritage and spectacular architecture though. If you’re ready to explore Colonial Calcutta on foot, here’s where we suggest you start.  "
BBD_Bagh,NileshKJha,5.0 of 5 bubbles,Apr 2016 • Friends,Photographer's paradise!,"Centrally located, this place has everything that a photographer can ask for! You see tram around, you have jhaal-muri walahs, you have the hustle and bustle of this city, you have grandeur it simply sums up what Kolkata stood for!"
BBD_Bagh,Dev1972,3.0 of 5 bubbles,Feb 2016 • Family,A Square lost,Its now a bustling street market. Street vendors abound this place and you find people jostling about to make their buys form the vendors. The grandeur of the Square is simply lost in this background.
BBD_Bagh,Ross .,4.0 of 5 bubbles,Mar 2016 • Couples,Spectacular  from a distance,"Lots of history esp Courts, Writer's Building and GPO, but others too and very impressive from a small distance.Very difficult to photograph giving the scale and true feel with so many mature trees and limited access to best vantage points.Cricket  World Twenty 20 in town which may explain enormous police presence with plenty of soldiers too and lots of parks locked up.Close up most of the said buildings in sorry state of repair. Seems a sad characteristics of much of the wonderful architecture over the city."
BBD_Bagh,Natalie1204,5.0 of 5 bubbles,Mar 2016,Reeks of history ,"This place is a must visit for any tourist. Right from the colonial buildings to the malai toast near stock exchange, in a nutshell, this is Calcutta "
BBD_Bagh,Kanchan58,3.0 of 5 bubbles,Dec 2015 • Couples,Place for all offices of Kolkata,The full name is Binoy-Badal-Dinesh Bagh which is commemorative to the three famous Bengali revolutioneries who faught armed struggle with the British Empire & laid down their lives. Earlier this place was known as Dalhousie Square. It is located in the central most part of the city & houses most of the Kolkata Offices. After office hours this place becomes absolutely silent. You can get good very cost effective dishes during the lunch break period.
BBD_Bagh,Purnendu_mukh,4.0 of 5 bubbles,Feb 2016 • Family,Binoy Badal Dinesh Square,"It at the heart of the Office para...opposite of Writers Building...GPO,Lalbazar,High court are in its adjacent area"
BBD_Bagh,vibhor das m,3.0 of 5 bubbles,Jan 2016 • Family,Commercial Area of Kolkata,"Its one of the busiest areas of Kolkata. All offices, shops are in and around this area. One will find the old structured building of the british times. All famous buildings like General Post Office, Reserve Bank of India, Writers Building are in this area. The famous Calcutta Stock Exchange is also in this area."
BBD_Bagh,schroff,4.0 of 5 bubbles,Aug 2015 • Family,Old Architecture,"BBD Bagh is an old architecture, built by erstwhile British rulers when Kolkata was the capital of India. It is a beautiful monument located in the prime commercial hub of Kolkata. It is a must see for every tourist traveling tio Kolkata."
BBD_Bagh,belgianguy1,4.0 of 5 bubbles,Nov 2015 • Solo,The heart of colonial kolkata ,"Surrounded by imposing colonial buildings, this is a walk through history... A lake lies in the middle, it looks like once upon a time there was some boating possible there,  now it looks neglected and dirty"
BBD_Bagh,Sharad,3.0 of 5 bubbles,Apr 2015 • Solo,Not in sight seeing list,"Though nothing much to see, its is a beautiful square garden, well maintained and surrounded by Writers building, General Post Office,St. Andrew’s Church etc to name a few important landmarks of Kolata. One can relax for a while with traffic and trams around you. It is popularly known as BBD Baugh (baugh is garden). BBD stands for Benoy, Badal and Dinesh three young freedom fighters who in 1930 shot dead  the then  British Inspector General of prison, N S Simson in the Writers building on one side of the garden."
BBD_Bagh,99emgee147,4.0 of 5 bubbles,Feb 2015 • Family,Calcutta and the British Raj,"BBD Bagh is the herart of Kolkata city. If you embark on any street in Dalhousie square, you almost think that you are in England somewhere. Well maintained old buildings, monuments, churches give you a real feel of the British rule some 100 years or more back"
BBD_Bagh,Prabhatlahoti,4.0 of 5 bubbles,Aug 2015 • Friends,Official hub for small businesses,BBD bag named after Binay - Badal - Dinesh is an official hub and lots of small businesses prevail over there.
