Tourist Attraction,Name,Rating,Date and criteria,Title,Review
Chowringhee,Dr. Parikshet Sirohi,5.0 of 5 bubbles,Dec 2022,Nice walk!,"Take the walk from St. Paul's Cathedral to Park Street via Chowringhee, and have some nice breakfast/dinner thereafter."
Chowringhee,Natalie1204,4.0 of 5 bubbles,Jan 2021 • Family,The centre of the city. ,"This is where the hustle and bustle of the city is. You want to sum up kolkata but don’t have enough time? Just walk down Chowringhee & you’ll see a lot of what the city is made of. The noise, chaos, traffic & yet the love. Vendors dot most of the footpaths & you can buy anything from food & clothes to watches. "
Chowringhee,Rasputin21,1.0 of 5 bubbles,Feb 2020,Chaos,"Chowringhee used to be a beautiful wide street with mansion and good hotels.  Gardens on the other side provided a lovely contrast.  Now is is a concrete jungle with decaying buildings, derelict buildings, dirty broken foot path (if you can even call it it a footpath), dirty stalls.  The traffic congestion and the old and decrepit vehicles add to the continuing air of despair.  Chowringee has had its day and it will not be returning there."
Chowringhee,Mitesh,5.0 of 5 bubbles,Dec 2019 • Solo,Good one,"It is one of the few localities in the city with top end boutiques, hotels, malls, shops and restaurants."
Chowringhee,RameshKN,5.0 of 5 bubbles,Dec 2019,An Old area with lot of Big companies HQ,"Lot of companies and theyr HQ situated here, an OLD masterpiece now filled with heavy traffic. WD&HO wills, has their HQ at 36 Chworingee..."
Chowringhee,Tarek Hasan Chowdhury,4.0 of 5 bubbles,Oct 2019 • Family,Shoppers Den!!,"This place is awesome. You can find right from hawker items to high street Puma, Woodland etc. Always bustling with people. It is just connected with new market and Lindsay street. So anyone coming here can do shopping in those areas too. There are lots of food stalls serving authentic Indian cuisine in a very reasonable price."
Chowringhee,Travel with Hemant,3.0 of 5 bubbles,Sep 2019,walk at Chowringhee Road,"This  is one of the main roads of kolkata, we use to have a charm during British period. you can see few very old heritage building from out side. The Footpath is mostly covered street Shops.  & Road full of traffic."
Chowringhee,Ash K,4.0 of 5 bubbles,Feb 2019 • Solo,Full of action,"Chowranghee is a popular market area. However, most ofthe area was very crowded. The market spills onto the street with merchants carrying all kinds of colourful clothes and paraphernalia. They can be quite persistent in their sales techniques however are extremely kind."
Chowringhee,Dr Suvendu Pal,5.0 of 5 bubbles,Apr 2019 • Family,Heart of kolkata,Fell the heart beat of kolkata when you will be here.Rome in New market and grand hotel foot path to have a great shopping experience.
Chowringhee,sulekha s,5.0 of 5 bubbles,Dec 2018 • Family,Centre of the city,"This is a gorgeous place consisting of shops, crowd, vehicles and noice. The featues of this place is same for a very long time. Connectivity is very good."
Chowringhee,Trish W,4.0 of 5 bubbles,Feb 2019 • Couples,Noisy and chaotic,This really is what Kolkata is all about.  Stand on any corner and you will see what we mean.  There are plenty of market stalls around if that is your choice but we found the area an excellent choice if you like photography.  
Chowringhee,reubenranjanfern2017,4.0 of 5 bubbles,Feb 2019 • Family,"Very Crowded,",It is a very busy and crowded place. Lots of restaurants and shops. One of the main locations in Kolkata.
Chowringhee,99emgee147,4.0 of 5 bubbles,Feb 2019 • Business,High street,"The area Chowringhee is actually the city centre. This place is a delight for those travellers who like history. Lined with magnificent buildings both old and new, 5 star Hotels, restaurants & bars with a vast expanse of open maidan, the visit is not complete if you dont have a taste for the place"
Chowringhee,Pradip B,4.0 of 5 bubbles,Jan 2019 • Family,The Eternal Attraction,"On our last visit to Chowringhee, I became a bit nostalgic. This has been the place for all important events in my life.  This must be true for all people living in Kolkata.If  one is not from Kolkata, Chowringhee is a must-visit place, in spite of all its hassles, crowd, busy streets and hawkers. One will find great eateries, shops and vendors who are doing business for generations in Chowringhee."
Chowringhee,kamakshi2015,5.0 of 5 bubbles,Jan 2019 • Friends,The centre of the city !,"The best known street by its name brings back the vivid images of the hub the famed chhouranghee lane . The stretch is busy , vibrant , focus of so much activity that you are in midst  of the action . The hustle bustle of this mega city creates the magic . The street is full of eateries , shops and the classic joints where you can relax and watch the  world go by . The well connected landmark street is easy access by bus and metro . Do not miss being here if you want to experience kolkata ."
Chowringhee,Amolak Rattan K,4.0 of 5 bubbles,Dec 2018 • Friends,A very busy market and shopping center,One of the oldest areas of shopping and restaurant and food places of Kolkata. We remember even fifty years back this area was great attraction. Even now always crowded and busy centre for every thing you want. Governor Amolak Rattan Kohli 
Chowringhee,gastronaut_11,3.0 of 5 bubbles,Dec 2018 • Couples,India in miniature,"Just embrace the organised chaos. You will experience everything in a few blocks. Keep an open mind.No great hassle, just masses of people."
Chowringhee,Firdosh M,3.0 of 5 bubbles,Dec 2018 • Couples,CHOWRINGHEE,"I was in Kolkata in 1970. My first job. Chowringhee was chaotic. And it has not changed a bit. Crowds, honking, Thousands of human beings trying to catch a transport for home. They have a few flyovers but not much has changed. "
Chowringhee,rohanpillai1,3.0 of 5 bubbles,Nov 2018 • Family,Very crowded,The place is absolutely crowded all the time. The roads are quite narrows which s the reason for traffic jams. The road is also filled with thousands of small businesses which makes it even more difficult.
Chowringhee,BananaLu,4.0 of 5 bubbles,May 2018 • Friends,Visit for the symbol!,I admit I was happy to go through this area only because I had read and enjoyed the eponymous novel by Sankar published in the 60s. It was fun to spot some of the places and to try to imagine how it was 60 years back!
Chowringhee,Indira2011,4.0 of 5 bubbles,Dec 2017 • Family,Crowded place,"Big marketplace and meeting ground of many things. Many shops, hotels, eateries. Lots of crowd, so be ready to jostle and have time on hand. "
Chowringhee,drramesh_devani,3.0 of 5 bubbles,Oct 2018,congested market,"congested market , cheaper variety of items available,good for 2 to 3 hours time pass activity if you have."
Chowringhee,namesak,2.0 of 5 bubbles,Sep 2018 • Business,old flavour of the city,"extremely crowded and center of the city, traffic is horrible specially in peak hours, it has flavour of old kolkata."
Chowringhee,VINAY S,5.0 of 5 bubbles,Aug 2018 • Family,Busy city street,Its located in the middle of the city with too much of traffic.. for cheap shopping lovers must visit place...
Chowringhee,amitava g,5.0 of 5 bubbles,Sep 2018 • Family,Gone are those days..,"No, not rated 5* for today's chowringhee but for those good old days when Lighthouse, New Empire, Globe, Tiger, Chaplin cinema halls were still alive and was heaven for us who never missed those Hollywood movies but, alas now nothing is there, only an enormous void will greet u and cacophony of hawkers will invite u."
Chowringhee,Jishnudeb M,5.0 of 5 bubbles,Aug 2018 • Couples,Heart of vibrant kolkata,"It’s the heart of Kolkata with great restaurants, shopping destination and many offices. Heritage buildings dot the area. Availability of Parking is an issue."
Chowringhee,stantp1916,3.0 of 5 bubbles,Aug 2018 • Solo,The most populous part of the city,"This was perhaps one of the founding streets of the city, a first built. Today it is a very populous area with many offices and head offices. The iconic British buildings can still be seen here."
Chowringhee,Shubhro Mitra,4.0 of 5 bubbles,Jul 2018,The iconic road of Kolkata,"I believe Chowringhee was one of the first roads in the city and till date it remains as one of the most iconic road of Kolkata. There were and still are some of the most beautiful buildings on Chowringhee, like the Oberoi Grand Hotel, the Janbazar Building, the Chowringhee Mansions, the Asiatic Society, and the majestic Indian Museum amongst many others like the Virginia House, the New Market Watch Tower building, TATA Center, etc. The Chowringhee over looks the vast maidan and this fortunately remained the breathing hole of Kolkata. "
Chowringhee,argha2715,4.0 of 5 bubbles,Aug 2018,its chowringhee,"i often used to go there in chowringhee more,actually its not a place for trip,and its very crowded place."
Chowringhee,Dharmendra Arora,5.0 of 5 bubbles,Jul 2018 • Family,Crowded but Amazing!,"You wanna shop..eat...window gazing...specially if you dont mind heat and the sweat (then go in the evening)Eat 'Phuchka""..jhalmuri"" Badhshah's double chicken roll.......drink masal thums upshop at Nerw MarketIts an addiction..i like to do it whenever i m in Kol"
Chowringhee,PRAVEEN KUMAR G,3.0 of 5 bubbles,Jun 2018 • Business,Crowded Central District,"Central Business District of Kolkata is called Chowrangi. Totally haphazard, no traffic sense, however real Kolkata."
Chowringhee,Vidhi_sharmah,5.0 of 5 bubbles,May 2018 • Solo,busy road,"if u want to see what traffic is and what busy road is like , this is the place in kolkata full of crowd and hawkers"
Chowringhee,Kasturi B,5.0 of 5 bubbles,Apr 2018 • Family,Heart of the city,This is one of the most busy and happening place in central Kolkata. Many government office and other business activities are running in this place everyday. It is the prime business centre of the city.
Chowringhee,PushExplore,4.0 of 5 bubbles,Dec 2017 • Family,Wow. Epic Place,"The Chowringhee is a famous place in Kolkatta but is extremely crowded. We were stuck here for a bit, but our chauffer managed to make it thorough. Its quite famous for shopping, so its a place you cannot avoid, if you like to buy stuff."
Chowringhee,Ashok Gupta,4.0 of 5 bubbles,May 2018 • Business,The  Chourangi,It is the neighbourhood of Central Kolkata and a business destination. The shopping can be really enjoyed. It is also hotel centre for entertainment.
Chowringhee,Rohit B,4.0 of 5 bubbles,Nov 2017 • Family,Chowringhee,"One of the busiest place in kolkata, full of hifi market, branded outlets, big corporate house, in total a complete small city itself"
Chowringhee,Sanchita S,5.0 of 5 bubbles,Feb 2018 • Family,The pulse of kolkata,"This has been and will be the pulse of kolkata. with commuters walking hurriedly across streets in the morning, to cars honking their way to reach the destination to tourist with maps in hand. This is indeed where one can see the real kolkata."
Chowringhee,Jayant1947,3.0 of 5 bubbles,Feb 2018 • Couples,Chaos,"This busy Road is chaotic, but typifies Kolkata traffic and is close to many places of historic and commercial interest."
Chowringhee,s_ramsam,4.0 of 5 bubbles,Jan 2018 • Friends,City centre experience,"The heart and central area of the city. Choked with traffic, congested and crowded,  bustling and busy. Shopping, eating.... Great experience for the visitor!"
Chowringhee,Gilkumar,5.0 of 5 bubbles,Jan 2018 • Family,great place for street food,"Chowringhee is always extremely busy but offers plenty of great spots for street food, particularly Putchkas. "
Chowringhee,Dr Anshuman Das,5.0 of 5 bubbles,Feb 2017 • Friends,Chaotic,The city centre  actually.  Traffic and chaos is the best way to describe  this. Everyone who visits Kolkata must experience  this place. This is the beating heart of the city.
Chowringhee,Rajadas2014,4.0 of 5 bubbles,Dec 2017 • Couples,City's another busiest place in central Kolkata,City's another busiest place in central Kolkata. Street food and road side shopping place for everyone. Kolkata main long distance bus stand also located here. Very busy place and over crowed area. A good street side shopping area. One should take care of fraud scam.
Chowringhee,Georgio Valentino Rayala,5.0 of 5 bubbles,Nov 2017 • Friends,This is the Place where you get a True Essence Of Kolkata,"Chowringee as an area comprises of everything you want to see in Kolkata. It is filled with crowds and it is very tough to walk on the streets as you have to maintain pace with the crowds. I went here along with three other friends and stood at street corners to marvel at the architecture of the Old buildings like the LIC Building. Also we visited the Hogg Market [New Market] which was built during british rule and wondered why it could not be converted like the Central Market in Kuala Lumpur. Both are built around the same time.It's also home to all the old movie halls like New Empire, Roxy, Elite, Tiger, Metro etc and now what we see is most of them have been converted into Shopping places or restaurants.I hope the Bengal government which is instrumental in beautifying the New town area will also focus on this amazing place in Kolkata."
Chowringhee,prabhavmusaddi89,4.0 of 5 bubbles,Feb 2017 • Friends,Extremely crowded,"This place is worth visiting, although very crowded as expected because of a lot of offices located, heavy traffic but you get some excellent street food."
Chowringhee,lindylou601,4.0 of 5 bubbles,Oct 2017 • Couples,Wonderful atmosphere,"To get a feel for the chaotic atmosphere of this area, take a walk around Chowringee. It rarely seems to be quiet and to see all the colour and hear the noise is amazing. Beware of potential pick pockets though."
Chowringhee,David R,4.0 of 5 bubbles,Nov 2017 • Couples,Fascinating just for the noise and bustle,"Unlike Delhi or Mumbai, you don’t get hassled as you walk around this busy area. The sounds of horns and constant traffic everywhere make this an important memory of modern day Kolkata. "
Chowringhee,milma,5.0 of 5 bubbles,Oct 2017 • Couples,Amazing!!!,This is the place to visit if you want to experience the busy road/pavement markets of kolkata. It may be possible to ger a good deal.
Chowringhee,syed21,5.0 of 5 bubbles,Jul 2017 • Couples,heart of kolkata,"chowringee  is located at central Kolkata, this place is always crowded  ,we can say  people   can do street shopping there."
Chowringhee,Pierre,5.0 of 5 bubbles,Aug 2017 • Business,Hectic but great !,"Experience Kolkata in this famous district of the city. Plenty of choices all around, from food to books to souvenirs."
Chowringhee,PRRM,5.0 of 5 bubbles,Feb 2017 • Family,office area,lots of old offices are mostly occupying this area. crowded with local transports during busy hours. some nice food places are around like Haldiram.
Chowringhee,SagarVS,4.0 of 5 bubbles,Sep 2017 • Friends,Chaotic !,"You will be in for a shock in this area. An ocean of humanity where ever you look and probably the most crowded place in the country. Full of old and about to collapse buildings in this area. Plenty of shopping and a great place to sample the local flavors of Kolkata, But be prepared, this is no place for those looking for a quiet place."
Chowringhee,Kaniz K,4.0 of 5 bubbles,Sep 2017 • Couples,Truly Kolkata,"Chowringee, the lively vibe, the heart beat of Kolkata. It is the business centre, so people of all walks of life are there. Thousands of people and all sorts of vehicles and their noises give the pulse of that area. I still can hear the honks, and ringing of the bells all around me. It is a well known place for shops, restaurants, small and big businesses."
Chowringhee,Harpreet_Chd,4.0 of 5 bubbles,Aug 2017 • Business,An experience to remember by,"There is not one particular thing that you can label as a definitive sight seeing activity per se in this area, known by the ever popular name of Chowringhee. A popular place, immortalised in books, movies, stories and even history, Chowringhee became famous as an urban destination when the British started building residences around this area, which was practically a jungle infested with wild cats. It is to Kolkata what Piccadilly is to London.The main stretch of the area is the JL Nehru Road, but other popular roads like Camac Street and Sudder also fall in this area. For the locals and tourists alike, Chowringhee defines Old Calcutta, both in terms of the layout as well as the architecture of the buildings. This is also the Business hub of the city, and therefore almost always crowded and chaotic. You will find all modes of transport, all forms of shops, all varieties of things to eat, and all different types of activities happening around you. You can catch a bus, hire a rickshaw, travel by metro, ride a bicycle, take a walk...have any form of Indian/Chinese/Continental/American cuisine in some nook or corner of the umpteen streets in the area, and also find small to large shopping establishment either in the well defined shopping outlets, or as an unorganised setup on the pavements- don't be surprised to find full suits being sold right on the pavement. It is precisely this order in chaos that makes Chowringhee so special- be a part of the crowd, experience the madness in all forms and colours, savour the delicacies on offer, and live life the way it is on offer in Chowringhee. You will find your own reason to cherish some or all of it."
Chowringhee,jonesharma29,3.0 of 5 bubbles,Sep 2016 • Family,chowringhee,chowringhee is one of busy place of kolkata.many luxury showroom and famose shop are around here.in evening time can walk through road and see daily life of local
Chowringhee,prasan68,4.0 of 5 bubbles,Aug 2017 • Business,The business street of Kolkata.,Chowringee is truly the business street of Kolkata and our office is also located here.It stretches from Central Kolkata to edge of the North.
Chowringhee,Shashank Singh,4.0 of 5 bubbles,Aug 2017 • Friends,Famous place in kolkata,This is a famous place of kolkata. Among the famous porsh area in this city has a lot of academic training institutes along with good hotels. A place to find your stuffs.
Chowringhee,Ullans,4.0 of 5 bubbles,Nov 2016 • Solo,The heart of Kolkata,For anyone who has read Shankar's novel 'Chowringhee' this is a street that will be familiar.  It may not be pretty but it is full of life and worth a stroll at any time of day!
Chowringhee,Albia-Newton,4.0 of 5 bubbles,Jul 2017 • Family,Beating Heart of the City,The center of Kolkata - with hustle and bustle all around - If you want to feel the city you have to come here.
Chowringhee,268yusufn,3.0 of 5 bubbles,May 2017 • Family,Exploring Kolkata,"Its one of the busiest Street of Kolkata. Its surrounded with many numbers of stores, cafes ,restaurant and etc. It was an good Experience . loved Exploring major part of Kolkata."
Chowringhee,AMUK,4.0 of 5 bubbles,May 2017 • Solo,Chowringhee is the most happening place in whole of Kolkata.,"Chowringhee is the most happening place in whole of Kolkata. With New market/Park street around, there is a flurry of activity with all sorts of vehicles and pedestrians going about their business in this area. The area is filled with apparel stores, fast food outlets, restaurants and roadside eateries. It is an experience in itself and being part of all that is happening is a bonus. Whenever I go to Kolkata, I made it a point to stroll around here to become a part of the happenings."
Chowringhee,Nikunj_sadani,3.0 of 5 bubbles,May 2017 • Friends,It is not an attraction,"It is an area's name and you would find only traffic and cars. i reiterate, this is not an attraction. there is absolutely nothing to do here."
Chowringhee,globetrottingourmand,4.0 of 5 bubbles,Sep 2016 • Solo,A glimpse of old and bustling Calcutta,"It's always bustling with energy and choked with transportation of all kinds. A heritage and central park of old Calcutta. Best place to be in for a glimpse of old Calcutta, the British charm and innumerable shops of all sizes, holding all sorts of different things and old favourite eateries for snacks and drinks."
Chowringhee,Shiny K,3.0 of 5 bubbles,May 2017,Busiest Place in Kolkata,"One of the most busy, heritage, central part of Kolkata ideal for Shopping, Eating Out, Movie watching etc."
Chowringhee,MAHENDRANATHAN,4.0 of 5 bubbles,Feb 2017,Nightmarish but Authentic,"Chowringhee is the whole of Kolkata centered in one specific location. There is a flurry of activity with all sorts of vehicles and pedestrians going about their business in this area filled with fast food outlets,restaurants and roadside eateries.The whole place is jam packed with cars,motor cyclists,buses,Autos,cyclists all moving in tandem without knocking into each other but with horns constantly blaring away. It is an experience in itself and being part of all that is happening is a bonus. "
Chowringhee,Parthajeet M,3.0 of 5 bubbles,Apr 2017 • Business,Crowded but full of interesting things,Shopping destination for widest variety of fashion. Got a few fast food joints and restaurants that serve interesting delicacies. Must visit for those for whom crowded place is not a concern..
Chowringhee,Christopher B,5.0 of 5 bubbles,Oct 2016 • Business,One of the Last Genuine Great Streets of the Nineteenth Century Still Alive,"One of the wonderful attractions of India is the chance to escape the gated, sealed-in, air-conditioned, ""pre-canned,"" and packaged life of the global citizenry. No other street in India offers this real-life experience on a living piece of history, with quaint cafes, street hawkers, hustlers, grand and small shops, cozy bars and a bit of excitement! As a varied streetscape, it ranges from the exclusive entrance to the Oberoi Grand Hotel, the National Museum, and tiny shops offering specialised services. Your life is not complete until you've walked on the Chowringhee!"
Chowringhee,Sumit A,4.0 of 5 bubbles,Feb 2017 • Solo,Kolkata's all in pne place,"This is a must visit for anyone visiting Kolkata. This is one of the busiest places you'll find here filled with authentic Bengali lifestyle.Why visit this place?You'll see the real Kolkata soul here.Numerous street food types. Enjoy !You can shop , have snacks, road side food or simply have a glimpse of Kolkata's essence.This is the truest form of Kolkata that has ever been or will ever be.Why not to visit this place ?If you don't like crowd.USEFUL TIPS / HACKS :Travel via trams and man pulled rickshaw so you can get real feel of the place.CONCLUSION:Yes, this is a must visit and I'd highly recommend trying Puchkas."
Chowringhee,senguptad2015,5.0 of 5 bubbles,Mar 2017 • Couples,Too disciplined in a  highly indiscipline Style,"Car, trams, Bus, minibus Taxi, Scooters, Bikes, Cycles, hand carts, Rickshaws Thelas... you name any type of transportation and you will find all of them at the same time moving, dodging people and cars, running, driving, honking, belling, Police Whistling  shouting and the beauty is -  none is hitting none. And that is TRUE CHORINGHEE of Calcutta. We call it also Esplanade. Full of Commercial activities with thousands of shops, street vendors surrounded by old historical buildings. "
Chowringhee,diptendubt,4.0 of 5 bubbles,Jan 2017 • Couples,Spinal Chord of Calcutta,"The main road of Central Business district of Kolkata, Chowranghee aka Jawaharlal Nehru Road is the place for the Exchange of Kolkata. The luxurious Theatres, the New Market, The Chandni Chowk Market , The Maidan (Lung of Kolkata), Park street and Nandan, all lying connected by the road. Pulsiated by Esplanade, this area is equidistanced fom Sealdah, Howrah, Shyambazar, Bhowanipur and Khidderpur. This is the lifeline of Kolkata."
Chowringhee,RizwanHJabbar,5.0 of 5 bubbles,Mar 2017 • Family,True Kolkata,"If youy really want to enjoy the lifestyle of Kolkata, you must visit this place. As true as it can get, this is real Kolkata. Busy and hustling place with shops of all sorts and with modarately low price."
Chowringhee,Deepak K,5.0 of 5 bubbles,Feb 2017 • Solo,"Best restaurants, bars and clubs and shopping.","Love going there every time I am in Kolkata. I was just there in February recently and had the best time. Park Hotel has number of bars, in particular, The Aqua, a popular gay hangout. Check it out on the weekends."
Chowringhee,niya27,4.0 of 5 bubbles,Feb 2017 • Solo,Busy Market area,It is a local market in Kolkata where you can buy almost everything. It remains very crowded almost all the days. This place is well connected to all the part of Kolkata by public transport.
Chowringhee,Ayub J,1.0 of 5 bubbles,Dec 2016 • Family,terrible,very crowded .just the place to be if you want to mingle with the crowd.otherwise a nice area to explore on foot.
Chowringhee,Mohammad Yusuf H,5.0 of 5 bubbles,Apr 2016 • Family,Must walk around the place,"Very interesting tourist destination for those interested in trinklets, toys, casual clothing and footwear etc. "
Chowringhee,YOGESH P,5.0 of 5 bubbles,Jan 2017 • Couples,Savour the real Kolkata here,"Those familiar with the market scenes in UK, would feel at home here. The only difference are the crowds of people. Tourists and locals mingle in the hustle and bustle that is Chowringhee. There is something for everyone here. From toys, knick knacks, local arts and crafts clothes and more.For those more adventurous, sample the street food on offer. A particular favourite is the Jhal Muri."
