Tourist Attraction,Name,Rating,Date and criteria,Title,Review
Chowringhee,sudipnandy,4.0 of 5 bubbles,Dec 2016 • Solo,Heart of Kolkata,"This is the heart of kolkata, with major office, bus stands, shopping and restaurants located here. Nice place to shop for all kinds of clothes, cosmetics and knick knacks at really cheap prices. Lots of fooding & street food also available."
Chowringhee,Abbotsbury92,4.0 of 5 bubbles,Dec 2016 • Solo,Walk through here to get a feeling of the city,"A marvelous, crowded market.  I walked through here, not interested in buying anything, on a Tuesday morning.  Got a real sense of the pulsing energy of the city."
Chowringhee,raythealchemist,5.0 of 5 bubbles,Dec 2016 • Couples,Heart of Kolkata,"This place has the magical feeling that only Kolkata has to offer. Maidan, Rajbhavan, Shahid Minar, Tipu sultan Masjid, K C Das sweet Store, Writers...all are nearby to it and all this brings that charm of old and new times together."
Chowringhee,NayanKothari,4.0 of 5 bubbles,May 2016 • Solo,A real feel of Kolkata,A real feel of streets of kolkatta. A market place with a lot of shopping options either rode side or the shops. Food lovers will have a plenty of options there to eat. Esplanade / Dharamtalla are various names used for the same / near by places.
Chowringhee,shaniruddh,5.0 of 5 bubbles,Jul 2016 • Business,Shop shop and shop,"too crowded and lots and lots of shops ,, one can really enjoy shopping here. need to bargain a lot . "
Chowringhee,Vijai M,4.0 of 5 bubbles,Oct 2016,a very crowded  marketplace,"Known by many names like Esplanade, Dharamtalla,it is a happening place in the city of joy(Kolkata).you can roam here for hours and see the crowded place and also do some shopping."
Chowringhee,Reykjavic,4.0 of 5 bubbles,Aug 2016 • Couples,I like chowringee,"It was fun to walk in the big crowed, we was walking with my wife and we talked loud to listen each other."
Chowringhee,SuvodipMoitra,5.0 of 5 bubbles,Oct 2016 • Friends,Heart of Kolkata,"Its like the heart of Kolkata. Typical busy streets, a big four point crossing, the Esplanade park street area, buzzing. A popular among locals place. Good to go for street shopping etc."
Chowringhee,guddu1954,4.0 of 5 bubbles,Oct 2016 • Couples,very crowded but a must visit,Chowringhee market also knoen as Esplanade and Dharamtalla is a very crowded market yet very popular with locals and tourists alike.
Chowringhee,933srinivass,2.0 of 5 bubbles,Sep 2016 • Couples,Very crowded area - street shoppers paradise,"This is a good place for those who like shopping along the footpath for clothes, footwear, trinkets and many other items. Those who like cheap bargains will like this. It is not for those who prefer to avoid crowded places."
Chowringhee,Kinshuk Guha,4.0 of 5 bubbles,Sep 2016,HEART OF KOLKATA,"Bustling with hawkers, pedestrians, traffic jams this place is always in action. It is the focal point of the Kolkata city.All the attractions as well as destinations can be reached from this place. It is also a shopper's paradise."
Chowringhee,AdvisorUpasana2014,3.0 of 5 bubbles,Oct 2015 • Couples,"Complete view, mixture of new & old Kolkata.","Lots of Good Hotels are available near this place. Best place to stay, everything is walkable distance.Best for shopping area named Bara Bazar. This place is famous for Dass Rasgulla shop as well as ITC ltd head office named Virginia House.  "
Chowringhee,Raisa23,5.0 of 5 bubbles,Aug 2016,The Essential Calcutta,"The heart of the city...take a Sunday morning walk to take in its grandeur and a Friday evening quick, to touch the filth.Contradiction and history."
Chowringhee,vikasmardia,4.0 of 5 bubbles,Aug 2016 • Family,chowringhee/esplanade,centrally located one of the most busiest places in town all historic places are in the vivinity Also excellent place for shopping.
Chowringhee,Suman S,3.0 of 5 bubbles,Aug 2016 • Couples,Very crowdy place,It's the centre of Kolkata with lots of shops where crowd gathering is very intense. It's a good place for shopping lovers as one can find products of various types within different price ranges. Not recommended to visit during hot weather. Communication system is good.
Chowringhee,Adhip M,5.0 of 5 bubbles,Jul 2016 • Friends,Chowringhee,"Another place full of Calcutta history. One building after the other. Of course, many of the old ones have gone. A terribly crowded place but for the lover of Calcutta history - paradise, no less!"
Chowringhee,pankaj3b,4.0 of 5 bubbles,Oct 2015 • Solo,Centre Point ok Kolkata,"Chowringhee is the heart beat of City of Joy. It is the centre from which you have access all over the city. As far as shopping is concern, everything is easily available that also according to your pocket. It gives you feel why Kolkata is said to be city of Joy."
Chowringhee,Singh56,4.0 of 5 bubbles,Aug 2015 • Family,Crowded place but perfect for a foody,"I visited this place with my family when we came to Kolkata.It is very crowded place.It has many food stalls,Shopping malls,Resturants and Small stores.We ate many things from the road side food stalls like Aloo-Chop,Bread-chop,Fish-chop,Chicken Momo,Chicken Maratha,Rosgula and Sandesh.So,I recommend this place if you love food."
Chowringhee,a e,5.0 of 5 bubbles,Aug 2015 • Business,This is Kolkata,"This is Kolkata! It is colourful, chaotic, buzzing. I love the place from the street vendors to the imposing buildings. This place has it all."
Chowringhee,Albia-Newton,4.0 of 5 bubbles,Jul 2016 • Family,Beating heart of Kolkata,A  busy commercial and market area - very busy: but great to experience and brilliant for people watching.Take Kolkata's pulse and visit here at least once
Chowringhee,diadour,5.0 of 5 bubbles,Jul 2016 • Friends,This is the hub of the hustle and bustle!,"Kolkata is riddled with people, cars, and more people.  Chowringhee area is one of those places but also wonderful with curio shops, outdoor markets and so many knick knack stores.  It's worthwhile to walk around and take it all in, even buy some few souvenirs to bring home "
Chowringhee,najataqil,2.0 of 5 bubbles,Jul 2016 • Friends,crowded,This street is too crowded and i felt like i will get hit by a tram or bus.I  think its best avoided.
Chowringhee,GlobalConnectionGuru,5.0 of 5 bubbles,Apr 2016,A very interesting place!,"This is a extremely busy place. the fun part is you get everything here! Exceptional to average hotels, shops for everything, Many restaurants for different types and category, public and private transport and so on. Be careful when crossing the roads as the traffic is not that sober!"
Chowringhee,Avatima,4.0 of 5 bubbles,May 2016 • Family,The CBD of Kolkata that still tells a story of the colonial prime,"The hub of non-IT offices, perpetually lively (or crowded, if you are a daily commuter), often the center of political agitations, always in the news, but impossible to ignore if you live in or visit the city. Buildings may not be sky-high, but the view is one of the best indicators of how late 19th, early 20th century city centers used to look like. Deightful for street food lovers and bargain hunters"
Chowringhee,sujoy c,4.0 of 5 bubbles,Oct 2015 • Family,My recent visit here,"One weekend I have visited this area. This is basically heart of Kolkata. One of the most busiest place in Kolkata. From early morning to late night, huge no of people come here everyday. Main problem is the availability of car parking. Numerous street foods are available near the new market area. Lots of restaurants, food court, shops are located here."
