Tourist Attraction,Name,Rating,Date and criteria,Title,Review
Malik_Ghat_Flower_Market,Penelopewms,3.0 of 5 bubbles,Feb 2017 • Solo,This is 7 days a week with lots of activity,I've heard a lot about this market so took a car and driver to guide me through the maze. This is colorful but a bit intense and you really don't do this on your own. There are so many little vendors who actually live in little cubbies which line these allies all selling their creations as well as bundles of blossoms. It's life raw and personal so be prepared for all the sights and sounds.
Malik_Ghat_Flower_Market,runawaywinterbirds,5.0 of 5 bubbles,Dec 2016 • Couples,Wow!,"An amazing area of countless flower arrangements; food being cooked on the street; people everywhere; and more flowers! This is a non-stop place that supplies flowers to most of the hotels and for many occasions...very tight spaces, but worth the effort!"
Malik_Ghat_Flower_Market,Im O,4.0 of 5 bubbles,Dec 2016 • Family,Flower market,Malik ghar flower market is the one of biggest flower market of Kolkata.. For me its very pleasant to visit flower market in morning ..lots of verity of flower here available
Malik_Ghat_Flower_Market,Kasturi P,5.0 of 5 bubbles,Dec 2016 • Friends,Mallick Ghat flower Market,"The Flower Market is a wholesale one, catering to the fresh flower needs of the entire Kolkata city. It’s stretches from under the Howrah Bridge to a little beyond the Mallick Ghat. Flanked with flowers shops on either side, the market is a flower lover’s heaven"
Malik_Ghat_Flower_Market,Bandhan1498,4.0 of 5 bubbles,Dec 2016,paradise for street photography lover,Visit this place early morning and wear comfortable cloths as the roads are muddy.If you are interested in street photography we can have many moments and faces to capture.Its a wholesale flower market.So if you are a flower lover you can buy some flower for your drawing room in a afordale price.
Malik_Ghat_Flower_Market,andolon,5.0 of 5 bubbles,Nov 2016 • Family,Largest flower market,"If you go there early in the morning, you'll find so many flours that are coming and being sold and going to every direction of Kolkata. Though you will find flours all through the day but the best time is early in the morning. If you want to buy flour in cheap rate, you should visit this place."
Malik_Ghat_Flower_Market,raythealchemist,5.0 of 5 bubbles,Dec 2015 • Solo,Photography and scents,Visit this place early in the morning. before 7 am most of the flowers already sold. prepare for muddy and water logged walking.
Malik_Ghat_Flower_Market,matt80baltimore,4.0 of 5 bubbles,Oct 2016 • Solo,Awesome wholesale flower market,"This is not a place to buy flowers, it's a place to see the flower trade and commerce. Stay out of the way of the men hauling huge bags of flowers and watch as customers buy garlands and loose flowers and with porters to cart them off. This place is loud and crowded and hard to navigate, hence the four instead of the five."
Malik_Ghat_Flower_Market,Adhip M,4.0 of 5 bubbles,Jun 2016 • Solo,Flower market - something different,"a strange but beautiful place. not how a tourist attraction is supposed to look like. a big market where only flowers are sold. very colourful, no doubt. the train line through the market, at the same level, makes for a terrific perspective for photos."
Malik_Ghat_Flower_Market,Moloy B,4.0 of 5 bubbles,Oct 2015 • Friends,Flower Market Kolkata,"I trust that this is biggest flower market in INDIA, its huge and will find all types fresh flowers and flower decoration options. The only problem is , its not structured and well maintained"
Malik_Ghat_Flower_Market,Albia-Newton,5.0 of 5 bubbles,Jul 2016 • Family,Lively / Colourful - A must see,a busy place which hums with activity.Flowers are at their freshest and most colourful in the mornings.A photographers paradise
Malik_Ghat_Flower_Market,Edmundsan,4.0 of 5 bubbles,Jul 2016 • Solo,Amazing bustle of flower sellers & buyers,"Be amazed by the colourful, bustling sight of flowers everywhere & sellers/buyers checking wares. Street is crowded, esp when motorbikes/trucks try to pass thru. There are proper shops in inner lanes but didn't check them out."
