Tourist Attraction,Name,Rating,Date and criteria,Title,Review
Parashnath_Jain_Temple,Eildon D,5.0 of 5 bubbles,Oct 2016,Pleasant oasis,I've visited this before and each time it has felt like an oasis in the midst of much business. The temple is very relaxing and interesting and you don't get hassled by priests. It's not open all day so check opening times.
Parashnath_Jain_Temple,Arka_Dutta,4.0 of 5 bubbles,Sep 2016 • Couples,One of overlooked place of interest in the city.,Kolkata is always been a conglomeration of culture and the Jain temple in Maniktala is a prime example. Visit the temple in the morning and you will find peace. The temple itself looks magnificent in colours and architecture - some thing unique that the city possess.
Parashnath_Jain_Temple,Ananda M,4.0 of 5 bubbles,Aug 2016 • Business,The Jain Marvel,"There are 2 Pareshnath Temples, one at Badridas temple St , Gouribari & the other beside the R G Kar Road bridge at Belgachhia. The Badridas Temple St has 3 premises, but only 2 are open to public mostly. The Badridas Temple St  Temple has exquisite ceramic mosaic art made over 70 yrs ago, plus a mirrored corridor made with Italion mirrors. The tank used to have lots of large fishes earlier which were15-20 kgs when I used to visit in my childhood about 50 yrs ago. We could feed the fishes then. Now there are just Lilantica fishes and one can feed them with Atta dough. The architectural splendour, is a must visit for all. Do pray to Lord PareshNath since it brings Good Fortune from His blessings."
Parashnath_Jain_Temple,LondonScott,5.0 of 5 bubbles,Sep 2016 • Couples,A hidden gem,We didn't know about this temple but we're delighted to get the opportunity to visit. Allow half an hour to walk the grounds and view the inside. No photos allowed but the inside is very elaborate and definitely recommend getting a guide to explain more about the temple and the history.
Parashnath_Jain_Temple,Ram Prasad B,4.0 of 5 bubbles,Mar 2016 • Family,Beautiful mesmerizing temples,"The Jain temples also known as Parsvanath temples are located on Raja Dinendra Street in North Kolkata. Beautiful till date, I could not believe the existence of these temples in Kolkata till I saw with my own eyes. It is still worshiped by the Jains and various occasions and religious ceremonies takes place within the campus."
Parashnath_Jain_Temple,Lucinda P,5.0 of 5 bubbles,Sep 2016 • Solo,Characteristic of the Jain Movement with beautiful Mosaics,This beautiful temple and garden is charateristic of other temples of this minority religion with the mosaics and the marble and the semiprecious stones. Courtyard area with european overtones given it was built and supported by the rag watergarden and interior.
Parashnath_Jain_Temple,BongBlogger,5.0 of 5 bubbles,May 2016 • Solo,Pareshnath Jain Temple in North Kolkata,"This temple was built in 1867 by a Jain named Rai Badridas Bahadoor Mookim and dedicated to Parshwanath, who was the 23rd Jain Tirthankar.The interiors and as well as the exteriors of the temple are decorated with high quality mirrors and glasses. Excellent place and very well maintained. This could be a major attraction of kolkata but unfortunately a major portion of tourists are not aware of this heritage."
Parashnath_Jain_Temple,nishita d,5.0 of 5 bubbles,Aug 2016 • Family,Beautiful Temple,"There are four temples next to each other divided in three campus. The temples were constructed nearly 200 years back and are unique and beautiful examples of architecture. One temple popular as 'Kaanch Mandir' is made of mirrors. There are two ponds in the campus and the surrounding is very beautiful and calm. One must go if they seek a quiet, peaceful and positive environment . "
Parashnath_Jain_Temple,Singh56,4.0 of 5 bubbles,Aug 2015 • Family,A must visit temple in Kolkata,I visited this temple with my family.The temple was very big and beautiful.It is very famous in the jain community.I mesmerized by experiencing this beautiful temple.If you wanted a place which will give you positive energy and calmness in Kolkata then Pareshnath temple will be perfect for you.
Parashnath_Jain_Temple,Singh56,5.0 of 5 bubbles,Aug 2015 • Family,Simply a mesmerizing temple,"I visited this temple when I came to Kolkata with my family.The temple was very beautiful.It is very much attractive for a God believer like me.The temple is very much popular in Kolkata.The perfect time to visit this temple is in early morning or in evening.So,I recommend other to visit this temple when they came to Kolkata."
Parashnath_Jain_Temple,Kavita J,5.0 of 5 bubbles,Jul 2016,Must Visit,"One of the most revered Jain Temple of Kolkata,so full of positive energy the moment you enter the Temple premise. "
Parashnath_Jain_Temple,Anil_the_enjoyer,4.0 of 5 bubbles,Jun 2016 • Family,An ancient temple,The temple is very old and popular with the Jain community. The dada bari which is near  by is where all relegious ceremonies are held. the only constraint is the narrow roads which leads to road blocks at times
Parashnath_Jain_Temple,Juliet C R,5.0 of 5 bubbles,May 2016 • Friends,Two wonderful experiences in one location!,"Two sites in Kolkata, right next to each other, can elicit strong spiritual experiences, both very special and very memorable.The Jain Temple is covered with small mirror tiles which glow in the sun, giving it a surreal appearance.  Inside the temple is a ghee candle which has been burning for more than 150 years, and the space is inspiring.  The grounds are beautiful, with fountains and landscaping. We saw monks giving lessons to locals, many families with young children, and devout worshippers in brightly-colored saris.But, as though that were not enough - the Temple is also located along the Ganges River, so that you can walk a few steps and be right at the water!  Touching or entering the water is a personal decision - it is said to be very polluted - but you can sit comfortably and watch bathers in yellow loincloths, and watch this river, the heart of India, flowing by.  I personally stepped into the water, took some in my hand and poured a few drops on my head, the ritual we had been taught - then went back to the hotel and scrubbed!!  I was just fine - but many people chose to just watch.The Temple and the River - two not-to-be-missed sights!!"
Parashnath_Jain_Temple,ravi0717,4.0 of 5 bubbles,Mar 2016 • Couples,Nice architecture,This temple is beautifuly made and well maintained. Dont wear black leather things when you visit this temple
Parashnath_Jain_Temple,RitaKalindjian,4.0 of 5 bubbles,Jun 2015 • Family,Beautiful temple,"A Remarkable architecture. Like all the temples , it is most of the time very crowded. Watch your bags ."
Parashnath_Jain_Temple,pilgrim_gsa,4.0 of 5 bubbles,May 2016 • Couples,Mesmerizing,Beautiful well laid out temple in the heart of the city just near Marble palace everyone goes but mises this one that's not to be missed .
Parashnath_Jain_Temple,firemangp,5.0 of 5 bubbles,Apr 2016 • Family,Beautiful and Stunning Jain Temple,"This is a beautiful temple - extremely beautiful architecture, pristine gardens and peaceful atmosphere. Well worth a quick visit and there are not many people present. "
Parashnath_Jain_Temple,ShekharMukherjee,4.0 of 5 bubbles,May 2015 • Solo,Pareshnath Jain temple,"This temple was built by Seth Badridas Mukim Bahadur in 1867. This temple is dedicated to Pareshnath, the 23rd Jain Tirthankar and is located in North of Kolkata."
Parashnath_Jain_Temple,Leslie B,4.0 of 5 bubbles,Mar 2016 • Solo,Colorful Temple,This temple is quite stunning and apparently the Jains do good works in the community.  It is difficult to see such extravagance amid so much poverty in a city.  I have some moral issues with that in all religions.
Parashnath_Jain_Temple,Liz S,4.0 of 5 bubbles,Mar 2016 • Friends,"Dolly mixture colours, wonderful to see!","I loved this, statues of men on elephants at bottom of temple, yellows and mauves, blues and pinks, extraordinary mix of colours, photos permitted outside temple.  Quirky gift shop. I was there when visiting pilgrims came, rather moving to watch them inside temple. Stunning flowers and plants, escape from the city for half an hour or more.  Don't miss, one of my five essential things to see."
Parashnath_Jain_Temple,1512012,5.0 of 5 bubbles,Mar 2016 • Couples,Beautiful and best,I can't explain in words. Old jain temple in Kolkata city. One of the best architecture in city. It's very decorative place.
Parashnath_Jain_Temple,hetalk903,4.0 of 5 bubbles,Jul 2015 • Family,Beautiful Place,"A must visit if you are a Jain . The temple is dedicated to Parshwanath, who was the 23rd Jain Tirthankar, and he is worshipped by the Jains, and this is one of the most important Jain temples in Kolkata."
Parashnath_Jain_Temple,lestroispigeons,5.0 of 5 bubbles,Feb 2016 • Friends,"Really interesting and beautiful,",As with other temples access was available to all.  No internal photography allowed though.  Fascinating insight to Jainism.  Highly recommend.
Parashnath_Jain_Temple,Andrew P,4.0 of 5 bubbles,Jan 2016 • Couples,Tasteful glitter,An oasis of peace and order in the mad streets.  Very ornate temple but done with craftsmanship.  Genuine friendliness from those inside.
Parashnath_Jain_Temple,lestroispigeons,5.0 of 5 bubbles,Feb 2016 • Friends,"Amazing tiles,",The Pareshnath Jain temple of Kolkata is one of the most revered and holy shrines of the Jains in Kolkata and I'm really glad to have visited it.  It had an amazing spiritual atmosphere and the blocks of glass mosaics and silver European-styled statues were awesome too.
Parashnath_Jain_Temple,pmcpmc,4.0 of 5 bubbles,Feb 2016 • Couples,An insight into Jainism,Visited the Jain temple as apart of an organised tour group.  The architecture is worth seeing and access to all areas is permitted.    There is some climbing of steps to enter the central part of the temple.   A guide will enhance the visit.  
Parashnath_Jain_Temple,Ismat,5.0 of 5 bubbles,Feb 2016 • Couples,Superb!,"Beautiful place.. hidden like a gem inside Kolkatta.. we were taken there by our very knowledgable guide.It was a lovely serene place, superbly maintained. so much peace and beauty , a haven of peace and tranquility in the middle of the clutter and noise of the city."
Parashnath_Jain_Temple,bose_rima,4.0 of 5 bubbles,Dec 2015 • Friends,Beautiful shiny temple,"Closed to the general public during certain festivals, the Jain temple is quite picturesque, though small. there is a pond too."
Parashnath_Jain_Temple,vikasmardia,5.0 of 5 bubbles,Jan 2016 • Family,jain temple,A must visit for all Jains residing and visiting Kolkata. Good shrines and can have darshan of monks and also sermons.
Parashnath_Jain_Temple,ABMKOL,4.0 of 5 bubbles,Nov 2015,Old Jain Temple,nice well maintained Jain temple with the idol of 10th Jain Tirthankar Shri Sheetalnathji.Its wonerful and artistic temple.
Parashnath_Jain_Temple,robert f,5.0 of 5 bubbles,Nov 2015 • Couples,An oasis of tranquility in a busy city,We thoroughly enjoyed our visit to this delightfully unusual temple which was an oasis of tranquility in the middle of a bustling city. It is well worth a visit.
