Tourist Attraction,Name,Rating,Date and criteria,Title,Review
Ananthaa_Padmanabha_Swaamy_Temple,Ananth 727499,5.0 of 5 bubbles,Nov 2020 • Solo,A must visit place of worship.. ,"This Temple is situated in the main part of chennai, in Adyar.. The Temple is neatly maintained and poojas are done in proper timings.. The main deity of this Temple is Anantha padmanabaswamy.. Idols of Lord Narasimma is seen majestic .."
Ananthaa_Padmanabha_Swaamy_Temple,PitoyAmpil1941,4.0 of 5 bubbles,Jan 2020,a nice temple near Besant Nagar,the temple is near the Theosophical Society campus where the big Banyan Tree is located.... street food is available nearby...
Ananthaa_Padmanabha_Swaamy_Temple,Ansi,5.0 of 5 bubbles,Jan 2020,wer impressive,definetely worth to visit. Very impressive and  wonderful. We would definitely go again if we could. recommendable
Ananthaa_Padmanabha_Swaamy_Temple,Passport648127,5.0 of 5 bubbles,Nov 2019,"A GOOD TEMPLE IN ADYAR , CHENNAI","The temple is a well maintained and popular one , in the good locality of Adyar.The main deity is Sri.Anantha Padbanaswamy , with shrines for  various Gods.Festivals are celebrated on all important days , with a good crowd of devotees..I suggest your visit and worship here. Well connected by Buses ; the metro station is also nearby.SRINIVASAN SUNDAR"
Ananthaa_Padmanabha_Swaamy_Temple,Mihir C,3.0 of 5 bubbles,Sep 2019 • Couples,Utter mismanagement in Padmanava Temple in Trivandum,"We went to the temple on the 22nd of September, 2019. There was no management to control the devotees. In fact, it was free for all. Only the mighty people can make their way to darsan. I was in the 3rd row and I could see nothing. More number of priests obstructed view. I expect local administration to take a note of that. Devotees should try toavoid going to that temple. We were very upset afterspending almost 3 hours there could see only the priests. Temple authority should arrange video screen in the temple like that in Mahakaaleswar temple in Ujjain, MP."
Ananthaa_Padmanabha_Swaamy_Temple,Vasudev68,5.0 of 5 bubbles,Jul 2019,A must visit,"A calm, serene place with divine experience. Visiting in the morning with fresh mind keeps the day going great."
Ananthaa_Padmanabha_Swaamy_Temple,cool1960,4.0 of 5 bubbles,May 2019,VERY CALM AND A NEAT TEMPLE,Car parking is little difficult. I had parked the car in the side street. The temple is very neat and well maintained. There is a good silence and it was a good ambience.The diety is looking very good and we feel immensely fulfilled after coming in to the temple.
Ananthaa_Padmanabha_Swaamy_Temple,DrGRajesh,5.0 of 5 bubbles,Jul 2019,hitorical temple,Historical templeit is worth visiting this temple in Adyarthank you Ashok for taking me to this temple
Ananthaa_Padmanabha_Swaamy_Temple,reubenranjanfern2017,5.0 of 5 bubbles,Jun 2019 • Business,Divine place.,This temple is very crowded when we visited and definitely worth seeing. Must for people visiting this city.
Ananthaa_Padmanabha_Swaamy_Temple,Ananth 727499,5.0 of 5 bubbles,Dec 2018 • Solo,Neat maintainance .. Calm place,"This Temple has its own speciality.As the name itself reveals, we could understand that the main deity is just like the same as in Trivandrum temple.. Neatly maintained and poojas are done in a good manner.. You could feel the sound of your inner mind, when you just sit here for a while and meditate..Many of your questions are answered here and you could balance yourself - whether you are correct in your decisions or not .. The only problem you could face here is parking.. But that's also arranged.. You should park your vehicles in the streets around the Temple with a minimum charge.. Don't miss this place... "
Ananthaa_Padmanabha_Swaamy_Temple,c krishnan,4.0 of 5 bubbles,May 2019 • Family,Regular visits on Saturdays,This is a nice temple which is generally crowded every day but more so on Saturdays since it is a Vishnu temple. The atmosphere is nice and conducive for a soulful experience. 
Ananthaa_Padmanabha_Swaamy_Temple,Corey E,3.0 of 5 bubbles,Mar 2019 • Business,beautiful but beware,"The temples are definitely worth seeing however...beware of the so called ""guides.""  They act like they're giving you a spontaneous tour because they happen to be walking next to you and will begin to explain things.   We told our gentlemen that we were there to film and weren't really tourists.  He stood by us anyway every once in a while explaining what it was that was before us.   When we went to leave he asked for money.  $60USD.!!!!   That's more than a weeks wage for a bulk of the population.  Not gonna do it.  "
Ananthaa_Padmanabha_Swaamy_Temple,j_yuvan,4.0 of 5 bubbles,Jul 2018 • Family,A place to pray in peace,"For those who do not have a chance to visit Trivandrum and pray Lord Ananthapadmanabhswamy, one can have the dharshan of this Almighty who is ever willing to take everyone who seeks his refuge. Situated within Chennai is well accessible. "
Ananthaa_Padmanabha_Swaamy_Temple,asokanma,5.0 of 5 bubbles,Mar 2019,"One of the Divine place in Adyar, Chennai where God(Perumal) provide abundant wealth to devotees","One can feel the vibration not only before the main deity Ananthaa Padmanabha Swamy, Narasimhar etc; before the Urchavar(s) statues also. Management and devotees are Neatly maintainingf the koil. Try sit before main deity and do mediation for bliss.Siva also here to bless the devotees. "
Ananthaa_Padmanabha_Swaamy_Temple,Narasimhan G,5.0 of 5 bubbles,Oct 2018 • Solo,Trivandrum of Chennai on Tamil Brahmin style !,"Ananthaa Padmanabha Swaamy Temple#2 2'nd Main Road | Adyar, Chennai 600020,it is nicely managedRun by a group devoted in the traditions of South Indian Brahmin styleThere are more concerts and discourses on religion"
Ananthaa_Padmanabha_Swaamy_Temple,Karpagavalli,5.0 of 5 bubbles,Mar 2018 • Family,Divine place,"The place is dedicated to lord vishnu worshipped as ananda padmanabhan,which is a an exact replica of the thirivanandapuram padmanaban samy temple. The place also has a temple dedicated to lord shiva behind."
Ananthaa_Padmanabha_Swaamy_Temple,K V K,5.0 of 5 bubbles,Jan 2019 • Friends,A temple well maintained,"This temple run by dharma paripalana trust is very well maintained. When we enter the temple premises, a divine feeling envelopes us, soothing our mind and makes us to focus on The Supreme. The temple is very clean and the idols are kept in  a systematic way making it easy for us to have good darshan"
Ananthaa_Padmanabha_Swaamy_Temple,sbalaji2016,5.0 of 5 bubbles,Jan 2019 • Family,Serene Anantha Padmanabha Swamy temple,"The God here is in lying posture and you would be able to see only of the three body parts from each door - so to see Ananatha Padmanabha Swamy you have to patiently move across to get a full darshan.Situated very close to Adyar Bridge / Fortis Malar hospital - 2/4 wheeler parking is available on the side roads (except on special / festive occasions)Very powerful god Dress - Normal, No headscarves required. no Shorts/ skirts"
Ananthaa_Padmanabha_Swaamy_Temple,PTG1976,5.0 of 5 bubbles,Dec 2018 • Couples,Temple visit,The Ananatha Padmanabha Swamy temple is a very well built and maintained one. The idols are maintained beautifully. The poojas are done with devotion. The premises is air-conditioned; provisions have been made for the devout to sit facing the main deity and engage in prayer/ meditation. Parking is a problem as there is not even a single car parking space provided by the temple. One has to park nearby and earn the wrath of the local residents for blocking their frontage.
Ananthaa_Padmanabha_Swaamy_Temple,babuvis51,5.0 of 5 bubbles,May 2018 • Family,A serene temple for worship,"This is one of the most beautiful temples in Chennai.  It is situated in Gandhi nagar, Adyar. The temple is well connected by buses, MRTS trains and other transport services.  Parking for private vehicles is available on the streets around the temple.  The presiding deity is Sri Anantha padmanabhaswamy like Trivananthapuram. Other sannidanams for Sri Sudharshan, Hanuman, Navagraha are there. A good place for calm prayers."
Ananthaa_Padmanabha_Swaamy_Temple,KMSMANIAN1049,5.0 of 5 bubbles,Oct 2018 • Couples,Vishnu temple in Adyar,"An excellent temple built for exclusively for Lord Vishnu in the 'Sayana ( sleeping posture), position similar to the temple in Trivandrum."
Ananthaa_Padmanabha_Swaamy_Temple,Arvind,5.0 of 5 bubbles,Sep 2018 • Family,Quiet and Peaceful,"This temple is a replica of Shri Padmanabhaswamy temple at Trivandrum and is maintained well. Nestled in a quiet residential suburb of the city, the temple is well connected by public transport (Bus and train) and private (parking space available on the side roads). The temple houses Shri Padmanabhaswamy in ananthashayana (sleeping) pose, his consorts, besides Ganpathy, Krishna, Devi, Shiva and the Navagrahas too. Saturdays are usually busy at this temple, but the other days are relatively peaceful and one could spend quality time peacefully meditating. The temple is well maintained and crowd (in case there are any), is well managed. Do pay a visit if you are in and around Adyar area of Chennai (Closer to the IT corridor)."
Ananthaa_Padmanabha_Swaamy_Temple,rashmi k,5.0 of 5 bubbles,Oct 2017 • Family,Beautiful temple,"People who cannot visit trivandrum to see Anantha Padmanabha swamy, need not feel sad as this temple resembles it. Narayana is in sleeping posture with all other gods around him and hs consulates near his legs. The sannidhi gives you immense solace and you will feel peaceful on entering the same. Evening Aarthi time is at 6.30. Easily reachable. Parking 4 wheeler might be problematic, so plan accordingly."
Ananthaa_Padmanabha_Swaamy_Temple,vinodkhedkar,4.0 of 5 bubbles,Aug 2018 • Solo,Lord Vishnu Temple,This is a nice temple dedicated to Lord Vishnu and is situated at Adyar area in Chennai. Nice architecture and peaceful ambiance.
Ananthaa_Padmanabha_Swaamy_Temple,Rajagopal S,5.0 of 5 bubbles,Aug 2018 • Family,Peaceful,"one of our fav temples.. cant believe they have AC now in the temple... is this the first AC temple ? :)   conveniently located in adayar.. love the peace and sanctity we get when we visit this temple..  we love the narasimhar vigraham here.. its one of our ""go-to"" god when we are in trouble :)"
Ananthaa_Padmanabha_Swaamy_Temple,Savitha NK,4.0 of 5 bubbles,Jul 2018,Nice visit,"Remember to check the timings before you go, place is clean and well organized. Good outing over the evening. "
Ananthaa_Padmanabha_Swaamy_Temple,lpkc,5.0 of 5 bubbles,Jun 2018 • Solo,Very peaceful,I visit this temple every week. Very peaceful place. There are proper sitting area in front of the deity to sit and meditate. The temple is situated in Adyar. The temple is a replica of Padmanabhaswamy temple of Travancore.
Ananthaa_Padmanabha_Swaamy_Temple,vijmail99,4.0 of 5 bubbles,Jul 2018 • Family,Peaceful place,Well maintained temple. Less crowded on regular days. Good darshan. Also good street parking facilities. 
Ananthaa_Padmanabha_Swaamy_Temple,oliver B,5.0 of 5 bubbles,Dec 2017 • Couples,Theindu God temple,"Shri Padmanabha swami tempelen in Adyar, this is similar to the temple that located Shri Padmanabha swamy temple in Trivandum, this temple is a famous and an ancient temple, we visited 9th december at 8 AM, a pleasant atmosphere."
Ananthaa_Padmanabha_Swaamy_Temple,Keertan,4.0 of 5 bubbles,May 2018 • Family,Amazing,"Ananthaa Padmanabha Swamy Temple of Chennai is the replica of original temple of Ananthaa Padmanabha Swamy Temple of Kerala which I explored in 2013 during my audit assignment visit to Chennai for four days. Visit to this temple was organized by our client for us after as a one day trip to Chennai after our audit assignment was concluded. The temple is big and widespread over a large area with open space for parking and shops around its corner. The architecture concept of the temple is exactly that of Padmanabha Swamy temple of Kerala. Even the statue of Lord Narayan is also same in the exact lying down position. The major difference is that the original statue of Kerala temple is made of pure gold while that of Chennai is stone with decoration of gold and silver metals.People visits lot here to offer their prayers. You will find accessories shops of flowers, sweets, fragrance sticks to offer prayer inside the temple. Some other shops are also there like music, clothes, wall frames, decorative pieces, toys, etc. Moreover, there is strict security checking just at the entrance of the temple. It will take around one hour to explore this temple from the time you stop at this place till you move out from this temple. On Sundays and holidays, this temple is full of rush due to which it takes more time. So, it is better to move out on weekdays.Please note that leather items, electronic devices, photography are strictly prohibited inside the temple."
Ananthaa_Padmanabha_Swaamy_Temple,Sathya B,5.0 of 5 bubbles,May 2018 • Couples,One of my fav temples,"This temple is so good to visit at anytime of the year. Its clean, quiet, easy to reach and not too far from city."
Ananthaa_Padmanabha_Swaamy_Temple,Venkata Shivaku... R,5.0 of 5 bubbles,Jan 2018 • Solo,Very well maintained place,"Like most Maha Vishnu temples, this is one is also well maintained. What is special about this temple, is the range of abhishekams, homams, and poojas that a devotee can participate in. The purohits here are very friendly and helpful. The speciality of the temple is the Shiva linga in the hands of Lord Ananthapadmanabha Swamy. I was told it wasnt there initially but was added later. The additional shrines found here are for - Garuda, Lord Krishna, Lord Rama, Lord Hanuman, Navagrahas and of course for Lord Shiva (in the form of linga)."
Ananthaa_Padmanabha_Swaamy_Temple,vinayan20152015,5.0 of 5 bubbles,Feb 2018,Example of modern yet traditional South Indian Temple architecture and Ambience,"Having already visited the Original Padmanabha Swamy Temple in Triivandrum several times, I was very keen to see what the Chennai version was like. We were not disappointed.  This temple has taken the essence of the Trivandrum shrine, and has imparted the unique Tamil ambience to the Murti. The temple is centrally located , in fact with possibilities of traffic jams on key days... The Padmanabha Swamy idol is in the same reclining position, viewed through three doors....one for the feet with the Holy Consort Devi visible, the middle door for the Torso, with the Umblical Cord and Brahma seated on it; and the third door showing the head and hand drooping on the floor just above the Shiva Linga . There are other deities in the background looking on...The piety and gravitas of the atmosphere in Trivandrum is not so prominent here. Instead of being awe-inspiring, here it is more democratic or transparent(!) is the feeling we get...But either way, this place gives you the indefinable presense that electric feeling you get in places close to the devine... Visit on a non-busy day or time, if you want to actually soak in the atmosphere leisurely...."
Ananthaa_Padmanabha_Swaamy_Temple,Prasad B,5.0 of 5 bubbles,Feb 2018,Majestic and Magnificent !!!,The temple of Lord Vishnu is not only appeared alike an architectural marvel but it presents itself as an epitome of holiness and spirituality.Brahmostavam is close to March...please once during the said eve.
Ananthaa_Padmanabha_Swaamy_Temple,Arun,4.0 of 5 bubbles,Nov 2017 • Friends,Beautiful temple with rare main deity pose,It is a small but a beautiful temple located near the Adyar Bridge. The temple is a rich temple. You can find the god statues covered in gold painted plates and they maintain the temple very well. I believe the temple is maintained by the trust that maintains the main Ananthaa Padmanabha Swaamy Temple in Thiruvananthapuram. The main deity is Lord Vishnu and he is in sleeping pose and it is very rare to find Lord Vishnu in such a pose.
Ananthaa_Padmanabha_Swaamy_Temple,Balasubramanian R,4.0 of 5 bubbles,Dec 2017 • Solo,Adyar Ananthaa Padmanabha Swamy Temple,"Anantha Padmanabha Swamy temple is situated in Adyar. Kasthuribai Nagar and Gandhi Nagar residents are main devotees of this temple. Vinayaga, Garuda, Anjenaya and other deities are there in this temple. Temple is more than 50 years old. The area is very calm, whereas busy roads are nearby."
Ananthaa_Padmanabha_Swaamy_Temple,lavydeepak,5.0 of 5 bubbles,Jan 2017 • Family,Ease of access and Good Darshan of Ananthapadmanabhan,"Instead of going all the way to Thiruvananthapuram, you can have darshan of the Lord in this temple. It is easy to locate the temple. Get down at Adyar Signal bus stop and the street at the junction will lead to the temple. (opposite to Standard Chartered Bank). Very peaceful visit for everyone guaranteed"
Ananthaa_Padmanabha_Swaamy_Temple,Jayasiva,5.0 of 5 bubbles,Dec 2017 • Family,Get peace of mind when you sit in front of the deity,"I don't know why I like this temple, why do i frequently making visit... I always want to see Kanchi Mahaperiyavar..The temple is filled with colours, always clean and give peace, sometimes prasadam.."
Ananthaa_Padmanabha_Swaamy_Temple,Ranganath Sampath,5.0 of 5 bubbles,Nov 2017 • Family,Visit to Ananathaa Padmanabha Swaamy Temple,Good darshan and very well maintained.  People who visited the temple at Trivandrum mentioned that the one in Chennai is equally good
Ananthaa_Padmanabha_Swaamy_Temple,SBakde,4.0 of 5 bubbles,Oct 2017 • Solo,A well maintained temple ,"Once again this temple is one of my favourites for being well maintained, less crowded (except for certain festival days which is as expected)The pujaris too are genial. This is a repeat of my observations recorded previously. I’m glad to revisit the temple. To put the reason for my leaving off one star - it is still parking."
Ananthaa_Padmanabha_Swaamy_Temple,deepakbhatia57,5.0 of 5 bubbles,Oct 2017 • Couples,EXCELLENT MAINTENANCE; PRIESTS PERFORMING PUJAS TO DEVOTEES SATISFACTION,"We are frequent visitors to this temple as it is within walking distance from our residence. In addition to the main deity of Bhagwan Vishnu in lying position, several others - Vinayak, Anjaneya, Durga Devi, Navgrah, etc. - are also installed. The sanctum sanctorum has been recently fitted with air conditioning. Prasadam prepared on the premises is perhaps the best we have had anywhere."
Ananthaa_Padmanabha_Swaamy_Temple,Rachamallu,5.0 of 5 bubbles,Oct 2017 • Family,Ananthaa Padmanabha Swamy Temple,Ananthaa Padmanabha Swamy Temple is a beautiful temple with extraordinary architecture.The temple has a pleasant environment.The temple has lot of historical background.
Ananthaa_Padmanabha_Swaamy_Temple,LightPacker729001,5.0 of 5 bubbles,Sep 2017 • Solo,Kolu,"Most beautiful and neat and nice temple. Centralized ac constructed. Nice seating arranged,able to have a good dharson ,even for along time.saw kolu and updated the photos. "
Ananthaa_Padmanabha_Swaamy_Temple,r_aadhirai66,5.0 of 5 bubbles,Dec 2016 • Family,THE RECLINING GOD OF ADYAR,"This is one of the new temples of Chennai on the banks of the Adyar river.  It is behind Fortis Malar Hospitals and boasts of the neatness and coolness of the interior.  The God himself a replica of the Padmanabha Swamy of Trivandrum, Kerala, India,  enchants devotees with a much nearer and brighter view of his noble form, reclining in high style on Adisesha, the Snake King with his consort the beautiful Sridevi upon his 'Vakshasthala' or chest.  There are separate sannadhis for Sudharshana or God of the Chakra, Anjaneya and many other Gods.  The temple is maintained with strict rules, basically on those followed in Kerala"
Ananthaa_Padmanabha_Swaamy_Temple,Vasu V,5.0 of 5 bubbles,Aug 2017 • Couples,Very peacful and holy shrine of Lord Vishnu., Serene and quite. Temple was very clean and well maintained.There are other deities also around the temple. On special occassion all the edities are adoned with Gold Kavacham and it looks very beautiful. 
Ananthaa_Padmanabha_Swaamy_Temple,Praveen S,4.0 of 5 bubbles,Feb 2017 • Couples,Big temple inside city,"Devotes must visit this temple, since many people suggested the temple is powerful, hot place in chennai"
Ananthaa_Padmanabha_Swaamy_Temple,Ganesh061974,4.0 of 5 bubbles,Jun 2017 • Family,devotional date,this temple is well maintained. here the lord is in sleeping posture.  the sorga vasal door is beautiful to watch.  a must see temple
Ananthaa_Padmanabha_Swaamy_Temple,Gugan_Ilango,4.0 of 5 bubbles,Jun 2017 • Solo,Beautiful temple at adyar,beautiful temple at adyar. this temple get crowed during the evening and a lot of pooja take place in the evening.
Ananthaa_Padmanabha_Swaamy_Temple,kshantanayar,5.0 of 5 bubbles,May 2017 • Solo,A holy place! ,I have seen this temple from its modest beginnings grow into the big space it hold now. The expansion has been done very nicely. 
Ananthaa_Padmanabha_Swaamy_Temple,Boopalachandran G,4.0 of 5 bubbles,Apr 2017 • Couples,Beautiful Temple,Very calm and Pleasant Temple.Well illuminated very clean interior.My family visits this temple every month  and to get our prayers fulfilled.The main Deity is in Sleeping posture and pleasant experience to visit. .
Ananthaa_Padmanabha_Swaamy_Temple,rajeswaran,5.0 of 5 bubbles,Mar 2017 • Couples,"Anantha Padmanabhaswamy Temple, Adyar","This temple is for God  Mahavishnu. God is in sayana kolam(sleeping pose) similar to the temple at Thiruvananthapuram. Very calm and neat temple. Located in the heart of Adyar easily assessable by public transport.  In the nearby air conditioned hall, during special occasions, music and bhajans programs are conducted."
Ananthaa_Padmanabha_Swaamy_Temple,Kishore P,5.0 of 5 bubbles,Dec 2016 • Family,Ananthaa Padmanabha Swaamy Temple,Ananthaa Padmanabha Swaamy Temple is located in Adyar. It is well known famous for Lord Perumal. One of the Famous and Ancient temple in Chennai. Very Peaceful temple. Easily accessible by public and private transport. 
Ananthaa_Padmanabha_Swaamy_Temple,SangeethaSriraam,5.0 of 5 bubbles,Jan 2017 • Family,Divinity within reach,"This temple, modeled along the lines of the Thiruvananthapuram Anantha Padmanabha Swamy, is located in the heart of the city. The Moola Swamy can be seen through three doors, signifying preservation (the Lord is seen preserving/protecting Mahadeva, creation (Lord Brahma emerges from the Lord's naval) and destructin/moksha (the feet of the Lord is considered the destiny of all living beings). The temple is known for its non-sectarianism. The Moola Swamy is Anantha Padmanabha, an incarnation of Maha Vishnu. However, dedicated shrines for Ganesha, Durga and Shiva are also there. The Swarga Vaasal is beautiful (can be seen right opposite to Goddess Durga's shrine while taking Prahara). The temple is beautifully and immaculately maintained. The biggest plus in the temple is that devotees can sit hours together at the three step ampitheatre styled podium right opposite the Moola Swamy. You will find women and men singing hymns and slokas. Most others prefer to sit there and interact with the Lord in their own way. If you want to spend some quality time with God, please visit :)"
Ananthaa_Padmanabha_Swaamy_Temple,Priya_T,4.0 of 5 bubbles,Jan 2017 • Family,Lord in reclining pose,I visited this temple on the most important day of the hindu calendar ie Vaikuntha ekadasi. The temple was adorned with flowers and the arrangements for managing the crowds was excellent. We had a good darshan. The Lord is in a sleeping posture here. 
Ananthaa_Padmanabha_Swaamy_Temple,suseelasukumar,4.0 of 5 bubbles,Aug 2016,Nice temple,Family members of around ten persons went and worshipped this temple. Had a nice darshan. Temple is very clean and neat. Everyone must visit this temple and get the blessings of this Perumal.
Ananthaa_Padmanabha_Swaamy_Temple,Narayanan S,5.0 of 5 bubbles,Dec 2016 • Couples,Seek Blessings from Lord Anantha Padmanabha Swamy,"The temple I have been visiting from the 1960s. It is a clean well kept and maintained temple, The temple has been adding more sanctums and even a marriage hall. They conduct homams on payment - which is very reasonable."
Ananthaa_Padmanabha_Swaamy_Temple,meghashyam,5.0 of 5 bubbles,Dec 2016 • Solo,Sri Anantha Padmanabha Swami temple,"Lovely temple , small in size but endowed with great sanctity , Moola murthi is beautiful, a miniature replica of Sri Anantha Padmanabha Swami at Trivandrum , there is place to sit and recite mantras in front of the Lord , there are sub shrines for Sri Garuda and Sri Anjaneyar, there is a lovely portrait of Sri Maha Periyava at the entrance . "
