Tourist Attraction,Name,Rating,Date and criteria,Title,Review
Besant_Nagar_Beach,Sunil,4.0 of 5 bubbles,Jul 2019 • Friends,What a walk near the beach ,"Very nice place to chill out especially in evening. Just you need to sit and relax and enjoy the ocean view .You get many things near by beach, cafe and other few restaurants."
Besant_Nagar_Beach,Singhan S,5.0 of 5 bubbles,Feb 2019 • Solo,Great place for walk,Had a nice morning walk along the beach to refresh and get energetic. The soup being served on the roadside was simply ecstatic.
Besant_Nagar_Beach,LostMySelfTraveling,5.0 of 5 bubbles,Aug 2018 • Couples,This one of the cleanest beaches of Chennai,We had been to this beach several times and enjoyed playing and bathing in the water. Though we always used to travel by bus. Really nice beach 🏖 unlike mareena Beach it's clean and you won't find much fish 🐠 smell here. Bus facility is very close there is a bus depot in Besant Nagar. So you reach most of the places easily. 
Besant_Nagar_Beach,Deadman17,5.0 of 5 bubbles,May 2019 • Solo,Smaller but peaceful,"This beach is smaller than the more famous Marina Beach, but is much more peaceful, given that very few people visit it. the place is ofcourse not very clean because of the low attraction of tourists. Still one can easily take a nice walk along the beach peacefully. Would suggest people to go here if Marina beach is not for you."
Besant_Nagar_Beach,satyajitjadhav,4.0 of 5 bubbles,Mar 2019 • Family,Good place to visit,Good place to visit with family but need more cleanliness. Nice place to spend some evening time. Snacks stalls are available.
Besant_Nagar_Beach,idea614354,4.0 of 5 bubbles,May 2019 • Family,Good to see,"this is a one best place to enjoy beach in chennai,   very big and good one. many movies are shooted in this."
Besant_Nagar_Beach,Rakesh,5.0 of 5 bubbles,Jun 2019 • Solo,A Great Early Morning Beach!,"Also known as the Edward Elliot’s Beach, it is good beach in Southern Chennai. The length and breadth of the beach is much small compared to the famous Marina beach. But, it is more peaceful and cleaner than Marina because fewer people visit and there are fewer food vendors and sellers.Garbage and littering can be seen here and there but still is less compared to the larger Marina.Early morning hours is recommended."
Besant_Nagar_Beach,jayakumar,3.0 of 5 bubbles,Jun 2019 • Family,Great place but unclean place,This place can be very organized and can offer disciplined clean practices by placing trash bins. Stall offer spiral potato where the sticks are potential risk to feet as these hidden objects in sand can get into your feet
Besant_Nagar_Beach,Mitesh Bhandari,5.0 of 5 bubbles,Feb 2019 • Family,A Must Try For Anyone who visits Chennai,"This is on of the most popular beaches of Chennai. the area has some amazing restaurants and also local eat outs. With family/friends its the best place t kill time or get peace of mind. Sunday Mornings are usually ""Car Free Sundays"" here, and the best place for your morning walks."
Besant_Nagar_Beach,DSKTraveller,5.0 of 5 bubbles,Jan 2019 • Family,For a relaxing evening or morning,"Unlike the Marina beach, the Besant Nagar Beach or Elliots Beach is more clean but shorter. Located in a slightly posh area, the Elliots Beach is a good place for morning and evening walk or a family outing. While the Marina offers hot bajjis and snacks, the road to Elliots is dotted with a variety of restaurants where you can have dinner. Some of these restaurants have seating arrangement in the open which goes well with the breeze. You can explore restaurants serving south Indian, tandoori and continental dishes. Sunday mornings are usually car free times so you can actually park your vehicles elsewhere and walk on the road along the beach sands. You also get to play games or participate in group activities during those few hours. Overall it is a less crowded beach and you can combine your visit here with shopping in the nearby showrooms."
Besant_Nagar_Beach,kovaiRavindran,2.0 of 5 bubbles,Jun 2019 • Friends,The Ugly Beach,Once in my childhood this beach was a familiar one to me and no crowd was here comparing with Marina Beach.But now this Beach also condemned by the crowd.
Besant_Nagar_Beach,CK T,4.0 of 5 bubbles,Dec 2018 • Friends,"Not as crowded as Merina Beach, very pleasant and comfortable.","The beach is not as wide as Merina Beach, but you still have the same ambiance and easy access to the restaurants along the beachside. There is fish market nearby and a very grand church. Nice place to spend during the evening with the sea breeze."
Besant_Nagar_Beach,arnabc_iitm,5.0 of 5 bubbles,Mar 2019,Shortest beach of Chennai,"Most of the Chennai Beaches are very long. This is the shortest beach and very close to IIT, Adyar. The food court attached with it also serves good food. You can spned a good evening in this beach for sure. "
Besant_Nagar_Beach,Anjal s,1.0 of 5 bubbles,Apr 2019 • Couples,worst,Should nt visit this beach with your girlfriend. Not so good people around. Very untidy all over the beach
Besant_Nagar_Beach,muthuvel r,5.0 of 5 bubbles,Dec 2018 • Family,always my favorite beach in the world,for besant nagar is nostalgia.with my friends we used to sit and have lots of healthy discussions.  lots of water have flown through the bridge . lots of changes happened  in and around the beach for last 20 yrs still its one of my favorite. now it has become little busier and commercial . 
Besant_Nagar_Beach,satheesh,4.0 of 5 bubbles,Jan 2019 • Friends,The Posh sister Of Marina,The beach lining with posh restaurants make it a great place to hangout with friends and family .Kids can have plenty of fun.
Besant_Nagar_Beach,Darshank,5.0 of 5 bubbles,Mar 2019 • Business,Good beach,When I visited Chennai I had been to this besant nagar beach. It was a good joyful experience I really enjoyed
Besant_Nagar_Beach,Ahamed,4.0 of 5 bubbles,Feb 2019 • Friends,Peaceful and less crowded,Nice place to visit. It is most pleasant as it is less crowded than marina. There are lots of good restaurants around
Besant_Nagar_Beach,fransis,5.0 of 5 bubbles,May 2019 • Solo,nice ,best place to visit . will alwats come back to see this place .. amazing place to have a good time . 
