Tourist Attraction,Name,Rating,Date and criteria,Title,Review
Guindy_Snake_Park,Josephsamuelot,5.0 of 5 bubbles,Jan 2017,Located adjacent to National park,"Must see location for the kids, they love to see snakes and crocodiles. Here they have a program to show how they catch snakes ans takes venom from snakes. Bit crowded in the evenings."
Guindy_Snake_Park,daredevil31,5.0 of 5 bubbles,Sep 2017 • Solo,Chennai; adventure; things to do; snake; reptiles,"It's about 18 km from airport. Get a prepaid cab or ola/ Uber. The park is open from 9am - 4pm. The snake park is a very well maintained park. It has a interpretation centre and museum. Other than snakes they have very well displayed crocodiles, gharial and lizard. Their are plenty of live reptiles in a very good health. Plenty of mosquitoes when I went so please carry odomos. There is a very good cafeteria as well. Books and t-shirt can be brought."
Guindy_Snake_Park,tnbalaji90,4.0 of 5 bubbles,Apr 2017 • Friends,Good place for a family outing,"Good place for a family outing. Enjoyable place for the kids.  Besides several snakes in cages, various birds are also on display."
Guindy_Snake_Park,Rohit S,3.0 of 5 bubbles,Sep 2017 • Business,Good for killing an hour ,Many of the cages are just empty. The whole park is not managed properly. The water in the cages looks like they haven’t been replaced since ages. Many of the cages are either too crowded or very small. Entry fee is just 20₹. They should start charging more and keep the place good for living animals there. 
Guindy_Snake_Park,Deepanarun,5.0 of 5 bubbles,Aug 2017,Crocs yikes,"Its a very well maintained crocodile park. With safe enclosures, good sign boards and also kept quite clean. There is a small snake park as well and they have venom extraction at certain times. Very good place for kids as it is safe and kids can learn a lot. "
Guindy_Snake_Park,Praveen S,5.0 of 5 bubbles,Dec 2016 • Couples,Best for childrens,"One of the biggest park in chennai located in IIT, peaceful place next to anna zoological park, must visit"
Guindy_Snake_Park,Nithu J,3.0 of 5 bubbles,Jun 2017 • Friends,Time pass,Nothing extraordinary. I'm from Trivandrum v have a snake park which is slightly better than this one . So this place don't impress me more . Can visit for spending half an hour maybe . Carry umbrella use sunscreen . It's damn hot in chennai. 
Guindy_Snake_Park,samvarth,4.0 of 5 bubbles,Jan 2017 • Friends,repetetive snakes,This is a place good for people who want to see snakes .But not much variety of snakes are present .But whatever limited quantity they have will still scare you .there are a couple of crocodiles as well
Guindy_Snake_Park,velayudhan,3.0 of 5 bubbles,Jun 2017,Good Amusement park,I have been here last week with my cousins . It was good time to spent here in the Snake Park . The Entire amusement are was enjoyable i loved the stay there . We were able to see the large variety of snakes in the national park .
Guindy_Snake_Park,Afrin S,4.0 of 5 bubbles,Sep 2016 • Family,crocodile park,Beautiful park in the heart of Chennai! The crocodiles were majestic and take center stage at this park.Wonderful place for kids to spend some quality time.
Guindy_Snake_Park,VijayDevaraj,4.0 of 5 bubbles,Apr 2017,Good place to watch huge Crocs population,"All is well, but the parking is charged premium & you will need to pay even if you outside its official spaces.  As very little parking available & no authority has control on it. They blamed Tenderer/ Govt."
Guindy_Snake_Park,rajani k,4.0 of 5 bubbles,Sep 2016 • Friends,Abode of the snakes - one of the finest products of Evolution,"This Snake Park is located close to Guindy National Park. The Park dedicated to Snakes although there are few lizards, Chameleons, Crocodiles, Aligators and Turtles as well. Several species of snakes are seen here. Russels Viper, King Cobra, Rat Snake, Boar, Python etc. are so fascinating.  This is also a breeding center for snakes."
Guindy_Snake_Park,Mart152015,5.0 of 5 bubbles,Apr 2017 • Couples,Snakes and Crocs,A great find! Lots of different snakes and crocodiles with clear and informative information. Easily accessible to get around and a range of videos and easy to view tanks / areas with the reptiles in. Excellent value for money.
Guindy_Snake_Park,Narasimhananda S,5.0 of 5 bubbles,May 2016 • Friends,Snakes and Snakes,Here you get all types of snakes in their full form. You can also see how poison is extracted. Be ready for a slithering experience!
Guindy_Snake_Park,RAMAKRISHNAN K,5.0 of 5 bubbles,Apr 2017 • Family,Children s delight snake park,"I would say the snake park has many type of snakes , turtles, crocodile and lots of details given about each of the species..One must carefully read at each enclosures where these are housed.Otherwise entry is next to children park and has separate ticket counter for that..Children must be taken to get to appreciate venomous and other type of snakes .."
Guindy_Snake_Park,rama151,5.0 of 5 bubbles,Apr 2017 • Family,Snake park must see,The snake park is next to children park with a separate entry. It houses many types of Indian snakes which enthrall children and elders as well.Lots of crocodiles also housed here which is good to watch
Guindy_Snake_Park,bishnu s,3.0 of 5 bubbles,Feb 2017 • Friends,Watch one of the best creations of evolution in action,"Guindy Snake Park is a separate section within the Guindy National Park dedicated to Snakes and few other reptiles. Snakes are one of the best creations of evolution on the earth. They are unique reptiles and also quite distinct from other animals.  You get to spot several species of snakes here like Python, King Cobra, Krait, Vipers, Boa, Rat Snakes etc. You get to know a lot about snakes here - their food habits, the way they reproduce, their habitats, their venom etc. Apart from snakes, you can see crocodiles, lizards, crabs, alligators etc. here."
Guindy_Snake_Park,krazikams,3.0 of 5 bubbles,May 2016 • Friends,Small Snake Park,"Unlike zoos and crocodile bank, this small little snake park is located in Guindy and offers children a glimpse into world of reptiles and wildlife. Lots of trees are there offering shade and fresh air to inhale. Needs more maintenance to attract tourists."
Guindy_Snake_Park,Angelrun29,4.0 of 5 bubbles,Mar 2017,A slimy experience,"Having been in Chennai for so long; this was the first time I went to the Snake park and it was indeed an enlightening experience. Many of these reptiles are on the verge of getting extinct but for the efforts of national parks like these. Well maintained place and all the snakes and other reptiles are kept in their natural-like habitats. Overall, it was an enlightening and knowledgeable experience."
Guindy_Snake_Park,Rajesh k,4.0 of 5 bubbles,Feb 2017 • Friends,Reptiles place !!!,"Several varieties of snakes can be seen here. You can see all dangerous snakes like Sand Boa, Pythons, King Cobra, Viper, Kraits, Rat snakes etc.  You can also see demonstration of catching snake and removal of their venom. Apart from snakes, some crocodiles can also be seen here. "
Guindy_Snake_Park,the_tanmoy,5.0 of 5 bubbles,Feb 2017 • Family,Must see place - lot of information about Snakes,Must see place - lot of information about Snakes in there. There are lot of different varieties of snakes. A few other reptiles are also there. There are videos played inside the museum and they are very informative. Just next to Guindy National Park - visit both together!
Guindy_Snake_Park,Satya_Abhiram,3.0 of 5 bubbles,Feb 2017 • Family,Not worth if you are a traveller and from outside,"Not much to see. No Snake show like before. Houses few snakes and few crocs.  Do not plan specifically for this place, unless if ur looking for places to see with in the city. Theres a children park adjacent to it. Few deers and fox put in there."
Guindy_Snake_Park,Rucha121,3.0 of 5 bubbles,Jun 2016 • Couples,Good breathing space in City,"Snake park located near Guindy offers a big breathing space with lots of trees and bushes and good collection of snakes and reptiles. Frequented by school children, better to avoid summer days. There is entrance fee."
Guindy_Snake_Park,Rajani K,4.0 of 5 bubbles,Jan 2017 • Friends,It's a Reptiles place,"This is located within the Guindy National Park. Crocodiles, Alligators and several species of snakes are housed here.  We got to see the python, cobra, krait,boa etc. here. Perfect place to get yourself familiar which several species of the snakes and watch them in some action in captivity."
Guindy_Snake_Park,sameernandan,4.0 of 5 bubbles,Jan 2017 • Couples,Worth if you saw snakes only rarely,"Visited it thrice over the last 25 years. Pros:1. Located at the heart of city 2. Houses currently about 10-12 species of snakes including cobra, viper, boa and python among others3. Also has few species of crocodiles and alligators. 4. Has monster lizards and turtles too.5. Can spend pleasant part of an hour 6. Tickets are cheap (20/- per adult or camera)7. Generally not overwhelming crowd 8. Has a food court just across the road, though quality and pricing are not that pleasing9. Place is safe in all respects 10. Mini zoo (not Chennai Anna zoo) with children's play park (with separate tickets) right adjacent to snake park Cons:1. Losing more species every year2. No king cobra 3. Glass enclosures poorly maintained and only semi transparent at areas4. Concerned workers left a flock of live chicks within few snake enclosures. It is heart wrenching to see them cowering at a corner, mortally afraid of impending death at any moment, all the days that they live! Finally if you are a new visitor to Chennai, with not much experience of seeing snakes in real life, you will find it engaging "
Guindy_Snake_Park,Jothilingam E,4.0 of 5 bubbles,Apr 2016 • Family,Nice place to visit,"Snake lovers ,you will enjoy and can view variety of species.But for others may not that much...Nicely maintained,thanks to Government & staffs.Clost to Famous Guindt engineering college and also IIT-chennai and all this situated near Governer house in Guindy"
Guindy_Snake_Park,WicklowEims,4.0 of 5 bubbles,Jan 2017 • Family,Pleasantly surprised at how much there was to see here.,As the Zoo was closed after the Cyclone - we came here to look at reptiles as were pleasantly surprised. A very good central learning zone with video's and facts. A god mix of snakes and Crocodiles and turtles. There's a kids park next door with Deer so a very easy way to spend a few hours with kids. Also they dont have foreigner prices so for 6 of us it was only 90 INR (2 kids were free) Totally recommend it for an afternoon for adults and children.
Guindy_Snake_Park,Akvince,4.0 of 5 bubbles,Dec 2016 • Couples,Very interesting.,A snake farm which extracts venom by hand from deadly snakes in order to prepare antidotes for snake bites.
Guindy_Snake_Park,Vineeth K,3.0 of 5 bubbles,Nov 2016 • Family,"lots of snake & crocodile species, but doesnt look like its maintained well","There are lots of snakes & crocodile species. But lacks good maintenance, may be because of less staff or some other reason. Place is not smelly but the cages where snakes & croc's are kept seems to bit old & showing some damages/wear & tear which creates a fear in our mind. Even saw on cage where they have kept a big python is just having a small lock similar to one we use in our normal wardrobe & even doors are having pretty gaps in between which may be enough for snake to take tour of surrounding places ;)."
Guindy_Snake_Park,Ravikanthvadamala,4.0 of 5 bubbles,May 2016,Amazing Creatures,Visited int he Summer and my son loved the place lot of crocodiles and just don't know till the visit on the number of types of crocs and alligators available in the world. 
Guindy_Snake_Park,vignesh d,4.0 of 5 bubbles,Aug 2016 • Family,Worth a visit,"Good to see the crocodiles and snakes, its fun to see the crocodiles lying with open mouth, park also there. Good outing place."
Guindy_Snake_Park,pshamkuwar,5.0 of 5 bubbles,Nov 2016 • Business,Unique Place of Attraction,"Recommended place for a day's a Picnic !!!!!!Travelers must visit along with children and  adults as well. Good to teach children on nature, especially wide varieties of crawling species"
Guindy_Snake_Park,Srinivas S,3.0 of 5 bubbles,Nov 2016 • Family,good park within city limits,"It's good place for kids to spend some time within the city limits to see animals, birds. Must watch at least once if you are around"
Guindy_Snake_Park,Ra_Radha,3.0 of 5 bubbles,Jun 2016 • Family,Need better maintenance,"Compared to Madras Crocodile Bank, this is smaller. It needs good maintenance, place is smelly of animal excreta and even landscaping is not maintained. Good collection of animals for kids to show and educate them about wildlife."
Guindy_Snake_Park,raja p,4.0 of 5 bubbles,Dec 2015 • Friends,good snake park in chennai,so many crocodiles i observed here.i have seen snakes and peacocks in this park.maintenance is good.
Guindy_Snake_Park,Himanshu Shekhar,3.0 of 5 bubbles,Jan 2016 • Family,Good place for kids to enjoy the zoo,Small but have all the animals to view. Specially for kids & Childrens to enjoy small walkable distance over all around. Good for picnic place.
