Tourist Attraction,Name,Rating,Date and criteria,Title,Review
Marina_Beach,Ananth 727499,5.0 of 5 bubbles,Sep 2019 • Solo,Worlds second longest beach..,This is a very famous beach and always crowded in the evenings..Many important landmarks are situated around the beach..You could take a leisurely horse ride and purchase itmes made of sea shells in the beach side shops ..Recently many tattoo shops are being opened and we could see many youngsters visiting the shops eagerly for their tattoos..Many evening shops are there for you to get fish fry and other ready to serve snacks..Nice and Excellent place to spend your time ..
Marina_Beach,Rakesh,3.0 of 5 bubbles,Jul 2019,Marina Beach,"Marina Beach is one of the famous beaches in the city of Chennai. When you reach the beach, you need to hire a camel or horse to reach the destination otherwise you need to walk alone around 500 meters on the sand to reach the water."
Marina_Beach,Madelinde H,4.0 of 5 bubbles,Mar 2020 • Family,Nice for a walk,"Nice place for an evening walk to see crabs, fisherman and evening waves. The Ghandi statue is impressive and do are the government buildings at the boulevard. "
Marina_Beach,Rohini,1.0 of 5 bubbles,Jan 2020 • Friends,Needs more improvement,The beach got more construction on. But not well maintained  no cleaning is done on regular basis . Wash rooms are not good.
Marina_Beach,Tigerlove50,4.0 of 5 bubbles,Feb 2020 • Couples,Viewed from the road,We viewed this expanse of beach from the road. Plenty of Indians were walking about and I’m sure in the evening it is may be busy. We asked about Indians swimming and not many can so they avoid the use of it. Also I’m told the sea is used for removing untreated sewage and rubbish so best avoided but a great shame as magnificent if something was done about this.
Marina_Beach,Vijay,5.0 of 5 bubbles,Jan 2020 • Friends,Weekend are valuable with the fun at marina,Had a great time with my family at marina beach and activities available for interesting and economical
Marina_Beach,Wil Chung,5.0 of 5 bubbles,Feb 2020 • Friends,Beautiful,"Huge beach in Chennai with many things to eat and do.We took a nice relaxing walk along the shore to take in the sights of Chennai Due to the weather, we went later in the afternoon/early evening.Very close to the Light house and Ghandi statue for more sights to see."
Marina_Beach,Sai Kiran M,5.0 of 5 bubbles,Feb 2020 • Family,A happy beach!!,"Beach with vibe is a perfect definition for Marina Beach. The entire area has a good parking facility(of course a bit hard to get place sometimes) with a lot of food stalls that once can enjoy while walking along the shore. This is a place one MUST visit if you are a tourist to Chennai. Coming to the waters, the shore is little inclined so have to be careful. Police patrolling(on horses) happens throughout(they watch us) the day which was the things I liked the most. They care and ensure every visitor goes back safe & sound. Good place!!"
Marina_Beach,Deadman17,5.0 of 5 bubbles,Feb 2020,"Good vibes, crowded",the beach is one of the longest in the world and offers great views of sunrise and the calm sea.  there are various monuments of historical importance opposite the Marina Beach. There are various stalls offering street food. There is enough place for parking as well.
Marina_Beach,SSekuri,5.0 of 5 bubbles,Feb 2020 • Friends,Best hangout place at no cost ,"Keeps getting better attracting more crowd. With so many attractions around town, marina beach is best place for a get together and spending an evening for few hours. Eateries are reasonable and may not be good if you are health conscious."
Marina_Beach,Jolly Traveller,2.0 of 5 bubbles,Feb 2020 • Solo,Marina Beach - I tried to love it,"Marina Beach is a Chennai must see destination but after visiting the north end of the beach I felt deflated.I didn't get to the lighthouse which I do think would be worth visiting so maybe start therr.I started my wanders st Madras University grounds (stunning architecture), then took the pedestrian underpass to the north end of the beach. I strolled through the monument grounds (worth a look but it would be best with a guide), up to the bridge (with its unique stink of backwater and sewerage) and cut through the quiet memorial park to the beach. From there a walk across the grass flats to the sand.As with Elliot's Beach, there is plenty to see but the plentiful garbage and for me the poor condition of some horses (possibly retired beach ponies) up the back made it a joyless visit. Have a look at my pics.I tried to love this beach for it's uniqueness but couldn't. My review doesn't include the south part of Marina Beach near the Gandhi statue - maybe there is more joy to be found there."
Marina_Beach,Raymen S,4.0 of 5 bubbles,Dec 2019,Nice Beach for families but over crowded,"It was a family outing and we have visited the beach, Yes, nice and huge space for the public, In my opinion, it could be much more. cleaner and utilize in an attractive manner to attract more. Parking was terrible. Lots of street food available. mush visit place."
Marina_Beach,jackharrybill,4.0 of 5 bubbles,Feb 2020 • Couples,Sand. Lots of sand. ,"We visited the beach on a Sunday afternoon. Lots of people enjoying the attractions, stalls and the sea. Still plenty of room if you needed it. "
Marina_Beach,Tanumita D,5.0 of 5 bubbles,Feb 2020,Literally the longest natural beach in India,"The Marina Beach is so beautiful with clear blue water and you can see long stretches of sand on either side of you. I loved being there and will go back again in future for sure. It's calm, serene, clean and iconic. People need to be a bit more cautious about maintaining the cleanliness of the beach though."
Marina_Beach,Anubhab Arko Dey,4.0 of 5 bubbles,Feb 2020 • Friends,"Good Place, But Needs Cleanup","the beach the main attraction of Chennai, indeed yes to some,I have certain different opinion regarding this,  authorities work on few points then its it could be.the cleanliness of this beach is Above average,The southern part ia comparatively cleaner everything than to the northern parts,so does the areas near the Promenade, The street vendors sells goods which are cheap and offer a wide choice. The sea is not so rough here, overall a good place to hangout with family and spend some time "
Marina_Beach,AURELIO L,3.0 of 5 bubbles,Dec 2019,not so bad,if you have so many time you can go to see the beaches but remember they are not so so nice and the most of them are so crowded
Marina_Beach,Madan Gopal M,4.0 of 5 bubbles,Feb 2020 • Friends,Great escape.,"I never missed this iconic beach whenever I visited Chennai. Though overcrowded in the evenings, the energy,vibrant atmosphere,beach market is not to be missed. My favourite is quite sunrise and sip hot cup of coffee."
Marina_Beach,Mikan999,4.0 of 5 bubbles,Feb 2020 • Couples,Fish market and fishing boats area is most interesting,"We preferred the southern end of the beach, past the lighthouse and along Foreshore Estate Promenade. This is where fishermen bring their boats onto the beach and their wives line the edge of the beach preparing and selling the catch from small stalls shielded from the sun by parasols. More kinds of  fish than we could identify. Everyone seems friendly and happy to allow photos and engage in hand-sign talk with non Tamil speakers like us. This is a working beach - covered in brightly coloured fishing boats, nets, fishing gear and assorted fishing related debris. We went late morning, we are told early morning is the really busy time. If you are visiting St Tome Cathedral then it’s a short walk to this area."
Marina_Beach,Dwightcr,3.0 of 5 bubbles,Jan 2020,Chennai beach with mostly fisherman,"This beach isn't really for swimming.  It's a fisherman's beach for fresh catch.  A bit dirty, but does offer some sea views."
Marina_Beach,nozzlering,5.0 of 5 bubbles,Jan 2020 • Family,Much cleaner now,"I was surprised to find it much cleaner, with decent public amenities. Must visit.Government has put in all efforts to maintain cleanliness. Although you could see some tourists littering the place."
Marina_Beach,senthil,5.0 of 5 bubbles,Feb 2020 • Family,Asia no one beach,Good beach and neat and clean.well maintain by the Tamilnadu government and public also.Public also maintain the same
Marina_Beach,justbliss,5.0 of 5 bubbles,Jan 2020,Most Popular Beach of the town,Having said that it also means this beach is the most crowded however you can always find a spot to sit and enjoy the view. 
Marina_Beach,Gaby,4.0 of 5 bubbles,Jan 2020 • Friends,Marina Beach 🏖,"A really wide beach with plenty of space for a good family time. Evening time, dotted with a number of vendors selling sea food, pakoras and snacks. The beach is not a swimming beach."
Marina_Beach,Jaykann,4.0 of 5 bubbles,Dec 2019 • Friends,Worth a walk,Second largest beach in the world. Beach is huge stretch and really worth a walk. Great place for morning walkers.It's too crowded in the evening and I would advise avoid evenings specially weekends. Lots of shops around the beach which makes it hard to maintain it. Somewhat clean but need more attention. Not advisable for swimming.
Marina_Beach,scs-953,5.0 of 5 bubbles,Jan 2020 • Solo,Interesting place to go for morning walk. ,"If you are keen to go for a morning walk in Chennai , then marina beach is the best place. The beach has so many interesting things to offer in the morning. You will find serious muting walkers walking on the beach , children playing , youngsters doing their exercises, and pop up vans selling special fruit juices. The sun rise is a wonderful sight. If you are lucky , you watch a fishing boat returning after a trip. Worth the effort "
Marina_Beach,Traveller G,4.0 of 5 bubbles,Jan 2020 • Couples,Bit dirty but a good walk,"Marina Beach in the Bay of Bengal. Longest beach in India, was a lot of building work going on when we were there. Sadly it’s pretty dirty with rubbish everywhere but still a fascinating sight to see and nice long walk. Be aware you’ll get hassled constantly by people trying to sell you horse rides, plastic jewellery etc..."
Marina_Beach,Mrudula,5.0 of 5 bubbles,Aug 2019,Urban Beach,"This is a very big beach in area and the second largest beach. it has all the varities to enjoy like horse ride, Fishes to eat, man made beads for ladies so many"
Marina_Beach,Ashwini1234,4.0 of 5 bubbles,Jan 2020,Nice evening spot,Its a vast beach . There is a light house which closes by 5 so we could not make it. but good place for a nice evening walk along the beach with friends /family.
Marina_Beach,arnold ahmed,2.0 of 5 bubbles,Dec 2019 • Family,Boring,If you are local you might like it. Beach is quite dirty and very few activities available. On the positive side its long and big. No cycling available. 
Marina_Beach,Isabella,4.0 of 5 bubbles,Nov 2019 • Family,Review of Marina Beach,It was a beautiful beach.It is a nice place to come and relax.But the only thing i think is unfair is how long u have to walk to get to the shore.overall i would recommend it to all those summer people out there.
Marina_Beach,devan2599,3.0 of 5 bubbles,Jan 2020 • Couples,An evening at the marina beach,Lot more can be done to this natural treasure. Its advisable not to go swimming in the beach. If you are from overseas its advisable to take with you titbits and water.
Marina_Beach,1777NT,5.0 of 5 bubbles,Dec 2019,"This beach seems to go on for miles, even excersise your horse on it","As the Bay of Bengal appears to have little tidal change, this beach is very wide, with little or no change due to high or low tide.  It goes on for ever, nice clean sand and it appears to be kept clean by machinery.  Lots of fish stalls at the Fort End and at the Lighthouse End, with plenty of working fishing boats moored around the Lighthouse end of the beach. Unfortunately, the usual Indian problem of plastic litter around these stalls/boats. No point the rest of the world trying to ban plastics...….."
Marina_Beach,laxman_iyer,3.0 of 5 bubbles,Jan 2020 • Couples,Beach,Too crowded..dirty.. not well maintained..garbage all over...does not have the beach vibe..waste of time and effort 
Marina_Beach,Milind Kshirsagar,3.0 of 5 bubbles,Jan 2020 • Family,Ordinary beach,Just another beach. Nothing great. Very far from main road. Rough sea waves. Go to Mahabalipuram instead.
Marina_Beach,George G,3.0 of 5 bubbles,Jan 2020 • Couples,A somewhat dirty beach but it does come alive at night. ,"A long, unexciting beach. It is dirty in many places and not a place to swim due to rip-tides and dirt. The rubbish is more near the areas used by the fishermen where the dogs run free. At night don't stray from the well lit areas near the stalls which come alive but as rows of predictable offerings with little originality. Old fashioned fair ground rides are quaint but not the same ones time and again. "
Marina_Beach,QWERTY098,4.0 of 5 bubbles,Dec 2019 • Family,Long long beach,Sand is grainy. Long stretch before one reaches the sea. Food joints and others add to the experience but thr vastness is brilliant.PDA is common here and largely unavoidable if one goes in late evenings.
