Tourist Attraction,Name,Rating,Date and criteria,Title,Review
The_Anna_Centenary_Library,shamveelahmed,5.0 of 5 bubbles,Dec 2016 • Family,Biggest library in city,"This is the biggest library in city situated in kotoorpuram it's a land mark now,for book lovers it's a must place to visit"
The_Anna_Centenary_Library,Nishanthini B,3.0 of 5 bubbles,Apr 2017,Book lovers paradise,"The decent crowd in own book section tell us how popular this place is among youngsters. I was awestruck by the number of columns of book found in Tamil section. The cleaning crew are trying to keep this place at its best.The food count must be improved. We are not there to eat, but we spend a whole day there. AC in few floors must be improved.Dont miss the bird's eye view from 7th floor"
The_Anna_Centenary_Library,Shyamis,5.0 of 5 bubbles,Apr 2017 • Family,Wow!,The library is currently organising a summer camp for kids every single day this month and next. Was there today and I should say we had great fun and they have an amazing children's book collection. My only grouse is that we cannot borrow books. It is free of cost and there is no membership involved.
The_Anna_Centenary_Library,gangadharankaruppan,5.0 of 5 bubbles,Jul 2016 • Solo,Biggest and bestest library,"The maintenance was good. Each and every section contains all levels of books. First time, I couldn't complete a portion(8-10 pages were left) in a book which I photo copied for free."
The_Anna_Centenary_Library,anushaSrao,4.0 of 5 bubbles,Jan 2017 • Solo,Good Collection,Nice place to study ... decent collection. If only wifi was there I would give it 5 stars. They have an area where you can bring your own books/notes to study .. which has been very helpful. 
The_Anna_Centenary_Library,Xe10,5.0 of 5 bubbles,Feb 2017 • Friends,The best place in Chennai,"Cannot believe the state govt can run such a efficient and wonderful library.Feel sad that it is so under-utilised.What more can one ask for! Free entry/parking/security/cloak room.a food court which serves decent meal and is very cheap.Clean well maintained.Greatly indebted to those who fought for this place ,to overcome the political drama, and keep the reading culture alive."
The_Anna_Centenary_Library,Akila P,5.0 of 5 bubbles,Dec 2016 • Family,One Stop for non stop knowledge seekers,"Ultimate collection of books, well maintained and courteous staff. Very silent and must go place for kids. Rare collection of books are available."
The_Anna_Centenary_Library,mrvradhika,5.0 of 5 bubbles,Jan 2017 • Family,Must visit for book lovers,Has books for all ages even for the blind. Large variety of books(can find anything you are looking for) and a must visit in chennai.
The_Anna_Centenary_Library,Sriram R,5.0 of 5 bubbles,Jan 2016 • Solo,Vast collection of books. reference material - Must Visit,"The Anna Centenary Library has been set up as a modern library catering to diverse readership and research. Spanning across 6-7 stories, the collection ranges from classics, reference material, fiction and non fiction, childrens' and academic books. Given such a unique home to treasure trove, unfortunately the library lacks the subscribers it deserves. Many of the floors are empty except for couple of research scholars referring to some material. If you are in Chennai, you must try be a regular reader at the Anna Library."
The_Anna_Centenary_Library,padmanaban2015,5.0 of 5 bubbles,May 2016 • Solo,Big bigger but not best,Good ambience and environment for active reading and to have a routine hobby as reading. Needs more development on latest books
The_Anna_Centenary_Library,vignesh d,5.0 of 5 bubbles,Oct 2016 • Family,Thanks to the Government,"Its a great library, think about a shopping mall instead of shops full and full of books. Great place to sit and read and roam around."
The_Anna_Centenary_Library,pshamkuwar,5.0 of 5 bubbles,Nov 2016 • Business,Most Modern Liberary,"International & Global standard facilities, huge collection of books on all topics from Art,Science, Engineering and well known for research in life sciences"
The_Anna_Centenary_Library,mukund s,5.0 of 5 bubbles,Nov 2016 • Family,Great collections/reference materials for students,One of the best facility run by a state govt. lots of educational and reference materials avaialble for students of all subjects. Particularly useful for IAS/IPS/ Civil services aspirants.
The_Anna_Centenary_Library,Shashank,4.0 of 5 bubbles,Mar 2016 • Friends,Paradise,"A paradise if you're a book lover. Refreshing to see a library so well maintained, with an impressive collection under their belt. Easily accessible by road as well. Large, spacious and well-lit. This one is for book lovers."
The_Anna_Centenary_Library,pchandras,5.0 of 5 bubbles,Sep 2016 • Family,Excellent kids section,I've been here with my family quite a few times and my daughters (8 and 6 years) love the place. Great books both in English and Tamil. Children who enjoy reading can easily spend a quality 2-3 hours browsing here. I've not yet been to the sections where they have books for adults.
The_Anna_Centenary_Library,khan25kareena,4.0 of 5 bubbles,Feb 2016 • Couples,South Asia's Largest Library,"The Anna centenary library is eight-storey structure and is South Asia's Largest library.It is a perfect retreat for all those who look forward to take a break by simply reading a book amidst the calm and peaceful atmosphere of the library.It has more than five lakhs books on various subjects.It has a Child section.tamil nadu book section,Braille sectoin etc."
The_Anna_Centenary_Library,balakec,5.0 of 5 bubbles,Dec 2015 • Solo,Fantastic Library with Great Infrastructure,Anna Centenary Library is situated near the Cancer Institute Adyar. The place is calm and serene. This library is one of the largest in the city with great collections of books for all subjects. The history and economics section is quite extensive. It has a Braille section and a section for old manuscripts like palm leaf which gives us great insights into Tamil literature.
The_Anna_Centenary_Library,ArunaSrinivas,4.0 of 5 bubbles,Sep 2016 • Friends,Largest library in town!,"Huge spacious library with enormous collection of books on literature, culture, technology etc. Ideal for research, as there are plenty of books for reference. Easily accessible on the main road in Kotturpuram."
The_Anna_Centenary_Library,Dinesh_cbe,4.0 of 5 bubbles,Sep 2016 • Friends,Largest library,"This library is probably the biggest in the country. We decided to visit this place as we planned Chennai. Have wide range of books from science, religion, literature, career related, IT, cultural and much more. Maintenance is not so great. There is plenty of space for improvement. Knowledge hub not utilised properly."
The_Anna_Centenary_Library,Padmanabhan,5.0 of 5 bubbles,Oct 2015,Net and well maintained with a large collection of books,"This place is probably one of the best maintained public libraries in Chennai. They have given a corporate look and feel here with top notch security, neat and comfortable seating arrangements, bright rooms and a great collection of books.Must visit place for all bookworms."
The_Anna_Centenary_Library,Sagar M,2.0 of 5 bubbles,Sep 2015 • Friends,Not worth a visit,"The library is in dire need of attention. The structure itself is new and spacious, however the collection of books is more suited for regional literature lovers (even there, I cant vouch for the collection). Those wanting to do some research, there are no plug points for you to plug in your laptops. Stick to pen and paper. Refreshments are not available, staff is least bothered and not friendly.Even the courts have criticised the management of this library. Such a shame."
The_Anna_Centenary_Library,girieshm24,4.0 of 5 bubbles,May 2016 • Solo,Source of Knowldge,again and again this place make me to visit it was an amazing place to spend time and to gain knowledge
The_Anna_Centenary_Library,LeenaGS,4.0 of 5 bubbles,Aug 2015 • Friends,A Modern Library with a huge collection to suit everyone's choice,This modern Library is one of the best additions to the Chennai's public Libraries. The building and surroundings is fantastic. The collections are great. The best part is the exclusive floor with some lovely collections for Children.A must visit place for families and also for visitors.
The_Anna_Centenary_Library,myspaceshalini,2.0 of 5 bubbles,Jul 2016 • Solo,"Provide open source tools like word,gmail in e-learning","This is Government aided learning center.But not providing the useful access in net.Simply providing wiki information it not make sense. Even using chrome browser,accessing gmail have restriction. Then how to take notes. Always user must bring notes not necessary. I dont know as you will take steps for this. If steps has been taken can appreciate."
The_Anna_Centenary_Library,gausan51,2.0 of 5 bubbles,Aug 2015 • Solo,The library abandoned,"In fact, Anna Centenary Library is one among the landmarks for Chennai city. However, the library has not been utilised properly. The maintenance is found to be very poor and books are not available and in case the library is utilised by providing more books, it can become one among the best libraries in the world"
The_Anna_Centenary_Library,praveenramanujam,5.0 of 5 bubbles,May 2016 • Family,Asia's biggest library,This is Asia's biggest library. The collection of books is amazing. The government of Tamilnadu should concentrate to develop the facilities in this library
The_Anna_Centenary_Library,VivekRN,4.0 of 5 bubbles,Mar 2016 • Friends,The Anna of libraries!,"The Anna Centenary LibraryMONTH OF VISIT : March 2016.LOCATION : On the Gandhi Mandapam road, Kotturpuram, large building easily identifiable.OPENING HOURS : 8 am to 9 pm everyday except Sunday. Parking available.THE ""GOOD""s : -Huge library with collections in almost every subject and study, includes a BRAILLE library.               -Also has a special section for children.              -Centrally air-conditioned and very well maintained, has elevator access.              -Provides ample number of desks and tables to sit and read, with good lighting.              -Computers at every floor to search and find any book using the search feature.              -Very less crowd during the day time.              -Has a mini food outlet. The ""BAD""s : -Books cannot be borrowed. My View : A great place to sit and study. Peaceful."
The_Anna_Centenary_Library,Nahin S,4.0 of 5 bubbles,Jun 2016 • Family,a big Library,A big library with variety of books and all at the main city.. and the environment is also so neat...
The_Anna_Centenary_Library,Vinoth M,5.0 of 5 bubbles,Jan 2016 • Friends,Book readers don't miss out this place,"If you are avid book reader, just knock out the doors of this library a great collection of precious vaults which you would add to your thoughts. Absolute fantastic collection of books."
The_Anna_Centenary_Library,SudhaGovi,3.0 of 5 bubbles,Mar 2016 • Friends,Good  library  poor maintenance,Blame the local government  for completely  ignoring this wonderful  investment . It's still a good  place with Other of books. 
The_Anna_Centenary_Library,helpothers2016,4.0 of 5 bubbles,Jun 2016 • Family,All books are there,"Well built, all books available and the place is well maintained and located at the centre of city, with parking facilities"
The_Anna_Centenary_Library,Srikanth R,5.0 of 5 bubbles,Jun 2016 • Solo,Heaven for book lovers,Nothing to beat the collection of books in various specialities.  It has a huge collection of books.  Everything arranged in order and maintained well. The children section is ideally designed for parents to read out the books for them in case they want to.  The library also has a cafe in case you need a munch between your reading.  You can't lend books from here.  Only reading within premises.  Still worth it.  
The_Anna_Centenary_Library,rajshekar3597,4.0 of 5 bubbles,Feb 2016 • Family,goood for reading.....,"I love the magazine section on the 1st floor. It has almost all the English magazines both Indian and Foreign magazines like Time, The Economist, Forbes to name a few. it's sad that even those nearby are not aware of this and all these magazines remain idle on the shelves. They have a good collection of History books of all countries on the 7th floor. I even saw Nandan Nilkeni's Imagining India. I am yet to explore the other sections. These books are much better than the rubbish optimized results that Google give us. After my first visit, I have now planned to visit the Library regularly. Moreover all the sections are air conditioned."
The_Anna_Centenary_Library,ganeshpkumar,5.0 of 5 bubbles,Feb 2016 • Family,Tons of Books,This is certainly the biggest library I have ever visited. It has huge collections of books from wide range of subjects. The place in air conditioned and elegantly calm. There are many high books for references normally which one can't easily afford.
The_Anna_Centenary_Library,arthi72,5.0 of 5 bubbles,Nov 2015 • Family,temple of books,awesome place.free.loads of books.all subjects reference books.braille section.self reading area.the building is cool[ac].food also inside.no entry fees.a special kids section hall.
The_Anna_Centenary_Library,NafiRiz,5.0 of 5 bubbles,Apr 2016 • Family,Peaceful,Its a big place that is neatly done. They have separate area for children and my kid loves it. Its very peaceful and can spend a few hours at every visit.
The_Anna_Centenary_Library,PraveenMax,5.0 of 5 bubbles,May 2015 • Solo,My favorite place in Chennai,"You can find on any topic and most of the books are imported which one cant buy in his /her lifetime. The place is well maintained with AC and it has the perfect atmosphere for book lovers to read for longer hours. I usually spend around 7 hours there. People studying for competitive exams also come here often. For lectures and research scholars, it has several publications and good books for reference too. If you cant find a book, there are computers in each floors where you can search the entire library.There is one canteen (French Loaf) at the ground floor which have limited selection of food. Small hotels are nearby the library and so one have breakfast, lunch there.Must visit place."
The_Anna_Centenary_Library,Gokhul,5.0 of 5 bubbles,Apr 2016 • Friends,Must Visit,A beautiful place in Chennai where you have large volumes of books in 7 floors. Sad that this is not maintained properly because of dirty politics by JJ.
The_Anna_Centenary_Library,Tamilian S,5.0 of 5 bubbles,Jan 2016 • Solo,Great place.,"Just love it. Frequent it at least once a week. Great books in psychology and film are here. I love how they've managed to keep things consistently quiet here. But, I wish they'd put in a little more effort arranging the books. Also, a database on the internet with all of its books would be wonderful. I could look it up online and then decide whether to pay the library a visit. Very comfortable though, and I feel lucky living pretty close by."
The_Anna_Centenary_Library,snehaavi254,5.0 of 5 bubbles,Mar 2016,Best Library for all age groups!!!,The library is one of best with state of the art facilities and can be a best option to inculcate good reading habits to children. The children's section is designed so beautifully. Every other section is also arranged well and has a huge collection of books. 
