Tourist Attraction,Name,Rating,Date and criteria,Title,Review
The_Anna_Centenary_Library,Bupa,5.0 of 5 bubbles,Apr 2022 • Family,Heaven for Book lovers.,Amazing place with lots of books. Definitely a big salute to kalainar. Every time I feel excited when Ithe collection of books and ambience of surroundings.
The_Anna_Centenary_Library,vijay c,4.0 of 5 bubbles,Jan 2020,Best library in Chennai,Anna centenary library in Chennai is the biggest library in Asia. It houses vast collections of ancient manuscripts. Good resources for students preparing for competitive exams
The_Anna_Centenary_Library,Ansi,5.0 of 5 bubbles,Jan 2020,very interesting,definetely worth to visit. you can spend here a day and it seems to be minutes....We would definitely go again if we could. recommendable
The_Anna_Centenary_Library,LostMySelfTraveling,5.0 of 5 bubbles,Jan 2019 • Family,Superb library,"It's an awesome library with lots of categories including children. You can study comfortably, peacefully. There is a facility for visually challenged or visually impaired. So it's a must visit place for the people who love."
The_Anna_Centenary_Library,Sai B,5.0 of 5 bubbles,Oct 2019,Excellent Library,"Excellent library with lots of books, Build by Former Chief Minister M Karunanithi. Now its not well maintained as it was earlier"
The_Anna_Centenary_Library,ababushankar,5.0 of 5 bubbles,Aug 2019,Paradise for book lovers,"You can find books for all ages and interests. Children's section has books for children and teachers. The library has exclusive space for those who would like to study peacefully, with your own books and laptops"
The_Anna_Centenary_Library,nithyavasu,5.0 of 5 bubbles,Sep 2019,Reader,"excellent collection of books, good facilities and easy to access by any mode of transportation. well maintained kids section , good collection of periodicals, comfortable seating, well ventilated , full of energy and above all excellent space for visually challenged and IAS aspirants.  "
The_Anna_Centenary_Library,Arul Prakash Samathuvamani,4.0 of 5 bubbles,Jul 2019,Knowledge Hub of Chennai,"Its one of the biggest libraries in Chennai. Other than ""Read you Own Book"" section, pretty much all other sections have some place for you to sit and read quietly without any disturbance. Its fully air conditioned. Engineering section could have better collection of books, most recognised author book are not available.The place does not have a canteen. It does have a caffeteria, but other than tea, there is no choice in food."
The_Anna_Centenary_Library,Deadman17,5.0 of 5 bubbles,May 2019 • Solo,Large collection of books,"The library has a large collection of books and is a book lover's paradise. There are books for kids, teenagers as well as office goers. If you are studying for a competitive exam, then one should visit the place. One can study here in peace."
The_Anna_Centenary_Library,Krishnaveni S,5.0 of 5 bubbles,Apr 2019 • Family,Amazing children's section,"It is a vast library, the largest in South Asia. It is located in kotturpuram. It has an amazing children's section where kids will love to go. It also has own book reading section, Braille section, regional language section. You can just go and read. No need of any membership. No borrowing of books allowed"
The_Anna_Centenary_Library,Karpagavalli,5.0 of 5 bubbles,Dec 2018,Wow,The place itself speaks of its own history and the n.number of books available mesmerize us to spend more time here.the maintenance of the place can be increased for its not as it used to be.
The_Anna_Centenary_Library,Swami1939,5.0 of 5 bubbles,Apr 2018 • Family,Book lover's paradise,"The Anna Centenary Library on Gandhi Mandapam Road, Kotturpuram is a place where you can see a very large collection of books on innumerable topics. The library is designed excellently and the atmosphere is conducive for calm reading. People love to visit this library to collect lots of data of their interest.    "
The_Anna_Centenary_Library,Sundaram R,4.0 of 5 bubbles,Jan 2019 • Family,visit to library,the library has improved upon in the last one year further to meet readers needs.[qualitative]ambience included.genuine readers will be delighted after a meaningful time well spent
The_Anna_Centenary_Library,uk555,4.0 of 5 bubbles,Dec 2018 • Solo,Book lovers' sojourn,"It's a heaven for book lovers. Has a good collection of books that you can pick, find your corner and blissfully spend as much time as you want. The search catalog computers were not working, but you can browse through the racks, find your pick and read through the day there.Milk parlor is located at ground floor for refreshment, but otherwise you need to head out for snacks/lunch. Toilets badly need maintenance."
The_Anna_Centenary_Library,RavikumarEswaran,4.0 of 5 bubbles,Dec 2018 • Family,Very nice for a public library,They have modelled it on the lines of the libraries in singapore. Kids section is amazing. Lot of books for kids to read and enjoy. Even other sections are good with ample place to sit and read. There are weekly events and activities for both kids and adults. But state of the restrooms are pathetic. Very poorly maintained restrooms.
The_Anna_Centenary_Library,DayaMass,5.0 of 5 bubbles,May 2018 • Friends,"""Informastic""","I visited this library on my summer vacation.This library was built as a memory of Anna's 100th birthday.This library is highly facilitated with A/C.This library has 10 floors,and each floor has different book sections.The 1st floor is for children.And the last floor contains books about history , travel and tourism.You can enjoy a lot here.The entry is free.And there is also a separate place for reading our books which we bring from home.There is also a Braille section for blinds.There is food court beyond the building and a Aavin parlour inside the building at ground floor.I hope u enjoyed this review.But I want u to experience it by visiting the library.☺☺☺"
The_Anna_Centenary_Library,Vinod500,3.0 of 5 bubbles,Nov 2018 • Solo,Huge Library Mismanaged,"My recent visit to this library was disappointing and saddening. I visited the Periodicals section on the 1st floor. The daily newspapers were current. However, I was shocked to find only June and July issues of India Today, Time etc. Magazines like Business India, Business Today, Forbes India, Open, Economist etc were nowhere to be seen. Most shelves were totally empty. I had gone to the same library a year ago, when the current issues of all these magazines were available for reading in the library. So I inquired with the staff why the deterioration in the last one year. They were apologetic, and said subscription to periodicals like India Today, Forbes India, Open etc have been renewed recently and December issues will be on the shelves. It took them 6 months to renew subscriptions! It smacks of mismanagement of this public resource at the top levels."
The_Anna_Centenary_Library,Ashish S,5.0 of 5 bubbles,Nov 2018 • Business,Nice visit,It was nice to visit the library. It was a neat place. It was very peaceful as well. Very informative visit.
The_Anna_Centenary_Library,Priya M,5.0 of 5 bubbles,Sep 2018 • Solo,Literature lovers paradise,Massive library complex located in Chennai City. Its a literature lovers paradise and there are so many books available. 
The_Anna_Centenary_Library,nageswararao g,5.0 of 5 bubbles,Sep 2018 • Family,Massive library,"Its a massive library, one of its kind in whole of South India. Well kept place with literature of most of Indian languages."
The_Anna_Centenary_Library,CharmDeepak,5.0 of 5 bubbles,Mar 2018 • Couples,Extraordinary Collection,Anna centenary Library is well organized library. it has every single feature what an ideal library has. though it is a silent library there is a room for louder section in the ground floor. this is not lending library but you can take picture of your fav books  with mobile ( in silent mode). Laptop is allowed.  
The_Anna_Centenary_Library,Anusree P,3.0 of 5 bubbles,Jul 2018 • Family,Very large,"Anna Centenary Library is very large building.  you will get mostly all the books, silent place and very spacious location"
The_Anna_Centenary_Library,vinodkhedkar,4.0 of 5 bubbles,Aug 2018 • Solo,Good Library,This is a very nice library which has a wide variety of book on different subjects. Good ambiance and silent place. Good place for book lovers.
The_Anna_Centenary_Library,selvambikaiyali,4.0 of 5 bubbles,Apr 2018 • Family,anna library,"big library, you will get mostly all the books, silent place and very spacious location, good for book lovers and readers"
The_Anna_Centenary_Library,worldwomantourist,5.0 of 5 bubbles,May 2018 • Friends,Wonderful collection of Books,Very great library with massive collection of books. Needs to be maintained well. Lot of rare books. One of the Best Library in Chennai.
The_Anna_Centenary_Library,vasan224,5.0 of 5 bubbles,Aug 2017 • Family,all books in one place,anna centenary library has all the books for the students also it provides a peaceful place for the students to read in a clam manner.
The_Anna_Centenary_Library,ilavarasi_sm,4.0 of 5 bubbles,Jul 2018 • Business,Forest of book and books,Lot of books collection from kids to senior citizens of all categories. It got very big space to read comfortably whichever you would like to...
The_Anna_Centenary_Library,vijmail99,2.0 of 5 bubbles,May 2018 • Family,lack of attention,need to improve a lot...less collections and lacking basic amenities. assistance staff not available for help
The_Anna_Centenary_Library,Madhan K,4.0 of 5 bubbles,Apr 2018 • Business,The good library,The library is huge and lots of books 📚 to read and study and understand.People who likes to read its a good place.Can get all types of books to boost our knowledge Must visit place for book lovers
The_Anna_Centenary_Library,Alicia A,5.0 of 5 bubbles,Nov 2017 • Friends,Fun to explore,"Visited the Anna Centenary Library to see the palm leaf scripts, which were a unique find. We hoped to get our readings done there as well but it was more so just to see. A huge library, a great place to explore when you want a change from the busy city life. "
The_Anna_Centenary_Library,Keertan,4.0 of 5 bubbles,May 2018 • Family,Good,"The Anna Centenary Library (ACL) is a newly established state library of the Government of Tamil Nadu. One of the largest libraries in Tamil Nadu, it is located at Kotturpuram, Chennai. A big boost to book lovers, it is said to be South Asia's largest and most elegantly designed library.Housing about 1.2 million books, the library is well equipped with state of the art facilities including a spacious auditorium, amphitheatre and two conference halls. The library is open to public from 9am to 8pm daily. The major attractions of the library are children's section, with fun-filled theme-based reading area with multimedia kits and storybooks. The library also has a special section for the visually-impaired, with talking books and Braille displays. ACL is often reckoned as a reader's paradise. The library is spacious and cool, and offers a calm reading environment. Moreover, it offers membership facilities, Amenity Centre and Food Court, Digital Library as well as Residential Facility for Researchers. The library is easily accessible from any part of Chennai. If you are planning your visit to Chennai, it is preferable to visit the place during the months of November to March, as the climate will be pleasant then."
The_Anna_Centenary_Library,Raghul J,5.0 of 5 bubbles,Oct 2017,A High Tech Library,A Library which is really peaceful for studying...and has a good infrastructure and contains a lot of books which is useful for research people...
The_Anna_Centenary_Library,Suresh C,5.0 of 5 bubbles,May 2018 • Family,Good place to be - great Infrastructure,"Eight floors of books on various categories.  Spacious entry/exit with Parking facilities , sign boards and rest rooms shows this place as a remarkable one.  When I went, there are large number of high school or college students using the facilities in many of the ""read your own book"" sections.   Air conditioning was functioning excellently  when I went and this place is ideal for those who want to spend time in learning in a comfortable environment.   There is also a small auditorium and there was a literary functioning happening during the time of my visit.   Children section in first floor is spacious and lot of english kids books were present and lot families have brought their children.  Parents should move their children out of TV, iPads and other gadgets and make them spend some time amidst books - it will change their mindset and productive.   Would recommend this for everyone especially kids to atleast make one visit as trendsetting."
The_Anna_Centenary_Library,BhaarathPhotography,5.0 of 5 bubbles,Apr 2018 • Solo,My Most Favourite Place in Chennai ,I believe this library is one of the most Peaceful and Knowledge gaining place in Chennai.The place where you can spend free time very useful. More number of books in different Language with different Authors. Kindly bring your children's once and explain them in brief about the books. 
The_Anna_Centenary_Library,RAMAKRISHNAN K,5.0 of 5 bubbles,May 2017 • Family,It is an wonderful place to read listen,The location is very central and collections are really commendable. Lots of floors for each category of readers . Children have separate floor Competitive exam preparation may be done from here because it gives calm atmosphere. Some good educational program also conducted 
The_Anna_Centenary_Library,Nirmal,5.0 of 5 bubbles,Sep 2017 • Friends,Excellent place for Study,This place can be used by the students to study and clarify the doubts as there are large collection of books in the library. this is very usefull for the UPSC and other government exam candidated who feel some sort of disturbance at home. This is supported with AC facility so that you wont feel tired even after hours spent together in this place.
The_Anna_Centenary_Library,keerthi2012,4.0 of 5 bubbles,Apr 2017 • Business,One of the best book collections,It is a very calm place in the midst of a bustling city. Best place to read and gain knowledge. Extensive collection of books. So spacious
The_Anna_Centenary_Library,592abck,5.0 of 5 bubbles,Nov 2017 • Family,Books and books,"Such a collection of books, hard to find in the era of kindle and internet. However, lot of kids here."
The_Anna_Centenary_Library,ananthakp,3.0 of 5 bubbles,Dec 2017 • Family,An opportunity lost,"Started with a lot of publicity in one of the finest locations in Chennai. The maintenance, to say the least is far from satisfactory. It had all the good things to become one of the finest libraries at least in South.  Unfortunately, badly managed and fast losing its purpose."
The_Anna_Centenary_Library,Krishnaveni S,5.0 of 5 bubbles,Jan 2018 • Solo,Heaven for book lovers,"It is a huge library with multiple sections. There are so many books related to every field. The children's section is very cute. There are 2 own book reading rooms as well. Very well maintained, and really awesome. Please visit"
The_Anna_Centenary_Library,scorpionchennai,4.0 of 5 bubbles,Oct 2017 • Solo,A delight if you are a book worm,"One of the best place if you loving reading,good ambiance and of-course a treat for all those who still love library."
The_Anna_Centenary_Library,shrinikethv,5.0 of 5 bubbles,Dec 2017 • Solo,Book heaven in Chennai,"If you are a book lover and an avid reader, it is sheer injustice if you haven't been to this place. Majestic huge building with tremendous facilities, AC, canteen, self study rooms, tons and tons of books in all domains including foreign languages, center for competitive exams resource and many more. Must visit!"
The_Anna_Centenary_Library,arunkumars2013,5.0 of 5 bubbles,Dec 2017 • Couples,Majestic!,"Visited the library for first time last week. The library is huge with almost all sections I could think of, covered. Wanted to visit the library for a long time. So just checked out a couple of sections - Travel and Economics. There is enough space for two wheeler and four wheeler parking.There is an aavin milk centre in ground floor.There are no computers in the sections that I visited. Ppl are allowed to bring their own laptops and use them. There is a kids section which has play area.Overall, a very nice place with no negatives at all."
The_Anna_Centenary_Library,harishbala,5.0 of 5 bubbles,Dec 2017 • Family,"Wide range of books available, can spend hours here",We visited this library and were very impressed to find such a large library in Chennai. There are books for all ages and Children would have a great time visiting also. 
The_Anna_Centenary_Library,SRIKAKOLAPU,5.0 of 5 bubbles,Jan 2017 • Friends,must see for book lovers,I am sure you will be amazed by the sophisticated facilities and the humongous size of the library.Go there if you are a book lover or not just to experience it
The_Anna_Centenary_Library,Johnson G,5.0 of 5 bubbles,Nov 2017 • Solo,World Class,"Superb, fully air conditioned, Amazing book collections. Silent environment, Places for family and children for gain skills"
The_Anna_Centenary_Library,Angelrun29,4.0 of 5 bubbles,Aug 2017 • Friends,Kids and literature sections are well planned and house a wealth of information in the form of books,"The access was smooth. Bear in mind that you need to deposit all your bags at the entrance while getting the access. Once in, smooth approach and proper guidance on what to find on which floor. The kids section is so beautifully planned and the whole colour combinations used and the furniture and layout would just keep the kids engaged throughout. The literature section also has a huge variety of books and is vast as an ocean. The source index for books is laid out in a neat fashion thus making it easy to scroll through. Only negatives are the food range and quality available in the snacking area and the fact that they do not have any memberships and so you can not carry any boks home. "
The_Anna_Centenary_Library,tnbalaji90,5.0 of 5 bubbles,Aug 2017 • Friends,One of my favourite places in Chennai.,"One of my favourite places in Chennai. Basically you will need one day to go a book tour for this place, then following days you can visit and start reading your favourite books. Well- maintained and lifts are available. The place is well furnished to sit and read, also plugin are available to charge your laptops and mobile phones. Reading sessions happen here very often and also Braille books are available here. Staffs are courteous and helpful, and you will definitely fall in love with this place for its interiors and book collection. Amidst a busy place, you can find peace here."
The_Anna_Centenary_Library,SIVA S,5.0 of 5 bubbles,Jul 2017 • Solo,Best Place to Learn,"Very Largest library,we have 9 floors of books with different categories.almost all the subjects.we also have digital library,you can also go with your notes and laptops to take notes.we have good speed of wifi.we can spend entire day from morning 10am  to 8pm.we can also get tea,sandwiches in cafeteria like aavin,cake cafe day.parking also very big so no worries about it.go there spend time to read, only restriction is #no rental,we won't get book outside.but you can take Xerox important content you need."
The_Anna_Centenary_Library,Srirambalaji S,4.0 of 5 bubbles,May 2017 • Family,Book lovers paradise,"Built on 8 acres of land, the 9-floor library houses a total area of 333,140 sq. ft and has a capacity to accommodate 1.2 million books. We visited the library during summer vacation and could make it only the Children's section and not to all the 9 floors due to paucity of time. The children's section had a good collection of books along with reading area for kids. Kids can read the books there itself and children's books are not rented to be taken out. The children can read as many books as they want and can spend almost the whole day there as there is a huge collection of books. School children volunteer on weekends / holidays to sort out, categorize and arrange the books properly.There is a canteen in the library campus, though it is little far behind the library building. The library is maintained better compared to other government establishments. However, the canteen needs better maintenance and air conditioning, as it gets very hotter during the summer.The overall campus is very good with very little to complain about. Since it was a long weekend on summer holidays, many of the services like Aavin parlour, ATMs, snacks & soft drinks delivery kiosks inside the library building were not working."
The_Anna_Centenary_Library,Trendsette,5.0 of 5 bubbles,Jul 2017 • Solo,Awesome!!!!!Comfortable reading!!!,I had been only to 3rd floor and found good interesting books on religion/philosophy. There are plenty of books on all topics and also you can search your book in the computer there.. which saves your time when you are looking for a particular book.The books can be kept on the table after reading which helps you decide on the books read by others. Since they take the responsibility of returning the books back to its place it is always in the right place!!Loved every moment there and shall be visiting this place everytime i come to chennai!!!Hats off to the kind hearted people who created this wonderful place!!!!
The_Anna_Centenary_Library,dinesh_j84,4.0 of 5 bubbles,Aug 2016 • Couples,A worth visiting library,"It is really good library with huge collection of books. The library has 8 floors with each floor dedicated for specific section. At the ground floor, there is a common reading section, wherein we can take our books and study peacefully. This is mostly used by the students preparing for the exams. In the first floor, a separate section with cartoon theme setup and wide range of books exclusively meant for kids are available. Subject books, fiction and non fiction novels, foreign languages book etc are available in huge numbers. However the library doesn't have the book lending facility. The library has a very big 2 and 4 wheeler parking space. "
The_Anna_Centenary_Library,Gugan_Ilango,4.0 of 5 bubbles,Jun 2017 • Solo,Large collection of books,"The Anna Centenary Library at chennai is government library and have a large collection of books, a must visit to see the scale of the collection"
The_Anna_Centenary_Library,Akin A,5.0 of 5 bubbles,May 2017 • Solo,Awesome Experience ,Must visit place for book lovers.. People doing research and preparing for tough exams won't get a better place than this..I loved the psychology and geography division..! Lil bit maintenance needed near escalator side!
The_Anna_Centenary_Library,Karthik V,5.0 of 5 bubbles,Jun 2017 • Family,Casual Visit,Since this library is on the road just near to my child s school I went in for a casual visit. But was enthralled by the very big spacious library with international standards with a very was varierty and collection of books magazines and references. A wonderful place to learn. I heard it is being upgraded to a much more better facility and collection constantly.Well maintained and upkept. Will visit again.
The_Anna_Centenary_Library,Joji J,4.0 of 5 bubbles,Apr 2017 • Friends,"""Library with a vast collection of books""","I went to the Anna Centenary Library with my friend's son who was doing his PG and I was really amazed to find the facilities and collection of books, journals and magazines. The library is situated in a vast compound and the eight storied building is also huge. They have about 200 staff working there, the facilities in the Library apart from the books include a huge auditorium, amphitheatre, conference halls, food court, ample car parking etc. The books are properly displayed in racks and seperate section for kids on the first floor with a good collection of books, CD's, DVD's, and periodicals, a braile section, facility to read own books or use laptops - all these make this library a cut above the rest. I really wonder, how they made it possible and wish every town in India has such a good library. The idea behind this library deserves appreciation."
The_Anna_Centenary_Library,Afrin S,4.0 of 5 bubbles,Sep 2016 • Family,The best Place to study,Vast book collection. I love this place so much and I feel so possesive that I dislike my fellow visitors.The best Place to study.
The_Anna_Centenary_Library,James K,5.0 of 5 bubbles,Sep 2016 • Family,Ancient and Modern Books of Indian and world war a History,"The largest Public Library in South India. Books stored and stacked neatly for quick identification of title and author. There are multilevel floors and guides posited to help the visitors. Ideal place for family to leisurely browse through books, magazines and periodicals. There is children's section of books which will unlock the minds of the youth."
The_Anna_Centenary_Library,Senthil K,5.0 of 5 bubbles,May 2017 • Couples,ideal place for enhancing knowledge,"Ideally, such a facility should be mandatory in all Districts, if not Taluks.  We have only one and everything about it from the plush carpets to the swank interiors is international about it.  You get books just about every topic in the world and the facility also boasts of a section for reading only your books that you take which is of great help to students.  I went there to verify and do some research on International Law and was astonished by the collection of law books there.  The kids section is super. "
The_Anna_Centenary_Library,tyag_1984,3.0 of 5 bubbles,May 2017 • Family,Good place for book lovers,"good decent place but lacks maintenance, cleaning and up keeping. vast place with huge number of collections specially educational books"
