Tourist Attraction,Name,Rating,Date and criteria,Title,Review
Habitat_World_Convention_Centre,skdel2016,4.0 of 5 bubbles,Oct 2016,A must go place for corporates,It is at the heart of delhi and place is witnessing many seminars/corporate events regularly. Nicely designed and relatively less costly place for convention.
Habitat_World_Convention_Centre,nbhagchandani,5.0 of 5 bubbles,Oct 2016 • Business,Amazing venue for conferences,Have attended 3 conferences here and it is about the best place there is. Lot of activities go on simultaneously. Staff is courteous.
Habitat_World_Convention_Centre,Nikhil P,4.0 of 5 bubbles,Nov 2016 • Business,Quite and nice place for meetings,"an ideal place to host business/social meetings .It has got facilities like auditorium,  theatre , restaurants as well. For people having intellectual inclinations, library and visual art gallery is also in IHC."
Habitat_World_Convention_Centre,Anisha B,5.0 of 5 bubbles,Oct 2016 • Solo,great place to soak in culture,it has everything from great food to great art exhibitions to plays to a lot of cultural events. the cultural hub of the city..definitely worth a visit.
Habitat_World_Convention_Centre,Akanksha S,4.0 of 5 bubbles,Nov 2016 • Solo,A small world in itself,"The landscaping is what attracted me to this place years ago... Only to realize that it has so much more to offer. The American Diner, Super budget friendly Eatopia are a couple of great eating options. There is an Art gallery that showcases the works of several budding and established artists!I particularly remember the lovely little open amphitheatre on the ground floor and the open air swimming pool on the top floor - brilliant places both!They also have banquet halls that are rented out for conferences, marriages, seminars etc.Great place to go for a meal and then to take a stroll around."
Habitat_World_Convention_Centre,pavrahi,5.0 of 5 bubbles,Feb 2016 • Couples,Excellent place and very well maintained,"Indian habitat center is in posh location of Delhi and very neat to nizammuddin railway station. Good place to hang out, or lunch or organize weddings."
Habitat_World_Convention_Centre,Shubhra B,5.0 of 5 bubbles,Oct 2016 • Family,Wonderful place,"Here, I used to have breakfast in a restaurant. There are lots of birds play here. Besides, numerous amount of plants are planted here. So, it is such a wonderful green place to hang out with your friends and enjoy nature. "
Habitat_World_Convention_Centre,Travel2014491,5.0 of 5 bubbles,Oct 2016 • Business,Art and Culture,"Tourist can buy Modern Art,watch plays, enjoy music, visit restaurant ,see all under the cultural Hub of NCR"
Habitat_World_Convention_Centre,Mehmoodmewat,5.0 of 5 bubbles,Aug 2016 • Business,Nice place for conferences,"In the busy city of Delhi,India Habitat centre is an excellent place to hold conferences.Very centrally located with very good facilities,this place provides good atmosphere for serious meetings."
Habitat_World_Convention_Centre,debjitsanyal,5.0 of 5 bubbles,Oct 2016 • Solo,INDIAN HABITAT CENTER AN ASSET FOR DELHI,"When ever I get an Invitation to attend a conference or meeting at Indian Habitat Center, I never miss. I really love the Food Court and Food Quality there in Habitat Center."
Habitat_World_Convention_Centre,SangiTani,4.0 of 5 bubbles,Aug 2016 • Family,Amazing experience,"I just love being there at India Habitat centre. located at Lodhi road, the entire building is very facinating. there are eating outlets EATOPIA which serves all types of cuisines. The is kid platy area. I celebrated my daughters bday at Kidzone - a partly hall behind eatopia. and let me tell u it was one of the memorable occasion. Ha ll is spacious. Food was very good. minimum 15 kids they ask for. they arrange for games as well. There are different price range. They supplied the cake also- outside cake is not allowed. Absolutely loved the place. Highly recommended if u have gathering upto 40 ppl. U need to book in advance as there are limited slots available each day for 2 hours."
Habitat_World_Convention_Centre,SussexIndia,4.0 of 5 bubbles,Sep 2016 • Business,A pleasant place for conference if dated,"Attended one day conference here last week and was pleasantky surprised at the quality of the infrastructure, catering and staff, Though a little dated, an efficient and effective place for business meetings, conferences and the like"
Habitat_World_Convention_Centre,vipi0017,5.0 of 5 bubbles,Sep 2016 • Family,Must visit,"The centre is full of offices and many restaurants , lush gardens . Its perfect start to explore the city "
Habitat_World_Convention_Centre,tejrazdan,5.0 of 5 bubbles,Sep 2016 • Friends,place to connect with world culture,"excellent place to spend evenings on discussions, music, cinema  followed by awesome food in multicusine outlets."
Habitat_World_Convention_Centre,RKNaidu,4.0 of 5 bubbles,Sep 2016 • Business,To attend program on self development ,It is nice place. Well maintained and nice to see that it is been maintained by Delhi government. Lot of activities were going on and lively throughout two days of our sessionNice restaurants available 
Habitat_World_Convention_Centre,SarahParsonsWest,4.0 of 5 bubbles,Sep 2016 • Solo,Great center for events and meetings,"Attending a 3 day conference at the IHC was very comfortable, with plenty of room to move about. The campus is landscaped nicely and offers great meals. The plumbing and restroom facilities are not the best and in need of a revamp. But, all in all a good place to host your next business conference or educational course."
Habitat_World_Convention_Centre,Dev_36,4.0 of 5 bubbles,Jan 2016 • Couples,Nice Comfortable Hotel with good restaurants,"My experience at the IHC has been pleasant on all occassions... The staff is polite well trained and professional... The property has a good lawn and green area as well as a charm and character to it. FYI - Rang De Basanti the movie has also been partly shot here.Besides the hotel and great conference facilities this hotel offers a lot in terms of dining and restaurant options with a wide range of desserts and cakes and a street style cafetaria ""Eatopia"" with cuisines from all over the world... The food and ambiance of the remaining restaurants in their property is very nice too... though the service can take a bit of time specially at "" The All American Diner"""
Habitat_World_Convention_Centre,Sudhanshu Rajvanshi,5.0 of 5 bubbles,Sep 2016 • Business,India Habitat Centre,"This is one of the few aesthetic architectural marvels in New Delhi. Very well behaved parking attendants. Good and spacious meeting halls, theatre, multipurpose spaces.A really nice place to visit. Location is excellent. Well suited for people of good taste."
Habitat_World_Convention_Centre,Chandra Shekhar S,4.0 of 5 bubbles,Aug 2016 • Family,Excellent facility for meetings.,Co-located with a number of institutions (including TERI) in Lodi Estate. Has a good cafe (American Diner) and other dining options (good ones accessible only to members). Usually has art exhibits to to browse if you have some time.
Habitat_World_Convention_Centre,Dharmendra S,5.0 of 5 bubbles,Jul 2016 • Solo,Excellent place for people to see,Very nice place. Good place for shopping and fun. Rajiv chowk is the metro station at canaught place. Must see this place.
Habitat_World_Convention_Centre,Sudhir S,4.0 of 5 bubbles,Dec 2015 • Solo,Cultural and intellectual activity,"Located in Lutyen's zone, this is a spacious complex housing offices, gardens, auditoriums, restaurents etc. usually associated with jholachhap intellectuals associated with NGOs, Unions, performers etc. Hub of Delhi's self styled intelelctuals and their showoff"
Habitat_World_Convention_Centre,Pranav Arneja,5.0 of 5 bubbles,Sep 2015 • Friends,Excellent hub for business/event organizing,"habitat is one place where the shines of the UN/ Business/ Elite is visible from a distant location. The buffet facility is amazing at a decent price.Conducted many Rotary and UN Meetings at this place and each time it was no less than travelling to a world of intellectuals. They have got all the facilities you need, but on request , of course. Bookings be done months ahead in advance as its ledger is pretty damn filled up always "
Habitat_World_Convention_Centre,Sukulpatial,4.0 of 5 bubbles,Jul 2016 • Family,cluster of banquets in south delhi,"Located at the posh location of south delhi , it is one of the most utilized banquet placed in delhi with lush green garden and clean pavements and roads . it is pretty big and has amost 20 venues of different sizes . the best auditorium is liked was the theatre - that was too big and can be distributed too .. all the banquets are named on flowers and this has a good staff . you will always find these busy as it hold maximum corportate meetings and social events . the only bas thing about this place is taxes .. with an additional 10% service charge which is preety high ( amounts to 35% approx ) . it has good banquest with attached open area also .. idle for weddings , corporate meets , cocktail , sangeet ! Jarkanda auditorium is also in my fav list ."
Habitat_World_Convention_Centre,GThapa,5.0 of 5 bubbles,Dec 2015 • Family,IT HAS IT ALL,This place is amazing and provides with a lot of benefits and has been always fascinating and a must visit 
