Tourist Attraction,Name,Rating,Date and criteria,Title,Review
Habitat_World_Convention_Centre,URP70,4.0 of 5 bubbles,Sep 2019,Beautiful heritage building,Loved my stay here inside heritage building. Morning walk and after dinner walks were relaxing. Great location to reach any place in Delhi. Pleasing to eyes with greenery all around. Safe for single women travelers and children too. Children have lot of place to run around and play. Lot of selfie friendly locations.
Habitat_World_Convention_Centre,Sonu Choudhary,5.0 of 5 bubbles,Dec 2018,Very good place for Meetings and Conference,IHC has state of art infrastructure and banquet services. Services provided by IHC compete with 5 Star hotels. Al though IHC has its own brand and status. 
Habitat_World_Convention_Centre,SwagataSN,5.0 of 5 bubbles,Dec 2018,Larger than life,The architecture of the landmark building and the spaces created within that allow merging of indoors with outdoors in unconventional ways makes for very interesting display places and invites people to come experience the space and whatever the display is. The product here becomes a part of the larger canvas that convention center is. 
Habitat_World_Convention_Centre,Jatin Garg,5.0 of 5 bubbles,Dec 2018,Lovely Ambience and Good Restaurants!,This is a good place to organize gatherings and to meet friends over chit chat. American Diner restaurant here is must visit for Breakfast. It is open to general public.
Habitat_World_Convention_Centre,Anjali R,3.0 of 5 bubbles,Dec 2018,Disappointing facilities and food in heritage building,"We stayed in this much talked about Delhi institution for a wedding. While the catering for the wedding was sumptuous and of good quality, the food at the breakfast buffet was awful. The rooms were also very average (for the price ~8K/night) and need upgrading. There was no hot water for a whole morning as well (in the middle of a Delhi winter) - quite surprising for an establishment of this size and reputation. Disappointing. "
Habitat_World_Convention_Centre,Amolak Rattan K,5.0 of 5 bubbles,Oct 2018,"Where art, culture , academics, food and conferences are popular","This centre has excellent facilities for cultural shows, Educational seminars, International and Nationalconferences , Exhibitions for art and craft . They have very good restorants for Indian, Mughlai, Oriental and continental food . Their facilities are top class and food is tasty, delicious and sumptuous .Governor Amolak Rattan Kohli"
Habitat_World_Convention_Centre,Smitpoo,5.0 of 5 bubbles,Oct 2018 • Solo,Eco Convention cetre !!,"It is one of the building planned very well,with lot of space around .Looks  a eco design,with lot of greenery around.Its got lot of government and non government office space..Very good place for any kind of workshops,its got a restaurant also.Planned parking."
Habitat_World_Convention_Centre,Piyush Thakur,5.0 of 5 bubbles,Oct 2018 • Family,The convention centre of Delhi,It's been there for ages. Habitat centre hosts some of the most popular conventions in the country. Apart from that it gives its members am opportunity to book their hall for your own function. They have their own cafeteria for regular visitors. Tip : Come here as part of some function. No point coming to just visit this place 
Habitat_World_Convention_Centre,RAJENDRA884 PRASAD,5.0 of 5 bubbles,Dec 2017 • Friends,Great place for get together!,"We had our school Alumni Get Together at Habitat Center, which was well attended by hundred of old students.  Had a great cultural event in auditorium and later had sumptuous lunch in open lawns."
Habitat_World_Convention_Centre,nikkiprincess005,5.0 of 5 bubbles,Aug 2018 • Friends,Convention Centre,Arts hotel accommodation in convention center and Delhi has a big one in every way. All kinds of people can visit.
Habitat_World_Convention_Centre,Simmurani,4.0 of 5 bubbles,May 2018 • Couples,Iconic,"A lot for some convention centre, the place is full of achievements and certification on major topics, used for gatherings of dignitaries over habitual issues"
Habitat_World_Convention_Centre,advance1984,4.0 of 5 bubbles,Sep 2018 • Couples,Good and big Convention centre,This is very big and beautiful convention centre. This is near to lodi garden. There are some good hotel and art gallery inside the centre.
Habitat_World_Convention_Centre,Sunil K,4.0 of 5 bubbles,Dec 2017 • Family,Nice place!,It is one of the finest convention centres in the country. Both members and non-members can visit here but some accesses meant for members only.
Habitat_World_Convention_Centre,Ashish S,4.0 of 5 bubbles,Aug 2018 • Family,Great place to visit,It's situated on the Lodhi road. This World convention center is an amazing place to visit. It's very neat and clean place.
Habitat_World_Convention_Centre,Jhoomer S,4.0 of 5 bubbles,Aug 2018,Cultural hub,American diner in IHC is what draws us to this place so often and we have always enjoyed exploring various art exhibitions and activities happening here while on our visit. 
Habitat_World_Convention_Centre,Amolak Rattan K,5.0 of 5 bubbles,Mar 2018 • Friends,Multipurpose Facility,"If in Delhi you can enjoy in this place with good food , cultural performances,and attend seminars and conferences on highly relevant topics . Rooms are available to members and their guests and they are well maintained and good quality .Amolak Rattan KohliFormer Governor of Mizoram"
Habitat_World_Convention_Centre,9708372852a,5.0 of 5 bubbles,Jun 2018 • Couples,A place full of crowd,This place was packed by crowd during my visit. But the food served in the cafetaria to me just awesome. I will say that this place is really a very good place to visit.
Habitat_World_Convention_Centre,KimayaSen,4.0 of 5 bubbles,Jun 2018,Good experience,"I went with my friends. Ate in the food court. Though the place was crowded and noisy, enjoyed the food. A good place to hang out with your friends."
Habitat_World_Convention_Centre,Varun497414,4.0 of 5 bubbles,Oct 2017 • Business,Very v great and memorable exp...,Everything was perfect and also rooms were very clean and georgeous service facilities we had in the pearl hotel. It was the great joyfull experience to stay in that perticular hotel and we suggest our colleauges to visit that hotel in future.
Habitat_World_Convention_Centre,Stanthorpe,4.0 of 5 bubbles,Apr 2018 • Couples,World Rural Health conference,This venue was convenient and functional with many room options for concurrent sessions and a large meeting room. 
Habitat_World_Convention_Centre,Vikas G,4.0 of 5 bubbles,Apr 2018 • Friends,One of the best convention centre in Delhi,Recently visited this place for a training programme and must say that this is one of the best convention centres in entire delhi... A lot many reputed formal functions are organised at this venue on a daily basis... 
Habitat_World_Convention_Centre,Vivek M,5.0 of 5 bubbles,Dec 2017 • Couples,A happening place all round the year,"Centrally located, this place is a hub of multi-activity hub for the music lovers, socialites, art lovers and people with a very fine taste and dignity.I just love it."
Habitat_World_Convention_Centre,Kumkumjaipur,4.0 of 5 bubbles,Apr 2018 • Business,Good place for a conference,"Habitat centre is a good place for conferences as it has many halls and they do outdoor catering, though it gets a little hot in summers."
Habitat_World_Convention_Centre,PushExplore,5.0 of 5 bubbles,Mar 2018 • Family,Beautiful Building,A visit to the Habitat World CC was very nice and pleasant. Met a friend who had invited us for coffee. The place is really nice and well maintained.
Habitat_World_Convention_Centre,mehtarakeshkumar56,5.0 of 5 bubbles,Apr 2018 • Solo,convention centre,"the convention center is famous for its restaurants , seminars organised in its lawns and auditorium  . situated on the lodi road. "
Habitat_World_Convention_Centre,MrSilverfox007,5.0 of 5 bubbles,Feb 2018 • Business,india habitat,"my place for last 15  yrs to India.i use to stay here for 14 days at a time , when there were no good hotels around in Delhi as we use to have all our conventions here"
Habitat_World_Convention_Centre,Myrddin,3.0 of 5 bubbles,Mar 2018 • Couples,an amazing place,"we thought we weren't allowed in as there is an official looking guard post at the entrance, but we were.  It's an interesting building but unless you are going for something in particular, not worth the effort"
Habitat_World_Convention_Centre,Travel_BaBa,4.0 of 5 bubbles,Jul 2017 • Solo,Place has an aura of its own,"This is located in the lodhi colony area. This place has an aura of its own. Lots of greenery around and many arts/paintings all around the campus. There is an art gallery right at the entrance of the centre. Once you are inside there is a huge open central area around which there are many halls and offices. There are restaurants as well inside the centre. There is ample of parking space available.This place houses many events almost on a daily basis. A very popular place for conferences and high-level events, etc.A must visit if you are in that area."
Habitat_World_Convention_Centre,suneel g,5.0 of 5 bubbles,Jan 2018 • Solo,"good place to read,eat and  for view exhibitions",There is a library inside this center. Many restaurants are located inside the campus.The glass roof top looks amazing
Habitat_World_Convention_Centre,Sunny Jnr,5.0 of 5 bubbles,Feb 2018 • Couples,That's India Sir ,"One of the most famous Hotels in India. It is a must to come here. Very nice Place... famous for business meetings. Security checks everywhere, but you feel them not really. The market is next door it only few minutes walking. Restaurants a nice but you will find all around the Hotel several other great restaurants. I just came out from Dehradun and I must say I love India it is strange to drive here but it's India Sir...so my Driver. Great Place with great people and food. Only a one day stop... going further to Mumbai"
Habitat_World_Convention_Centre,isha saxena,4.0 of 5 bubbles,Aug 2017 • Solo,IHC - artsy and all,"India habitat centre hosts so many art exhibitions, installations, houses offices, a library and of course the All American Diner which is the premier place for breakfasts. Located on Lodhi Road, this huge complex is characterized by its symmetric glass ceiling and a lot of foot fall thanks to the food court, Eatopia and the All American Diner."
Habitat_World_Convention_Centre,Sanjit M,5.0 of 5 bubbles,May 2017 • Business,Nice place for business meet,"This is very nice place to organize business meetings. They have nice conference rooms, auditoriums, etc. The food served was also  very nice."
Habitat_World_Convention_Centre,sukhi504,4.0 of 5 bubbles,Dec 2017,strikingly distinct,"very popular place for those connected with literary , creative and conferencing activities . locals also find it convenient due to canteen comfort. "
Habitat_World_Convention_Centre,kmanish08,4.0 of 5 bubbles,Nov 2017 • Friends,Old world charm !!!!!,"one of the most well knows addresses in delhi, India Habitat center is a must visit for all.. place to hold conferences and seminars, the place always buzzes people performing in open amphitheater and hungry birds grabbing bites at eatopia and american diner...."
Habitat_World_Convention_Centre,ALOK ANAND,5.0 of 5 bubbles,Jul 2017 • Family,Excellent place to visit with Family and Friends,"This indeed is an excellent place to visit with friends and family. You can go for brunch, lunch and Dinner. Good place to see art galleries "
Habitat_World_Convention_Centre,bindu2016,5.0 of 5 bubbles,Nov 2017 • Family,Great place,It is a great place to visit for plays and art.  It is such a happening place and have very nice restaurants for get together.
Habitat_World_Convention_Centre,kamakshi2015,4.0 of 5 bubbles,Sep 2017 • Solo,The venue of classy events !,Any well known academic / art event in Delhi is generally organized here . The beautiful convention hall and the sprawling surroundings enough room from a huge number if people . The canteen in the premises offers a great choice of foods veg/ non veg . The location on the well known upscale Lodi road adds to its charm . 
Habitat_World_Convention_Centre,Karan Sachan,5.0 of 5 bubbles,Oct 2017 • Couples,Very happening place,"I really love this place, it's very modern yet very traditional too, in restaurant food is delicious and art galleries are fabulous. Overall it's one of the best place in Delhi to hang out.. :))"
Habitat_World_Convention_Centre,deepakbhatia57,5.0 of 5 bubbles,Nov 2016 • Family,A HAPPENING PLACE !,Convenient location; good food at American Diner; rooms are exclusive to members and their guests and expensive. Buffet dinner with our selection of dishes was very good and at reasonable rates.Cultural events and private functions being held at various venues.
Habitat_World_Convention_Centre,echowa,4.0 of 5 bubbles,Mar 2017 • Friends,Great place to hang out,Standard restaurants.Quality food.Interesting events.Meeting place with friends and colleagues.Sparkling conversations.
Habitat_World_Convention_Centre,Mehmoodmewat,5.0 of 5 bubbles,Aug 2017 • Business,Conference ,Had gone to attend a conference.This place is very professionally managed.Free parking.Good place for networking 
Habitat_World_Convention_Centre,Maneesh12345,5.0 of 5 bubbles,Sep 2017 • Friends,Good Place to view plays,"ou can go there and watch plays performed by various artists and many other cultural events that keep on happening there each coming day. Other than these events, the restaurant/cafeteria - EATOPIA - at this place is just awesome! Have some good food, good cakes or take a coffee and just enjoy the peace outside! Love this place!"
Habitat_World_Convention_Centre,Kumar S,4.0 of 5 bubbles,Aug 2017 • Business,Habitat World Convenient Centre,Visited this place for a business meeting and it was quite a pleasant surprise to know such convention centre was here in Delhi. Big and well maintained. Couple of restaurants located inside the campus. 
Habitat_World_Convention_Centre,Sreejesh Neelanath,4.0 of 5 bubbles,Jun 2017 • Business,Business visit in June 2017,Had stayed here for a night during June 2017. It is a cozy room with all necessary amenities close to the heart of the city. The served dinner at very late night. Breakfast was also very good.
Habitat_World_Convention_Centre,Lalit Surjan,5.0 of 5 bubbles,Aug 2017 • Solo,A Major Attraction In Delhi,"India Habitat Centre is one of the major attractions in the capital city of India, not only for its architectural beauty but also for its activities. It is known for a whole range of socio-cultural activities. There is an art gallery, a theatre, an amphitheatre, moving photography/ picture exhibitions and lot more. A number of seminars and workshops take place here. There are two restaurants open for general public. The Eatopia is multi-cuisine and it is not costly. A part of centre houses a hotel only for its members or their guests."
Habitat_World_Convention_Centre,charlessthomson,4.0 of 5 bubbles,Jun 2017 • Business,Great food court but hidden,Make sure you ask someone to show you the food court which is fairly hidden within this complex.  There is an American Dinner too but service is hopeless and charges far too high.
Habitat_World_Convention_Centre,nishantvermaphoto,4.0 of 5 bubbles,Aug 2017,Great Place to hang out in Delhi,This place has two restaurants open for public (Eatopia and American Diner) and 1 is only for members.  Bollywood Movie Rang de Basanti was shot here. The Art / Photo Gallery is a must visit. The Food here is fairly ok.  
Habitat_World_Convention_Centre,Lokamitra,4.0 of 5 bubbles,Aug 2017 • Solo,Conference visit,"This facility was built many, many years ago yet is more wheelchair accessible than even the most modern buildings in India.It has an excellent little cafe and a good art gallery."
Habitat_World_Convention_Centre,madwhop,5.0 of 5 bubbles,Jul 2017 • Family,Culture Hub,"If your are attracted to art and culture, this is the place for you. There is generally always an art or sculpture exhibition on. You can check out the calendar and catch plays or recitals in the auditoriums. It can also serve as a hang out with eateries conveniently located in the complex"
Habitat_World_Convention_Centre,gomc77,5.0 of 5 bubbles,Jun 2017 • Business,Multi-faceted campus with class and ambience,"The India Habitat Centre, as I came to know it, was the opening experience for my summer practicum in New Delhi. A large, multi-faceted campus, the centre is a work of art unto itself. Featuring a variety of spaces for meetings, seminars, and other group events, the offices and business structures interplay with art, architecture, and a graceful indoor-outdoor pavilion. Inside, the rooms of the IHC are well-lit and maintained, with plenty of space for your needs. Meeting rooms are closely connected with public conveniences and dining areas.Personally, I was also a bit starstruck by the various organizations that call IHC offices home. The overall feeling of the campus is one of professionalism and inspirational artistry. I highly recommend a visit, even if only to enjoy a meal and a walk of the grounds."
Habitat_World_Convention_Centre,268yusufn,5.0 of 5 bubbles,Apr 2017 • Friends,EVENTS,Its one of the bet places in Delhi. Many Events keep happing and its load of fun to be at Habitat Center.
Habitat_World_Convention_Centre,SMFirstTrip,4.0 of 5 bubbles,Jan 2017 • Friends,World class place of Seminars / Conference / Business Meetings,Great amenities and facilities available to conduct any Seminars / Conference / Business Meetings.  Nice Ambience and enough space for large gatherings.
Habitat_World_Convention_Centre,sonalpmalhotra,5.0 of 5 bubbles,Jun 2017,best place to relax with culture,culture plus good food plus excellent environment make for a perfect evening. Habitat center is just the place for that!
Habitat_World_Convention_Centre,PoojaSumit,4.0 of 5 bubbles,Apr 2017 • Business,Professional ambience ,The Centre is well equipped for meetings and conventions. It has ample space for large gatherings. Food is great and free undeground parking makes it convenient for visitors. Its our Preferred location for business meetings. 
Habitat_World_Convention_Centre,Anjali,4.0 of 5 bubbles,Jun 2017,Good venue,"Free parking, lovely architecture.Very well managed. Staff is polite. Spacious halls and auditorium."
Habitat_World_Convention_Centre,sandeepkumarindia,5.0 of 5 bubbles,Nov 2016 • Family,A very modern place displaying Art and Culture,The building is very well built allowing light and air to flow easily through it. The place would always have some exhibition of art and culture happening through out the year. It has got open space for theater artists as well as many auditoriums and convention halls. 
Habitat_World_Convention_Centre,Gugan_Ilango,4.0 of 5 bubbles,May 2017 • Solo,A beautiful Convention Centre,"Habitat World Convention Centre Near Airforce Bal Bharati School, is a beautiful place with a great architecture attached to the building"
Habitat_World_Convention_Centre,verenmitter,5.0 of 5 bubbles,Apr 2017 • Family,Excellent place and architecture,Good place to witness Delhi art and architecture. reminds me of Delhi of 1980s. Good galleries with a very good convention hall and auditorium.
Habitat_World_Convention_Centre,Garima A,5.0 of 5 bubbles,Jun 2016 • Business,v good,good place. must to see in delhi. nice ambi. nice weather. be sure to visit. prime delhi location...
Habitat_World_Convention_Centre,KhwajaSaif,4.0 of 5 bubbles,Feb 2017 • Business,Centrally located for Business needs,"a good place to organize small business gatherings , the catering is very basic but does the job . main advantage is the ease of accessibility"
Habitat_World_Convention_Centre,anonymus688,3.0 of 5 bubbles,Apr 2017 • Business,very posh,and possibly suitable for those who wish to distance themselves from the hustle and bustle. That's all. Personally I prefer the street food and opportunities. 
Habitat_World_Convention_Centre,Sadhan M,4.0 of 5 bubbles,Mar 2017 • Family,An excellent place to meet and discuss,"India Habitat Centre is really an excellent place to met and discuss. As a participant in a meeting( organised by The Masterkey, we had good arrangement to sit with microphone system. The lunch was very good and the service of the Centre, both during our meeting and during lunch. I found the staff very cooperative and obliging. Next month we shall have another bigger conference there with the participation several important people to discuss the details of the Insolvency and bankruptcy code 2016, recently pass by Parliament. "
Habitat_World_Convention_Centre,anithaaravamuthan,4.0 of 5 bubbles,Mar 2017 • Family,Good place!!!,"The place is very good and sitar, tabla recitals was amazing. The dance performances was also too good. Wonderful venue."
Habitat_World_Convention_Centre,26carol2015,4.0 of 5 bubbles,Mar 2017 • Solo,Stein Auditorium wonderful venue but lacks a decent bar.,"I visited the Indian Habitat Centre on 3 occasions in late Feb early March. The Sitar and Tabla recitals were tremendous and the Traditional Dance pwerformances were really good. I also enjoyed a couple of the exhibitions one in particular on The Himalayas stand out. The only thing lacking is somewhere to enjoy good food and a drink, if you are a member of the IHC you have more options. I ate at both the American Diner and Eatopia neither were good. A fantastic venue let down by poor eating choices for visitors."
Habitat_World_Convention_Centre,Rajeshwar Dayal Mathur,4.0 of 5 bubbles,Jan 2017 • Family,Great Location and Great place.,"I ahd arranged a private party at the Juniper hall last month to celeberate my son's engagement. We were happy with the arrangements. The food was good and service was also very good.I would personally like to place on record our appreciation of the hard work Team IHC did to make our event a grand sucesses, particularly Ms Sushmita Sagar (Sales), Arun Yadav, Shushant and Hemant.Thank you Team IHC."
Habitat_World_Convention_Centre,Parimal S,5.0 of 5 bubbles,Jan 2017 • Solo,A very good place for business gatherings,Had an opportunity to get a government organized training at Habitat world convention center. It is perfectly located. A very good place to organize national and international workshops/seminars/training/business meetings as all infrastructure required is available here. They serve good food as well..
Habitat_World_Convention_Centre,vipinantil,5.0 of 5 bubbles,Jul 2016 • Friends,One of the finest architectures of Delhi.,"I have been here multiple times and this place has not disappointed me even a single time. It has beautiful art and crafts galleries, open-air restaurants, open space for stage plays etc."
Habitat_World_Convention_Centre,Nikhiiil,4.0 of 5 bubbles,Jan 2017 • Family,GREAT PLACE,Great place to hangout with family and friends . This place has a good restaurants and the venue for the best theatre in town
Habitat_World_Convention_Centre,Punavuorenkatu,5.0 of 5 bubbles,Mar 2016,Culture,"Been here many times attending concerts with indian music, most of them classical and of high standard. "
Habitat_World_Convention_Centre,AVEMEADOWS Vagamon,5.0 of 5 bubbles,Feb 2016 • Friends,best place for conferences and functions,"Best experience with cultural festivals, variety of restaurants and small and big convention/conference facilities"
Habitat_World_Convention_Centre,Geoffrey C,5.0 of 5 bubbles,Jan 2016 • Business,World-class conference and convention venue,"The Habitat Centre is one of the best multi-feature convention centres I have visited. The facilities in the conference halls and smaller rooms are excellent, and the catering is always high quality. The location is very convenient and easily accessible. It has a good range of halls and rooms, to suit almost any size of event. The main hall has great acoustics for concerts."
Habitat_World_Convention_Centre,King2212,5.0 of 5 bubbles,Nov 2016 • Business,My meeting place,"This place is buzzing with seminars, weddings, restaurants and convention facilities. I had one of my meetings here and this place was not far from Red Maple. I liked their bar after a hectic day at the seminar. The food is good and offers a lot of variety "
Habitat_World_Convention_Centre,Sahdeep S,5.0 of 5 bubbles,Oct 2016 • Friends,Luxury in Legacy+Art+Architecture+Quiet+Business,What a place to be in..you are attracted to these cluster of buildings even if you pass by..Can make a combo with visit to Art Galleries with business dinners.Don't forget to spend some time at Main gate with swinging bell structure..mesmerising
Habitat_World_Convention_Centre,rabhat2013,4.0 of 5 bubbles,Nov 2016 • Couples,A place full of activity,"Its a place where a large number of offices are housed.Place has a number of art galaries wher some or the other exhibition or art& craft display is enjoyable.It has a number of eating places. American Diner is a good eating place for any meal.Greenary around building and building itself is quite attractive,"
Habitat_World_Convention_Centre,Himanshu G,4.0 of 5 bubbles,Dec 2016 • Business,Beautiful,"Very greatly build architecture. Visited there for an International Conference, everything is just outstanding. Great place for corporate."
Habitat_World_Convention_Centre,Deepali P,5.0 of 5 bubbles,Dec 2016 • Friends,Beautiful Architecture!,A must visit place for all architecture and art lovers!! Very nice places open and semi open just to hang around!!
