Tourist Attraction,Name,Rating,Date and criteria,Title,Review
Humayun_s_Tomb,SEEDJEN,5.0 of 5 bubbles,Feb 2023 • Couples,A beautiful & impressive heritage site,"This tomb of the Mughal emperor Humayun, an almost 500 year old UNESCO site is a very impressive place in scale  and design. You will marvel at the skilled craftsmanship of the work on show in trellis stone lattice windows & geometric designs, and ingenuity of the Persian architecture of Mirak Mirza Ghiyas. It is set in a large garden with some very old trees dotted around creating an oasis of peace juxtaposed with the busy city streets outside. There are other interesting structures to visit in the complex."
Humayun_s_Tomb,David D,5.0 of 5 bubbles,Jan 2023,The first of the great Mughal era tombs.,"Humayun inherited the Mughal Empire, then lost it, fled into exile with his wife and a small group of soldiers, made friends with the Safavid Shah of Persia and traded a priceless diamond for an army, which he then used to take his empire back. He trusted everyone around him and nearly everyone betrayed his trust, but despite his trusting nature, he died the prosperous ruler of one of the largest empires on earth at the time. His wife went on the Haij pilgrimage to Mecca and then built this tomb in his honour from her own treasures. The tomb complex is also historically important in that it was where the last Mughal Emperor was actually captured by the British in 1857. The tomb complex also houses other tombs, such as those of Isa Khan, who predated Humayun’s rule in Delhi."
Humayun_s_Tomb,Ambassador435631,5.0 of 5 bubbles,Dec 2022,Beautiful monument,"A very beautiful monument, so huge, the grounds are beautiful as well. We could have easily spent 3-4 hours marvelling at this wonder. Don't miss this!"
Humayun_s_Tomb,Hanzik von Tutenschwarz,5.0 of 5 bubbles,Jan 2023,Baby Taj Mahal that's worth the price,"Very interesting experience. The area is quite well maintained. Takes around an hour or two to walk around. You can go all the way inside the tomb. Around 50 Rs for locals, 600 Rs for foreigners (I think it's 550 Rs if you buy the ticket online, but I don't know where you can do that). You can take everything with you, there seems to be no restrictions on cameras and bags.Combined with a visit to the Sunder Nursery across the street, this was a lovely afternoon."
Humayun_s_Tomb,Shil P,4.0 of 5 bubbles,Dec 2022,Great history,Such beautiful grounds that we didn't realize the importance of and almost didn't stop to see. I highly recommend paying a little extra for one of the official tour guides. The history of the moghuls who came to India and this site being the inspiration for the Taj Mahal was just amazing. Highly recommend this on your tour of Delhi.
Humayun_s_Tomb,Anika S,5.0 of 5 bubbles,Dec 2022 • Family,A monument built by Emperor Humayun's wife in his memory.,Humayun's tomb is the tomb of the Mughal Emperor Humayun .It is a monument built by his wife in his memory. It is UNESCO world heritage site and was built before the more renowned and another famous Mughal monument Taj Mahal. It's ay Nizamuddin area near the mosque opp Sunder Nursery.
Humayun_s_Tomb,Majdalina,5.0 of 5 bubbles,Dec 2022 • Friends,Beautiful,Taj Mahal precursor - with over 100 tombsGo before 4:00 PM because some gates inside close by 5:00 PM although it remains open to visitors
Humayun_s_Tomb,Sarah Afker,5.0 of 5 bubbles,Dec 2022 • Friends,Oh the architecture ,"This is a breathtaking mausoleum in the hub of Central Delhi. The architecture is splendid and I would recommend carrying water and being wary of fake guides and pick pocketers. This is a must see when in Delhi, nothing quite made my trip than the visit to the Humayun's Tomb"
Humayun_s_Tomb,singhasam,4.0 of 5 bubbles,Nov 2022,The first garden tomb on the Indian sub-continent.,"THIS is the tomb of the Mughal emperor Humayun.It was built in 1570, is the first garden tomb on the Indian sub-continent and the site is a Unesco World Heritage monument.When you arrive you walk into the site through an archway flanked by trees.Visitors then walk down a stone drive towards the main tomb area which can be viewed on several levels.Times are different post-Covid and all the waterways around the site which used to be full are currently empty on Government orders as part of efforts to combat the virus. You have to imagine the tinkle of water or the look of reflections.The main white marble dome is impressive and rises more than 150ft.It is possible to climb very steep stone steps to get out on to a terrace overlooking the gardens, but be warned. There are handrails but the climb needs care particularly if you are elderly or disabled.Inside the main building itself are several tombs with graceful stone and marble work and fretted stone windows.The structure is a combination of Persian, Turkish and Indian architecture and was commissioned by Humayun's first wife and consort, the Empress Bega Begum.Keep an eye out when you wander round the gardens because a wealth of birdlife lives there. I even saw a Brown Kite come down to drink at a point where lawns were being watered.A very peaceful place and well worth a visit."
Humayun_s_Tomb,Woodstag,4.0 of 5 bubbles,Oct 2022,Great Mughal Tomb Garden Place to visit,"Interesting place to visit and explore this first garden Mughal tomb built in memory of his wife and inspired several major architectural innovations, culminating in the construction of the Taj Mahal and other Mughal architectures. Great place to walk around and having a guide to explain the history."
Humayun_s_Tomb,vyasch,4.0 of 5 bubbles,Oct 2022,A different in the line of Mughal monuments,"A different in the line of Mughal monuments, commissioned by a wife in memory of her husband. It gives a little sad feeling when one circles around the tomb.A very few structure has this good platform. The structure looks the same from all the side, surprisingly and unfortunately.Had this monument been built in marble, it would have been one of the seven wonders of the world but perhaps, it doesn't have the kind of legends the Taj Mahal has with it."
Humayun_s_Tomb,Smarthitech,1.0 of 5 bubbles,Sep 2022,Wastage of Money,"If anyone is planning to go there please don't. According to my experience, you should only go there when you think that it is an ancient monument and must visit once otherwise there is no fun even a park is better than this and let me make you clear you need to pay 40 rs per person if you go there, Instead, I will suggest you the newly developed park just opposite Humayun's tomb and that will be more enjoying."
Humayun_s_Tomb,AlGr1990,5.0 of 5 bubbles,Oct 2022 • Friends,Interesting,Interesting place to explore. Nice museum explains the conservation efforts. Spend a couple of hours here. Sunset brings out the colour of the stone well.
Humayun_s_Tomb,Wanderlust Family,4.0 of 5 bubbles,Sep 2022 • Friends,"Awe inspiring architecture, culture & history","One of the most impressive sites & must visit monuments of the Mughal Empire. A Beautiful love story, awe inspiring architecture, culture and a divine aura of an ancient an opulent past. It really is amazing, so much to soak in & see. The good thing about this place is unlike Taj Mahal, it is not so crowded."
Humayun_s_Tomb,Federico,5.0 of 5 bubbles,Oct 2022 • Couples,A must-see in Delhi!,"A must-see landmark in Delhi.Humayun's Tomb compares to the Taj Mahal in Agra, sharing a lot of architectural similarities and deep roots in the Mughal dynasty.Highly recommend to hire a guide to fully appreciate the history behind the site."
Humayun_s_Tomb,Travellertohelp,5.0 of 5 bubbles,Oct 2022 • Family,What a beauty..!,I'm leaving full stars review for this monument because Humayun's Tomb exceeded my expectations. My experience for the first time in mughal monument after the Taj and I'm pretty impressed.For me is still a big question in my mind how they built these massive monuments back in the days.All of them are just Wow factor.
Humayun_s_Tomb,Marc R,5.0 of 5 bubbles,Sep 2022,favorite thing to see during layover,"Great pictures here, well managed. A security guard did follow me around wanting to take my picture for tip money, midday the sun could be intense and right outside the entrance lot of local people trying to aggressively sell you souvenirs, which could be overwhelming."
Humayun_s_Tomb,Lakshmi Biradar,5.0 of 5 bubbles,Oct 2021 • Solo,Great Asian and Persian architecture,"Humayun's tomb is the tomb of the Mughal Emperor Humayun in Delhi. It was the first garden-tomb on the India. It was also the first structure to use red sandstone at such a scale. It which houses the graves of Empress Bega Begum, Hamida Begum, and also Dara Shikoh, great-great-grandson of Humayun and son of the later Emperor Shah Jahan. It designed using Asian and Persian architecture."
Humayun_s_Tomb,pragati9,5.0 of 5 bubbles,Jul 2022 • Family,Uncrowded and well maintained.,"Uncrowded,calm and magnificent.Worth visiting solo or with family.Maintaince is good though the stairs leading to first floor are bit high and can cause problem to small kids and elderly visitors.An interactive tour using VR or audio guide or video  presentation to relate History of the place would make it more attractive to students and others too."
Humayun_s_Tomb,AnisMajid,5.0 of 5 bubbles,Aug 2022 • Family,Amazing tour to the old & new Delhi,Have a great experience to have a tour in the hiatorical place in Delhi.Our tour guide Mr Sunil help us to explore the old & the new delhi.Thanks so much for the great hospitality and really recommended to have Mr Sunil as your tour guide.
Humayun_s_Tomb,Ella,5.0 of 5 bubbles,Jul 2022 • Couples,Amazing place,"Humayun the second of great Mughal ruler honored his favorite barber with a beautiful tomb, located next to his very own magnificent mausoleum.Its proximity to the main tomb and the fact that it is the only other structure within the main tomb complex suggests its importance, however there are no inscriptions suggesting as to who is interred therein, the name Barbers tomb is the local name of the structure, hence still in use."
Humayun_s_Tomb,pri12,4.0 of 5 bubbles,Aug 2022 • Family,Nice,Nothing much great.it just tomb of humayun...nice garden..ticket are there for entry..half an hour is ok..beautifuly constructed 
Humayun_s_Tomb,Abhay,4.0 of 5 bubbles,Sep 2021,Must visit in Delhi,"A beautiful memorial place with lots to see around and relax in the parks. Can be done on your own but if you want to dive into history, do hire a guide.Though, not recommended to visit in Summer."
Humayun_s_Tomb,AlnmouthFan,5.0 of 5 bubbles,Aug 2022 • Family,Variety of building to look round,Lots to see and wander around on your own. No need for guides. Good shady areas to rest from heat and really relaxed place.
Humayun_s_Tomb,Michaela B,4.0 of 5 bubbles,Aug 2022 • Couples,Beautiful monument and interesting tour,"We had a guide as part of our tour and it was very informative and helpful. By yourself, you can appreciate the site, but not the history so much."
Humayun_s_Tomb,Bade C,4.0 of 5 bubbles,Mar 2022 • Friends,Amazing place,"I visited Humayun tomb 2nd time or more then that,. All time it is best favourite place for me❣️Nace Nature vew and place is in peace.Best place for visit with family and friends.Must visit here."
Humayun_s_Tomb,Ron,3.0 of 5 bubbles,Jun 2022 • Business,Interesting but needs some TLC,It’s surprising to see monument of this magnitude in center of Delhi in rather poor shape. Government should spend some money to spruce up this place. Overall Delhi is least impressive of the golden triangle places.
Humayun_s_Tomb,EastTNVol,5.0 of 5 bubbles,Apr 2022 • Friends,"Rich Cultural Experience, in the Heart of Delhi","This was a very interesting site to visit.  Several people to whom I sent photos assumed it was the Taj Mahal, which allowed for a discussion on the differences between the two sites.  I especially enjoyed comparing the two sites, with the differences between the red stone and white marble.  Note when planning a visit that the stairs leading up to the building are very steep. "
Humayun_s_Tomb,Achal N,4.0 of 5 bubbles,Nov 2021 • Family,"Beautiful, Relaxing Monument","Beautiful monument indeed. Looks more like a mini Taj Mahal of a different shade. The surroundings of the monument are well maintained and clean. Outside the compound it's a whole different story. Good place to walk around and rest too. There's also another tomb at the entrance with another small monument. If you're not planning on relaxing, nothing much to do here. Avoid visiting during afternoons, extreme heat. The entrance and the route leading upto the monument could've been slightly better. There was some sort of construction/renovation works going on at a stretch, things might be better now."
Humayun_s_Tomb,Moniesha V,2.0 of 5 bubbles,Dec 2021,Could skip it,"Firstly, it isn't well maintained. There is no water as shown in the picture. It is just a good place to take a stroll and some pictures and nothing much. The only thing I liked there was the upper area (terrace) and the view that you get of the entire place. The inside of the tomb is blocked."
Humayun_s_Tomb,Niket Kumar Dixit,3.0 of 5 bubbles,Dec 2021 • Family,"Must visit, but place can be better managed. ","Had really high hopes from this place as always saw this place in history books. However, got really pained by the mismanagement at this Unesco world heritage. Guides were not there. However, still recommend this for a quick visit. "
Humayun_s_Tomb,Shubhanshu B,5.0 of 5 bubbles,Dec 2021,Absolutely Amazing!,"A clean, green and serene place in the middle of the city. Truly grand at scale that can't be imagined from its photos/videos. Easy to reach from JLN metro station (the nearest), there are absolutely no prearrangements required. Can scan and pay for tickets at the entry (Rs 70 for Indians). Carry essential food/water as there is no kiosk/eateries inside the complex. Washroom facility is available. Guards double down as guides and happy to share what they know about history. Maps/artefacts/stories have been maintained to make it historically interesting. The best part is access to first floor of the main tomb (huge open area with great visibility, ideal for winters). Rich artistic roof work and intricate wall angles make it an architectural marvel. People not comfortable with steep stairs and long walks may want to avoid. Ideal for dates, families, shoots, and spending quiet quality time. Overall, a fulfilling 2 hour place :)"
Humayun_s_Tomb,Laura R,4.0 of 5 bubbles,Nov 2021 • Solo,Honest doorman ,It is a great construction and a very beautiful place to visit! I payed the full fee but then the doorman came running after me and gave me my money back because tourist come in for free that day.... that was such an honest thing yo do 😊 very nice 
Humayun_s_Tomb,Jon,5.0 of 5 bubbles,Oct 2021 • Family,Our favorite sight in Delhi!,"What a great place to visit - as many others have said, it is an oasis of calm and beauty.  The architecture is fantastic and surrounding buildings and tombs are equally lovely.   While everyone is struggling for the perfect picture from the entrance side, be patient and walk all the way around the building from the same distance - you’ll find fantastic views with fewer/no people in your shots!  Great history to boot - read up a bit first to truly appreciate just how special this place is."
Humayun_s_Tomb,Vaidehi15,4.0 of 5 bubbles,Nov 2021,A place for History lovers,"Beautiful Memorial place to visit. Especially if you are fond of understanding the history & love watching beautiful view.It requires around 1 hour to see the complete site. Do plan your visit with other monuments, as all can be covered together."
Humayun_s_Tomb,Avik Mukherjee,5.0 of 5 bubbles,Oct 2021 • Family,A must visit place,"The first Mughal architecture in India, developed by great Akbar. And the same was copied at Taj Mahal.  A must visit Entry ticket is there"
Humayun_s_Tomb,Maximilian,3.0 of 5 bubbles,Nov 2021 • Couples,Nice but the prices for Foreigners are to high!,The place is really fantastic!It’s a huge area with great parks and a lot of animals. Why I only give 3 Stars? Because the price for tourists are 12x times higher then for locals and you are not allowed to bring a small attached microphone on your camera! Sorry guys that makes no sense!And advertising with a discount 50 Rupies of by Card Payment but not providing the Option is a real no go!
Humayun_s_Tomb,Fran-Svk,5.0 of 5 bubbles,Oct 2021,Nice place,"Very nice place (cause it is quiet and clean;). First of all wanna say that this area contains several ancient buildings: Humayun's tomb, Barber's tomb, Nila Gumbad, Isa Khan Mausoleum,Afsarwala mausoleum and Bu Halima's mausoleum. and make no sense to separate it or rate it separately. It's like big park with walls and buildings. good place to rest on sunday morning.special entry fee for foreigners: 600rupees."
Humayun_s_Tomb,Kumar G,4.0 of 5 bubbles,Aug 2021,Restored gem,"On the last day, as we had time to spare, we visited Humayun's tomb, which is undergoing restoration.  It is slowly rejuvenating"
Humayun_s_Tomb,FirenzeMamma,5.0 of 5 bubbles,Oct 2020,Don’t miss this if you’re in Delhi,"This is a wonderful building, less visited than some of the other highlights of Delhi. It’s a great example of Mughal architecture which anyone interested in such buildings should definitely make the effort to see."
Humayun_s_Tomb,Bidule05,5.0 of 5 bubbles,May 2020,Isabelle (France),"We visited the Mughal Emperor Humayun's garden tomb, which is a UNESCO World Heritage, being built in 1570. It's the first garden tomb, that has been built in India.We were impressed by this dazzling octogonal mausoleum in the early Mughal architectural style. We saw that the mausoleum was surmounted by a double dome 42.5 meter high, clad in marble with colonnaded kiosksAltogether, I highly recommend to visit wonderful Humayun's garden tomb, whose early Mughal architecture will later lead to the construction of the Taj Mahal!!!"
Humayun_s_Tomb,Country adventurer,5.0 of 5 bubbles,Feb 2021 • Solo,A beautiful place to spend a pleasant day,The place is actually amazing. u can see the perfection of the architecture and the greenary is amazing. Photographers can have a perfect shot.A great to visit with friends as well as  family.The complex is clean.
Humayun_s_Tomb,aur1408,5.0 of 5 bubbles,Feb 2021 • Friends,Monument looks amazing with lights,Recently ASI has done excellent work by doing lighting to the monument. It is till 9pm . Mist visit when you are in delhi . Nearby you can also visit Sundhar Nursery
Humayun_s_Tomb,skagarwal74,4.0 of 5 bubbles,Mar 2021,Good architecture,Nearest metro station to Humayun Tomb is JLN stadium.Ticket for 35 can be purchased using mobile scan and pay also.The Tomb and the garden around is beautiful and well maintained. The place is attractive and good for photography.
Humayun_s_Tomb,Amit mehla,5.0 of 5 bubbles,Feb 2021 • Business,Good,Humayun tomb was very good and its was very near to metro station also it's outer delhi so you can't face any traffic
Humayun_s_Tomb,MedhaviG,5.0 of 5 bubbles,Apr 2020 • Friends,Must see ,"This tomb is just as grand as the Taj Mahal, and it’s history is just as interesting. Must visit when in Delhi."
Humayun_s_Tomb,Gur Jeff H,4.0 of 5 bubbles,Dec 2020,Well worth the short visit and photo-op,"Also known as the Mini Taj Mahal. This site is well worth visiting. You must have cell phone reception the only way to buy tickets is via cell phone now. There are guides inside that will show you around for a tip. The inside is impressive but neglected, on a good sunny day it's a great photo opportunity. All-in maybe 45 minutes tour."
Humayun_s_Tomb,Veronica J,3.0 of 5 bubbles,Dec 2020 • Friends,Quick tour ,We visited this sight and had difficulty purchasing the ticket because we didn’t have cell phone connection. You must buy online and provide Passport for ID. Be aware of staff pretending to help guide you then wanting payment. Was interesting trip and I’d recommend going. 
Humayun_s_Tomb,Chanchal,5.0 of 5 bubbles,Dec 2020 • Couples,Flawless,This on mentioned that inspired the Taj is magnanimous and beautiful. Imagine a Taj in red sandstone. It is located in one of the busiest parts of Delhi however the moment you go in you Step into a Different world. Must see .
Humayun_s_Tomb,pawandeep@1990,5.0 of 5 bubbles,Dec 2020,wonderfull,"This is a monument that is the model for the Taj Mahal. This is a wonderful Indo-Islamic architecture and is a feast for the eyes. It is a mausoleum and there are multiple tombs inside it of the Mughal Emperor Humayun and his family. But the tomb was also used as a refuge and has seen a lot of blood shed in the past. The last Mughal king Bahadur Shah Zafar hid there after the 1857 uprising. There are many tunnels running under the building leading out from the monument. There are other beautiful buildings around it which are also worth a visit. A building with a green mosaic dome behind the main building is worth a look.You must approach this building by going around the main tomb. The gardens, much of which are being restored are beautiful. It is a declared a World Heritage site. The fact that these buildings have survived the ravages of centuries and multitude of wars is a testimony to their solidity and workmanship."
Humayun_s_Tomb,AjaySingh,5.0 of 5 bubbles,Nov 2020,Delhi Taj,The Tomb is in central Delhi. It is large beautiful building set in formal gardens. The site is very peaceful compared with chaos of the streets just outside. A visit is definitely recommended if you are sightseeing around Delhi. There is a relatively short walk from the main entrance through the gardens to some steep steps up to the first level of the main building. From here you can get a close up look at the design and intricate work that has been put into the building.
Humayun_s_Tomb,Mudhit G,4.0 of 5 bubbles,Nov 2020,Historic monument,"Humayun's tomb is the tomb of the Mughal Emperor Humayun in Delhi, India. The tomb was commissioned by Humayun's first wife. Its a UNESCO World heritage site. Very beautiful and well maintained. Nice experience."
Humayun_s_Tomb,Shivani K,5.0 of 5 bubbles,Oct 2020 • Solo,Mini Taj .....,I went to this place with my friend and with my family as I have a fetish to visit old monument I loved how beautiful this place was........................
Humayun_s_Tomb,sudhirr 2020,5.0 of 5 bubbles,Oct 2020 • Couples,Awesomeness,.....It's simply wow....Visiting the place is very fantastic always ....It's a great monument build by the mugal rulers......
Humayun_s_Tomb,Udit Bhatia,4.0 of 5 bubbles,Sep 2020 • Couples,Heritage in Delhi,"One of the most recognized landmarks in Delhi, this is a UNESCO world heritage siteExpansive lawns and gigantic tomb complex makes for a perfect day outing in the capital city"
Humayun_s_Tomb,Sans K,4.0 of 5 bubbles,Sep 2020 • Friends,Visit to humayun tomb,I visited this place almost twice or thrice with my friends .It is located in Delhi and is constructed in memory of mughal ruler late.Humayun.This tomb is really beautiful and I went for the purpose of clicking pictures as it as amazing scenery .
Humayun_s_Tomb,Jehosh,5.0 of 5 bubbles,Nov 2019 • Family,Must visit in Delhi,"A must visit place in Delhi even if you have an one day itinerary. Popularly referred to as the red Taj mahal.One of the well maintained historical artifacts. Good parking area is available. And I went through a cabEntry tickets are 30 for Indians and 500 for foreignersLooks magnificent and with wide area of gardens - one can easily spend 3 to 4 hours here. Good place to click lots and lots of pictures Timing to visit__________Also please visit early morning if you are visiting in April may or hot season. The temperature literally kills and you will find it hard to spend quality time there.I couldn't walk much inside the tomb as I was already tired walking. The main structure itself is about 500 m inside.Will be surely visiting again to explore more.Word of caution:I would suggest to take some snacks with you. Cause I didn't find any eateries inside. Only water was available Even outside the premises, I could find only juice and ice cream vendors.Also for the aged and weak persons, please allot a half day for this place, to explore fully. "
Humayun_s_Tomb,Tapanmc,4.0 of 5 bubbles,Sep 2019,Tomb of second Mughol,Humayun's tomb was built in 1572 by his wife Hamida Banu Begum . It aws designed by Persian architectMirak Mirza Gias .The masuleum was first of its kind which was build on vast garden.From the front it looks like three arches standing side by side with centre one leading in height .White dome risesin the centre behind the arch. Red sand stone and white marble made an wonderful combination .Inside main room tomb of emperor Humayun covered with white marble . This simplicity made the site greater and quieter .There are other tombs in the complex.Those are of  Prince Darashiko son of emperor Shahjahan and wife of Humayun .The green lush all around is well maintained .
Humayun_s_Tomb,Polo_and_Marco,5.0 of 5 bubbles,Nov 2019 • Couples,Delicate and intricate tomb ,The Humayun’s tomb is such a delicately and intricately carved building adorned with semi precious stones and inlays. The gardens are reasonably kept considering the amount of visitors. Be prepared to queue to get tickets.It took about 30mins to walk from JML stadium tube station. 
Humayun_s_Tomb,Rahul G,3.0 of 5 bubbles,Aug 2020 • Friends,Tomb,"As the name suggests, it's a monument. It is not that affluent as the other mughal buildings of the later centuries. But worth a  visit. "
