Tourist Attraction,Name,Rating,Date and criteria,Title,Review
Rajpath,podrozniczka60,4.0 of 5 bubbles,Jan 2023 • Couples,Impressive representative avenue of the city,This magnificent street is perfect for an evening walk all the way to India Gate. It was especially filled with the spirit of national pride in the days preceding the Republic Day holiday in January.
Rajpath,Surya Katakam,5.0 of 5 bubbles,Apr 2022,Raj path is the place where Republic day celebrations happens every year,"Raj path is the 3km stretch wide road between Rashtrapati Bhavan to Vijay Choke to  India Gate. you are not allowed to travel by Car whole distance so better to visit  by walk. Best time to visit is in the evening. Start your walk from Rashtrapati Bhavan and end your walk at India Gate and ensure that you will be there at India gate during Sunset as Sunset at India Gate is one of the memorable scenery.After visiting Sunset comeback and enjoy the beautiful scenery in LED light glow besides Raj path. Specially Parliament Bhavan, South Block, North Block, Mughal Gardens, Rashtrapati Bhavan will be very nice to see in the Lighting.You can also enjoy snacks in this Raj Path road as there are many vendors available in the evening. If you are going in the Morning or Afternoon you will not enjoy your visit. so plan to visit this place by evening.This is the place where Republic day celebrations happened on 26th January of Every Year."
Rajpath,Ravi A,5.0 of 5 bubbles,Mar 2021 • Family,Beautiful Historic Site,A must see when visiting Delhi NCR. Especially visit at night to see the lighted buildings and water fountain in Tricolor of the Indian Flag
Rajpath,Real Astrologer,5.0 of 5 bubbles,Oct 2019,Get free consultation with vashikaran Specialist in Hyderabad,If you are facing problem in your love or relationship and you are trying your best to solve that problem permanently from your life but due to some reasons you are not able to do so then don’t worry because with the help of vashikaran hyderabad you will able to vanish all your love problems beyond this if you are having any issues like lost love or break up problems then by just a free consultation with vashikaran specialist in hyderabad will help you to bring back your lost love back into your life again and stay with you forever and ever.Vashikaran is famous for solving every kind of life problems you face in your day to day life and you can really get rid from any kind of problem you face in your life but it’s so complicated because as it deals with various mantras and tantras and it is difficult to study all the mantra for all human beings and due to this reason our vashikaran expert in hyderabad practise various ways of vashikaran by which he is able to solve all your life problems.  
Rajpath,Tissa.travels,4.0 of 5 bubbles,Feb 2020,Main street between India Gate and Rashtrapati Bhavan,"Main street between India Gate and Rashtrapati Bhavan. Great for an evening stroll or to do a run. When we were there it was closed of for cars and had lots of food stalls and a kind of a fetsival atmosphere. I don't know if it's like this on a regular basis, but if it is it's a great place to see locals having a good time."
Rajpath,Anjan Sengupta,5.0 of 5 bubbles,Feb 2020,Power Center of India...,"As the name suggests, the Rajpath is the Power Center of India and a walk on this makes you feel the Power of our great democracy. The 3 kms stretch from gates of Rashtrapati Bhavan till India Gate gives you a glimpse of all important buildings and powerful institutions (ministries)  of India..."
Rajpath,R1chardN,3.0 of 5 bubbles,Feb 2020,The Power House,This is an impressive boulevard of grand buildings that  runs from Rashtrapati Bhavan to the National Stadium. We drove through it on our way between stops on a day tour of the city and highlights.  It is very heavily guarded and I was surprised to see so many armed soldiers.
Rajpath,Ipek T,5.0 of 5 bubbles,Feb 2020 • Friends,Shopping,"Beautiful street. You can find almost everything in affordable prices. Bargaining is recommended, you can buy 30-50 % cheeper with bargaining"
Rajpath,Brij_TheHuman,5.0 of 5 bubbles,Jan 2020,Royal Road,You find yourself with a feeling of being at some of the prominent places on the earth. The place looks royal through out the year.
Rajpath,VIPIN_GOEL_TP_Impex,5.0 of 5 bubbles,Nov 2019,Power Centre of India is here,"Rajpath runs from Rashtrapati Bhawan (President House) through Vijay Chowk to India Gate, around 3km long. The place is the Political Power Centre where President of India residence & office , Prime Minister Office, North & South Block, Parliament House and most of the other Ministries has offices. You can not travel the whole length by car. The best way is to walk in the evening. Start from India Gate before sunset and end at Raisina Hill (President Houseand) end after dark with the view of Historic Building illuminated with colourful LED lights. On the way one can have snacks, Ice Creams, Soft Drinks etc., one can enjoy boating in the canals along the road, relax in parks on both side of Rajpath. The Republic Day Ceremony is held here on 26th January every year, the event is must watch for everyone if in New Delhi at that time. One must visit National War Memorial, India Gate and Amar Jawan Jyoti before sunset. Its a sense of national pride once you are here."
Rajpath,Dan L,4.0 of 5 bubbles,Oct 2019,A Grand Boulevard,This is an impressive ceremonial boulevard bordered by extensive lawn areas and rows of mature trees and waterways. It runs from  Rashtrapati Bhavan to the National Stadium. The area had extensive barricading and was heavily patrolled by members of the armed forces when we drove through. Our guide/driver mentioned that there had been a weekend of ceremonies and preparations were underway for  Diwali. Shame that we were unable to stop and have a closer look at the area and the impressive monuments.
Rajpath,Chubb,5.0 of 5 bubbles,Oct 2019,we loved it,"OK, the benefit we had was the Mahatma Gandhi 150 year celebration was on, so there was lots going on and it was brilliant.  The area is clean and tidy and well managed, the people were all super friendly and there was so much going on with entertainment, mostly brilliant, food, excellent from the Kerala stall were the ladies were charming and so much more.  We loved it."
Rajpath,Anoop Vij,5.0 of 5 bubbles,Sep 2019,INDEED A TREAT,It is indeed a treat walking along the Rajpath with green lawns either side of the majestic pathway!
Rajpath,A R Kohli,5.0 of 5 bubbles,Apr 2019 • Friends,Best place in Delhi to enjoy walk and family picnic,During Republic Day the National Celebrations are done. During rest of the time you can have a wonderful family picnic and enjoy lovely street food with a vast variety to choose from. You can have fun with boating also. Any outing here will always be great fun and enjoyable experience.Amolak Rattan Kohli Former Governor of Mizoram
Rajpath,Cheenu J,5.0 of 5 bubbles,Jan 2019,Beautiful...,"Being a true-blue Delhi-ite, I just love this place and it's a family tradition to drive past on Republic Day and Independence day evenings!! True grandeur..amazing architecture and sprawling area.."
Rajpath,Lucky262728,4.0 of 5 bubbles,Apr 2019 • Family,Early morning joy,"Every Delhite must visit here early in the morning. Cool breeze, clear path and athletic people around will fill you with enthusiasm. It's worth giving up a little of your sleep and enjoy the dawn. Kids are seen cycling, skating and playing as traffic is bleak in the early hours.Note : Park your vehicles only in the parking area as traffic police keeps patrolling here."
Rajpath,JnVSydney,4.0 of 5 bubbles,Mar 2019 • Couples,Kings Way,"A boulevard stretching from India Gate, to the Presidents residence.  A proud stretch, lined with trees, lawns and canals, built during british rule. Nice to see if your in the area"
Rajpath,marrios,4.0 of 5 bubbles,Feb 2019 • Couples,Ceremonial boulevard,The Raj Path stretches from India Gate to the Presidential Palace.We were very lucky when we visited as the road was closed to traffic making for a very pleasant walk past some of the most important buildings in New Delhi.
Rajpath,sridharan2013,5.0 of 5 bubbles,Mar 2019 • Solo,A majestic stretch of road in India's Capital,"Rajpath as the name itself signifies is a stretch of beautiful wide road that has the monument India Gate to one end and the imposing Rashtrapathi Bhavan at the other end. This stretch of wide straight road has the pride of the annual republic day parades where world leaders have been invited to attend. Walking along this street is a pelasure particularly in the winter months. Tourists visiting Delhi must spend some time here. The lawns adjacent to the Rajpath though look nice from a distance could be better maintained. The added attraction now is the newly opened national war memorial, which considerably adds to the place."
Rajpath,Linda Y,5.0 of 5 bubbles,Jan 2019 • Solo,King's Path,"This 2-mile long boulevard is flanked by the most important government buildings in India. Formerly known as the “King’s Way”, Rajpath is the major artery that connects the Presidential Palace and India Gate. Along with the Secretariat buildings, and lined with canals, fountains, and manicured lawns, it’s living proof of British architect Edwin Lutyens vision for the New Delhi.  On the day I visited, seating and police barricades were still evident from the January 26 Republic Day celebrations that took place here. Unfortunately, what could have been a fabulous view was obscured by the morning haze (pollution)."
Rajpath,One_of_the_BOFs,4.0 of 5 bubbles,Feb 2019 • Couples,Important central road,"We were driven down this road as part of our day’s tour of New Delhi, stopping off at both ends to view the India Gate and the government building, etc. Luckily we were early enough in the day as we found that it was closed by the time we were returning to our hotel late afternoon - lots of locals having picnics all around as it was Sunday!"
Rajpath,Albia-Newton,4.0 of 5 bubbles,Feb 2019 • Couples,Historical and Iconic,Last gasp of the British Empire. Or Icon of Independent India. This location can be read in two waysThe walk along the Raj path is interesting especially at weekends as there are many impromptu sports games on the many lawns beside the roadway. You may well end up playing or being a referee if you are lucky 
Rajpath,kattullus,4.0 of 5 bubbles,Feb 2019 • Friends,The Empire's last breath...,Very impressive vast parade made to show the eternal greatness of the British Raj. 16 years later the Brits were out...
Rajpath,pkaran,5.0 of 5 bubbles,Jan 2019 • Friends,Ceremonial and most important road in New Delhi,"Rajpath is ceremonial and most important road in New Delhi. One one end of the Rajpath is India Gate and on another end in President's Palace. There are several very important buildings which are masterpieces of British-Hindu-Saarsenic architecture on both sides of the Rajpath, including, India Gate, South and North block, President's Palace. Adjacent to the Rajpath, Parliament house is also there. The road is  lined on both sides by huge lawns, canals, pools and rows of trees. Every year on 26th January, republic day parade takes place on Rajpath. Road was planned by Lutyens and it gives a panoramic view of New Delhi from President's Palace. When the road was built, it's name was King's Way, later it was changed to Rajpath post independence."
Rajpath,israr mansuri,5.0 of 5 bubbles,Jan 2019 • Couples,Best,One of the bestets place in New Delhi .lovely location highly security area and its huge place and looking India gate is amazing best place for children
Rajpath,Let's Go Sightseeing,5.0 of 5 bubbles,Nov 2018 • Friends,a walk to remember,"Rajpath is the road that stretches from the President's House on the Raisina Hill to the India Gate. While traffic is busy on this road (& the perpendicular ones), the pavement, the gardens & a little carefulness make it a great place for a walk.We started at the Rashtrapati Bhavan, which, in itself, is an architectural marvel. The imposing sandstone structure with the tricolor fluttering on top swell the hearts of Indians. The symmetry of the North & South Blocks are worth seeing.Start walking down from the Raisina Hill towards the India Gate. On both the sides are well laid out lawns with fountains thrown in. During the cooler seasons, you will be able to see more colors apart from the staple green.The lawns abuzz with activity - hawkers vending stuff, families soaking in the sun, lovers stealing moments, government employees napping in their lunch breaks, & dogs, kites & pigeons running around. Please keep the lawns clean."
Rajpath,Bobbi S,4.0 of 5 bubbles,Oct 2018,Great Architecture On One Of Delhi's Few Open Boulevards,"If you want to take a nice walk, try visiting India Gate at one end of this wide-open ceremonial ""King's Way"" boulevard, lined with rare open areas of grass, then walk to see the government Defense, Finance and other ministry buildings, the large, ornate gate in front of the President's Residence (Rashtrapati Bhavan), all of which are guarded by soldiers and all of which are beautiful in their design and architecture. I loved the symmetry of the huge gate and monument in front of the Residence, as well as the view from this end of the boulevard, back to the War Gate."
Rajpath,jmodi1981,4.0 of 5 bubbles,Oct 2018 • Family,Nice,"It was a very good experience to pass through this road, we have seen many times in national event this road with different dignities. Now it was our turn to see and it was awesome experience."
Rajpath,Amolak Rattan K,5.0 of 5 bubbles,Oct 2018 • Family,A walk with a breath taking view and enjoyment,"Starting from India Gate right up to Rashtrapati Bhawan, the wide road planked by beautifully manicured huge lawns and waterbody on both sides give you an exiting and enjoyable experience . Must do it . .. Governor Amolak Rattan Kohli"
Rajpath,RajanSaravanan,5.0 of 5 bubbles,Sep 2018,Heart place for India,"Rajpath is building were all Minister office department and external minister office also situated here it was nervous office all over the state of  india. Near by we can also see the Rashtrapati Bhavan President Palace and Parliament house there were cleaned Roads,Parks and Fountain were seen well maintain and tight security. After showing your id and proof we have pass the road. In evening we can see sun set behind the rashtrapati bhavan nice scenery were seemed. This place always busiest area."
Rajpath,Piyush Thakur,5.0 of 5 bubbles,Oct 2018 • Friends,Quite Royal ,This is the road connecting India gate to Rashtrapati bhawan. Republic day function in a organised here . It has quite a royal appeal. Tip : Visit early morning or post sunset 
Rajpath,TheTravelography,4.0 of 5 bubbles,Oct 2018 • Friends,A walk in high street.,"Yes, highly guarded area with all big hotels around. It is located near to Central Sect. Metro station and can be seen from India Gate. This is best in evening but after sunset they don't allow to go towards the President's residence.  "
Rajpath,Priya M,4.0 of 5 bubbles,Sep 2018 • Solo,Well Maintained place,Well maintained place which is easily accessible by public transportation. Its an iconic place in delhi.
Rajpath,nikkiprincess005,5.0 of 5 bubbles,Aug 2018 • Friends,Proud,A Proud moment for me and a Proud place Rajpath. Respectable and Honored to visit. Throughout all over the world popular!!!
Rajpath,nkadagarwal,5.0 of 5 bubbles,Sep 2018 • Couples,Beautiful Path,This is very very famous path. This path is very beautiful and main defence office is also in this path. All 26th January parade is taken place in this path.
Rajpath,Simmurani,5.0 of 5 bubbles,May 2018 • Couples,Path of the king- Rajpath,"It speaks of itself as the path of the king, one of the most secure as well as busy places in the town, residences of important dignitaries are located by its sides"
Rajpath,Nona43,5.0 of 5 bubbles,Dec 2017 • Friends,Beautiful Place to ride your mo bike.,"Me and my sister visit this place since our childhood and we use to ride our Yamaha Rx100 bike on Rajpath, wide roads and good view of the President house and other buildings around Ministry of Defence. and you can come for the morning walk here early morning when there is no traffic and can enjoy a good walk from Rajpath to India Gate, the place is peaceful and on weekends you will see many children and elders with their colorful bicycles. and you can click pictures with President House on your back, there is a designated place to take pictures near the security post. you can take your vehicle also till that point and  can park there for 10 minutes but cant halt more there due to security reasons so come and must visit this beautiful place in New Delhi"
Rajpath,advance1984,5.0 of 5 bubbles,Sep 2018 • Couples,Clean and beautiful Road,"This road is Delhi best road. There are Defence office, President estate and India Gate in between this road."
Rajpath,sanjeev kumar S,5.0 of 5 bubbles,Aug 2018 • Family,Majestic walk,The place in Delhi to go for a morning or evening walks. Serenity all around especially in the morning. One may exercise in the lawns and end the walk at the India Gate over a cup of tea.
Rajpath,sawhneysaab,4.0 of 5 bubbles,Oct 2017 • Business,Spectacular,Must visit this place when you're in New Delhi's India Gate. You can relax and chill and have coconut water.
Rajpath,pratss2014,4.0 of 5 bubbles,Jul 2018 • Solo,A road to be travelled,"If you're visiting Delhi, a drive or better yet a walk (if the weather permits) down this road is a must."
Rajpath,R0hanL,4.0 of 5 bubbles,Aug 2018 • Family,Grand boulevard,The grandeur of this boulevard is plain to see. The parks lining the way to India Gate were full of workers enjoying their lunch break and the walk up to India Gate from Parliament was quite manageable.
Rajpath,AnkitJain1368,5.0 of 5 bubbles,Aug 2018 • Family,Royal Road of India,Road from India gate to rajpath. Very well maintained. This road witnesses the display of Indian Culture and gallantry on Republic Day. You feel very proud of your country once here.
Rajpath,seeker_here,4.0 of 5 bubbles,Jun 2018 • Family,Amazing Experience,The Rajpath is the area between the India Gate and the Rashtrapti Bhawan (President's Residence). It is an amazing sight at night.
Rajpath,Jalal Iqbal,4.0 of 5 bubbles,Aug 2018 • Solo,nice area,the nerve of india. can have a nice stroll here. easy to reach here by bus or metro. india gate is located on one side and the presidential palace to the other. many cool govt buildings are also situated here which were built mostly in the British period. night view is cool once it is decorated. has nice green lawns and some water features here that makes the place more scenic. well maintained and clean and safe.
Rajpath,VINAY S,5.0 of 5 bubbles,Jan 2018 • Family,Amazing Beauty at Night,One should must visit Rajpath Marg at Night to see the beautiful Capital of India.. Must visit......
Rajpath,Shaf B,5.0 of 5 bubbles,Apr 2018 • Family,Very Nice place!!,"This Rajpath is a path (walkable place), near to India gate. Its almost 2Km road where you can see Parliament on one end and Stadium on other end. "
Rajpath,Guruprasad B,3.0 of 5 bubbles,Aug 2018 • Couples,Soaked in Independence Day Fervour ,"Being 15-Aug, the Rajpath was over crowded with people of all sorts and street sellers. But in normal days, this is wonderful monument to look around and to walk from the Rashtrapati Bhavan to Notth/South block Secretariats to the India Gate (a good 2km walk)! Highly secure place with police/paramilitary forces at every step. Amazing place indeed. We couldn’t take any good pictures due to the overcrowding."
Rajpath,Sonulata S,5.0 of 5 bubbles,Aug 2018 • Couples,Nice place,Good and look more good in Dark. We are there last week. and it was a nice experience. Very Clean area (Not found in Delhi easily) and tight security due to Independence day. 
Rajpath,Rasputin21,5.0 of 5 bubbles,Mar 2018,But where is the Raj?,"Rajpath was designed by the British to showcase their new Indian capital.  The long straight road leading to the Parliament at one end and the Stadium at the other, broken only by India Gate - the memorial to Indian soldiers who died in wars, and the stone canopy which was to house the marble statue of the reigning monarch is magnificent sight.  Beautiful lawns with fountains and colourful flower beds invite relaxation and fun.  During the Republic Day Parade these lawns provide standing room for all the poor people the Government brings in to show them what the Government does for them!  The buildings are lit during this time and do look beautiful."
Rajpath,gagatourist,5.0 of 5 bubbles,Jul 2018 • Family,"Amazing walk along Rajpath, has feeling of regality","Walk along Rajpath makes you feel proud to be an Indian. The place is amazing, architecture, greenery, fountains. Should not miss a chance to be here when lit during National days. Only wish the water canals could be cleaner and recent mushrooming of roadside vendors could be controlled by Govt"
Rajpath,teekhi_mircheee,5.0 of 5 bubbles,Jul 2018 • Friends,beauty,one of the most scenic and beautiful place in Delhi. It has lush greenery and fresh air to breathe- Delhite should definitely come!
Rajpath,FoodieeDiva,5.0 of 5 bubbles,Jun 2018 • Friends,MOST BEAUTIFUL PART OF DELHI,"its a beautiful place to visit just next to India gate , you can plan a picnic at india gate gardens with a view of rajpath the parliment house .. its all the more amazing on 15 Aug and 26 jan"
Rajpath,9708372852a,5.0 of 5 bubbles,Jun 2018 • Couples,The road with beautiful view ,Rajpath is a dream road. It connects India Redfort to Rashtrapati Bhawan via Redfort. Nice maintained road. Beautiful trees all alongside the road.
Rajpath,Amolak Rattan K,5.0 of 5 bubbles,Feb 2018 • Family,Festival on weekends and Holidays,It is pleasure to go for a walk from Rashtrapati Bhavan to India Gate . Tourists from India and International tourists from different parts of world gives a wonderful feeling that we are part of this one World . A variety of snacks and ice cream of different flavored are available . Never miss this opportunity when you are in Delhi because it is a unique experience .Amolak Rattan Kohli Former Governor of Mizoram
Rajpath,anoops37,5.0 of 5 bubbles,Jun 2018 • Family,Delhi 0 kilometers..!!!,"Yes it is the center of Delhi..setup amidst gocernment buildings ministeries it links as main road rught from Rashtrapati bhavan to India Gate... Beautiful nice views overwhelminga gardems and water bodies on either sides,it is where the 25th january parade takes palce every year to celebrate Republic Day of India...A national Holiday..!!!"
Rajpath,amitkumar_bec,5.0 of 5 bubbles,Sep 2017 • Friends,The place of Indian Government,"The place of Indian Government. At one end President house and India Gate at another. In between lies the centre of democracy i.e. Parliament house, government office i.e. north & south block and some ministries including rail bhawan at one side."
Rajpath,Animesh,5.0 of 5 bubbles,Oct 2017 • Friends,Aristocratic Feel To Walk/Drive Through The Best Road in India,"When a road has Rashtrapati Bhawan (Indian Presidential Palace) one end and India Gate on the other, walking/driving between is aristocratic amazing experience. It is the same road from where 26th Jan Republic Day Parade begins and inspected by the the President of India. The road has well maintained parks on either side. It's a favourite tourist spot in day during winters and at night during summers. You can sew sea of people enjoying themselves with ice cream and other roadside vendors thronging the place. There is facility of boating besides the park."
Rajpath,Navin S,4.0 of 5 bubbles,Jan 2018 • Couples,Best road of Delhi,"To walk through Rajpath is the best feeling you will ever hve as an Indian. The gardens beside, the cleanliness, the high quality roads gives us a diffrnt feeling. We are at the highest secured place, the classiest place. The greenery on both sides of the road is a beauty and really soothing to the eyes."
Rajpath,Roshan G,5.0 of 5 bubbles,Jul 2017 • Family,A monument which has so much history,This monument connects Rashtrapati Bhavan and India Gate. This is where a lot of political leaders are buried. Must visit monument
Rajpath,karan a,5.0 of 5 bubbles,May 2018 • Friends,Ancient historical monument!!,"It is one of the ancient and important monument of India and democracy!Here lives all our great leaders, here is the deptt of all major ministries."
Rajpath,Milan Patel,4.0 of 5 bubbles,Sep 2017 • Solo,The royal road of India,Rajpath is the main road or called Path which connects the India Gate to the the Rashtrapati Bhavan. It's a important part of this country and on the national festivals it will be decorated and ised for many events.
Rajpath,unexploredlanes,4.0 of 5 bubbles,Dec 2017 • Friends,A day well-spent,This is a major attraction for families. It's a famous picnic spot and covers two important visiting points - Rashtrapati Bhawan and India Gate. The location is crowded on weekends mostly with vendors and families.
