Tourist Attraction,Name,Rating,Date and criteria,Title,Review
Rajpath,Nikhil P,5.0 of 5 bubbles,Apr 2018 • Friends,One of the iconic places in India.,"One of the iconic places in Delhi and must visit one too.  This is the route which is being taken by the parade during republic days as well as during the famous Airtel Delhi half marathon. Lots of historical places and attractions are located near by Raj path like the rashtra pati bhavan, India gate,  The sides of raj path have nicely maintained green lawns and ponds as well. During the festive season, the iconic buildings along the raj path are nicely lit with lights which provides for a memorable view ."
Rajpath,seedhunter,4.0 of 5 bubbles,Mar 2018 • Friends,Why to miss?,"If you are in Delhi, must visit this road specially in the morning when there is less traffic. Joining India gate with  Rashtrapati Bhavan this is place where parade is organized on the republic day, 26th Jan each year. Well laid out parks and water bodies make it more charming in the evening."
Rajpath,PatilChinar,4.0 of 5 bubbles,Jan 2018 • Solo,It is pretty royal-ish,This road mainly runs between Rashtrapati Bhawan and India. I'd recommend visiting this place both at night and the daytime if you are interested in good photography.
Rajpath,gagan9,5.0 of 5 bubbles,Apr 2018 • Family,Must visit place during night / evening,The place looks very elegant with all the light ON during night. It's not very crowded during weekdays and is a short and pleasant drive from  CP. Must visit place in a life time.
Rajpath,mehtarakeshkumar56,5.0 of 5 bubbles,Apr 2018 • Solo,raj pat road,"the road is famous for its lawns , boat ride , india gate , rashpati bhawan and the most famous republic day parade happens on this road"
Rajpath,PushExplore,5.0 of 5 bubbles,Jan 2018 • Family,Driving Down,"To drive down Rajpath at night was really nice, as the lights shine bright, due to the Republic Day celebrations in January. We were fortunate that we were there when Rajpath was lit up and we had a very leisurely drive. A memorable experience for the kids."
Rajpath,RajeevAbuDhabi,4.0 of 5 bubbles,Mar 2018 • Family,Historical Rajpath we saw in 26Jan Parade,Its was a amazing experience of walking down the the rajpath from India gate up to rashtrpati Bavan .It was fun walking the whole path . there is nothing much to see but the feeling is really patriotic .
Rajpath,ranjanapathak,4.0 of 5 bubbles,Feb 2018 • Couples,Grand,"Rajpath is a ceremonial avenue in the heart of New Delhi. It runs from the Rashtrapati Bhavan to the National Stadium and passes through India Gate. Rajpath on its both sides has beautiful  gardens, trees and canals.  It was constructed by Sir Edwin Lutyens.  It is  one of the most important roads in New Delhi and yearly site for the Republic Day Parade.   Rajpath is the most visited place in New Delhi and one should not give a miss!"
Rajpath,Ankit prasad,4.0 of 5 bubbles,Mar 2018 • Couples,Place to see Republic day Parade,Its this place where we have a Parade on Republic day. Its opposite to India gate and one can find all sorts of rood side food in evening time next to India gate. 
Rajpath,prkota05,3.0 of 5 bubbles,Nov 2017 • Friends,Rajpath,It's a part just opposite to India gate has lot of crowd enjoy this beautiful place with friends and have pix
Rajpath,tehkahkin,3.0 of 5 bubbles,Mar 2018 • Friends,Incredible Structure,Located opposite India Gate. Very tight security with armed guards. No parking & waiting - only allowed to drop & pick-up. Easy to walk up from drop-off point. Moorish architecture. Large building sprawled over big compound. Can take photos outside (not sure if you are allowed in as we visited after 5 just before the sunset). Worth to spend 30 minutes taking photo
Rajpath,Westonblue,5.0 of 5 bubbles,Feb 2018,Looks great,This whole area looked lovely.  I can understand why so many locals come and have picnics here - I'm sure I would if I lived there.
Rajpath,David D,4.0 of 5 bubbles,Feb 2018 • Couples,National treasure,"Tuesday 13th February and we stopped here briefly on our way to Airport. We took the opportunity to visit India Gate and the Rajpath (means Kings Way) and is a ceremonial road in Delhi.India Gate (reviewed seperately) is situated at the eastern end of the Rajpath.It is an impressive sight with its  large lawns, waterways and rows of trees on both sides. There is a real sense of importance about this entire area.This thoroughfare is of great National importance  the annual Republic Day parade takes place on 26 January."
Rajpath,Rasheedur Rahman Shihab,5.0 of 5 bubbles,Mar 2018 • Solo,The Pride of India,"One of the best places, not only in Delhi, but in entire India is this place, the Rajpath. I totally loved this place."
Rajpath,Norman J,5.0 of 5 bubbles,Feb 2018 • Couples,Ruined by the pollution,"Rajpath is the centreline to Imperialk New Delhi, stretching from the Viceroys Palace to the India Gate and should be a wonderful perspective. Unfortunatley, the level of airborne pollution means that visibility is so reduced most of the tourist season as to make it a shadow of its true self."
Rajpath,Sumitkumar_13,5.0 of 5 bubbles,Dec 2017 • Family,Majestic,Its really feels great to walk down the rajpath. As the name suggests its really majestic. Very well maintained
Rajpath,Kunjppu,4.0 of 5 bubbles,Nov 2017 • Family,Rajpath,This is historical place.....Every person who visit New Delhi should visit Rajpath.The Artitecture is awesome....Every Indian should proud about Rajpath.
Rajpath,Miriam P,5.0 of 5 bubbles,Feb 2018,Rajpath,Loved it and would recommend it to other travellers. I would recommend hiring a driver and avoiding peak hour traffick.
Rajpath,Nitin K,3.0 of 5 bubbles,Feb 2018 • Friends,The path to the corridors of power,I had high expectations about Rajpath. However was quite disappointed with the upkeep of this part to the corridors of power. The road was lined with hawkers. The lawns on one side were not well kept (don't know about the other side as I did not venture there)The only bright side about this walk from India Gate to Rashtrapati Bhavan was that I got to see a variety of bright and beautiful flowers.The credit goes to the ending winter season and not to the caretakers.
Rajpath,victor4000,4.0 of 5 bubbles,Feb 2018 • Couples,Not as good as we hoped,"We had included a walk down the Rajath as part of one of our days in Delhi but in the end, when we saw it, we opted not to, It's just a wide tree lined road - not as imposing as say Paris or London."
Rajpath,N. Shah,4.0 of 5 bubbles,Feb 2018 • Business,Feeling of Pride,Everytime I come here I get a feeling of being a Proud Indian. Absolutely beautiful this place is!!!
Rajpath,546roba,5.0 of 5 bubbles,Feb 2018 • Business,Magnificent Lutyens Delhi,"The architecture is quite magnificent, and takes the breath away. The drive up RajPath completes the trip round the layout arranged initially for the Raj itself."
Rajpath,phillkentuk,4.0 of 5 bubbles,Feb 2018 • Solo,it's long,"You might struggle with the size of this, it's massive.  worth a wander, but watch out if it's hot :-)"
Rajpath,reubenranjanfern2017,4.0 of 5 bubbles,Dec 2017 • Friends,Awesome and amazing.,A great place to visit if you are in Delhi. A moment of history where every indian takes pride. Must visit on 26 January.
Rajpath,travelerraghu,4.0 of 5 bubbles,Nov 2017 • Couples,Republic day parade is awesome,Rajpath is an important place in India. This place is an awesome place and displays  very beautiful views at the time of republic day of India. The whole surroundings are green and the gardens are very well maintained.
Rajpath,Hasan Khan,5.0 of 5 bubbles,Jan 2018 • Friends,Royalty,Located near the RashtraPati Bhavan it's an indeed great place to visit to enjoy the beauty of India.
Rajpath,Vijay Jotwani,5.0 of 5 bubbles,Jan 2018 • Family,A must go place during Republic Day Celebrations,"It would be a great experience to go to Rajpath and nearby South Block, etc to see the effect of lighting on any evening during the Republic Day Celebrations."
Rajpath,Ema Datshi,5.0 of 5 bubbles,Nov 2017 • Couples,Kingsway - Delhi's great street,"Every great city needs a great street and whilst Paris has the Champs Elysee, Berlin the Unter den Linden, and London 'The Mall', Delhi has Rajpath - or as it was originally know, Kingsway. This is the wide and often not very busy road that links the Presidential Palace at one end to the India Gate at the other. Its sister road 'Queensway' a.k.a Janpath crosses it at right angles.It's a beautiful walk though I'd suggest to start at the palace and then it's downhill to India Gate. It's a bit of a way on a hot day but well worth a walk. Of course it's also free."
Rajpath,gireesh s,4.0 of 5 bubbles,Sep 2017 • Friends,Royal Path,It's a royal Path connecting national museum to Rashtar pati Bahavan you must visit this place in evening for better view
Rajpath,mail2bibhu,5.0 of 5 bubbles,Apr 2017 • Friends,"That feeling called ""Live Life King Size""","RajPath is a Hindi word when split gives (Raja=King + Path=Street/Way). Walking on this Rajpath gives that feeling of a King. Mostly people walk from India gate to President's house (both of which are famous tourist places of New Delhi) via this nearly 4 km stretch of Rajpath. Republic Day Parade of India is celebrated on this Rajpath each year on 26th January, which is worth seeing. Political dignitaries from across the world are invited to attend this event.Best time to visit : Evening to midnight during Summer and all throughout the day during winters. One can reserve time to relax at this place for as many hours as possible. Whether Delhi's temp. is above 40 degrees celcius during peak summers or freezes to zero or sub-zero during winters, you will hardly find a decrease in number of ice-cream vendors selling ice-creams in this area. People drive from distance to enjoy the ice-cream on this Rajpath. You may sometimes find celebrities / dignitaries jogging on this Rajpath during early morning hours.Located at the heart of New Delhi, walk on this Rajpath is worthwhile and a lifetime experience. If you are in New Delhi for any reason, take out time specially to visit this place. Nearest Delhi Metro station to access to this place: Central Secretariat and Udyog Bhawan."
Rajpath,Sanjay S,5.0 of 5 bubbles,Dec 2017 • Family,A must see,The Rajpath drive up is itself so good and you can see the India Gate on the other end. This is the place where the Independence Day and the Republic Day Parades are held every year.
Rajpath,WayneTech,5.0 of 5 bubbles,Dec 2017 • Solo,Glorious Path,"If you get the chance to walk this road at night, I'd highly recommend it. It's not at all crowded, and quite beautiful."
Rajpath,Anil1050,4.0 of 5 bubbles,Dec 2017 • Family,India's Important RAJPATH,A very important road from all angles connecting National Museum with Rashtrapati Bhawan. Nicely maintained. Full of greenery and favorite of love birds.Unfortunately the illumination done recently for night viewing is not very impressive.Still one must visit this area in your leisure time during day as well as nite
Rajpath,amitkumar_bec,5.0 of 5 bubbles,Sep 2017 • Friends,Rajpath,A straight road strech which connects India Gate and Rashtrapati Bhavan which also includes north and south block is a place of Indian Government.
Rajpath,Hardial_13,5.0 of 5 bubbles,Dec 2017 • Business,Beautiful Place,Rajpath is beautiful place to visit specially at night. This is one of the historical pathway. Very neat and clean.
Rajpath,blackdrongo167,5.0 of 5 bubbles,Aug 2017 • Couples,Decorated Raj Bhawan,"What a time to visit Raj Bhawan and North & South block, on the eve on 16th Aug, decorated with light. A colorful environment where India top official seats and all major decision taken from here. We just walked from India gate its awesome (if you are visiting this place in evening). Otherwise you can take auto from India gate which will cost 10-20 rs per person. If want to take a complete round of parliament, Raj Bhawan and North & South block then auto will cost around 150-200"
Rajpath,Vaibhav A,4.0 of 5 bubbles,Dec 2017 • Friends,King's way,Rajpath starts from Rashtrapati Bhavan goes via india gate and terminates at national stadium. It becames important venue for rpublic day parade.
