Tourist Attraction,Name,Rating,Date and criteria,Title,Review
National_Gandhi_Museum,mandypage2015,5.0 of 5 bubbles,Feb 2018 • Friends,A most see,Gandhi is such a part of modern India - and this museum has so many nice spots. The animated show of his last day with the background raga is very special. The path of his footsteps is very moving.
National_Gandhi_Museum,Arlene L,5.0 of 5 bubbles,Feb 2018,Very interesting and inspiring,Going to the Ghandi Museum was one of my goals while in New Delhi and it didn't disappoint. I ended up spending about 3 hours there (I'm one of those people who likes to read all the wall text at a museum). There is so much to learn about this inspiring man and I left saddened about his ultimate assassination but uplifted by his amazing outlook on life and how he actually walked the walk instead of just talking the talk. I found the statues and the replica of one of his ashrams in the garden equally compelling. 
National_Gandhi_Museum,Sumitkumar_13,4.0 of 5 bubbles,Dec 2017 • Family,Learning experience,National Gandhi Museum provides a great learning experience on Gandhian thoughts. Lot of historic memoirs are available here
National_Gandhi_Museum,Kiri G,3.0 of 5 bubbles,Mar 2017 • Friends,Worth a visit,"It's always interesting to see parts of history, nothing out of the ordinary but worth a visit while in Delhi"
National_Gandhi_Museum,Ali G,5.0 of 5 bubbles,Mar 2017,loved the place,loved the place.historical and beautiful.have been there a couple of times and would love to go once more
National_Gandhi_Museum,Gretton,3.0 of 5 bubbles,Feb 2018 • Couples,Quite interesting,"Only visited as it was free and next to our hotel this place was quite interesting if Gandhi rocks your world ,Loved the grounds "
National_Gandhi_Museum,SCORPYO1952,4.0 of 5 bubbles,Jan 2018 • Friends,A must-see!,"Gandhi...the father of the nation! No visit to India is complete unless you visit this museum, where Gandhi took his last steps before his assassination. Very inspirational!"
National_Gandhi_Museum,Jack B,5.0 of 5 bubbles,Feb 2018 • Couples,Gandhi,Very interesting museum and made you realise the sacrifices Gandhi made to achieve his dream for India.
National_Gandhi_Museum,travelerraghu,4.0 of 5 bubbles,Nov 2017 • Couples,Things used by Gandhiji is found here,Gandhi memorial Museum is situated opposite to Raj Ghat. Personal belongings of Gandhiji is kept in display. Those who wants to collect the memories and details of his life can find it very informative and knowledge gaining.
National_Gandhi_Museum,flowergirl58,5.0 of 5 bubbles,Jan 2018 • Couples,fantastic museum,"dedicate some time to go here but well worth it.It has the history of India laid out chronologically in a multitude of rooms and is fascinating with costumes,jewellery and artifacts going back BC"
National_Gandhi_Museum,dave w,4.0 of 5 bubbles,Jan 2018 • Family,a sacred place,everyone knows Ghandi. so this place is like a pilgrimmage. i found it to be a very sacred place to visit. and to see all the history. 
National_Gandhi_Museum,Angela M,4.0 of 5 bubbles,Nov 2017 • Couples,"If you are visiting Delhi, you should come here","Worth coming here to see the shrine dedicated to Gandhi, just a word of caution - take a cover up/scarf if visiting late afternoon/early afternoon as the mosquitos seemed to come out in full force!"
National_Gandhi_Museum,cabell2014,5.0 of 5 bubbles,Dec 2017 • Friends,Trip of Delights,This can get confusing.  There are a few places Gandhi is billeted.  His resting place is across the street and his residence is elsewhere.  This is on older building dedicated to his work and has the March Statue and model of the house he lived in out back.  There is a lot of information of his work and life here.  It's a great building in itself.  No fee and they wouldn't take a donation ( many places wouldn't). 1 hr is probably enough time. Very emotional to visit. 
National_Gandhi_Museum,Dan C,5.0 of 5 bubbles,Jan 2018 • Friends,Must Visit,"The National Gandhi Museum is a must see in Delhi. The grounds exude peace, and is a remarkable show of affection for the man who had a great impact in the liberation of modern India. The museum with his personal effects, and final steps to the site of his assassination are extremely powerful.Not to be missed."
National_Gandhi_Museum,PerryWorCapPar,5.0 of 5 bubbles,Dec 2017 • Couples,Alace of pilgrimage,A very moving memorial to a great man.  Perhaps the best bist is whn you see his bed  and a collection of his personal possessions at the time of his death.  A Delhi highlight
National_Gandhi_Museum,mummybear-Stoke,5.0 of 5 bubbles,Oct 2017,Very upsetting,I had not realised Gandhi had been shot by a fellow Hindu I had always assumed wrongly that it was a Muslim.  The museum is very well laid out and if you don't have time to go all around it then please find time for the garden it is really beautiful.
National_Gandhi_Museum,W4lking,5.0 of 5 bubbles,Nov 2017 • Couples,Well worth a visit,Gandhi's story is inspiring and this museum represents his life and workin a very compelling way. I would definitely recommend a visit
National_Gandhi_Museum,cruiser54,5.0 of 5 bubbles,Oct 2017 • Friends,The Life of Mahatma Gandhi,"A place where Mr Gandhi's epic life ended on Jan 30, 1948.  There are many artifacts to see at the museum & a Peace bell & Gong outside. "
National_Gandhi_Museum,AndyMcGonegal,5.0 of 5 bubbles,Nov 2017 • Couples,Wonderful Place Celebrating a Wonderful Man,"I spent two hours here drinking in everything Gandhi. I always knew him to have been a great man, but digesting the simple, but powerful, exhibition of his thoughts and deeds was a truly moving experience that reinforced many beliefs that I hold dear. Sadly, modern day society is distinctly at odds with the enlightened teachings of Gandhi.Perhaps the best investment of time that I've ever made."
National_Gandhi_Museum,Aman K,5.0 of 5 bubbles,Oct 2017 • Friends,Must Visit Museum,"National gandhi museum is a must visit place. To know many things related to Gandhiji, it is necessary to go here. There are no fees."
National_Gandhi_Museum,Mary Beth F,5.0 of 5 bubbles,Nov 2017 • Couples,the interesting story of Gandhi,"if your interested in history then this should be on your list of places to visit, it explains the life and death of Gandhi"
National_Gandhi_Museum,Brian M,4.0 of 5 bubbles,Jul 2017 • Couples,Worth visiting,This museum gives a very good description of Gandhi's life and work. Free in so really no reason why you shouldn't go  
National_Gandhi_Museum,JKE255103,4.0 of 5 bubbles,Sep 2017 • Couples,Worth a visit,"The entry is free. There’s so much information about the national hero of India. His life, his fight, his philosophy, his assasination..."
National_Gandhi_Museum,Littlelizamay,5.0 of 5 bubbles,Nov 2017 • Couples,A must!,"Wonderfully evocative of a man and his time - so moving. A history, so beautifully told.Go & visit it soon!!"
National_Gandhi_Museum,TAMAN1951,4.0 of 5 bubbles,Nov 2017 • Couples,Nice collection,A number of Ghandi artifacts on display. A fitting tribute to s remarkable man. Very interesting to appreciate the story and impact on a country of one mans life. You will not be disappointed.
National_Gandhi_Museum,Anabel-2013,5.0 of 5 bubbles,Oct 2017 • Business,Important Monument to a Remarkable Individual,Gandhi and this museum deserves great attention.  The presentations are comprehensive and the grounds are lovely.  They offer a documentary that covers Gandhi's first steps to his last. It is important that we remember the parsimonious words of Gandhi and hi contribution to humanity.  This museum is the house where Gandhi spent his last nights and the place where he was assassinated.  
National_Gandhi_Museum,AVNI,4.0 of 5 bubbles,Sep 2017 • Family,Visit once,Must visit this place with kids. You will feel a touch of history. If you hold that sort of interest.
National_Gandhi_Museum,robert b,5.0 of 5 bubbles,Oct 2017 • Friends,"The history of his life story is truly amazing,what a truly lovely man.","Very interesting museum,easy walking for people of all ages and beautiful surrounds.A good driver will find it easily,don't try and find it on your own."
National_Gandhi_Museum,Geoff F,5.0 of 5 bubbles,Sep 2017 • Couples,Wonderful. One of the best museums,"In may cities, there are places that are essential. The Gandhi Museum is one. It is not large, but clearly lays out the main elements of the man and his life and can take at least two hours to follow completely.What comes across is the beautiful serenity and simplicity of one of the great men of the late 19th and first half of the 20th century in complex situations. He saw through the political chicanery and just said what was right and just. He may have had some impractical ideas, but the beauty of the man shines clearly through the whole of the museum. It can reduce grown men and women to tears."
National_Gandhi_Museum,Kumar S,4.0 of 5 bubbles,Jul 2017 • Solo,Gandhi Museum ,"Situated opposite Raj Ghat, a great deal can be learned about Mahatma Gandhi. Spend a couple of hours, and read description about every picture, it’s quite interesting. "
National_Gandhi_Museum,jonesharma29,4.0 of 5 bubbles,Nov 2016 • Family,National gandhi museum,National gandhi museum is best place to walk in history.here many monument from thier timeline era kept nicely so easy to get know about different era history.
National_Gandhi_Museum,Mohamed Al Rimawi,5.0 of 5 bubbles,Sep 2017 • Couples,Amazing man life,It contains almost everything about mahatma Gandhi life house tools pics books and even clothes .. small shop for books and souvenirs
National_Gandhi_Museum,gentbrugg,4.0 of 5 bubbles,Mar 2017 • Solo,Opposite to Raj Ghat,"Gandhi memorial Museum is located opposite to Raj Ghat – the place where first he and then his daughter and grandsons were cremated. The Museum is small. Personal belongings of Gandhi – up to one of the bullets that killed him, his dhoti, in which it hit, his canes, urn with his ashes, and the rest – occupies in the collection a relatively little space compared to magazines and books promoting the teachings of Gandhi and talking about his life. There are audio-visual materials – even a film about his life which is shown to visitors at certain times."
National_Gandhi_Museum,phel_the_fairy,5.0 of 5 bubbles,Aug 2017 • Friends,Easy to find,"There are lots of interesting photos and I really enjoyed wandering around, reading all the stories about this fascinating man. It's a little dated but worth a visit. I spent a good 2 hours there reading all the photo descriptions etc.It's easy to find- take the Metro to Delhi Gate, take exit 4 and turn right out of the station, then follow the road to the right. It's about 5 mins walk on the right, past the stadium. There is a big blue sign outside."
National_Gandhi_Museum,Creadivs,3.0 of 5 bubbles,Aug 2017 • Family,History on display with hardly any visitors,Was surprised to see a public place with only 2 families as visitor on a Sunday. The place offers rich remembrances of history. Covers all the aspects of Gandhiji's life.The maintenance of the place is below average. Doesn't charge anything as entry/ parking fees.Everyone should visit there once to know and learn more about such a prominent part of our history - Gandhiji.
National_Gandhi_Museum,Mehdi_Farrokh,3.0 of 5 bubbles,Sep 2016 • Friends,Leader of a Nation,"There are lots of stories about this person. A man who had leadership of a nation with variety of religions. You will see his belongs, some pictures and sentences of him here. It's good to know India from this point. Place is OK but do not expect a huge or extraordinary time there if you are not interested in history."
National_Gandhi_Museum,justinthebyrner,5.0 of 5 bubbles,Aug 2017 • Solo,An amazing life of an amazing man,I really enjoyed rediscovering the life of Gandhi. This museum has an amazing collection on the life and history of this great man. Worthwhile visiting if in New Delhi.
National_Gandhi_Museum,Russ1470,4.0 of 5 bubbles,Aug 2017 • Friends,Calm,This is a calm and peaceful place to visit where you can find out more about the man. The museum is interesting.
National_Gandhi_Museum,Kirsty C,5.0 of 5 bubbles,Oct 2016 • Couples,Amazing - to see the man rather than the myth,"Everyone's seen ""Gandhi"". Everyone knows about ""the father of the nation"". But do they? This is a great museum to visit, to see Gandhi's few belongings, plus letters and a lot of background to understand what made him into the figure he became."
National_Gandhi_Museum,bradfam2017,5.0 of 5 bubbles,Jul 2017,Must see,Lovely building great display of his work and understanding of what he stood for. Peaceful although very hot in the building which is a shame as lots to see and read.
National_Gandhi_Museum,Amy D,4.0 of 5 bubbles,Jul 2017 • Family,To know more about father of nation,"Located Opposite Raj Ghat, Ring Road, Delhi. one can reach there by cab , car or auto. timing is  10.00am To 5:30 pm . calm & peaceful place .museum  Dedicated to the Father of the Nation, the museum contains some of his personal belongings, like teeths , his spectacles , pictures , documents,book , journels  . There are five pavilions , it also has a  sculpture, photographs and paintings of Gandhi , his movements and the history . and important monday is close ."
