Tourist Attraction,Name,Rating,Date and criteria,Title,Review
National_Gandhi_Museum,Michaela B,3.0 of 5 bubbles,Aug 2022 • Couples,"Free and informative, but missing something in terms of customer appreciation ","Free entry and plenty of staff around to guide you around the exhibits. We found the acoustics within the building (and mask wearing guide), difficult to hear and understand clearly. An inspirational and amazing man.... interesting exhibits with interactivity BUT for us, being able to travel around at our own pace with a QR code for an audio guide would have given us more satisfaction and the museum a higher score."
National_Gandhi_Museum,SAROJ8585,5.0 of 5 bubbles,Jan 2020 • Family,A JOURNEY TO GANDHIS LIFE,"National Gandhi museum contains huge picture gallaries depicting Gandhis life,work and ideals in photographs ,artworks,paintings and his relics.It also contains a well maintain specialized library having nearly 40000 books,magazines,his correspondence,books on world peace and religions"
National_Gandhi_Museum,Janet B,5.0 of 5 bubbles,Mar 2020,Very moving experience,Could have spent all day here. The museum is very informative as is the whole memorial site.  When you follow the final footsteps Mahatma Gandhi took hed on his last journey it is very moving. The atmospher is very respectful and really toucned me.
National_Gandhi_Museum,MamaT23,5.0 of 5 bubbles,Mar 2020 • Solo,A walk through his life,A very informative Walkthrough Museum of his entire world. Step by step of his life in  chronological order. Bit shocking seeing his blood stained shawl which he wore  while he was assassinated.
National_Gandhi_Museum,eandeMelbourne,5.0 of 5 bubbles,Jan 2020,Gandhi Museum,Very comprehensive museum on the life of Gandhi.  Lots of photos and written information. Gives a real feel for the person.
National_Gandhi_Museum,Hadassa,5.0 of 5 bubbles,Dec 2019,"So INSTRUCTIVE, Interesting and calm","From our plural visits to museums in India and beyond, our interest was concerning the kind of public undertaking that museums cultivate, has grown, further Indian museums have splended series but fail to actively bind with their communer. The dweller Council of learning Museum in India & a knob of other museums have merged this approach, lately, however, we have yearned for museums across the country to follow suit, wsorth it!"
National_Gandhi_Museum,Tarique S,5.0 of 5 bubbles,Jan 2020,GLIMPSES OF THE LIFE OF A GREAT SOUL,"Gandhi, a man who is revered all over the world for his philosophy of 'Ahimsa' or 'Non Violence'. Man, who taught the world that no matter how tough the battle is, it can still be won by love. He took up no arms, still defeated his opponents. Lived simplest life with some of the greatest philosophical thinking. Man, who eradicated untouchability from our society and left an indelible mark in the history of mankind. Such was Mahatma Gandhi and this humble Museum has tried its best to bring forth some of the glimpses of his life.The Museum is built on two floors, the ground and the first floor. As you enter the main building, you find a larger than life size bust of Mahatma Gandhi to your left and an exhibition hall to your right, where presently the photographs of Gandhi’s Life in South Africa has been put on show.There is Library on the ground floor which has around 40,000 books in English and other Indian languages, like Urdu, Hindi, Tamil, and Guajarati etc. The collection of this Library have been divided into two sections, viz. ‘Gandhiana (including freedom movement) and ‘General’. The ‘Gandhiana’ section includes books, journals and documents by Gandhiji, on Gandhiji, his philosophy, ideology and those on the history of the Indian Freedom Movement from 1857 to 1947. The ‘General’ section includes books, journals and documents on subjects other than those covered under the ‘Gandhiana’. No membership fee is required for consulting books. The access to library is free for all.As you climb the stairs to reach the first floor you will come across an abstract by Nobel Laureate, great writer and a poet, Rabindranath Tagore, which he wrote on Gandhiji. On the first floor lies the ‘Charkha Museum’. Charkha or ‘Spinning wheel’, became a symbol of freedom movement and also played a pivotal role in ‘Swaraj’ movement. It represented a desire to achieve self-dependency, self-responsibility, self-respect and self-realisation.‘Commemorative Gallery’ on the first floor exhibits many of the belongings of Gandhiji and in ‘Martyrdom Museum’, the blood stained cloth of Gandhiji has been displayed. It was the same cloths that Gandhiji was wearing when he was assassinated by Nathuram Godse.There are few things in the museum which are indeed amazing and adds extra charm to it. Like the recreated heartbeats of Gandhiji which can be seen in the form of ECG and can also be heard on headphone. One can listen to the original voice of Gandhiji on a handset of telephone. The “Walking Stick” of Gandhiji is also on display. It is the same “walking Stick” which Gandhiji used during the great “Dandi March” in 1930. Two teeth of Gandhiji extracted by Dr Barretto at Nagpur has also been kept on display at this museum.This museum doesn’t just displays objects but also teaches the much needed philosophy for the present time. I would definitely recommend this museum to people of age groups.Important Infos:1. Free Parking is available inside the main campus of the Museum.2. The Museum and the Library are open from Tuesday to Sunday between 10 am to 5:30 pm.3. There is a small souvenir shop in the main building where you can purchase show pieces and books as well.4. A Tea/Coffee stall is also available near the Parking bay.5. Photography is allowed inside the main building.6. Public Convenience is also available inside the main building."
National_Gandhi_Museum,macedonboy,5.0 of 5 bubbles,Dec 2019,Museum dedicated to the great Gandhi,"The National Gandhi Museum and Library as the name suggests is both a museum and a library, the former dedicated to the great father of the nation of India, the latter mostly a library, but with an emphasis on Gandhi.The museum chronicles the life and times of Gandhi through exhibits, photographs and paintings. If you want to know about the achievements of the great many, this museum is one of the best places to do that."
National_Gandhi_Museum,Sunil,4.0 of 5 bubbles,Jun 2019 • Family,Gandhi museum ,The great place to witness the Gandhi history. The place is well maintained by Delhi authorities and quite informative 
National_Gandhi_Museum,Ellemay 🍹🐠🐳,4.0 of 5 bubbles,Dec 2019,Interesting.,"The National Gandhi Museum showcases the life of Mahatma Gandhi. It has a large collection of original books, journals, photographs, materials & papers connected to Gandhi. It's a fascinating journey into the life of a very special person before the assassination in January 1948."
National_Gandhi_Museum,Mavis57,5.0 of 5 bubbles,Nov 2019,A moving tribute to Gandhi's life,"Well worth a visit - there is a lot to read and take in inside the house, so give yourself plenty of time. The calm greenery of the gardens helps to alleviate the solemnity of the story."
National_Gandhi_Museum,Arne Birkeland,4.0 of 5 bubbles,Oct 2019,Informative and interesting,A good place to visit to become more informed about Gandhi. Especially the doll expo of different parts of his life were interesting and informative for kids
National_Gandhi_Museum,Orchid Z,4.0 of 5 bubbles,Oct 2019,Ghandi Smirti - where Mahatma Gandhi was assassinated,"This is the house where Mahatma Gandhi lived just before he was assassinated in the garden just behind the house.  Ghandi lived, taught and peacefully fought for India's independence from the British.  He is known by many as the ""Father of India""."
National_Gandhi_Museum,Kris M,5.0 of 5 bubbles,Sep 2019 • Couples,My new hero,"This is a must in Delhi to understand what an amazing man Gandhi was and what he did for India and South Africa.the power of peaceful and non participation to achieve many thi gs for the poor. You also understand his philosophy of life, which is deeply rooted in Indian culture. Spend time here."
National_Gandhi_Museum,JustC28,4.0 of 5 bubbles,Jun 2019 • Couples,Informative and sobering,"Awesome place to visit. Very well presented and hugely informative. Set aside a good amount of time as there is plenty to read about and take in. Great place to prove that peaceful protest can be effective and intolerance and violence doesn't have to be precursor to change. Free to visit, you don't need a guide."
National_Gandhi_Museum,Wendy w,3.0 of 5 bubbles,May 2019 • Friends,A national Museum,This house is quite small for large bus loads of people to go through. Situated in a quiet neighbourhood I actually feel sorry for the people living around here to have so many bus loads of people invading their street. Mahatma Gandhi is very well respected by Indians hence this museum showing different photos & memorabilia of his life. Because of the amount of people climbing up 3 levels of this house combined with extreme heat I didn’t really enjoy this museum.
National_Gandhi_Museum,Gala2812,4.0 of 5 bubbles,Mar 2019 • Friends,The good learning experience,"Nice museum in the quite governmental quarters. The area is well-maintained and neat. The museum tells about Mahatma Ghandi, his life and beliefs. There's an intercative part on the second floor that would be a fun place to go, especially for kids. It shows Ghandi's ideas in a simple but impressive manner as well as gives introduction to the cultural background. On the first floor there's a hall to watch a movie about his life. The house is pretty big but Ghandi was said to occupy just one room and you can see his everyday life was very simple. The garden around includes some nice landscapes and the spot where he was shot during the public meditation by one of his former friends. And yes, he's got to say the words of forgiveness to the shooter. I would say its a great place to visit in Delhi to get closer to the modern history India and life of one of the most outstanding humanists of the world."
National_Gandhi_Museum,Bruce & Angela H,5.0 of 5 bubbles,Apr 2019 • Friends,In the Style of Gandhi Himself,This museum is free to go through and very simple in it's presentation which I liked. Lots of dedications by world leaders and a mountain of photos and chronological descriptions of his life and struggles. I learned a lot and am glad we took the time to visit. You don't need a guide for this.
National_Gandhi_Museum,Nicola T,5.0 of 5 bubbles,Apr 2019 • Family,Excellent source of exhibits on Muhatma Gandhi,"Short visit here whilst on a tour. Beautifully kept gardens and exhibits. All translated into English. Some areas outside require shoes to be removed. You can take photography here. Was 40 degrees centigrade on our visit in early April so welcomed a chance to sit down and watch a film about Gandhi in a cool area inside. There are original relics, books, photographs and journals and audio visual assistance if required. Was a very calm and respectful place."
National_Gandhi_Museum,TobyMontreal_Canada,5.0 of 5 bubbles,Mar 2019 • Couples,Very Rewarding Visit,"We agree with others that said that this free museum could be updated....BUT we still found it very inspiring and moving, with interesting photographs and artefacts.   We were there for a while and yet felt we would have liked to have had more free time to see this museum....by the way free admission!"
National_Gandhi_Museum,Amolak Rattan K,4.0 of 5 bubbles,Mar 2019 • Solo,Needs improvement to get a top billing,This is a National Museum on Gandhiji. But this is not the best one. I shall rate many other museums definitely better than this one. This is also informative but not very well kept. I hope Authorities improve it by renovation.Amolak Rattan Kohli Former Governor of Mizoram
National_Gandhi_Museum,Jodi R,4.0 of 5 bubbles,Mar 2019 • Friends,Inspiring,This museum is everything about Mahatma Gandhi.  Entry is free and there are some amazing artefacts and photographs sharing the history of his life and work.  Certainly worth a visit.
National_Gandhi_Museum,PipPaul W,3.0 of 5 bubbles,Feb 2019 • Couples,Very disappointing ,"For a 'National Gandhi Museum ' this was very disappointing. Tired displays, faded photos and a few badly displayed artifacts.There are better places in Delhi to find out about Gandhi "
National_Gandhi_Museum,sunrise99,4.0 of 5 bubbles,Dec 2018 • Family,National Gandhi Museum Visit,"I found this museum very interesting finding out about Gandhi’s life, causes and politics.Allow a few hours as there is lots to look at and read about.I wouldn’t be put off by the exterior of the museum. Once inside there is lots to take in. Displays are set out clearly written in Hindi and English. Spinning history and politics found  in ‘The Spinning Gallery’, ‘Charka’, caught my attention. Gandhi himself spun and the wheel represented independence and self-sufficiency."
National_Gandhi_Museum,StratosLFC,5.0 of 5 bubbles,Dec 2018 • Friends,Worth to visit,A must visit place if you want to learn some things about “Gandhi's lifeIntersting things inside with all of his past.
National_Gandhi_Museum,DonnamjCan,3.0 of 5 bubbles,Jan 2019 • Couples,Interesting ,"Popped in here for a 1 hour visit and was able to see the highlights. There is a lot to see if you are interested in the life and teachings of Gandhi and want to see pictures etc of his childhood, some of his talks, where he last walked, where he was assassinated. If you want to take the time to read everything than you need a couple of hours. For us an hour was more than enough as the pictures are quite repetitive. There is a fairly large states re on site that sells cloth (clothing etc). This is a typical museum site and has a lot to read and many pictures to look at. Not great for young kids. "
National_Gandhi_Museum,durham05,5.0 of 5 bubbles,Jul 2018 • Solo,Gandhi as he was,"Was rather off the beaten track to get to this museum but well worth the effort. A huge display of items associated with Gandhi, from his personal everyday objects to the clothes in which he as assassinated. Highly recommended."
National_Gandhi_Museum,cristoph2010,5.0 of 5 bubbles,Dec 2018 • Friends,Mahatma Gandhi,"This museum showcases the life of Mahatma Gandhi, a definite giant in India's political and social history.  You can see actual artifacts used by Gandhi and replicas.  Lots of quotes and sayings by the man himself.  So you'll get a glimpse into his philosophy and learn about what motivated him.  It's free so you can't get any better than that when you're in Delhi."
National_Gandhi_Museum,jmodi1981,4.0 of 5 bubbles,Oct 2018 • Family,Nice Museum,"It was really a nice experience to see this Museum, we really need 4 to 6 hours to cover this place as it has lot of things to visit. However, we couldn't able to spent more time due to other places which were in the plan."
National_Gandhi_Museum,Rosemary L,5.0 of 5 bubbles,Dec 2017 • Friends,Life of Ghandi,"This is a beautiful museum in New Delhi, India about the life of Mahatma Ghandi.  It was very interesting to understand his life, where he came from and his philosophies. I saw Indian garments for sale as well, his traditional clothing.I would combine this with a visit to his tomb, also in Delhi, where people come every day to pay respects."
National_Gandhi_Museum,Mark M,3.0 of 5 bubbles,Oct 2018 • Couples,Nice Museum,Very interesting museum where an hour would do to visit Located in a really exclusive part of town and free to visit Worth a look if your near by
National_Gandhi_Museum,Sharon C,5.0 of 5 bubbles,Oct 2018 • Friends,worth the visit,This is not just a museum for adults but also children can interact with displays and learn alot about an incredible man.Thoroughly enjoyed my time here learning more about history.
National_Gandhi_Museum,Diana D,5.0 of 5 bubbles,Oct 2018 • Couples,Humble Man,To actually see how Gandhi lived and where he died was an eye opener for me. It offered me an Asian taste of history
National_Gandhi_Museum,nikkiprincess005,5.0 of 5 bubbles,Aug 2018 • Friends,Life of Gandhiji,Almost all the elements and life of Gandhiji covered in this National museum of Gandhiji and called known very well around the whole world.
National_Gandhi_Museum,Simmurani,5.0 of 5 bubbles,May 2018 • Couples,Historic,"Not boring as it basically focuses on the life of father of the nation- Bapu, showcasing his artifacts and letters and his timeline of achievements"
National_Gandhi_Museum,PushExplore,5.0 of 5 bubbles,Feb 2018 • Family,Unique Experience,The trip to the National Gandhi Museum was a unique experience for us. The place provides a sense of calmness. The items on display were truly unique.
National_Gandhi_Museum,Sunil K,5.0 of 5 bubbles,Jan 2018 • Family,Gandhi's life!,If you would like to learn about the life of  Mahatama Gandhi you may visit this place. Quite beautiful place. Many things belonging to Gandhi are kept here.
National_Gandhi_Museum,Tim L,5.0 of 5 bubbles,Aug 2018 • Couples,Old school museum,"If you are onto Gandhi and his work it is a must see. A timeline of photos and quotes of his work. Fantastic stories and structure. It does seem as if the museum is stuck in the 1950's though. Good air conditioning in most rooms which is appreciated. I loved it! Driver FYI - We used Raj from Sheetal Tours - he was fantastic, spoke great English and we felt extremely safe. My tip: Don't use the hotel driver, I would suggest Raj. His number  +91 9810776968"
National_Gandhi_Museum,Tammy2124,3.0 of 5 bubbles,Aug 2018 • Couples,Wonderful memorial,If you have the time it is worth a visit. Very informative museum on the life and work of Gandhi. Loved all the quotes on various topics and issues spread throughout the museum. 
National_Gandhi_Museum,Lovegoodfoodgoodwine,5.0 of 5 bubbles,Aug 2018 • Solo,All life of Mr Gandhi ,"Great museum tracing the very last years of Gandhi, showing everything in detail, such as his last clothes, his glasses and even his two last teeths.. Very instructive in general. "
National_Gandhi_Museum,Saurav K,5.0 of 5 bubbles,Feb 2018 • Friends,Well Maintained Museum,Here You will see some Historical Things Which is best to know.And You can watch Short Stories About Mahatma Gandhi.However There Is no any entry fee for this museum.
National_Gandhi_Museum,Gdaynamaste,4.0 of 5 bubbles,Jul 2018 • Friends,"Peaceful, moving tribute to inspirational man.","A peaceful small old style museum. Have visited many times with overseas visitors and they always leave having had “ a moment”. The respectful and moving atmosphere in the “Martyrdom Gallery” is felt by many.Yesterday we were able to leisurely walk around the building taking our time to observe a vast collection of historical photos and objects. The book collection on Mahatma Gandhi is also worth a look.Shady garden, good parking on premises and a kiosk. "
National_Gandhi_Museum,Fazul M,5.0 of 5 bubbles,Jul 2018 • Family,Life of a Man,"I have come across the great man named Gandhiji where the term Ji denotes respect. Most of my reading largely centred around the independence of India. The museum was really an eye opener as his single mindedness actually begun in South Africa and later on his return to India that moved up multiple notches until the day he died; shot by a fundamentalist. The museum takes you back to his formative years, his way of life, legacy and most of all what he stood for. Most impressive that makes us look like less than mere mortals."
National_Gandhi_Museum,nik_0107,5.0 of 5 bubbles,May 2018 • Family,Peaceful and Well Maintined,Great museum to see some of the historical photos and belongings of Mahatma Gandhi. There is no fees to enter the museum and they also show are short video on Mahatma Gandhi.
National_Gandhi_Museum,Charles H,5.0 of 5 bubbles,Jun 2018 • Family,Still moved by the loss of a great spiritual leader ,"Just over 70 years ago, I recall sheer desolation in the normally busy streets. Visiting the site where Gandhi spent the last 144 days of his life and to read his sayings alongside historical photos was the most moving experience of our tour of Delhi and Shimla. At this beautifully maintained and such peaceful centre, we spent two hours studying the simple belongings of a humble leader and watched a truly moving video recalling the manner of his passing on 30th January 1948, before retracing his last steps in the garden. Highly recommended place to visit when in New Delhi."
National_Gandhi_Museum,Kathleen M,5.0 of 5 bubbles,May 2018,Very Moving To Be There,"It is quite moving to follow the steps he took to his final moment. Beautiful, well tended grounds and buildings. Free to public. I'm very glad I went. Also a wonderful shop that benefits underprivileged artisans."
National_Gandhi_Museum,Kelly K,3.0 of 5 bubbles,Mar 2018 • Family,Peaceful and well kept park,It was a lovely way to spend an hour with quite a walk between plaques and statues. Not much shade if you have little ones
National_Gandhi_Museum,46susan46,5.0 of 5 bubbles,May 2018 • Couples,great interesting mueum,we arrived early to beat the heat and had plenty of time to appreciate this fab museum and get to have a proper look at all the displays
National_Gandhi_Museum,Peter F,5.0 of 5 bubbles,Apr 2018 • Couples,Informative,This venue is worthwhile from a historical and informative point of view. Well worth a visit and very pleasant to walk around.
National_Gandhi_Museum,Ted B,4.0 of 5 bubbles,Apr 2018 • Solo,Good reminder of Gandhi's life,"A good place with many interesting displays including his sandals, the staff he used on his march to the sea, and the clothes he was wearing when he was assassinated.  Worth a visit."
National_Gandhi_Museum,DotM53,5.0 of 5 bubbles,Mar 2018 • Couples,"Amazingly moving, quiet and reflective museum","I could easily have spent all day at this museum.  We were lucky to go on a really quiet day at the museum.  The impact of seeing where Gandhi spent his last days and where he was killed is quite profound and moving.The displays in the museum of his life and history and many, many of his thoughtful and provocative quotes are quite spellbinding.I did not expect to be so affected by our visit, so I was quite blown away.  We have traveled in many countries and been to countless museums, this is one of my absolute favorites."
National_Gandhi_Museum,cisco289,4.0 of 5 bubbles,Apr 2018 • Friends,Learn About this Very Special Man,"A trip without finding out about Gandhi is like visiting the U.S. and not learning about Lincoln (or even Disney Land). He was so very brave and focused----and, of course, nonviolent. The museum offers much about his life, journeys, trials & tribulations. He is a great example of the kind of human I wish I was strong enough to even approximate."
National_Gandhi_Museum,John S,5.0 of 5 bubbles,Mar 2018 • Couples,Must See,Walked here from my hotel and had a great time reading about Gandhi and his live and writings.  Very thought provoking and would like to read more in the future.  Easily walk around the complete and readings on the walls.  2 hrs max.
National_Gandhi_Museum,prkota05,5.0 of 5 bubbles,Dec 2017 • Friends,Mahatma Gandhi museum,Belonging achievements and history of Mahatma Gandhi is shown here so nice place and it's tribute to Gandhi ji
National_Gandhi_Museum,goodguyjas,4.0 of 5 bubbles,Mar 2018 • Solo,Small museum celebrating a legendary human being ,This is not a big place to visit but I was surprised to find it seemed to be free when I was there. I don’t think I jumped any queue or missed something but was ushered through the gates like others by a uniform guard and had the usual security check. The main building was very busy when I was there and there is a lot to read and look at. The garden area was pleasant enough but there was only the gift shop after. This was not on my main tour so relied on my own day trip using the Tuk Tuk taxi. Great fun and pretty cheap if you can do a deal with a drive for a number of hours.
National_Gandhi_Museum,_neil_ackerman1950,5.0 of 5 bubbles,Feb 2018 • Friends,Historical event that made a Nation,Seeing where Gandhi spent the last fourteen days of his life was a highlight at the start of an Incredible Trip. The humbleness of this man and the history showing how he reached there was humbling in its own way to the visitor. Very well laid out and serene in a city of noise. Very enjoyable.
National_Gandhi_Museum,AussieTravellers555,5.0 of 5 bubbles,Mar 2018 • Couples,Fitting tribute to a great man,Very informative and well kept museum. It is a fitting tribute to a very inspirational man. A reminder of who he was and what he achieved in his lifetime. Well worth the visit.
National_Gandhi_Museum,Alice V,5.0 of 5 bubbles,Feb 2018 • Friends,A must-see!,"This small museum houses a weath of information about Gandhi in a variety of formats -- letters, histograms, photos, paintings, and physical objects.  While not modern, and far from the ""slick"" presentations of many newer museums, the National Gandhi is nonetheless one of the most effective sources of information and insight into one of the world's most remarkable men. "
National_Gandhi_Museum,RWHinze,5.0 of 5 bubbles,Mar 2018 • Couples,A lot of history here,"This is where Gandhi spent his last hours his foot steps are raised showing his path up to the assassin.  His home is what one would expect from Gandhi, simple modest, and open.  There is much history all around the grounds showing Gandhi's life and accomplishments.  "
