Tourist Attraction,Name,Rating,Date and criteria,Title,Review
Butler_Palace,kushBans,3.0 of 5 bubbles,Apr 2019 • Solo,Good location,The palace itself is not so much magnificent but it is well maintained from inside as well as outside. 
Butler_Palace,shobha agarwal,3.0 of 5 bubbles,Nov 2017 • Family,Just a residential colony,Nothing unique and no need to visit this place. It is just a residential colony of government officers wherein you will get to see huge bungalows of IAS officers.
Butler_Palace,sshuklalko,3.0 of 5 bubbles,Jul 2017 • Couples,It's Government officers residential colony...,"It has nothing royal or regal only huge bungalows for IAS officers were there ,now they are constructing apartments inside colony so lots of dust and pollution .The only speciallity is AKANSHA Foods which provide  snakes items and grind masala ."
Butler_Palace,sujatapant,3.0 of 5 bubbles,Oct 2016,Nothing regal about this palace,"This is now the property of the GOVT and houses the officers of the state GOVT . Nice open spaces , green area good for walks , and akanksha is here , which is a ngo run by women from the weaker section ,who prepare the most delicious snacks."
Butler_Palace,indiatravel35,3.0 of 5 bubbles,Feb 2016 • Solo,historical place and now residential colony,"this place has historical significance, now resident colony inside this place ,was built by Spencer Harcourt Butler."
Butler_Palace,Sajeed K,4.0 of 5 bubbles,Feb 2016 • Solo,Great Rajastani Architecture,"It is beautiful palace was used for the official residence of Sir Harcourt Butler. After independence, the Palace had been the academic centre (Library)  of the Indian Council of Philosophical Research (ICPR) until 2005 when the Council vacated the Palace following the Supreme Court order. Built in Rajasthani style, it is a four faceted  palace  and a rare object of architecture.There is a lake adjacent to the Palace which provides a magnificent look to the Palace. The Palace is  the property of to Raja of Mahmudabad, Mohammed Amir Mohammed Khan, hence you can see it from outside only."
Butler_Palace,rchohan,4.0 of 5 bubbles,Aug 2014,residential colony,it is a residential colony near botanical gardens in Lucknow and houses the elite class of Lucknow . there is a small water body near the place but mainly residential area 
