Tourist Attraction,Name,Rating,Date and criteria,Title,Review
Gautam_Buddha_Park,Tanvi,5.0 of 5 bubbles,Dec 2019 • Family,Peaceful place,It is one of the places where you feel positive vibes and peacefulness in Lucknow . Spent some quality time with my family here .
Gautam_Buddha_Park,Yogesh P,4.0 of 5 bubbles,Dec 2019,Nice place for visit,Very nice place for visit with family. There was many trees in park. You may visit with food from home and enjoy lunch there. There was different swings for kids.
Gautam_Buddha_Park,Niraj K,4.0 of 5 bubbles,May 2018 • Friends,Ideal for Summer Evenings,A nice place for spending evenings in hot summer. Attraction for kids to enjoy the Pedal Boat ride in an arificial river.Even you can enjoy your evening time here in cool breeze.
Gautam_Buddha_Park,Nabeel N,4.0 of 5 bubbles,Mar 2019 • Family,Calm and peaceful ,Very nice place to visit with family. Spent a day with family there and it comes out to be peaceful and fun. Really good tress everywhere. You can take your home food there. Perfect for family outing.
Gautam_Buddha_Park,rsraghavan6,5.0 of 5 bubbles,Apr 2018 • Business,Nice place,"It's the most old and popular park in Lucknow, great place to spend a entire day with your family, you better get your food stuff with you, they have it there but a bit over priced. They also have parking facility.Have Fun!"
Gautam_Buddha_Park,Manas R,3.0 of 5 bubbles,Feb 2018 • Solo,Common park,A good place when you are with your friends but don't expect some extraordinary experience here. Many other places are there in Lucknow to explore when you come here for few days.
Gautam_Buddha_Park,592abck,4.0 of 5 bubbles,Mar 2018 • Family,Best place here,"Best place here in Lucknow to spend time with everyone. Clean place, ample parking and peaceful environment"
Gautam_Buddha_Park,nirmalsrivastava1000,5.0 of 5 bubbles,Feb 2018 • Friends,best park in lucknow,"This is seriously one of the best park in lucknow with all its attraction like the roller-coaster , swinging boat and the big water slide though i think the slide has being closed now , but still it is on of the best park .It even has a big park to play .A part place to bond with family "
Gautam_Buddha_Park,Inspiration821481,3.0 of 5 bubbles,Mar 2018 • Family,Great place to hangout with kids,"There is literally ample space for the kids to roam and play by themselves, but fr me its that dragon boat swing makes my day..."
Gautam_Buddha_Park,Amit M,4.0 of 5 bubbles,Apr 2018 • Solo,Remebrance of my childhood days,I used to visit this park when I was a school going child. Despite being one of the oldest park of Lucknow; it is still maintained. Becomes bit crowdy with children in the evening. Visited this place again in Apr'18 during my visit to Lucknow for remembrance of my childhood days
Gautam_Buddha_Park,Niya1315,3.0 of 5 bubbles,May 2018 • Solo,Children Park,"There is another park adjacent to it, which is called Hathi Park. This park is little more greener than Hathi Park.Gautam Buddha Park becomes crowded during weekends. Nice place to go with family and friends."
Gautam_Buddha_Park,Robert G,1.0 of 5 bubbles,Dec 2017 • Family,How parks would look if designed by someone who hated children.,"Nothing works, everything is rusted, the lake looks like it is a sewer and there are transvestites wandering around asking for money.Thank goodness the Buddha has already achieved enlightenment so he is spared another reincarnation and the possibility of having to visit his park.Avoid at all costs."
Gautam_Buddha_Park,Aarav K,5.0 of 5 bubbles,Jan 2018 • Family,Popular Park,From childhood I am going here. This park is quite fame in lucknow. A large number of people come here to enjoy. I love to go here. Must visit place for everyone.
Gautam_Buddha_Park,AAA,5.0 of 5 bubbles,Sep 2017 • Family,Impressive,Must visit place of lucknow. Gautam Buddha park is quite green and beautiful all around. There is a fascination in the park. There is a lot to do fun.
Gautam_Buddha_Park,Hitesh Rathore,3.0 of 5 bubbles,Apr 2017 • Family,A community park,"This Gautam Buddha park is one of the attractions of Lucknow,located on the verge of the city was built 30 years ago. It's a perfect half a day out with family with children rides boats lawns and other facilities to hang around."
Gautam_Buddha_Park,Dryogendranath M,4.0 of 5 bubbles,May 2017,"Visit to Gautam Budha Park, Lucknow",This  place is worth visiting by the visitors of any age. It is situated in the heart of the city and can be easily accessed.The natural scenes arequite impressive 
Gautam_Buddha_Park,Aman K,5.0 of 5 bubbles,Aug 2017 • Family,Best park for people of all ages,One of my favorite parks. It's very popular park. There is so much fun for every age of people. There is a lot of interest here especially for children. Very nice place to go with your family.
Gautam_Buddha_Park,Vibhu S,4.0 of 5 bubbles,Dec 2016 • Friends,Oldest Park in Lucknow,This is place of Gautam Buddha Park in Lucknow nearest of College and there was different type of Hammock
Gautam_Buddha_Park,msadiqsalman,5.0 of 5 bubbles,Feb 2017 • Family,A Must visit place for childrens,"The park is very famous for its swings and boating. There is a canteen also , although not very good. The ticket is quiet cheap and the toy train is also very attractive among children."
Gautam_Buddha_Park,saini74,4.0 of 5 bubbles,May 2017,Walk on Greenish,"good space with greenish area and cleaness. Good place to spend quality time with childrens in cool evening only, the ticket fare also very less, playarea is nice, kids love it"
Gautam_Buddha_Park,rachvinod,4.0 of 5 bubbles,Jun 2016,good garden,This is quite a good green open space for people to enjoy long walks and children to play around happily.
Gautam_Buddha_Park,BantakalDotCom,4.0 of 5 bubbles,May 2017 • Family,"Children's or Kids Park in just 6km from Lucknow Railway station,","This park is around 6km away from railway station. It's having children's play area, walking track and seats to sit and relax for some time. Entry to this park is Rs 5 and the perfect time to visit this park is around evening. This park is very easy to find as it's attached to the main road. Park opens at 7am and closes at 9 pm. Do not forget: If you found this review helpful, please click THANK below."
Gautam_Buddha_Park,Shruti_Poki,4.0 of 5 bubbles,May 2017 • Friends,Recreation park for family outings,"Famous among children and families for evening recreational outing. Rides, Boating and eateries make this a budget accessible place for all. fun day activity place."
Gautam_Buddha_Park,kc j,4.0 of 5 bubbles,Mar 2017,A good park for children,This is a nice park with a good statue of Gautama Budha.  It has a number of rides and swings for kids. In fact it has a lot of amusement for the children. It is well kept.The boating facility is ok. The day we went it was not operating.
Gautam_Buddha_Park,Kakoli C,1.0 of 5 bubbles,Mar 2017 • Couples,Can be avoided,This place and adjacent Kansiram Smarak are grand structures constructed with pink colored rock. These huge structures are completely made of rock and become so hot it's difficult to go ear it during summer. Avoidable.
Gautam_Buddha_Park,Makarand Pundalik,5.0 of 5 bubbles,Mar 2017 • Business,very good,quite well maintained place. better to go in evening or early morning if you are visiting in summer. 
Gautam_Buddha_Park,Ronak J,5.0 of 5 bubbles,Jan 2017 • Couples,Good place,This place give me the soothing and calming effect everytime I visit just a fantastic experience and memories here
Gautam_Buddha_Park,Ronak S,4.0 of 5 bubbles,Nov 2016 • Business,another beauty,Lucknow has some of the best parks in town. The Gautam buddha park is huge and very peaceful. Good place to spend time with family on weekend evening
Gautam_Buddha_Park,sujatapant,3.0 of 5 bubbles,Jul 2016 • Friends,nice place,"this is an old park built on the river banks of the Gomti river.it is peaceful till the crowds come in .it has places to sit,relax,boating .could do with some better upkeep."
Gautam_Buddha_Park,SKBhatiya,5.0 of 5 bubbles,Dec 2015,worth a visit,"My childhood memories are relived by visiting this park almost after 24 years, it has been well kept and is much better now.a good place to spend half a day or an entire evening with family and children. Children will enjoy here"
Gautam_Buddha_Park,sunilagrawa111,3.0 of 5 bubbles,Aug 2016 • Couples,An old park,The park was built about 40 years back on the bank of  river Gomti with pedal boat  facility.It was an good attraction till 20 years ago but gradually lost its attraction.It is not very well maintained and some new attractions should be added to repopulate it. Just time pass place
Gautam_Buddha_Park,shalinisharma,5.0 of 5 bubbles,Jun 2016 • Friends,Best place to hangout in evening,"If you are looking for a peaceful place to spend your evenings, do visit this place..With and amazing view of gomti nadi and beautiful breeze you are surely going to come back. Plus the lighting on the gomti bridge makes the view spectacular."
Gautam_Buddha_Park,Nivesh A,2.0 of 5 bubbles,Sep 2015 • Family,An old attraction,It is just an old attraction. Nowadays it does not have anything interesting. Not many people go here as there are better places inlucknow to visit... in terms of parks
Gautam_Buddha_Park,Vijaypsingh81,4.0 of 5 bubbles,Jul 2016 • Family,"Excellent Park, nicely maintained.",Small but very beautiful Park in Lucknow.one can visit the place in the evening in Park lighting.It has got very nice boating.overall ambience is good in this park.
Gautam_Buddha_Park,NayanKothari,4.0 of 5 bubbles,Feb 2016 • Solo,Good place,A huge garden nicely maintained and with nice monuments. Good place for evening or early morning walk.
Gautam_Buddha_Park,nik_0107,4.0 of 5 bubbles,Sep 2015 • Friends,Well Kept,"Well maintained, great to visit during evening. Right next to the river bridge and offer great photo shots."
Gautam_Buddha_Park,Arpitgupta25,5.0 of 5 bubbles,Mar 2016 • Family,Evening place,An ordinary park with boating and lots of food shops and park struture is good beside gomti river ..
Gautam_Buddha_Park,travellerasr1407,2.0 of 5 bubbles,Apr 2016 • Family,One can miss,"An ordinary park with buddha statue, needs good maintaince, dusbins were heaped full and was not cleaned for long"
Gautam_Buddha_Park,Sundeepgupta,4.0 of 5 bubbles,Mar 2016 • Business,old and beautiful,"while the city has a lot of parks now, this old park still have its own place. It is very famous among locals for evening outing with children."
Gautam_Buddha_Park,Romil M,4.0 of 5 bubbles,Nov 2015,nice,its a nice place and very calm and relaxing.. u will enjoy it if u r a believer must visit if in that area
Gautam_Buddha_Park,manoj k,4.0 of 5 bubbles,Jul 2015 • Business,Good park visit for Pcnic,one can visit this park with young children . young enjoy this park playing. a picnic can planed in winter specially on a sunny day. Nice Park  
Gautam_Buddha_Park,chetan1586,4.0 of 5 bubbles,Nov 2015 • Family,Nirvana,Buddha park is one of the few attractions in lucknow where once can go to find peace. Another attraction in the park is the boat ride
Gautam_Buddha_Park,nitu_gupta_in,4.0 of 5 bubbles,Nov 2014 • Family,good park !,"plan trip with kids. enjoy boatride in the shallow artificial stream flowing around. The park is near to other parks (lemon), so enjoy that area"
Gautam_Buddha_Park,ApurbaRoy,3.0 of 5 bubbles,Sep 2015 • Family,outing,A place to relax in busy chowk area. Though approach road from all corners are busy and congested. A good place for taking children to stroll and outing
Gautam_Buddha_Park,Taz_Bh,3.0 of 5 bubbles,Apr 2015 • Friends,It can open any time and close any time.,The park is no doubt huge and beautiful. But the gates for some reason remain closed and some times open at very weird timings.We happened to notice this as we stayed quite close to the place and wanted to visit the same but could not manage an entry cz of the constant closure. The disputed statues are however humongous and well visible from outside as well.
Gautam_Buddha_Park,Avadh B,5.0 of 5 bubbles,Sep 2014 • Friends,Very Beautiful,I went to this park with lot of hesitation but it is really beautiful. The elephants sculptures are really huge and made with awesome and sharp work with no scope of mistake.
Gautam_Buddha_Park,mountaincharm,4.0 of 5 bubbles,Oct 2014 • Friends,Little natural world in the heart of city. ..,"Although situated between the crowded part of city, but it is a little natural world to please you when you are tired. In front there is busy city road, and behind is river gomti.  Size is few hundred meters. Park is split into two part green park and ride portion.           Green Park comprise of small canal system in which boating by paddle boat is done, and around that a walk way is made. There are two artificial mountain shaped bumps.  And one artificial island.            Ride portion was once a attractive portion but now no fun. Canteen is also there but good quality is average."
Gautam_Buddha_Park,Pratibha C,3.0 of 5 bubbles,Dec 2013 • Family,Good place for kids to enjoy,Buddha Park is a nice mid size park for kids to have fun around  and enjoy few swings. Food outside the park is available.Boating facility is also available.
Gautam_Buddha_Park,mountaincharm,3.0 of 5 bubbles,Mar 2012 • Family,Small Fun park,"300 *150 meter in dimension, side to a road, 4 meter wide 200 meter long loop canal for boating and two mountain shape artificial bumps, attached is a jhula park having 3-4 rides, snacks coffe south indian food available but not good,"
