Tourist Attraction,Name,Rating,Date and criteria,Title,Review
Husainabad_Clock_Tower,Ajjoo A,4.0 of 5 bubbles,Aug 2017 • Family,An Evening at Clock Tower in Lucknow,"During our last visit to Lucknow , India , we have been Clock Tower area in the evening of August and got a pleasant surprise to see the giant clock of tower is working and looks amazing,  the clock was out of order for many decades .The Clock tower along with other place like Sat Khamba, Picture Gallery & Park is very well illuminated with lights. Hats off to the authorities for developing the area in to a clean and modern tourist place form old narrow and congested area.This area is a must see now for lovers of historical buildings and places.Historical facts beautifully crafted on pillars. The Tower was built by Nawab Nasiruddin Haider on the occasion of arrival of 1st Lt. Governor George Couper. Its Historical, beautiful and must see area."
Husainabad_Clock_Tower,Aarav K,5.0 of 5 bubbles,Aug 2017 • Friends,Clock Tower,Clock tower near Rumi Gate is very tall and beautiful. There is a clock in it that helps the people coming to see the time. It is also called the Ghantaghar of Lucknow.
Husainabad_Clock_Tower,Vibhu S,5.0 of 5 bubbles,Jun 2017 • Friends,Husainabad Clock Tower,This is developed by Britishers and this is call place Ghanta Ghar in Lucknow and very strong and high peak of tower 
Husainabad_Clock_Tower,Mohsin A,4.0 of 5 bubbles,Aug 2017 • Friends,Part of history,"Husainabad clock tower is among the tallest clock towers in India. It's near chota imambara and part of heritage zone in lucknow. Surrounding has become much better than before but can be further improved. Modelled in Big Ben its simple but important part of Lucknows history,culture and architecture. Deserves one visit."
Husainabad_Clock_Tower,sid_ups,5.0 of 5 bubbles,Apr 2017 • Friends,Attached with Romi Gate,This is a pillar type clock tower same as the Clock Tower of London and very close to Romi Darwaja. You can see this easily from the main road.
Husainabad_Clock_Tower,Neighborhoodfoodie,5.0 of 5 bubbles,Jun 2017 • Solo,Ghanta Ghar,must visit place knows as the ghanta ghar clock tower .build during nawabs duration showcases the architect 
Husainabad_Clock_Tower,Ikreatepassions,4.0 of 5 bubbles,Jul 2017 • Family,A Historic Significance,"This place speaks about the history of Lucknow, standing 22 ft tall, this tower clock was used as a means of mass communication in older times. Built in the year 1881 it also marked the arrival of Sir George Cooper, the fist lieutenant governor of Avadh. It was built by Nawab Nasirudin Haider, and today its a sight of tourist attraction in Lucknow."
Husainabad_Clock_Tower,rockzzM77,2.0 of 5 bubbles,May 2017 • Friends,A tower in old Lucknow,"This clock tower is situated near chowk in old Lucknow, it's a simple tower nothing special to visit, "
Husainabad_Clock_Tower,Seema H,4.0 of 5 bubbles,Feb 2017 • Couples,Beautiful Clock Tower ,"The Husainabad Clock Tower is a landmark in Lucknow. It is 221ft tall and imposing monument built of gunmetal. It is the oldest Clock Tower in Lucknow .Located near the Imambara, it is a must see"
Husainabad_Clock_Tower,sun_abhay,5.0 of 5 bubbles,May 2017 • Family,Oldest clock tower of Lucknow,"Now under maintenance, oldest clock tower of Lucknow, located near Rumi Darwaza, Imambada and Bhulbhulaiya . "
Husainabad_Clock_Tower,SomnathKhaskel,4.0 of 5 bubbles,Jan 2017 • Friends,The tower was built to indicate the arrival of the first Lieutenant Governor,"The Clock Tower construction was originally started in 1840 by Nawab Nasir-ud-Din Haider, but when the Nawab died the construction stopped at 4th storey. The rest of the construction was later renewed and the tower was completed in 1887. The architectural style and the material used to build the Husainabad Clock Tower, is an example of the excellence and finesse of the British architecture. The tower was built to indicate the arrival of the first Lieutenant Governor of United Province of Awadh, Sir George Cooper. The 221 feet tall clock tower is built of gunmetal by the Husainabad Endowment Trust. The material to build the clock tower was especially imported from Luigate Hill, London."
Husainabad_Clock_Tower,Alok N,4.0 of 5 bubbles,Feb 2017 • Couples,CLOCK TOWER,"The Guide will tell you the History of the Clock Tower and some other interesting facts. Since it is on the way from Bara Imambara to Chota Imambara, it is easily accessible."
Husainabad_Clock_Tower,lovetoootravel,4.0 of 5 bubbles,Mar 2017 • Couples,It's part of Lucknow's history,This iconic clock from the British ruling days is in excellent condition.  Can be viewed from the ground or from the Terrace at the next door picture gallery.
Husainabad_Clock_Tower,authorneelesh,5.0 of 5 bubbles,Feb 2017 • Couples,Being developed,"An imposing structure, it is currently being developed with  sit outs, cafes etc under construction.Will be a very good place to lounge around once fully developed.The clock tower it self is well preserved and looks imposing"
Husainabad_Clock_Tower,vinitasaraf2015,3.0 of 5 bubbles,Oct 2016 • Friends,Just a clock Tower,"Its a 18th century clock tower, nothing much. Saw it from the car itself. Nothing great.Very tall indeed"
Husainabad_Clock_Tower,Auscoach,3.0 of 5 bubbles,Feb 2017 • Friends,It's a clock?,Clock towers are important in Indian towns this one was broken. They are building a park around it but good luck with keeping it clean. Colonial build of moderate interest 
