Tourist Attraction,Name,Rating,Date and criteria,Title,Review
Kal_Bhairav_Temple,RAJIV1954,3.0 of 5 bubbles,Dec 2018 • Couples,Unique,The temple is located around 10 kms from the city centre. The temple is unique in the sense that devotees offer hard liquor as the offering to the God Bhairav. There are lot Langgors in & around the temple.One should plan to go there only during the day because of it's far away location
Kal_Bhairav_Temple,VivekPriyadarshi,4.0 of 5 bubbles,Dec 2018 • Family,Whiskey offered to the Lord,Yes.. The temple is around 8 kms from the Mahakaleshwar temple.. Autos ply from there regularly to Kal Bhairav temple.. Was amazed to see people carrying whiskey bottles in the Prasad basket as an offering.. Was told that the deity drinks the offered alcohol.. But you cannot see this.. People pour a few drops in a bowl kept in front and carry the rest home.. Must visit to see this unique thing.. 
Kal_Bhairav_Temple,Vishnu Pendyala,5.0 of 5 bubbles,Dec 2018 • Solo,Does the presidiing diety really need hot liquor?,Watched a number of devotees offering whiskey and what not to the Presiding Diety. Strange practice!
Kal_Bhairav_Temple,Karpagavalli,5.0 of 5 bubbles,Nov 2018 • Family,The guardian of ujjain,"He is the guardian of the ujjain city and the gadkalika mata, one of the shakti peedam in the city. the sayana aarati is from 830pm and is  so divine. "
Kal_Bhairav_Temple,Hitesh Rathore,4.0 of 5 bubbles,Dec 2018 • Family,Kaal bhairav ALCOHOLIC,"Had only heard about it, but for the first time seen here people carrying alcohol to the temple. Strange but true liquor bottles were sold outside shops and pandit ji in the temple was opening the bottles and offering it to the God...... Great"
Kal_Bhairav_Temple,Ashish Gupta,5.0 of 5 bubbles,Jan 2018 • Friends,Bhagwaan Drinks Whiskey,"visited this place on dry day on 26th Jan. didn't had a chance to see the magical event, this place is far from Mahakaal Temple if you don't have car then you can book auto from Temple."
Kal_Bhairav_Temple,meenakshimuthusamy,5.0 of 5 bubbles,Oct 2018 • Family,Well Divine,The temple is very divine.The place is very nice to visit and good feel is felt on the inclusion of the temple in the tour.
Kal_Bhairav_Temple,babita13,5.0 of 5 bubbles,Dec 2018 • Family,Amazing,The statue of deity is very attractive. Kal Bharaw is said to be Senapati of Lord Shiva. This is the place which is visited most commonly after Mahakal so there is rush but they manage it. the statue sucks alcohol and it is interesting factor.
Kal_Bhairav_Temple,Shubham Karwa,4.0 of 5 bubbles,Dec 2018 • Friends,Know before you go,"Famous for its suspense regarding how bharu baba drink and its vanishes.Anyways take your hard drink as prasad from outside as shops in the premises doesnt keep all brands and keep just local vodka, etc that to with high margin !!So do take it from outside. !!Visit if u visit mahakal so that your wishes come true soon.."
Kal_Bhairav_Temple,Namjoshi,5.0 of 5 bubbles,Nov 2018 • Family,"Kal Bhairav Temple, Ujjain",It is said that Kalbhairav was militory head of God Shankar. In temple you can see some paintings made during King Parmar fro Malawa. While chanting some mantras you can see he sucks the alcohol given for him near mouth.
Kal_Bhairav_Temple,shaileshjpai,3.0 of 5 bubbles,Nov 2018 • Couples,Temple,In this temple liquor is given to kalbhairav deity. You have to purchase a bottle  of liquor from liquor shops around the temple. They pour some in a saucer and pour in the mouth of the  deity.
Kal_Bhairav_Temple,poojathakur13,5.0 of 5 bubbles,Nov 2018 • Family,Must visit to see the unique prasad,The uniqueness of this temple is the Prasad offered to the diety bhirava is alhohol. The temple is easy to go to and no longer queues.
Kal_Bhairav_Temple,Vineet_Tuli,5.0 of 5 bubbles,Sep 2018 • Business,Amazing !!!,We visited Kaal Bhairav & it is one of the main temples of Ujjain. The aura of god is awesome & there is quite a rush in the morning thus plan accordingly.
Kal_Bhairav_Temple,Yash,4.0 of 5 bubbles,Oct 2018 • Family,A unique temple,"This is a unique temple of the God of Death. The deity is given alcohol as a prasad, and you can find liquor shops outside the temple. The rock, where the prasad is offered, absorbs the alcohol, and no other liquid. This is what makes the temple extremely unique in its own way"
Kal_Bhairav_Temple,Ajay KMehta,5.0 of 5 bubbles,Oct 2018 • Friends,Small but loving and powerful,Very powerful but small and quiet.You could feel the presence of God.Did Aarti and was touched by the simple beauty within.
Kal_Bhairav_Temple,Pree B,5.0 of 5 bubbles,Oct 2018 • Family,Peaceful..,We heard so much about this temple that it was a must see on our bucket list... it was the first time that we went to a hindu temple where alcohol was being offered... 
Kal_Bhairav_Temple,Atul Shah,4.0 of 5 bubbles,Nov 2018,the diety that drinks wine,a relatively clean hindu temple with daru as the offering and the prasad as well. a novelty to see and experience 
Kal_Bhairav_Temple,Ravi D,4.0 of 5 bubbles,Nov 2018 • Family,Lord Kal Bhairav drinks liquor here,"Lord Kal Bhairav is offered liquor, which is put in a plate, put at the lord's lips and liquor vanishes somewhere (supposedly Kal bhairav drinks the same).If you want to offer liquor, it is available (both country made and English) in the market surrounding the temple. Worth a visit"
Kal_Bhairav_Temple,Dilip123,5.0 of 5 bubbles,Oct 2018 • Family,Deity who drinks liquor!,The ancient temple of kaal bhairav is a must visit in Ujjain. There are shops outside the temple that sell offerings that include liquor. We did not buy any of those offerings but witnessed the miracle of the deity drinking liquor.Liquor is poured into a silver saucer and  then poured into the open mouth of the idol. The remaining liquor in the saucer is retained in a silver pot in front of the idol and half the unused liquor in the bottle is returned to the devotees as prasad!
Kal_Bhairav_Temple,meghashyam,5.0 of 5 bubbles,Nov 2018 • Friends,Kaal bhairav ,One of three kaal temples other two being Mahakaleshwar and Gadkalika maa temple . Kaal bhairav emanates power n protection . Lord is swamboo .
Kal_Bhairav_Temple,Payal G,5.0 of 5 bubbles,Sep 2018 • Friends,Foreign liquor = Wishes on fast track,A unique temple in Ujjain where alcohol is the primary offering made to the diety. Kal Bhairav is considered to be the Senapati (Commander-in-Chief) or the guardian deity of Ujjain. It is an important shaivaite temple where thousands come to pray daily. The local shops surrounding the main entrance sell a variety of alcohol which is the primary offering (they claim that offering foreign brands makes the Lord fulfill wishes faster). A jatra or festival day while crowded is very colorful (crowd can get unruly). One has to be wary of pickpockets in the crowd.
Kal_Bhairav_Temple,ANAND V,5.0 of 5 bubbles,Sep 2018 • Family,Baba Saheb ki Jai,Kal Bhairav also known as Senapati of lord Shiva. This is one of the very ancient temple of Ujjain. Its believed and also can be observed that Baba saheb (Lord Kal Bhairav) himself have the alcohol in this temple. You will definitely feel relaxed and one can feel a mental peace in temple campus.
Kal_Bhairav_Temple,Sunnilbgautam,4.0 of 5 bubbles,Oct 2018 • Family,Guardian of Ujjain,"I visited it around 9am Aarti. In spite of the loud music played, it was sirene & peaceful. Could feel a strong presence at the Alter. It was wonderful. There is also a Dutta Temple here. The backyard garden has a few monkeys (Langoors) swinging up the tree branches. It was quite a watch for my Son."
Kal_Bhairav_Temple,Mahesh Kulkarni,5.0 of 5 bubbles,Oct 2018 • Couples,Tirth of Alcohol to Lord Shiva at Kalbhairav Temple Ujjain,Offer in of Alcohol to the Lord Shiva is the differentiator of this temple from other Shiva Temple.Devotees bring alcohol and the  Statue of Lord Shiva is fed with this unique offer ing and it goes down inside mouth if the statue.A must visit Shiva Temple at Ujjain.
Kal_Bhairav_Temple,Arvind S,5.0 of 5 bubbles,Jun 2018 • Family,Lord Shiva's bodyguard temple,"Kal Bhairava is as per Indian mythology known as guard to lord Shiva. This temple is situated bit far from main mahakal temple,on the bank of holy river.Devotees used to offer liquor as prasadam. Not much fascinating tourist spot but holy place for Hindus..means a lot..So visit to feel serenity and positive spritual vibes.Must visit along with Mahakal."
Kal_Bhairav_Temple,Swarg tours & travels,5.0 of 5 bubbles,Feb 2018 • Couples,Best & surprising Kalbhairav,"This Temple is approximately 4 kilo meter from main Temple. Kalbhairav is a body guard of Shivji. Kalbhairav takes only wine. Opposite side so many wine Shop here  A surprising things, Still nobody can find where wine is going after giving him too much wine everyday. Don't Miss this place. "
Kal_Bhairav_Temple,rohit s,5.0 of 5 bubbles,Oct 2018 • Friends,Mahakaal visit,Positive devotional place in ujjain. Kaalbhairav is the senapati of Mahakaal.. Very nicely managed devasthan
Kal_Bhairav_Temple,Krishnaveni S,5.0 of 5 bubbles,Sep 2018 • Family,Unique temple where liquor is offered to god,"This temple is dedicated to god Kalabhairava who is told as senapati of Lord Mahakaleahwar. Here liquor is offered to god and when the poojari keeps the plate with liquor near the slit of mouth of the idol, the liquor disappears. Outside the temple there are state government authorised liquor shops. Small gudis dedicated to other gods are inside the temple. It is a custom to visit this temple before visiting Mahakaleahwar Jyotirlinga."
Kal_Bhairav_Temple,anubhavmpm,5.0 of 5 bubbles,Sep 2018 • Couples,Blessings of God,This is a temple where everyone offers alcohol to God Kaal Bhairav. The temple is well kept and maintained and the rituals are soothing. 
Kal_Bhairav_Temple,Omkar P,5.0 of 5 bubbles,Sep 2018 • Family,VISIT TO KAL BHAIRAV TEMPLE,The temple is very old but there are lot of devotee and here the peoples are giving wine as a Prasada to God Kal Bhaiav. Arrangement is not so bad.
Kal_Bhairav_Temple,arunbvkumar,5.0 of 5 bubbles,Aug 2018 • Family,God being offered Liquor.,Lord Kaala Bhairav is offered Liquor and the mystery is the idol sips some. it is one of the unique places in our mythology and a must place to visit. Hair Raising experience.
Kal_Bhairav_Temple,Vacation815975,5.0 of 5 bubbles,Dec 2017 • Solo,Jai Kaam Bhairav,"This palace is very mysterious, kaal bhairav temple is very ancient temple, lord kaal bhairav consume liquor as offering from devotees. Very very special palace."
Kal_Bhairav_Temple,rameshtiwari03,5.0 of 5 bubbles,Jul 2018 • Family,Darshan,We have visited many times to Ujjain and went to Kal Bhairav Temple for Darshan. Their apart from other Prasad Liquor is also one item normally serve to God.
Kal_Bhairav_Temple,The Golden Age f,4.0 of 5 bubbles,Aug 2018 • Friends,Mystery God,The mystery of this temple is Alcohol is offered to God and the complete  alcohol  disappears from the plate when offered. Outside the temple small bottles of alcohol are available. As it was saawan month lot of rush in the temple. Another surprising act I found was people throw flowers at diya stand if it gets stuck to it they say there wishes will be fulfilled.    Outside the temple is beautiful you can see Kshipra river from top. Overall a very nice temple can't be missed if you are in Ujjain. 
Kal_Bhairav_Temple,piyushkachchhava,5.0 of 5 bubbles,Jun 2018 • Friends,one of the best temple to visit in ujjain,"in june,we almost visited more than 10 places.where thousands of temples are present.and in all of them kaal bhairav temple is too peaceful where whiskey is the prasad.and the brahmins who do all the care of temple like pooja,aarti and bhajan.a very peaceful environment around this temple,at that temple there is one holy pillar where people throw a flowers and if sticks that means your wish will be fufill."
Kal_Bhairav_Temple,Viral Arya,5.0 of 5 bubbles,Feb 2018 • Family,Jai Kal Bhairav,"This is a Hindu Temple, located around 5kms from Mahakal Jyotirlinga and a must visit to complete darshan of Mahakal. This temple is dedicated to Kal Bhairav, the guardian god of the city. The strangest thing of this temple is that Liquor offering to Kaal Bahirav during worship"
