Tourist Attraction,Name,Rating,Date and criteria,Title,Review
Kal_Bhairav_Temple,Sudha,3.0 of 5 bubbles,Jan 2023 • Friends,Can be avoided,Very unhygienic surroundingsSurprise element was the alcohol offering to the deityThe socalled devotees were only speaking about the alcohol prasad
Kal_Bhairav_Temple,S M,5.0 of 5 bubbles,Dec 2022 • Couples,Very good darshan,"Huge line, but managed a good darshan. 🙏🙏Temple clean and neat.  Lots of monkeys around. There's a temple dedicated to Sri Dattatreya God, single face."
Kal_Bhairav_Temple,pmmathur,4.0 of 5 bubbles,Oct 2022,Very open spacious Temple,Belief is that Kal Bhairav was the lords defence incharge and therefore kal bhairav should be also worshiped with the lord. Here wine/alcohol is offered as prasad to the lord. This temple is far from Mahakaleshwar temple. 
Kal_Bhairav_Temple,williamsamaddar,5.0 of 5 bubbles,Oct 2022,Powerful place,"A trip to Ujjain is incomplete without offering a puja to Kaal Bhairav, the fearsome form of Lord Shiva who is believed to be the guardian deity of the city. Located a little over 5 kilometers to the north"
Kal_Bhairav_Temple,moloybora,5.0 of 5 bubbles,Sep 2022 • Friends,Best place to for Rahu Dosha elimination,This is an unique temple in Tantrik Tradition and supplements Darshan of Maha Bhairav Temple  in Ujjain. The uniqueness is that the devotees offer liqueur in this Temple to the Shrine
Kal_Bhairav_Temple,DrValliappan,5.0 of 5 bubbles,Sep 2022 • Friends,"A rare temple of Kaala Bhairavar (Kal Bhairav) in Ujjain, Madhya Pradesh, Central India","The vaahan (accompanying animal form; a statue of which faces the deity here is dog). There is also an unique tree of lamps just outside the temple. Small temple but, a lot of barricades make long, winding path for queues and combing the steps. Small shrine and on permission, photos / videos are allowed. If one goes through a shop keeper by buying archana items, short cuts to enter and exit temple are provided. No entry fee or charges. Kal Bhairav here is offered with bottles of liquor (as coconut, garland, banana, betel leaves etc are offered in many temples) and there are Pooja items shops with liquor shops outside. An unusual experience."
Kal_Bhairav_Temple,dimpoo1971,4.0 of 5 bubbles,Aug 2022,UNIQUE TEMPLE,"It is said that this must be visited to complete the Mahakaleshwar Darshan.The Prasad is Liquor, but it is not mandatory to offer it. Flowers can also be offered.First time in life I saw liquor being offered to God as Prasad in the temple.Temple is surrounded by shops selling liquor bottle along with flower, sweets etc."
Kal_Bhairav_Temple,BharathiMani,5.0 of 5 bubbles,Aug 2022 • Couples,Unique,A very unique and interesting temple. Kaal  Bhairav ji likes alcohol so that's offered to him. There are liquor shops outside.The temple entrance can be better maintained.
Kal_Bhairav_Temple,Surya Katakam,5.0 of 5 bubbles,Dec 2021,Unique Place where liquor offered to please God,"Shri Kal Bhairav temple is one of the famous and most visited temple of Ujjain situated close to Shipra river, which is located @ 6 km distance from Ujjain Mahakal Mandir.Ujjain Kal Bhairav temple is as much famous as Varanasi Kal Bhairav temple and there are some similarities between these two temple's formalities, one of that is visiting Kal Bhairav temple before visiting the Main Mahakal temple. It is believed that Kal Bhairav temple is located here since 6000 years and also details are mentioned in the Skanda Puranam. Present visible temple is built by King Bhadrasen in 9th century and then renovated during Maratha rulers, and there are suppose to be some good paintings in the Malwa style inside  but they are not visible today. Secondly no one has attention towards them as all eyes are on the deity, into whose mouth liquor is poured. This temple is Known for:1. This Kal Bhairav is regarded as the guardian of Avanthikapuram, which is called as Ujjain today. Due to this reason Ujjain Kal Bhairav lord is also called as Kotwal of the city.2. Liquor is offered here to Devotee as Prasad through out the year, witch is strange but true. The Priest offers Liquor in saucer and takes the saucer near the mouth of the Kal Bhairav idol, When he starts tilting the saucer, with in Minutes the wine will get empty and no one knows where it is going. Devotees believes that lord is having this Liquor.3. As per the standard rule Devotees first has to visit this temple and then only visit Mahakal Mandir. It is believed that without visiting Kal Bhairav temple, Ujjain trip will not fulfill and also if you are not visiting Kal Bhairav before Mahakal Mandir Visit, your wishes will not fulfill and will not get blessings of Mahakal. So most of the visitors first Visit's Kal Bhairav and then visits Mahakal Temple.Temple Timings:Morning 06:00 to Evening 08:00"
Kal_Bhairav_Temple,KeshavChakraborty,5.0 of 5 bubbles,Mar 2022 • Couples,Offering of liquor to God,"Very popular among pilgrims and tourists and also believed to be Live, that's why you will find much more crowd in this temple."
Kal_Bhairav_Temple,SudarshanKS,5.0 of 5 bubbles,Apr 2022,unique Kaalbhairav temple,A nice temple dedicated to Lord Kalbhairav. The key offering to the Lord here is liquor sold in shops outside.Very nice kalbhairav moorthy and a blissful darshan
Kal_Bhairav_Temple,abkush,5.0 of 5 bubbles,Dec 2021,Nice temple,"We visited the temple during evening. It's a small temple with people offering liquor to Kal Bhairav ji.There is one huge deepmalika here, which is lighted in evening, we waited another 45 minutes for it to be lighted up, and it was very much worth the wait.The whole process of preparing deepmalika (towers of oil lamps) and lighting it up is quite unique and should not be missed.Darshan are quick and easy."
Kal_Bhairav_Temple,windpace,3.0 of 5 bubbles,Dec 2021,Check if the construction is over if travelling with elderly,"We visited the Kal Bhairav Temple in December 2021 along with my in-laws.  There is a lot of construction happening in front of the temple which meant my mother in law who has problems in walking had to take a round about (uneven) road to reach the temple.  So, if you are planning to visit with elderly or with divaang then you may want to check the status before making plans.  It is not that it is impossible to visit with them but it will likely be inconvenient.  Rest is all like what is said in other reviews."
Kal_Bhairav_Temple,skdel2016,5.0 of 5 bubbles,Nov 2021,Unbelievable but True,Its an old temple complex . The main prashad is wine which is being offered to  Shri Kal Bhairav. The offered wine is drunk by Shri Kal Bhairav statue. Normally there is rush which can be managed better but administration is lacking here . In case of heavy rush Purohit put your offering of wine in container near Shri Kal Bhairav  which later being offered to Shri Kal Bhairav. It's unbelievable but true that statue drink the wine. There might be different science angle in this phenomenon but aastha and believes  are above all logics. Shi Kaal Bhairav is supposed to Senapati ( Head of Army) of Shri Mahkaal Raja.  Beware of Monkeys as well. Jai ho..
Kal_Bhairav_Temple,AnshumanMaini,5.0 of 5 bubbles,Apr 2021 • Family,Kal Bhairav,Good place for a short visit. 5- 10 mins. We went during covid times and nowadays liquor is not being offered. So can't say much but one has to visit it after visiting Shri Mahakaaleshwar Jyotirling and that's about it. Jai Mahakaal!
Kal_Bhairav_Temple,gpradeepshenoy,4.0 of 5 bubbles,Feb 2021,A good temple to visit in ujjain,"Took an auto to this temple. Autos charge Rs 300 for visiting three places, Kal Bhairav mandir, Mangalnath temple & Sandipani ashram. We took an auto at about 6:00 Am so the charge was Rs 300 else the charge would have been Rs 350 as per the Auto driver.                We reached this temple at about 6:20 Am and this temple was completely free of other devotees. No shops which sell liquor/flowers were opened in this time.We had a good darshan of the lord.                Will suggest to visit this temple in early morning to beat heat of the day and also crowds."
Kal_Bhairav_Temple,Ankush Sharma,5.0 of 5 bubbles,Mar 2020,Nice Temple,Very nice place and adorable. You can see lord drinking alcohol in front of you and people tried everything to find out the reason but failed. Must visit the temple. Avoid going on Sunday as you will be surprised to see long queues.
Kal_Bhairav_Temple,Prasad Puranam,4.0 of 5 bubbles,Feb 2020,good place,"Nice place by taxi / auto , it is there belief and faith in the GOD , It is about 20 minutes by auto for visit , if you hire a electric vehicle for Rs 300 for three hours drive "
Kal_Bhairav_Temple,Sktangriin,5.0 of 5 bubbles,Mar 2020 • Couples,Beautiful temple ,The place is well maintained and is thronged by people. The temple comprises statue of Kal Bhairav. The people offer liquor and other things to the deity. The temple is a must visit for people visiting Ujjain.
Kal_Bhairav_Temple,Pramod1953,5.0 of 5 bubbles,Feb 2020,very famous temple.,we visited the temple on 10th Feb.'2020. it is one of the famous temple in Ujjain. The diety is Kal Bhairav. 
Kal_Bhairav_Temple,sangeeta68,4.0 of 5 bubbles,Jan 2020,interesting place,we had gone here after visiting the main temple of ujjain.here they worship god and give offering of spirits!
Kal_Bhairav_Temple,Rudra Sharma,3.0 of 5 bubbles,Jan 2020,Mahakaal and Kaal bhairav unique duo.......,"Ujjain is famous for its Jyotirlinga of Lord Shiva, i.e. Mahakaal; but it is equally famous for the temple of Kaal Bhairav. Situated in the outskirts of the city area, this temple is famous for its unique offering of liquor as prasadam for the deity. Visitors to this temple offer liquor besides usual offerings like coconut and flowers etc to the deity. The priest takes a small quantity of liquor in a plate and takes it near the lips of the deity. Within few seconds the liquor goes inside the mouth of the deity. Throughout the day this system continues and nobody knows as to where this liquor has gone. Obviously, for the followers, it is a miracle of the Lord; and one cannot deny it too as the miracle happens just in front of our eyes, so there is no doubt about rethinking or doubting."
Kal_Bhairav_Temple,hipiyush007,5.0 of 5 bubbles,Jan 2020,Old temple of Bhairo baba,Its an old and ancint temple of Bharion baba. here devotee offer alcohal to Bhairon baba.Alcohal is easliy avaialble on all parshad shop outside temple but prices are on a bit higher side.Main temple entrance is very narrow so you need to wait for on hour in queue on normal days. Its also included in your mandir darshan package of auto.
Kal_Bhairav_Temple,Sourav B,4.0 of 5 bubbles,Dec 2019,Kal Bhairav Temple,"1. Its towards the outside of the city, should cost around Rs 350 inclusive of 6 destination spots (inclusive of this one)2. Legend has it that you offer some sort of alcohol to the deity. You shall easily get it in the stalls outside.3. Though only a bit is allowed to pour in, the rest you can take away as offering prasad."
Kal_Bhairav_Temple,Abhi62001,4.0 of 5 bubbles,Nov 2019,Unique experience,"First time in my life I saw liquor being offered to God in the temple. Long queue for the dharshan. Beautiful entrance, surrounded by shops selling liquor bottle along wit flower and agarbathi. Cleanly maintained temple with lots of youngsters visiting the temple."
Kal_Bhairav_Temple,Mili Dutta,5.0 of 5 bubbles,Sep 2019,Divine,Kal Bhairav temple is a must visit at Ujjain. Divinity at its best. Must visit incase you are Ujjain. Blessed!!The world famous Bhairav statue consuming alcohol can be witnessed here.
Kal_Bhairav_Temple,Gdj,5.0 of 5 bubbles,Nov 2019 • Family,Kal bhairav temple ujjain,Most famous lord bhairav temple in ujjain.i visited on bhairav astami tithi.a lot of devotee there on bhairav astami.
Kal_Bhairav_Temple,Debasish Das,4.0 of 5 bubbles,Nov 2019 • Family,Wine god,"Once in my life ,I saw these god. Take wine as Prasad.there is long queue. So just visit the temple. "
Kal_Bhairav_Temple,Mohan,5.0 of 5 bubbles,Nov 2019 • Friends,Must visit to complete the Mahakaleswar Darshan,"1. It is said that this must be visited to cmplete the Mahakaleshwar Darshan.2. The Prasad is Liquor, but it is not mandatory to offer it. Flowers can also be offered.3. Pooja in the anctum Santorum can be done by requesting the security staff ."
Kal_Bhairav_Temple,varadarajan,4.0 of 5 bubbles,Oct 2019,Sri Kal Bhairav Temple - unique experience,"This temple is famous and unique - wine offering to God is primarily focussed. A clean, well maintained, spacious temple. A must visit temple in Ujjain. Enjoy and get blessed."
Kal_Bhairav_Temple,Satya B,4.0 of 5 bubbles,Sep 2019 • Couples,Kal bhairav temple,"This is place of kaal bhairav where alcohol is offered as parshad. There seems to be no excise rules and regulations... Every prashad shop outside temple sells alcohol alonwith flowers and sweets.. If you visit Ujjain, this is a must visit place... "
Kal_Bhairav_Temple,Rohit Nanda,4.0 of 5 bubbles,Sep 2019,Bhairo baba Temple,I visited the place with family. The temple is big with a lot Monkeys. Wine shop is easily available opposite to the temple.To many beggars so ready for that.
Kal_Bhairav_Temple,vinay760,5.0 of 5 bubbles,Jul 2019,Ujjain Darshan,"this is one the very old and historic temple and must visit if visiting Ujjain,  This is also very crowded and suggest to go on working day.  please read history to understand importance and go with faith and do darshan. there is enough space out side for parking etc and can be managed better along with upkeep and cleanness for such historic temple. "
Kal_Bhairav_Temple,raj_Indb,4.0 of 5 bubbles,Mar 2019 • Couples,"Nice Temple,","This is nice temple, their are many wine shop near this temple, kal bherav is also take wine, I have go to many times in this temple"
Kal_Bhairav_Temple,Nithin M Agarwal,5.0 of 5 bubbles,Sep 2018,A must visit for a better analysis on Hinduism.,"This temple is located near Ujjain and is worth visiting during your tour here. The temple is of Kaal Bhairava, an avataar of Lord Shiva. In Shaivism, he is a fierce manifestation of Shiva associated with annihilation.With faith and proper seeking of resolution, one gets peace of mind and courage do go through different situations in life. There is liquor being served as PRASADI to the Deity here. But, as HINDUISM says -- to connect with Him, you first need to be pure of heart. It is a re-built temple and holds the old MALWA type of architecture for one to visualize and understand.Date of Experience - March 2008."
Kal_Bhairav_Temple,Sivakumar V,4.0 of 5 bubbles,Oct 2018,An Ancient one with peculiar Prasadam,"This Kal Bairav Temple is dated back about 6000 years. The legend of this tmple centres arund Brhma  and Shiva. It is said that Brhma wanted to compose a fifth Veda in spite of Shiva not encouraging. Enraged Shiva sent a child Bhutak Bairav who pinched off Brahma,s fifth head. And to absolve of the sin of hurting Brahma, Shiva asked the Bairav to do penance on the banks of river Shipra. The hence the temple here for Bairav.This purnic episode is said to be in Skanda Purana.The peculiar and strange practice in this temple is that Bairav is offerd Wine as offereing and it is said that when the cup of wine is kept near the mouth of Bairav , the wine disappear! It is a - must see temple in Ujjain"
Kal_Bhairav_Temple,soumendra kumar M,5.0 of 5 bubbles,Jun 2019,JAI KAL BHAIRAV,"A temple dedicated to the Kala Bairava - Yama (God of Death) an incarnation of Lord Shiva.One may offer wine to the Lord here. Lord however, takes very little and returns the maximum part to the devotee as His Prasad. Wine is sold at the gate of the temple. The priests are very cooperative."
Kal_Bhairav_Temple,H. N. Pandey,5.0 of 5 bubbles,Aug 2019 • Couples,Kal Bhairav senapati of mahakal,"Kal Bhairav, A unique temple in india...Where you get wine as a prasada. can offer liquor as Prasad to Lord at any day in India. One can offer any brand of liquor which is available.Also there is unique part is , when liquor is pour , it is getting sucked and never leaked. There is discussion that even scientists have done the experiment to check where the liquor is going and not found the answer yet!"
Kal_Bhairav_Temple,1Jayanthi,5.0 of 5 bubbles,Jul 2019 • Couples,Different practice,"In this temple apart from flowers, most of the devotees offer alcoholic drinks too. These are sold in most of the shops selling the flowers and located across the road from the temple."
Kal_Bhairav_Temple,Jasraj pardeshi,5.0 of 5 bubbles,Nov 2018 • Friends,Mysterious Temple,Once you reach the temple the most abstract thing will happen to you. The people there who sell flowers and haar  for the deity also sell you alcohol. Yes..! and that alcohol you have to offer it to the deity. When you enter the temple just give the bottle of alcohol to the guru there and watch. They offer it to the god in a plate like utensil and the deity literally sucks the alcohol in the plate and where does it go is an unsolved mystery.
Kal_Bhairav_Temple,plpalani,4.0 of 5 bubbles,Jul 2019 • Couples,Temple dedicated to Lord Bhairav,In this temple liquor  is taken as offering to the Lord.The temple is majestic with quite a few steps.
Kal_Bhairav_Temple,Akhil Singal,5.0 of 5 bubbles,Jun 2019 • Friends,Kal Bhairav ka prasad hai Daaru (Alcohol),"Great Place to visit. Travelled from Ujjain by cab and the 8kms run was just fantabulous. Surrounded by Shipra river and the mountains. When I reached,  it was drizzling which made the weather more enjoyable. I was surprised to see the  shops outside the temple were selling only alcohol  as it was the main offering to the God. I used my mobile camera to capture the precious moments. But the stay at this place is good enough for only an hour.Overall the visit was cool but the main thing which excited me was the offering to the God."
Kal_Bhairav_Temple,Luv to Travel,5.0 of 5 bubbles,Jan 2019,Jai Kaal Bhairva !!,Had the opportunity to visit the temple on a Kalashtami day. Surprised to see what was offered to the deity.  Liquor was the main offering and it was really poured into the mouth of the deity and disappeared in a few seconds.  Blessed to be there.
Kal_Bhairav_Temple,Binay Kumar P,5.0 of 5 bubbles,Jun 2019 • Family,Pricing of offerings,"Always try to purchase the bottle of liquor for offering to the Kal vairab from the city, since the local vendors charge a heafty some, don't purchase from there and they ask for price more than the amount printed on it. "
Kal_Bhairav_Temple,Shael,4.0 of 5 bubbles,Mar 2019 • Couples,Alcohol offered by devotees,"Place is good and one of a kind where alcohols are offered by devotees. But this is not mandatory. Once offered you have to take it with you or you can give them to people waiting in temple premises. Do remember due to these offerings, an alcoholic smell will be in garbhagrih."
Kal_Bhairav_Temple,Mitesh P,5.0 of 5 bubbles,May 2019 • Family,Kal Bhairav - Unique place of Worship and faith,"Kal bhairav is unique place. At Kal Bhairav, devotee can offer liquor as Prasad to Lord at any day in India. One can offer any brand of liquor which is available.Also there is unique part is , when liquor is pour , it is getting sucked and never leaked. There is discussion that even scientists have done the experiment to check where the liquor is going and not found the answer yet !!!"
Kal_Bhairav_Temple,skagarwal74,4.0 of 5 bubbles,Mar 2019 • Family,Unusual temple,Shri Kaal Bhairav temple is at the outskirts of Ujjain about 6KM from Mahakaal temple. The temple is unique as liquor is offered here.
Kal_Bhairav_Temple,Giri S,5.0 of 5 bubbles,Apr 2019,Visit to kal bharav temple,"Different experience, not much rush. One can have peaceful and pleasant darshan. A must visit place in Ujjain."
Kal_Bhairav_Temple,trivediar,5.0 of 5 bubbles,Apr 2019 • Family,Amazing & Beautiful Place,It is said that visit to Kal Bhairav Temple is necessary after visiting Shri Mahakaal Temple if you would like to accomplish your pilgrimage tour successful. Very nice and well managed temple.
Kal_Bhairav_Temple,Sanjaykumar P V,4.0 of 5 bubbles,Aug 2018 • Family,Unique temple,A unique temple where whiskey bottles and any other form of liquor is offered as prasad.  Must visit just for the uniqueness
Kal_Bhairav_Temple,Himanshu Bhatt,5.0 of 5 bubbles,Dec 2018 • Family,A unique temple in india...Where you get wine as a prasada.,"kal bhairav is one of the unique temple in india.  Lots of prasad shops outside the temple and liquor/wine is served to god as a prasad.  you can buy the wine bottles from outside shops and give it to pujari , he will put the wine on plate and touch this plate to the god's mouth and within a minute the wine disappeared from plate.. you can experience the live magic by visiting there."
Kal_Bhairav_Temple,Gdj,5.0 of 5 bubbles,Oct 2018 • Family,Kal bhairav temple,One of the most famous temple in ujjain. Prasad of bhairav baba is wine.very crowded and attractive temple.
Kal_Bhairav_Temple,Dipteshrao,4.0 of 5 bubbles,Mar 2019,Good place to see,It is a religious place to see once where Kal Bhairav used to drink liquor Nice place to see visit and experience
Kal_Bhairav_Temple,rathod2017,5.0 of 5 bubbles,Oct 2018 • Family,Kal Bhairav Temple,Kal Bhairav Temple this is one of the famous temple in Ujjain. There is a Shivalinga in this temple which during Mahashivratri attracts thousands of visitors to this religious site. Kal Bhairav temple is said to be related with black Magic.
Kal_Bhairav_Temple,ramnita16,4.0 of 5 bubbles,Mar 2019 • Couples,Non-rushed visit,Visited on Friday evening about 8 PM. There was absolutely no crowd and was able to stand in front of God for sufficient time. Awesome feeling.
Kal_Bhairav_Temple,Dipen Shah,5.0 of 5 bubbles,Feb 2019 • Family,Must Visit once,"A must visit temple in india, where we offer wine to God.Worth watching process how they give wine as prasad to god.Amazing to watch it and blessed by darshanTry to avoid visit on sunday to avoid long que"
Kal_Bhairav_Temple,CHETANsurat,5.0 of 5 bubbles,Aug 2018 • Friends,JAY KAL BHAIRAV BABA,Near Mahakal temple. Going in Auto.Auto fare is 140 to 170. Liquor is served to the Kal Bhairav BaBa and it is believed that Kal Bhairav BaBa consumes it. Liquor is sold in almost all shops in the premises.
Kal_Bhairav_Temple,Yogesh L,5.0 of 5 bubbles,Feb 2019 • Friends,Very Serene,A nice clean temple that has shivling almost 50 ft below the main entrance. In old time it must have been at river bank and now away by about 500 Mts. Must visit for Aarti that takes place at 4am.
Kal_Bhairav_Temple,Leena N,4.0 of 5 bubbles,Jan 2019 • Couples,Kal bhairav Temple,"Its 15 minute away from mahakaleshwar temple. in rickshaw. approx rickshaw driver took 150/- rs per return journey  from mahakaleshwar temple. Temple is good. We visited during the holiday season so we got little rush, otherwise there is no rush you can easily take darshan in less than 10 minute."
Kal_Bhairav_Temple,RanjithKumarPrabhu,4.0 of 5 bubbles,Dec 2018 • Family,The devata who consumes liquor,"This is another famous temple at Ujjain. The temple is relatively smaller in area, and is located in the outskirts of the town. Liquor is served to the deity and it is believed that deity consumes it. Liquor is sold in almost all shops in the premises. There is also a pratishta of Dattatreya in the temple compound."
Kal_Bhairav_Temple,Shankar I,5.0 of 5 bubbles,Jan 2019 • Family,Senapati of Shiva,"The temple of Kala Bhairav is a must see, say the locals of Ujjain . They call him the senapati of Shiva and the head of Ashta Bhairavas. Liquor is the offering here.It is situated on the banks of the Kshipra river. One should watch your step while entering the shrine through the staircase. Some people's liquor bottle fall off their hands shattering the bottles and a threat to barefeeted devotees who follow."
Kal_Bhairav_Temple,Neelamraju,4.0 of 5 bubbles,Jan 2019 • Friends,Interesting Offering - Liquor,"Ujjain City has a lot of Temples. The saying goes that if you carry a ton of rice and offer 4 grains to each temple, you will still run short of the grains..The Kal Bhairav temple is dedicated to Kal Bhairav, the guardian Deity  of Mahakal . It is located on the banks of the Shipra River. It is one of the most active temples in the city, visited by hundreds of devotees daily.Liquor is offered to the temple deity as one of the five tantric ritual offerings known as panchamakara  - Madya (alcohol), Maansa (meat), Meena or Matsya fish), Mudra (gesture or parched grain) and Maithuna (sexual intercourse). In older times, all five offerings were made to the deity, but now only alcohol is offered.We were amazed to see Indian as well as imported liquor was being offered. The priest takes the bottle from the devotee, opens it and pours some liquor in the saucer and keep near the lips of the deity and the liquor disappears. The remaining bottle is handed over to the devotee as Prasad.."
Kal_Bhairav_Temple,Sushant Kumar,5.0 of 5 bubbles,Dec 2018 • Solo,GOD who is fond of Alcohol,"Temple is unique in itself, where alcohol is served to idol and you can watch him drinking. You will find licensed wine shops outside temple premises. People offer variety of alcohol to GOD starting from Desi Daru to Scotch. Recommended visit to this temple if you are inn Ujjain specially if you want to see an idol drinking alcohol live."
Kal_Bhairav_Temple,aalpaad,5.0 of 5 bubbles,Jan 2019 • Family,Wonderful place ,It’s a powerful temple and it’s amazing to see how liquor is offered to Kaal Bhairav...a must visiting when ur visiting maha kaleshwar temple 
