Tourist Attraction,Name,Rating,Date and criteria,Title,Review
Navlakhi_Eco_Tourism_Park,Amit jain,5.0 of 5 bubbles,Dec 2019 • Family,NATURE SAFARI,"Excellent place for bird watch, photography, nature movie making, environmental education , Initiative by Forest Department Ujjain. NATURE INTERPRETATION CENTRE BUILDING needs to be decorated by wild life pics , wildlife n nature movie should be shown. Night safari and camping arrangement needed."
Navlakhi_Eco_Tourism_Park,Himanshu Bhatt,4.0 of 5 bubbles,Jun 2019 • Friends,A good initiative to promote eco tourism,its a initiative by municipal corporation and govt where they are trying to establish a place where people can visit and understand the importance of nature. 
Navlakhi_Eco_Tourism_Park,Kapil S,1.0 of 5 bubbles,Oct 2018 • Family,Worst experience,There is nothing in this park. I would not even call it a park. We paid 100 rupees for car and 10 rupees entry fee for each person. Don't waste your time and money. Stay away.
Navlakhi_Eco_Tourism_Park,prem M,5.0 of 5 bubbles,Oct 2018 • Couples,Nature safsri,"Ecotourism park created at NAULAKHI , maxi road ujjain at a 15 year old a man-made Forest (named Naulkhi bead). Initially only grass grew there but due to repeated plantation various years it transformed into a Forest . An Ecotourism Park development with the help of MPEDB, BHOPAL with an objective to provide environmental spa to people near city.One can visit this area for mental calm, digital detox, calory burning, and many more fun activities with a fresh food cafeteria to enjoy the moments. "
Navlakhi_Eco_Tourism_Park,Cruiser331903,5.0 of 5 bubbles,Oct 2018 • Friends,When i visit there i got a lot of joy.,"To know the environment ,bird,nature & wild life.you may visit there with your family without any fear . but com with some sneaks ,drinking water also bcz u need in this tour."
