,Tourist Attraction,Name,Rating,Date and criteria,Title,Review
0,Hemis_National_Park,sandeep k,5.0 of 5 bubbles,Mar 2019 • Friends,Best part of our trip ,This is a very awesome park many of animals we will see and this park is very nicely maintained by gov. They will provide safety to the tourist.
1,Hemis_National_Park,David G,5.0 of 5 bubbles,Jan 2019,Winter time what an experience!,I camped just short of the village of Rumbak in Hemis National Park. Camping in winter there is a great experience as long as you're ready for the cold. Overnight it got down to -25c but the Austrian Army issue down sleeping bags did the trick. We were also fortunate enough to spot 3 snow leopards while here. A mum and 2 cubs attacked a heard of blue sheep. A sight I'll never forget.
2,Hemis_National_Park,arvind1000,5.0 of 5 bubbles,Oct 2019 • Couples,Definitely Worth visiting this Monastery ,"Hemis monastery is one of the oldest monasteries in Ladakh and has existed before the 11th century. It is further down from Tiksey monastery on the Leh- Srinagar road and about 45 km from Leh. Hemis monastery also has a museum as part of its complex which is worth visiting. It has many statues of Buddha in various forms including Maitreya, Tara, etc. There are a number of temples and prayer halls as part of the monastery. The one which fascinated me most was the one dedicated to and with a statue of Lord Padmasambhava ( Guru Rinpoche), believed to be a reincarnate of Buddha. The annual Hemis festival honouring Padmasambhava is held every year. "
3,Hemis_National_Park,Th_vicker,5.0 of 5 bubbles,Sep 2018,"Wonderful park, less crowded than Markha valley, more authentic","I went trekking on my own, leaving from Hemis all the way to Dat. Landscapes are gorgeous and you feel absolutely alone and into the wild. Few possibilities for food (shang sumdo, chogdo, nimaling and then nothing!). You will find water all along the way."
4,Hemis_National_Park,Jasraj pardeshi,5.0 of 5 bubbles,Jun 2019 • Solo,Snow Leopard Paradise,During winters snow leopards descend down for hunting in search of their prey. It is the best wildlife outing in Ladakh.
5,Hemis_National_Park,rjpriyanka,4.0 of 5 bubbles,Apr 2018 • Friends,Snow leopard,"I found this monastery very beautiful,located some 30 km from leh city. If yiu are lucky yiu can sight some wild animals including snow leopard"
6,Hemis_National_Park,Umang A,4.0 of 5 bubbles,Apr 2018 • Friends,Nature,So this is the  national park of leh and if you are lucky you can sight snow leopard during the visit .
7,Hemis_National_Park,Sightsee737349,5.0 of 5 bubbles,Sep 2018 • Friends,Rare wildlife ,"Hemis Monastery is renowned worldwide for rare wildlife which is found here . The rare Snow Leopard, Ibex and other wildlife are seen in aplenty in this region where these wild animals live  "
8,Hemis_National_Park,Umang A,4.0 of 5 bubbles,Aug 2018 • Friends,Amazing,"I found this monastery to be the most beautiful in leh, located 35 km from Leh city on the way to Pangog TSO. You can sight snow leopard if you are lucky"
9,Hemis_National_Park,Freedom54952488570,5.0 of 5 bubbles,Nov 2018 • Solo,On the chin of the mountains,"I was greeted by a tibetian flag when I parked my bike here and boy I was mesmerised by the beauty of the place, the most insane part of the trip was the way to the park, the BROs have laid a red carpet to the place."
0,Hemis_National_Park,Dalbir_S_Virdi,5.0 of 5 bubbles,Sep 2018 • Couples,A hidden Treasure of Leh,This is the only Monastery in Leh which had not been invaded and it has all its original riches intact. It can not be seen from the main road and its now only that its accessible due to the road constructed to reach here. Its one of the richest monastery of Leh and Laddakh.
1,Hemis_National_Park,mark10r,5.0 of 5 bubbles,Sep 2018 • Couples,Trekking through nature and traditional villages,"Markha Valley trek through Hemis NP was a wonderful way to experience the dramatic landscapes, ancient chortems and mani walls, and fascinating villages of this amazing part of Ladakh. We stayed in family run home stays each night that were comfortable and food was excellent. Carry plenty of water and allow lots of time between villages. While challenging this was a very rewarding trek and the 5200m pass above Nimilang a highlight. "
2,Hemis_National_Park,Lovers_paradise,4.0 of 5 bubbles,Jun 2018,"Spot the wildlife at Hemis National Park, Leh","Hemis High Altitude National Park is a hilly and rough high elevation desert located in the eastern section of Ladakh. The Park is spread in the beautiful Markha Valley and Rumbak Valley of the Ladakh. The normal altitude of the Park is more than 3,000 meters. The Park is very famous for exceptional snow leopards and the ibex. One can see the snow leopards very easily in the Shang valley of Hemis National Park. Hemis National Park is a paradise for bird watchers as well."
3,Hemis_National_Park,Balisc,4.0 of 5 bubbles,Sep 2018 • Friends,A Wildlife Enthusiast's Paradise,This is a place for the daring and adventurous. Western trekkers visit during the winters to photograph the snow leopard and other fauna. The villages in this park offer home stays. The treks can be arranged by most tourism agencies in Ladakh.
4,Hemis_National_Park,Clive T,5.0 of 5 bubbles,Feb 2018,Fabulous trip to see the snow leopards in Hemis National Park,Camping in the Rumbakh Valley and then trekking in the mountains to see the snow leopards was an amazing experience.  We saw three snow leopards including one female who had just made a kill and stayed with it for a few days providing ample photographic opportunities. Our local guides were amazing and our group was exceptionally well looked after.  Our snow leopard spotters worked tirelessly and were able to find two snow leopards within site of our camp.
5,Hemis_National_Park,royjay2018,4.0 of 5 bubbles,Jun 2018 • Family,The Hemis High-Altitude National Park,"The Hemis High Altitude National Park is a high altitude national park in the eastern Ladakh. The park is home to a number of species of endangered mammals, including the snow leopard. It is believed to have the highest density of them in any protected area in the world."
6,Hemis_National_Park,Atish B,5.0 of 5 bubbles,Jul 2018 • Family,Very nice place to start your birding trip,"We visited Hemis National Park twice during our 10 day birdwatching trip to Hemis. We saw some very nice high altitude birds and animals including blue sheep, red fronted serin ,chukar and rosefinches. It it is isolated from people which makes sighting wildlife easier. You will not get the non-wildlife  lover  crowd here like in many other parks in India."
7,Hemis_National_Park,Daniel T,5.0 of 5 bubbles,Sep 2017 • Friends,Trekking here is for adventure freaks,"Take time out to drive to Hemis area in Ladakh region. For adventure freaks, there is Stok Kangri - the famous mountain of Ladakh, where you can do mountaineering.For bike lovers, the road is like paradise - you'll love bike driving to this area (plz be aware of the precautions you must take).Remote villages like Padum are around the corner from Hemis National park.Always have a local guide with you when you venture out in Hemis National park."
8,Hemis_National_Park,Nitin,5.0 of 5 bubbles,Jul 2017 • Couples,Beautiful Monastery,One of the most beautiful Monastery on the way to Pangong. Highly recommended to visit this place!!!
9,Hemis_National_Park,SivaramSi,5.0 of 5 bubbles,May 2018 • Solo,Thrilling hiking experience at Hemis,"Drive to Hemis is very thrilling - winding roads, deep gorges, Indus flowing through the valley down below, cold mountain air, remoteness, dry mountains, clear sky - it was a phenomenal ride to rememberAt the time of my visit, there was less snow so the apex predator of the region - snow leopard remained elusive but we saw plenty of the prey - himalayan tahr and witnessed their agile climbing on sharp and steep rocks of Hemis"
0,Hemis_National_Park,Sathya S,5.0 of 5 bubbles,Jun 2017 • Friends,Unique park,"We trekked through portions of this park. It is greener than most of Ladakh. The pretty stream with the trees and flowers on its banks soothes the senses. We were lucky to see marmots sunning themselves and blue sheep in the distance. Also a golden eagle and many other birds. This is also where the snow leopard roams in dead winter but vanishes into the heights with the onset of summer and tourists.Anyway, as is well known, he is an elusive, almost invisible beast! You can drive in up to a point to enjoy the sanctuary which is not what you normally expect a sanctuary to be considering the inhospitable nature of the region's topography. The rest of the park is for those who are physically and mentally equipped to trek through it. Except for remote villages there is absolutely no other habitation in the park, which is a good thing. "
1,Hemis_National_Park,667marians,5.0 of 5 bubbles,Sep 2016 • Couples,"Markha Valley, independent trekking","We did this trek starting from Jingchan, thus the trek comprised passing of two high passes: Kanda La (4973 m) and Kongmaru La (5287 m). Not many trekkers do it independently, most of tourists hire at least a guide, and majority prefer “sahib” trekking, which means that all gear is carried by a caravan of donkeys and mules. Still, this trek can be done fully independently and actually you have not to be very fit to complete this amazing route. In every village there are several homestays where accommodation and meals are available. So, it is not necessary to take tents and food. The only exception is water, and it is a good idea to have sterilization drops to sterilize refilled water and not to buy new bottles, which is not good for the environment. The cost of room and meals (this includes dinner, breakfast and packed lunch) in 2016 was 1000 rupees/person. This price was the same in every village, except for tents in Nimaling, where it was 1200 rupees/pp. Here is our itinerary, with modifications to the routine schedules offered by travel agencies, and some tips and tricks. We did this trek in the beginning of September are there were only a few tourists on the entire route. In high season (July-August) there are probably more tourists and a possible shortage of homestays.Acclimatization in Leh before the trekUsually, it is recommended to stay in Leh at least 3 days before starting the trek. This is because Leh is situated at the altitude of 3,500 m, which carries a high risk of altitude mountain sickness (AMS), and this risk is even higher if you start ascending when not properly acclimatized. Thus, these 3 days of rest are recommended. Still, most travel agencies on the 1st day of the trek take tourists from Leh (3500 m) up to Yurutse (4150 m), or even to Kanda La base camp (4450 m). This seems to be too fast ascent, and indeed you can find many reports by people complaining of AMS symptoms at such an itinerary. Our plan was to shorten acclimatization in Leh to 2 days, but to add one day of trekking at a lower altitude before crossing Kanda La pass.Acclimatization Day 1If you arrive to Leh by air you will be immediately hit by thin air and low oxygen concentration. It is better to do almost nothing at this first day, as even going upstairs can be a big challenge. All planes land in Leh in the morning, so you will have full day to relax. After half day of  rest we had a short (and slow!) walk in the afternoon.Acclimatization Day 2It is a good opportunity to check your acclimatization. There are several opportunities of a short trips within Leh city. One is to visit Leh Palace and then Namgyal monastery. The monastery is about 300 m above Leh, thus it is a good acclimatization trip and because of the visiting, you will not ascend too fast. Then, in the other part of Leh, there is a picturesque Shanti Stupa, at a similar altitude as Namgyal monastery. Also, you can visit the town, do the shopping, buy or rent trekking equipment. It is a good idea to arrange transportation for the next day, it can be done by hotel staff (taxi prices are fixed, so it does not matter who arranges the car; bargaining is not an issue in this part of India).Trekking Day 1. Jingchan-Rumbak (altitude: 3850 m)You can start your trek if you are somewhat acclimatized. If you still feel weak, suffer from headache or other mild symptoms of AMS, you should stay in Leh for another day (or even descent to another location downstream the Indus valley). Jingchan-Rumbak trek is quite short, so it is not needed to take a taxi early in the morning. I would recommend taking the taxi directly to Jingchan. A cheaper option is to take a bus to Spituk and then walk to Jingchan. Still, it would be a boring walk on a tarmac through a desert in full sun. The trek to Rumbak should not be difficult. The altitude gain is about 400 m, and even if you walk very slowly it should take 3-4 hours including rests. The proper path is usually obvious, yet in some areas there is more than 1 path (in a case of doubt follow the boot tracks or the freshest donkey poos). After several kilometers there is a parachute “restaurant”, where you can have some tea or instant soup. There is a bifurcation of the treks at this parachute restaurant. The path to the right goes towards Yurutse and most of trekkers follow this trail. Instead, we went to the left towards Rumbak village, situated at a lower altitude than Yurutse. There should not be a problem with finding a homestay in Rumbak, since not many tourists come here. Trekking Day 2. Rumbak-Yurutse (altitude: 4150 m)Also a short and easy day, about 2-3 hours maximally. There is only one house in Yurutse. Since there are only a few rooms available in Yurutse, it is better to start the trek early and arrive to Yurutse before the arrival of organized tourists, who start their trek from Jingchan. It is very easy to find the route. Firstly you backtrack your yesterday trek up to the parachute restaurant at the bifurcation (again a good opportunity to have a nice cup of tea), and then you should follow the obvious path towards Yurutse. The only problem is crossing a small stream just after the restaurant. In September it was not necessary to remove shoes, yet in July and August there can be more water and fording may be inevitable. In the afternoon it is possible to have an acclimatization trip to the Kanda La base camp. There is a parachute restaurant here and it is possible to have a cup of tea before returning to Yurutse.Trekking Day 3. Yurutse - Kanda La (altitude: 4973 m) - Shingo (altitude: 4130 m)This is probably the most difficult day. Although Kanda La is lower than Kongmaru La, but altitude gain is higher. The other problem on day 3 is that you should take quite a lot of water, since it is not available above Kanda La base camp (half an hour from Yurutse) until Shingo village; 3 liters per person is a must. A heave gear and low oxygen concentration are not good combination. The trekkers from organized groups carry only a small backpack, while the remaining things are carried by mules. It is possible to hire some mules in Yurutse to carry your backpacks to Kanda La, and we met some independent tourist who did it. There is a lot of wildlife in the area of Kanda Laː marmots, blue sheep, Himalaya hares, and eagles - just look around you. Descent from Kanda La is quite easy and there should not be a problem with finding the way. There are 3 homestays in Shingo (we stayed at Khangpa-pa homestay, with hot shower possible). Some guidebooks suggest further descent up to Skyu, but it would be at least 3 hours of trekking (possibly more, taking into account that you will be tired after crossing Kanda La).Trekking Day 4. Shingo - Skyu (altitude: 3400 m)Easy day, 3-4 hours of trekking. A descent though colorful canyon to the Markha valley, with obvious path and no river fordings. In Skyu there is a nice small monastery and ruins of a royal palace.If you do not want to have a relax day, it is possible to walk towards Markha village. There is a homestay in Sara, about 10 km from Skyu. In high season it is also possible to stay in a tented homestay, which is a few km before Sara. Both options would shorten a long walk from Skyu to Markha (still, in high season there may be a shortage of beds).  Trekking Day 5. Skyu  - Markha (altitude: 3800 m)It is a long day of trekking in a nearly flat terrain, more than 20 km, and at least 8 hours (usually more) of walking. The route goes along Markha river and it crosses the river several times. In September it was not necessary to ford the river, but in the summer, when more water comes from melting glaciers, be prepared for many fordings. Usually it is not difficult to find the proper path. However, Markha valley is built of loose sedimentation rocks that are constantly and quite fast carved by the river. All trails that are situated at the slopes above Markha river are doomed to be destroyed by erosion (in a years and not centuries perspective). You should not use a path hanging above the river without fresh boot tracks on such a path, since it could be a dangerous trap. Also, many details of the trek depicted in the guidebooks are no longer valid because of changing terrain.In Markha, the biggest village in the valley, there are about 20 homestays, so there should not be a problem with accommodation. If you have enough time, it is possible to visit local monastery.Trekking Day 6. Markha - Hankar (altitude: 4000 m)This day you will continue ascent along Markha river. Unless the locals are building a bridge across Markha river, there will be at least one fording. Look where other people cross the river, and if nobody is seen – you should use the widest section of the river (not the narrowest one, since wider part of the river will be shallower, and the water will flow not so fast). Use trekking polls for security. About 5 km after Markha village there is Umlung village with several homestays and a parachute restaurant. Before Umlung village you will see a monastery unbelievable built on a high rock (worth visiting if time allows). In Hankar there are some homestays in the lower part of the village, and another homestay in the upper part of the village, with a nice view at Kang Yatze – the highest peak in this area (6400 m). Trekking Day 7. Hankar – Nimaling (altitude: 4850 m)Difficult day, about 12 km and 850 m of altitude gain, but with superb views and a lot of wildlife along the trek. First few kilometers involve navigating along Markha stream, with a possibility of some fordings (depending on water level and status of the path hanging above the stream). Some 2 km after upper Hankar the valley divides: to the left goes a proper trek to Nimaling, to the right the trek via uninhabited Langtang valley.In high season there should be a parachute restaurant ata  campsite of Thachungtse (in September it was closed). Still, it is a good idea to have a rest in Thachungtse (4250 m) before the steep climbing begins. There are a lot of picas (a smaller version of marmot) in this area, playing on the rocks.After a steep ascent you will finally arrive to small lake at the altitude of 4700 m. If you climb a few meters above this lake you would encounter other lakes, and a view towards Kang Yatze is simply breathtaking. After several more kilometers of walking among picas and marmots you will reach Nimaling. Here there is a tented restaurant and a lot of tents to stay in. Accommodation in Nimaling is slightly more expensive compared to other villages; in 2017 it was 1200 rupees per person, meals inclusive. Nimaling is perhaps the only place where having a sleeping bag is a good idea, since it can be really very cold and windy at night (the tents are provided with blankets, as other homestays are, but the place is really cold).If the weather is good and you are not in rush (and not frozen after the night) it is possible to stay in the area for one or two days. Local trips may involve a walk to Kang Yatze base camp (5100 m) or even ascending the slope above Nimaling (6000 m; no rock or ice climbing needed to get to such a high altitude).Trekking Day 8. Nimaling – Kongmaru La (altitude: 5200 m) – Chokdo (altitude: 3850m)A long day. Although Kongmaru La is the highest point of the trek, there should not be a problem with trekking to the pass, which is almost 400 m above Nimaling. You should cross the stream and the route to the pass is obvious. As you will ascent, the views toward Kang Yatze and neighbor 6000+ m peaks, and also distant Zanskar Range are fantastic. Also, there are plenty of fearless picas and marmots (except for the moments when an eagle approaches and tries to catch something for lunch). After a short break at Kongmaru La and obligatory breathtaking vistas, there will be a long descent through beautiful colorful canyons. The descent is similar to the trek from Shingo to Skyu (Day 4), still it is much longer. Finally there will be a parachute restaurant in Chuskyumo and a few kilometers further down homestays in Chokdo. If it is not late and you are not very tired, it is possible to proceed to Shang Sumdo village and return to Leh by taxi the same day (see Day 9)Trekking Day 9. Chokdo – Shang Sumdo (altitude: 3800m)An easy 2 h walk downhill. Once you approach the village you will see some taxis waiting for tourists (it the guidebooks you can find descriptions of Markha trek ending in Hemis, but currently the road begins in Shang Sumdo and probably it won’t be very interesting to walk among cars). Yet, it may be a good idea to have a break in Hemis and visit its famous monastery, just ask the taxi driver for a possibility."
2,Hemis_National_Park,Udaya Nayak,5.0 of 5 bubbles,Aug 2016 • Family,Hemis National Park- Rumbak Village,"It was only the third day during our Leh Trip, we took a trek to Hemis National park. The starting point is around 25 kms from Leh town and will take around 75 mins. The road to park is amazing views of the valley and really a very adventurous road. Hardly any traffic throughout the road journey.At the starting point of the trek , it is barricaded and chained and no vehicle can go beyond the starting point. It is around 8 kms to the Hemis National park and will take 3 hours to reach the Park and half the time to return.Initial around 2.5 kms of the trek is a decent mud road and rest all is typical trekking path .Throughout the trek, U will get wonderful views of the mountains and water streams.You are sure to meet many fellow trekkers , few of them from overseas. We met people from France, Israel and From England. Carry enough water and eatables. Only at the top , you will be getting water,refreshments and snacks.We had to terminate our trek just before the Rumbak Village as my Daughter started showing AMS symptoms and we had to return back.You require complete 8 -9 hours to complete the trek"
3,Hemis_National_Park,Haxy Tailor,4.0 of 5 bubbles,May 2016 • Solo,National Park ,It's just nearby the Monastery can go and visit around the National Park. Loves the place and got really nice view around the place. I just visited from the outside coz I was a bit in hurry to catch the local transport. But hope you guys will enjoy it well. Enjoy 
4,Hemis_National_Park,abhilash0505,5.0 of 5 bubbles,Feb 2015,Amazing Experience,"First of all, a week before I visited, a new ""paid entry system"" was introduced. So, please do collect the entry passes first. The trek through the national park is just awesome. I was lucky to meet a few folks from BBC and more importantly, spot mountain goats. This is supposed to be the ideal spot for Mountain Lion and if you are lucky, you will spot one, if you are patient."
5,Hemis_National_Park,RAMAKRISHNA SARIPALLI,5.0 of 5 bubbles,Sep 2015 • Solo,Hemis National Park,"Hemis National Park (or Hemis High Altitude National Park) is a high altitude national park in the eastern Ladakh region of the state of Jammu and Kashmir in India. World famous for being the best place to see the snow leopard in the wild, it is believed to have the highest density of snow leopards of any protected area in the world"
6,Hemis_National_Park,Amitabh S,5.0 of 5 bubbles,Sep 2014,Wonderland,"Now you gotta be a special person in your heart to 'feel' this place. You can be just another tourist, or you can lose your city soul here to feel 'the purity' of lives lived here. It's a mental thing."
7,Hemis_National_Park,skagarwal74,4.0 of 5 bubbles,May 2015,Unique national park,The national park is a unique high altitude national park on Leh-Manali highway houses Hemis Monastery which is a famous place for tourists. The park traverses a large area housing monasteries and snow leopards. There are small villages and very few people living here.
