,Tourist Attraction,Name,Rating,Date and criteria,Title,Review
0,Pashmina_House,richa5791,4.0 of 5 bubbles,Sep 2018 • Friends,Original collection of pashmina,"If you are visiting leh and want to take some beautiful gift for your dear , then this is the shop. It has large collection of beautiful pashmina. Warning : Visit only if you have pocket full of money, as you will start liking all the collection they have and you will have an urge to buy all ;)"
1,Pashmina_House,Cosmopolitan401666,5.0 of 5 bubbles,Aug 2018 • Friends,Pilgrimage to lndia,"I was travelling with a group of 12 from Canada to India. Our itinerary brought us also to Leh Ladakh. I left my country with the intention to buy a rug. One of the group members ended, after shopping around other carpet stores, at the Pashmina House and bought her piece there. I learned about it and checked it out myself. Majid is a very good sales person, with a lot of knowledge and insights. He is very friendly and funny too.Well, l ended up buying a bigger piece than what l planned. The formalities for shipping were done quickly and l got possession of my piece within one week after leaving lndia. I love my carpet and l can only recommend the Pashmina House and naturally ask for Majid to give you the insights and tips to find the right piece for you."
2,Pashmina_House,GRBAachen,5.0 of 5 bubbles,Aug 2018 • Couples,any time again !!,"Best shop in Leh for Pashmina scarves and shawls. Nicely located, great variety in terms of colors, patterns, quality and prices. The shop is run by the owner family (father and son), as well as some very knowledgable staff. Ask for Majeed, he truly has great taste. Recommendation: enter the store WITHOUT tour guide (tour guides receive 10-20% comission on everything you buy) and be sure to negotiate at least 20% rebate on all marked prices."
3,Pashmina_House,Kultida N,5.0 of 5 bubbles,Jul 2018 • Friends,Good place,"The nice place and good qulity Kahsmir scarf, fair price. I recommend this shop for everyone who visits Leh to visit Pashmina house, you will find some thing good."
4,Pashmina_House,Maggy S,5.0 of 5 bubbles,Jul 2018 • Friends,Luxurious Cashmere and Pashmina shop,"Luxurious cashmere and pashmina scarfs, shawls with reasonably price.Mr.Majid is a good advice, he showed us everything we want without pressure to buy. He took care of us , offered nice tea and wifi password 😄. Mr.Majid is the real gentlemanWe bought a lot of scarves for ourselves and a gift with good discount. If you looking for a good Pashmina/wools scarfs. I recommend Pashmina House in Leh Main Bazar Market."
5,Pashmina_House,MaggyMalin,5.0 of 5 bubbles,Jul 2018 • Friends,Excellent Pashmina shop,"If you want to buy a good scarf. I recommended a Pashmina house there is a shop in Leh. We bought a lot of beautiful scarfs, pashmina and wools. It’s good quality ,fair price, friendly staff and nice place. I beg you’ll love there!!"
6,Pashmina_House,sunanan2018,4.0 of 5 bubbles,Jul 2018 • Friends,High quality,"Very high quality of pashmina ,Mr.Majid is a good consultant,he 's very kine.I hope to go back there again.Pashmina house is very nice place and has clean wash room.Thank you for extra scraf.😄"
7,Pashmina_House,kritthiyaporn t,5.0 of 5 bubbles,Jul 2018 • Friends,The best Pashmina shop in Leh,"Staff is very nice and they have a good recommendation for you. Kashmir scarf is a good quality and the best price. If you will travel to Leh don't miss to visit here and choose the scarf that you like. Just walk into the shop, you will give the smile. :)"
8,Pashmina_House,Kimm,5.0 of 5 bubbles,Jul 2018 • Friends,Cashmere,good quality fabric. Soft n comfortable~. U can make this to be goods or cloths. Cool shop for everyone!!:)
9,Pashmina_House,jitsuporn,5.0 of 5 bubbles,Jul 2018 • Friends,"Good Quality , Luxury and Friendly","Pashmina house is one of recommended shop in LehWe brought many beautiful scarfs. it’s good quality ,fair price, excellent salemanshipIf you come to this shop I’m sure they will find some thing good for you. :))"
0,Pashmina_House,MarcoDellaChiara,5.0 of 5 bubbles,Jul 2018 • Couples,best yarn in the world!,"Unique shop in Leh, beautiful yarns with scarves and pashminas in a thousand fabrics and colors. the guy at the sale is very prepared and really kind, knows everything about wool, cashmere, yak .. everything! if you pass by the ladak you can not stop at the PASHMINA house! you will find things that you can find from other parts of the world!"
1,Pashmina_House,Natalie R,5.0 of 5 bubbles,Jul 2018,"good quality, reasonable price","Majid’s shop has a lot of beautiful Cashmere and wool scarves very good quality and luxury, I recommend everyone who visits Leh to visit his shop."
2,Pashmina_House,contato146,5.0 of 5 bubbles,Jun 2018 • Business,quality products,"very well attended, and products of the highest quality. Very attentive , and  Beautiful products....."
3,Pashmina_House,Cassie D,5.0 of 5 bubbles,Sep 2017 • Friends,Beautiful selection and great staff,"Beautiful selection of cashmere and pashmina scarfs/shawls that look and feel luxurious and reasonably priced. Majid and the staff were very helpful, offered us tea and showed us everything with no pressure to buy. We did end up buying quite a lot as gifts and got great discount! They do have lots of nice rugs too but unfortunately we couldn't buy this time. Next time may be!"
4,Pashmina_House,Narumin W,5.0 of 5 bubbles,Jul 2018,Best pashimina shop in Leh or maybe in the world!,The best price and the best staff! The staff is so kind and gave us very much discount. He also gave us a lot of information about pashimina and cashmere. Best pashimina shop in Leh guarantee Mr. Majid is the best !!
5,Pashmina_House,Syeda Ajima S,5.0 of 5 bubbles,Jun 2018 • Solo,Splendid place to experience great goods.,Shop has not only exclusive goods but also has the person who has (Mr.Majid) vast knowledge of the products as well honest opinions.As the other people of the market will not provide proper or truth regarding quality of the products.bought some pashmina shawls.
6,Pashmina_House,Val V,5.0 of 5 bubbles,Oct 2017 • Couples,Great quality and variety!,"I liked a lot the different designs they have  and everything is very good quality, you could spend hours choosing from the variety of designs! bought 4 or 5 pashminas and I loved them! Recommended!"
7,Pashmina_House,Louie107,5.0 of 5 bubbles,Jun 2017 • Solo,Best place in Leh to buy rugs,Friendly service and wide selection. Highly recommended! Bought 2 rugs and 5 scarves from here a year ago. They help you package it so that it easily fits in your suitcase. Will be visiting again next time I visit the region.
8,Pashmina_House,Sina_Schlatter,5.0 of 5 bubbles,Jul 2017 • Solo,"A great place, where all you wishes come true","The Pashmina House in Leh is a great place for clothes, carpets and of course all kind of shawls and scarfs. Ask for Majid, a nice guy, who can show you everything you want with good offers."
9,Pashmina_House,bhat m,5.0 of 5 bubbles,Sep 2017 • Business,Pashmina house,Very good collection in pashmina Shwals and Trible carpet and high knotted silk carpet And also very good price here This is the best shop in Leh city for pashmina Shwals and Trible carpet
