,Tourist Attraction,Name,Rating,Date and criteria,Title,Review
5,Sand_Dunes_Leisure_Park,Kaivan,5.0 of 5 bubbles,Aug 2018 • Friends,Awesome location in Leh,"Sand dunes is in Nubra Valley. This is the only place where we can find double hump camels. There is camel safari in this sand dunes.The interesting part is to find sand/small desert in this location. In fact, there is a river flowing just 1-2kms away from this place. Nevertheless, a beautiful location in Leh with mesmerising view. "
6,Sand_Dunes_Leisure_Park,Aartichand,4.0 of 5 bubbles,Sep 2018 • Friends,Good Fun,On the way from Leh to Nubra one comes across the ATV rides just after one passes Khalsar.The ATV s are good quality and it is fun to ride them on the dunes. It costs 1000/- for 2 people per ride. The track is marked and can be a bit tricky if one goes too fast. One can go to the top and stop by the river for a photo.
7,Sand_Dunes_Leisure_Park,ghosal_rg,3.0 of 5 bubbles,Sep 2018 • Couples,Not a park,"This is between Diskit(7km) and Hunder village, both green by Shayok and Nubra rivers respectively. This middle part get minimum water supply in naturally arid Ladakh. Locals have captured few free roaming Bactrian double humped camels and charging a minimum of 200 bucks for a nondescript 15min ride. In the other side of the not so vast dunes, ATV 4wheeler bikes are available for joyride for 10 mins. There is a small canteen also and valuable seabuckthorn jungles. Glare of animal lovers and PETA has fallen now. Also there is an effort to increase the agricultural land by drilling Nubra river water which is resisted tooth and nail by the cameo exploiters for obvious reasons."
8,Sand_Dunes_Leisure_Park,travelbugDelhi,5.0 of 5 bubbles,Aug 2018 • Couples,Gentle Dunes,"Gorgoeus short  hike from Nubra ecolodge where we were staying. It was deserted both times we went,sunset & early morning so beautiful ! The 3 mountain ranges surrounding the dunes makes it picture perfect !!Fun kicking off shoes & walking in the wet sand to the rivers edge."
9,Sand_Dunes_Leisure_Park,Angad Singh,4.0 of 5 bubbles,Jul 2018,Good but crowded,"The Sand dunes are a nice attraction and they look pretty good too. Though when you go there, the entire crowd of Nubra Valley would be there. "
0,Sand_Dunes_Leisure_Park,kunjathur,5.0 of 5 bubbles,Aug 2018 • Family,Full of white sand and ATV ride,It is really astonishing to see the white sand in the valley at Nubra valley.It has stretched to a wide area. Utilising this ATV rides (4wheeler) are arranged for interested tourists. The ride in the sand dunes is really a good experience
1,Sand_Dunes_Leisure_Park,Sat_samp,4.0 of 5 bubbles,Aug 2018 • Family,Leisurely evening walk at the Sand dunes,"This is a very interesting place. Although we were driven to this place to ride on the two-humped Bactrian camels, the area itself makes for a good evening walk. There is a good stretch of grassland, and a nice stream with clear water that flows by - one can dip knee high into this and the water was not very cold. Just a short walk through the grasslands brings one to Sand dunes that are very much desert terrain. This terrain goes for a fair distance upto the mountains. And since this entire area is in a valley, the surrounding mountains make for good viewing. We werent too keen to ride the camels, but it seemed like a crowd puller. There is a cafe as well for a nice cup of tea and some eats. It was also nice to note that trash bins were kept at reasonable distance of each other in this area to encourage tourists to keep the place clean.Of the few places to see in the Nubra Valley, this is a definite recommend, particularly for a nice evening stroll."
2,Sand_Dunes_Leisure_Park,Prem P,4.0 of 5 bubbles,Oct 2017 • Family,Silver Sand Valley,"It is approx.5 to 6hours journey and maximum time you spend is approx.2hours. You enjoy Camel Riding but if you had already seen Jaisalmer, may not find it comfortable."
3,Sand_Dunes_Leisure_Park,Rajeev K,3.0 of 5 bubbles,Mar 2018 • Friends,Overrated!,"The sand dunes are in a small area of nubra valley and although offer a new views of the mountains are nothing spectacular , i had very high hopes about the camels and the and dunes and rode my motorcycle extra to be there but was disappointed .. there are two humped camels there which are managed by locals to provide a ride , and for riding them people literally fight with each  other , also the area has accommodated lots of plastic waste ittered by the tourists which distracts you from the beautyof leh and the chaotic atmosphere created by 100's of tourist vehicles adds to it as wellMy advice: better stay away from it until unless you are really interested in viewing the sand dunes.Accomodation: there are plenty of accomodation near the dunes and are very cheap to begin with.Roads to dunes: the roads constructed by BRO to sand dunes are basically a level above.you would breze along them in your bike or in your taxi."
4,Sand_Dunes_Leisure_Park,Peter L,3.0 of 5 bubbles,Jul 2018 • Solo,A bit overrared place when you are a Dutchman.,A relatively smal area with sand dunes and some commercial rides with camels. In Holland we have 300 km of sand dunes along the coast.... So Nubra is a bit overrated in my view. 
5,Sand_Dunes_Leisure_Park,debasis2k,5.0 of 5 bubbles,Aug 2018 • Couples,The double hump camel,It was a lovely experience. The camels are very adorable. Go their in the afternoon so that you can experience the dune and dont feel the heat of the sun. The sand dunes are nice and a new experience. Dont forget to take the photos with the reflection so that you get lovely framing with the mountains. The sun set is a bonus. Dont forget the cultural show in the evening near the park. 
6,Sand_Dunes_Leisure_Park,Pranaya Kumar,5.0 of 5 bubbles,Aug 2018 • Couples,Sand Park,Place to see different view of Nature at a single place.Can enjoy the Camel Ride.Clean and Enjoyable place
7,Sand_Dunes_Leisure_Park,N. Shah,3.0 of 5 bubbles,Jul 2018 • Friends,Beautiful Desert in the middle of mountains.,The dunes are not as big and magnificent as in middle east. But the whole surrounding makes this even more beautiful.
8,Sand_Dunes_Leisure_Park,MADAMDNMD,4.0 of 5 bubbles,Jun 2018 • Family,Amazing Ladakh,"Great view of the sand dunes and amazing experience middle in the valley at a height of approx. 11,000 feet. Organisation of the Camel ride was chaotic and needs some good organisation."
9,Sand_Dunes_Leisure_Park,njan45,4.0 of 5 bubbles,Jul 2018 • Couples,A desert in the Himalayas,It's white sand every where. A desert in the Himalayas. It is around 150 km from Leh at an altitude of 10000 ft. It is beautiful and I found it more thrilling than the deserts of Arabia. The presence of double humped Bactrian Camels makes it all the more interesting. A desert with a river (SHYOCK) flowing by the side.
0,Sand_Dunes_Leisure_Park,Jamie F,2.0 of 5 bubbles,Jul 2018 • Couples,No much to look at.,"Not worth the trip if all you are doing is taking a selfie in front of the sand dunes. Really, the Nubra Valley is beautiful but the sand dunes are not the highlight."
1,Sand_Dunes_Leisure_Park,Aarthik Kanal,5.0 of 5 bubbles,Jul 2018 • Solo,Very interesting place in the hills,This place has lots to offer for adventure / thrill seeking enthusiasts. There's also the double hump back camel rides for children and adults alike. There's also ATV experience on the sand dunes. A worth visiting place. 
2,Sand_Dunes_Leisure_Park,DEVDEEPAK70,4.0 of 5 bubbles,May 2018 • Family,nubra valley sightseeing point,ATV and camel rides available before arriving at Nubra valley.  Visiting a desert at such a high altitude is itself a chance of a lifetime. 
3,Sand_Dunes_Leisure_Park,Amaresh M,5.0 of 5 bubbles,Jul 2018 • Family,Must visit place,"You must spend a full day here to absorb the quaint and beauty of this valley. White sand is spread between tall mountains. Specially at the time of sunset, the hills give tremendous color effect to photo shoot and enjoy."
4,Sand_Dunes_Leisure_Park,Mil02004,4.0 of 5 bubbles,Jul 2018 • Couples,Lovely view,Sand dunes at a height of 11000ft seems like a fairly take but they are there at this height.Remarkable nature.Enjoy double humped camel ride & stroll along the river Shayok. Beautiful view of the mountains in the setting sun
5,Sand_Dunes_Leisure_Park,nidhi b,5.0 of 5 bubbles,Jul 2018 • Couples,beautiful sand dunes,Sand dunes were very beautiful. ATV riding was also fun. enjoyed very much there. must visit placce.
6,Sand_Dunes_Leisure_Park,Hrithik Shrivastava,5.0 of 5 bubbles,Sep 2017 • Couples,One of the Best Activites in Nubra,Sand Dunes all across you surrounded by Snow Capped Mountains..Thats the beauty of Nurba Valley. Thousands of Camels available to a ride. 
7,Sand_Dunes_Leisure_Park,Nilma S,4.0 of 5 bubbles,Jun 2018 • Family,Valley of Sand Dunes,The sand dunes are surrounded by the mountains. The dunes are spread over a large area near Hunder where it is possible to take a camel ride on the bactrian camels around the dunes. A walk on the dunes is a pleasure.
8,Sand_Dunes_Leisure_Park,Christopher G,5.0 of 5 bubbles,May 2018,A wonderful part of the Cold Desert,We stayed a night in Sumoor village and started further to the Panamik Hot springs. The village is on the way to Siachin Glaciers and way is beautiful..
9,Sand_Dunes_Leisure_Park,Neelam_Singhal80,4.0 of 5 bubbles,Jun 2018 • Couples,"Sand dunes at 10,000ft!!","Nubra Valley is famous for its sand dunes , the double humped camels and the ATV rides. The rates of both are fixed. The sun can be very strong in the afternoon so its best to go to the dunes around 5pm."
0,Sand_Dunes_Leisure_Park,Manoj B,4.0 of 5 bubbles,Jul 2018 • Couples,Silver sand experience,"it was nice and flat. Weather was not at its best, light drissle continued the whole time, certainly dry weather would have made it much more enjoyable."
1,Sand_Dunes_Leisure_Park,Dave O,4.0 of 5 bubbles,Jun 2018 • Couples,Great to have a look and ride a camel,"If you are in the area worth a look and a camel ride. Not much there except stunning views, restaurant and camels."
2,Sand_Dunes_Leisure_Park,kaliamanoj,5.0 of 5 bubbles,Jun 2018 • Family,ATV ride is wonderfull,Atv ride on way to hnder is wonderfull experience. The sand dunes are perfect for such a ride and is affordable too
3,Sand_Dunes_Leisure_Park,Harshshah1212,5.0 of 5 bubbles,Jun 2018 • Friends,Hunder sanddunes,"Located in Hunder, approx 7 kms from Diskit, the capital of Nubra valley.Very famous for riding of Bactrian camel, the two humped one.Awesome and must see place of Nubra"
4,Sand_Dunes_Leisure_Park,DreamTraveller17,1.0 of 5 bubbles,Jun 2018 • Family,terrible place. Full of Camel droppings and Unhealthy camels.,Sand dune operators are milking money and are not taking care of camels. it's apparent and the trend you see in Nubra. Everyone wants to extract money from you. Very low quality.
5,Sand_Dunes_Leisure_Park,Uday Krishna,5.0 of 5 bubbles,Jul 2018 • Business,Nubra Sanddunes,Nubra Valley is famous for Diskit Monastery and the Sand Dunes. As per history ages ago this place was under water and after the earth restructuring the was a lot of movement and these sanddunes have been here ever since
6,Sand_Dunes_Leisure_Park,vikaagar,5.0 of 5 bubbles,Jun 2018 • Family,must to camel safari,"Sand dunes of white sand and riding on double back camel is wonderful experience.But careful before camel riding.Do inquire from camel owner about camel behavior as I saw few tourist got injured after falling from camel,no medical help in near vicinity.So use caution and enjoy Nubra valley"
7,Sand_Dunes_Leisure_Park,GokulChandran,4.0 of 5 bubbles,Jun 2018 • Family,Family trip to Ladakh,"very good place to visit with family but the ride price was overpriced.  given the price, they should allow guests to enjoy the ride for somemore time.  is it because they get to earn only during season?  overall it was a wonderful place with family and kids thoroughly enjoyed it.  Also the sand storms in the evening was a sight to watch (from inside the vehicle though :)."
8,Sand_Dunes_Leisure_Park,Wara P,4.0 of 5 bubbles,Jun 2018,Lovely sand dunes and camels!,"The weather was quite humid, however, with breeze. The Park has the sand dunes as its landmark. You could ride camels for 15 min or 30 min. Watch out for the crowd! A pond nearby the parking is where people cool down the temperature. Taking photos with the sand dunes in harmonious atmosphere of mountains, sand, waterways and camels. Can you imagine? :)"
9,Sand_Dunes_Leisure_Park,Anand G,4.0 of 5 bubbles,Jun 2018 • Couples,Interesting side track,"Leh is more about monasteries, mountains and military heroism and the sand dunes offer something completely different and refreshes you. Nice camel rides, slightly adventerous ATV rides and a bit of long walk along the dunes recharges you on the way from Nubra/Hunder to Leh. Located close to the Deskit monastery, we can have a double stop before proceeding to Leh or Nubra depending on the direction of driving."
