,Tourist Attraction,Name,Rating,Date and criteria,Title,Review
0,Spituk_Monastery,Tarani Sharma,4.0 of 5 bubbles,Jun 2016 • Friends,nice place,situated near bto leh & nice place to see. grt view for airport & air force academy. really nice to see planes coming down & go.
1,Spituk_Monastery,Prabhakar G,5.0 of 5 bubbles,Aug 2016 • Solo,Kali Mata Temple Spituk Top View ,A religious place with so much of positive vibrations. Surprising wind speed and a lot of peace... Perfect view of Leh City.. Scenery.. And mountains... Must visit. 
2,Spituk_Monastery,Sunil S,4.0 of 5 bubbles,Aug 2016 • Couples,Beautiful view of Leh City,"Its very beautiful and easily accessible - its on way to Alchi Monastery and almost adjacent to airport but you need a vehicle to go to top, very steep - once there, you can have a magnificent view of Leh city and the best time is when the sun is at your back - this is the time when you can have the best of clicks of fading lights falling on the hills.  Had a chance to enjoy the Khambir Rot (Khamiri Roti with Curd) with Dahi - a very delicious local cuisine at Rs.30/- per Roti."
3,Spituk_Monastery,surendra_chelawat,3.0 of 5 bubbles,May 2016 • Couples,Nothing special,"Having seen some good monasteries in Leh my experience with Spituk has not been great, though this is most closely located to the town. With no sign posts or stadia you are not sure in which direction you have to move. There is steel rise in gradient making it difficult to walk and climb.The lamp temple is unique but you have to travel."
4,Spituk_Monastery,Mel_Who_Sings,4.0 of 5 bubbles,Aug 2016 • Family,Small but really atmospheric ,"Previous reviewers have not praised this little monastery and certainly you will see monasteries with grander furnishings and more brightly painted walls, but I loved the less touristy authenticity of this little place. The temple itself is at the top of the hill (more great views) and is made up of three small rooms. The one on the right is full of burning oil lamps and the final room has a series of large brightly coloured statues, but the main central room was my favourite as it was far more atmospheric than many larger places we visited. Worth the very short trip out of Leh I felt. "
5,Spituk_Monastery,kp_vy,3.0 of 5 bubbles,Aug 2016 • Friends,Close to leh,You will be visiting a lot of other monestries on your other trips to Nubra and Pangong lake so you can easily skip this one
6,Spituk_Monastery,abhishek mitra,3.0 of 5 bubbles,Jul 2016 • Business,Airport view,Not very special! Only the view of the airport and Leh city in the background is something you might like.
7,Spituk_Monastery,tourraut,5.0 of 5 bubbles,Jun 2016,Nice place but some what difficult to climb by old people.,This monestrey is located on a hill top overlooking Leh’s airport runway around 5km from town. Multiple mud-brick buildings tumble merrily down a steep hillock towards Spituk village on the Indus riverbank. The prayer hall contains yellow statue of  Buddha which is made up of copper as per the local people's tale. The steps going to the monastery are quite raw form and it seems the entire place is not maintain properly by the concerning people. On the very top of the gompa hill is a three-tiered latho (spirit shrine) and the small Palden Lamo temple hiding veiled Hindu-style deities and festival masks in an intimate rear section.Read more: http://www.lonelyplanet.com/india/jammu-and-kashmir/leh/sights/religious/spituk-gompa#ixzz4FutUm87v
8,Spituk_Monastery,llleslly,4.0 of 5 bubbles,Jul 2016 • Friends,Cycle there !,"The Spituk monastery is probably a short drive away but my friend and I hired some bikes and cycled there and I think that's a great way to get here. The monastery looks very impressive from the distance and when you're cycling around the nearby villages, you get to see the other side of the monastery and it's still a great view. It wasn't on my list to visit but it was on the way while cycling so I just checked it off. Not THAT impressive and nothing much to describe or write about but you could make a flying visit if you have spare time. "
9,Spituk_Monastery,mehal_parikh,4.0 of 5 bubbles,Aug 2015 • Couples,Only for Leh Airport's Aerial View.,Only for Leh Airport's Aerial View. There are certain restrictions on entering the monastery. Please contact locals.
0,Spituk_Monastery,Aniruddha S,4.0 of 5 bubbles,Jun 2016 • Couples,Spituk an Exemplary Monastery!!,"The Spituk words means exemplary...and here you go. The ancient monastery was founded on 11th Century and it is the den of more than 100 monks. You can have a very panoramic view of Leh, from the top. You have to climb a lot of stairs to go to the top (almost a 7 storied apartment) . The location is good, one good ice cream parlour and a decent canteen is there also to tease your taste buds."
1,Spituk_Monastery,subhrashis a,3.0 of 5 bubbles,Jul 2016,11th century monastery that overlooks the Spituk village.,"It is the first Gelugpa, or Yellow Hat, Monastery (as opposed to the more traditional red hats from the red cap that the Buddhists of Nalanda used to wear). There is a chapel devoted to Tara and has 21 images of her in different manifestations. The upper temple is the older one. It has big idols of Vajra Bhairava, Begtse, Vaishravana, White Chintamani, Upasika, Chamundi and Shri-devi. This gompa specifically mentions that alcohol cannot be offered. If I was the god I would be offended by such restrictions!"
2,Spituk_Monastery,sophiapt,4.0 of 5 bubbles,Mar 2016 • Couples,ancient monastery,Its not far from Leh so totally can visit if you have couple hours nothing to do. The view from Spituk Monastery can give you an over view of Leh which is nice to see. 
3,Spituk_Monastery,guptasanjeev65,4.0 of 5 bubbles,Jun 2016 • Family,First Monastery on the list,"This is a very small monastery in terms of size and located on a hillock overlooking the Airport. One needs to climb a good number of steps in order to reach the monastery. But after a first day of complete rest for acclimatization, this climb posed no problem. One gets a good view of the airport from the monastery."
4,Spituk_Monastery,Ashok130954,5.0 of 5 bubbles,Jun 2016 • Couples,Nice and Quiet,It is very nicely placed. Steps are there in each monastery. You would love the place. You would like to sit there and spend some time to meditate.
5,Spituk_Monastery,hgsalunke,5.0 of 5 bubbles,Jul 2016 • Family,Beautiful,Visited Spituk Monastery during Leh local city tour. The monastery is beautiful and as good as many other monasteries in Leh.
6,Spituk_Monastery,lotusdiamond,4.0 of 5 bubbles,Jun 2016 • Family,600 years old heritage,Located at one end of the runway on the hill top is Spituk Monastery. Monastery is almost 600 years old and maintained. You need to climb stairs and buy entry ticket to visit inside. This is the place for awesome view of Leh and Runway. Just below the Monastery is located Air Force Station. I am curious to visit monasteries to know more although they all looks similar. All the idols are covered with piece of cloth and removed only once a year for 4 days in the month of Jan.  Spitiuk is famous for its 600 years old heritage nothing else. For beautiful architecture visit Hemis and Thiksey.
7,Spituk_Monastery,travellertrail6,5.0 of 5 bubbles,Jun 2016 • Friends,Old monastery with a great view,"Like most other monastries, the Spituk Monastery is situated atop a hill. We visited this one on way to leh from the gurudwara. The monastery is about 600 years old and quite well kept and offers some lovely views of leh and the airstip around. I have a curiosity for monastries so i don't mind peeking into each monastery even though they may appear similar."
8,Spituk_Monastery,drkaushikmandal,4.0 of 5 bubbles,Jun 2016 • Couples,Worth visiting........,"Spituk Gompa is a nice monastery close to the city, which is worth visiting at least for those who love photography. The monastery is as usual like a prototype Buddhist monastery, with nothing much to discuss except its age, but the view is spectacular from this place."
9,Spituk_Monastery,ANILJOHAR,3.0 of 5 bubbles,May 2016 • Family,Spituk Monastery,Spituk Monastery is also good as all the monastery is same with different architecture. If you are interested to see the monastery than you can visit but if you have seen Thiksey than it is your choice to visit here also.
0,Spituk_Monastery,Syed T,4.0 of 5 bubbles,May 2016 • Friends,Old but well kept,One of the oldest monasteries located on the hill top. You will also get a good view of th town from here.
1,Spituk_Monastery,Lalbahadur,4.0 of 5 bubbles,Apr 2016 • Friends,best view,"Nothing much to say about this place. One may visit This monastery on the way to sightseeing of alchi, on leh-srinagar highway, Approx 50 mins drive from leh. The best part of this monastery is view."
2,Spituk_Monastery,BeingNomad,4.0 of 5 bubbles,May 2016 • Couples,Average monastery,"Leh/Ladakh region is full of monasteries and this is one of them. The place is quite close to leh and can be visited during the time you are acclimatizing yourself.Must See: The temple at the top of the hill, airstrip/airport with flights taking off/landing constantly, provides a good view of the Leh city"
3,Spituk_Monastery,travel_ticker,4.0 of 5 bubbles,Apr 2016 • Family,Nice place,Nice monastery and quite near to the city. The temple complex is very nice and the monastery gives a very nice view of the KBR Airport
4,Spituk_Monastery,SuvodipMoitra,3.0 of 5 bubbles,Apr 2016 • Family,Average Monastery,"If you have extra time in hand. Go for it, else chuck it. Not so attractive. But from top good view of the city & airport."
5,Spituk_Monastery,Begaraaj S M,5.0 of 5 bubbles,Apr 2016 • Solo,Stupendous Spituk !!!,"I went to Leh on 24th April 2016, same day after 2hours of rest I started my tour and went straight to Hall of Fame, but it was closed for renovation, so I went to this wonderful monastery, the location was top class with the view of the Leh airport runway, in fact the 360* views from this place is awesome.Must visit for all age groups since it's located very close to the city, Kali mandir is very famous in this monastery and we can see some beautiful statues, I took some fabulous photos and videos to cherish.Happy travelling ...Enjoy !!!"
6,Spituk_Monastery,Kaneth25341,4.0 of 5 bubbles,Apr 2016 • Friends,Close to the airport with chances of seeing landing planes,"Its located on a hill near the airport's runway which makes it very easy, and probably the best place to watch planes landing or taking off as planes will pass above the short diverting road to the monastery. There's a sign that said photos of the military area is strictly prohibited but I find that really hard to comply if one were to take photos of Leh from there. The monastery offers 360 degrees of view which were enjoyable. The distance from Leh makes it a must visit and can be done it less than an hour."
7,Spituk_Monastery,yogindery,5.0 of 5 bubbles,Apr 2016 • Couples,giant statue of Kali,"Spituk Monastery in Leh district, Ladakh, northern India, 8 kilometres from Leh. It was founded by Od-de, the elder brother of Lha Lama Changchub Od in the 11th Century. Founded as a Red Hat institution, the monastery was taken over by the Yellow Hat sect in the 15th century. The monastery contains 100 monks and a giant statue of Kali which is only unveiled to the public during the annual Spitok festival. Every year the Gustor Festival is held at Spituk."
8,Spituk_Monastery,arkzworld,4.0 of 5 bubbles,Aug 2015 • Friends,Old Palace of King with Added Monastery,The Intricacies of wood work in visible in the ruins. A giant Budhha statue is located here. Nice place to visit once in Leh. 
9,Spituk_Monastery,ShubH GhosH,4.0 of 5 bubbles,Jan 2016 • Friends,January Festival for the Goddesses View,"Located on the farther side of the airport at a vantage point overlooking the Leh airport, this place is steeped in local culture, history and spiritualism. The monastery is co-located with Kali Mata Mandir. Of course you cant view the goddesses except if you manage to visit in first week of Jan. The screen is removed and you can view the large demonic deities. Its mesmerising amidst all the chantings. A cultural show is organised by the monks to celebrate this special occassion. The seamless enmeshing of the two religions rightly strengthen the unity of godhood. So if you can plan well, are strong and brave and enjoy adventure to the extreme-- Do visit this Monastery in winters"
