Tourist Attraction,Name,Rating,Date and criteria,Title,Review
Anjuna_Beach-Bardez_North,Tushiepie,4.0 of 5 bubbles,Apr 2019 • Family,A good beach for some good food and music,It a little uphill from Baga Beach but the food and music here is good.Though mostly trance and edm plays here..we were at aura bar and Cafe which has a good sea side view..Another famous shack at Anjuna is CURLYS.OVERALL A ONE TIME VISIT.Anjuna flea market is also worth a try once if u wanna shop..
Anjuna_Beach-Bardez_North,Avi,3.0 of 5 bubbles,Apr 2019 • Friends,Good place.,Very nice place to visit.I visit this in the mid february and I fully enjoyed the place with my friends.
Anjuna_Beach-Bardez_North,shoyjoseph,4.0 of 5 bubbles,Feb 2019 • Friends,famous beach in goa,"it is one of the famous beach in goa. Very crowded. lots of shacks, pubs, hotels available just opposite to beach. many small shops of cloths and art work."
Anjuna_Beach-Bardez_North,Cristina M,1.0 of 5 bubbles,Mar 2019 • Friends,So crowded and dirty,Not recommended at all. Bad area to swim or even just to have sunbathing. Crowded and dirty. I won’t come back here.
Anjuna_Beach-Bardez_North,Parveen M,4.0 of 5 bubbles,Feb 2019 • Couples,Rocking sunset view 👍,"Fantastic experience,SUNSET scene on the Seaside with cool view of rocks and coconut trees 👍Nice Place to visit asper  my point of view 🌹💐"
Anjuna_Beach-Bardez_North,Barry B,5.0 of 5 bubbles,Mar 2019 • Family,Great time out,Try a bit of old goa  check out the market and bargaining skill s  follow some of the old Hippy  trail The fun starts by going on a local Boat  Someone   like Eugenio  who has been their for years and is very Knowledgeable  Great for shopping
Anjuna_Beach-Bardez_North,Agarciaaa,2.0 of 5 bubbles,Mar 2019 • Couples,"Great prices, swarmed with beach vendors.","The cove of the beach is beautiful, I found alot of hassle from all the beach vendors. I couldn't enjoy 5 minutes on the beach without having another vendor hassling us to check out their shop.Not relaxing."
Anjuna_Beach-Bardez_North,Sunil Vatta,3.0 of 5 bubbles,Jan 2019,Good Sunset View Point,Good beach for viewing sunset. Not so good for bathing as lot of thick sand and stones are there on the shore. 
Anjuna_Beach-Bardez_North,Hooray H,2.0 of 5 bubbles,Feb 2019 • Couples,A shadow of what it was,"A visit after 35 years, first time was March 1984.How awful; this pristine, paradise beach is ruined- so unorganised & dirty.Don't bother going there."
Anjuna_Beach-Bardez_North,Parmeeta123,2.0 of 5 bubbles,Mar 2019 • Friends,It's died a slow death,"Please don't waste your time visiting this beach, unless you want to experience the flea market. This is a rocky beach and super commercial. It's personally not my thing."
Anjuna_Beach-Bardez_North,SSDelhi,2.0 of 5 bubbles,Mar 2019 • Family,No where close to the best beaches in Goa,"Went with senior citizens and kids and I must say it wasnt the place I should have chosen, especially after having spent most of my time in Calangute beach. Hardly spent 15 minutes and rushed back"
Anjuna_Beach-Bardez_North,Mark L,3.0 of 5 bubbles,Jan 2019 • Couples,Great place and fantastic market   ,"Popped over from Vagator to the next beach to mosy around the market and beach. Many an hour looking around and a few items bought. Colourful, noisy and vibrant, as per expected, and lively locals. Partner spent far too much and beers were desperately sought😂 Beware the guys who walk up to you saying you’ve got something in your ear. Scammers who’ll want 200 rupees to clean non existent stones and wax out of your ears. Gets a bit tiring after a while, but a polite but forceful No will suffice. Worth a visit on market day. "
Anjuna_Beach-Bardez_North,Eamon M,2.0 of 5 bubbles,Feb 2019 • Solo,Not disabled friendly,For anyone with mobility issues this is not a friendly place all the beach bars and restaurants have steps up to them. The majority of the roads seem to be small lanes with a rough surface very hard work for a wheel chair. Still hard going with walking sticks. If you found this review helpful give it a thumbs up. Thanks
Anjuna_Beach-Bardez_North,Monica Thomas,3.0 of 5 bubbles,Jul 2018 • Friends,Not Good Neither Bad,This is the first time i went on some beach so if we look at my point of view this beach is nor good neither bad but there was a lot of crowd and also water sports are also very costly but you can visit other beaches some of are very good and clean like vagator.
Anjuna_Beach-Bardez_North,Nitesh Rajput,3.0 of 5 bubbles,Nov 2018 • Friends,Average,"Well, the spot is quite nice and less crowdy. Limited water sports facilities and very few restaurants you can find here."
Anjuna_Beach-Bardez_North,CoolTravelFreak,3.0 of 5 bubbles,Aug 2018 • Couples,Decent Affair,Anjuna is famous for its flea market .. This beach is very crowded and not very very neat .. would always prefer vagator or baga ... this is
Anjuna_Beach-Bardez_North,Arpit Deshmukh,1.0 of 5 bubbles,Feb 2019 • Couples,Worst water sports,Anjuna water sports people are so hungry for money.  The person who is your spoc  makes false commitments to get the deal. After deal is done you will meet new persons who come with their own Terms and conditions. In middle of each sport they ask extra money to give full ride. That means the amount you have already paid is just for half of the ride only.  They are always ready to argue which makes your experience very bad.
Anjuna_Beach-Bardez_North,Isabellajackson,2.0 of 5 bubbles,Jan 2019 • Couples,Dirty,"What could be a pleasant beach, is littered with glass, plastic, nappies, we even saw a dirty needle and syringe in the sand for example.Many of the Indian tourists appear to be large groups of males who just go to the beach to drink alcohol ( then throw the used alcohol bottles in the sea or the sand) and take photos of females.Goa is being ruined by people not taking responsibility for the correct disposal of their rubbish.TAKE YOUR LITTER HOME."
Anjuna_Beach-Bardez_North,Anand Bhatia,5.0 of 5 bubbles,Oct 2018 • Family,Its been a great trip,Its a great visit to the goa all family and friends are there to welcome us. Enjoyed a lot :) beaches are great and food was awesome.
Anjuna_Beach-Bardez_North,Mohit Agrawal,4.0 of 5 bubbles,Feb 2019 • Couples,Rocky beachbwith great view,Every beach in north Goa has its own special attraction. While others may be famous for night life and sunset. This is slight diffrent. Its a rocky beach and provides and amazing view to beauty ful view 
Anjuna_Beach-Bardez_North,adventure,5.0 of 5 bubbles,Apr 2018 • Family,wonderful,it was greatest experience travelling to goa. full freedom and excitement. i was so happy with my family here
Anjuna_Beach-Bardez_North,pr_ri_123,4.0 of 5 bubbles,Jan 2019 • Family,Nice beach,"This one is near vagator and a little far from main north goa area but worth a visit. If you are family, avoid it at night as its famous for rave parties."
Anjuna_Beach-Bardez_North,modxsounds,4.0 of 5 bubbles,Mar 2018 • Couples,Noisy beach,"It is a good beach for drink a beer or coffee,or just lay down and watch. But if you want to swim better to go to vagator beach or arampol beach probably the best beach in north goa. If you want to party go to the shiva Valley in anjuna Beach every Thursday night."
Anjuna_Beach-Bardez_North,Sukhvinder1955,3.0 of 5 bubbles,Feb 2019 • Friends,Not easily approachable beach,"By the time we reached Anjuna beach, it had started getting dark, so we avoided going down to the beach and had a view by standing on top only. The view was indeed beautiful. The water front here is small as well as not easily approachable. As we reach near the beach, we have to go down the side lane to reach near water front. However the water is nice and clear and the scenario is lovely. We enjoyed the sight and the breeze for sometime before heading back to the Resort."
Anjuna_Beach-Bardez_North,Sharmaedm,5.0 of 5 bubbles,Jan 2019 • Solo,Good market,"This market next to Anjuna beach. Good leather stuff available here. I bought a hat. Lot of restaurant,  good food. Bike for rent also available here."
Anjuna_Beach-Bardez_North,CheekyKB,3.0 of 5 bubbles,Jan 2019 • Couples,Really good beach if you want to get away from the hustle and bustle of Calangute,"It's a better beach than Calangute/Candolim and not as busy, however there are still quite a lot of travellers that frequent this beach. There were more domestic Indian tourists than other cultures"
Anjuna_Beach-Bardez_North,AIS,5.0 of 5 bubbles,Jan 2019 • Friends,"Lots of Fun, Music, Food, Shopping",This is where the Parties are at. Very loud and vibrant. Loads of Shopping and many restaurants and dancing scenes to choose from. Very tourist-y. 
