Tourist Attraction,Name,Rating,Date and criteria,Title,Review
Anjuna_Beach-Bardez_North,s.,3.0 of 5 bubbles,Dec 2022 • Family,be wary of jet skiing,"not the best beach for lounging (preferred Baga). speed boating was worth it, jet skiing was 100% not (they don’t let you drive and the whole trip only lasts 2 minutes)."
Anjuna_Beach-Bardez_North,Vandana,5.0 of 5 bubbles,Oct 2022 • Family,A picturesque rocky beach ,This is a rocky beach . Ample of misleading places for four wheeler parking. One can drive a long way inside and still find parking available. The beach is very picturesque .
Anjuna_Beach-Bardez_North,Chalo Travellers,4.0 of 5 bubbles,Nov 2021 • Couples,Adventurous beach ,"Anjuna beach is one of the best beach for water and sport activities,amazing place to hangout.I loved the beach and enjoyed"
Anjuna_Beach-Bardez_North,Raja Ashu,4.0 of 5 bubbles,Nov 2021 • Couples,Fun beach ,This place was super amazing to stay relaxed and lots of things to do like various water activities and  restaurants and shacks
Anjuna_Beach-Bardez_North,Neha D,1.0 of 5 bubbles,Aug 2022 • Couples,It's only about money here.,"Please do not visit this beach. It's not about the nature or public place anymore. There are Vultures who are only hungry for money. We thought of visiting beach early morning & have a nice morning walk but there are people who won't let you enter the beach if you do not park wherever they want & pay them money. We really had very bad experience.As soon as we refused to pay them, those vultures started arguing & abusing. Please visit other beaches in Goa."
Anjuna_Beach-Bardez_North,Maneesh2700,5.0 of 5 bubbles,Jun 2022,"Anjuna Beach, Goa -- A Beach that tells you something","We had a short stint at this beach but that was awesome ... the heavy water tides made us fal in love with this beach ... A good place to be with family, surrounded by a number of amazing pubs and cafes"
Anjuna_Beach-Bardez_North,anand s,5.0 of 5 bubbles,Dec 2021 • Family,Calm Beach,"The beach is having less rush comparing calungate beach, most important feature is clarity of sea water. The sand is firm to walk around. Its ideal for family with small kids. "
Anjuna_Beach-Bardez_North,Mason,3.0 of 5 bubbles,Oct 2021,Beach with water sports and bars,"Great place to hangout with friends but if you're looking for peace and less crowd, you can avoid this place as it offers none. But yes, crowd depends on the season. All water sports are available here and there are some nice locations for photography. Come here during night and enjoy the view from a high point i.e from Sunset bar and Cafe Liliput."
Anjuna_Beach-Bardez_North,Ritesh,3.0 of 5 bubbles,Nov 2020 • Family,It's famous for its beautiful site view..Nice to feel from high mountary. One should visit atleast one time here. No many crowd ,Anjuna beach 6-7 km far away from the south goa. Anjuna beach is not so much developed. Beach is for feel the beauty of the sea beauty.you can not take bath here..
Anjuna_Beach-Bardez_North,Sandy_JSR,4.0 of 5 bubbles,Feb 2021,Nice Settings,"Anjuna is one of the beach of many beached in Goa. During our visit to Goa in Feb’20, we visited Anjuna Beach as part of North Goa tour during evening time. The beach had enough place for car park and was situated at a small hike, we reached the beach through steps. The beachside was rocky and one has to be careful to avoid trip and fall.  When we visited, the beach had lesser crowd, we spent some quality family time on the beachside by enjoying the sunset and surrounding."
Anjuna_Beach-Bardez_North,lotusdiamond,4.0 of 5 bubbles,Dec 2020,Awesome & Famous,"Anjuna beach is famous among not only locals but foreigners . Few years back it used to be full of foreigners. But lately, only local tourists visit this beach. Local food is amazing and environment is superb."
Anjuna_Beach-Bardez_North,Roshan_Dhamvani,4.0 of 5 bubbles,Jan 2021 • Friends,Place to relax,Time we visited was not much rush there one can sit there whole day and relax for the half day .....
Anjuna_Beach-Bardez_North,TravelMongers,1.0 of 5 bubbles,Nov 2020 • Family,Don't go there - it is full of glass,The beach is full of glass from broken beer bottles. The visitors or the shack owners don't care for it in any way. There are no dustbins anywhere. I cut my toe deeply while just standing in the water 
Anjuna_Beach-Bardez_North,PusHkar Raj,5.0 of 5 bubbles,Sep 2020 • Solo,Anjuna Beach,"Amazing experience, loved this place clean and worth of visiting. Local Food is amazing specially local fish. You get parking with very small price. Try local wine.. it’s good for first time. "
Anjuna_Beach-Bardez_North,Vikram Pandian,4.0 of 5 bubbles,Nov 2019,Beach Shack are best,Best Beach. Less crowd. Has parking. Peaceful.Beach Shacks are best and late night partyOnly things not much safety for family
Anjuna_Beach-Bardez_North,Abhishek,5.0 of 5 bubbles,Nov 2019,Tranquil.psy.beach.peace,"This is where it all started in 1960's . Anjuna !this will be always a trance lovers paradise, come at night for best underground trance scene in goa , be it UV bar , pirates, shiva valley or curlies.have been visiting each year since 2010.you know what to have to do to get the best of anjuna experience"
Anjuna_Beach-Bardez_North,ashishdeora123,4.0 of 5 bubbles,Mar 2020,nice,located on north goa its 18 km from panji nice beach less crowded as compare to colva beach overall nice
Anjuna_Beach-Bardez_North,Manasa,5.0 of 5 bubbles,Feb 2020 • Friends,Tranquil atmosphere and calming waters ,"Unlike Baga and Calangute, Anjuna is fairly less crowded and less noisy with lesser establishments occupying the beach area. Contrary to the other beaches, the water here is blue, the sand is white, and comes with an unusual rock formation (which are quite sharp and dangerous even, so one has to be careful while sitting or even standing on them). There is an air of tranquility and serenity here especially if you visit in the mornings. On a clear sky day, one can see the blue and green shades in the water. Also, there are plenty of assorted pebbles and shells of different colours and sizes that you can pick as souvenirs. If you ever go on a Wednesday, I would suggest that you shop in the flea market during the day and have a nice evening at Curlies or Shiva Valley, enjoying the gorgeous view of the sea."
Anjuna_Beach-Bardez_North,Aniruddha Srivastava,4.0 of 5 bubbles,Sep 2019,Beautiful beach in north Goa,"Although, there are many beach in North Goa but most of them are crowded and not very clean like South Goa beaches. here, Anjuna beach is different. Beach is beautiful with famous Curlies shack. Must visit."
Anjuna_Beach-Bardez_North,Ruchira Khandelwal,3.0 of 5 bubbles,Feb 2020,Not a good experience,"Nice place to go to watch the sunset but there is no sandy beach, it is all rocks. Perhaps Google maps landed us on wrong side of the beach. What we found was that seashore was very less area, not many people, and not so clean water. Our visit to Candolim beach post this made us realize that it was a waste of time to visit to Anjuna. May be there is some better side of this beach. I would suggest not to go by Google map. It is better to ask locals."
Anjuna_Beach-Bardez_North,Suraj Nayak,5.0 of 5 bubbles,Feb 2020,Relaxing beach with many shacks,"We love this beach. There are many hotels with beach cottages that are right on the beach. Lots of shacks to look into the sea and have a meal in including the super famous Curlies. This beach is also popular for the flea market that happens on WednesdaysThe beach is not ideal for a swim as it is quite rocky. There are many water sports options available such as parasailing, banana boat and speed boat."
Anjuna_Beach-Bardez_North,Samir S,3.0 of 5 bubbles,Feb 2020,Anjuna Beach - Rocky and clam beach,"Located 18 kilometer from Panaji . Full of rocks , clam and serene . Night party goers can enjoy a lot . View is beautiful.  Nearby Wednesday and Saturday market one can roam .  Under sun this place should be avoidable . We stayed only for 20/25 minutes ."
Anjuna_Beach-Bardez_North,Mohit G,3.0 of 5 bubbles,Feb 2020,Rocky beach but great view,"It was a rocky beach, so didn't enjoy playing with water but the view was awesome.  The shacks are at a height and they have good music, good food, provide beautiful view of the horizon. the sunset was the best."
Anjuna_Beach-Bardez_North,The Great,5.0 of 5 bubbles,Jan 2020,beach,its nice beach and sunset point of this beach is also nice and not more crowded so place is nice to visit
Anjuna_Beach-Bardez_North,Must Do Travels,5.0 of 5 bubbles,Sep 2019,Amazing,Goa is the hot and happening party beach destination in India popularized by the hippies who visited the beaches here in their heyday and still do so in flocks and Anjuna ranks
Anjuna_Beach-Bardez_North,GD's BBQ Grill (24x7x365),5.0 of 5 bubbles,Jan 2020,The Beach which never Sleeps,"The Iconic Curlies, Shiva Valley, Cafe Lilliput are where you will see the most activity all year round. Water Sports & a clean beach is what Anjuna is all about. Wednesday Flea Market. Tuesday PsyTrance @ Shiva Valley goes on till lunch the next day, talk about overnight rave parties. "
Anjuna_Beach-Bardez_North,mrsharma132@yahoo.co.in,4.0 of 5 bubbles,Jan 2020 • Couples,Anjuna beach,"I visited a resort at Anjuna beach, owned by my daughter's friend, whose son is a friend of my grandson. The view was fantastic with the sun settling. This is why Goa is so attractive to all. "
Anjuna_Beach-Bardez_North,Anne-Sofie A,1.0 of 5 bubbles,Jan 2020 • Couples,Read this.,"This was not that we expected us then we went for Anjuna. We are not please at all. Stayed för 1 night and then left it- all though we allready payed för 1 week!! Just a lots of young drunk Indians and very high rave music. Anjuna, the village is a bit far to go to from the beach as well. Dont go here! "
Anjuna_Beach-Bardez_North,Bhav B,3.0 of 5 bubbles,Jan 2020,Good for sunset nothing else.,Great place to go to watch the sunset but there is no sandy beach it is all rocks. As well as people selling alot and the vast array of dogs roaming around
Anjuna_Beach-Bardez_North,ravin gareeb,5.0 of 5 bubbles,Jan 2020 • Couples,Anjuna Beach,Lovely landcape with lots of water activities Safe with excellant choice of foods and wine Good service 
Anjuna_Beach-Bardez_North,sohilgoodluck,5.0 of 5 bubbles,Feb 2019,nice but rocky beach,its a nice but rocky beach so be sure to wear good footwear. Its neat and clean and has some stalls to eat corn and other snacks 
Anjuna_Beach-Bardez_North,Rahul Mishra,4.0 of 5 bubbles,Jul 2019,Just another Beaach in Goa,it fall in the middle of going from Baga Beach to Chapora Fort. So another batch you can add easily in your Goa trip list.
Anjuna_Beach-Bardez_North,globetrottingBee,4.0 of 5 bubbles,Dec 2019,Serenity of the Setting Sun,The land is at a higher level. So the sunset is best seen from a high level. Go in time for sunset and you will enjoy the serenity of the setting sun.
Anjuna_Beach-Bardez_North,Bhumi Bhesaniya,5.0 of 5 bubbles,Dec 2019 • Solo,Serene and Peaceful,"Anjuna beach offers beautiful view of ocean with least crowd around, it does not offer water activities but it is serene, peaceful and there are many beachside shops and restaurants. "
Anjuna_Beach-Bardez_North,Maddy's Review,5.0 of 5 bubbles,Oct 2019 • Family,Nice Beach with scenic beauty,"Very nice beach with excellent scenic beauty.Unlike others, It's a rocky beach. Little crowded place."
Anjuna_Beach-Bardez_North,kev_russ,4.0 of 5 bubbles,Oct 2019,Nice vibe at the beach,"We stayed at Candolim so took a short cab ride for a visit. It was a nice enough beach, a little small and crowded but it had a nice vibe about the place, especially visiting the flea market then having a beers at sunset."
Anjuna_Beach-Bardez_North,amita pandey,4.0 of 5 bubbles,Dec 2019 • Couples,Goa trip,"You recently we've been to goa and we visited this place called Anjuna beach. During off-seasons you won't get much to do or see however from mid-October to February, you can see lots of happening. Many parties, carnivals take place. As its season so prices are bit high so if you are planning to visit or attend any of the happening it's better to go for early bird tickets and booking to avoid any hassle during or before the trip."
Anjuna_Beach-Bardez_North,KALYAN R,3.0 of 5 bubbles,Dec 2019 • Family,LOST HEAVEN ,"My first visit was in the year 1991 and the beach was full of foreigners and sports activities like volleyball, amateur tennis played, ambience was superb but the beach is now lost in sea and big stones are there and new beach is 2km inside from here. The approach road is narrow and not properly maintained. Authorities must look into the same. Number of foreigners are fewers. Not at all a good sign for a famous tourist place. "
Anjuna_Beach-Bardez_North,A2SV Traveller,3.0 of 5 bubbles,Nov 2019 • Family,Not so good,"As suggested by our cab provider we headed to the is beach first to this beach first thing ok our first day of the Goa visit. Perhaps Google maps landed us on wrong side of the beach. What we found was that seashore was very less area, not many people, stuck sound, not so clean water. Our visit to calangute beach after this made us realise that what a waste of time it was to visit Anjuna.May be there is some better side of this beach. My recommendation is that dk not go by Google map. It better to ask locals."
Anjuna_Beach-Bardez_North,Arun Golas,5.0 of 5 bubbles,Dec 2018,Excellent Beach,"It is one of the most popular beach of Goa, located in North Goa. It is also one of the beach most frequented by the foreign travellers."
Anjuna_Beach-Bardez_North,Melany,5.0 of 5 bubbles,Nov 2019 • Solo,Best hostel,"It's even too hard to explain how this place is how amazing as it is! What makes it so special is its vibe. An artistic, magical, free world where everyone can be its most authentic and genuine self. A community of travelers,  who share and grow together. A family! It's also very close to the beach and a walking distance from the main areas and party life. It's the perfect balance between a chilled life, with a relaxed vibe and the craziness of Anjuna's night life. I could not recommended enough!! :)"
Anjuna_Beach-Bardez_North,Happy Hippy Girl,5.0 of 5 bubbles,Nov 2019 • Friends,Anjuna Beach,"This beach is beautiful. Has a small shopping area. This man sells tut he best roasted corn ever. The water is clear, warm cool water. Waves a bit rough but nothing a swimmer can't handle. "
Anjuna_Beach-Bardez_North,Explorer,4.0 of 5 bubbles,Nov 2019 • Couples,Serene,This is the best beach in Goa which I have been to. Pretty clean and compared to Baga has less crowds
Anjuna_Beach-Bardez_North,jainms,5.0 of 5 bubbles,Dec 2018,Good one,"Also one of the good beach in Goa, I felt it is less crowded and near to flea market where we can shop lot of things."
Anjuna_Beach-Bardez_North,Explore2498,5.0 of 5 bubbles,Nov 2019,Beatiful!,Really good beach to relax and spend hours looking at the beach in a cafe overlooking from the top! Simply amazing!
Anjuna_Beach-Bardez_North,Anuj Thappa,5.0 of 5 bubbles,Aug 2019,A beautiful beach with rocks! and ship view in faaaaaarrrrr end,"I visited this lovely beach in August during my trip to Goa. This beach has a wonderful shoreline, and the sunset here is simply magnificent! with orange reflection on sea water......... Wow experience. The surrounding trees and the greenery make for an amazing scene as well on sea shore. The best things were the huge rocks. The fact that Anjuna beach is not renowned for activities like water sports. For this reason, Anjuna experiences a lot less crowd than most other beaches in Goa. Therefore, the beach is very quiet and you can enjoy the beauty of nature quite peacefully. Moreover, the beach is conveniently located, and hence, can be accessed from all corners of Goa.The Anjuna beach is a lot safer in comparison to some of the other beaches in Goa as i feel. You will also come across a number of budget hotels as well as expensive accommodations near the beach."
Anjuna_Beach-Bardez_North,pradeep j,5.0 of 5 bubbles,Nov 2019 • Couples,Amazing place ,As all visit Goa almost similar places at Baga or culgd beach but you LL find it too crowdy but if u wanna enjoy n feel the real peace thn visit anjuna beach n specially (curlies restaurant) you LL find it at the almost at edge of the beach and it's dam clean ther with less crowdy
Anjuna_Beach-Bardez_North,Iffi9j,5.0 of 5 bubbles,Oct 2019 • Family,Happening place,We went on two wheeler's from baga to Anjuna beach.There are various parking attendant's who charge about 20 rs.Best time to visit anjuna beach on a wednesday when you have anjuna flea market.The beach has a lot of activity from Bumper approx 600Rs to banana ride 1000rs approx for 4.Excellent waves.
Anjuna_Beach-Bardez_North,Tapan,1.0 of 5 bubbles,Oct 2019 • Couples,Disappointed,We personally did not like it much. Though this is only a subjective opinion.we did not see watersports or any adventure. Baga and Vagatore are best
Anjuna_Beach-Bardez_North,Amruta23,4.0 of 5 bubbles,Oct 2019 • Family,Not a beach actually,Anjuna beach is very beautiful.. very clean and scenic..with blue skies and blue waters.. But there is no sand where kids can sit and play with sand toys..Anjuna beach is not crowded so if anyone wants to take family pics and pre wedding photos.. it's best place as no crowd will spoil your pics..Water is to be seen from a high point..Parking charges RS 100 .. for full day or for one hour.. So pretty expensive..Rest the road to Anjuna beach is scenic.
Anjuna_Beach-Bardez_North,Prabhat Maurya,5.0 of 5 bubbles,Sep 2019 • Couples,Rockey Beach,"A rocky coral beach of Goa..I literally loved this the best.. without getting sand stuck in your footwears, one enjoy the water splash. The corals were so Lovely and beautiful and the under rock water caves were splashing the water out of nowhere."
Anjuna_Beach-Bardez_North,saurabh_dhingra10,5.0 of 5 bubbles,Aug 2019 • Family,Beautiful beach with some really nice shacks,It is a beautiful serene beach in North Goa. Excellent shacks available on the beach with great views and food. Definitely a must visit beach.
Anjuna_Beach-Bardez_North,Ssethi,5.0 of 5 bubbles,Aug 2019 • Family,Goa trip,"Must visit Beach if you travelling to Goa,Photogenic, cool beach. Take camera with you if you have a interest in photography."
Anjuna_Beach-Bardez_North,shayneracheldanielj,1.0 of 5 bubbles,Sep 2019,Why?,"I’m an Aussie writing for aussies..I visited all the northern beaches, they remind me of Bali, all the worst bits of Bali! Yes I visited at the end of monsoon, however the water is generally murky, beach sand was only dirty yellow on one beach. On a popular beach only concrete erosion busters, no sand. Hinterland is ok for chilling. Want to party, then it’s what people come for..I won’t fly over Indo to come back. Spend your time elsewhere in India. I didn’t visit southern beaches."
Anjuna_Beach-Bardez_North,Karpagavalli,5.0 of 5 bubbles,Jul 2019,Beautiful beach,This is one of the beautiful and most sort after beach destination by tourists in goa along the Arabian sea coast of goa in northern part of goa with beautiful sand and seashore.
Anjuna_Beach-Bardez_North,Andy B,4.0 of 5 bubbles,Jun 2019 • Couples,Good athmosphere.... ,I like this beach not so far from my friend place... Also like flea market ever here... But sometimes is so dusty but okay not really a problem.. But sometimes beach so dirty becouse many rubbish... Overall good to stay here with many differrent things... India is so nice for me to spend my time with my bf... 
Anjuna_Beach-Bardez_North,syed_vasim_s,4.0 of 5 bubbles,Jul 2019 • Couples,Beautiful clean beach in North Goa,This beach is very clean with restaurants on the beach. There are few stay options also in the beach.This is less crowded compared to Baga.
Anjuna_Beach-Bardez_North,Got Keried Away,4.0 of 5 bubbles,Jul 2019 • Couples, Nice Night Spot,We went to this beach at night. There were several restaurants and clubs along the beach. Some clubs had quite loud music so you could sit in the sand and listen or move down the beach to a quieter place. 
Anjuna_Beach-Bardez_North,N S R,3.0 of 5 bubbles,Jul 2019 • Family,Visit to Anjuna on 1st July 2019,"This beach has lock of rocks , so not much space for moving around. May be because when I visited it was raining and high tide was there. I was not able to see the sand pima facie.But sunset is very nice from here. Way to beach is bit slippery inrain so be cautious while going there.Not much clean when I visited"
Anjuna_Beach-Bardez_North,adarssh s,3.0 of 5 bubbles,Jun 2019 • Couples,dont go here,"its useless to visit this beach.you will get nothing here except if you want to catch fish than its good for you else no use.only rocks here and very small narrow passage to down to sea,i wud say its not beach it just u can look sea and it wave which u will get any beach in goa."
Anjuna_Beach-Bardez_North,Komal S,4.0 of 5 bubbles,Jun 2019 • Family,Rock Beach,"Anjuna beach is very important beach of Goa, It divided into two parts one of the rock beach and second is sand beach, there is very attractive sun set scene,the sea waves are also attractive"
Anjuna_Beach-Bardez_North,jackiekapadia,4.0 of 5 bubbles,Jun 2019 • Friends,Nice beach ,Travel only in April may when to take sun bath other wise there is heavy tides n u cant even go in beach.. It's a famous beach for foreigners. Overall less then 1hr beach not famous as baga n culungate
Anjuna_Beach-Bardez_North,Manish Sarraf,3.0 of 5 bubbles,Jun 2019 • Family,Rocky beach but not as good as other,The beach looks more like picnic spot than a romantic or leisure place. I did not like the beach to spend more than few minutes
Anjuna_Beach-Bardez_North,20travel1972,4.0 of 5 bubbles,May 2019 • Family,A beach more peaceful and less of crowd.,Anjuna Beach is not so crowded beach but nice place to relax and swim and more peaceful. I'll say good place for romantic dinner. The beach is still clean and can enjoy sunset from Mountain top touching the beach. A perfect place for photography. From the hilltop on one side is Anjuna Beach and other side Vagator.
Anjuna_Beach-Bardez_North,Mohan George,5.0 of 5 bubbles,Jun 2019 • Friends,Amazing sunset point,* Best to visit for the sunset.* The place is very silent and good* There are many restaurants in that area where you can have some good food and enjoy the sunset
Anjuna_Beach-Bardez_North,kapurvandana70,3.0 of 5 bubbles,May 2019 • Solo,Average experience but gud sunset view,"Over the years, anjuna has been stated a clean beach but lately it has become a little dirty , animals freely roaming around. Though it is gud for sunset view and has a relaxing effect."
Anjuna_Beach-Bardez_North,Vayu43,4.0 of 5 bubbles,May 2019 • Couples,Clean Beach,Anjuna beach was not crowded  and was clear - it was hot as it was May 2019.Not very many folks but for those who would want a quiet time would have loved it !
Anjuna_Beach-Bardez_North,sumapuranik,5.0 of 5 bubbles,May 2019 • Couples,Very nice,"We visited this beach today 12/5/19,nice view We saw corals in the sea.We took many pebbles.,stones from the sea. It was amazing.Mant beach resorts are there.One thing we didn't liked this area was parking money.Every where people exploits you.100rs taken from us.You are helpless in this matter."
Anjuna_Beach-Bardez_North,shovanosneha,4.0 of 5 bubbles,Jul 2018 • Friends,Nice beach!,Anjuna beach is undoubtedly one of the  best sea beaches of Goa. Sacks along the sea shore prepares delicious dishes. We tried few sea foods like crab & prawn.
Anjuna_Beach-Bardez_North,Krishhere,1.0 of 5 bubbles,Apr 2019 • Couples,Littered and dirty. Avoid ,"Having visited Calingute, Candolim, Vagator, Ozran & Bogmalo beaches in Goa before coming to Anjuna beach, I found Anjuna a huge letdown.  Indiscriminate construction has destroyed the beauty of this beach. The pathway to the beach is very dirty and littered. "
Anjuna_Beach-Bardez_North,NTJOC1,4.0 of 5 bubbles,Apr 2019 • Friends,"Good atmosphere, quiet out of season","High season in Goa ends at the end of March/start of April so when we spent a few days on Anjuna Beach in mid April, we had the freedom of sun loungers and chairs from the many sea front bars/restaurants. I am not sure if it is because it was out of season, but we could use the beds free of charge and we did not feel pressured to buy food or drinks from the respective establishments (although we always did have something out of respect). The sunsets were fantastic here. One negative to the beach is the amount of 'sellers' who approach you;they were often quite relentless and occasionally the bar staff would come out and tell them to leave. I can imagine with the loud speakers on the beach and strobe lighting, this place would be extremely busy in high season. In my opinion, a couple of days here are well spent."
Anjuna_Beach-Bardez_North,Iqbal M,5.0 of 5 bubbles,Apr 2019 • Solo,Nice,Via is my lovely place my dream come true lovely such a nice place great to see the clean annual beach nice
Anjuna_Beach-Bardez_North,Ashish,4.0 of 5 bubbles,Apr 2019 • Friends,Amazing party beach with good crowd,"It was beach to be visited by us during our trip...It was a commercialised and party beach...Music and lightnings around beach were very happening...Lightning bangles ,googles hairbands could be bought for pics in the dark by local sellers around beach...It was not quite yet vibrant beach with so many fun loving people around...Bars and other eating hubs were available to do party ...Parking facility was also good"
