Tourist Attraction,Name,Rating,Date and criteria,Title,Review
Calangute_Beach-Calangute_North,Ahmet D,1.0 of 5 bubbles,Jan 2023,"Very dirty, poor and dangerous road. Beach crowed","Simply. do not go to Calangute. Walking about is dangerous with tarffic, potholes and no pavements. A disappointing visit."
Calangute_Beach-Calangute_North,sandeep patyal,4.0 of 5 bubbles,Dec 2022 • Friends,Welcome to Goa,This beach is very crowded in new year 31 december water activity avalible and food varity party dance music and sand sea sun can be enjoy easily
Calangute_Beach-Calangute_North,Wandering Slipper,3.0 of 5 bubbles,Jan 2023,Buzzing,"Everywhere you go in India is very crowded and Calangute beach is no exception.  Lots of people, not all there for the beach, but that said there’s plenty of water sports to enjoy and beach shacks offering food and drinks, not always good value for money. Not really for the less young "
Calangute_Beach-Calangute_North,Bharath6012,3.0 of 5 bubbles,Jan 2023,over crowded.,visited in the month on jan. no so great water. dirty water. good water activities. prime location..
Calangute_Beach-Calangute_North,Raza,3.0 of 5 bubbles,Jan 2023 • Family,Taken For A Ride,"I visited Calangute beach for the first time with my family on Jan 2, 2023. The beach is crowded. I saw a number of people standing on the edges of the beach waiting for their chance to get a water sports ride. On reaching Calangute beach, we were approached by a guy that we will get beach beds. We went with him, we didn't get it. We got beach chairs. Now here are some tips for you while visiting Calangute beach for the first time. 1. Look around, talk to 3-4 people before getting a beach chair. You won't get any beach bed. It's too crowded, all occupied. 2. Don't order any food on the beach except the most minimum priced non-alcoholic drink so that u can sit on a beach chair that some shack or restaurant has placed on the beach. Any food u order will b 5 times costly. If u r willing to pay that amount, u r free to do that. It's better u pack some snacks before coming to the beach to eat with ur ordered drinks. 3. Pls book your water sports rides before coming to this beach from established tour operators so that u pay acceptable amount n enjoy hassle-free rides. Otherwise there are many agents here who will take you for a ride - literally and figuratively. You will then end up paying 3-4 times the right price. 4. Enjoy the beach. Walk around. Watch people. Guess the number of states that people are coming from on this beach. 5. If you go for parasailing, check if other passengers with u stepping on the boat don't have alcohol or beer bottles in their hand. If u see that, make an excuse and get off that boat quickly. You don't want to see any drunken hassles n fights on the boat. "
Calangute_Beach-Calangute_North,drarunkumaraggarwal,5.0 of 5 bubbles,Dec 2022,good crowded beach,"good and crowded place to visit. you get what you want at beach shops, kaju, good crowd, and a long beach. but if you donot keep cleanliness how a place can be clean...."
Calangute_Beach-Calangute_North,Arun Chaudhary,3.0 of 5 bubbles,Nov 2022 • Friends,For watersports,Famous for watersports.Largest Goa beach.Best time to visit is Mid December and upto January.Full of tourists.Eating joints along the beach.
Calangute_Beach-Calangute_North,Shahab Jafri,5.0 of 5 bubbles,Oct 2022,Calangute Beach visit,Calangute Beach was overcrowded but seeing the sunset was an absolutely amazing experience. There are lots of shacks on the beach but these are slightly expensive. They are the ones who have provided good seating arrangements for you to enjoy the view.
Calangute_Beach-Calangute_North,Vandana,5.0 of 5 bubbles,Oct 2022 • Family,A good crowded beach with lots of water activities.,This beach is next to Baga beach. They both belong to the same panchayat. One can see the Baga beach board standing on this beach. This beach has fierce tides with undercurrents. So one must be  careful. There are ample of water activities one can enjoy here.
Calangute_Beach-Calangute_North,Amit B,4.0 of 5 bubbles,Oct 2022 • Family,It's a mixed bag,Visited with family. Beach is with good amount of sand for kids to play... Also with good amount of tides... Also lot of motor sports and boats are available. There is a good merket  selling beachwear etc is situated just at the entry of beach. The only negative point I see is that it is a bit too crowded. While clicking photograph we literally do not see in background any point without people. And this was the only beach in goa for which I was a bit sceptical keeping my scandals a bit away from me. Side note- Road leading to beach is a bit narrow seems can get stuck in jam sometimes !
Calangute_Beach-Calangute_North,Subrat Saurabh,5.0 of 5 bubbles,Oct 2022 • Family,Beautiful beach,One of the cleanest and beautiful beach of north Goa. I had been to this beach multiple times and always had a pleasant experience. Avoid street shopping on this beach as it’s over expensive. Life savers guard are very proactive and alert
Calangute_Beach-Calangute_North,Kumar K,5.0 of 5 bubbles,May 2022,full of Enjoyment,"Calangute Beach of Goa is on of the most crowded beach in india. Foreigners and indians love to visit their and enjoyed their. nearby the beach there are many hotels available to stay near the calangute beach. Whenever i go Goa for my work, i always visit calangute beach and enjoy the happines and peace of that beach."
Calangute_Beach-Calangute_North,Abdul,5.0 of 5 bubbles,Jul 2022,Crowded beach,"Crowded beach,  many restaurants nearby one of the most visited places in goa, family visitors mostly found.  Busy area even in late night's "
Calangute_Beach-Calangute_North,bsingh,3.0 of 5 bubbles,Mar 2022 • Couples,Popular Beach but Very Crowded,"Possibly this is one of the most ‘popular’ beaches of Goa and that is why it tends to get heavily crowded especially in the evening. It is full of shacks / restaurants which occupy a large part of the beach by putting up tents and tables. Water Sports facility is available at this beach. If you prefer a quiet and cleaner beach , you should go to some beaches of South Goa."
Calangute_Beach-Calangute_North,Vaishali M,5.0 of 5 bubbles,Jul 2022,best beach monsoon me,shaanti. Enjoyment. aaram se baitho and enjoy karo. but baarish me monsoon me risk mat lo paani me. wahan shacks operate karte hain. u can enjoy sea food. feni.. and ye beach sunder hai. 
Calangute_Beach-Calangute_North,giji365,3.0 of 5 bubbles,Jul 2022,Needs better maintenance,Was appalled to see the amount of plastic and dirt thrown in the beach. Hope to see better civic sense and nature love from the tourists.
Calangute_Beach-Calangute_North,Varun Gupta,5.0 of 5 bubbles,Jul 2022,Calangute Beach is very famous beach of North Goa.,"Calangute Beach is very famous beach of North Goa.Its very Beautiful beach. I went there in June 2022.Water sports were closed due to Monsoon but lots of people are on beach daily so you can enjoy sea water, sand, sea waves and weather."
Calangute_Beach-Calangute_North,Maneesh2700,3.0 of 5 bubbles,Jun 2022,"Calangute Beach, Goa -- Crowd defines this beach","We found so many people all around, that too from the entire country ... So, it's good for those who ove crowd, else this is not the beach you would be visiting Goa for. Market all around is really good though"
Calangute_Beach-Calangute_North,rakesh v,4.0 of 5 bubbles,Jun 2022 • Friends,Calangute Goa,Nice beach....crowded.....better vis in the night after 2200h....clean....bit expensive......too hot in summers.Good hotels nearby try Calangute Beach resort Goa tourism.  Restaurant of the resort was too good. Night at the beach was amazing.
Calangute_Beach-Calangute_North,Manish B,5.0 of 5 bubbles,Jun 2022,Sea Sun and Sand,A very nice beach with full of people. A must visit place in your travel guide while visiting goa. Are is filled with nice shops and food joints.
Calangute_Beach-Calangute_North,srgoyal,2.0 of 5 bubbles,May 2022,Only Name Nothing Special,"This is very famous beach for tourist but I will recommend visit the same for the sake of visit but do not try to stay nearby or give much time to this beach as this is highly crowded and dirty beach, There are several other beaches in North Goa which you will love to visit. "
Calangute_Beach-Calangute_North,jojo,4.0 of 5 bubbles,Apr 2022 • Family,Enjoy sun and sand,Visited noon time and enjoyed the sun and sea. Properly maintained having clear water and the tides were exciting. Eatery facilities were good. Can enjoy having good seating arrangement. Boating was good
Calangute_Beach-Calangute_North,Shubhanshu B,2.0 of 5 bubbles,Feb 2022,Avoid in peak season,"One of the popular beaches in north goa, this is also the most crowded. Busy lanes leading to the beach front with limited parking space (couldn’t locate 4 wheeler parking). During peak season, traffic jams come easy. Entry to beach was dirty, filled with intruders selling something (tattoos, clothes, etc) and a staring crowd. Unfortunately, we went in the sunny afternoon and the sand was red hot. Had to choose a shack adjacent to the entrance and it was expensive. Overall, this is one beach that could be avoided (in peak season) unless you enjoy crowd. May provide better experience in off season."
Calangute_Beach-Calangute_North,Vaidehi15,4.0 of 5 bubbles,Feb 2022,Place to be for sun downer & water sports,This place can be visited in evenings to enjoy the sun set moment & relax on shacks. Also one can enjoy all water sports at mid-range pricing. You have good options to chill at cafe & enjoy drinks with snacks.
Calangute_Beach-Calangute_North,Dr Dilip Pawar,5.0 of 5 bubbles,Jan 2022,Beautiful beach,Its worth to visit this beach along with family for memorable moments. The beaches are very clean. Its a perfect place in Goa
Calangute_Beach-Calangute_North,ShreyasMulgund,4.0 of 5 bubbles,Dec 2021,Happening but crowded and loud,"You should definitely visit this place if you're a party animal. We spent the evening at Calangute and were completely taken in by the glittering lights, smells and pleasant sea breeze. There are beach shacks and tables placed on the beach itself, where you can spend a nice time having dinner with your partner or family. Some beach shacks also have hookah, so it adds to the ethereal feeling."
Calangute_Beach-Calangute_North,Anand1351,2.0 of 5 bubbles,Nov 2021 • Couples,"Place to Avoid, too crowded like a Fish market","While nothing wrong with the beach, it’s clean and beautiful but we were horrified by the number of people there, more than a fish market. It’s a mass beach and thousands of people and it’s the boarding point of so called water sport activities so it add to the crowd. Best to avoid and instead go to Candolim beach which is nearby."
Calangute_Beach-Calangute_North,Gaurav G,4.0 of 5 bubbles,Nov 2021,fun,always fun to be there. always crowded. quite a few shacks. A lot of water sports options available at fixed prices
Calangute_Beach-Calangute_North,dennis4156,3.0 of 5 bubbles,Nov 2021,Very crowded,"The beach is very crowded and people like me who want to avoid crowds should not go there. Though there are a lot of activities on offer like boat rides, parasailing and jet skiing"
Calangute_Beach-Calangute_North,Sandy,4.0 of 5 bubbles,Nov 2021 • Family,Good beach but stray cows and dogs make it worse some times,It is one of the happening beaches in North Goa. You have Baga beach and Candolium beaches closer to this as well.The beach is generally crowded with all types of people. You can enjoy in the water which is quite clean. Water supports are also available in abundant for enjoyment.Only things are stray cattle and stray dogs which make the things worse.Otherwise you will enjoy here a lot.
Calangute_Beach-Calangute_North,Amit A,5.0 of 5 bubbles,Oct 2021,"Little uneven, but beach to be in","Full happening, with shops/eateries/restaurants/tattoo on the way. Good parkin place available. I found beach a bit uneven but once you found right spot your fun begins. It has shacks all the way to chill you down!"
Calangute_Beach-Calangute_North,Natalie1204,4.0 of 5 bubbles,Oct 2021 • Family,Look for the quieter parts - they’re lovely,"Parts of it were really crowded but we later discovered a quieter part and absolutely loved it. I would recommend going off season to avoid the crowds. Loved the Red Lobster shack in particular. Great service by Ali and his team. Fantastic massage by Kavita, who is forever smiling (you’ll find her near the shack - ask for her). The beach itself is lovely and the water is perfect."
Calangute_Beach-Calangute_North,srids,4.0 of 5 bubbles,Oct 2021,Well maintained,"Looks neat Lot of sports activities. Suggestions to people wanted to do water rides: If you have money don't bargain much with those who are providing the water rides. By looking at the way they work whole day and eating food bought in polythene covers under harsh sun with no roof on top just to earn few bucks, I was really felt bad for those who can earn money only during the season. Beach is very nice and famous. There is 2 wheeler car parking at the entrance to keep vehicle safe. Paid 20/- for almost whole day."
Calangute_Beach-Calangute_North,Dulichand S,5.0 of 5 bubbles,Aug 2021 • Friends,Best beach in goa,The best beach in goa.Very clean and crowned  you can enjoy the goa beach and it is very famous beach in goa.And the night life at this beach is very fantastic you can enjoy the clubs and the open sag beach where the djs are played.The sunset view from this beach is very satisfying. 
Calangute_Beach-Calangute_North,Yash Kataria,5.0 of 5 bubbles,Jan 2021,One of the best beach in Goa,"The Calangute beach is quite crowded. All water sports are must try. Night life is full of life. Best for party freaks.For bookings or query contact:;Kataria Holidays+91 9665518776, +91 7559468385 "
Calangute_Beach-Calangute_North,mai03051,1.0 of 5 bubbles,Nov 2020,Very crowded and mood spoiler,Wanted to do water sports at this place. This beach was so crowded. Different prices quoted by everyone for water sports activities. Did not find it safe to perform any of the water sports. With so much crowd decided we would not end up enjoying the activities. Decided against it.
Calangute_Beach-Calangute_North,Rajivglobaltraveller,5.0 of 5 bubbles,Apr 2021 • Solo,Must visit beach in North Goa,This is a busiest beach in north Goa.  I was there on 17th April 2021 for two days. You must visit this place if you are in Goa. It is easily accessible from airport.
Calangute_Beach-Calangute_North,burhan687,4.0 of 5 bubbles,Apr 2021 • Couples,Good one,Good for sports activitiesVery crowded and unhygienicBut this one is best place for tattoo lovers.. 
Calangute_Beach-Calangute_North,lotusdiamond,4.0 of 5 bubbles,Dec 2020,Amazing place to view sunset.,"One of the best beach to visit in Goa. Lot of fun and activities. Good shopping area selling souvenirs,  beach wears, sleepers and restaurants available just near to beach. Negotiate prices before buying.  Parking is available. Washrooms and changing room just at the entrance of the beach is available on payment. Very well developed and maintained area outside the beach. Wear comfortable clothing and footwear to enjoy at this place. Shades and hats is must. Good for photography lovers. Good restaurant offering all types of menu just near to beach. Beach is neat and clean and tourists also well behaved. You can also enjoy adventurous water activities. You can take beach bench on nominal payment with beach umbrella and relax. Beer is served freely. Lot of  shacks made of bamboos full of tourists enjoying drinks and sea food. Food is reasonable priced. Stay till sunset and enjoy the evening . After sunset all the shacks managers put comfortable seating next to beach with candles for tourists to enjoy the evening. Spend good quality time with your family and friends. Must visit place."
Calangute_Beach-Calangute_North,mom affze,4.0 of 5 bubbles,Mar 2021 • Friends,Good,"Enough good to explore entertainment and food. There paragliding,  jet ski, boat riding etcNow this time we Indians only no foreigners. Because of COVID "
Calangute_Beach-Calangute_North,Brevil Dsilva,4.0 of 5 bubbles,May 2020,Wonderful and feel like heaven,myself Brevil Dsilva and visited this place with my wife and kids . It is very beautiful place . This place the beach is very good and clean  .
Calangute_Beach-Calangute_North,Madhur( Prince),5.0 of 5 bubbles,Mar 2021 • Family,Family trip ,"Loved to stay at room no. 4003 Le meridian goa, services and everyone behaviour was lovely, special thanks to LIONEL  from reception area supported us so much.Hotel was full of greenry, properly neat and clean sanitized , pool was very cleaned n special arrangment of room dine-in services, food quality was superb.Had great stay."
Calangute_Beach-Calangute_North,Balledisco,2.0 of 5 bubbles,Mar 2021 • Family,"Beer bottles, Stray dogs and narrow stretch of sand","After seeing the cleanliness of the South Goa beaches, it is a bummer to see North Goa beaches. Saying that, water sports and local shopping is half the price of South.Fortunately, the beach wasn’t over crowded when we visited"
Calangute_Beach-Calangute_North,Rashmi,1.0 of 5 bubbles,Mar 2021,Terrible - at least at dinner time,We visited the beach at dinner time (9 pm) and it looked like a pub with neon lit cabanas and blaring music. The pathetic thing was that there were three different venues close by playing different loud music. So it really hurt our ears. We didn't stay even for 2 minutes and left the beach. Avoid it at night.
Calangute_Beach-Calangute_North,Akshay,2.0 of 5 bubbles,Mar 2021 • Friends,Over crowded and dirty beach,"This beach is really dirty. You will see cigrattes, empty bottles, wrappers near the beach. This place is so much crowded."
Calangute_Beach-Calangute_North,Rishika K,1.0 of 5 bubbles,Mar 2021 • Friends,Pathetic experinece,Not at all worth the visit. Totally skip this beach. Had a very bad Experience here. Too crowded and commercialized
Calangute_Beach-Calangute_North,Gaddam C,4.0 of 5 bubbles,Feb 2021 • Family,Awesome ,The Most Beautiful Waves are at calangute Beach... one must visit this beach for authentic Goa experience... sunset was awesome.... Big waves will hit u so hard.... safety First.... 
Calangute_Beach-Calangute_North,Shashank Kaul,4.0 of 5 bubbles,Feb 2021 • Couples,Clean beach ,"More suitable and less crowded comparative to Baga beach which are much hyped for no reason , must visit "
Calangute_Beach-Calangute_North,me_shilp,2.0 of 5 bubbles,Feb 2021 • Friends,"Terrible beach, hated it","Too over crowded with hardly any place to sit and relax without paying. Crowd is really bad too with guys staring at you constantly, which happens only on this beach in the whole of Goa.Hardly stayed here for 5 mins and hated it totally and completely."
Calangute_Beach-Calangute_North,Vipul Agrawal,5.0 of 5 bubbles,Feb 2021 • Family,Happening,Clean beach. Very good for kids and family. Shacks are there for those who want to drink and party. Also vendors are everywhere serving eatables and toys.
Calangute_Beach-Calangute_North,Gavaksh B.,1.0 of 5 bubbles,Feb 2021 • Family,Avoid avoid avoid,This place is really best to avoid. You just can't enter because it's so crowded beaches. Entire stretch has people having no regards for safety and cleanliness.
Calangute_Beach-Calangute_North,ujwal kakkad,4.0 of 5 bubbles,Jan 2021,popular beach of north goa,this is the most crowded beach which has highest tourist footfall. it also has specially designed cabannas for the tourists who are tired
Calangute_Beach-Calangute_North,SamratBanerjee,3.0 of 5 bubbles,Jan 2021 • Family,Too crowded,"This beach is not ideal for a sea bath and all. For shopping, yes, but if you want to have some good time at a sea beach, visit Baga"
Calangute_Beach-Calangute_North,Inderpreet,5.0 of 5 bubbles,Jan 2021 • Couples,Awesome place with Full of fun,"Beautiful place with lot of crowd , water sports and nite life , food , dance ,fun and lively place . Can spend all nite eating dancing and having fun . Multiple hotels with walking distance from calangute beach"
Calangute_Beach-Calangute_North,Rudra Tank,4.0 of 5 bubbles,Dec 2020 • Family,The fan of Beaches of Goa,Water sports are great to enjoy. Spending quality  time with family at a shack is the best thing I enjoyed on the beach.
Calangute_Beach-Calangute_North,JE Dolphy,5.0 of 5 bubbles,Jan 2021,Another Good Beach,"very good beach , with so many shacks and music and fun , good for those who klove dance and swater sporting activities"
Calangute_Beach-Calangute_North,pansariamit,2.0 of 5 bubbles,Jan 2021 • Couples,Very dirty,Pathetic beach .strongly avoid if u r looking for cleanliness.  The quality of beach is sad and also the shacks
Calangute_Beach-Calangute_North,Camper819338,5.0 of 5 bubbles,Dec 2020 • Couples,Beach shacks are lit,"Earlier when I visited goa, Calangute beach was plain and normal, left unidentified. This time I was so pleased with the colourful shacks, music everywhere, watersports in the beach. Looks colourful and awesome during night time."
Calangute_Beach-Calangute_North,Sachin Zanje,5.0 of 5 bubbles,Dec 2020 • Couples,Calungute beach ,One of the best beaches of north goa.Very clean beach with beautiful golden sand.Stretch of the beach between calungute and candolim is good for couples and family because you will find descent crowd here and nice shacks .
Calangute_Beach-Calangute_North,PusHkar Raj,5.0 of 5 bubbles,Oct 2020 • Solo,Calangute Beach. ,Calangute Beach is another popular and crowded beach with numerous shacks that offers various food items and drinks alcoholic and none alcoholic. It was breathtaking experience and best part is it’s clean.
Calangute_Beach-Calangute_North,Shiv S Dutta,3.0 of 5 bubbles,Oct 2019,Lively,We visited this beach particularly to have our lunch at Souza Lobo. The beach is very crowded and the water is not very clean. I did not dare to take a bath on this beach. Lots of activities happen on the beach.
Calangute_Beach-Calangute_North,HarryHSR,4.0 of 5 bubbles,Jan 2020,Good Beach,"after spending some time at Baga beach, we went walking towards Calangute beach which was clean and seemed bit better , though this beach was also crowded Lot of options here too for water sports etc and both domestic n international tourists were enjoying at the Beach, lot of shacks available where one can rest n enjoy the local cuisine ...We spent some time here before heading to have some fresh coconut water followed by a nice lunch at Calangute"
Calangute_Beach-Calangute_North,Sandy_JSR,5.0 of 5 bubbles,Feb 2020,Lively,"Calangute is another popular and crowded beach with numerous shacks that offers various cuisines and drinks, the prices are by and large same at the shack.  The beach is big with water sports options such as boating, water skiing & parasailing etc. Be it day or night, the beach is always crowded and lively, good place for enjoyment and hangout."
Calangute_Beach-Calangute_North,ashishdeora123,5.0 of 5 bubbles,Mar 2020,great,queen of all beach many national and inter nation tourist visit this beach  its also in top 10 bathing beach in all over the world
Calangute_Beach-Calangute_North,The Allens,5.0 of 5 bubbles,Apr 2020,Cleanest beach,the cleanest beach in goa! the shacks are worth a try! - great food and great atmosphere with fantastic music!
Calangute_Beach-Calangute_North,ZnicZ,5.0 of 5 bubbles,Feb 2020,The changes that have made this a beach of beaches,"I have truly enjoyed my visiting the beaches such as Calangute, over seven years.Celebrating 2020s New year was my return to this location, where its beauty, was/had been enhanced with now a cleaning service to the whole Calangute beach area. In the early mornings there were staff walking/cleaning the beach with transport picking up waste from these people also vendors selling food from the shacks  along the length of the beach. This was a great improvement for the Calangute beach.  Well Done the Goan,s"
Calangute_Beach-Calangute_North,shivani m,5.0 of 5 bubbles,Sep 2019,best beach of goa,we went to goa in off season of september. the weather was very pleasent and comparatively less public than december.we enjoyed big waves with family.
Calangute_Beach-Calangute_North,Alfred S,5.0 of 5 bubbles,Mar 2020 • Couples,Goa 2020,"This is our second visit to this wonderful part of the world. Calangute beach is lovely place to be,beautiful sandy beach plenty of Shacks to get a sunbed on locally cooked food smashing people. We are here during the Virus problem but still life is going on. We will return."
Calangute_Beach-Calangute_North,MukeshDave,5.0 of 5 bubbles,Feb 2020,Clean beach,The beach is quite clean as compared to my earlier visit 4 years back. Good place to have a bath in the sea. 
Calangute_Beach-Calangute_North,Richard K,4.0 of 5 bubbles,Jan 2020,Great beach - can get a bit crowded,This is the beach that is very popular with tourists and local Indians alike - clean beach with food & drink shacks all the way along.Most of the shack prices are the same - so it is down to how good the loungers / shades / comfort and service is.
Calangute_Beach-Calangute_North,Gagan,4.0 of 5 bubbles,Mar 2020 • Friends,Amazing beach,"One of the most popular beach in  north Goa, approach is good, there are plenty of shakes/Local restaurants and sunbeds to enjoy, plenty of water sports options."
Calangute_Beach-Calangute_North,shaggy2015,5.0 of 5 bubbles,Mar 2020 • Friends,Goa with friends,It was superb holiday with friends after long timeCalangute and Baga beach is main beachin Goa were most of the tourist stay
