Tourist Attraction,Name,Rating,Date and criteria,Title,Review
Calangute_Beach-Calangute_North,Ram S,5.0 of 5 bubbles,Mar 2020,good beach,The hotel is walking distance to Calangute beach. Calangute beach is an attractive beach in Goa with the facility of Sports activity. Souza Lobo restaurant on beachside serves good prawns and fisghes.
Calangute_Beach-Calangute_North,NAIRSUDHIR,4.0 of 5 bubbles,Feb 2020,Cleaner than expected,Loved the sand and the cleanliness of the beach. There are relaxing benches on the beach where one could chill but these benches are encroaching on beach. Lots of eating and drinking places on the beach!
Calangute_Beach-Calangute_North,NITHIN KUMAR CHINTHAKINDI,5.0 of 5 bubbles,Apr 2019,crazy beach,"Big, popular beach with water sports, such as boating, water skiing & parasailing, plus food stalls.We had a fantastic first time in India staying on Calangute beach.When visiting Calangute town you must also visit this part of the beach, it’s a great experience you won’t forget."
Calangute_Beach-Calangute_North,Rajeh,4.0 of 5 bubbles,Mar 2020 • Friends,Rajeh,"Location is very good, not close to beach, staff is very kind, the front desk manager Mr Sir Adhithyen Gurumoorthy was helpful and looking after all customers and his staff all the time , active person and decent, he should be the manager of all Ibis hotels in India not a front desk manager, he deserves more than my comment to be honest, thank a lot A dhithyen , hope to come again to the hotel."
Calangute_Beach-Calangute_North,Aniruddha Srivastava,3.0 of 5 bubbles,Sep 2019,Crowded but better than Baga,Crowded all the time as it is adjacent to famous Baga beach. But still better here than Baga. Very near to shacks and also some good food joints in Calangute market.
Calangute_Beach-Calangute_North,G E,5.0 of 5 bubbles,Jan 2020,"Wonderful beach, white sand, great waves in the sea!","We had a fantastic first time in India staying on Calangute beach.  Great beach huts, wonderful food, lovely white sand, sunbeds and parasoles, and fab waves in the warm sea, which was like walking into a warm bath!"
Calangute_Beach-Calangute_North,DJKJO,5.0 of 5 bubbles,Feb 2020 • Couples,Goa India Calangute Beach.,"When visiting Calangute town you must also visit this part of the beach, it’s a great experience you won’t forget. On our few trips here we tended to head for the Royal Shack... As you arrive at the main Calangute strip/rd, there are steps leading down to the beach... walk down the said steps and turn left, the forth beach shack along is the Royal shack with the flag of India flying above it... you can’t miss it!! The shack is run by a chap called Makan, a lovely friendly attentive fella that always made us feel so welcome👍🏼 He was constantly moving our umbrella throughout the day so we were always in the shade. Makan’s service of food and drink was excellent, 10 out of 10👍🏼😎👍🏼 bear in mind this is the busiest part of Calangute beach, possible busiest in North Goa so be prepared for an experience😂... for more relaxed options there are numerous other beaches in Goa, or just keep walking for around 500m or so on this beach and it’s a far quieter/chilled beach. But for something completely different it’s a must experience and everyone is super friendly! "
Calangute_Beach-Calangute_North,Huxley,3.0 of 5 bubbles,Feb 2020,Over Populated Beach,"The Beach is over crowded and too commercialized.Not a beach for relaxation or chilling out.There are numerous shacks, numerous sun bathers and an open-air massage beach.Walked for 45 mins and then found the nearest exit to Souza Lobo"
Calangute_Beach-Calangute_North,Shubham Jadhav,4.0 of 5 bubbles,Feb 2020 • Family,Not good,The place always seems crowdy and lot of noise present over there of DJs. The place is good only if you want to drink and hangout
Calangute_Beach-Calangute_North,kat23uk,3.0 of 5 bubbles,Feb 2020 • Couples,A very busy beach,"The sand it lovely, the shacks were good but this beach is like the blackpool of india. Lots of indian tourists come here and the beach is packed!! One of the busiest i saw"
Calangute_Beach-Calangute_North,ghoomboom,4.0 of 5 bubbles,Feb 2020,The happening beach in Goa,"Nicely developed beach in North Goa and one of the most popular ones. Lots of crowd and water sport activities. Long beach and in fact is in continuity to another popular beach of Goa i.e. Baga beach. Reclining beach beds are in plenty but if you want to use one, you are expected to buy some drinks or food. The beach is children friendly and can be visited with families."
Calangute_Beach-Calangute_North,Sista Jean,1.0 of 5 bubbles,Feb 2020 • Friends,HIDEOUS,"Overpriced sea front cafés and far too crowded, will never return to Calangute beach ever! Unlike the actual town, which was full of character and interesting shops that didn’t overcharge!"
Calangute_Beach-Calangute_North,Krishanku,5.0 of 5 bubbles,Feb 2020 • Couples,Crowded but the best beach,Lively and best beach of Goa but pretty crowded. You can enjoy the sunset and for a stroll along the beach.
Calangute_Beach-Calangute_North,chikpick,5.0 of 5 bubbles,Feb 2020,A very happening beach,"Visiting this a must if u r in Goa, crowded at all times and also very much commercialised but even then it has great goan vibe. "
Calangute_Beach-Calangute_North,Samir S,4.0 of 5 bubbles,Feb 2020,Calangute Beach - nice beach but bit crowded,"This is one of the crowded beach and lots of happening ... thousands of sunbeds kept in queue . No charge . But you need to order some food.  Sunbath , swim , salt and bear ... one can enjoy a lot here . Water sports available . Near the beach , roads are crowded , lots of traffic .  If you come early morning then it is really refreshing.  Nice place to enjoy in group"
Calangute_Beach-Calangute_North,ShivaSunny,5.0 of 5 bubbles,Jan 2020,Most happening beach in Goa,"planing to visit goa then this beach has to be the first priority for you. The most happening beaches, you can stay till midnight 3 and 4 am."
Calangute_Beach-Calangute_North,Paul,5.0 of 5 bubbles,Feb 2020 • Couples,Great beech,"A bit crowded on occasions but otherwise fantastic, Good place to try for good food and drink was Friends Corner, we visited most days"
Calangute_Beach-Calangute_North,LaDinero,5.0 of 5 bubbles,Dec 2019 • Family,Enjoyed Sun,"Nice beach although bit crowded, good to enjoy early morning at beach, crowd increases as the day progresses, evening are generally crowded & people enjoyed water sports activity."
Calangute_Beach-Calangute_North,The Great,4.0 of 5 bubbles,Jan 2020 • Couples,Average ,It also near to baga beach so its has also crowded beaches but some less than the baga so its average beach tattoo parlour are more at this Beach 
Calangute_Beach-Calangute_North,barbara h,4.0 of 5 bubbles,Mar 2019 • Couples,Clean  beach,"Was windy the day we went .Yet still buzy .lots of sellers an shacks full. Good vibes, went another day was packed full of people  dogs cows "
Calangute_Beach-Calangute_North,jadd1010,4.0 of 5 bubbles,Feb 2020,Beach is Good - Getting There Not So Good,Long sandy beach with lots of bars and cafes renting out sun loungers. Very clean beach but you have to walk through a lot of stench and rubbish strewn paths to get the the beach. Goa tourist authorities need to address the dumping of trash near the beaches.
Calangute_Beach-Calangute_North,Rahul K,4.0 of 5 bubbles,Jan 2020 • Friends,Best place,It is one of the best beach in goa to hang out with friends the finnest beach is bagha beach I was staying at the bagha beach only
Calangute_Beach-Calangute_North,nisargraj,4.0 of 5 bubbles,Feb 2020 • Couples,One of the most popular beaches of Goa,"The silent beach - as the local people call it. One of the most famous beaches of Goa, which is slightly less crowded than Baga and Candolim. You will love the blue water and white sand of the beach but if you are planning to take a bath in the sea, it will hit you hard!! At least the day when I visited it, the  waves were very big and it was not easy to take a bath. There are many shacks on the beach, which offer food and drinks at (obviously) higher prices. If you just want to sit on those beds available on the beach and relax, you will be charged INR 100 per hour per bed, which is double than the price of the beds on Baga beach. Watersports are available here. The beach becomes a bit silent at night, so if you just want to hang out with friends, this is the perfect place."
Calangute_Beach-Calangute_North,atin a,5.0 of 5 bubbles,Feb 2020 • Family,Tour to goa,"Beautiful neat and clean tidy beach with all facilities such as washroom, parking, restaurant, markets etc."
Calangute_Beach-Calangute_North,Neal P,2.0 of 5 bubbles,Feb 2020 • Family,Not the best beach,Very packed beach. Any sort of privacy is limited and there is very loud music depending on where you sit. I would recommend Candolim. We had a better experience. 
Calangute_Beach-Calangute_North,Mayank G,4.0 of 5 bubbles,Feb 2020,One of the happening beach in Goa,This is one of the happening beach in Goa and central attraction of GOA. This is one of the crowdy beach same time its full of water sports etc. activities. Water quality of this beach is really good.
Calangute_Beach-Calangute_North,neeebeee,5.0 of 5 bubbles,Feb 2020 • Couples,Enjoy Water sports,"Calangute is the most commercial beach of North Goa. Water sports with traditional and latest rides. Shacks on the beach, Beer, Hukkah and what not..Good for Couples and Family both.Shopping on the way of the beach is also a great attraction. You can find variety of dresses and almost all type of product related to beach and specially Goan products.."
Calangute_Beach-Calangute_North,Ann M,4.0 of 5 bubbles,Feb 2020 • Couples,Mrs mussell ,Nice beach lot's of good shacks we mostly stayed at aggies shack very good in there staff lovely food good they will do anything for you 
