Tourist Attraction,Name,Rating,Date and criteria,Title,Review
Fontainhas-Panjim_North,shayneracheldanielj,5.0 of 5 bubbles,Sep 2019 • Solo,Not a beach bum...,"... then stay here! Skip the party crowd, this is the place for you. European ambiance in the orient! Great bars restaurants and heritage hotels."
Fontainhas-Panjim_North,Fiona Fouquet,5.0 of 5 bubbles,Mar 2019,Indulge in the Portuguese history of India,"A wonderful place to experience by foot, and indulge in the history of Goa.  Walk through all the little streets, walk up the coloured steps to the top of the hill and discover the Sunaparanta arts centre, then walk back down for a drink at Joseph's Bar.  Put your feet into the pool at the Mateus Hotel, shower up and have dinner at Vinetes or the Black Sheep.  A great day to be had before your next destination.  Try to go to ask many of the little museums and big churches to get a sense of the history.The place is full of little restaurants and holes in the wall.  If you have time (and are interested) take a tuk tuk to FabIndia to buy some incredibly nice tops, tablecloths, and bedspreads."
Fontainhas-Panjim_North,Rishabh A,4.0 of 5 bubbles,Aug 2019 • Couples,Close to Elegance,Beautiful houses with old European touch is super. A must visit to explore the architecture and the beauty of this place !!
Fontainhas-Panjim_North,Sharmista De,5.0 of 5 bubbles,Aug 2019 • Friends,A slice of history,"This is a nostalgic walk for few, for some every corner is photograph worthy, brilliant colours, ample food joints. One can go for a good walk within it. Loved the place. Easily accessible."
Fontainhas-Panjim_North,LostMySelfTraveling,5.0 of 5 bubbles,Sep 2018 • Solo,Fontainhas - Portuguese colony Dont miss to visit,"It was a colony where Portuguese rulers lived when they were ruling us. They maintained the houses and villas with beautiful architecture and they even had a rule that everybody should paint their houses every year.  The balconies are well maintained. The houses are colourful. Roads are so clean. It feels like you are somewhere in a foreign country while walking in these streets. Most of these houses now became restaurants,  museums and training centers. Its a must visit place in Goa. Don't mis to visit. "
Fontainhas-Panjim_North,s0madhar,5.0 of 5 bubbles,Jul 2019 • Family,Lovely,The heritage walk through the streets of Panjim led us to Fontainhas. Loved the quaint houses and their colour schemes
Fontainhas-Panjim_North,Sheelaa,3.0 of 5 bubbles,Jul 2019 • Family,Exploring the unknown ...,"Ours was a family trip to see this place called 'Fountainhas'. Its a Portuguese colony of Goa, where Portuguese rulers lived. This town is famous for  colourful villas and heritage houses with artistic balconies and doors. Many such villas are now converted into restaurants and homestay. You can have authentic European cuisine. Its a only part in Goa where portuguese is still a main spoken language. A walk in this town is known as 'heritage walk'. Many places to explore of that portuguese era!"
Fontainhas-Panjim_North,Krishti Bhattacharjee,4.0 of 5 bubbles,Jul 2019 • Family,An underappreciated gem!,"Visited with my parents. Had it not started drizzling, I would have definitely liked to spend more  time here. This place is called the Latin Quarters of Goa and it is a quaint neighborhood with colourful houses in narrow lanes. Came across rainbow stairs here too! It's a lovely place to hang out and definitely a great place for pictures. Trust me you'll get really aesthetic instagrammable pictures here! "
Fontainhas-Panjim_North,Rahul Kumar,5.0 of 5 bubbles,Apr 2019 • Solo,Street with many colourful Latin Quarters!!,"Fontainhas is actually a 18th century abandoned Chappell with many colourful Portuguese villas and houses including couple of theme restaurants. Roaming around the street will actually give you the taste of Latin quarters. Located in outer part of Panjim so unlike other busy street of Panjim, this place is less crowded. Residents are also prefer silence so do not expect any noisy bars and clubs there."
Fontainhas-Panjim_North,deepa Nagaraj,4.0 of 5 bubbles,May 2019 • Family,Evening walk...,Suited for late evening walks ...has series of Portuguese style houses with narrow roads...next to immaculate church n Panjim shopping market nearby
Fontainhas-Panjim_North,Sanjay Kumar,5.0 of 5 bubbles,May 2019 • Family,See Portuguese,The Portuguese architecture are a treat you watch.  Still the flair of olden architecture exists.  Great place to take photos
Fontainhas-Panjim_North,Padmini15,5.0 of 5 bubbles,Jan 2019 • Family,A Street So Colourful!!,Fontainhas is located in Panjim and is a beautiful street with colourful houses is typical Portuguese style.Wonderful place to click great pictures.
Fontainhas-Panjim_North,Preeti Baijal,5.0 of 5 bubbles,Apr 2019 • Couples,Heritage Goa,We went for a Heritage Walk with Dr Luis Dias. He has grown up in this area and is a great guide. It was a truly wonderful experience seeing Fontsinhas with an experience guide.
Fontainhas-Panjim_North,Krishhere,4.0 of 5 bubbles,Apr 2019 • Couples,Portuguese architecture,Nice surroundings to walk around and has Portuguese style houses. Some of them are really nice. Some have been remodelled 
Fontainhas-Panjim_North,Travellover6128,3.0 of 5 bubbles,Apr 2019 • Friends,Not sure what all the fuss was about,"We visited here whilst walking around the older part of the city.  To be honest none of us could see what the fuss was about !  It's not the original building, just a replica."
Fontainhas-Panjim_North,Arun Mani Kanta Gunda,5.0 of 5 bubbles,Mar 2019 • Solo,Gallery,Within Panjim cityBut very inside of cityAwesome art galleryContains a lot of paintingsBeautiful arts and art work
Fontainhas-Panjim_North,Jack I,3.0 of 5 bubbles,Mar 2019 • Family,Over-hyped.,Lower your expectations before visiting. A poor representation of the original with restaurants that require deep pockets.
Fontainhas-Panjim_North,Roy V,5.0 of 5 bubbles,Feb 2019 • Couples,Outstanding architecture,A guided tour is recommended to get a sense of the historical background of the area. Will take about 1 hour by foot
Fontainhas-Panjim_North,zsszn,5.0 of 5 bubbles,Feb 2019 • Family,Back to europe,"This place is really nice to see, it's like back in Europe. The colorful houses are funny, the streets clean, the people helpful. A good photo spot. "
Fontainhas-Panjim_North,Arvind_Yayavar,4.0 of 5 bubbles,Feb 2019 • Friends,Glimpse of Goan History,"Fontainhas is an old Portuguese colony in Goa. A walk into this lane will give you a glimpse of Goa's Portuguese connection. When visiting this place, keep the shutter of your cameras ON."
Fontainhas-Panjim_North,Krittika M,5.0 of 5 bubbles,Feb 2019 • Friends,Your next color palette!,"Where do I even start? Fontainhas is beautiful. Where else will you find a street that has a blue, red and yellow house next to each other and all of them match each other? I would recommend everyone to put on their walking shoes and hit the area in the evening and just walk around soaking in the sights. Most of the houses were built in the later 1800's and 1900's and have beautiful pastel colors. Every fourth house has a vespa parked outside. Just be careful, the locals do not have any patience for tourists standing on the streets clicking pictures. While you're there, you can hit Mamarama for some good authentic Ramen followed by Tito's for a good drink. Also remember that most stores in Panjim close around 7 so if you wanted to get some shopping done, you should do it before you hit the Latin Quarters."
Fontainhas-Panjim_North,Glenn P,5.0 of 5 bubbles,Feb 2019 • Family,Portuguese influence architecture,Fontainhas is a very colourful and the oldest Latin quarter. It is a residential area.Tourist cars visiting need to park on the main road to access this place.The buildings are beautiful and the coloured steps and a variety of buildings with different architectural landscapes is what makes this place unique. You can spend a few hours walking through these quaint localities.
Fontainhas-Panjim_North,Vishrut S,5.0 of 5 bubbles,Nov 2018,Latin quarters of Goa,"If you want to experience how people lived during Portuguese rule, you must visit Fontainhas. With its beautiful Portuguese era bungalows all around you'll be mesmerized and won't believe you're still in Goa. A must visit place if you're interested in history and/or architecture.  "
Fontainhas-Panjim_North,NafeeTA,5.0 of 5 bubbles,Jan 2019 • Friends,A must visit area when in Panjim,The area is rich in old Goan heritage and is picturesque in every sight. There are good restaurants there as well such as Viva Panjim. Some shops too. A definite recommend when in Panjim.
Fontainhas-Panjim_North,Aishwarya,5.0 of 5 bubbles,Dec 2018,Picture perfect frames,"If your looking for picture perfect frames or may be just wanting to chill out, the streets around Panjim Goa​ are just perfect for both.Rating: 4.8/5"
Fontainhas-Panjim_North,CATIWARIG,5.0 of 5 bubbles,Nov 2018 • Family,Lovely to travel through fontainhas!!,"If you are in Panaji, don't miss to travel through this beautiful, colorful, vibrant old colony. This is an old colony built with Portuguese architecture. It will take around 5 minutes to travel through the entire colony filled with colors and vibrancy. Each building has a different color. Blue, pink, green, purple, orange and all off beat colors. There are some shops, restaurants, designer cloth stores etc. Worth a visit."
Fontainhas-Panjim_North,max falk,4.0 of 5 bubbles,Dec 2018 • Friends,Lovely to walk around,The traditional old Portuguese architecture and bright colours are a delight. Only a few minutes walk to the promenade. 
Fontainhas-Panjim_North,Nesligül D,5.0 of 5 bubbles,Nov 2018 • Friends,What a beautiful surprise to find Latin America in Goa ,"We visited the Latin Quarter of Goa with a feeling of surprise and joy. It was so interesting to find a piece of Brazil or even Cuba in this part of the world. They say that the Portuguese mingled very well with the people in India whereas the British kept their distance. As a result, 26% of Goa’s population are still Christians and speak Portuguese. You can still see many signs in Portuguese. The houses are multicolored and the streets are beautiful. Once the hippies’ paradise, this place isn’t as cheap nowadays. Look for the soldier and rooster signs to see which families supported the Portuguese and which preferred independence. Don’t miss the rich fruit and spice market which unfortunately isn’t listed in the list of things to do in Goa. "
Fontainhas-Panjim_North,misiddiqui2017,4.0 of 5 bubbles,Nov 2018,Little Portugal in India,Fontainhas reminds us about the colonial era. It has the Portuguese legacy. Old houses in the neighborhood are attractive and different from Indian style. Small Portuguese population maintains its identity and culture. It's worth visiting if in Goa for a few days!
Fontainhas-Panjim_North,Daisychain50,5.0 of 5 bubbles,Dec 2018 • Couples,Celebrity cruise tour,Great tour and excellent guide Mario. Latin area is lovely and interesting to see the culture. Rue De Natal with its Christmas decorations.
Fontainhas-Panjim_North,Kalindi D,5.0 of 5 bubbles,Oct 2018 • Couples,Charming little Portugal !,"This is a lovely little area with lots of Portuguese small houses. If other countries have little India then I would call this place the Little Portugal in Panjim. Lots of lovely boutique shops, nice eating joints and colourful sites. There is small museum/art gallery in one corner and a few lovely white washed churches and small colourful streets!One of the reviews mentions that the person had booked to stay here for two days and found it very disappointing! Well, it is worth a short visit for an hour if you happen to be in Panjim and it has some nice eating joints which you can visit for a meal!"
Fontainhas-Panjim_North,Gilmo S,5.0 of 5 bubbles,Dec 2018 • Solo,Nice to hangout ,"Just look around. See the small roads and Portuguese influence. Very calm and relaxing place just to hang out. To see it rTake half an hour, to enjoy it and to relax take an hour "
Fontainhas-Panjim_North,MarkAnnaLondon,4.0 of 5 bubbles,Dec 2018 • Family,Spend an hour...,"If you're in the area of Panjim, then the Portuguese Quarter is definitely worth a visit. The colonial influence is all around you, from the colours and architecture of the buildings to the tiled name plaques on the house.The area isn't massive, so an hour is all you really need to take it in.There are a number of small coffee shops, restaurants and guest houses in the area."
Fontainhas-Panjim_North,Pedro Manuel P,5.0 of 5 bubbles,Jul 2018 • Friends,Indo-Portuguese charming quarters. The most beautiful are of the city,"Along small roads and footsteps climbing up the Altinho hill, Fontainhas is the oldest neighborhood of the city of Panjim. Fortunately in the recent decades it was understood that the old Indo-Portuguese architecture should be preserved and when you stroll around you still see the Goan architectural charm. It has became a lively place, with restaurants and bars and it has to be part of your visit to the city."
Fontainhas-Panjim_North,Annsley F,5.0 of 5 bubbles,Jan 2018,The Legacy of Portuguese Heritage,Fontainhas (Also Known as the Latin Quarter) of the Panjim City is Second Place in Goa after Old Goa to give the feeling of the Portuguese feeling. This is Richest place in terms of Goan Heritage and simple ways of living.You may Just Park your vehicle in the vicinity and walk around the enjoy the feel and see the place.
Fontainhas-Panjim_North,GowriNK,4.0 of 5 bubbles,Nov 2018 • Couples,Panjim is hillier than you think!,"A walk through Fontainhas is full of colourful sights - homes painted bright yellows and terracotta and indigo with white trimmings. The roads are tree-lined and there is a chapel or two. We walked up steep steps all the way to the Panjim High Court, another beautiful yellow coloured building with flowering bushes on the grounds, and walked downhill back to the town square near the church. This part of Panjim is surprisingly hilly and reminded us of walks in little Himalayan towns!"
Fontainhas-Panjim_North,WAVESTOURISMGOA,4.0 of 5 bubbles,Nov 2018,Awesome glimpse of Old Portuguese architechure,Fantastic place to walk through the local. We can see Old Portuguese architecture and Houses with colourful painting. Very unique compared to any Indian ancestral locale.. Must walk through with Camera to capture the unique marvel..
Fontainhas-Panjim_North,Katharina N,1.0 of 5 bubbles,Nov 2018 • Solo,I expected so much more...,I was so sad when I saw this quarter... I wanted to 2 days there to see everything but I am really disappointed. There is nothing around. I wished that I stayed in another place longer...
Fontainhas-Panjim_North,Dr I R Patil,3.0 of 5 bubbles,Oct 2018 • Friends,It's a typical Portuguese colony,"After seeing pic of building intially thought it's museum but Fontainhas is name of area, many Portuguese buildings next to each other so it looks typical Portuguese colony. The building pic which is shown in DP is Geetanjali art gallery in that colony"
Fontainhas-Panjim_North,Digamber H,5.0 of 5 bubbles,Oct 2018 • Family,Heritage,Street walk along Fontainhas recalls old Portuguese memories.All houses along the street has Portuguese influence and architecture. 
Fontainhas-Panjim_North,Gujju Traveler Aditya,4.0 of 5 bubbles,Jan 2018 • Family,Amazing colony with colorful structures,"Amazing colony with colorful structures. Just near to Panji church, at walkable distance.  Must visit to see Portuguese style of colonial structures and colorful buildings all the way. "
Fontainhas-Panjim_North,SUDHANSHU-K,4.0 of 5 bubbles,Sep 2018 • Couples,Must see If you are in Panjim,"I have noticed that tourists visiting Panjim have one target in their mind , i.e. visiting a casino. Do that but , spare one hour to soak your self in the old glory of Panjim by visiting Fontainhas . This old settlement is trying to preserve the buildings / houses of Portuguese time. The bright colors of the houses and the architecture makes them distinctly different from other houses in Panjim. The place needs attention from the government in terms of providing infrastructure, cleanliness, and making this a better tourist spot. I visited this place in the evening hours and liked the silhouettes of the buildings ."
Fontainhas-Panjim_North,Padmini D,4.0 of 5 bubbles,Oct 2017 • Solo,Walk ,If u have a lot of time on hand and wish to take it slow a walk in the Latin quaters would be a great option. Good walking shoes and light airy cotton clothes are a must. Do carry an umbrella in the rains. And enjoy the sights and sounds of the Latin quaters
Fontainhas-Panjim_North,Blasio F,4.0 of 5 bubbles,Sep 2018 • Solo,Heritage,One of the last heritage residences in the Capital Panjim . Has a relaxed charm around it. Nice houses painted in soothing colours and small garden spaces with a small Chapel 
Fontainhas-Panjim_North,Vineeth_r_c,5.0 of 5 bubbles,Sep 2018,Small yet a different world !,"Even though this place is a small area within Panjim , the moment you step into this quarter , the Portuguese old world feel pulls into into a different age ... it’s quite close to central Panjim and hence is an easy walk too ... Pl do make sure you walk around this place and avoid using your two wheelers / four wheelers here to retain the charm of this place .."
Fontainhas-Panjim_North,Sanhita,4.0 of 5 bubbles,Sep 2018 • Couples,Great for a Heritage Walk,This area has some great heritage buildings and is very picturesque. It's a good place to walk around and explore.
