Tourist Attraction,Name,Rating,Date and criteria,Title,Review
Galgibaga_Beach-Agonda_South,Dipak,5.0 of 5 bubbles,Jan 2023,Galgibag Beach,Very peaceful and secluded beach at almost southernmost tip of Goa. The controlled development of beach is helping in it's consevation for breeding place for Olive Ridley turtles.
Galgibaga_Beach-Agonda_South,Manish Kumar C,5.0 of 5 bubbles,Apr 2022 • Friends,"Secluded, Calm, Nature.","Calm and secluded beach. If lucky, can see turtles too. No sound pollution,  no light pollution.  Pure nature.  Can visit from November to February. "
Galgibaga_Beach-Agonda_South,Subhankar,5.0 of 5 bubbles,Dec 2021 • Family,Nice virgin beach,"Very peaceful beach.. we were all alone. Good thing is there are no shacks, no loud music, no lights.. extremely serene.. "
Galgibaga_Beach-Agonda_South,CHETANsurat,5.0 of 5 bubbles,Dec 2021,Beautiful South Goa Galgibaga Beach,beautiful beach.There is no more visitor. Clean Beach.Less choice food available on beach.Once must be visit this Galgibaga Beach.
Galgibaga_Beach-Agonda_South,Amit J,4.0 of 5 bubbles,Jan 2021,"Beautiful beach, no shacks","This beach is a few Kms from Palolem beach. This is one of the cleanest beach in Goa with no shacks at all and very less crowd. If you want a quiet place with clean water this is a must visit for you. A lot of people visit here with hopes of seeing turtles. This only happens during a particular time of the year, so please check before coming here to see turtles."
Galgibaga_Beach-Agonda_South,darshan1416,5.0 of 5 bubbles,Nov 2021,Must Visit...Clean and Less Crowded,"Worth a visit if you are in South Goa, this beach has less or no crowd and clean....sometimes you will feel that you are in a private beach."
Galgibaga_Beach-Agonda_South,smewar,5.0 of 5 bubbles,Mar 2021 • Family,Beautiful beach with less crowd ,Must visit if in South Goa! Interesting coral rocks with different colors. Nature at its best in clean backwaters too. One can experience the calm river and beautiful beach sunset both at one place!
Galgibaga_Beach-Agonda_South,Dr Reena dantas,5.0 of 5 bubbles,Mar 2020 • Friends,Amazing beach 😍🏖️ ,We went here for a sunset and no kidding had one of the best experience 😊😊The road leading to the beach is small and through some quiant Goan villages and compared to North Goa this place is damn peaceful .The waters are preeetyyy okay with ocassional waves 🌊 ( so swimming is restricted )It's also one of the most important turtle nesting spots (another reason why swimming isn't encouraged here)The south side of the beach converges with the river galgibag and it's a site to behold .There are only one or two shacks here to eat or grab a beer and few limited accomodations are also available on the beach .Place is a 20min drive from palolem beach in South goa .
Galgibaga_Beach-Agonda_South,Yukthi Manjunath,5.0 of 5 bubbles,Feb 2021,"Serene, Pristine, Untouched Beach",Its a beautiful long beach with only 2 shacks at the end of the beach. Surya's cafe serves very good food but its expensive. Galgibhag river meets the sea here and there's place where you can get into the water and play. Its very safe and pleasant especially in the mornings and evenings. There are no activities here as its a turtle nesting beach. you will see two pits fenced with nest by forest department where turtles have laid eggs. 
Galgibaga_Beach-Agonda_South,Shivani,5.0 of 5 bubbles,Feb 2021,A paradise beach,"Galgibaga beach is lovely flat, not at all crowded beach in South Goa. Surrounding shacks have amazing sea food to offer that their are very affordable huts around for the stay. One looking for a get away which is economic and yet very private can definitely stay at this beach."
Galgibaga_Beach-Agonda_South,PavanKota,5.0 of 5 bubbles,Jan 2021,The perfect week off and the gem being the Santosh Shack,"- Awesome location, beautiful beach and great rock formations- Nice to see turtle eggs safely taken care of hatching- Very less crowd, hence pristine- Cleaning by local authorities daily in the morning- Santosh Shack is an excellent place for great drinks, food, internet and a good chat. He has great staff- Clam and quite. The pine and coconut trees are awesome"
Galgibaga_Beach-Agonda_South,padmanabhan p,5.0 of 5 bubbles,Nov 2020,Beautiful,"This  is  also  a  turtle  nesting  site  with a  lovely  flat  beach.  When  we  went  (on a weekday, in the morning)  it  was  largely  empty. "
Galgibaga_Beach-Agonda_South,alex62,5.0 of 5 bubbles,Feb 2020,AMAZING,"I ve been visiting Galgibaga for the last 13 years,always amazing. Never crowded, crystal clear clean waters, sometimes  big waves, shade under the trees. Nice to walk the beach up and down, it s about 1,5 mile. I recommend Santosh Restaurant and a family place , Mrs. Telly, great local homemade food."
Galgibaga_Beach-Agonda_South,ME & V,5.0 of 5 bubbles,Feb 2020 • Couples,Galgibaga Beach,Lovely quiet beach no shacks or sunbeds plenty of turtle pens giving details of when they are due to hatch 
Galgibaga_Beach-Agonda_South,R P,5.0 of 5 bubbles,Mar 2020,The most serene location in South Goa!,"This beach was by far the most peaceful and serene of beaches. I visited Anjuna, Calangute, Baga, Candolim, Colva, Agonda, Palolem and Patnem beaches in addition to this, however this best was the best. There is no development here, so if you're looking for some peace and quiet on your holiday this is the place to go. "
Galgibaga_Beach-Agonda_South,puneet0310,3.0 of 5 bubbles,Feb 2020,very less crowded beach,"it is very less crowded beach. we visited here in afternoon. it is near palolem beach, nearabout 9-10 km.  We did not bath here, just take around the beach."
Galgibaga_Beach-Agonda_South,Purple F,5.0 of 5 bubbles,May 2019 • Couples,Perfect beach,Nice and clean beach of south goa We wer 5 couples had spend a good time at beach Will surely visit again
Galgibaga_Beach-Agonda_South,Jacky Bhagat,5.0 of 5 bubbles,Mar 2019 • Solo,Solitude Soup,This beach can be a perfect place if you were looking for something private and enjoy solitude. There are few restaurants and hotels around which is open throughout the year. 
Galgibaga_Beach-Agonda_South,JillFerg,5.0 of 5 bubbles,Mar 2019,The last Beach,One of the nicest beaches in Goa. No shacks on the beach as it is a protected area for Turtle nesting. Sadly they are building a highway that will go right next to this beach so I am afraid the turtles will end up being disturbed shortly. 
Galgibaga_Beach-Agonda_South,Nikhil V,4.0 of 5 bubbles,Feb 2019 • Family,Nice place,A really nice place very near to agonda beach. Neat and clean with not too many people around. Must visit for turtle nesting
Galgibaga_Beach-Agonda_South,TrravvelIndia,5.0 of 5 bubbles,Feb 2019 • Friends,Huge Beach,This is a very huge beach in South Goa. Very neat & clean. With very few tourist on the beach. It is very calm & peaceful beach. Turtle nesting happens on the beach. Amazing beach.
Galgibaga_Beach-Agonda_South,Dr. Ashish B,5.0 of 5 bubbles,Feb 2019 • Family,BEAUTIFUL BEACH!!,"Situated in South Goa near Agonda, is this serene golden beach. Compared to Nouth Goa Beaches, it is much quieter, cleaner and romantic. A must visit if you are staying near. "
Galgibaga_Beach-Agonda_South,LeeYip,5.0 of 5 bubbles,Feb 2019 • Friends,Quiet and clean beach,"Firstly, you need to rive to get to this beach. We stayed at The Lalit resort and it would have taken 1.5 hours by foot to get there!Once there, you are met with a long, wide beach and there was hardly anyone there. Palolem beach was closet to The Lalit but Galgibaga beaches it were shear quietness. There are a few eateries with free wifi and taxi service; and it is the area has a local community so all sociable from morning till sunset. They are building a motorway next to the beach so I hope this does not ruin the area with 5 star hotels etc because this beacj will not be quiet anymore and it will be like Palolem."
Galgibaga_Beach-Agonda_South,Nomadess1111,4.0 of 5 bubbles,Jan 2019 • Couples,"Beautiful quiet bay, Protected area ","Stunning and mostly silent. No crowds. A few restaurants hidden behind in the coconut trees. Nice, near Talpona. So much quieter than the beaches like Palolem, etc. Nearly entirely natural environment, a nice village in among the trees. "
Galgibaga_Beach-Agonda_South,Uttam,5.0 of 5 bubbles,Feb 2019 • Couples,Don't miss this if in south goa,I have never seen any beach in goa which is this clean and serene..May be because it is under environment protection and it's still not visited by many.. it's turtle nest and looked after by forest department..It's a must visit place if you in South goa.. road which takes you there is just so beautiful.. take a bike and ride there to experience it.. I just hope that this beach stay like forever..As these are the few beaches left which are not commercialized..
Galgibaga_Beach-Agonda_South,Josiegymbunny,5.0 of 5 bubbles,Jan 2019 • Friends,Lovely place to stay,"If you are looking g for peace and quiet this is The place to come to. The best huts we found on this beach were at Sera Point Restaurant at southern end of the bra. Very clean, comfortable beds and sea facing with a glorious view. Sera is very friendly and helpful and "
Galgibaga_Beach-Agonda_South,Dilip S,5.0 of 5 bubbles,Feb 2018 • Couples,Turtle Beach,"Olive Ridley turtles , bigger and heavier than tortoises lay eggs between October and March on the Galibaga beach . In the wee hours the female turtle visits the beach . After laying around 100 eggs , the female returns to the sea . The eggs hatch within two months and baby turtles swim to the sea . As these turtles are endangered species , the forest department ensures proper fencing of the nesting area .We saw  three enclosures . Each enclosure carried a date on which the eggs were laid . The eggs were laid on 13th and 22nd February . The beach was the most beautiful and unspoiled one . There was no shack , no tourist except us ,  no vendor and no water sport . Tip : Turtles usually come to the shore in night . So , one can take a chance of spotting them by visiting and staying at the beach in the night . It is beneficial to drive on the Margaon – Karwar road to reach the beach ."
Galgibaga_Beach-Agonda_South,ECarmenF,5.0 of 5 bubbles,Jan 2019 • Couples,Best beach in Goa ,"After visiting numerous beaches in Goa, this has to be the best! Extremely clean and quiet. Like previous reviews have mentioned however, they are building a highway right next to the beach, so get there as soon as possible! There are a few restaurants on the banks of the beach which serve nice food and drinks. Definitely a must see if in the area. "
Galgibaga_Beach-Agonda_South,11London1111,5.0 of 5 bubbles,Jan 2019 • Friends,A Perfect Beach,It's a must to go to ASAP if you're in the area. There's a motorway being built behind it which may or may not spoil the peace and beauty. I'm not sure the name of the small cafe on the beach but the women there served up the best momos I've ever tasted. 
Galgibaga_Beach-Agonda_South,Tushar G,5.0 of 5 bubbles,Dec 2018 • Family,Serene peaceful sparkling clean,"The beach is one of the best beaches in south Goa. With hardly any people, the place provides the peace you wish to have while travelling to south goa. The sand was white, tides good. Lifeguard was present. The place is also a nesting place for turtle however they come out at night as told. Its also a delta where river meets the sea. So you will get everything here except sports. Very good beach and we enjoyed our stay there "
Galgibaga_Beach-Agonda_South,Satyen Sharma,5.0 of 5 bubbles,Nov 2018 • Couples,Gem of the beaches,"Excellent golden sand unexplored beach in South Goa , Very rarely visited by Tourists and local people.It’s also known as Turtle beach as during the season turtles lay there eggs here at night.If you want privacy this is the one totally isolated.Only thing is that u will get no eataries on the beach"
Galgibaga_Beach-Agonda_South,jaspal Singh K,4.0 of 5 bubbles,Oct 2018 • Couples,SECRET (UNEXPLORED BEACHES) IN SOUTH GOA,"Beautiful GALGIBAGA beach, Turtle nesring site GALGIBAG (see pic) with pine trees along the shores harldly any visitors we visited on 13th October 2018 with total 4 people including two of us and 2 lifeguard boys It is like one will feel special as no one is there totally empty and clean no shacks or water sports here but very calm environment.  Better to Check your google route because 100% it will show wrong route you mind end up on other side of river from where you can't reach the beach. Two separate routes 1. For bigger vehicles take NH 66 (longer route ) and right turn from POIGUINIM MARKET/ ARTI WINES. 2. For smaller vechicles take the route via SADOLXEM BRIDGE (see pic) cross via TALPONA BEACH shorter route of only 7 km from CANACONA if you are staying in LAIT GOLF AND SPA RESORT, take right turn from lalit resort and travel through the small villages with harldly any vechicles on this route  which you will enjoy it is just 7 km stretch from CANACONA, cross via blue colour sadolxem bridge (see pic)( no one will tell this) it is single lane bridge good for small cars we had taken Maruti celerio almost fitted in the bridge (NOTE:for big cars like innova take NH route 66) so no problem in driving as travelling was fun about 3 km cross via TALPONA BEACH which also untouched secret beach just next to GALGIBAGA BEACH we stayed at LALIT RESORT so it was showing on google maps to take NH 66 route via Cotagio national park which is 17 km stretch (see pic. )"
Galgibaga_Beach-Agonda_South,Pranshu Dad,5.0 of 5 bubbles,Aug 2018 • Couples,Pristine... Divine ,"One of the most beautiful beaches in Goa, guess The most beautiful I should say. It is one of the Turtle nesting sites, a wildlife protected site, turtles visit this beach during winters and stay till March to lay eggs. "
Galgibaga_Beach-Agonda_South,geordieboy919,4.0 of 5 bubbles,May 2018,so much quieter than other south goa beaches but busier than it was 10 years ago,This is a delightful place but is slowly going the way of others At the moment it is just a little busier than Palolem in 1992
Galgibaga_Beach-Agonda_South,Ravi R,4.0 of 5 bubbles,May 2018 • Couples,Turtle Beach - A magnificent and lonely beach,"The beach is called a turtle beach. However there are no turtles on the beach. Its only a lonely beach with possibly few foreigners who always like to be in private. No sports activity also. If one likes to just enjoy the sea moments, this is a place to be. Its too far from the gentry."
Galgibaga_Beach-Agonda_South,lovetravelling,5.0 of 5 bubbles,Mar 2018 • Couples,Beautiful beach,"This is a very lovely beach, very quiet, great for a day trip and a picnic, the sea eagles and kites whirled overhead, 3 little boys played at the waters edge plus the 2 of us. "
Galgibaga_Beach-Agonda_South,Siddhartha C,4.0 of 5 bubbles,Jan 2018 • Couples,Great lonely beach of south goa,"Galgibag is one of the most lonely beach in goa, its famous for turtle nesting, there is no resturent or hotel near this beach.You can have your scooty/car/ bike ride to get this beach. A wide sand beach, the corner part of the beach ideal for sunbath. You can find people rarely here. I can saw this this one of the best beach of goa if you love to visit lonely place. Small river goes between rajbag and galgibag beach and also can enjoy the view where river meets the sea."
Galgibaga_Beach-Agonda_South,kalpajeetbhattachary,4.0 of 5 bubbles,Jan 2018 • Couples,This is one of the cleanest beaches around.,Galgibagh Beach is located in the south of Goa in Canacona region. This is a nice place to unwind yourself by spending few quite & peceful hours far from the congested & crowded beaches.  This is one of the cleanest beaches around & the water clarity of this unspoilt beach is terrific.  Galgibag Beach is also known as the Turtle Beach it is famous for turtles protection work.
Galgibaga_Beach-Agonda_South,anne5130,5.0 of 5 bubbles,Jan 2018 • Friends,Best Beach EVER!,"This beach is the epitome of peace and tranquility. Not very well known, this beach has very few people who all come here for peace, so no loud parties, if that's what you are expecting. The water is clean, not polluted and you can wake up to the sound of waves crashing and birds chirping. Isn't that what you need to get away from the city life?"
Galgibaga_Beach-Agonda_South,Naren D,5.0 of 5 bubbles,Mar 2018 • Friends,Turtle beach,We went to the south most point of galgibaga beach which is called the turtle beach and yes as the name suggests a lot of sea turtles neat their egss there.Beside the fact that it is a very peaceful beach it is very clean and there are good waves to practice some surfing
Galgibaga_Beach-Agonda_South,Shailesh B,4.0 of 5 bubbles,Mar 2018 • Solo,Very good place to have a peaceful outing ,"Not much people visit the place The reason may be it's not that highlighted  or published Actually people gets busy with the palolem,  patnem,  etcThis beach is really a good place W clean waterw wviews Nice place with not much tourist Even litteale bit difficult to get to the place as its on a bit remote seide Not much signs or boards which can bring you to the place "
Galgibaga_Beach-Agonda_South,John M,4.0 of 5 bubbles,Mar 2018 • Couples,Turtle Beach,Beautiful and quiet beach.  Netted off area where turtles have laid eggs.  Nests are listed with hatching dates. We watched a herd of goats running along the beach.  Nice place to take a picnic.
Galgibaga_Beach-Agonda_South,sumit w,4.0 of 5 bubbles,Mar 2018 • Solo,Essentials of galgibaga,"Perfect place to chill out esp mornings and evenings . Sketchy/nonexsistent mobile networks .there are basic shacks to stay other than one property which is good . Frequented by foreigners generally , limited food options view limited shack but having said that two-three shacks churn out really awesom seafood cuisine .expensive place budget wise as it caters mainly to foreigners but if one wants to see totally laidback Goa and explore nearby south goan life , hop.over to Galgibaga and its mindblowing beach "
Galgibaga_Beach-Agonda_South,MissCristina81,4.0 of 5 bubbles,Feb 2018 • Couples,"Quiet, clean beach, great for walks and sunsets","Secluded, long, clean beach, perfect for late afternoon walks and great sunsets. It is also one of the three main nesting sites for the Olive Ridley Turtles in Goa (the other two are on Agonda beach and Morjim Beach). Few basic drink + food places available near the beach, but we have not tried any. Great for an afternoon getaway from Palolem and the surrounding beaches."
Galgibaga_Beach-Agonda_South,sllerena,5.0 of 5 bubbles,Jan 2018 • Couples,Beautiful Beach,"We rented a scooter and drove from Palolem to Galgibaga to the turtle sanctuary, amazing isolated beach, and beautiful. If you want to spend the day bring your beverages and snacks for the beach. there are some restaurants nearby."
Galgibaga_Beach-Agonda_South,Nomadess1111,5.0 of 5 bubbles,Jan 2018 • Solo,Turtle Beach. Beautiful but watch out for naked white people.,"You might, on this stunning beach, fall over a baking human unclothed. I'd rather not... so I kept to the open space and swam. It was glorious! But can't westerners cop on it's not appropriate to sunbathe naked. I find it annoying, so what on earth can the poor locals think??? Go to Nice, please!"
Galgibaga_Beach-Agonda_South,asim848,5.0 of 5 bubbles,Jan 2018 • Friends,Peace,"This beach is one of the best beach in Goa. It's yet to get commercialised, I wish it stays that way. It is also a nesting site for olive Ridley turtles ( an endangered species of turtles) . Good for morning jog and stroll. There are couple of restaurants which has good food at reasonable price. If you are in south Goa please spare some time here and you will find at peace with nature. Best time to visit Oct to march"
Galgibaga_Beach-Agonda_South,Christian P,3.0 of 5 bubbles,Dec 2017 • Couples,Extremely calm and pretty empty,I think there is only one restaurant at the beach open during high season. Otherwise very calm and pretty empty. But exrremely nice and clean.
Galgibaga_Beach-Agonda_South,DSRems,2.0 of 5 bubbles,Dec 2017,Not worth the extra effort.,"In what way is it beautiful compared to other Goa beaches ?  Believing in all the rave reviews I set off with my family and was thoroughly disappointed. It's quite far from canacona and when we reached there were very few people on the beach or rather sea shore. As darkness fell, it became completely deserted and the sea became rough so I had to rush to get my children out of the water. It may be a breeding ground for turtles, so let it be that way. Let's not go there and ruin their and our peace of mind."
Galgibaga_Beach-Agonda_South,skinnygirldiariez,5.0 of 5 bubbles,Dec 2017 • Friends,"Hidden Gem -  Santosh Beach Restaurant - Top Shack in Galgibaga/ Turtle Beach, Goa","The beaches in Goa are really crowded and not worth the effort to spend a lazy afternoon. The Turtle Beach also known as Galgibaga Beach is one of those exquisite gems that is now getting noticed. This was my second visit from last year. Santosh Beach Shack is the best one to dine in. The sea food especially Crabs are a must have. If you can do let them know you are arriving and how many people are there. The crabs get over in a giffy. The beach is quaint and clean. The waves are just perfect if you want to just float around and enjoy the peace and quiet. As its a nature conservation site, the beach is pretty restricted. The highlight are the turtles lay their eggs on the shore, which are clearly marked. The highway is being constructed and I do hope it won't destroy the habitat for these gorgeous creatures that thrive."
Galgibaga_Beach-Agonda_South,Dr.Q T,4.0 of 5 bubbles,Dec 2017 • Friends,Breathtaking ,This is one of the most breathtaking beaches in the area. Contains all of the proper scenery that will make your soul reach a new way of in taking life. 
Galgibaga_Beach-Agonda_South,RLauraPark,5.0 of 5 bubbles,Dec 2017,Shanti beach,"A quiet beach with only a few other tourists. The sea and beach are clean, but there is no shade on or around the beach, so take your own umbrella if you need shade. Also no chairs or beds on the beach (yay!).Behind the beach there is a river/lake that you can see sunrise over, with the sun setting in the ocean. The best seafood restaurants in south Goa are here, and they're much cheaper than the busy tourist beaches! Santosh restaurant is the best!"
Galgibaga_Beach-Agonda_South,Gaurav B,5.0 of 5 bubbles,Dec 2017 • Couples,Hidden Gem of Goa,"Beautiful and secluded. An ultimate getaway that is eco friendly. There's an environmentally conscious vibe all around. Not for parties and people looking for mindless entertainment. Hopefully the the new highway construction won't attract people that'll cause nuisance. Good food options available too, although limited. So just grab a beer have some good grub and stare at the ocean aimlessly."
Galgibaga_Beach-Agonda_South,mohitbohra88,3.0 of 5 bubbles,Dec 2017 • Couples,Clean but restricted,"The beach is beautiful and clean. It is a great place to be if you love turtles. The turtles start visiting this beach in second half of December and continue till February. Thus playing, lighting fire, riding on this beach is prohibited. "
Galgibaga_Beach-Agonda_South,satyam v,4.0 of 5 bubbles,Dec 2017 • Friends,Quiet nd gud beach,It's a quite and good beach with 3-4 places to hang around. During dec to jan turtles come to lay eggs. Beach is clean and less crowded also. Good place to hang around with friends of you want to avoid crowded beaches
Galgibaga_Beach-Agonda_South,DEEPAK J,5.0 of 5 bubbles,Nov 2017 • Couples,real gem,"most peace full beach in south Goa, bit boring tho for someone who is looking for the entertainment,  "
Galgibaga_Beach-Agonda_South,Vinvmax,5.0 of 5 bubbles,Sep 2017 • Couples,Exploring Goa,Very good place for an evening or morning walk. There are not many hotels or resorts. Its a protected beach for turtles and strictly kept very clean.
Galgibaga_Beach-Agonda_South,Wanderlustme5,5.0 of 5 bubbles,Aug 2017 • Family,A worthwhile drive to the fag end of Goa,"Please time your visit as per the months turtles come to lay eggs. A very calm, Serene and clean beach in Goa. Off the beaten path and a well-known secret :)No shacks, no noise just nature's bounty."
Galgibaga_Beach-Agonda_South,Chandan P,4.0 of 5 bubbles,Apr 2017 • Couples,A beach so beautiful,A fabulous beach to enjoy the water and the view was just really amazing.  Not many people ventures here hence less populated.
Galgibaga_Beach-Agonda_South,TheGoodLifeWithIQ,4.0 of 5 bubbles,Oct 2016 • Couples,"Out of the way, uncommercial and spectacular ","We were staying at Agonda when we heard about this beach. It took us about half an hour to get there by scooter from Agonda, and we would never have found it without GPS. Pros: - Long, clean, pristine beach- Almost no tourists (there was only one family in the water when we were there) - Interesting river mouth and rocky outcrop at one end of the beachCons: - No facilities whatsoever (actually a good thing, considering this is a turtle nesting site) - The corner with the river and rocks has no trees or shelter, which makes it uncomfortable in the afternoon Bottom line: A lovely beach for peace and quiet, but not a great place for eating and drinking. "
Galgibaga_Beach-Agonda_South,Rakesh s,5.0 of 5 bubbles,Sep 2016 • Friends,Galgibaga,Beach is very beautiful and very clean. Every were their is dustbin to keep the beach clean. Love the place. 
