Tourist Attraction,Name,Rating,Date and criteria,Title,Review
Mangeshi_Temple,Neha Dudye,5.0 of 5 bubbles,Jan 2023 • Couples,Best temple,The temple have beautiful architecture with great environment. It's a must visit experience in goa..
Mangeshi_Temple,Aditya Antika,5.0 of 5 bubbles,Jan 2023 • Couples,Afternoon in Mangeshi Temple,"There is only one shop for sugarcane juice,other than that coconut water is available.There is good facility for parking ( 2 and 4 wheeler ).The place is very calm and also you can enjoy scenic beuty  at the temple.Good place to visit."
Mangeshi_Temple,anitapnz,5.0 of 5 bubbles,Dec 2022,Divine,The visit was a moving spiritual experience.Had expected crowds and delays but the atmosphere is quiet and serene.Surprisingly few know about this ancient temple.Very well maintained site which also has a restaurant on site.Must visit!
Mangeshi_Temple,Kshitiz Shrivastava,5.0 of 5 bubbles,Oct 2022 • Family,Amazing,"A vibrant place, it's open throughout the day,ample parking space around temple. Public toilet is available"
Mangeshi_Temple,mailmahim,3.0 of 5 bubbles,Sep 2022 • Family,aaGood but not great plan with multiple activities can be missed,Good feeling at place no rush but can’t consider it very good no good place to lunch nearby if you came at lunch time. Temple is different from temples in north
Mangeshi_Temple,Sumon,5.0 of 5 bubbles,Aug 2022 • Family,Bliss!,"Very well kept temple, and an important one for many from this part of India. Absolute worth the visit.Try the canteen food inside the temple complex - simple and delicious food on offer."
Mangeshi_Temple,mysterioustraveling,4.0 of 5 bubbles,Jul 2022 • Couples,Beautiful temple in Goa.,I am always fascinated when visiting religious places around the world. So it is no wonder that I found visiting this site very special. While we were allowed in to see some of the temple grounds it was also very fortuitous that we were able to enter an actual festival. Take time to go visit this temple while you are in Goa. You won’t be disappointed.
Mangeshi_Temple,Maneesh2700,4.0 of 5 bubbles,Jun 2022,"Mangeshi Temple, Goa -- For a Quiet Visit","The temple looks stunning, with a large campus and clean atmosphere. This is really a good place to visit, won't need more than 30 minutes of your time if it is not crowded. Finding a clean washroom was a challenge though"
Mangeshi_Temple,Natashajose,4.0 of 5 bubbles,May 2022 • Solo,Nice temple,"It is a nice temple with plenty of parking space. blue, golden and white combination of colours makes it look more beautiful. Lord Mangueshi is recognized as Lord Shiva. It is a nice spiritual place to feel calm and relax."
Mangeshi_Temple,santosh rangnekar,5.0 of 5 bubbles,Dec 2021,My family god's temple (Kuldevat),Oh thanks to lord mangesh to allow me to visit and for darshan to mangesh temple. The temple's maintanance is amazing and facilities are highly satifactory.  Words are not enough to express my emotions and feelings. Thanks to Lord Mangesh. 
Mangeshi_Temple,Amit Aggarwal,2.0 of 5 bubbles,Feb 2022 • Family,Highly overrated. Pls skip,This is #1 item on To Do list for Goa. Pictures of this temple make you feel like something directly from Thailand or Malaysia. We traveled around 50km to see Mangeshi temple and found it to be just another ordinary temple. It can be highly avoidable for tourism purpose. Your precious time can be spent on other things.Note : Please understand that I am commenting on it from a tourist attraction point of view. If you are going there out of faith or love towards God then please excuse this review. 
Mangeshi_Temple,Neha K,5.0 of 5 bubbles,Nov 2021 • Family,Nice temple,Must visit.Nice temple. Open for all the time.Parking is available near the temple.Closer to mahalasa temple.Nice visit
Mangeshi_Temple,Arun Prakash Ray,5.0 of 5 bubbles,Oct 2021,"Portuguese Architecture, systematic darshan",One of those most disciplined Temple in India. The priests are very knowledgeable too. My daughter & I did a wonderful Darshan without any waiting.
Mangeshi_Temple,lotusdiamond,4.0 of 5 bubbles,Dec 2020,Famous among locals,Temple is situated in North Goa. do check temple timings before going. Its closed in afternoon. Beautiful and serene surroundings situated  in the heart of  village. Car parking is available and few shops selling puja items and flowers are available. Famous temple among locals. Photography is allowed.
Mangeshi_Temple,LalitaVasu,5.0 of 5 bubbles,Nov 2020,Definitely worth a visit when in Goa,"I was visiting this temple for the third time in my life.  The first was in 1971 , second in 2001 and third this month. Not only the temple but the entire area around it has changed drastically. The current structure looks awesome. The blue, golden and white combination of colours give it a look of grandeur . We went to visit it in the afternoon which is a time one should avoid as the floor is very hot. Due to the pandemic all precautions were being taken. There were no vendors selling flowers or puja material, social distancing was being maintained well. Also the darshan could happen only from a far of distance so no one really enters the hall fo the temple. The surroundings were kept very clean. My recommendation would be to visit this when in Goa. It is a very beautifully built and well maintained."
Mangeshi_Temple,PAVITRA SHIBAD,5.0 of 5 bubbles,Nov 2020 • Family,Divine and Godly,"Very beautiful and serene temple.The timings currently are 3pm to 6pm all days due to COVID.The temple was previously situated in Cortalim. Upon Portuguese invasion in Goa, many Hindu temples were destroyed. The Portuguese forced people to change their religion to Christianity. Hence the group of Saraswats belonging to Vatsa Gotra shifted the Linga to the village Mangueshi, where it is currently housed now.The temple was rebuilt twice during the Maratha regime and renovated last in 1973.A golden kalash was fitted atop the tall dome of the temple during this last renovation.There is a another fascinating legend attached to the name of the Lord Manguesh, who is an incarnation of Lord Shiva. The ancient legend states that Lord Shiva once lost everything he had in a game of dice with his wife Parvati. He decided to go into self-imposed exile and arrived in Goa.Parvati, unable to stay without Lord Shiva for long, came looking for him in the jungles of Goa. Lord Shiva decided to play a prank to frighten her and disguised himself as a tiger which attacked her. Parvati cried out for help in terror, ‘Trahi Mam Girisha’ (O Lord of Mountains Save Me).Lord Shiva immediately turned himself back into his normal form and the two were united. But the cry for help and the words ‘mam girisha’ became associated with Lord Shiva. In the course of time the words abbreviated to Manguirisha or Manguesh by which name he is known today.A linga which was left to mark the place where the legend occurred was discovered by a local shepherd and eventually a temple was built to house Lord Manguesh.Me being a Saraswat, this is one of my kuldevatas(family deities). I always make it a point to visit when I come to Goa.The peace you feel when you visit this temple is incomparable.Definitely come here at least once.Only suggestion to the authorities is - please make sure all people are wearing masks and following social distancing. Otherwise deny entry.Some people did not follow the precautions and were very unruly; something I observed during my last visit on 16 Nov 2020.Sanitizer was provided at entrance but no one seemed to be using it consciously.When questioned, why they are allowing people without masks, their answer is ""We cant do anything except leave our safety to God"". Not done at all, when at other places heavy fines are taken when masks are not worn and social distancing not followed.Also, certain visitors came in shorts, skirts, sleeveless dresses up to knee length. Modest dressing should be a must-people should maintain the sanctity of this temple, not treat this like a party place just because you are in Goa."
Mangeshi_Temple,Johnny,5.0 of 5 bubbles,Feb 2020,Nice and peaceful!,"Very nice temple! We did spend a long winter vacation in Goa, so we did everything there :), so it was nice to visit some more cultural/spiritual places. Good one, I do recommend it!"
Mangeshi_Temple,premnath600,5.0 of 5 bubbles,Feb 2020,Ancient Temple,"This ancient temple of Shiva is located Mardol in Ponda district. This deity is a kuladevata of many SB and GSB community residing in Goa, Karnataka and Maharashtra.If you are in this area on a Monday don't miss the Palaki Ustav and night Pooja which starts at 10 PM. goes on for an hour or so.  "
Mangeshi_Temple,Biju Nilgiris,3.0 of 5 bubbles,Feb 2020,Hindu Devotional Temple,"It's a good place for hindu devotional followers. Nothing much on architecture of temple, it's normal."
Mangeshi_Temple,Reghu N,4.0 of 5 bubbles,Jan 2020,"Lord Mangueshi, an incarnation of Lord Shiva","We were told that Lord Mangueshi is recognized as Lord Shiva only in the regions of Goa. Shri Mangueshi Temple is situated in the Ponda Taluka at a place called Priol. The distance of the Mangueshi temple from Panaji is 22 km.Mythology says that Lord Shiva had once visited the land distraught after losing heavily to his wife Parvati at a game of dice. As Goddess Parvati came looking for him, he tried to prank her by shape shifting into a tiger and frightening her. Seeing the predator in front of her, Parvati shrieked and prayed uttering the following words Trahi Mam Grisha, roughly translated this means “O Lord of the Mountains, save me”. Upon hearing her plea Shiva reverted to his usual form and returned to Kailash with her.Shiva came to be known as Lord Manguesh due Parvati’s words Mam Grisha that remains associated with the land and the tale. The original location where the temple was built is presently the location of village Cortalim, located at the south of the Zuari River. It was during the Portuguese invasion that the deity was shifted Priol, where it remains till this day."
Mangeshi_Temple,anand k,5.0 of 5 bubbles,Jan 2020 • Family,Fantastic Temple ,During our visit to Goa happened to visit this nice temple which is built on 15th century. We had a very good Darshan. One of the few temples Built and lasted in Goa since the the Portuguese / Christian Era where they destroyed a lot of Hindu temples. 
Mangeshi_Temple,ashish g,4.0 of 5 bubbles,Dec 2019,Beautiful Temple with a lots of shops nearby,One thing I noticed here is this this temple doesn't appear like a temple. The architecture of this temple is very unique and looks like a Portuguese church. The Blue and yellow colors make it more vibrant. The shopping area near this temple is much cheaper as compared to other places in Goa
Mangeshi_Temple,138500423,5.0 of 5 bubbles,Nov 2019,GSB (Goud Saraswat Brahmin's) Landmark Temple Of  Goa.,"A) Location:This most famous temple in Goa is located at Mangeshi village in Priol, Ponda taluka:1) 1 km from Mardol2) 21 km from Panaji3) 26 km from MargaonB) Temple Impressed Me From Following Aspects:1. Very unique distinctive type of architecture.2. Neat & clean temple premises3. Free parking at three locations:a) Next to templeb) On the side of road from temple to main roadc) At the main road junction 4. Canteen facility providing simple veg food.5. Agrashala: Very affordable accommodation facility for pilgrims & devotees from GSB community only.6. Feet water wash system7. Free footwear stand 8. Washroom facility opposite the parking area beside temple9. There are food stalls, flowers garland stall, clothes shop, souvenir stalls, hotel on route from main road to temple. It 250 meter distance approx.10. Spacious temple surroundingsC) Mangeshi Temple:Wikipedia, trust & other websites provides excellent religious & historical information on this temple. Please read it on google search by typing Mangeshi Temple Goa.Temple is open from 6 am to 10 pm.This temple houses the kuldaivat (family deity) of GSB community.Temple belongs to Bhagwan Manguesh (Linga) an incarnation of Lord Shiva.There are shrines of Goddess Parvati & God Ganesha as well as shrines of many more deities in the temple &  temple premises. D) The Other Notable Things Are:1. Multistory Deepstambha (Lamp Tower)2. Chandelier inside the main hall of temple3. A water tank, the gate of it was closed during our visit4. Agrashala accommodation facility on left side, rear side & right side of temple5. One is not allowed to take darshan from very near inside the templeE) Photos:Photos inside main temple are totally prohibited. Visitors are allowed to take photos outside temple.I have attached photos with easy to understand tag & description system. Have a look at the photos to get the feel of those things in the photo.This is the biggest & famous landmark temple of Goa so it should be visited."
Mangeshi_Temple,Swati A,4.0 of 5 bubbles,Nov 2019,Clean Temple,I visited this place once in 1988 and now in 2019. No rush for Darshan. Also note shorts are not allowed to enter into the temple. They give some kind of cloth/Dhoti to wrap around and then you can enter. Its free of cost.
Mangeshi_Temple,Achal,5.0 of 5 bubbles,Oct 2019 • Friends,Nice Holy place,Divine place with divine shiva blessings. Nice place to worship lord shiva in village of legendary lata mangeshkar ji.
Mangeshi_Temple,TrivraQ,4.0 of 5 bubbles,Oct 2019,Could've been better.,This was a second visit to our family deity. We were lucky to be there for the afternoon Aarti. The security guards inside the temple were very rude to devotees and with the priests shout if you stand in front of the deity for a bit longer. This does make the experience unpleasant.
Mangeshi_Temple,travel0814,5.0 of 5 bubbles,Oct 2019,Divine place,"It is one of the biggest temples in Goa. Must visit if you are in Goa to get the blessings of God Shiva. Very beautiful temple. There used to be an ancient one at another location but it was destroyed by the Portuguese invaders during Goa inquisition. Somebody managed to hide the idol at the current location. This was a farm labourer called Mulkeshwar. You will find his temple behind the main temple. He used to smoke bidi, so devotees offer him bidi and is considered a form of the God himself.Temple also has a nice canteen where you can enjoy local vegetarian food right from breakfast to dinner."
Mangeshi_Temple,Harinderjit,4.0 of 5 bubbles,Oct 2019,Nice feeling.,Located at a nice place. We have to move arround 700 meters to visit that place. For old people it is difficult to move. The gaurd is not so co-operative to elderly.
Mangeshi_Temple,RAJIV,5.0 of 5 bubbles,Sep 2019,graet,"a very spiritual place and architeture place, must see when come to goa .also visit fort aguda and holy church alsoj"
Mangeshi_Temple,manoj p,5.0 of 5 bubbles,Sep 2019,Beautiful temple and divine darshan,"The temple is situated approximately 20 kms from Panaji and is easily accessible by road. The highway is good except for a patch of around four kilometers. Ample directions available to reach the place. Google map is accurate to the T. Parking can be an issue during weekends, festivals and other religious occasions. Slight detour from the highway and another half a kilometer from the main road. Temple is accessible from 0530 to 2230 hrs. The temple architecture is beautiful. The deity is divinity incarnate. Shorts, short dresses, frocks etc are not allowed. Wrap around cloth is available free of cost for those with inappropriate dresses. There is a temple pond too. Lot of history behind the temple which has survived the Portuguese invasion and their religious intolerance."
Mangeshi_Temple,Debasis,5.0 of 5 bubbles,Sep 2019,Mangueshi Temple - for peace and prosperity,"Located on a Hillock at Proil which is in the Ponda Taluka, surrounded with lush greenery.   21 km from Panaji the capital of Goa, and 26 km from Margao. The deity Lord Mangueshi, an incarnation of Lord Shiva. Mangueshi Temple has strict dress code for both domestic and foreign tourists."
Mangeshi_Temple,Karpagavalli,5.0 of 5 bubbles,Jul 2019,Very big temple,"This is one of the beautiful temples of goa which attracts most go an tourists.the place is vast and house to god shiva.do carry caps,umbrella, sunglasses, sunscreen, water as it takes a lot of time for Darsham due to the huge crowd here."
Mangeshi_Temple,meenakshimuthusamy,5.0 of 5 bubbles,Jul 2019,Nice place,The place is good and nice to have a visit.It is a nice place and good time pass.It is maintained well.
Mangeshi_Temple,Surachandra Doley,5.0 of 5 bubbles,Jul 2019 • Family,Shri Mangeshi Temple,"Shri Mangeshi Temple located at Mangeshi Village in Priol, Ponda taluk of Goa is one of the largest and most visited temple in Goa. It is a must visit if you are in Goa. Also the stalls near by the road leading to the Temple sells varieties of items that one can buy as a souvenier or gift to family and friends....and the price are also cheap...as compared to other parts of Goa. The stalls nearby beach are very costly and the prices here are half of those of beach stalls....but I learned it the hard way...."
Mangeshi_Temple,Abhitheexplorer,5.0 of 5 bubbles,Jul 2019,Supreme.,"We had to go a bit far looking for this temple but once we reached there found it so serene and so beautiful. It is very old temple and connected to Goan History. Contrary to my belief the place is not owned by Lata Mangeshkar Family but about 12 families made this temple. They have a canteen also that serves very nice, home made food on very subsidized rates. We had meal there as well. "
Mangeshi_Temple,Jitendra J,5.0 of 5 bubbles,Jun 2019 • Family,Must visit,If you are in Goa you must visit this temple. Beautiful temple. There is a dress code for girls. They have to wear decent cloths. 
Mangeshi_Temple,csd1979,4.0 of 5 bubbles,May 2019 • Family,The abode of Lord Shiva,"Its a very beautiful temple on a hill top. The premises is quite clean and well maintained.  Short dresses inside the temple not allowed, hence one need to be dressed appropriately. The drive to the temple is also quite good. Must visit if in Goa."
Mangeshi_Temple,Vayu43,3.0 of 5 bubbles,May 2019 • Couples,Worth A visit,"Said to have power of getting your wishes fulfilled !! A medium size temple , Well kept and orderly systems"
Mangeshi_Temple,rajesh_marar,4.0 of 5 bubbles,Apr 2019 • Family,Nice temple,"It is one of the most famous temples in South Goa where people come from different parts of the country. The Temple structure is very old , decent  and the environment is peaceful. Able to pray in peace…… Its quite a decent  walk from the car park ….."
Mangeshi_Temple,Bobby201,4.0 of 5 bubbles,Mar 2019 • Friends,BEAUTIFUL TEMPLE,"One of the well maintained clean Temple and serene atmosphere.A must visit while at Goa. Easy approach, parking area available, disciplined devotee crowd."
Mangeshi_Temple,CoolTravelFreak,4.0 of 5 bubbles,Aug 2018 • Couples,Clean Temple,This is one of the most visited place in Goa and is considered as one of the top tourism spots in Goa ... car parking is very far but the market area  helps cover the distance with fun ...
Mangeshi_Temple,Devd168,4.0 of 5 bubbles,Dec 2018 • Couples,Goa 2018,"One of the most famous temples in South Goa.Many people come from different parts of the country to visit.The Temple structure is very nice and the environment is peaceful. There are rooms built for the patrons to stay inside the campus.Have been visiting this place since childhood and unfortunately, of late I observed the sanctity of the temple is being compromised due to commercialisation."
Mangeshi_Temple,Ajay2306,4.0 of 5 bubbles,Feb 2019 • Couples,Clean temple premises ,Worth visiting. Its quite a long walk from the car park & can be uncomfortable in the hot sun. Temple is kept clean & does not seem very commercial. 
Mangeshi_Temple,DMitra,5.0 of 5 bubbles,Feb 2019 • Family,Good one to start the day,This was one of the oldest Hindu temple in Goa dedicated to lord Shiva in the form of Mangesh. Lot of devotees visited this temple. Actually we visited this temple in February end when the sun started becoming hot. The road to temple is blocked for vehicle movement so we walked. Lot of people were giving puja. We had good time. 
Mangeshi_Temple,NICKWILSON,5.0 of 5 bubbles,Feb 2019 • Family,must visit place in goa,"I visit with my family regularly, beautiful temple, they served a pure veg authentic food on the chargeable basis"
Mangeshi_Temple,Food Travel Tech Life,5.0 of 5 bubbles,Feb 2019 • Couples,Beautiful temple of local style,"It is located on a hill and a road leads to the small stairs to the temple. It is a very modest temple like the ones in bali as they know people come to goa to chill and may not be appropriately dressed, they offer free cloth like sarong to used to cover knees. Unlike in bali where they charge a lot to rent sarongs. We felt very peaceful and calm after visiting this temple. The market on the way is also good but be aware you need to bargain big. If you are having your own vehicle drive through cortlaim village and enjoy the jetty ride as well."
Mangeshi_Temple,Aditya,5.0 of 5 bubbles,Apr 2018,Must Visit if you are in Goa,"If i am in Goa, i do visit Mangeshi as this is our kuladevata. But apart from that actually a must visit place. If possible dont miss the Palkhi which is on every Monday. It is a grand celebration. The view of the temple on this Night is simply magical. There is even place to stay within the Temple but is restricted. Its always nice to stay and since the same is built arond the temple its gives a clam and plesant feeling. Would recommend to wear clothes which cover your legs completly i.e. full pants or else will have to get the dhoti or chunni to do that as the entry is restricted with western outfit.Again the entry in the main temple very well know as ""Gabhara"" (The innermost division of temple) is restricted, however from the place from where we can see the idol gives a good view. Photography is restricted as it is in most of the temples.Non-Veg is strictly prohibited and the canteen inside the temple premises have some delicious maharashtrian delicacy. For people who would like to have the feel of some goan non-veg food if you step out of the temple there are a few eateries popularly know as ""Khanaval"" who serves authentic goan food mainly fish and sol kadi are one of my favourites. Its a home made food."
Mangeshi_Temple,Sukhvinder1955,4.0 of 5 bubbles,Feb 2019 • Friends,Beautiful temple,"Travelling with a group of 43 senior Citizens, we visited this temple arround 12.30 PM. After climbing about 10-12 steps, we hit the main entrrance. At the entry point, there is Bharoan temple. It's very satisfying to have blessings of the Lord. Within the temple complex, we see a high white tower, called the Garuda stambh, which is yet another attraction at the Temple complex. "
Mangeshi_Temple,Dilip S,5.0 of 5 bubbles,Feb 2018 • Couples,Exquisite Temple,The last temple we visited was that of exquisite Mangeshi temple located on a hillock surrounded by lush green hills at Priyol just 1 km from Mardol . Here Lord Shankar sports a beard . The temple has a seven storeyed Deepstambha . Timings : 0600 to 2200 .
Mangeshi_Temple,Suvarghya,3.0 of 5 bubbles,Jan 2019 • Family,Shiva Temple,"This is a Shiva temple located in Ponda village. Worth a visit for its location and religious aspects, priests however are eager to extract money from tourists. "
Mangeshi_Temple,"Neeraj,The Traveller",5.0 of 5 bubbles,Dec 2018 • Family,"Peace,Uncrowded and Good Food","Mangeshi temple is located near Ponda taluka of Goa, It will take around 1 hour to reach from Panjim, the road is smooth and you can go by car/2wheeler,It is old Lord Shiva temple which was saved from Portugese during their colonisation,There are other small temples around it as well.This temple is also famous for Mangeshkar sisters.You must try its kitchen food (Thali) which is very simple but will be super delicious."
Mangeshi_Temple,Charan63,4.0 of 5 bubbles,Jan 2019 • Solo,Shiva Temple in Lata Mangeshkar’s Village ,"While visiting Goa, made a point to visit Mangeshi Shiva Temple. It is Situated in the village that is also famous for being the native village of melody queen Lata Mangeshkar. Like all parts of Goa, the road to templetown passes through an undulating terrain though lush green hills. Given it’s a small village, local body has made sure that cars are parked outside the village access road. This leaves the last about 500 meters to walk before one reaches the main entrance of temple. Climbing about 20 odd steps, one crosses the main gate and enters the vast grounds of temple. What surprises one is the temple architecture. Unlike a traditional temple with a pointed step tower above the sanctum sanctorum,  the temple appears like a dome of a basilica. From distance, the temple appears like a church complex. Possibly, a fusion of Hindu Temple Architecture with Portuguese history and Roman Catholic Church styles. The inner hall of temple is decorated with numerous glass chandeliers - again very different from traditional Hindu temples. Temple is however very clean and environs so soothing and serene. When visiting Goa, this should be a must visit site, just like Basilica of Bom Jesus or Se Cathedral. "
Mangeshi_Temple,Bibhu Acharya,4.0 of 5 bubbles,Jan 2019,Historic temple with diverse architectural styles,This historic temple dedicated to Lord Shiva is a symbol of diverse historic legacy of Goa.. The temple by itself was restored several times and presents an interesting melange of architectural styles. A must see for the Hindu tourists visiting Goa. 
