Tourist Attraction,Name,Rating,Date and criteria,Title,Review
Sheek_Emporium_Armanii_Boutique_Since_1950-Candolim_Bardez_North,melandra,5.0 of 5 bubbles,Jun 2019 • Couples,Couture at Next prices!,"John and I always visit Sartaj when we go to Hoa - he makes the most beautiful made to measure clothes for us, and unlike most of the tailors in North Goa, his women’s clothes are as good as the men’s. He will design for you, or copy something - he’s very talented. My husband’s favourite shirts are the ones Sartaj makes for him. He’s made him some lovely suits. This time I had a gorgeous trouser suit made and some raw silk shell tops. Previously I’ve had skirt suits, cocktail and long evening dresses made for cruising.You won’t go wrong with Sheikh Emporium.Btw it’s almost opposite the Chocolate Cafe - it’s hard to find places in Candolim."
Sheek_Emporium_Armanii_Boutique_Since_1950-Candolim_Bardez_North,Janet Q,5.0 of 5 bubbles,Mar 2019 • Solo,Mrs janet quick,Brought a dress from uk to have copied as I loved the design and fitThe finished outfit for my sons wedding was beautifully made and totally bespoke
Sheek_Emporium_Armanii_Boutique_Since_1950-Candolim_Bardez_North,700Tanya,5.0 of 5 bubbles,Apr 2019 • Couples,Tailor made shirts,"My husband had 2 shirts custom made by Sartej, while on holiday in April. They were excellent value and have washed really well. We would definitely recommend Sheek Emporium."
Sheek_Emporium_Armanii_Boutique_Since_1950-Candolim_Bardez_North,Susie W,5.0 of 5 bubbles,Mar 2019 • Friends,"Fantastic, friendly and high quality tailored clothing.",I was recommended by my father who has visited Goa several times and had many suits made by Sheek Emporium and I have to say I was not disappointed. I had a pinstriped suit made to measure and I was so impressed I also had a asymmetric fuchsia dress made which I love! Sartaj was thorough and his attention to detail was fantastic which shows in the finished products I do love my suit and dress.  I can not recommend Sheek Emporium enough and I will definitely be purchasing tailored clothing from them in the future! Thank you thank you !! Five Stars all the way!!
Sheek_Emporium_Armanii_Boutique_Since_1950-Candolim_Bardez_North,Jaydee W,5.0 of 5 bubbles,Jan 2019,Beautifully made clothing with a friendly touch ,I came across Sheek online before my holiday to Goa and it did not disappoint. I had many things made to my specification very efficiently with a beautiful range of fabrics. So much time is given to you and you really get treated as an individual. My mum and dad were made to feel oh so very welcome too as if we had known the family for years. Thank you! 
