Tourist Attraction,Name,Rating,Date and criteria,Title,Review
Sheek_Emporium_Armanii_Boutique_Since_1950-Candolim_Bardez_North,Sarah H,5.0 of 5 bubbles,Mar 2020 • Friends,2 dresses,"Just wish I had visited this man at the beginning of my holiday but I might of needed an extra suitcase 😂. I took a dress in to be copied and was so impressed went and had another one done which he did within 24 hours as we were going home. Great prices and very helpful and friendly he even sends you a text when your garments are ready. Highly recommended, my husband is going to have a suit made when we return to Goa "
Sheek_Emporium_Armanii_Boutique_Since_1950-Candolim_Bardez_North,Evie-p82,5.0 of 5 bubbles,Feb 2020 • Family,Pereira wedding 2020,"Thank you so much to Sartaj at Sheek Emporium, for the wonderful experience you gave us. We went to India for what I thought was just a holiday but it turned out to my surprise we were getting married. Sartaj made my beautiful wedding dress from the most awful picture, and my very bad explanations, Every stitch hand beaded and beautiful and exactly what I had pictured in my mind. 👰🏽 Normally people plan things like a wedding for such a long time and we had less than 10 days, Sartaj worked extremely hard  to make my prefect dress and all of the garments for my husband and son were all amazing also. I am so thankful he made us all look wonderful for our wedding day.  His lovely Father even played and chatted with my daughter especially and also my son while we attended important measurements and fittings. We look forward to visiting again and would highly recommend Sheek Emporium to anyone looking for beautiful handmade garments with a friendly brilliant experience. Thank you Sartaj, hope to see you again soon 🤵🏻👰🏽🍾🇮🇳"
Sheek_Emporium_Armanii_Boutique_Since_1950-Candolim_Bardez_North,Chilly,5.0 of 5 bubbles,Feb 2020 • Family,Superb tailor & wonderful man,"If you need anything made at all this is the only place to go in Goa!! I have know Sartaj for 20 + years & he has never failed to impress!! His attention to detail is incredible and he treats his customers as the most important people like family. He recently made all the wedding outfits for our son’s wedding in Goa.. in the space of a week!! The bride looked spectacular in her dress as did the groom and young page boy. He made mine & my husband’s outfits too I could not have asked for better. We have used the services of Sheek emporium many times over the years, fair prices & superb workmanship. Thank you Sartaj you are second to none. I recommend this place very highly! Don’t bother going any where else! 1st class!! "
Sheek_Emporium_Armanii_Boutique_Since_1950-Candolim_Bardez_North,Extraordinary459802,5.0 of 5 bubbles,Feb 2020,Sheek Emporium,"The excellent work of this craftsman is a pleasure to be the recipient of. Mr Sartaj is meticulous and very particular at the same time so very friendly. I ordered several clothing articles, and all were as I expected. The jewellery Mr Sartaj made for me can only be described as bespoken and unique with outstanding quality. I will only buy bespoken pieces from Sheek Emporium in the future. I recommend this establishment to all visiting Goa. "
Sheek_Emporium_Armanii_Boutique_Since_1950-Candolim_Bardez_North,Sqwirly,5.0 of 5 bubbles,Feb 2020 • Couples,Best tailor,"Can’t praise this tailor enough. Quality fabrics, excellent workmanship and him and his dad are such truly lovely gentlemen. Highly recommended!!"
Sheek_Emporium_Armanii_Boutique_Since_1950-Candolim_Bardez_North,Julie B,5.0 of 5 bubbles,Jan 2020 • Friends,Best Taylor ever,I had a jacket made to measure last year.  My husband wasn’t even there!  Texts and calls got all his measurements. Fitted like a glove   He adores it. Thus year I went he still had hubby’s details!!  He made him 7 shirts and another jacket   Superbly crafted and do helpful   100000000% recommend
Sheek_Emporium_Armanii_Boutique_Since_1950-Candolim_Bardez_North,CBraganza,5.0 of 5 bubbles,Jan 2020 • Solo,Just Sheer Excellence!,"Sheek Emporium has been my go-to tailor for more than 5 years now. The professionalism, need for perfection and eye for detail are just many of the quality service you will experience. Kudos to Sartaj, who has maintained the highest standards there in the business. Sheek Emporium is always be my go-to designer."
Sheek_Emporium_Armanii_Boutique_Since_1950-Candolim_Bardez_North,Navigator772424,5.0 of 5 bubbles,Dec 2019 • Couples,Fabulous,Decided to go to sheek emporium after reading reviews and recommendations from friendsSartaj the owner and his staff are really nice friendly people I had 3 dresses made and they were lovley absolutely perfect nothing was too much trouble l look forward to my visit next year to get other clothes made
Sheek_Emporium_Armanii_Boutique_Since_1950-Candolim_Bardez_North,Debyco,5.0 of 5 bubbles,Jan 2020 • Business,Top quality jacket ,We visited Sheek Emporium after seeing recommendations on tripadvisor and Facebook. We are very happy with the quality and fit of the jacket that was made for my other half. The attention to detail is second to none - everything is perfect. All designed from a photo I had on my phone. Thank you so much Sartaj (& your lovely dad) for the excellent service. 
Sheek_Emporium_Armanii_Boutique_Since_1950-Candolim_Bardez_North,Julie P,5.0 of 5 bubbles,Feb 2020 • Friends,The only tailor in Candolim,"We have just returned from Goa & no visit would be complete without seeing Sartaj & his team , they are so friendly, welcoming & helpful. Sartaj helped with the design of a leather jacket & even helped chose which color would look best - his choice was spot on & better than I would have chosen . He even went to special trouble to get a burgundy leather in for a skirt I wanted made . Nothing is too much trouble & great prices . My husband had several shirts made as we know from previous visits that they are great quality- I doubt he will buy shirts in England again . Thanks Sartaj you are the best !"
Sheek_Emporium_Armanii_Boutique_Since_1950-Candolim_Bardez_North,Jess fear,5.0 of 5 bubbles,Dec 2019 • Couples,Shirts from a distance,"We visited sartaj and his shop back in December 2018 and had some beautiful clothes made including suits, blazers and dresses. After this I was assured they kept all measurements and that we could order from home. I did this in December 2019, and ordered 3 shirts for my partner and brother in law for Christmas. I was given a great choice of fabrics and designs and the service was brilliant all ordered, made and delivered within the space of 3 weeks. Thank you soo much 😁"
Sheek_Emporium_Armanii_Boutique_Since_1950-Candolim_Bardez_North,Steve T,5.0 of 5 bubbles,Feb 2020 • Couples,Top quality shirts,"Don’t waste your time with other tailors,you won’t find a better one,great quality clothing,a great price and when you meet Sartaj and his lovely family you also get the Goa experience.I went away for a cruise,I needed 2 dinner shirts made,as Sartaj has all my measurements,he made them and sent them to me,great service."
Sheek_Emporium_Armanii_Boutique_Since_1950-Candolim_Bardez_North,GingerRufus,5.0 of 5 bubbles,Nov 2019 • Solo,"A Gem of a Tailor, who also sells lovely gems!! ","My first port of call is always Sartaj and this is the lovely coat he made me this winter. It takes me everywhere and is much admired as well as being really warm. He designed this coat from a germ of an idea I had and it’s totally unique! He had a real skill sorting what suits people. A gem of a tailor who sells lovely jewellery too, again which can be personally designed!! He made this bracelet for me several years ago..... I’ve not taken it off since. "
Sheek_Emporium_Armanii_Boutique_Since_1950-Candolim_Bardez_North,RuthForder,5.0 of 5 bubbles,Jan 2020 • Couples,Another fabulous shirt and dress,"A few years we walked past Sheek Emporium....Sartaj, has some beautifully tailored shirts and dress I liked outside the shop.We called in, and couldn’t resist to have 2 shirts and 2 dresses made.Again, this year....we have had another shirt and dress made.Fabulous attention to detail with a warm and friendly service plus a lovely friend to to see when we are staying on holiday....we called in most days even for a chat.Sartaj, also helped us out last minute in getting a taxi to get us to the airport....plus he has introduced us to his friends too...a really lovely and caring community. We would really highly recommend Sartaj if you want the best tailor in town then pay him a visit. Ruth and Dennis"
Sheek_Emporium_Armanii_Boutique_Since_1950-Candolim_Bardez_North,Claire1234_13,5.0 of 5 bubbles,Jan 2020 • Family,Lovely clothes fab tailor amazing service,Visited Sataj and his family had 4 beautifully crafted dresses made for myself and some alterations tooAlso had a stunning  dress made for my daughter My family also cane with us on this trip and had some perfect copies of dresses made to perfectionThankyou Sataj and his wonderful team for another faultless visit to your shop we will be back next year! ❤️
Sheek_Emporium_Armanii_Boutique_Since_1950-Candolim_Bardez_North,Karol D,5.0 of 5 bubbles,Dec 2019,Wonderful tailor. Lovely friend,"I asked Sartaj to copy a skirt for me. Wow. What  a great job he did. It was perfect. So much so that I ordered another one in a different colour.  Sartaj was lovely. Got fabrics In for me to check and ensured I was totally happy. I would really highly recommend.  He is also a lovely man, great  conversation. Happy to share his knowledge. Can’t walk by without having a chat. Everytime I went in he had customers who had popped in to say hello and who were all really happy. If you want the best then come to see Sartaj."
Sheek_Emporium_Armanii_Boutique_Since_1950-Candolim_Bardez_North,skewbridge,5.0 of 5 bubbles,Nov 2019 • Couples,Excellent tailors & lovely people! ,Excellent tailors & such lovely people! Had two pairs of trousers made. I was quite fussy requesting little changes here and there. No problem at all! Couldn’t have been more helpful. Would definitely go back! 😀
Sheek_Emporium_Armanii_Boutique_Since_1950-Candolim_Bardez_North,Dermotsuks,5.0 of 5 bubbles,Dec 2019 • Couples,Great service again,Our 4th visit to Goa and would not be complete without a visit for high quality tailored outfits and jewellery from this excellent family service. Highly recommended
Sheek_Emporium_Armanii_Boutique_Since_1950-Candolim_Bardez_North,Siskin10,5.0 of 5 bubbles,Feb 2019 • Friends,Never disappoints ,"The Sheek Emporium never disappoints - had and absolutely beautiful evening dress made here.Everyone commented on how stunning it was and I felt time a million dollars in it.We have had this dress, shirts for my husband and a Marilyn Monroe dress made and have found them all to be made to a very high standard.Thank you all at the Sheek Emporium "
Sheek_Emporium_Armanii_Boutique_Since_1950-Candolim_Bardez_North,Piratepacific,5.0 of 5 bubbles,Dec 2019 • Solo,"As usual, beautiful result","Sartaj, yet again, turned out beautiful results for the two gifts I asked him to make up. First, a long stole - scarf for my daughter, made of a lovely delicate patterned and embroidered fabric. And second, a party shirt for my son in law made up of a lovely IndiGo print. Sartaj enhanced the fabric with high quality buttons and subtlely contrasting fabric on the plaque. "
Sheek_Emporium_Armanii_Boutique_Since_1950-Candolim_Bardez_North,Colin M,5.0 of 5 bubbles,Dec 2019 • Couples,Fantastic Tailor,As always Sheek Emporium  run by Sartaj was outstanding with regards to our requests for new trousers and shirts etc. His prices are very reasonable and he is well worth a visit. We have been using his services for a number of years and have always been more than satisfied with the finished garments. Highly recommended.
Sheek_Emporium_Armanii_Boutique_Since_1950-Candolim_Bardez_North,June H,5.0 of 5 bubbles,Dec 2019,"Never disappoints ""SIMPLY THE BEST""","Had some more fabulous clothes made when in Goa.  Time and time again, Sartaj never disappoints. This is a very old established business with ""excellent"" craftsmanship skills which have been handed down from Father to Son.   Had the most beautiful black chiffon evening dress made with glittering hand sewn beading on the front,  Wow!  What a ""head turner"".  Looks a million dollars!  Have received very many compliments from friends when I wear the dress.   Must mention the other gorgeous garments made such as a long blue/pink chiffon dress. What another ""gem"". Again, many compliments. Had a silk type jumpsuit made and evening tops all of the highest standard and superb!  As always over the moon and delighted.  Thank you Sartaj."
Sheek_Emporium_Armanii_Boutique_Since_1950-Candolim_Bardez_North,Hilda F,5.0 of 5 bubbles,Jan 2020 • Family,Best tailor,Very pleased with the warm service and excellent stitching. I would definitely recommend seek emporium. Wishing him all the best in 2020
Sheek_Emporium_Armanii_Boutique_Since_1950-Candolim_Bardez_North,Stuart L,5.0 of 5 bubbles,Nov 2019,Tailor made shirts,"We have been vivting Candolim for a number of years but this last trip my wife, Chris, wanted an outfit making for my daughters wedding this year and after looking on tripadvisor she decided to try Sheek Emporium.On her first visit while Sartaj was taking measurements I looked at some of the shirts he had on display and suffice to say by the time her outfit had been made at the end of the holiday, I had purchased 9 shirts for both work and casual use.Best decision I have ever made, something I should have done a long time ago, they are a fantastic fit and look and feel superb.If you are in Candolim and are looking for casual clothes or something for a special event I could not recommend them highly enough!!"
Sheek_Emporium_Armanii_Boutique_Since_1950-Candolim_Bardez_North,Nick,5.0 of 5 bubbles,Nov 2019 • Solo,Goa November 2019,"Have been visiting Sartaj for some years now...whatever your tailoring needs are, excellent quality and great , friendly service."
Sheek_Emporium_Armanii_Boutique_Since_1950-Candolim_Bardez_North,doug1945,5.0 of 5 bubbles,Dec 2019,excellent workmanship,"Had two (Nehru style) suits and three shirts made, meticulous attention to detail resulted in excellent quality. Sartaj ensured that everything went well and he was also very friendly.Would recommend them and will probably have some more made next year."
Sheek_Emporium_Armanii_Boutique_Since_1950-Candolim_Bardez_North,Carole C,5.0 of 5 bubbles,Nov 2019 • Couples,Excellent,"My partner and i visited Sheek Emporium for the first time in November 2019, only wish we found him sooner, having been to Goa for a few years. Sartaj is an excellent tailor, meticulous in his measurements, a wonderful eye for detail,and makes the most wonderful clothing. The whole experience in this shop is professional, nothing is too much trouble. My partner was having three shirts made initially, but on seeing the care and quality he decided on a total of ten shirts...... Then a leather jacket (of course I had to have a leather jacket as well)! Then my partner decided on a casual suit like jacket, closely followed by trousers. And I had the most beautiful chiffon dress, its gorgeous!I would whole heartedly recommend Sheek Emporium without any hesitation.Hope to be back soon, with more orders for beautifyl clothing."
Sheek_Emporium_Armanii_Boutique_Since_1950-Candolim_Bardez_North,iluvgoa,5.0 of 5 bubbles,Dec 2019,Apparel Perfection ,5 star service from Sataj & his team. They go above & beyond to make sure you get just what you want. Highly recommended. No other tailor for me now!!
Sheek_Emporium_Armanii_Boutique_Since_1950-Candolim_Bardez_North,Paul C,5.0 of 5 bubbles,Dec 2019,Went to have a couple of shirts made.,"I have just returned back yo the UK after a lovely holiday in candolim. Whilst visiting Goa I decided to have a couple of shirts made so I visited the Sheek Emporium after reading reviews on Trip advisor. The shop is run by a father and son team who were very friendly and spoke good english. After trawling through reams of material I chose the ones i wanted for my shirts, they took my measurements and a couple of days later my shirts were ready and I was really pleased with the results lovely attention to detail like coloured cotton stitching to match the colours on the shirt material. I was so pleased I ended up also having a jacket and two pair of trousers made. The shirts were £20 each and the trousers £30 though thats dependent on the material you choose. The jacket too the longest to make, about four days with a fitting in between. A great experiance for me due to the service I recieved I will certainly use their services again next time I visit Goa."
Sheek_Emporium_Armanii_Boutique_Since_1950-Candolim_Bardez_North,renfer133,5.0 of 5 bubbles,Nov 2019 • Couples,Great tailor,"Just got back home after visiting Sartaj yet again. Our daughter is getting married next year and me and my husband wanted something special made. Sartaj made me a beautiful dress that he made identical to a design that I took to him, he also added a lace jacket, a clutch bag and trousers. My husband got a three piece suit and seven shirts, everything fits perfectly, as it all ways does. Thank you Sartaj."
Sheek_Emporium_Armanii_Boutique_Since_1950-Candolim_Bardez_North,Navigator630701,5.0 of 5 bubbles,Dec 2019,It started with a silk cap...,Called in here to enquire about getting a silk head wrap made (very good to protect and improve hair condition while sleeping). I showed Sartaj one that I had bought in the UK. He was able to produce a matching piece with perfect fit and beautiful quality workmanship at the first attempt. I ended up buying two more. And a couple of bracelets for my daughters. I also learned a lot about life in Goa and some of the political challenges of the country in our chats. Dealing with Sartaj (and his father) turned out to be a highlight of the holiday and I have no reservations about recommending his services to others.
Sheek_Emporium_Armanii_Boutique_Since_1950-Candolim_Bardez_North,cag802,5.0 of 5 bubbles,Nov 2019 • Couples,Wedding suit,"Visited Sheek Emporium last year and had 2 shirts made that were excellent,so this year I had 4 more made along with 2 suits, all made to measure. One a black suit for general use the other a grey suit for a wedding. Really pleased with them and will be back next year"
Sheek_Emporium_Armanii_Boutique_Since_1950-Candolim_Bardez_North,CHRIS-BLLL,5.0 of 5 bubbles,Nov 2019,Perfect just perfect,Took a picture of a suit I wanted made for a wedding. It is absolutely stunning. They even made a clutch bag to match. If you want anything made at all and you want perfection this is the place for you. While I was having the suit made my hubby decided to have a couple of shirts made....we came out with 9. They fit perfect and to have these made specially for you with the advice of what trims to have ...what buttons..just amazing. I know this will be our first place to visit next time we are in Candolim. I absolutely loved the total experience   thanks guys
Sheek_Emporium_Armanii_Boutique_Since_1950-Candolim_Bardez_North,Juliet,5.0 of 5 bubbles,Dec 2018 • Family,Excellent tailor at shrek emporium in candolim Goa,Had some tailor made shirts for my dad. Excellent service and quality. Highly recommend them. Also had more made and sent over to the uk. Really fast delivery too.
Sheek_Emporium_Armanii_Boutique_Since_1950-Candolim_Bardez_North,elizabeth c,5.0 of 5 bubbles,Feb 2019 • Couples,Beautiful pear neclace,My husband bought me a beautiful 3 string pearl neclace on the last day of our holiday. Delighted with the quality and workmanship. The service we got at sheek emporiam was fantastic. We will definately be back.
Sheek_Emporium_Armanii_Boutique_Since_1950-Candolim_Bardez_North,rebeccachatfield,5.0 of 5 bubbles,Jan 2019 • Friends,Couldn’t be happier,"The most stunning engagement ring I could have imagined. Having never actually travelled to Goa myself, as this was arranged by family as a surprise, Sartaj has put in a huge amount of care and detail to ensure the ring was what we were looking for and that I’d be happy. I am over the moon, more than anything I could have asked for!"
Sheek_Emporium_Armanii_Boutique_Since_1950-Candolim_Bardez_North,Michael S,5.0 of 5 bubbles,Oct 2019,Great tailoring by the best in Goa!,"Back to visit Sartaj at Sheek Emporium!  A wonderful visit, purchased a selection of shirts, shorts, linen trousers and a jacket...all tailored perfectly and perfect fit!  Delighted as always!🌈"
Sheek_Emporium_Armanii_Boutique_Since_1950-Candolim_Bardez_North,Lynda-Candolim,5.0 of 5 bubbles,Oct 2019,"Wow, what an amazing tailor!  Fabulous stylish new dresses!","Repeat visits to Sartaj, who never fails to delight!   Whatever weight I am, he makes clothes for me that me feel fabulous!  Best tailor in Goa!! 💖"
Sheek_Emporium_Armanii_Boutique_Since_1950-Candolim_Bardez_North,goaindia1,5.0 of 5 bubbles,Mar 2019 • Couples,Fab outfit great Tailor,Sartaj is not only a fabulous tailor but also a good friend we have known him since 1998 when I bought my first outfit from him this year was a big Birthday so I wanted something special we sat together drew a picture chose the fabric but not enough beautiful lace with diamontes in but no trouble it was brought from Mumbai within a couple of days and two days later my beautiful outfit was produced it is gorgeous and everybody commented on it asking when i had got it I will attach a picture but it does not do it justice. If you go to Candolim please lay him a visit you will not be disappointed
Sheek_Emporium_Armanii_Boutique_Since_1950-Candolim_Bardez_North,Jayne Pooley,5.0 of 5 bubbles,Apr 2019 • Friends,1000% recommend Sheek Empirium Candolim,"We went to Goa in April 2019, we had been told that the tailors were very good.  Sartaj from Sheek Emporium was fantastic. I had 3 dresses and a leather jacket custom made and my Husband had 3 shirts and a jacket made, we also had a shirt made as a gift for our Son The workmanship is brilliant and the quality of the fabric was fantastic   We have both had lots of compliments on our clothes.We are returning to Goa in April 2020 and I have already starting collecting pictures of clothes designs I would like Sartaj to make"
Sheek_Emporium_Armanii_Boutique_Since_1950-Candolim_Bardez_North,jan d,5.0 of 5 bubbles,Mar 2019,More to my wardrobe.,"Last time I was,in goa, I went along to my usual tailor Sheek Emporium, for  a couple of new tops. So after trawling through numerous reels of fabrics, Sartjaj suggested that I choose a lovely chiffon for my new tops. 1 in pink and one in a lovely shade of rust and grey, with a touch of blue. Both garments turned out lovely, as per usual, lovely and light, especially for the evenings, and the warm weather.Whilst I was in Sheek Emporium I was drawn towards the jewellery counter. There  were some stunning pieces of jewellery, diamonds, emeralds, saffires, rubies, to name a few.some unusual designs, and if you have something in mind, or would like an item copied, that is not a problem. Sartaj will advise you what goes with what and to achieve the best results.A place worth visiting if you are ever in Candolim, Goa.He has an outstanding reputation."
Sheek_Emporium_Armanii_Boutique_Since_1950-Candolim_Bardez_North,KinraraCandolim,5.0 of 5 bubbles,Apr 2019 • Couples,Quality Tailoring ,"Sartaj is a honest, friendly tailor, who goes out of his way to produce quality clothing, from suits, shirts, dresses, coats, jeans. He also produces excellent wedding attire. If you have a favourite outfit, take it to Sartaj he will reproduce it for you."
Sheek_Emporium_Armanii_Boutique_Since_1950-Candolim_Bardez_North,David Taylor,5.0 of 5 bubbles,Jul 2019 • Friends,Great Tailor,Great Tailors. Had a suit made it was made to measure and fitted like a glove. High quality material and great advice from Sartaj and his dad. Also had a couple of shirts again high quality. My wife had 2 dresses and she was delighted.
Sheek_Emporium_Armanii_Boutique_Since_1950-Candolim_Bardez_North,Julie P,5.0 of 5 bubbles,Jan 2019 • Friends,Beautiful diamond ring,"A beautiful diamond ring has been made by Sartaj for our niece's engagement after sending a photo of the design. We were given great advice regarding which metal to go for and diamond sizes which would suit the design best. Once the ring was made a photo was sent to us and on our approval arrangements were made to get the ring to us. We were blown away when we saw it, the photos didn't do it justice, its stunning. My niece's boyfriend is over the moon and I cant wait to see her face when she the gorgeous ring that's been made for her - lucky girl! Thanks Sartaj"
Sheek_Emporium_Armanii_Boutique_Since_1950-Candolim_Bardez_North,NicoIrvine,5.0 of 5 bubbles,Feb 2019 • Business,Best Tailor in Goa,"Am at regular visitor to Sartaj and his Father ‘s Tailor in North Goa.You always get a warm welcome and excellent service from a very skilled team....Have had suits and shirts all made to measure , all excellent quality and tailored to your needs .Certainly can recommend without question."
