Tourist Attraction,Name,Rating,Date and criteria,Title,Review
Tomb_of_St_Francis_Xavier-Old,suryaanaarainsingh,5.0 of 5 bubbles,Apr 2018 • Family,Lovely,if you have one place in goa to do site seeing go here.Its a beautiful church with remains of  St Francis.Church dates from the 17th century and is one of the oldest churches in India. Its beautiful!!
Tomb_of_St_Francis_Xavier-Old,sandra n,5.0 of 5 bubbles,Mar 2018 • Couples,Special reason to visit this Basilica,"Important part of visiting the Basilica of Bom Jesus, you will be remembering your journey to a historic place and the rare opportunity to experience this special connection with the beloved St. Francis of Assisi.  See my review under Basilica of Bom Jesus."
Tomb_of_St_Francis_Xavier-Old,Amy K,5.0 of 5 bubbles,Apr 2018 • Family,worth the visit,"enjoyed the visit.. it was fairly busy but enjoyable visit, people were pinic at the front.  full of history and some awesome paintings"
Tomb_of_St_Francis_Xavier-Old,Puneet M,4.0 of 5 bubbles,Apr 2018 • Family,Nice experience !,Do visit this place if travelling to Goa.  Take a guide along with you who will charge just Rs 100 but will share you the history of that place which you will not know otherwise
Tomb_of_St_Francis_Xavier-Old,Dishaa S,4.0 of 5 bubbles,Mar 2018 • Family,basilica of bom jesus,the gothic architecture of the building is suoerb. the red stoned exterior lends it an awe inspiring look. inside there was a calmness and one could come out in 10 mins.
Tomb_of_St_Francis_Xavier-Old,CherylandBrett,4.0 of 5 bubbles,Apr 2018 • Couples,Historic church with body under glass,"Beautiful architecture, ancient and historical.  Lots of art and paintings, no entry fee.  Not very well maintained.  The glass viewing case contains the “remains of St. Francis Xavier.”"
Tomb_of_St_Francis_Xavier-Old,Elegantslummin,4.0 of 5 bubbles,Dec 2017 • Family,Excellent old-time architecture laced with history,This is the place that has a lot of religious fervour and history and has the undecomposed/incorrupt body of St. Francis Xavier in a glass container encased in a silver casket which is mostly kept elevated in the Basilica of Bom Jesus and kept on ground level during Exposition.
Tomb_of_St_Francis_Xavier-Old,Nitinca2018,5.0 of 5 bubbles,Apr 2018 • Family,"""Basilica of Bom Jesus"" Peaceful Holly Place","It's a historical place having best architecture and spirituality. Basically its a tomb of St Francis Xavier whose body are still as it is even after death of Many years without any chemical and Masala, even Vetican city declare it as miracle.In the church there is a audio picture show on the entire life of St Francis Xavier with having Nominal fee of Rs 20."
Tomb_of_St_Francis_Xavier-Old,Kunal Nair,5.0 of 5 bubbles,Apr 2018 • Couples,Historical spot must visit,The Tomb is located in Old Goa and is easily rideable from calangute which we did. There’s no entry fee however there will guides who will charge for a short tour on the details and significance of the place. A little research on google can help you though. There’s also and art gallery on the first floor of the building. 
Tomb_of_St_Francis_Xavier-Old,Jaya03,4.0 of 5 bubbles,Mar 2018 • Family,Interesting place in 5 words,"I would like to describe in five words-architectural, ancient, historical, religious, and stupendous."
Tomb_of_St_Francis_Xavier-Old,Preeti C,4.0 of 5 bubbles,Jul 2017 • Friends,"Interesting Piece of Religious history and architecture ,also houses paintings","Also know as the Basilica of Bom Jesus ,this is a very old church and houses the relics of Saint Francis Xavier .There are lot of paintings depicting the life and times of Saint Francis Xavier which makes for interesting viewing ,unfortunately there is no description in English and it will be a good idea to hire a guide or get some literature that could help in understanding the various exhibits .The place is definitely worth visiting for its historical importance and architecture .No entry charges are there and if you wish to visit the art gallery housed inside the premises , there is a minimal charge of Rs 5 only per head . There is no dress code but it would be a good idea to dress modestly ."
Tomb_of_St_Francis_Xavier-Old,thomas t,4.0 of 5 bubbles,Mar 2018 • Family,Old Monument,This is the place where the body of St. Francis is kept. Christians going to Goa must visit.It is about 14 K.M from Panjim city 
Tomb_of_St_Francis_Xavier-Old,Gopakumar1981,4.0 of 5 bubbles,Mar 2018 • Family,A must visit if you are in Goa,Only the relics remain of St.Francis Xavier. The area is not maintained well and the crowds are not managed properly. The relics are placed at a height and may not be able to be viewed properly.It is an important tourist location. it is a must visit place located in old Goa.
Tomb_of_St_Francis_Xavier-Old,MamaT23,5.0 of 5 bubbles,Apr 2017 • Family,Devotional Site,"A very religious and sacred church.The church is located in Old Goa, which was the capital of Goa in the early days of Portuguese rules. St. Francis Xavier's  body is now in the Basilica of Bom Jesus in Goa, where it was placed in a glass container encased in a silver casket"
Tomb_of_St_Francis_Xavier-Old,mum,4.0 of 5 bubbles,Mar 2018 • Family,The Basilica of Bom Jesus,Situated in Old GOA. It is of historical importance. It has the relics of St. Francis Xavier which is kept for public viewing once in every 10 years. Photography is allowed but taking selfies or group-fie is not allowed inside the church.
Tomb_of_St_Francis_Xavier-Old,janardhanan n,4.0 of 5 bubbles,Feb 2018 • Couples,A very popular tourist attraction,"The relics of St.Francis Xavier in Bom Jesus Basilica is a pilgrimage attraction for believers. The body of the saint is kept for public viewing once in ten years on 3rd,December ."
Tomb_of_St_Francis_Xavier-Old,asis2015,5.0 of 5 bubbles,Feb 2018 • Family,One of the best examples of baroque architecture in India.,"The church is located in Old Goa, which was the capital of Goa during Portuguese rules. The basilica holds the mortal remains of St. Francis Xavier. The remains of the saint still attract a huge number of tourists, irrespective of religion, from all over the world,"
Tomb_of_St_Francis_Xavier-Old,Krishnan U,5.0 of 5 bubbles,Mar 2018 • Family,Basilica of Bom Jesus,The Basilica of Bom Jesus has the relics of St. Francis.It is a functional Church and go with modest dress and maintain silence
Tomb_of_St_Francis_Xavier-Old,Praveen Kamble,5.0 of 5 bubbles,Mar 2018,Non Decomposing Body of a Saint,"St. Francis Xavier, who teached gospel to many in the portuguese period around 500 years back. His body is buried in bom Jesus Church and is still in non-decomposing state. He is regarded as one of the greatest scholar to spread Christianity in India. "
Tomb_of_St_Francis_Xavier-Old,Vivson,4.0 of 5 bubbles,Mar 2018 • Family,Tomb of St. Francis Xavier,One of the prominent site to visit when in Goa.The site is full of history and with open grounds which can cater to the visitors. The visit was smooth in terms of visiting the tomb and offering our prayers.
Tomb_of_St_Francis_Xavier-Old,Santosh J,5.0 of 5 bubbles,Mar 2018 • Family,Visit,"A beautiful historic place with many statues and paintings. A world Heritage site where every visitor should visit.Only feedback is that the place should be restored and maintained well. Visitors should abide by rules, mainly of clothing and photography"
Tomb_of_St_Francis_Xavier-Old,DAVID J,4.0 of 5 bubbles,Feb 2018 • Solo,Looks great,This church houses the remains and coffin of St. Francis Xavier. This church has an aesthetic experience and it's a marvelous piece of Portuguese architecture.The red-bricked walls is the key striking feature of this church. The altar is beautiful.There is an art museum on the top floor. Entry fee is Rs.5.  Though the art gallery is very minimal (statues of various saints etc) you can take a quick stroll.Vehicles are not allowed inside. You've to park your vehicles on the nearby roads.
Tomb_of_St_Francis_Xavier-Old,rishabh1020,4.0 of 5 bubbles,Jan 2018 • Family,A place to visit,It is one of the best place to visit in Goa. The body is preserved in here. This place was a lot crowded when we visited it. However overall it was a good experience.
Tomb_of_St_Francis_Xavier-Old,Hamish J,5.0 of 5 bubbles,Feb 2018 • Couples,Saint Francis of Assisi,Its well worth the time to visit this old Cathedral - well maintained and speaks volumes of the past.  I found it quite an emotional experience ( I am not religious) - peaceful and awesome
Tomb_of_St_Francis_Xavier-Old,rakeshs_ca,1.0 of 5 bubbles,Feb 2017 • Family,You decide,Saw the church with my family originally in 2006. Thought of it as one of the places to visit in Goa. Recently visited Goa again and did some reading up on this Saint and the Goa Inquisition. Had I known I would have given it a skip.
Tomb_of_St_Francis_Xavier-Old,grazytraveller,5.0 of 5 bubbles,Oct 2017 • Family,The Body of St. Francis Xavier is preserved here.,This tomb of St. Francis Xavier is Located inside the BOM Jesus of Basilica. The Body of St. Francis Xavier is preserved here.
Tomb_of_St_Francis_Xavier-Old,maria cecilia z,5.0 of 5 bubbles,Jan 2018 • Friends, Nice visit," Quite an interesting visit. Somewhat crowded, but that was to be expected. A European visit in India"
Tomb_of_St_Francis_Xavier-Old,Dinesh_cbe,5.0 of 5 bubbles,Dec 2017 • Friends,Elegant and Beautiful !,Great workmanship of Portuguese structure. Interior is totally amazing - lovely architectural works. Very peaceful and historically important place.
Tomb_of_St_Francis_Xavier-Old,PSurendraP,4.0 of 5 bubbles,Jan 2018 • Couples,Old Goa,"An imposing structure of ultimate historic value, felt great visiting this awesome cathedral. Saw the mummified remains too."
Tomb_of_St_Francis_Xavier-Old,Jackie C,5.0 of 5 bubbles,Jan 2018 • Friends,beautiful,"very interesting the building doesn't look much from the outside but once inside wow stunning to say the least,  Interiors are mostly in gold stunning.  Go early as it can get very busy.  I just wished mass would have been on when we were there."
Tomb_of_St_Francis_Xavier-Old,Avina V,4.0 of 5 bubbles,Dec 2017 • Solo,Candles look divine,"The church is huge architecture and an enormous structure, beautifully preserved till date. In it lies the well preserved dead body of St. Francis, in a tomb, at a big height. The candles are lit outside in a given area. The church is clean and a major tourist attraction."
