Tourist Attraction,Name,Rating,Date and criteria,Title,Review
Tomb_of_St_Francis_Xavier-Old,Baskar,4.0 of 5 bubbles,Aug 2022,Nice Basilica,We had taken the help of a guide. He explained how St. Francis Xavier's body is kept. Saw Baby Jesus and St. Ignatius. 
Tomb_of_St_Francis_Xavier-Old,David,4.0 of 5 bubbles,Jul 2022 • Couples,Beautiful church,"Beautiful church with nice staff. Photos are not allowed on the inside sadly. If you go past it, definitely worth a visit. The staff is knowledgeable of the churches history "
Tomb_of_St_Francis_Xavier-Old,Biju Nilgiris,4.0 of 5 bubbles,Feb 2020,Good one,Good architecture and it's an old churh from portughese era. It's easily accessible from Main road. Good to visit as part of south goa trip.
Tomb_of_St_Francis_Xavier-Old,Travelingmonkie,3.0 of 5 bubbles,Feb 2020 • Friends,Bom Jesus cathedral,"Apart from the interesting history, the cathedral is about the only tourist stop worth visiting in Old Goa. We paid 5 rupees to have a look at surrealistic art and some photography. I wish there were captions to the paintings as well as some explanation. It was crowded with many school children going there on a picnic. Entrance to the cathedral is free. "
Tomb_of_St_Francis_Xavier-Old,Gregg P,3.0 of 5 bubbles,Jan 2020,Disappointing,We travelled for over an hour to see this and quite frankly thought it a complete waste of money. Beware the guides who rip you off for a 10 minute fly by.
Tomb_of_St_Francis_Xavier-Old,Prem Kumar,5.0 of 5 bubbles,Feb 2019,Bom Jesus Church Nachinola,The church chapel is pretty big and it can accommodate more than 500 people for the mass. The interiors are really well architecture by the Portuguese who built this church.
Tomb_of_St_Francis_Xavier-Old,Udayan Banerjee,5.0 of 5 bubbles,Oct 2019,A Must see place in Goa!,I can safely say that our trip to Goa would have been incomplete without a visit to the Basilica of Bom Jesus and the tomb of St. Francis - it was wonderful to experience the peace and upliftment that we experienced during our visit as well as learning about the history of Goa!
Tomb_of_St_Francis_Xavier-Old,Vikram Malhotra,5.0 of 5 bubbles,Sep 2019,A must visit in Goa..,"No trip to Goa is complete without visiting the ""Basilica of the Bom Jesus"" or ""St. Xavier's Church"". The Church looks beautiful from the outside always, and has managed to stay peaceful and quiet in the Church. Doing a guide helps with some historical facts. Its a 10 mins tour inside, Guide is useful, though not mandatory. The tomb of St Xavier can be seen in the church. It is brought down every 10 years, with the next one being in 2024."
Tomb_of_St_Francis_Xavier-Old,Vikul Gupta,5.0 of 5 bubbles,Sep 2019 • Family,Must visit place in old goa,It's really very nice and very great historic place. We hire a guide and he told us too much about the history of this tomb. Must visit place if you are in Goa. 
Tomb_of_St_Francis_Xavier-Old,Jitecious,5.0 of 5 bubbles,Sep 2019 • Solo,Architecture & Stories Filled,"A beautiful Church with lot of things to know from ancient times, Tomb of St Xavier something unusual for all the visitors to this church, architecture of the church is very beautiful and monument as well. Must visit for peace and knowledge."
Tomb_of_St_Francis_Xavier-Old,Jacqueline d,5.0 of 5 bubbles,May 2019,Timings to visit,Best time to visit is between 3 pm to 5 pm as in the morning it's cowded with tourist. Restaurants around the area are not up to the mark and very expnsive.
Tomb_of_St_Francis_Xavier-Old,Eksteen,5.0 of 5 bubbles,Sep 2019,A Spiritual Experience,Great to see the place where this famous man served in real life. You get to know all the important information on notice boards inside and outside. Decorations inside are beautiful and well maintained. It is also unusual to see the body of this saint from a distance! A must see!
Tomb_of_St_Francis_Xavier-Old,meenakshimuthusamy,5.0 of 5 bubbles,Jul 2019,Very beautiful place,The place is very good and have a nice look over all.Nice to have a visit and nice to know what the place is.
Tomb_of_St_Francis_Xavier-Old,Jyoti goel,5.0 of 5 bubbles,Jul 2019 • Family,A must visit,We visited the church on our trip .The church has a beautiful history and it gives you peace . I would recommend everyone to pay a tribute in the church if you are in goa
Tomb_of_St_Francis_Xavier-Old,Dobanjare,4.0 of 5 bubbles,Jun 2019,Good place to see,This place is huge and you will see a lot of people here. Taking pictures over here is allowed but they ask you not to take selfie and pictures of others visitors. You can see this place in Old goa along with many other churches.
Tomb_of_St_Francis_Xavier-Old,700morgan,5.0 of 5 bubbles,Apr 2019 • Couples,Must see,Calm peace tranquility reverence zen. Whatever your inner restful reflective state you won’t be disappointed.
Tomb_of_St_Francis_Xavier-Old,Rashid Isa Rishi AlHeddi,5.0 of 5 bubbles,Mar 2019 • Friends,Church in Old Goa,"In this holy place tests the mortsl remains of St. Francis Xavier revered by people worldwide.It’s a lovely old building and its important to know that you must buy candles well outside the premises as the shop in the building does not sell candles only Catholic books, crosses , pictures etc.Very peaceful place and yet used for Church services regularly and Newly weds regularly visit to seek Blessings.Lots of old artifacts also displayed in adjoining rooms.A must see place for visitors to Goa of all faiths."
Tomb_of_St_Francis_Xavier-Old,jim m,5.0 of 5 bubbles,Mar 2019 • Couples,worth a long stop,"This is a very unusual place and much bigger than you think.  We did not have enough time.  It is free but there are rules - you can take photos but there are lots of signs saying no selfies - no photos of people.  It is a place of history and religious importance. It has relics and the body of St Francis Xavier but it has much more.  It is being restored and so is different than some of the TripAdvisor photographs. Inside is a strange mix of art and sculpture that range from the very bloody crucifixion, relics, intricate stone work and nativity scenes that look like they are from a garden centre.  Worth going to the toilet - or rather following the signs to them as they lead to a shady courtyard with seating that gives a nice break.  Many sellers on the streets outside trying to sell postcards etc but the second you go through the gate they leave you alone."
Tomb_of_St_Francis_Xavier-Old,joannacharris,3.0 of 5 bubbles,Mar 2019 • Couples,worth a quick stop,we couldnt see much as a service was taking ace so we couldnt go inbut what we saw was nice and the architecture outside was interesting 
Tomb_of_St_Francis_Xavier-Old,manoj k,5.0 of 5 bubbles,Feb 2019 • Couples,The body of Francis Xavier are kept here,The body of Francis Xavier are kept here. people come here to see the body and pray for their  well and future wishes. 
Tomb_of_St_Francis_Xavier-Old,CoolTravelFreak,5.0 of 5 bubbles,Aug 2018 • Couples,Historical Value,"This is a place where the remains of St. Francis Xavier are kept in a coffin ,, worth a visit for every tourist .. be sure to be there "
Tomb_of_St_Francis_Xavier-Old,Ged P,4.0 of 5 bubbles,Feb 2019 • Couples,A little piece of history,Ex student of the Sorbonne in Paris and founder of the Jesuit church. Whilst you can't really see the mummified body in its crystal coffin above head height it is certainly worth visiting when you take a tour of the Bom Jesus edifice.It was interesting to see a large number of pilgrims taking comfort by touching the photographs of his mummified body in the antechamber on the left.
Tomb_of_St_Francis_Xavier-Old,Mercy’s Local Food Adventure,5.0 of 5 bubbles,Feb 2019 • Family,Holy Pius Groundsm Blessed to be Visiting and Praying at this Sacred Grounds,"To me, this was a Holy Pius Grounds.Am Blessed to be Visiting and Praying at this Sacred Grounds. The incorrupt body of St Francis Xavier was a visit worth the trip...So serene,, so sacred and hol. Would recommend this to every visitor to Goa, a MUST SEE church, especially when we were flying in from another country.... ..... God bles"
Tomb_of_St_Francis_Xavier-Old,Suvarghya,4.0 of 5 bubbles,Jan 2019 • Family,Historical place,"This is a historical place with an ancient mummy kept inside the church, a popular place for tourists. "
Tomb_of_St_Francis_Xavier-Old,Tarushi Thakur,5.0 of 5 bubbles,Feb 2018 • Family,Quiet and serene place,Everyone visiting Goa must take a break from the beaches and come to this place. I still remember the calmness and purity of this church.
Tomb_of_St_Francis_Xavier-Old,KevanEastYorkshire,4.0 of 5 bubbles,Dec 2018 • Couples,Worth seeing,Its an old portugese basilica with the tomb inside. Its not really 'indian' but from  an historical perspective has significance. Lots of local Christain Indians visit and make the atmosphere. Enjoyed a walk around. No entry fee.
Tomb_of_St_Francis_Xavier-Old,anewmoon,4.0 of 5 bubbles,Nov 2018 • Solo,Peace and Beautiful Church!!!,"Peaceful and Beautiful Church on my trip to Goa, the remains of St. Francis Xavier is preserved in a tomb and people have access to it, there is a museum and entry fee is Rs.10. Must watch"
Tomb_of_St_Francis_Xavier-Old,Amit P,5.0 of 5 bubbles,Dec 2017 • Family,Goa Trip,Nice to See Amazing Experience.  Very Quite & Clean Place. Very big area. Must visit when you visit to Goa.
Tomb_of_St_Francis_Xavier-Old,Jaimala W,4.0 of 5 bubbles,Nov 2018,Visit if you like historic sites,"This church is located in Old Goa.It has two parts, the old church and then there's the new one on the other side of the road. This church has St. Francis Xavier's body."
Tomb_of_St_Francis_Xavier-Old,Weedsatdenstone,3.0 of 5 bubbles,Oct 2018 • Couples,Quaint...,"A need to be seen item in old Goa. An old faded church with faded items… it will not dazzle you, but it will give an insight into the Portuguese enclave of Goa"
Tomb_of_St_Francis_Xavier-Old,Indian Ghummakad,4.0 of 5 bubbles,Oct 2018 • Friends,"Historic Site ""Tomb of St Xavier""",Church is Historic and Made in 1605. Coffin of St Xavier is kept inside in Casket. 400 Yrs ago St Xavier Passed away but his Coffin kept safe and as per information every 10 Years time they open this box of Coffin. There will be big event during these time.  It is worth visiting place if you are in Goa don't miss the chance to be there. Thanks & Regards Anil Thakur 
Tomb_of_St_Francis_Xavier-Old,GenuineFeedback74,4.0 of 5 bubbles,Oct 2018 • Family,Must visit heritage site ,"This church is located in Old Goa. While it might seem like just another church , what sets this church apart from other churches is that St. Francis Xavier's body lies here in a casket after St. Francis passed away his body was not cremated but kept in the casket. Each year his body is shrinking. The saying goes that the world will end the day his body shrinks completely You must visit this church if you are in Goa "
Tomb_of_St_Francis_Xavier-Old,Chetan_Konda,5.0 of 5 bubbles,Nov 2017 • Couples,Long drive along with Ferry,This is one of the must visit place in Panjim. We can see the tomb of St xaviers at this place. There is lot of art in this place. There is shopping in the surroundings. We must experience the ferry in the nearby within 1 or 1.5 km distance which crosses the river to reach the island. the ferry ride is just for 5 minutes & more interesting to travel on it.
Tomb_of_St_Francis_Xavier-Old,Zarin S,5.0 of 5 bubbles,Oct 2018 • Friends,Tomb of St. Francis Xavier,This is one of the main attractions if you are visiting Goa.  Years ago when I had visited it the body was kept outside.  Now its in a cascade.
Tomb_of_St_Francis_Xavier-Old,SreejithSreekumar,4.0 of 5 bubbles,Oct 2018 • Friends,Good architecture ,Place is a good visit. Very well kept. Have a semi museum feel. Guides are available and have reasonable rate. 
Tomb_of_St_Francis_Xavier-Old,1Jayanthi,5.0 of 5 bubbles,Sep 2018 • Friends,Must visit place in Goa,The body remains of St.Francis Xavier is kept inside the Basilica of BoM Jesus at Old Goa in a box with little glass panels. Once a year the body is kept for public view in a glass casket when lakhs of people visit and pay homage.
Tomb_of_St_Francis_Xavier-Old,Gaurav C,4.0 of 5 bubbles,Nov 2017,blessed,what a nice experience one has in this church...it makes it even more interesting having studied in st. xavier school delhi...the body has been preserved nicely ...the architecture is amazing..
Tomb_of_St_Francis_Xavier-Old,RSpicer,4.0 of 5 bubbles,Sep 2018 • Friends,Our Viking included tour,Our Viking excursion included the tomb of St Francis Xavier church and the SE cathedral. Both were well worth seeing. It helps to have a good tour guide to give you background information about both sites. 
Tomb_of_St_Francis_Xavier-Old,Anjan Sengupta,4.0 of 5 bubbles,Aug 2018 • Family,Real Wonder!!!,Its a Real Wonder that the Body of Francis Xavier is nicely preserved for hundreds of years at this place. The old architecture of the Church Building adds more charm to it.A must visit place in Goa.
Tomb_of_St_Francis_Xavier-Old,bjroaming,3.0 of 5 bubbles,Aug 2018,An interesting church and space,The ability to see the actual body and coffin is very limited but the space gives a view of the old styles and lovely setup in this space. The very very thick walls really impressed me
Tomb_of_St_Francis_Xavier-Old,SydneyPinto,5.0 of 5 bubbles,Aug 2018 • Solo,St Francis Xavier ,I have visited the St Francis Xavier shrine several times and each time I visit here I feel blessed. The feeling here is something which can't be described.Tourist throng here some end up by default as per the tourism itinerary others trek here as a pilgrimageI being a catholic it holds special relevance and I feel enlightened coming hereThe surrounding to is beautiful and typically PortugueseI am happy the structures are cared for and will easily see several more centuries 
Tomb_of_St_Francis_Xavier-Old,Koteswara Rao,3.0 of 5 bubbles,Jun 2018,good architecture,its nearly 4 floor height building and building such a tall church in those days looks something different. one doesn't get to see such things quite often.
Tomb_of_St_Francis_Xavier-Old,reubenranjanfern2017,5.0 of 5 bubbles,Aug 2018 • Family,Nice architecture.,One of the very old church. The structure has been maintained and place is clean and tidy. One can have the opportunity to see the body of St. Xavier in this church.
Tomb_of_St_Francis_Xavier-Old,Alok Nahata,4.0 of 5 bubbles,Dec 2017 • Couples,Tomb of St Francis Xavier,One of the main places of Goa where lot of tourists come everyday to pay their respects to the tomb of St Xavier. You can see the body of St Xavier in this church.
Tomb_of_St_Francis_Xavier-Old,ayyagari2015,4.0 of 5 bubbles,Aug 2018 • Family,"St.Xavier,a spanish Roman catholic Saint, Phylosopher","Nice to see this old monument church/tomb. Though you may not be able to see the body fully,since it is at a height, the knowing about the saint and his demise at that place due to fever while on his way to china with a mission to spread peace and love will make you admire . "
Tomb_of_St_Francis_Xavier-Old,Cliff F,5.0 of 5 bubbles,Dec 2017 • Family,A true Treasure of Goa!!,"A trip to the Basilica is must on your to do list on a visit to Goa, to catch a glimpse of the body of St. Francis Xavier. The Architecture of the Basilica itself is worth the visit. Coming in December during the feast of St.Francis Xavier is an experience in itself, if you do not mind being in a crowd."
Tomb_of_St_Francis_Xavier-Old,KumarVK,3.0 of 5 bubbles,Aug 2018 • Friends,World heritage site in Bad Shape,Well known place of worship in Panjim GOADeclared as UNESCO world heritage site The church is neglected from outside and structure needs restoration 
Tomb_of_St_Francis_Xavier-Old,Sharesarun,5.0 of 5 bubbles,Aug 2018 • Friends,A taste of history,This was the first place we visited in Goa on our tour. It was amazing to view fro the outside and the peace and calm inside the church was such a blessing. We spent more than an hour wandering the huge grounds and gardens.
Tomb_of_St_Francis_Xavier-Old,Indiviking,3.0 of 5 bubbles,Jul 2018 • Family,Historical Relevance,Ordinarily maintained. Can generate higher revenue by charging tourists a nominal amount and thereby ensuring world class tourist facilities. 
Tomb_of_St_Francis_Xavier-Old,VJha72,3.0 of 5 bubbles,Aug 2017 • Friends,Beautiful but noisy due to tourists,"While it may be a tourist attractive, it is after all a church & a holy place. They should ensure a code of silence in reverence to St. Xaviers & the historical, religious significance that it has.Though being a Hindu I am used to noisy temples, but also having been educated in a convent, I understand the value of silence in a Church. I request all tourists to preserve the sanctity of the place. Its a beautiful building architecturally and a must visit in Goa."
Tomb_of_St_Francis_Xavier-Old,Nelvis R,5.0 of 5 bubbles,Dec 2017 • Friends,Ancient Tomb,This is the ancient Tomb of Saint Francis Xavier who has been kept in the Silver Castle. It is also called as Bom Jesus of Basilica. People from around the world to visit this place to see its rich history and heritage. This place is also marked as world heritage monument. So if you happen to visit the old Goa make sure you do not miss to visit the Tomb of Saint Francis Xavier. This place is easily accessible from Panaji and also there are buses plying to this place. Hence you need not need a taxi or any tourist vehicle to be hired. This place dates back during the Portuguese rulership and you will find a lot of history or historical information at this place. You will also find a lot of paintings with a lot of information. 
Tomb_of_St_Francis_Xavier-Old,Thomasachen,5.0 of 5 bubbles,Apr 2018,AMAZING,VISITED this church with my family. It was a sunday and very crowded. would have preffered to visit some ither day when it would have been possible to sit and imbibe the beauty of its architecture and its rich heritage.
Tomb_of_St_Francis_Xavier-Old,syed_vasim_s,5.0 of 5 bubbles,Dec 2017,Old rustic church,I visited with friends in december 2017. The architecture of the tomb is very well preserved. It is the place where the body of the saint is preserved. The place was teeming with tourists
Tomb_of_St_Francis_Xavier-Old,Mariette B,5.0 of 5 bubbles,Jun 2018,mariette bouwer & Nancy Naidoo,"This is a must for a visit to Goa. We arrived just after sunday morning mass, one of the Indian, prime ministers were there for prayer and blessing.  We went through the church, prayed, lit candles for family, offerings, and purchased some treasured memories for family members."
Tomb_of_St_Francis_Xavier-Old,Gillian d,4.0 of 5 bubbles,Jun 2018,Excellent heritage site,"I just wish they maintained a level of silence to actually allow people to pray in the Basalica , and had more detailed hoardings on its history and architecture, either way still loved the experience "
Tomb_of_St_Francis_Xavier-Old,Shoeb S,5.0 of 5 bubbles,Mar 2018 • Friends,Religious and Historic,"One should visit the church, You cannot take self y inside the premises..very calm place you can spent some time for yourself."
Tomb_of_St_Francis_Xavier-Old,Darryl Gonsalves,4.0 of 5 bubbles,Jun 2018 • Family,The iconic church of Goa,"One of the oldest church of Goa the Basilica of Bom Jesus is where tourists flock to every time they visit Goa. This huge church is well maintained even after hordes of tourist step in to have a look at the church. I, however, am miffed at some people's sheer lack of civic sense in abiding the rules maintained by the church to preserve the church's heritage. One should take enough time to browse through the main hall as you enter and slowly make your way to the elaborate gilded altar where on the right is the mortal remains of St. Francis Xavier enclosed in an ornate silver casket guarded by cherubs. If you look closely you can see the mortal remains through the windows in the sarcophagus. Enter inside to a gallery that features the day to day items worn by the revered saint and some painting depicting his life. Exit to the inside courtyard where you can buy some souvenirs of your visit or check out the video show. The backdoor exit leads to the grotto depicting the apparition of Our Lady of Lourdes to Bernadette with a water cascade offering a soothing soundtrack. The toilets can be accessed further back but are in a sorry state due to lack of civic sense in most tourist using the facility to clean up after they have used the facility."
Tomb_of_St_Francis_Xavier-Old,want_2_c_d_world,4.0 of 5 bubbles,Jun 2018 • Family,Well kept place,Basilica of Bom Jesus is well preserved and the whole area is very clean and tourist friendly. I recommend a visit for anyone travelling to Goa.
Tomb_of_St_Francis_Xavier-Old,Rempt2,4.0 of 5 bubbles,Jun 2018 • Family,Beautiful church and setting,This is one of the places I definitely wanted to visit.  The church was lovely and seeing the tomb of St. Francis Xavier was an experience.  He is so famous in the US.  Many children of Catholic Parentage are named after him.  The tomb of the saint isn't easily viewed as it is just above eye view.  The grounds cover a large area and I enjoyed the setting especially of our Lady of Lourdes.  The side of the building is perfect for having a picnic lunch.  One the upper floors is a very nice museum containing wood statues previously used in the church.  There is also murals of St. Francis Xavier's life and some sketches of the interior of the church.  It is only 10 rupees which is a good price.  I offered a donation but the woman at the desk refused.  The church overs so much history of the area.  Across the street is an archeological museum which I didn't get a chance to see.
Tomb_of_St_Francis_Xavier-Old,chandru s,4.0 of 5 bubbles,May 2018 • Friends,Historic and religional,The church which is one of the oldest churches of india share an historical inportance. As the st.Xavier who visited india to preach Christianity died of fever. He is still preserved in an concealed chamber. There's also an chapel there where masses are conducted. Also there is an museum. An example for well structured construction.
Tomb_of_St_Francis_Xavier-Old,Ron R,4.0 of 5 bubbles,Jun 2018 • Solo,Historical.,"The tomb is set in an old church which is well worth visiting in itself.  There is a coffin which apparently contains the remains of the saint, although I remember visiting a site in Malacca which also claimed to have held them at some stage, then stated they were removed to Rome."
Tomb_of_St_Francis_Xavier-Old,Yash G,5.0 of 5 bubbles,Jun 2018,Good old church .,It is a good church situated in old Goa. I recommend travellers to take a guide with then ( you will find many in the church) he will tell you about everything .
Tomb_of_St_Francis_Xavier-Old,venkrish,5.0 of 5 bubbles,May 2018 • Family,well maintained,historical place worth visiting. well maintained and good guides to explain the historical importance of the place.
Tomb_of_St_Francis_Xavier-Old,ajayajmera,4.0 of 5 bubbles,May 2018 • Family,Avoid on public holidys.,Must visit if its your first time at Goa.  A bit crowded on public holidays.  Entry is quick.  Get ample time to observe everything.  Good for photography.
Tomb_of_St_Francis_Xavier-Old,Milan Patel,4.0 of 5 bubbles,Jul 2017 • Friends,Very popular and interesting,Situated just besides the Basilica of Bom Jesus is also very popular and interesting place to be visited by number of tourists every year.
Tomb_of_St_Francis_Xavier-Old,viral06,5.0 of 5 bubbles,Apr 2018 • Couples,Religious place ,Tomb of st. Francis xavier is religious place. Very nice church and well maintained. Very good cleaning and clam place. 
Tomb_of_St_Francis_Xavier-Old,Luftkrieger,5.0 of 5 bubbles,May 2018 • Solo,Magnificent!,I wasn't expecting to see so many churches in Goa. This is probably one of the most famous because the basilica holds the mortal remains of St. Francis Xavier. 
Tomb_of_St_Francis_Xavier-Old,naveenlalam,5.0 of 5 bubbles,Dec 2017,Bleesed to be in Tomb of St. Francis Xavier,A sacred place and I would suggest everyone who is visiting Goa to visit this place.The travel from Candolium to Old Goa is approximate 30 mins.
Tomb_of_St_Francis_Xavier-Old,JUGAAD H,5.0 of 5 bubbles,May 2018 • Couples,Oooh Good,"Tomb of St Francis Xavier in the Church of Bom Jesus, Goa, from the Lee-Warner Collection: 'Bombay Presidency' taken by an unknown photographer in the 1880s. Born in Navarre, Spain, St. Francis Xavier (1506-52), was a former pupil of St. Ignatius Loyola, founder of the Jesuit order; he was ordained in 1537 and came to Goa in 1542. During his time in Goa, St. Francis was credited with nursing the sick, founding numerous churches, converting thirty thousand people as well as performing miracles. Later he went to Sri Lanka, Malaysia, China and Japan to carry on his missionary work. St. Francis died in 1552 at Sancian Island off the coast of China at the age of 46; his body was later moved back to Goa. The tomb, the gift of the Grand Duke Cosmos III of Tuscany was carved by the sculptor Giovanni Batista Foggini; it took ten years to complete and was erected in 1698. Constructed of jasper and marble, the tomb was set out in three tiers: base, mausoleum and casket. The bronze plaques in the middle depict scenes from the life of St. Francis, and in front of the casket is a fine silver statue of the saint. The interior of the chapel is richly ornamented with carved detail and paintings illustrating scenes from the saint’s life. Once in a decade, the saint’s remains are displayed to the public on the anniversary of his death, 3rd December"
