Tourist Attraction,Name,Rating,Date and criteria,Title,Review
Tropical_Spice_Plantation-Ponda_North,Sahil M,5.0 of 5 bubbles,Dec 2022 • Family,"Don’t touch the cats, but enjoy the peaceful time learning about spices","If you are interested in learning about spices, to try a Goan buffet that is good and to enjoy some time off in a quiet place, this is the place to go. Even during the day time, the shade of trees meant it’s not too hot. Just be careful not to pet the cats, they are stray and may bite (and you would need rabies shots). But that goes for all places in India and around the world"
Tropical_Spice_Plantation-Ponda_North,Jk N,1.0 of 5 bubbles,Nov 2022 • Couples,Waste of Time and Money,"Waste of Money & time. Go any where in Goa or either take rest in hotel room but never make mistake of visiting these place. Entry fee Rs.500 per person against which you will get unhygienic, unhealthy food been served at place where there is no cleanliness, dogs are sitting on table . No welcome drink or no proper cooperation once you pay. Its all commission business that taxi people get paid for bringing tourists at such terrible place. Welcome drink serve after half hour coz they wait for more tourists together so they prepare drink for all at a time. Food quality is also horrible, smelly bread . Sitting arrangements is also worst . All tables are broken . In short Goa tourism official should take notice of such place and should be shut down forever or make it proper"
Tropical_Spice_Plantation-Ponda_North,Niten,3.0 of 5 bubbles,Mar 2022,Nice plantation but very far,Big Spice plantation. Goan lunch included in tour price of Rs 400 per person .Nice preparation of food  and plates made of leaves. Tour was of short duration and every spice shown was offered for sale..Can avoid  if trip is packed .Place is bit far from Goa .So taxi and food  will cost lot .Totally commercialized and catering to various batches of tourists in row .
Tropical_Spice_Plantation-Ponda_North,Raiden,4.0 of 5 bubbles,Feb 2022 • Couples,Interesting off beat experience,"Location: Ponda Property: slightly low on the signages. So there is a probabitlity to get confused. Spread out over 80acres. Though tour is only around 1acre or so.Wide range of spices. Though would have loved to see Cashew trees or Feni distillary. Alas, it was off season.Tour Guide: Sushmita. She knows her spices well enoughThey also provide lunch. Simple goan food. Loved the sustainable aspect related to the utensils and cutlery.Overall, to be checked out for those looking at exploring Goa beyond beaches.PS: you can try out 1 shot of Feni."
Tropical_Spice_Plantation-Ponda_North,Mitali,1.0 of 5 bubbles,Nov 2021 • Couples,Don't waste time and money,This is just waste of time and money. They have almost nothing to show. Even I have better collection of spices plants at my garden. The food is just edible. They sell different fake and duplicate product in the name of  herbal products. I bought different oils which are quite expensive yet duplicate. Total experience is too bad.
Tropical_Spice_Plantation-Ponda_North,Traveler from Finland,1.0 of 5 bubbles,Jan 2021 • Couples,Waste of time and waste of money,"Before coming there read the truth. Nothing to see. All the business is based on pushing you to take drinks, food and guide who will repeat you what you can read on the internet. We were in this place 10 and 15 years ago. This was a real spice plantation, which started to die slowly. At that time there was a tag with information about each plant. Now if you want to drive 2 hours (with a return way) and pay 400 INR only for drinks and food welcome. Strongly not recommended"
Tropical_Spice_Plantation-Ponda_North,sami_priya,4.0 of 5 bubbles,Dec 2020 • Family,Worth every penny.,"It's always refreshing to walk in woods. I found it very professionally managed. The staff greet you with a welcome drink which is green tea with lemon grass, Ginger and lemon. It is refreshing. Then they take you for a tour which lasts for approximately 30 mins where you get to see cardamom , pepper, cinnamon, vanilla, betel nut trees etc. After the walk they serve you Goa's popular feni. And last but not the least you get the lunch (price included in the entry fees). The lunch is like Ghar ka khana,not fancy but filling. You can buy some pure spices from there too. Beware of the monkeys and it's better to walk in shoes. Good place overall."
Tropical_Spice_Plantation-Ponda_North,Ruchira Khandelwal,4.0 of 5 bubbles,Feb 2020,Informative Place to know about Spice Plantation.,"There is an entry ticket which also includes welcome spice green tea and veg/non-veg lunch. Upon entry you will be welcomed with flowers. There is a wooden bridge made on a small lake to enter into the spice plantation. There are lady guides who accompany the groups of tourists in showing the plantation and explaining the details about the different types of spices and their benefits.There are variety of spices plants/trees here which we won't see usually mexican mirchi,  pepper tree, lavender tree. The tour is covered in 2 acres place though actual plantation spreads in 50 acres approximately. After the tour, visitors are provided with lunch which has both veg and non veg options. We can also buy spices and oils from here. This place also offers the Elephant Ride for which they charge Rs. 700 per person which is too expensive. Overall good place to visit."
Tropical_Spice_Plantation-Ponda_North,123omi,1.0 of 5 bubbles,Feb 2020 • Family,Biased management,"We had included this site in our itenerery during our Goa trip this year. And to confirm it, we had also called to ask whether we need to book our visit. The manager or whoever was on the phone said that no booking is required you can visit anytime between 10 am to 3 pm. So we reached the place by 11:30 am. And to our surprise, the Watchmen at the gate didn't allow us to enter saying that the booking is full, all German tourists are arriving. He was way too rude to us even after telling him about how we had called for booking our visit and how we (my wife and 3 year old daughter) were planning to have lunch there as it was included in the package. He simply closed the gate on our face. We tried calling the manager who said that he will accommodate us only after 1 pm which was not fitting in our schedule. This clearly shows how biased and greedy the management is towards foreign tourists. They just want to mint money. Their ethics and values are gone for a toss. After sharing this incident with one of our family friends who had been here in the past, we even got to hear worse things about this place (food and hygene, overrated prices) Please give a second thought before planning your visit here, you can't trust the management."
Tropical_Spice_Plantation-Ponda_North,sharonn198,4.0 of 5 bubbles,Jan 2020,Most Tranquil  & Informative,We had the most informative young lady walking this plantation Parvika. She was funny and knowledgeable. What a well maintained and neat plantation.Was so intrigued by how simple spices could help with not only health issues but add so much flavour to foods.The guy swinging from tree to tree was something else.Loved how we get cold water poured down our spine to relax us after the walk and the finny ( extract from cashew) was potent but good.Lunch was  included - it was simple and truly yummy.Definitely worth a  visit.
Tropical_Spice_Plantation-Ponda_North,Johneo_ca,4.0 of 5 bubbles,Jan 2020,Interesting information on spices,Interesting if very commercialized place to find out about spices.It was good value for money as entrance included a nice buffet all you can eat lunch and a guided tour for 400 rupees.
Tropical_Spice_Plantation-Ponda_North,jmt12london,1.0 of 5 bubbles,Jan 2020 • Friends,soulless and robotic,"although it is in a beautiful setting, this is very disappointing. the name is misleading as we never get to see the plantation. instead, we walk briskly along a path where they’ve planted a few spice trees and bushes.the welcome is silly with staff robotically throwing petals at people. the whole place is soulless and is not worth the journey.and, i don’t see the point of advocating environmental practices when they sell their spices overpackaged in plastic. i also resented the advertising at the entrance.on top of that, even water has to be purchased, and of course in plastic bottles.highly disappointing"
Tropical_Spice_Plantation-Ponda_North,Gregg P,3.0 of 5 bubbles,Jan 2020,Informative,"Informative but extremely forgetful. Worth a a visit for 1 hour and the 400 rupees admittance including lunch is fair. If your a food lover I’d bypass lunch, it was awful"
Tropical_Spice_Plantation-Ponda_North,CheshireTravellerHJG,5.0 of 5 bubbles,Nov 2019,Fascinating insights +  delicious lunch,"We visited the Tropical Spice Planation as part of a private tour also including, Panjim, a river cruise and Vehla Goa.The guided visit to the Plantation was conducted by a knowledgable and personable guide who gave us fascinating insights into the cultivation and production of spices and other tropical crops. The setting is very picturesque and the buffet lunch delicious."
Tropical_Spice_Plantation-Ponda_North,Vijay Kumar,5.0 of 5 bubbles,Aug 2019,Office offsite,"We visited this place first time. Though, I have been goa for almost 8-9 times but this was my first experience to visit this place Tropical Spice Plantation.. When we reached they offered veg/non veg food which was amazing .. then take an tour of plantation. Everyone in my group loved to have such seeds, plantation and trees ... "
Tropical_Spice_Plantation-Ponda_North,Charley H,4.0 of 5 bubbles,Nov 2019 • Couples,Good experience ,"Costs 400 rupees to enter. On entering you get given a complimentary drink and a tour round the plantation, I expected the tour to be a little longer than it was, however we did learn a lot and the tour guide was very informative. After the tour you get a buffet lunch which is mostly veg meals (which is great), the food was really tasty and they have the best pickle I have ever tried, they also give you a shot of feni (that will definitely put hairs on your chest) They have a little shop also where you can purchase the spices, oils, etc from the plantation. Good experience overall, would recommend if you're in the area. "
Tropical_Spice_Plantation-Ponda_North,Chanx,4.0 of 5 bubbles,Nov 2019 • Friends,Interesting tour ,"We found the guides here to be very knowledgeable and found this tour very interesting. We were surprised by things and learnt a lot. A great veg/non veg lunch is included in the entry free, with a lovely area to eat on the waterfront."
Tropical_Spice_Plantation-Ponda_North,Sri Satya Sai S,4.0 of 5 bubbles,Oct 2019,Good place to know about Spice Plantation,"This place is around 60 km from Goa and located amidst beautiful ghats. There is an entry ticket of Rs.400 for this plantation tour which also includes welcome spice green tea and veg/non-veg lunch. There is a wooden bridge that's laid on a small lake to enter into the spice plantation. Upon entry we will be welcomed with flowers and given hot green tea with spices which is very tasty (my daughter had 3 cups of it). There are in-house guides who takes group of visitors showing the plantation and explaining in details about different types spice plantation & benefits. There are variety of spics plants/trees here which we won't see usually and they include vanilla plant (2nd costliest spice), beetle nut tree, mexican mirchi (which is smallest mirchi and stands vertically upwards unlike regular mirchi), pepper tree, lavender tree etc. The tour is covered in 2 acres place though actual plantation spreads in 50 acres approximately. After the tour, visitors are provided with lunch which has both veg and non veg options. We can also buy spices and oils from here. Overall good place to visit and know the spice plantations, but the ticket price is costly though lunch is included."
Tropical_Spice_Plantation-Ponda_North,Debbie P,4.0 of 5 bubbles,Oct 2019,Great Educational Experience!,"Better to get there in the morning as it gets very busy around lunchtime and the afternoon, with parking a challenge!  We walked around the plantation finding out about many spices and how they can hep you with health conditions.  A real educational experience.  Guide was very knowledgeable and gave many interesting facts.  Lunch was in the price and was average for the masses they have to feed.A couple of hours is more than enough for this attraction.  You can buy some of the spices, whilst you are there! Well worth a visit!"
Tropical_Spice_Plantation-Ponda_North,Phalguni Nayak,5.0 of 5 bubbles,Oct 2019 • Family,Nice tour,"Good knowledge about spices and saw them grow.Good Lunch, but go early and take lunch before it gets cold. Can shop for spices it is not that expensive."
Tropical_Spice_Plantation-Ponda_North,rohitt4ever,4.0 of 5 bubbles,May 2019,Good,"A bit expensive but good place to spend 2-3 hours.Quiet place seems to be in the middle of a Jungle, you can hear a leaf fall. Food is prepared using the spices grown inhouse."
Tropical_Spice_Plantation-Ponda_North,Karishma-Nagpal,5.0 of 5 bubbles,Oct 2019 • Couples,Beautiful,"If you are in Goa do make a point to visit this lovely place,food is good and tasty and the guide along with nature walk was good."
Tropical_Spice_Plantation-Ponda_North,Sailesh,4.0 of 5 bubbles,May 2019,not bad,Costly for the services and food provided. Only saving grace is the tour.It is quite a distance away from main locations.So should be avoided.go for it if nothing better to do.
Tropical_Spice_Plantation-Ponda_North,Asha Simunek,5.0 of 5 bubbles,Aug 2019 • Couples,Beautiful nature walk,"We didn’t expect much but it was very lovely experience. The entrance fee per head is 400 INR which includes welcome drink, guided walk through spice plantation and then nice bufet lunch. Areal is clean and into ecologic which is good. You can also buy some spices there."
Tropical_Spice_Plantation-Ponda_North,juvalesm,4.0 of 5 bubbles,Sep 2018,Pure spices,The place has wide variety of spices planted. You get tasty food with good information on spice plants. Must walk down to get supreme experience. 
Tropical_Spice_Plantation-Ponda_North,Amy K,5.0 of 5 bubbles,Apr 2019 • Family,"A must place  to visit when in Ponda.,",easy to get to from the beach area.... within two hours drive.... Spices are grown in this beautiful area... from Banana trees to a l00 year old coconut tree.....
Tropical_Spice_Plantation-Ponda_North,priyansh j,5.0 of 5 bubbles,Jun 2019 • Friends,Worth a penny,"We visited and got package of ₹400 which include lunch, tour, entry ticket. And the lunch was so yum they make lunch with there fresh spices. After lunch we went on tour where they will explain the imp of spices and how they grow the spices.  After the tour you can taste fenny which is Goa speciality. You can even buy spices from there and they are worth. "
Tropical_Spice_Plantation-Ponda_North,Johannawrites,4.0 of 5 bubbles,May 2019 • Family,"Worth a visit, but a hassle to locate the place.","I enjoyed my visit here, the bridge is a little rickety but the staff are great and knowledgable about the plantation. The little tour around the plantation was informative and the ending where cold water scented with lavender is poured down your back is a lovely to end the half walk. I didn’t try the food but my fellow travellers said it was delicious and definitely well worth it especially since it’s included in the entrance fee. I definitely recommend a visit here however it took us some time to locate the place because there’s really no signboards to guide you. So have patience and your GPS and you should be fine."
Tropical_Spice_Plantation-Ponda_North,Praveen M,4.0 of 5 bubbles,May 2019 • Family,Spice plantation ,It was great visit got knew got so many spices india has the use of it. Pls visit this place great food dont miss the visit
Tropical_Spice_Plantation-Ponda_North,Raghu,4.0 of 5 bubbles,May 2019,Welcome to the world of Spices,"Right from the entry gate to the entire garden it is a very spicy experience. What mesmerizes you the moment you the reach the place is canopy and the natural habitats with cows grazing on the grass and the bridge that leads you to the plantation. The ducks welcome you with their corking sounds and you are handed over a lovely lemon grass tea. As you sip on it you wait for your tour guide to take you around. The guide shows, makes you feel, smell and even eat sometimes the fruits, herbs and spices. The aroma and flavors kind of explode in your mind. While i am sure that Black Pepper is best in Calicut and so is Cardamom best in Munnar. I think Cashew is best in Goa... and obviously Feni. The only thing surprising was they harvest all this and send it to the mill... where it gets machine pressed, refined, which may not be the best way to extract the goodness and we may end up buying junk. Food served is decent and staff is welcoming... washrooms, which are western, need to be kept more clean. total charges 400 and time is 3 hours. "
Tropical_Spice_Plantation-Ponda_North,Prajot Joshi,4.0 of 5 bubbles,May 2019 • Couples,A walk to get to know about the stuff you should already know ,We liked the concept and the way guests are greeted and welcome here. The lunch served has got a great taste and the way it is served could also be fascinating for some. I feel this place is based on the premise that how ignorant we have  become with the nature and the basic understanding of it. Having seen some of the stuff that we always see well packed  in a supermarket in its original form could be interesting for many.  Just the fact that we have lost touch with nature and the basic understanding of it that we find this amusing was a bit upsetting got me. Nevertheless the location is beautiful and a must visit for city dwellers.
Tropical_Spice_Plantation-Ponda_North,Vani S,5.0 of 5 bubbles,Apr 2019 • Friends,Nice and well maintained plantation,"It was a very nice n informative guided tour. My 1st spice plantation visit. The guide Veena was very cheerful and patiently explained and answered each query fired at her. Its clean and well maintained.  The greenery insides really is soothing. They provide lunch too which is simplereally relishable. Very much an ecological place. Food was served in earthern pots. The taste was very homely. Worth a visit and lot of information gathered on different spices. There are some elephants too little ahead, but couldnt visit as we had a flight to catch. But we saw an elephant being bathed in a pond inside the plantation. Must go!"
Tropical_Spice_Plantation-Ponda_North,ClareS,5.0 of 5 bubbles,Mar 2019 • Couples,Fantastic,"What a wonderful experience. After walking across a bridge from the car park, a wonderful Aarti welcome greets you, plus juice and nibbles. Then delicious Goan food served traditionally on a dried banana leaf plate, in a covered area within the spice plantation that had so much ambiance. The guided tour of the plantation was so interesting and informative. Opportunities to buy spices after the tour. Would highly recommend."
Tropical_Spice_Plantation-Ponda_North,KKPal,3.0 of 5 bubbles,Mar 2019 • Family,Average,"It was a small tour and also costly as they charged INR 400/- pp. Limited food option and it took around an hour to travel from North Goa to reached here so you need approximate 4hours to visit this place, in my opinion, it was not worth. So better to go on a beach and enjoy there."
Tropical_Spice_Plantation-Ponda_North,Rashid Isa Rishi AlHeddi,5.0 of 5 bubbles,Mar 2019 • Friends,Spice plantation visit,"Arrived at this place after a long drive from Cavellosim and car parking available outside- Paid Entrance fees Rs 400 per adult which was inclusive of a Goan Veg/ Non Veg lunch !! Very pleasant couple of hours wandering through this green ecological, well maintained spice plantation- We got to see various plants, flowers, trees, spices and even preparation of KajuFeni!! The local Goan portent alcohol !!There was samples available for the brave . The guide was well informed and patiently answered all questions raised by our small group. Saw several Birds and missed seeing the Elephants as they only at site during early morning and evenings.Nice shop selling all Spices , Tea , seeds, and Clove oils etc at reasonable prices.The Goan meal was average but as we were all hungry was devoured happily.It was Holi so all the Plantation staff were in different powdered colours and seemed to have enjoyed the Holi festival. Certainly a must visit for all visitors to Goa."
Tropical_Spice_Plantation-Ponda_North,CoolTravelFreak,5.0 of 5 bubbles,Aug 2018 • Couples,B E A U T I F U L,This is a superb place to visit .. if you are interested in plantations and / or organic platation .. this place is for you
Tropical_Spice_Plantation-Ponda_North,Mazar sayed,5.0 of 5 bubbles,Feb 2019 • Couples,Amazing,I went to spice garden with my wife just for chilling there but as i enter the gate i was just watching all the plants and area surrounded jungle looking amazing.Food is too awesome and smell of the spices are too much awsome.
Tropical_Spice_Plantation-Ponda_North,Aaraa,4.0 of 5 bubbles,Jan 2019 • Couples,Recommend for a day trip in goa,"Going to visit the spice farm in ponda is a good idea if you are anyways in old goa . The entrance fee is reasonable , the tour is a 30-45 min tour where they explain all the various spice plants and trees and take you through the plantations.the lunch is also quite decent , of course the food is local Indian cuisine. Well organized"
Tropical_Spice_Plantation-Ponda_North,rajatkant,4.0 of 5 bubbles,Jan 2019 • Family,an  authentic experience,"reasonably priced at rs 400 per person which includes lunch thrown in and a guided tour into the plantation with all the details about different things.the food is simple,authentic and basic.its just that the stuff they are selling there is grossly overpriced.but hey nobody is forcing yyou to buy."
Tropical_Spice_Plantation-Ponda_North,GPaCalgary,4.0 of 5 bubbles,Jan 2019 • Couples,A Highlight of our Trip,This was definitely a hilite of oir Indian visit. Our tour guide gave us an excellent presentation of the trees and plants which create such beautiful iconic Indian spices. We also had an opportunity to dine here ( good food) and buy some of the locally produced spices.
Tropical_Spice_Plantation-Ponda_North,Saikat Chakraborty,3.0 of 5 bubbles,Dec 2018 • Family,Tropical spice plantation,"The tour is good if you take a guide. The elephant ride is excellent but too overpriced at Rs 700 per person. There should be name board in front of tree as found in eco park Kolkata.But the  oils and extracts they are selling are of top quality, reakl and trully effective for the purpose they are to be used.we got result almost instantly!!"
Tropical_Spice_Plantation-Ponda_North,sona2391,5.0 of 5 bubbles,Jan 2019 • Friends,Beautiful place,A very good and beautiful ambience.u will get a transitional Indian welcome . The tour to the plantation is very good and finally the trip with end with yummy Goan food 
Tropical_Spice_Plantation-Ponda_North,650paul,1.0 of 5 bubbles,Jan 2019 • Couples,Not worth it,"Travelled from Goa it took us an hour and a half to get there. The plantation is a short walk down and over a rickety bridge to a covered area where your tour begins. However they do offer a complimentary transport from the car park down to the bridge for those with mobility problems. The tour takes about 40 minutes, but there is little to see. Food was provided in a buffet style. This was not what we envisaged and wouldn't recommend."
Tropical_Spice_Plantation-Ponda_North,john a,5.0 of 5 bubbles,Dec 2018,awsome place to learn of spices,we had an excursion to the plantation and also saw several temples and churches and the tour guide was amazing and very informative
Tropical_Spice_Plantation-Ponda_North,ggillian912,3.0 of 5 bubbles,Jan 2019 • Friends,Spicy ,"Visited this plantation last Friday. 20 kms from Panjim.... follow your gps... otherwise you will end up driving around for another 10 kms through a hilly forest road... which turned out to be quite picturesque....When you reach the plantation, there is enough parking for cars & buses. You have to walk down, cross a rickety bridge to enter the reception centre.... we were greeted with a traditional Indian welcome and a showering if marigold petals.Tickets for a spice garden tour & lunch is ₹ 400/- each ... very reasonable !!!A half hour walkabout was interesting... then we tucked into a lunch buffet... local, wholesome & satisfying....Nice trip to do, if you haven’t visited a spice farm before ..... they are open from 9am - 4 pm daily."
Tropical_Spice_Plantation-Ponda_North,Wayne G,4.0 of 5 bubbles,Dec 2018 • Family,Interesting insight,We visited the spice plantation and enjoyed the tour where the guide told us about many spices and how they grow and develop.  Learned some new facts and it was interesting.  Took about 40 minutes and then followed by lunch which could have been skipped.  Sugar cane drink is an acquired taste.  The staff were attentive and helpful although not sure about the shop.  be ready for cold water experience which was fun watching people's reactions.  Worth a visit.  Lots of other activities such as zip line and quad biking which we didn't do so can'rt comment on quality or safety of those activities.
Tropical_Spice_Plantation-Ponda_North,travelingdmd,5.0 of 5 bubbles,Dec 2018 • Family,Spices in India,This is a very interesting tour of the plants that make our spices.  It is about 30-45 minutes of walking around an area with plants that produce spices and our guide was very knowledgable.  We skipped the lunch and opted to eat in Panaji.
