Tourist Attraction,Name,Rating,Date and criteria,Title,Review
Tropical_Spice_Plantation-Ponda_North,PBPG,3.0 of 5 bubbles,Jan 2018 • Couples,Great setting but not enough spice,"The setting is fabulous with a lake surrounded by trees.  The tour round the spices was very disappointing.  I realise you can only be shown what is growing at that time, but it was very limited.  Peppercorns, prir piri and a couple of other trees that apparently would have cloves and cinnamon.  The it was back for lunch, which was a bit grim, very sloppy curry, and then the gift shop to sell you stuff.  You didn't get to see the actual farm at all, apparently it is 760 acres"
Tropical_Spice_Plantation-Ponda_North,Sakshi,4.0 of 5 bubbles,Jan 2018 • Family,Luxuriously Green & Aromatic!! ,"Visited the Tropical Spice for a second time and found it as enthralling as before! The walk across the lake, on the wooden footbridge, is such a crowd-puller! The excellent photo ops keep people floating back n forth over the bridge creating a constant jam 😋We reached around midday on a Tuesday and the place was teeming with tourists.. Our guide Pooja made the walk around the plantation very interesting with her anecdotes and animated conversation! She was well acquainted with the spices and herbs and answered questions from guests enthusiastically! At the end of the tour, we were ushered to the open dining area for a buffet meal.. The food is traditional Indian.. well-cooked, simple and tasty.. i ended up eating twice as much (its so hard to find non-spicy non-greasy meals!) There is a kiosk for buying fresh spices n a plethora of oils produced at the plantation .. and i loaded up on all things exotic 😎Its a well-organised copiously-green place to spend 2 hours learning about ingredients that set our Indian dishes abuzz, with never an insipid moment! I would highly recommend this place even for those not-so-gastronomically inclined.. just to unwind in the luxuriously green environs of the plantation! "
Tropical_Spice_Plantation-Ponda_North,Hulalaura,5.0 of 5 bubbles,Dec 2017 • Couples,Super interesting!,What a great little visit!Found out lots of information from a really lovely tour guide!Got to try the local drink!!Free dinner buffet included!Not a whole day thing at all but deffo worth an experience!
Tropical_Spice_Plantation-Ponda_North,Indira N,5.0 of 5 bubbles,Nov 2017 • Couples,Beautiful spice plantation,Visited this spice plantation with my family. I love this place and the little bridge over the lake. Very peaceful. The guide is knowledgeable and made this visit very interesting. We gained a lot of information about spices and their benefits. Food was delicious. A visit to a spice plantation shows another beautiful aspect of Goa. I would highly recommend a visit.
Tropical_Spice_Plantation-Ponda_North,pekingduck69,4.0 of 5 bubbles,Jan 2018 • Couples,Fun Walk,"Visited the spice plantation as part of a tour from a cruise ship. About an hour drive from the port and were greeted with flowers. A nice lady took us on a walking tour through the forest then we had lunch. Food was tasty and safe - no stomach issues. Fun place to visit, very relaxing. "
Tropical_Spice_Plantation-Ponda_North,Ishuheri,5.0 of 5 bubbles,Dec 2017 • Friends,A Beautiful Walk Through the Woods,"Came here as part of a tour of Goa. I really enjoyed this experience. You get to the spice farm by crossing a long bridge across a lake. The bridge is a bit rickety, but it adds to the charm. On the other side you're greeted with a shower of petals and a talika.It's fascinating to see all the plants we cook with every day, but never think about where, or how, they grow: black pepper, cardamom, turmeric, vanilla. It's like something from the pages of The Mistress of Spices.At the end of the tour, you get a refreshing dose of cool lavender water down your back and treated to lunch, served on recycled palm leaves. You can even sample their homemade feni, a lethal moonshine unique to Goa, distilled from cashew nut apples."
Tropical_Spice_Plantation-Ponda_North,Udders,4.0 of 5 bubbles,Dec 2017 • Family,Fun,We were taken as part of a companies itenerany so me not have picked to go ourselves. However we did enjoy it and despite having some concerns we sampled the different tasting elements and got stuck into the buffet. Really nice to see lots of different nationalities including Indians all experiencing the setting. It was done well and it is not a big oversell of spices. Even the drinks that were not included in the buffet were priced normally.
Tropical_Spice_Plantation-Ponda_North,Vacationsaremust,4.0 of 5 bubbles,Dec 2017 • Family,Tropical spice plantation educational and fun visit,"This is in Goa in ponda area.We visited this place as a recommendation from our hotel manager.We have been to the Kerala spice gardens and wanted our kids to see something similar and understand where the spices came from.You can combine the tour with the temples on that road...we saw shatadurga temple, Balaji temple ,and then the more famous mangeshi temple and then headed to the spice garden.Hardly a 20 minute drive from the mangeshi temple.They charge 400 RS for entry with a complimentary lunch which is a very simple home cooked meal both veg and non veg is provided.The option to eat first followed by a guided tour of the plantation is also available.English and Hindi tours were available..I'm not sure if other languages are also available.They provide you with a welcome drink of lemon grass and herb tea.The tour is a short 35-40 min tour pointing out various herbs and spices and mode of harvest.Kids enjoyed the shaded walk and learnt a few things too.Would definitely recommend it for families with kids above 5 years so they can relate to the spices.Adults too seemed to enjoy it.We got to taste pheni the local alcohol from cashew fruit."
Tropical_Spice_Plantation-Ponda_North,Harsh S,4.0 of 5 bubbles,Dec 2017 • Couples,Far place on hill,This is in Ponda and far place on top of hill two-wheeler ride can be little uncomfortable. Monday closed. Can see spices pepper plants.
Tropical_Spice_Plantation-Ponda_North,GAlphonso,4.0 of 5 bubbles,Nov 2017 • Friends,Tropical Spice Plantation -  worth a visit,"The Tropical Spice Plantation is very much like the other spice farms in Goa, in terms of the plantation. However, the food was authentic & good, both in terms of taste & presentation. The tour guide was well informed.  Although, we have visited spice farms several times before, she held our attention, with her interactive & witty presentation. Worth a visit!"
Tropical_Spice_Plantation-Ponda_North,thingsthatareunique,3.0 of 5 bubbles,Nov 2017 • Friends,Good short stop,Had a tour of the demonstration spice plantation - basic information on spices provided. Lunch included in entry fee - recommend to enjoy veg dishes only.
Tropical_Spice_Plantation-Ponda_North,Haydn S,3.0 of 5 bubbles,Nov 2017 • Couples,Nice place for lunch,A worthwhile stop if you are doing other nearby attractions. Tour lasts about an hour. A bit of a tourist trap. But for 400 Rupees per person was a pleasant stop. Knowledgeable guide explained the spices in their natural habitat. Good buffet lunch. I wouldn’t rush back but it was a nice enough experience. 
Tropical_Spice_Plantation-Ponda_North,SumitTaxali,2.0 of 5 bubbles,Nov 2017 • Family,Poor Experience,"Seriously don't know why did I book this visit as I didn't enjoy the food and the tour after food to understand spice plantation wasn't excited at all.In case you want to understand how do get certain spices on your plate, this is for you else, don't waste time and explore some more interesting activities in Goa."
