Tourist Attraction,Name,Rating,Date and criteria,Title,Review
Tropical_Spice_Plantation-Ponda_North,Uday Dangui,5.0 of 5 bubbles,Jul 2018 • Family,good,"very good experience, good food , good people. staff is very caring I wish to visit again.  Agood picnic spot near Ponda town"
Tropical_Spice_Plantation-Ponda_North,Odyssey35956655723,1.0 of 5 bubbles,Dec 2018 • Family,Only for foreiners,"Today i visited this place ,paid 1000 for 2 adult and my 8 year sonShown 6 to 7 tree of local spicesThis place is only for foreigner tourist ,giving warning to all my indian citizen ..As seperate buffet lunch for indian and forigners ,they serve fried fish ,prawns etc to foreigners with fresh fruit.Indian tourist must visit this place if they have no self respect..The owners of this property must have genitical relationship with foreigners so they r giving such treatment to our local tourist..Will not recommended for indian tourist.."
Tropical_Spice_Plantation-Ponda_North,Sub3B,5.0 of 5 bubbles,Dec 2018 • Family,Excellent experience and value for $,"I was glad that I decided to visit this plantation. It represented good value for money at just INR 400/head. The location was scenic. The food had a home cooked feel to it. I loved the tour of the spice plantation - our guide (in hindi) did an amazing job. I learnt a bunch from the tour. I'd recommend this over the plethora of church, temple and beach options which regularly comprise a south goa tour."
Tropical_Spice_Plantation-Ponda_North,Avica M,4.0 of 5 bubbles,Nov 2018,An Interesting and Informative Tour,A lovely experience - though it is quite busy with the various tour groups - the entire setup of the place and venue is very organised and the onsite crew/team makes it a seamless process. There are no frills - it is a pragmatic setup that serves the purpose of the tour.It is an informative tour where we learnt so much more about spices than we thought we knew.Our hostess and guide at the venue JORITA FERNANDEZ is absolutely exceptional - she has a wealth of knowledge which was shared so well - she kept it interesting and we enjoyed the tour of the plantation. Lunch is served ( though no frills) - tasty freshy prepared food.Good and enlightning experience.
Tropical_Spice_Plantation-Ponda_North,OnAir16536029315,1.0 of 5 bubbles,Nov 2018 • Family,Spice plantation,"Very far away not worth going. Very short trip made long by offering lunch. Lunch quality not upto mark. Think that you are eating dark chawal in rs 400.spices not visible.all theoretical knowledge. It's better to call it spice shop. Not showing processing, packing etc. Even my 6 year old daughter could understand they made us fool and it was waste of time. Actual visit maximum Half hour."
Tropical_Spice_Plantation-Ponda_North,Nisheeth R,4.0 of 5 bubbles,Nov 2018 • Family,Nice Place,It is a worth place to visit.Though nothing special about it normal spice gardern no elephants rides available.Crew their is courteous.Plan your lunch their nice simple food
Tropical_Spice_Plantation-Ponda_North,Maria F,4.0 of 5 bubbles,Feb 2018,Dont miss a visit here!,"Its a fantastic experience to learn about all the different spices. Our guide gave us a great tour where w e could see, touch and taste the spices. I do recommend a visit!"
Tropical_Spice_Plantation-Ponda_North,Alfredo S,5.0 of 5 bubbles,Nov 2018 • Friends,"An interesting experience in Goa, including lunch, worth a visit!","This attraction is very well designed with parking for tourists.  Includes a welcome drink,small group assigned to one guide who is well trained and knowledgeable about spices produced in this plantation.The lunch was an extra included in the price of Rs.400.  The food was better that other restaurants in town and included a drink of anise at the end of the meal.The shop in this attraction is interesting and prices are good.Although it is located away from Calangute, it was worth the visit."
Tropical_Spice_Plantation-Ponda_North,Preeti C,4.0 of 5 bubbles,Oct 2018 • Family,"A  good learning experience ,but should include more spices in the tour","For us Indians, spices are nothing new but to see them in their natural state is new.So this is a good learning trip.It is open from 9-4 , we were charged Rs 400 per head , which included tour of the spice garden and lunch buffet.We were served a welcome drink of lemongrass tea,which was nice and then a guide took us in small groups for the spice garden tour .The guide was knowledgeable but the knowledge was not very deep, more of rote.We got to see 10-12 spices if I recall well , I would have been happy if they had charged us Rs 100 more and given us a bigger tour !We were served lunch , which had veg and non veg dishes both , the lunch was low on spices and chilies in keeping with their mostly foreign visitors but it was filling and good.We also got to taste some cashew Feni !I recommend this place definitely.They have spices and some products made from coconuts for sale, which I found on the expensive side so did not buy."
Tropical_Spice_Plantation-Ponda_North,Padmaja G,3.0 of 5 bubbles,Oct 2018 • Family,An informative tour about spices,"A beautiful plantation to visit. Almost all spice plantation tours follow same routine..offering a warm lemon grass drink and a tour of a small area of the plantation that is purposely developed for spice tour. One of the assigned guides will take us around the designated area and will show us the available spice plants/tress mostly vanilla, turmeric, pepper, cardamom, cinnamon, arecanut etc...which is about 40-45 mins. This is followed by lunch. The drivers who recommend and take tourists to these plantation tours will get either a commission or free lunch. Overall it was time well  spent."
Tropical_Spice_Plantation-Ponda_North,Dragana T,4.0 of 5 bubbles,Oct 2018 • Couples,Very nice spice story,We liked this visit since we learned about spices and purchased some for bringing home. The girl who showed us spice plantation were very knowledgeable and was really interesting to explain us about spices. Definitely great visit.It was long drive (over an hour) from Baga beach so if you are not into spices you probably won't enjoy a lot.Lunch was good but nothing to special.
Tropical_Spice_Plantation-Ponda_North,Vivekaradhana,5.0 of 5 bubbles,Sep 2018 • Couples,Good introduction with spices,"Very green, calm and peaceful place. Welcome drink made of lemon grass and other herbs was served in arrival. Their after a we took a garden tour which was very informative and interesting too. The last thing we did there was yum buffet lunch made of self grown spices. Overall very good experience we have had."
Tropical_Spice_Plantation-Ponda_North,sandesh d,5.0 of 5 bubbles,Sep 2018 • Friends,"Must See place ""Goan Spice Farm""","I would say this is one of the best place in Goa where you can get rejuvenated. The place is surrounded with lots of greenery and the plus point is it pollution free. In cities we  have busy and polluted environment with smoke, dust and noise. This place will make you completely relaxed from the noise and smoke from the cities.When you visit this place the host well comes you flowers and a welcome drink tea. The tea which they serve is organic and herbal which just relaxes you from the long tiring journeys.The Spice farm is a group tour. the group can be from 4 people to 10 people. and each group gets a professional and experience tour guide who explains the entire spice farm where you can see real and feel the spices which are grown naturally and organically.The other Specially of the Spice farm is that once the tour is over they serve you buffet  lunch which contain both Veg and Non Veg dishes. Most of the dishes are goan delicacies and it equivalent  to Continental taste.And the best part is the total tour comes to you with Spice farm tour and Buffet Lunch for Just Rs.400 ($6) per person which is very cheap.I suggest whoever visit Goa for the First time should add this place in their travel plan.Keep up the good work ""Tropical Spice Plantation team"". Cheers."
Tropical_Spice_Plantation-Ponda_North,Silverrmoon,4.0 of 5 bubbles,Sep 2018 • Solo,Must visit place for Spices lovers,This is the place which I wanted to visit since ages and finally got a chance. The place where you can know how your favorite spices grows and gets cultivated.The tour guide of the plantation was good and had a keen knowledge about all the spices and provided all the information and clarification with related to the queries you have.And lastly the closure of the tour with the local cuisine was just great.
Tropical_Spice_Plantation-Ponda_North,Kabita B,4.0 of 5 bubbles,Aug 2018 • Couples,Visit to a lovely Spice Plantation,"The visit to the Spice Plantation was not planned but our cab driver took us there and insisted on seeing the place.Indeed it was a good decision.In this monsoon month it was lush green,a serene place.Though,we have been to other spice gardens this visit was a good one.They welcome the guests in the traditional Indian way and a herbal tea which was soothing.Tour was interesting and our guide whose name was Pooja explained very well and not at all boring.At the end of the tour she poured little water mixed with lavender oil on our spine,which was relaxing.The entry fee is rupees four hundred which includes a lunch which is simple and tasty.It offers both vegetarian and non-vegetarian in their menu.There is a counter where one can buy spices from their plantation.Prices are reasonable.Good place to visit."
Tropical_Spice_Plantation-Ponda_North,Freakyy_Traveller,4.0 of 5 bubbles,Jul 2018 • Friends,"Good guided tour with awesome Goan veg, non-veg buffet food!!","You need to pay ₹400 per person for entry to the property which includes buffet lunch and guided tour. Best time to visit: Rainy season. Monsoon gives this place an extra pop with lush green trees and superb landscape. They offer you full veg, non-veg Goan cuisines with finger licking taste. Our guide Pooja was very knowledgeable and gave us some detailed information about the herbs and why they are that expensive. They even had a small shop, wherein you can buy natural oils, spices, herbs, etc. Overall it's a must vist place, if you are in Goa, not just for Night Life!!Do see the attached images for more details and hit Like if you found this review helpful."
Tropical_Spice_Plantation-Ponda_North,Alison G,5.0 of 5 bubbles,Jun 2018 • Friends,A perfect getaway,"This is a must-see in Goa if you are here for several days. Amazing food, an educational and fun tour, and certainly a bargain."
Tropical_Spice_Plantation-Ponda_North,Mariette B,5.0 of 5 bubbles,Jun 2018,Mariette Bouwer & Nancy Naidoo,"We arrived in the middle of a monsoon downpour.  We had a warm 'wet' welcome by our 'spice plantation' guide.  We enjoyed a lovely lunch while we waited for the shower to pass.  The guide was very light hearted and informative giving lots of information in the plantation.  There is also an opportunity to do some shopping of the products at good prices.  Well worth the effort,, Shouldn't be missed"
Tropical_Spice_Plantation-Ponda_North,megsmy,3.0 of 5 bubbles,Jul 2018 • Solo,Only if you have nothing else to do,"Was mildly disappointed with this one. The entire spice tour lasted about 15mins, excluding the waiting. Didn’t show a whole lot of spices, neither explained much. Started off with a welcome drink, then the tour, and then lunch. Lunch was pretty good."
Tropical_Spice_Plantation-Ponda_North,drviveksaxena,5.0 of 5 bubbles,Jul 2018 • Family,Goa visit with a difference,"Generally goa visits are associated with beaches, sea food and fun, but I visited this place not knowing what is in store. I was surprised by the nature's blessing on this place, caretakers and guides of this place are really good. You will see almost all spices in their natural forms and in the end nice simple food finishes the trip at a very high note. I recommend this place a must if you are nature and peace lover."
Tropical_Spice_Plantation-Ponda_North,Wanderer,4.0 of 5 bubbles,Jul 2017 • Family,Delight to the eyes!,"When I visited Goa for the first time, I went to this place and I loved it so much I went there again on my second trip too. * The bridge connecting from entrance to this place is the loveliest thing.* Then they welcome you with tilak and handmade garland.* Then they serve you some Lemongrass herbal tea.* Then they take you for a walkable guided tour in the spice plantation where they show you how the spices are grown and tell you about a few uses.* After this you can have Goan buffet lunch which is served in earthen pots and eaten on plates made with dried leaves.* At the end you if you wish you could buy pure spices/oils from a selling counter there.They have described many more things on their web-site which were COMPLETELY MISSING from this tour like Butterfly garden, 75 species of birds, some Italian food in the menu/Kaju feni/Urraq, Paddle row boat, Informative leaflet to name a few."
Tropical_Spice_Plantation-Ponda_North,Lauren G,5.0 of 5 bubbles,Jun 2018 • Friends,Must-see cultural experience in Goa!,"Although my friend and I came here during the off season and there was quite a bit of rain, we had an excellent time. Not only was the tour cheap (400 INR/6 USD) we learned a ton! The guide was very knowledgeable and her English was excellent. The meal afterwards was one of the best I had during my stay in Goa. Highly recommend this place!"
Tropical_Spice_Plantation-Ponda_North,Lakshmi N,4.0 of 5 bubbles,Jun 2018 • Family,A good insight on spice plantation,"Its almost an hours drive from the shores of Goa. Once you get closer to the location, the drive resembles a hilly ride! The place has a decent parking space. Once you get in, you are welcomed by the crew members with a nice welcome drink (lemon grass tea) which you don't generally get in restaurants. They group people based on your language preference (I guess they have english and hindi guides). So you might have to wait for a few minutes before they take you through the tour. The guide is really knowledgeable on the spices and the plantation. Its almost an hours walking tour as they take you through different spice trees / plants and explain how its grown / and harvested. Sometimes, you need to be lucky enough to see the real spices as certain things are seasonal. Once you are done with the tour, you get to taste a decent enough buffet lunch. If you are staying in shore side of Goa, you need half a day to cover it. So plan accordingly to spend the rest of the day so that the distance you travel is worth the trip.Its a must visit for city grown people who might not have seen plantations!!!"
Tropical_Spice_Plantation-Ponda_North,Joao A,2.0 of 5 bubbles,Jun 2018 • Couples,To hot and not so much to see,It is an mandatory tourist visit they say but the true is that there is not much to see. And it is so hot that takes the mood for the visit. You can have lunch their for only 400 rupees but don’t waist your time and look for a nice restaurant although near their are none. Good for backpackers with no money to spend.
Tropical_Spice_Plantation-Ponda_North,Stevehuddersfield68,4.0 of 5 bubbles,Apr 2018 • Couples,Nice tour,Went on a tour which included a visit to the plantation. Good tour round with a good English speaking guide very knowledgeable about all the different spices and what they can be used for. The tour included a typical Goan meal served on banana leafs . Worth a visit .
Tropical_Spice_Plantation-Ponda_North,d s,3.0 of 5 bubbles,Mar 2018 • Couples,Excellent except the climb from coach not suitable for non walkers,Very good except the walk from the coach in the heat was not for the faint hearted The tour lasted about 45 mins and although the tour guide spoke very good English the amount of people in the tour we could not hear themThis tour included a lunch and drinksMake sure you cover yourself with spray because of the flies before you go
Tropical_Spice_Plantation-Ponda_North,eligorovici,5.0 of 5 bubbles,Apr 2018 • Family,Great place to visit,"A great place to visit, learn about plantation, the use of plants for different ingredients and franganances. We had a wonderful tour guid and the lunch at the end was good authentic Goa style food. Highly recommended!"
Tropical_Spice_Plantation-Ponda_North,Takarehi,4.0 of 5 bubbles,Apr 2018 • Couples,And Lunch Too!!,"This farm had an entrance fee that included a tour and lunch.  Our tour guide spoke great English and gave us details about the various spice plants on the farm. This included, cinnamon, basil, lemon grass, betel nuts (with a high flying demonstration on how to harvest), cashews and pepper plants to name a few. Lunch was a buffet of Indian foods.  Very good and a must see in the area. "
Tropical_Spice_Plantation-Ponda_North,CherylandBrett,5.0 of 5 bubbles,Apr 2018 • Couples,Thoroughly enjoyed this tour and loved lunch!,"This was a great place to come to examine the trees, shrubs, and vines that provide the spices we use every day.  It’s beautiful, with a fun walk over the wooden bridge to get to the dining area where we had excellent food and a free drink.  Lots of pineapple plants, coconut palms, pepper plants, cardamom, cinnamon and more."
Tropical_Spice_Plantation-Ponda_North,Dhiraj H,4.0 of 5 bubbles,Apr 2018 • Couples,A pleasant experience ,This plantation can be done after your visit to Mangeshi temple. However the signages are not adequate and neither is google map very accurate. The drive is through pleasant hilly terrain. There is adequate parking space in the premises. You have to purchase a ticket for a reasonable Rs 400. You first walk across a rather creaky walkway over a pond. On the other end girls welcome you by showering flowers on you and putting a traditional tilak ( a small paint mark)on the forehead. The premises is very cool and the staff very professional. You are first offered a pleasant warm welcome drink.Every fifteen minutes or so you are taken around on a guided tour of part of the plantation which showcases the different spices grown on a demonstration plot.The girl guide is knowledgeable and of pleasant personality. You can purchase spices and dry fruits also. After the half hour tour you are fed a hearty meal. The local buffet spread has interesting menu including two non veg items. You can purchase your drinks. The only improvement I would suggest is the washroom which needs more maintenance. Overall a worthwhile experience.
Tropical_Spice_Plantation-Ponda_North,Holiday C,5.0 of 5 bubbles,Mar 2018 • Business,spices and goan traditional lunch,really had a great time walking to the plantation getting knowledge about different spice plants and the lunch was one of the best otantic goan lunch
Tropical_Spice_Plantation-Ponda_North,Primal Survivor,3.0 of 5 bubbles,Mar 2018 • Family,Spice Plantation,Visited this place for two reasons - educational trip for children and had heard a lot about spice plantations .It's basically a small  farm with samples of all major spices grown . Rs 400 per person is the rate and after a short guided tour (15 minutes) lunch is served.The food is good has an eco-friendly setting and appeal .Go if u have nothing to do in Goa !*** Why is there a separate seating enclosure for foreigners? I am unable 2 understand *****
Tropical_Spice_Plantation-Ponda_North,Kaptan Rinkal,5.0 of 5 bubbles,Mar 2018 • Couples,Great atmosphere Great food,"Must visit Place if you are nature lover.Went there as a part of Tour - Taken whole day tour for Dudhsagar & Spice Garden with lunch included cost 1400 /- rs. It will vary from agent to agent from 1500 to 2000/-.About Tropical Spice GardenIt has pleasant atmosphere & well developed plantation areaPackage includes Welcome drink30-35 mins tour in spice Garden with knowledge pack tour guideLunchDrink & food was good, spice Tour was awesome. Overall great experience & recommend all to visit once."
Tropical_Spice_Plantation-Ponda_North,Michael H,1.0 of 5 bubbles,Feb 2018 • Couples,Do not give these people your money,"The splice plantation is ok ...but it’s owned by the same people who do the elephant ride and wash a few miles up the road. Please please please do not go on the elephant ride.   The elephant had cuts and bruises and they just shout at him.  People in comments below noticed the same.  I got there with my partner and she went on a 5 minute ride but I declined.  They charged 1400 IRS which was a total rip off. When alone with them after the elephant wash (which is getting in his back in a river and he chucks water over you) they started coming up to us going “give me tip , give me tip for me and the boys”. I gave them an extra 200 just to get him away from me.  My partner after felt terrible for doing it but because the driver took us there she felt pressured to do it.  Who ever reads this please take note and do not go if you like animals. Thanks."
Tropical_Spice_Plantation-Ponda_North,chris282,1.0 of 5 bubbles,Feb 2018 • Friends,Don't expect too Much from the tour of this plantation,Total experience is a big disappointment: It's quite a distance from the city: To pay 400 INR is not worth it: The tour is nothing but a walk around a small area with nothing much to see of the spice plantationThe guild just rush though as I think they keep on repeating the same thing thousand times. A strong hint to give tips. The meal serve after the short tour is mass produce. Only go to this Spice Plantation if you really are very free and have nothing else to do
Tropical_Spice_Plantation-Ponda_North,AninditaDe,1.0 of 5 bubbles,Feb 2018 • Couples,Give this a miss!,"The entry fee is 400 INR which includes lunch, we just wanted to go visit the garden and was not interested in the food. The lunch however was terrible to say the least, the yellow rice was colored (while they claim natural), the prawn dish hardly had any prawns and the food was not tasty either.The garden visit experience was also average. The spices they sell there are overpriced.Overall service quality - extremely poor.Give this a miss and save some time and bucks!"
Tropical_Spice_Plantation-Ponda_North,PrateekDwivedi28,4.0 of 5 bubbles,Feb 2018 • Family,Must go place,Its a must go place not only to get intriduced to spices but also to have local authentic goan food.  Food was just awesome and we were kind of lost in food after Spice garden tour.  Tour time : 30-45 mins Food : buffet(no Time limit) This place has small beverages shop offers water cold drink and BEER wgich you can buy and drink while walking in tour or consume wherever you want. Only drawback : little far place from city limit. Kind of 1 hour drive from North Goa 
Tropical_Spice_Plantation-Ponda_North,TrueIrishWanderer,5.0 of 5 bubbles,Feb 2018 • Couples,A great way to spend a few hours,"My wife and I visited the Tropical Spice Plantation one lovely Friday afternoon for lunch. When we arrived we walked across a long wooden bridge across a lake and were greeted by two members of staff. They ushered us to our table in the restaurant and gave us both a hot lemongrass drink. It was very refreshing. We then were taken to the buffet area and selected our food from large crock pots. There were several vegetable dishes, a prawn curry, and s chicken curry. There was also steamed rice and vegetable rice, and bread rolls. We then purchased cold drinks from the counter. After we had finished the main course the waited brought a plate of water melon pieces and two small individual tubs of ice cream. We were also served a small cup of Feni  - a local 40% alcoholic clear drink, made from distilling cashew nuts. After our meal, we were treated to a small tour of the exhibition area of the spice plantation and we learned many interesting facts about the various spices. At the end of the tour, the guide takes a ladle of cold water, taken from a crock pot, and puts the water down your back from the collar of your shirt. This is to cool your spine from the heat. I was a bit dubious about having this done, but it refreshed me and, in the heat, my shirt dried very quickly. After the spice tour, you can buy spices from the spice shop if you wish. I thoroughly enjoyed my day at the Tropical Spice Plantation and would recommend a visit to anyone. "
Tropical_Spice_Plantation-Ponda_North,Jenny C,5.0 of 5 bubbles,Jan 2018 • Friends,Nice wind down with great info,"The spices are grown in their own areas throughout the property but they have a one acre plot that has samples of all they grow. Our guide was very knowledgeable( I'm sure they all are) and gave much info on how the spice is processed and what parts are used for what, ie cooking, therapeutic oils etc.Buffet lunch was average, but then you pay less than $10 AUD to enter so you can't expect too much. Gift shop was nice but unfortunately with our quarantine laws, can't bring back spices so I settled for oils."
Tropical_Spice_Plantation-Ponda_North,Sandy J,5.0 of 5 bubbles,Jan 2018,Interesting visit,"We visited the plantation a few days ago. I loved the welcome we received  - a shower of yellow petals and a red marking in our forehead, followed by a refreshing spicy tea. We had an excellent guide who showed us all the plants that they grow. This was followed by a buffet lunch. Really worth a visit"
