Tourist Attraction,Name,Rating,Date and criteria,Title,Review
Nahargarh_Fort,annu sharma,4.0 of 5 bubbles,Feb 2020,Historical retreat,"Beautiful view of the city from the fort. Historic place built with amazing architecture by  the Maharaj fondly known as the Nahargarh fort. The entry fee to the fort for Indian citizen is INR 50 .  Great place for family hangout with ample of historical information.One would be advised to avoid the wax museum as it is very costly and you cannot take photograph from your mobile phone too, u need to hire a photographer inside who will charge you 300-400 for 8 to 15 photographs, its ticket price is INR 500 that includes entry to wax museum and sheesh mahal. Also in Sheesh Mahal they give wrong information to tourists that itz the only one in the world having a mirror floor. Lot of monkeys are there in the fort but they do not harm the tourists.A visit to the fort is highly recommended to those who love historical places."
Nahargarh_Fort,kshantanayar,5.0 of 5 bubbles,Feb 2020 • Family,Another historical slice! ,Old ramparts having faced many wars & seen many hands changing. Place overrun with monkeys though. 🙂🙂
Nahargarh_Fort,Ashish Reja,5.0 of 5 bubbles,Feb 2020 • Couples,Very long forte,Good forte for the journey there was very long area for walking good quality of the forte ancient memory
Nahargarh_Fort,Asteri N,5.0 of 5 bubbles,Feb 2020 • Friends,Great view. ,"Great fort, nice view of jaipur! Beautiful architecture with small rooms, labyrinth type. Definitely worth visiting. "
Nahargarh_Fort,royalescape,4.0 of 5 bubbles,Jan 2020,Best for the view of Jaipur,Ideally you can sit and enjoy some tea and snacks at RTDC restaurant and enjoy the view of walled city of Jaipur. At night it's more beautiful to watch.
Nahargarh_Fort,Debasis C,4.0 of 5 bubbles,Dec 2019,Nice fort,You can spend two hours here to see this fort. You will have an idea how a fort looks like. you can have your lunch in the RTDC restaurant which offers excellent food and you will get an excellent view of Jaipur from this hilltop Restaurant.
Nahargarh_Fort,nrups s,3.0 of 5 bubbles,Jan 2020 • Couples,Keep wondering why we went there ,"It's a loosely developed tourist destination where the tourism board is not sure what to do of place.First of all, its at a high point of the city, so be very careful on choosing the driver.Once you pass the entrance, the points of interest are scattered around. Some robotic animal show here, sunset point there. Some high end restaurant here, some temple there. There were no proper sigb boards or history or relevance of the place mentioned anywhere.There is an rtdc restaurant located in nahargarh from where you can see the whole city. Sounds superb but the service is total turn off.In all, no history, no nature, no thrill. Totally avoidable. "
Nahargarh_Fort,Dr Sandesh Kedia,3.0 of 5 bubbles,Jan 2020 • Couples,"Don't visit, save an hour and spent it on Amber fort",Just visit Amber fort and you are done. No other fort can satisfy you if you spent a good time at Amber fort.
Nahargarh_Fort,anurag62,4.0 of 5 bubbles,Dec 2019,"A Must see when in the Pink City, Breattaking Views all over.","Was there in End of December. This Nov-Feb is ideal period to visit this place. Went their quite early , to beat the rush..This is most advisable as by afternoon you may feel scared , as lots and lots of vistors throng this place. You just get into awe of the place , as these places have been built with resources available in those time period. This place is also a reminder of the Proud History of Rajashthani Kings and their Majestic Forts . You can take pics at different places in the Fort , those will all come great. The Road width and maintenace is quite qordonary.Ticket Costs are high...but even then worth a visit. Go with a local guide who can live up history for you. Cheers :)"
Nahargarh_Fort,KSB72,3.0 of 5 bubbles,Jan 2020 • Family,Great historical monument but disgusting wax museum and house if mirrors,The ride up to the fort is very picturesque. The grand feeling ends right there when one gets in the line to buy the entry tickets where a Rajasthan police cop very rudely chases away the companions of the people in the line.Going in one encounters the wax museum and house of glass . THIS IS A PRIVATE ENTERPRISE and is a total RIP OFF. The guy there behaves as if he owns the fort. The wax museum is substandard and not at par with what you would be expecting and the house of glass is another let down.AVOID THESE TWO and carry on with the tour of the fort.How can the government allow this business enterprise which is masquerading as a part of the history of the great monument   
Nahargarh_Fort,Vijayaraghavan S,5.0 of 5 bubbles,Jan 2020 • Family,Worth visiting too see sunset,Gives a terrific view of Jaipur city. A visit around sunset time is definitely worth it. Takes about 1 hour to see the place and watch the sunset from sunset pointThe auto guys pester you to visit the house of wax inside the fort complex as they get a good commission but we skipped itThe view from the top makes the trip much worth the long drive
Nahargarh_Fort,camsandeep,5.0 of 5 bubbles,Jan 2020,Amazing and picturesque view,The highest hill in the area and best time to visit is during sunrise or sunset. You will be having the best view of the city and nature. Wax Museum and seeshplace are worth worth watching.
Nahargarh_Fort,Vishal Shah,4.0 of 5 bubbles,Jan 2020 • Family,Visit,For indian nationality adult ticket is 100 rs per person.5 years old kids are free.and students id get have discount for entry tickets.
Nahargarh_Fort,SibsagarVish,4.0 of 5 bubbles,Feb 2019,The view outside more memorable,The fort is ideally located on top for a beautiful view of the jaipur city... especially with the sunset as the backdrop. The inside of the fort built for the many queens are quite good but no match for the views outside from the top of the nahargarh fort. worth the visit. not to miss.
Nahargarh_Fort,abrahamsuji,5.0 of 5 bubbles,Jan 2020 • Family,Best example of Public Private partnership,Wax museum & Hall of mirrors are must visit. Strict rules of conduct help maintain the place well. Must visit.
Nahargarh_Fort,tajinder pal,3.0 of 5 bubbles,Dec 2019 • Family,Jaipur visit ,"Wax museum , sheesh mahal good attractions .If you visiting with children  pls make sure  keep there school college ID cards for concessional tickets ."
Nahargarh_Fort,mgaurav7,5.0 of 5 bubbles,Jan 2020 • Family,Amazing Fort vd beautiful Sheeshmahal,Had a great experience visiting Nahargarh fort.Visited Wax museum and Sheehmahal there which adds to the beauty of Fort.Must visit.
Nahargarh_Fort,NISHANKSAROHI,5.0 of 5 bubbles,Nov 2019 • Family,Famous attraction of Pink City.,"Famous Attraction of Jaipur, built by Maharaja Jaisingh II. Basically this fort was the residence of 9 queens of King, separate same portion was made for each queen having. It also served as defence property for the rulers. Breath taking view of jaipur city can also be witnessed from there. There you find one wax museum  and sheesh mahal as famous attraction of there. In wax museum you can watch wax statues near to life  . Sheesh mahal is really mesmerizing Attraction of the property made up of glass work, 24 caratgold plated paintings.. not to miss."
Nahargarh_Fort,bhavnabkumar,5.0 of 5 bubbles,Dec 2019,Entertaining and Mesmerizing,"Nahargarh Fort is located a little outside the Jaipur city. Within the fort there are different attractions. Let me warn you it can be quite a walk with steep staircases. My mother is a senior citizen and has issues with walking long distances; however she did not face that much difficulty. Ask your car driver to drop you at the car park. That is very close to the gate, reduces the walk. Inside the fort, there is a wax museum and sheesh mahal (must see). The ticket is on the expensive side however if your budget permits, don't miss the Sheesh Mahal. It is very beautiful and the do listen to its audio carefully. It is very interesting. The wax museum is fun. You are not allowed to click pictures inside. However, you can request for a photographer. Soft copies of the photos are provided at an extra cost.There are some artists displaying their skills like pottery, traditional folk music and a magician. These are just to pass your time till your turn comes to visit the Sheesh Mahal. Limited people are permitted inside at a time. Next, there is a step well, and a water storage tank. Just gives you information on how rain water was harvested in olden days. The views from this fort are breath-taking. Please don't visit the fort on a Sunday, we did that mistake. It was very crowded. Finally, there is Madhavendra Bhawan. We hired a guide and it was helpful to understand the history of the palace, the queens' rooms, toilets, bathing areas, summer residence, winter residence, chimney, how the king entered and none of the queens knew in whose chamber he would spend his time.... was all very interesting. If your budget permits, do hire a guide. We were charged INR 200/-. The tour took us a lot of time because of the crowd and the fact that I had senior citizens with me who walked very slowly. There are steep, narrow staircases to climb inside Madhavendra Bhawan, not too many though. 2 - 3 hours are sufficient here. There are restaurants inside the fort including a fine dining restaurant. I recommend don't eat from here if you are on a budget. Moreover, the taste is not too great either. There is a small eatery outside the fort which is cheaper. Can't comment on the taste as I did not eat.Overall verdict - Must visit!"
Nahargarh_Fort,Steve R,5.0 of 5 bubbles,Dec 2019 • Couples,Don't let the drive scare you,"Although we didn't visit every high point in Jaipur, I feel confident in saying that the views from Nahargarh Fort are as good as they get.  Definitely worth the crazy drive to get there."
Nahargarh_Fort,wandererlust,5.0 of 5 bubbles,Feb 2019 • Family,Nice again,"All three forts in Jaipur are adjacent to each other, though you do need to travel a bit to reach them. All 3 of them offer excellent views and are must visits..."
Nahargarh_Fort,Geeta R,4.0 of 5 bubbles,Jan 2020,The view is worthwhile during sunset,"Firstly, for those who want to know if you can reach nahargarh fort without taxis/drivers - then yes, it is possible but it is very steep / if you are comfortable driving uphill on a steep road with ditches on side then go for it. I am not comfortable with it and I didn’t do it.Secondly, I would recommend keeping amer fort and nahargarh fort for the same day if you’re young - most of the route is the same and it splits half way through.Thirdly - i personally thought that the fort was only worth the sunset - the fort only had Morden art displayed and I personally thought that that took away from it beauty. Watching the sunset over the entire city of Jaipur was worth it though.Forth - if you are on the heavy side - then the stairs going up to the roof top may not be able to accommodate you."
Nahargarh_Fort,Shobha,4.0 of 5 bubbles,Nov 2019 • Family,Fort is good,The view from fort is good . But avoid buying tickets of wax museum it is about Rs 500 and believe me it is not worth it .
Nahargarh_Fort,Prabhu Ram,5.0 of 5 bubbles,Dec 2019 • Family,"Fort is good, Avoid wax museum ",Separate tickets for Fort and Wax museum. Buy tickets only for Fort visit.Privately run Wax museum not worth Rs 500 per person. Instead you would spend more time in Fort.
Nahargarh_Fort,Shwets19,5.0 of 5 bubbles,Dec 2019,tiger fort,fort is good.. as compared to other fort in jaipur.. here is wax museum and sheesh mahal is additional you can visit.. 500 rs fees is overpriced but sheesh mahal is worth to watch. sunset and city view is awesome. no quide  requires here. plan to visit here in the evening so that you can enjoy sunset and city view.
Nahargarh_Fort,rameshcri2001,4.0 of 5 bubbles,Dec 2019 • Friends,"Fort is good ,wax museum fees is too much ","Wax museum have limited place  not  worth for 500 rupees ...Fort and all good to visit ..Can see the view of Jaipur from the fort.really it was remember how the fort made in those days ...city view,jal Mahal view from the  fort can enjoy ..fort inside and top can see and enjoy ...food court availble inside ...."
Nahargarh_Fort,S k j,5.0 of 5 bubbles,Dec 2019 • Couples,Tiger fort,This is the place which is srounded by 4 deewar awesome place srounded by beautyfull green hils and and their boundry wall's which is looking so beatyfull jaipur city looking awesome from top of the fort in evening their is some folk dancer  showing their cultural dance so awesome i want came heir again and again i have't words  awesome historical place with awesome rastourerant  also available  here for foode people
Nahargarh_Fort,Chitralekha Services Syndicate,1.0 of 5 bubbles,Dec 2019 • Family,Nahargarh fort,You have put a wrong photograph  of Naharagarh fortPleaze insert correct photo.Although Nahargarh  which also known  as Sudarshangarh was used as a stronghold for the protection of Jaipur.During the period of Maharaja Jagat singh Raskappor a Nautch girl who was trying to become queen of Jaipur was imprisoned  here.Later duding the reign of Maharaj Madho singh second the fort was  used as prison house for prisoners.
Nahargarh_Fort,Soumya Ranjan Satpathy,5.0 of 5 bubbles,Nov 2019,Marvellous architecture and history,"High architectural value, excellent craving and art work. A must visit place in Jaipur. Best thing is to watch sunset and sunrise from the fort.Food is avialble inside the fort but costly.You need to reserve vehicle to reach the fort"
Nahargarh_Fort,Sneha Nagare,5.0 of 5 bubbles,Dec 2019,Nahargarh Fort,"Before Jaipur was made the capital of Rajasthan, the majestic city of Amer stood tall as the capital of the Rajput. ... Nahargarh fort along with Amer Fort and Jaigharh Fort had formed the defense to the then capital. ... The fort now also is home to the Jaipur wax museum and glass palace."
Nahargarh_Fort,Akash Deep,5.0 of 5 bubbles,Dec 2019 • Family,Nahargarh Fort,"- Nice one, situated on a moderate height. - I never drove on hills but it was an easy one and made it with my own car.- It is divided into 3 parts:   - Only palace visit - entry fee 100/-  - Sheeshmahal and Wax Museus - 500/- per person. Children above 3 will also be charged full.- Better to get a guide from inside the palace. I strognly recommend to get one else it would not be a worth trip. Guide will tell you the significance of each room and other areas of the fort.- Wax museusm is worth to pay a visit.Very good learning for children.- Sheeshmehal is also a good one.- Clicks are not allowed inside Sheeshmehal and Wax museum however, you can hire an inhouse photographer and he would charge you as per the pic size you prefer.- There is a food court as well inside the fort. Plan your trip to Jaigarh fort next as it is on the way while returning from Nahargarh.- Overall, it was a nice experience."
Nahargarh_Fort,p g,3.0 of 5 bubbles,Aug 2019 • Friends,Very filmy,This fort is to filmy simple because it's been  shown in so many films... It's on your luck if on the day you visit and the location are open which are been used in shooting else they have mostly conserved it with baracatess..
Nahargarh_Fort,Shariq,4.0 of 5 bubbles,Dec 2019 • Friends,A Must Visit ..,"Great Location which require lots of walking.. but all an all a must visit place to understand the culture and history of Maharaja's time. Around 15 km from the railway station, easiy accessable through taxis.  Go and enjoy Nahargarg Fort, Sheesh Mahal, Sunset Point and Sunrise Point."
Nahargarh_Fort,Girraj Sonkhiya,3.0 of 5 bubbles,Mar 2019,"Best for sunrise, sunset, and architecture.","It is located in the Aravali mountain range you can go there by drive and by public transport too but i will suggest  if you are okay with driving and can manage your drive than you should definitely go there by drive you will experience one of best the view of jaipur from there, the roads the view the sunrise and sunset makes the place so beautiful there are mini shop on the middle of the roads where you can eat and have maggie, chai and other snacks, there is one museum and inside the for you can spend and can get some history experience. There is one baori there where rang de basanti had been shooted, there is tickets for entry in the fort and for parking too. One of the best fort of rajasthan."
Nahargarh_Fort,Sriram_064,5.0 of 5 bubbles,Nov 2019,The second best of the 3 forts in Jaipur. Don't Miss!!!,The Palaces that were used by the queens of Jaipur are ornate and decorated very well with paintings. There is an added attraction of various artefacts on display that are of modern architects and sculptors in each of these palaces. The Palaces are just a Never Miss since they are very well maintained to this day.
Nahargarh_Fort,PKfamily,4.0 of 5 bubbles,Nov 2019 • Couples,Great views,This hill fort has spectacular view points. The interior is filled with art installations and is very different to other forts.
Nahargarh_Fort,Luise E,2.0 of 5 bubbles,Dec 2019 • Friends,Just don’t. ,"200 rupees, but at least 800 rupees to come and go, as it is a steep way up, of 11 kilometers. We found the fort poorly kept, and it had weird modern art exposed, which took the beauty of of the place.Wouldn’t recommend it. "
Nahargarh_Fort,Grumpy013,2.0 of 5 bubbles,Nov 2019 • Family,Maybe,We were disappointed! It's a lot of money when you add the transport & tickets. You see the fort and around. You need to pay for all the other attractions. Foodcourt is okay - not a lot of tables. We had shakes and there were not good and food&drinks are expensive. Better to go to Amber Fort. 
Nahargarh_Fort,Martina Hohnjec,5.0 of 5 bubbles,Nov 2019 • Friends,Absolute must-see!,"A location that is an absolute must-see! Get a motorcycle, head there before the sunrise and enjoy the city panoramic view before everyone wakes up. I also had some fresh fruits from a guy who cut them fresh. After, take a beautiful road down to the city."
Nahargarh_Fort,dizzybl0nde,4.0 of 5 bubbles,Nov 2019 • Couples,Not as busy,"Worth going. Cheap to get in. Visited on way to elephantastic. Good photo opportunities as so high up, great views. "
Nahargarh_Fort,Leslie L,5.0 of 5 bubbles,Nov 2019 • Solo,Wonderful view of Jaipur city if not for the fog,"I took a day tour with Royal Majestic Tours booked through Viator.com. The guide, Mukesh was excellent and very knowledgeable. After Amber Fort we went to Nahargarh Fort to admire the views of Jaipur city. Unfortunately, it was a foggy day. The fort, however, has an interesting history and is certainly worth visiting. "
Nahargarh_Fort,jazsacher,3.0 of 5 bubbles,Nov 2019,Interesting Fort,"I enjoyed my visit to the Nahargarh Fort in Jaipur.  This was a large facility and grounds and was easy to get lost since there were 2 separate entrances and exists.  What I enjoyed most about my visit were incredible views of Jaipur city up close which made some amazing shots  As for the rest of the visit, it was just ok.  Nice to walk around and view the structure and its various fort architecture.  However, I wouldn't list this as one of the top attractions to see in Jaipur."
