Tourist Attraction,Name,Rating,Date and criteria,Title,Review
Nahargarh_Fort,David D,5.0 of 5 bubbles,Jan 2023,A large fortress overlooking the city of Jaipur.,"The Nahargarh Fort looms over the city of Jaipur on a nearby mountain, helping to protect the city. The views here are great, but sometimes obscured by the haze of pollution that sometimes descends over the city. The interior is painted in a uniform manner. The outer areas of the fort also hold restaurants and a host of other attractions. It is far less frequented than Amer or Jaigarh Fort and is good if you want to go to a tourist attraction that is less crowded."
Nahargarh_Fort,Sarah R,3.0 of 5 bubbles,Dec 2022,Impressive Views but Sheesh Mahal is a rip-off.,"The views of Jaipur and the valley from this fort are impressive.  There’s also a step-well inside.Having paid to get into the fort, there is a second steep 700Rp fee to get into a privately-run complex inside (the Sheesh Mahal). This consists of a wax-work museum, a room decorated with mirrors, a moth-eaten stuffed tiger with a clockwork mechanism to move its head from side to side, and also has various side-shows (a magician, a puppet show, a potter, each of whom will want another 100-200Rp).  If you’re the kind of person who loves Disneyland or M&M world, go ahead.  But frankly, it’s a tacky rip-off designed to part tourists from their cash."
Nahargarh_Fort,Trudy W,4.0 of 5 bubbles,Dec 2022 • Solo,Worth the hike up the hill for city views.,I enjoyed walking up the winding hill. Don’t need to  take the tuk tuk. It is 20 minutes and quite steep but you get a great view looking over the city and in the distance the Aravalli mountain range. The palace in the fort is ok  from the outside. It’s completely empty inside but the view from the roof terrace is nice. The day I went the visibility was bad due to pollution but I still enjoyed the hike up and down. 200 rupee tourist entry.
Nahargarh_Fort,singhasam,4.0 of 5 bubbles,Nov 2022,Lovely views.,"HIGH on a hillside lies this fort which formed part of the defences for Jaipur.It was mainly built in 1734 although it was later extended and a range of palaces built there.When I visited the fort it was easy to see the commanding views it had of the surrounding countryside and down to the city of Jaipur.The fort, which is also known as the Tiger Fort, was a welcome blustery experience on a hot day.I walked along the ramparts and it was possible to look down on fortifications below which were not open to the public.On the top level visitors could look down into little courtyards which formed part of the Royal apartments which were beautifully painted.Slightly distracting while I was there was a colossal fight among a group of monkeys with much deafening screaming and calling.Different sections of the palaces reflected the seasons with the one lived in during the winter having its own fireplace.Definitely worth a visit which can be combined with the nearby Jaigarh Fort which houses the world's biggest ever cannon."
Nahargarh_Fort,Meghana,5.0 of 5 bubbles,Nov 2022 • Family,Loved it,It was a beautiful place with lovely wax museum magic show puppet show sheesh mahal Worth to visit this place for all tourist Helpful ppl guides photographers enjoyed overall experience would definitely recommend it
Nahargarh_Fort,jsthouston,5.0 of 5 bubbles,Oct 2022 • Couples,Best of the Forts,While not a fort in the sense of the other two nearby this was by far my favorite site in Jaipur.  Relatively small and beautiful it gave the appearance of a palace rather than a military fort. It also offers the best views of any of the forts over the city and country side
Nahargarh_Fort,Abhishek Wadekar,5.0 of 5 bubbles,Oct 2022 • Couples,A must try spot,Good experience.Good view of the city of Jaipur from the fort.Good spot to spend a quality time with family and friends.
Nahargarh_Fort,Ritikawill,5.0 of 5 bubbles,Sep 2022 • Friends,Wonderful,"There are several view points and photography points to take good pictures. You can also take elephant ride inside the fort. Must visit palace!Very amazing and huge place with very charming views surrounding.Great architecture design and beautiful historical site. Some area still in repairing, but overall considered well maintained. We wish the place will keep maintained and well preserved."
Nahargarh_Fort,Subrat Saurabh,3.0 of 5 bubbles,Sep 2022 • Couples,One time visit during day time,If you are travelling with kids then you need to walk a lot. You will find local hawkers and guide very expensive. The road to fort is not well maintained and don’t find safe. You will find lot of peacock on the way which is a best part about this fort.
Nahargarh_Fort,Aakash V,1.0 of 5 bubbles,Sep 2022 • Family,Insecure,"Travel planned to reach the Fort at 7pm expecting it to be lightened. The long 15km route from main road is narrow, broken, unpopulated, thick darkness, no street lights and most susceptible route to get looted or attacked. The Fort was in total darkness with police only to collect entry fees."
Nahargarh_Fort,Ankit Saxena,5.0 of 5 bubbles,Aug 2022 • Friends,Peaceful and scenice view spot,"Nahar garh Fort is on the hill. Before reaching the fort, there are several places where you can stop and enjoy the view.  You get good view of the Jaipur city. Calm breeze and scenic view."
Nahargarh_Fort,Arpit Agarwal,5.0 of 5 bubbles,Feb 2022,Nahargarh Fort Visit,"Nahargarh fort was a good experience to visit, there only you can see the wall and some temples and doors 🚪 historical, rest of the items they only build and just to make money from tourists like wax museum sheesh mahal and nothing else to see there"
Nahargarh_Fort,mick582,5.0 of 5 bubbles,Jun 2022 • Solo,Favourite place in jaipur,This place is just awesome ( I would recommend you to take a bike on rent and driver till there ) the view from the top is excellent you can see the entire pink city from there also they have cafe + bar on the top where you can get some nice dishes and grab some beers .
Nahargarh_Fort,Sarfraz_Vanoo,5.0 of 5 bubbles,Jun 2022 • Family,Jaipur Nahargarh fort,"Very nice experience....From the Nahargarh fort, you get a clear and full view of the entire Jaipur city.It is around 35-45 mins from the city centre and you can take a rickshaw/cab in case you are not taking your car. It has proper parking, has a sheesh Mahal and wax museum, very nice, cleanly managed internal roads.On the way back we sighted more than a hundred peacocks and pea hens in the vicinity..they seem to have a liking for this place. Must visit"
Nahargarh_Fort,Anand D Nanavati,4.0 of 5 bubbles,Nov 2021,Combine with jaigarh,Nice fort which can be combined with Jaigarh fort.  We did not go in the paid fort part.  There is sunset point and small eateries outside.
Nahargarh_Fort,satish7113,5.0 of 5 bubbles,Apr 2022,Magnificent Nqhargarh Fort,"Climb to Nahargarh fort is awesome. Take your time on the climb. Take pictures. When you reach the Fort, you will witness a fort worth remembering. Great artistic work.  Great views of the Jaipur City.  It gives you moments to connect with your past. Overall great place to visit. Entry fees is Rs 50 for indians."
Nahargarh_Fort,ajay,5.0 of 5 bubbles,Mar 2022,Beautiful palace,Historical fort built as vacation palace for the king. Taking a guide is highly suggested as it helps in the understanding of structures with the fort.
Nahargarh_Fort,Indrani M,4.0 of 5 bubbles,Mar 2022,enjoy bird's eye view of Jaipur city from atop!,"We could only visit the Madhavendra Bhawan in detail since we went around 5pm. even the Baoli was closed for view, though the security guard was sitting at the top of the stairs and could allow small groups to descend the stairs. Moreover at all signages the fort is described to be open till 7pm, without mentioning that the baoli will be closed to visitors. Post dusk, the behaviour of the uncomfortably friendly locals could be better checked with appropriate security measures.  Likewise the local transport could be better utilised if only there were standard rates preventing the fleecing of tourists. The attitude of locals can attract or divert tourists and a State which advertises about ""Padharo mhare desh"" ought to have better policies to maintain their supremacy in tourism. "
Nahargarh_Fort,deepak kumar,5.0 of 5 bubbles,Dec 2021 • Friends,Nice place,"Very nice place to visit in jaipur, Superb location and Fort,Click beautiful images here to cherish for long………..:….."
Nahargarh_Fort,ShyamKasturi,4.0 of 5 bubbles,Dec 2021,Good historic fort,The fort with designs using natural colors is a must see place in Jaipur. Not that much big when compared to Amer or Jaigarh forts. The wax museum and seesh mahal at the entrance of the fort are of very expensive and can be skipped if you already visited wax museum anywhere else.
Nahargarh_Fort,S88064,4.0 of 5 bubbles,Nov 2021 • Friends,Jaipur visit,Amazing place to visit we have been there with friends and we were very happy nature's and one should visit..
Nahargarh_Fort,Sherin,4.0 of 5 bubbles,Dec 2021 • Family,Avoid Sheesh Mahal,"Fantastic place except for the makeshift Sheesh Mahal here. While taking ticket, avoid Sheesh mahalSheesh Mahal here is Not worth the money. Note that this is not a historic site. This is a makeshift arrangement built in 2017. They charge height to enter this place whereas the the original sheeshmahal in the Amer palace is free to enter and 10000 times better than this.Also no photos are allowed in Sheesh Mahal at Nahargarh fort, whereas you can take photos as you like in the Sheesh Mahal of Amer for which is almost 500 years old."
Nahargarh_Fort,Shravan B,4.0 of 5 bubbles,Nov 2021,Worth visiting for the breathtaking views of Jaipur city from the top,"Have to visit this fort for a fantastic view of Jaipur city from the top!!!Compared to the other forts ,this fort can be done away with only 1 to 1 and half hr and we did take a guide but felt we wouldn't have missed much if we did not hire him in the first placeThere are other attraction like Sheesh Mahal(artificial),original one is at Amer Fort and Wax Museum for which the ticket charges are separate.On the way to this fort you get breathtaking views of the Jal Mahal for which you can stop your car/cab and take some photos Near to this fort is the Jaigarh fort which is also worth visiting and will take even longer time than this fort,it is adviced to club these two forts together in a single trip as they are nearby to each other.Amer fort should be done separately to do justice to it as it is at an even more further distance away from these 2 fortsYou also have the sunrise and sunset points at this fort and if you happen to be there at this fort during these times ,you can witness beautiful views of sunrise and sunset from this place"
Nahargarh_Fort,Rohin V,2.0 of 5 bubbles,Sep 2021,Least suggested,"Nothing much about the place if you have visited Amer Fort, most of the fort is been rented to private business units for restaurant, wax museum, seesh mahal who charge separate to the fort govt entry feeThe only best part is you can view the entire Jaipur city from the fortAll credit goes to govt for not maintaining the same"
Nahargarh_Fort,Subbukanyakumari,5.0 of 5 bubbles,Sep 2021,Must visit this place in Jaipur which has a rich history of Jaipur Kings,"We visited the Nahargarh fort during last week of Sep’21. The ticket to the Nahargarh fort costs INR 50 for Indian nationals and INR 20 for Indian students. We purchased a composite ticket for INR 400 (INR 100 for students) which allows entry into 8 attractions managed by Government of Rajasthan. City palace, Jaigarh fort etc are managed privately by the Jaipur Royal Family and therefore not covered under the composite ticket.  It’s the highest of the three forts in Amer and located on the Aravalli hills. The fort offers scenic views of the Jaipur city. The other attraction within its premises is wax museum, sheesh mahal, puppet show etc which are managed by private operators with separate entry fees of INR 500. There are also Segway rides for INR 200.On the way you uphill, you will find a diversion towards Jaigarh fort as well and at the base Amber palace is located.Nahargarh fort is open from 10 a.m. to 10.00 p.m. This is a must visit attraction if you are in Jaipur and taking a guide is recommended."
Nahargarh_Fort,Inderpal Singh A,4.0 of 5 bubbles,Aug 2021 • Family,Less crowded fort,A short and enjoyable 30-35 mins drive from Jaipur city. Not much walk and convinent to access from parking. King Madho Singh was living with his 9 wife's and we'll.managed to access queens room. Jaipur city view is nice from height. Don't forget to capture loveable moments. Entry is rs 50 only but you need to pay rs 500 for sheeshmahal and wax museum. Ohh missed to tell about puppet show.
Nahargarh_Fort,Mohammed khan,5.0 of 5 bubbles,Aug 2021 • Family,Waste of time,"Nahargarh fort  was good experience to visit, there only you can see the wall and some temples and doors 🚪 historical, rest of items they only build and just to make money from tourists like wax museum sheesh mahal and nothing else to see there"
Nahargarh_Fort,AchintSinghal,4.0 of 5 bubbles,Aug 2021 • Family,Nice but not extraordinary fort...,Its a comparatively new fort and would just like to see place where Rang de basanti movie scene is shot. Some new wax museum is recently developed over there...Nice but not extraordinary fort...
Nahargarh_Fort,fozjon,5.0 of 5 bubbles,Aug 2021,amazing place,"having just walked all over Jaigarh Fort in the heat, we weren't sure we were ready for another fort...but this was amazing. So glad we went. This fort has apartments where the King's nine wives had apartments. "
Nahargarh_Fort,KathakaliC,5.0 of 5 bubbles,Jan 2021,The gorgeous fort and the grand view from the top left us mesmerized!,"Nahargarh fort at night offers a spectacular view of the whole city. It is magnificent to say the least. It also has a restaurant run by Rajasthan Govt., the food and hospitality is just brilliant!"
Nahargarh_Fort,A Choudhury,4.0 of 5 bubbles,Oct 2020 • Solo,Beautiful Fort,Visit this fort in the evening after visiting Amber fort and Jaigarh fort as this fort offers a splendid view of the city during sunset. An hour is enough for this fort and photography is permitted.
Nahargarh_Fort,S88064,4.0 of 5 bubbles,Apr 2021 • Friends,Nice place ,"Very nice place to visit in jaipur, Superb location and Fort, we were there with friends, we had enjoyed a lot "
Nahargarh_Fort,Ravi Kumar,5.0 of 5 bubbles,Feb 2021,It is beautifully built but the main attraction of this fort is the tour of Sheesh Mahal,Nahargarh Fort stands on the edge of the Aravalli Hills and probably on of the longest and highest hill in Rajasthan. From here you can see almost Jaipur(Pink City). It is beautifully built but the main attraction of this fort is the tour of Sheesh Mahal
Nahargarh_Fort,KALA Nikhil,5.0 of 5 bubbles,Mar 2021 • Family,Nice place,"Not much of walking from the front entranceAlmost 2km of walking from back side,so if you are not able to walk avoid that way.Should hire guide for better understanding of the place.pay around 100only as it will take only around 25minThere was a sheesh mahal also,which had extra charges,we skipped that placeThere is a beautiful step well inside thay fort where one scene from rang de Basanti was filmed "
Nahargarh_Fort,ritica_travel_diary,4.0 of 5 bubbles,Mar 2021,Nahargarh - Hill top fort,"Located on the hilltop near Amber fort and palace and Jaigarh Fort. It can be reached by taking a forest road. The fort walls can be seen from a distance.  The fort was built for emergency purposes in case of any attack on the kingdom.  What we see inside the fort is where the king can live with his 9 wife’s and how all the rooms are located around one courtyard. From the top of the fort, we can see the city view. Inside the fort complex there is a Wax museum and 2 restaurants. Overall, it is an interesting place to visit."
Nahargarh_Fort,Bhumika Kaushik,4.0 of 5 bubbles,Feb 2021 • Family,Fort with a view of city Jaipur,"Nahargarh Fort is located at the highest hill location in Jaipur.It is beautifully built but the main attraction of this fort is the tour of Sheesh Mahal. As the name suggests, a place entirely made of glass.There are no pictures allowed inside.The ticket is for 500/- per person which includes the tour of Sheesh Mahal, Wax Museum, a kathputli show, a magic show and pottery. It was every bit worth it.Go there with your family to relax and enjoy the view of the city."
Nahargarh_Fort,JayeshLC,4.0 of 5 bubbles,Jan 2021,City View Photo Stop,You can have a good city view of Jaipur. Guide is not required and you can drive right up to the fort.
Nahargarh_Fort,Sim Kaur,4.0 of 5 bubbles,Feb 2021 • Friends,Night view is totally worth it ,"Fort visit timings are 10am-10pmJaipur s promoting night tourism hence the extended visiting timings of fort.Night view is better than the day view. The uphill road towards the fort is dark without many street lights, but once u reach the fort, the top view is totally worth the effort !(Visit at night if u want to escape the crowd. The fort is well lit both inside and outside during night.)Night view is super !"
Nahargarh_Fort,Sanjay Malhotra,5.0 of 5 bubbles,Jan 2021,Amazing Nahargarh Fort !!!,"We had visited this fort and found very interesting. Apart form the historic values, we can also view Jaipur city from the fort. This is the property of Royal family and is maintained by them. Just to share if you have elderly person in your vehicle, then the security allows you to take your vehicle near the entrance of the fort."
Nahargarh_Fort,ankit,4.0 of 5 bubbles,Jan 2021,good fort and large cannon,"good place, try to take there guide as they will help you in parking at good places and will also click photoes for you apart from informing you about the fort.has a large cannon, also good view of the city."
Nahargarh_Fort,Anurag,3.0 of 5 bubbles,Jan 2021 • Couples,Don't use their Photographer,Place is good.. Nice Scenes.. but don't go for their Photographer.. photographer will click and ask you not pay to at office rather tell you that he will send on your individually. Will ask for money and will not send you photo.. I have already lost 600 rs this way..
Nahargarh_Fort,Lalit,5.0 of 5 bubbles,Dec 2020 • Family,Good place for an exceptional city view,We visited Nahargarh fort on Dec 25th 2020. The fort has been maintained with proper cleaning and security management. The area had a huge crowd which I was not expecting citing Covid scare. The fort had a spectacular view of the city. 
Nahargarh_Fort,AryaTushar,3.0 of 5 bubbles,Dec 2020 • Family,Just another stopover in Jaipur,Nahargarh fort is one more fort in jaipur. It has undergone renovations and is in much better shape than it was 10-12 years ago. Not much to see. It has the residence of nine wives of the king. Will take about half an hour to see. A new addition to the fort is the wax museum and the sheesh mahal . Though nothing extraordinary they were enjoyed by the kids. They are like a very well made bollywood movie set. 
Nahargarh_Fort,monika,5.0 of 5 bubbles,Nov 2020 • Friends,A fun day in nahargarh fort,Nice palce in Jaipur lots of old things there we were injoy there really miss that time I hope we will be come back next year to visit  here
Nahargarh_Fort,Rajesh Ranjan,5.0 of 5 bubbles,Nov 2020 • Family,Joy filled trip,"Wonderful to visit the Fort. Loved the experience. Wax museum, Sheesh mahal, magic show, pottery, puppetry show are a must watch. The Fort gives a very good view of the pink city. "
Nahargarh_Fort,Vinay B,5.0 of 5 bubbles,Oct 2020,Great fort,Great fort and the local guide gave a good historical background of the fort....one of the good forts in Jaipur
Nahargarh_Fort,Nandini,3.0 of 5 bubbles,Oct 2020,Mediocre,"The fort itself is interesting. What was disappointing is the common refrain about the sunset from there. Honestly, we were disappointed and felt the cafe there which is touted as a place to get your free choice of beverage was overstated. The air quality being bad on the day we visited, we did not find it spectacular. Instead, when the lights came on, that was a better sight to observe of the Jaipur city than any other time."
Nahargarh_Fort,Vinay K,5.0 of 5 bubbles,Jun 2020 • Friends,Seen of jaipur,"The fort on the top of jaipur from there u can see arial view of jaipur from one palce can ride of solo scooter , sunset and surising points places local"
Nahargarh_Fort,Gl0balCitizen2013,3.0 of 5 bubbles,Jul 2019,Not as impressive as Amber Fort,"The Nahargarh Fort is not as impressive as Amber Fort and there isn't much to see. The drive up to Nahargarh Fort is nice and the view of Jaipur from the Fort is the only good thing about it. There are some ticketed attractions within the Fort, that seemed to me to be a bit amateurish. We spent around 30 minutes at the Fort, took some pictures and headed back down to Jaipur."
Nahargarh_Fort,Anjan Sengupta,3.0 of 5 bubbles,Feb 2020,Can be skipped,I am not sure if this a UNESCO Heritage as it doesn't deserve to be one. There is nothing worth seeing here as compared to Amber or Jaigarh Forts.Its just a place where a King had kept his 9 Queens in different parts of a Building. One can visit here if you have extra time..Also please avoid the so called 'Sheesh Mahal' for which you need to pay extra.Its just a waste of money
Nahargarh_Fort,gundeep singh,4.0 of 5 bubbles,May 2019 • Solo,The fort,Its is on the top of the mountain nearby the pink city .. the only thing to visit last in pink city. .. from there u can see the whole world below
Nahargarh_Fort,Ajay,5.0 of 5 bubbles,Feb 2020,Rang De Basanti Fort,"It is really worth the time. Really amazing view of the beautiful pink city from the top. It's good to visit the place with friends or family. I have personally always liked sunsets from a beach, however, sunset from the fort took my breath away. Would definitely recommend everyone to mark Nahargarh Fort as a to-do in their upcoming trip to beautiful Jaipur."
Nahargarh_Fort,SalimM,3.0 of 5 bubbles,Dec 2019,Worth a visit,"If you have not had your fill of forts then this is yet another one to visit. It is one of the three forts in Jaipur. Appears to have undergone some maintenance and visitors are apparently increasing as it was previously neglected. Going up is an adventure as the road winds up the mountain. Walking is an option but I would not recommend as it is a long and steep hike up.So what do you get to see? The highlight is the Madhavendra Bhavan palace complex. It has nine spacious self-contained apartments, where the king's women lived, set around three sides of a courtyard. The king's quarters are on the remaining side. They're connected to the apartments by a corridor that enabled the king to secretly visit his ladies and frolic in privacy. There is a Sculpture Park where the collections on show change every so often. Finally, there is the wax museum. The museum is divided into three sections—a Hall of Icons with statues of celebrities including cricket players and Bollywood actors, a Royal Darbar with paintings and wax statues of Rajasthan royalty in traditional costumes and a stunning modern-day Sheesh Mahal (Mirror Palace) crafted out of glass pieces.Finally check out the view of the pink city from the top. Absolutely amazing."
Nahargarh_Fort,Asia traveller,3.0 of 5 bubbles,Mar 2020,"Not too impressive, would skip this unless you have extra time","The Nahargarh fort was not half as impressive as the Amber Palace or the Agra Fort. Its a 20min drive (by car) up the mountain further than Amber Palace, on windy narrow roads and once you get there it seems completely commercialized (wax museum?) and not well maintained. Luckily we only paid SAARC rates to enter this site or I would have been quite disappointed. The Step well is quite interesting to see, but again the Abhaneri Step well is far more impressive if you've seen that. Would probably recommend to skip this unless you have extra time to kill. I would rather have shopped in the market places than spend 2 hours here. "
Nahargarh_Fort,Sandeep G,4.0 of 5 bubbles,Mar 2020 • Business,superb,Here is the place you must visit when you are in Jaipur. Wax museum is really interesting. Though the restaurant there is a let you down completely.
Nahargarh_Fort,Iqbal M,5.0 of 5 bubbles,Mar 2020 • Couples,Lovely,Nahargarh fort is one of the great place it was such a beautiful fort it was .nahargarh fort is very huge fort nice beautiful and i loved it
Nahargarh_Fort,Bryan D,5.0 of 5 bubbles,Dec 2019,Beautiful fort in Jaipur,"Beautiful fort in the pink city of Jaipur.  Great views from the Fort of the city and the walls.  Looks like the Great Wall of China, built on same type scale.  A must see in Jaipur."
Nahargarh_Fort,Anusha_Rahul,5.0 of 5 bubbles,Mar 2019,Now you need Ticket,When I first started to go to Nahargarh it was free for all. We were in college and this place was our regular evening walk spot. There were few small eateries but now when I went it had changed so much. There are some super expensive restaurants and some not so expensive ones. But yes its not economical. And now you need a ticket to visit this place. Nahargarh has  the famous Rang De Basanti Beer dive spot. But also has one of the most mesmerising views of City of Jaipur. Must go place
