Tourist Attraction,Name,Rating,Date and criteria,Title,Review
Rajputana_Cabs,Sandip Patel,5.0 of 5 bubbles,Jun 2022,So happy !! 🙂,We have got a very nice facility. The driver and the car were very nice. We are happy with their service and will be re-booking from here and will suggest others to book from here as well. Ms. Divya ma'am  so supportive and kind for booking. we are  very great full with their services.
Rajputana_Cabs,Adil D,5.0 of 5 bubbles,Jun 2022 • Friends,Good experience with relatively competative price. The coordination Divya was able to setup everything quite well. Drive,Good experience with relatively competative price. The coordination Divya was able to setup everything quite well. Driver too were friendly and cooperative
Rajputana_Cabs,Samir Pandey,5.0 of 5 bubbles,May 2022 • Friends,Char dham trip,I experienced professionalism in dealing with them. Their arrangements in terms of quality and worth are appreciating. Quite satisfied with coordination of Ms. Divya.
Rajputana_Cabs,Karmrajsinh,5.0 of 5 bubbles,May 2022 • Couples,Awesome Journey with Sandeep Singh,It was a great and safe journey with family. Very co-operative team of Rajputana Cabs. It was a nice experienced
Rajputana_Cabs,Prateek,5.0 of 5 bubbles,May 2022 • Friends,Excellent CABS,Car was clean and comfortable  with excellent driver . Driver was on time . Reached destination on time
Rajputana_Cabs,Shailendra Baghel,5.0 of 5 bubbles,May 2022,Excellent service and good driver.,"We took the services of Rajputana cabs from Chandigarh to Manali and back in a 5 days tour. Highly recommended. 5 star experience. Driver named as ""Lucky"" from Ludiana was quite friendly . He was familiar with all places in & around Manali.I will definitely use your service again. Your service, and reliability, made a long stressful journey end positively. Driver was punctual.Driver got in touch really early to make arrangements of where and when would be best to meet us , and then stayed in touch with us throughout our trip.Lucky was friendly.Would highly recommend the service to anyone."
Rajputana_Cabs,hemant kumar meena,5.0 of 5 bubbles,Apr 2022 • Couples,Upender Singh cab driver,Upender Singh driver of rajputana cabs has excellent knowledge of rajasthan history. Very good cab driver friendly and hospitable as well. 
Rajputana_Cabs,sahayj29,5.0 of 5 bubbles,Apr 2022 • Couples,"Excellent service, good car and driver.",Had booked a Crysta for one way from Jaipur to Jodhpur on 28th April 2022. They sent a nearly new vehicle so we had a comfortable and cool journey. The driver was superb and guided us during visit to Ajmer en route.
Rajputana_Cabs,Subir R,5.0 of 5 bubbles,Mar 2022,Simply Great.,"Well behaved , punctual drivers, very efficient office staffs, always available at your service. Very clear communication and never missed commitment."
Rajputana_Cabs,GK Rao,5.0 of 5 bubbles,Mar 2022 • Couples,Excellent Service,"Excellent service by Rajputana Cabs, Mr. CB Singh and Hemanth Kumar. They took good care of the tour plan as per schedule and guided us properly. Thanks to Rajputana Cabs."
Rajputana_Cabs,Manav S,5.0 of 5 bubbles,Mar 2022 • Family,Jaipur journey,Excellent service by bhupender singh. He very good knowledge of history of Rajasthan. We enjoyed jaipur journey with him. He is so kind and good at explaining historical places of Rajasthan
Rajputana_Cabs,Basant,5.0 of 5 bubbles,Mar 2022 • Couples,Manali Experience,Booking experience was smooth. Driver was timely available each day and was fully aware of the local places to visit. The standard trip duration however can be shortened from 3 days to 2 days.
Rajputana_Cabs,Vadloori Karthik Babu,4.0 of 5 bubbles,Mar 2022 • Family,Good and memorable experience,Glad to have chosen this service. The driver was timely and professional. But we faced a little arrogant behaviour from the same. Do groom your drivers on that aspect and everything else is fantastic.
Rajputana_Cabs,YASHAWANT SANE,5.0 of 5 bubbles,Feb 2022 • Couples,Very efficient and prompt service,Ms.Hina Chaudhary (Rajputana cabs) was cooperative for booking  driver Mr.Raju Rai was good decipline driver
Rajputana_Cabs,muzir,5.0 of 5 bubbles,Feb 2022 • Friends,Good,"Trip was hassle free and our tour guide cum driver Mr.Bhupender singh made it a good and wonderful day, he was punctual, obidient, friendly and helpful, had a good time with their service, its affordable"
Rajputana_Cabs,Swati k,5.0 of 5 bubbles,Feb 2022 • Couples,Excellent service by Bhupendra singh from Rajputana cabs,Excellent service by Bhupendra singh from Rajputana cabs. He came on time and explained many things about jaipur while on the cab. Had a relaxed and great time due to him in jaipur.)
Rajputana_Cabs,prateekdoppleganger,5.0 of 5 bubbles,Feb 2022 • Couples,Great services. Good and generous drivers.,"Driver Ravinder Singh Shekhawat is a very well behaved and good driver. Rajputana Cabs provides excellent service all over Rajasthan. Everytime I visit Rajasthan i hire their cabs. From Jodhpur,Jaisalmer,Udaipur,Chittorgarh,Bikaner,Mount Abu,Jaipur i have always trusted them. During my Jodhpur Jaisalmer Longewala trip Driver Chhatar Singh was also very well behaved and generous."
Rajputana_Cabs,Ramiz,5.0 of 5 bubbles,Feb 2022 • Family,Excellent,"They gave us great experiences. Mr Bhupinder , our cab driver, was very honest man. He gave us many historical information prior to our guide. He indeed is talented. He helped us when we lost our phone. Fortunately we got the phone back. He is simple. He is a down to earth man and jovial. I will recommend if anyone is hiring rajputana cabs in jaipur for sight seeing, they should take Mr Bhupinder."
Rajputana_Cabs,Dhawal Grover,5.0 of 5 bubbles,Feb 2022 • Family,Excellent serviceMr. Bhupendra SinghRajputana cabs Excellent knowledge about historical period and he is of very polite nature H,Excellent serviceMr. Bhupendra SinghRajputana cabs Excellent knowledge about historical period and he is of very polite nature Had a great time with Mr. Bhupendra Singh
Rajputana_Cabs,Deep D,5.0 of 5 bubbles,Feb 2022 • Family,Rajputana cabs excellent service by Mr Bhupendra singh,An excellent trip in jaipur which was kindly elaborated by Mr.Bhupendar singh who was very kind and generous. He got a nice knowlegde about historical monuments and forts in jaipur. Got good history skills. Had a great time with him anyone can recommend him for their tour.
Rajputana_Cabs,Shrabanti,5.0 of 5 bubbles,Feb 2022 • Family,Excellent Trip,Excellent Trip.. Mr Bhupendra Singh. Rajputana CabBhupendra ji is a very reliable person and also knowledgeable person if you want to know about Rajasthan. He is a nice person. If you want to take Rajputana Cab for Jaipur sightseeing please take Bhupendra ji as a driver. the rate is also minimal.
Rajputana_Cabs,ranjita g,5.0 of 5 bubbles,Jan 2022 • Couples,Baraat Car,I booked car ( Audi A4) for my brother’s wedding in Jan22. The whole experience was very professional and seamless. Car arrived on time and was very clean. Driver was very helpful and accomodating to our needs during the wedding.
Rajputana_Cabs,Vinay,5.0 of 5 bubbles,Jan 2022 • Couples,Best experience. Definitely recommended,"We had hired Rajputana CAB service for 13 days. Trip includes sightseeing of Jaipur, Bikaner, Jaisalmer, Jodhpur and Udaipur cities. Our CAB driver NAVARATAN SIGH RAJAVAT was very helpful, punctual and explained us most of the things we should know as first time visitors. Also he was very professional and well behaved. CAB(Swift Desire) was also very neat and clean.Rajputana CAB service representative HEENA guided us for planning the entire trip. She was in touch with us for continues feedback.It was a very good experience with Rajputana CAB and happy with service. Definitely recommended."
Rajputana_Cabs,Papu B,5.0 of 5 bubbles,Jan 2022 • Family,Trust them they're good and professional,"Overall it's a good experience, most of the process is online and professionally managed, hence i don't face any problem in availing the service. Ms Hina assisted me during the entire process and Mr. Ram sing our driver was a gem."
Rajputana_Cabs,mehul kabrawala,5.0 of 5 bubbles,Jan 2022 • Family,Rajputana cab is really Rajputana 👌,Very good & Very safe Cab Service. Car is in very good condition.  Most important they provides me well behaved & knowledgeable driver. Thank you Rajputana Cabs & special thanks to medam hina chaudhary for making my trip memorable.👍
Rajputana_Cabs,Sonali Korgaonkar,5.0 of 5 bubbles,Dec 2021 • Solo,Excellent service,"Excellent service, From pickup to boarding from Jaipur to selected place. Making your journey memorable. Service by Bhupendra Singh. Great tourist guide & down to earth nature. Really thankful for your service 😁👌."
Rajputana_Cabs,Pooja M,5.0 of 5 bubbles,Dec 2021 • Couples,Excellent,"Excellent love the network, speed of arrangement & quality of service! Only people to book with in Rajasthan!"
Rajputana_Cabs,Shreya Dhole,5.0 of 5 bubbles,Dec 2021 • Friends,Reasonable and Reliable Cab service,"It was a very wonderful experience to travel with Rajputana  Cabs.In 2020 we traveled to Pushkar,Ajmer,Kumbhalgarh,Ranakpur and Jodhpur with Rajputana with senior citizen,the drivers are very polite ad go out of the way to make your journey a memorable one!Last week we were travelling to Kishangarh and Ajmer from Jaipur on a all girls trip,it was an impromptu plan,they provided the cab on a short notice and this time again the we had a pleasant experience.They drive very smoothly and also inform you about the history of the place and also about the local food you should try.Coming to prices,its very reasonable as compared to other taxi services,trust me we had contacted a lot.So definitely go for Rajputana Taxi Service."
Rajputana_Cabs,PC,5.0 of 5 bubbles,Dec 2021,Fabulous Trip,Took a local cab service for exploring manikaran kasol from Miss Anjali Singh.it was a memorable day. driver was awesome well planned tour. Big thanks to Anjali Singh and her team.
Rajputana_Cabs,lucky,5.0 of 5 bubbles,Jan 2022 • Couples,Good and great Service with reasonable price,"The service was arranged by Anjali on a short notice and we were very happy with the service provided, we would recommend to our friends about Rajputanaa Cabs.Driver was very friendly and nice to us...Keep doing good..Much appreciate the service which was provided to us on short notice on New year peak time, with reasonable price."
Rajputana_Cabs,megha r,1.0 of 5 bubbles,Dec 2021,Terrible,"We booked a taxi with rajputana cabs in jaisalmer with a drop to jodhpur.We spend almost 4 days with this taxi operator. It was one of the most horrible experience we had, I asked for a sedan but they gave an innova saying they didn;t have a sedan due to peak season and i  agreed for the innova with X amount, which was a bit high , i agreed as i was travelling with my mother in law and daughter. When we reached jaisalmer we were welcomed with 2 Dezires mentioning that their innova met with an accident , once we reached jaislamer town we were forced into one car , i was assured that from the next day innova will be ready. Come the second day there came a ETIOS that too late by more than an hour the driver had some excuses when i asked about innova a new story was given to me and i spoke with their representative via phone who was telling some other reason .The driver all through the journey mentioned that they will not be able to provide innova for the local tours and will provide one during our return to jopdhpur.The driver was mostly on phone and was mostly interested in commissions he gets and was asking for bills from where we shopped...etc...Come the third day a Dezire came that too late by 90 mins gave some lame reasons.Yes more thing i had to pay tolls and parking charges but these guys told that they rates are inclusive.Come the fourth day ETIOS came that too a bad vehicle and once again late by 120 mins.This impacted our program in jodhpur as we reached jodhpur late .Finally when it came to settlement he was asking 2k on top of what was asked for innova, i had to fight with the person and settled for a lesser amount.I was messaging and speaking to him multiple times all through the 4 days and everytime he was only telling lies.Very bad service , pathetic cars , unprofessional service and over priced.Better avoid this cab service as they seem to tell only lies and extremely unprofessional."
Rajputana_Cabs,Arpita M,5.0 of 5 bubbles,Dec 2021 • Friends,Highly recommend,"Our experience with Rajputana cabs was awesome. Anjali mam was always available for any questions and she assured us about best service. Driver was very polite ans cooperative and very professional. Thank you for making our trip successful and taking memories back home . Thanks Anjli Singh, driver Bittu and driver Sukhvinder Singh."
Rajputana_Cabs,Sshhiivvaanniiii,4.0 of 5 bubbles,Dec 2021 • Family,Rajputana cabs,Service of Rajputana Cabs was very nice. They cooperated very well. Our trip was arranged very well without any trouble. Driver was linent. Zoya mam cooperated and responded on time and her service was good.
Rajputana_Cabs,Manish S,5.0 of 5 bubbles,Nov 2021 • Couples,Great service,Great experience overall. Drivers are helpful and very courteous. Timely pickup and drop. Highly recommend overall.    
Rajputana_Cabs,Akshay,5.0 of 5 bubbles,Dec 2021 • Couples,Jaipur-Udaipur-Ranthambore trip,Our journey was very good. Driver was excellent took us to all the beat places. Felt safe travelling with him.
Rajputana_Cabs,pujaa,5.0 of 5 bubbles,Dec 2021 • Family,Airport Tranfer ,I came across this cab service on Google. I wanted a clean sanitized big car with vaccinated driver for tranfer to the Indira Gandhi International Airport as I wS traveling with my family. Miss Zoya helped with best choice of car available at 3 am in the morning. The price were very competitive with personal service. The driver came before time and was very polite. I would definitely chose there service again.
Rajputana_Cabs,Eswar,4.0 of 5 bubbles,Dec 2021 • Couples,Jaipur one day sightseeing tour,"Had a good experience with the service.Driver Sultan singh was good. Was able to recommend good places and cab was well maintained, hygiene. Highly recommended."
Rajputana_Cabs,Aqip,5.0 of 5 bubbles,Dec 2021 • Friends,Good,Thank you zoya for giving me a save and a best service. Excellent service by herAnd A great thanks to her driver Mukesh
Rajputana_Cabs,Farzana G,5.0 of 5 bubbles,Nov 2021 • Solo,One of the best Jaipur car rental company,"Sultan was our guide and driver for the 3 days. He is a very knowledgeable and friendly guy. While we had a draft itinerary to see multiple things, Sultan suggested we make minor changes to it so that we could see all the places of interest without getting too exhausting. Overall er spent a good 3 nights at Jaipur and Sultan made it extra special for us."
