Tourist Attraction,Name,Rating,Date and criteria,Title,Review
Chowmahalla_Palace,Lokesh1981,5.0 of 5 bubbles,Aug 2019 • Family,Top attraction of Hyderabad ,"This grand palace of Nizam’s is situated near to to Charminar, locating this place is quite difficult and getting there by four wheeler is little tricky .....One can see the enigmatic glimpses of Hyderabadi nizams & cultural heritages, One of the must place for visit, internal ambience is cosy & neatly maintained, Garden is beautifully maintained and one can go through nizams past through the various portraits kept there ....."
Chowmahalla_Palace,Amashnee S,5.0 of 5 bubbles,Nov 2019 • Business,Beautiful and well maintained Palace,"I visited the Chowmahalla Palace in November 2019 during a short trip to Hyderabad. The entrance to the palace has these wonderful fountains which my guide said was once filled with scented water, such opulence. The palace itself is really beautiful, the crystal chandeliers are really a marvel. There is a lot of history to go through as you make your way through the palace. For car enthusiasts, there is a display of the kings vehicles, in pristine condition. This is well worth the visit."
Chowmahalla_Palace,JohannesNL023,4.0 of 5 bubbles,Nov 2019,A lazy afternoon,"If you want to escape the noise and heat of the old city in Hyderabad, this is the place to go, museum, court-yard and    relaxation all in one. Take a seat under one of the large trees, enjoy the automobile collection, admire the hall with chandeliers, learn about the Nizam dynasty and have a look at photo's and articfacts.Some buildings are still under repair."
Chowmahalla_Palace,Debasis,4.0 of 5 bubbles,Oct 2019 • Family,Good one,"This is a very nice place, just beside char minar of Hyderabad, it's a hidden gem.Many things to see.GardenFountainPalaceOld cars and bikesKind a museum too.Loved it."
Chowmahalla_Palace,7mayaw,5.0 of 5 bubbles,Nov 2019 • Family,Good palace ,It's a nice palace. Amazing carving work on the ceilings and walls. Lots of weapons to see and furniture on display. 
Chowmahalla_Palace,Pradeep S,4.0 of 5 bubbles,Oct 2019,Hyderabad - back in time.,The name says it all. Four palaces. Definitely worth a visit. A mix of visual splendour and dilapidation. Big estate. Make sure you have a couple hours if you want to see the entire place.
Chowmahalla_Palace,MukeshDave,5.0 of 5 bubbles,Nov 2019,Good palace,This is palace of Nizams. Very well maintained but vehicle entry is little issue as the parking area is very narrow. 
Chowmahalla_Palace,Jo-Ann,4.0 of 5 bubbles,Nov 2019 • Couples,Old with rich stories,"Needs maintenance badly. The grounds are huge. The buildings need to be upkept constantly. It is nice to walk around but certain parts are an eyesore. Quite sad, actually. "
Chowmahalla_Palace,ArjunPatel,5.0 of 5 bubbles,Nov 2019 • Friends,A must visit in Hyderabad ,The palace and the gardens are fabulous. This place is a must if you are visiting Hyderabad. It holds a lot of history of the city and Nizam Dynasty.
Chowmahalla_Palace,S B Khare,5.0 of 5 bubbles,Oct 2019,A majestic building cum museum,"It is a grand palace built by modern Nizams, the rulers of Hyderabad, where they lived, held their durbars and where their coronations were held. It's central piece is the great darbar hall, a huge hall all marbles with a seat where the Nizam sat or where the coronations were held. It has huge chandeliers and its opulence is quite apparent. The palace is the property of the current Nizam who decided to restore it and open it to public. It is also a museum and the rooms are dedicated various historical themes. If one wants to learn about Nizamshahi and the Nizams, this is a great place to spend time."
Chowmahalla_Palace,Sunita Saldanha,4.0 of 5 bubbles,Oct 2019 • Friends,Leisure,Can spend around an hour here. Conveniently located from the Charminar a rickshaw ride away. Nice architecture and is like a museum with the displays. Also has vintage cars.
Chowmahalla_Palace,Eileen108,4.0 of 5 bubbles,Oct 2019,Interesting Place to Visit,"Enjoyable visit to go through all the royal palace rooms and see the items they used. The rugs we walk on are low quality and some areas are dusty or paint peeling from the walls, so it needs more maintenance. A couple of buildings were closed but with interesting furniture and decorations seen through the windows. I especially enjoyed the lady's quarters area because it was fascinating to see how they lived, they had mannequins dressed up and protected behind glass. I saw a few vehicles outside that were completely old, dusty and falling apart. What a shame! I didn't see where the vehicles inside were, it might have been closed for renovation."
Chowmahalla_Palace,Drphani,3.0 of 5 bubbles,Oct 2019 • Friends,Needs to be Taken Care ,"Beautiful palace, but the maintenance is not up to the mark. E everything needs to be properly taken care. We have these palaces which needs to be preserved for our younger generations to see and feel proud of our history. "
Chowmahalla_Palace,Sounak Poddar,5.0 of 5 bubbles,Jun 2019,Nawabi,"Hyderabad is a city, famous for its Nawabi mezaz and when one visits this place, can definitely relate that one for sure. Amazing architectural work and with that a stunning tour of the heritage walk through the museum. One should not visit this trip if from Hyderabad or touring this place. "
Chowmahalla_Palace,Garon_Susanne,4.0 of 5 bubbles,Oct 2019,Interesting and worth a visit,"It’s not the grandest palace in India, but worth visiting. Each fort and palace in India is unique and shows different styles. "
Chowmahalla_Palace,Lawyer/Exporter,5.0 of 5 bubbles,Oct 2019,very interesting,This is a very interesting complex. Our visit was enhanced by walking there through the market and surrounding areas as ithat put the palace in context - see my walking tour review.
Chowmahalla_Palace,Sunil,4.0 of 5 bubbles,Dec 2018 • Friends,Hyderabad Nizam fort ,It’s a very special place in Hyderabad and is a historical place to visit. The place is well maintained and it’s clean and entry fee is less and it’s quite good place to know the history of Hyderabad nizam 
Chowmahalla_Palace,savvyuec,4.0 of 5 bubbles,Nov 2018 • Family,Small palace with vintage car collection,It is a small place with a vintage car collection. A rolls Royce that was used to fetch water for daily needs. The furniture room is also exquisite but off limits.
Chowmahalla_Palace,So_Winnie,4.0 of 5 bubbles,Oct 2019 • Friends,A good trace of Indian history,"This palace provide information and tell a good story of Hyderabad Nizam, with photo, pictures and collections of exhibits including antique cars. The palace is huge so spare at least 1.5-2 hours to walk around. The palace entrance is very hidden. "
Chowmahalla_Palace,Varsha V,5.0 of 5 bubbles,Aug 2019 • Couples,Elegant and beautiful essence of the past,"Wow. No words to describe this palace. Such a beautiful, well kept place. Entry fee you give is nothing compared to the beauty of the Palace. (It's just 60 rs/adult)Kindly take a ticket for photography (50rs) from the counter so that you can lavishly take photos! The chandeliers at the main hall is a sight to behold. You feel the essence of grandeur, the aura of ancient India around you. You can't stop imagining how it would have been in its glorious years. It also holds the collection of weapons from spear to revolvers. It seems they ran out of space and stacked them up the wall! But beautifully arranged. You will also get to know about the various rulers, their history through the museum which displays numerous photographs / articles on the Rulers. The main Palace is surrounded by multiple Mahals, one of which holds gorgeous sarees and some ornaments of the Queen. There's a vintage car collection of about 10+ cars belonging to various era (till 1947). Overall wonderful place and worth visiting!"
Chowmahalla_Palace,Bianca,4.0 of 5 bubbles,Oct 2019 • Family,Beautiful palace,"While the palace and durbar is very beautiful, two of their areas are not open for the public to visit. Should take you approximately 1-2 hours. "
Chowmahalla_Palace,dr.pragnesh Vachharajani,5.0 of 5 bubbles,Sep 2019 • Couples,Worth visiting place in Hyderabad,"Just walking distance from Charminar,this is a very beautiful place.  You need to buy entry tickets of 25 rupees and tickets for camera.It has beautiful palace, land sacped garden ( inside main palace entry is not allowed), vintage car and buggy display. Need about an hour to visit the place. A photogenic place for photo Lovers. Do visit. "
Chowmahalla_Palace,Arun Karthik,5.0 of 5 bubbles,Jan 2019,Royal Life,"Be prepared to get transported in time while taking a royal tour of one of the most magnificent palaces in Hyderabad. The Chowmahalla Palace has been meticulously restored to bring its past-beauty back to life. Once a seat of the great Nizams, this palace has played a perfect host to numerous royal guests and still welcomes its admirers with a majestic charmBe prepared to get transported in time while taking a royal tour of one of the most magnificent palaces in Hyderabad. The Chowmahalla Palace has been meticulously restored to bring its past-beauty back to life. Once a seat of the great Nizams, this palace has played a perfect host to numerous royal guests and still welcomes its admirers with a majestic charm.Embellished with gushing fountains and opulent gardens, the palace-complex now retains two courtyards (northern and southern), marvellous palaces, the Durbar Hall, Clock Tower, Roshan Bangla and the Council Hall. The domes, arches and the elaborate stucco work of the palace emanate a grand mix of Persian, Rajasthani, Indo-Saracenic and European styles. As one steps into the palace, the eyes are left bedazzled by the overhead, Belgian crystal-made chandeliers and the mirror-finish, white marbled floor.With numerous adornments and enchantments, the Chowmahalla Palace still stands tall with an indomitable prowess to impress millions with its sparkling glamour. Important facts about the palace:it was initiated by Nizam Salabhat Jung in 1750 and completed by Nizam Afzar-ud-Dawla Bahadur in 1869.it originally sprawled across 45 acres of land extending from Laad Bazaar to Aspen Chowk Road but unfortunately, at present only 12 acres remain."
Chowmahalla_Palace,Bulbul,4.0 of 5 bubbles,Aug 2019,Ideal for history buffs and photographers,"Also knows as Nizam Palace, the complex is clean and well-maintained. The palace was the seat of the Asaf Shahi Dynasty and was the residence of the Nizams of Hyderabad while they ruled their state. Shah of Iran’s palace in Tehran was a model for this palace.I found the royal court (durbar), known as the Khilwat Mubarak the most attractive. The ceremonies used to take place here under enormous chandeliers of Belgian crystal. There is Kilwat Clock above the main gate to Chowmahalla Palace which has been ticking away for around 250 years. The people of the locality wait for its chimes and correct their own watches by the accuracy of this clock’s timingVarious galleries in the Palace with each presenting an interesting display of crockery, clothes, furniture, coins and currency notes, pictures from the Nizam era, etc. will keep you engaged. Weapons are displayed interestingly not just inside the glass cabinet but on the walls as well, reaching till the top.The palace is ideal for history buffs and photographers."
Chowmahalla_Palace,Rabia Bint Hasan,5.0 of 5 bubbles,Jul 2019 • Family,ROYAL HISTORY OF HYDERABAD ,"THE GEM OF NIZAMS ERAAmongst the brilliance of the most outstanding places and palaces in the world; is Hyderabadd Chowmahallah palace!Built in the 18th century by Nizam Afzar-ud-Daulah Asaf Jah - The grandeur of the Hyderabads Nizams extraordinary extravagant era, glory of the regal past, glimpse of the enigmatic royal way of living, are still alive. The captivating features of the 2 courtyards is the Shishe-Alat, Council Hall, Palace Clock Tower & Roshan Bungalow. The heart of the palace- Khilwat Mubarak with its grand Durbar hall had us dazzled by the lavish & luxurious design architecture of the  palace decore influenced by traditional Islamic imperial style. Inside the majestic Mughal domes, the Durbar Hall, we saw the platform made up of marble-the royal seat ""Takht-e-Nishan.""The grandeur, charm and regalia of the Chowmahallah Palace with its beautiful spread lawns, its green landscape with huge fountains, contrasting yellow and white motifs of the palace presents a hypnotic sight that herald the ""Golden Age"" of Chowmahallah palace grandeur and legacy - giving an insight into the fascinating & magnificent architecture that sets a major impact on the regions heritage & culture.A visit to Hyderabad- recommend, experience the Nizams great era!""Chowmahallah"" - A Palace That Takes You Back Into ""Time.""Rabia Bint Hasan Kuwait "
Chowmahalla_Palace,Travel_Lust_Dushyant,5.0 of 5 bubbles,Aug 2019,Heritage of theNizam,Chowmahalla Palace is a must visit place when in Hyderabad. It preserves amazing art and heritage of the one the most richest rulers in India. Be it the Architecture of the palace or the ancient time war instruments or the exotic heritage car collection or the series of beautiful chandeliers everything is preserved well and depicts the proud legacy of the Nizam.
Chowmahalla_Palace,ShaanRoy,4.0 of 5 bubbles,Sep 2018,Beautiful Palace and a must see in Hyderabad,"The palace is neatly tucked in behind the Charminar away from the hustle and bustle of its surrounding. Its walking distance from Charminar via Lad bazar and a must see if you are visiting Charminar. It may easily take 3 to 4 hours to visit the palace which is well maintained. Car parking is available and there is a entry fee to the palace. The palace has courtyards, and different sections where the king and queen use to live in luxury. The last section has a collection of vintage imported cars which is well maintained behind the glass panels. They have a collection of age old weapons, the darbar hall is magnificent and the rani mahal is awesome.There are fountains and lush gardens which are well maintained. You will feel like entering another world."
Chowmahalla_Palace,Ronita B,5.0 of 5 bubbles,Jul 2019 • Family,Mesmerizing palace ,This place is located very near to charminar. The palace is too beautiful and everywhere one can see chandeliers hanging from the top. The beauty of the chandeliers are mesmerizing. 
Chowmahalla_Palace,REENUJAIN,4.0 of 5 bubbles,Jul 2019,Nice Palace,Nice palace with amazingly beautiful artifacts. Beautiful Vintage cars. Well maintained with nice staff. Clean.
Chowmahalla_Palace,Hus,4.0 of 5 bubbles,Aug 2019,beautiful,"located around 1km from Charminar( its longer if you take a vehicle since roads are one way) is Chowmahalla Place which was the official residence of the Nizams who ruled HyderabadEntry free is rs 60 for Indians 20 for children and 200 for foreign tourists and open from 10-5 on all days except FridaysPhotography/ videography charges are separate but no one checks if you have paid for it or notyou can place your luggage near security for free and they will give you a token to collect it laterThe main attraction is obviously the Kilawat Mubarak which is beautifully maintained and interior houses lot of artifacts/valuable/weapons belonging to the ruling familyThe other palaces Aftab Mahal is only accessible from outsideTehniyat Mahal has a collection of clothing and Afzal Mahal has a beautiful golden architecture on roof and you can view the interiors from outside but cannot go inside Further ahead is a collection of vintage cars which is okdont forget to visit secret Quran room at the backEntire place is very pleasant and you can rest under the trees/near the entry. takes around 1.5 hours total to visit.There is also a small cafeteria, drinking water and toilets near the entrance"
Chowmahalla_Palace,rohit s,5.0 of 5 bubbles,Nov 2018,Nice,You must visit this Palaceyou will find many of the things not heard aboutThis is really a good place to visit.
Chowmahalla_Palace,WondererGuy,4.0 of 5 bubbles,Jul 2019 • Friends,Historical Monument,If you have interest in history than Chowmahalla Palace is must visit place for you.It tells you the background of Nizam's of Hyderabad.
Chowmahalla_Palace,Aayush G,5.0 of 5 bubbles,Aug 2019 • Family,Must visit,The best and the most beautiful piece of history at Hyderabad. Completely mesmerised with the richness and beauty of the palace . Vinatge cars to elaborate Court room to drawing rooms. Do keep this place as the top location in Hyderabad. Can't find words to express the beauty of this palace. 
