Tourist Attraction,Name,Rating,Date and criteria,Title,Review
Chowmahalla_Palace,Rahul2604,3.0 of 5 bubbles,Jan 2023 • Solo,Disappointed,"Former residence of Nizam,once the richest person on earth still very unmaintained,needs to do lots of efforts to maintain and refurbish.It’s situated close to Charminar,ticket price is rs 100 for Indian.This campus have multiple buildings but most of the buildings are closed for visitors,whatever is open is not maintained properly,even toilets were one of the dirtiest I had seen in any attractions in recent days,galleries doesn’t have proper signage about exhibits.The vintage car gallery was best to see but even that is not properly maintained,few vehicles were like scrap,sad to see the conditions,very much disappointed."
Chowmahalla_Palace,Ruzan Desai,4.0 of 5 bubbles,Dec 2022,Beautiful gardens and expansive space.,Beautiful gardens and grand architecture. This place has the infrastructure and ability to be one of the most visited places considering the lawns and the vast expanse of space It needs to be developed like it
Chowmahalla_Palace,Xavier D,4.0 of 5 bubbles,Dec 2022,Chowmallaha palace,It is a very nice looking palace which is well maintained. Unfortunately camera photography is  not allowed.
Chowmahalla_Palace,vasant agshikar,5.0 of 5 bubbles,Dec 2022 • Couples,Chowamallah palace,"Chowmahalla palace is well maintained property . One can walk through the palace and witness magnificent architectural structure.  One see the antique furniture  ,photos ,clothes and cutlery etc on display. It would take you an hour and half to see it. Garden too is well maintained."
Chowmahalla_Palace,OctOriental,3.0 of 5 bubbles,Nov 2022,Corridor walk only,"Largely you get to walk throught the corridors only. The halls are mostly locked or cordoned off and you can try to peep in through the glass panes to see some old furniture. It's not a grand structure as historical palaces go. Items on display are mainly photos of the last Nizam barely a hundred years old, a lot of crockery (really!) left behind by the family when they left India and some classic vintage automobiles, including Rolls Royces."
Chowmahalla_Palace,Global-Bhatakanti,3.0 of 5 bubbles,Nov 2022 • Family,"Chowmahalla Palace, Hyderabad: Nijam's residence and Darbar","Reviewed 11 Nov 2022Chowmahalla Palace is now a restored monument of historical significance. Once it was one of the main residence of erstwhile king of Hyderabad, the Nijam. There is a small museum in the main palace (but if you have seen Salarjung Museum) you can skip this. The name stems from Chow (4) Mahal (palaces). The entry ticket is 50 for adults. There are toilets at the entrance.Suggested Time to spend: 1 hour.Can be covered as part of Hyderabad sightseeing day itinerary as: Salarjung Museum - Chowmahalla Palace - Charminar - Shopping."
Chowmahalla_Palace,Daniela R,4.0 of 5 bubbles,Oct 2022,Worth a visit,"Lovely place to visit: interior of palace, as well as garden. Well labelled exhibits and artifacts well maintained. Worth buying the photo pass as there are many beautiful places and rooms to photograph."
Chowmahalla_Palace,lkoraj,3.0 of 5 bubbles,May 2022 • Family,Historic attraction.,"A very big place like forte, needs maintenance also, historic building, time taking place, you will more enjoy if you takes interest in history. Otherwise a simple old building of hydrabad."
Chowmahalla_Palace,rd07,5.0 of 5 bubbles,May 2022,Beautiful palace close to Charminar,"I was recommended this palace by my driver, I had never visited this place despite being in Hyderabad many times. Its well preserved palace and kept pretty well. Its too hot to visit during day time as the whole palace is non airconditioned.  you can walk to charminar from here or take an auto for 20 rupees. "
Chowmahalla_Palace,Karuna A,5.0 of 5 bubbles,Dec 2021,Must Visit,"Walking through a Nizam's home, looking for snippets of what it must truly have been like to live there. A glimpse from their perspective.I remember my grandmother telling me stories of the Nizam & his wife, his children. This visit for me was so much nostalgia for her.The place is beautiful. its like a museum of so many ages of their lives. The grounds, the mosaic the chandeliers.Their Rolls Royce & other cars.Definitely a nice place to see."
Chowmahalla_Palace,Gurus49,5.0 of 5 bubbles,Feb 2022,Relive the Royal Experience,The three palaces take you back in time. The staff is very courteous and helpful and compensate for the lack of wheelchair access.
Chowmahalla_Palace,Milind Kshirsagar,5.0 of 5 bubbles,Jan 2022 • Family,Aristocracy at its best.,"Wonderful palace showcasing richness of Indian history. Vintage cars, armours, Darbar hall are really awesome. Get yourself clicked in the attire of Nizam."
Chowmahalla_Palace,shekharlele,5.0 of 5 bubbles,Oct 2021,"Under-rated, far better than other famous places","Chowmallah palace is in old city, and close to the much more famous Char Minar. It houses 4 palaces facing each other and boasts of amazing architecture. Unknown to many, it is under-rated and is a must visit. Pls be mindful that it is closed on Fridays and Id. "
Chowmahalla_Palace,Avirup Guha Roy,4.0 of 5 bubbles,Jan 2021,Chow Mahalla Palace,"The actual Seat of Asaf Jahi Dynasty, this palace belongs to the Nizams & was the official Residence during their reign....Completed by Asaf ud-Dawlah in 1869, the Palace has absorbed Persian, Indo-Saracenic, Rajasthani & European styles into its architecture... it is believed that the Palace has been modelled on the Shah of Iran's Palace in Tehran"
Chowmahalla_Palace,yesarar,4.0 of 5 bubbles,Nov 2021,Palace intact.,"Nice sprawling complex with lawns and reasonably well maintained palace of the Nizams of Hyderabad. Don't miss the vintage car museum where Rolls Royce,  Ford, etc on display. "
Chowmahalla_Palace,Jaepy K,4.0 of 5 bubbles,Nov 2021 • Family,Hyd,Can see for the Vintage cars - the famed Rolls Royces and the enormity of the whole place at its prime.
Chowmahalla_Palace,Vikas Singh,5.0 of 5 bubbles,Oct 2021,The seat of the Nizams,"Cameras are now more allowed. They have stopped selling camera tickets. However you can take pictures with your mobile on purchase of a mobile photography ticket. There is a free locker service. In case you do not wish to pay for mobile photos or have accidentally brought your camera along you can deposit them in the locker.Durbar Hall or Khilwat MubarakThe heart of Chowmahalla Palace it was the seat of the Asaf Jahi dynasty. The grand pillared Durbar Hall has a pure marble platform on which the Takht-e-Nishan or the royal seat was laid. Here the Nizams held their durbar and other religious and symbolic ceremonies. On specific days of the year such as the Nizam’s birthday, Muharram and Eid, the British resident and dominion heads would present the nazr (an offering, usually of gold coins) as a mark of respect. Private celebrations and other public ceremonies such as Investiture were also done by the Nizam at this venue."
Chowmahalla_Palace,Mainak_Choudhuri,5.0 of 5 bubbles,Mar 2021,"Excellent Palace kept in good condition, must visit","Chowmahalla Palace was the primary residence of the Nizams. it is about 500 m walking distance from the Charminar along the New Laad Bazar Road. The entrance is from the side of the palace. There is a large fountain in front of the palace. the main palace contains the coronation hall with the throne used by the last Nizam (VIIIth). Apart from the coronation hall, there are smaller rooms containing photographs, video, life history of the Nizams, two armor rooms, and a Quran room (need to take off your shoes to enter) in the ground floor, and three galleries containing the furniture, paintings and utensils of the Nizams in the first floor. Behind it are four smaller structures on four sides of a central fountain, Tehniyat Mahal (closed for visit) Aftab Mahal, Afzal Mahal and Mehtal Mahal (closed for visit). Behind these four mahals is the antique cars garage.It takes about 2.5 hours to see the entire complex.There are washrooms and drinking water at the entrance, and a shop selling some excellent books."
Chowmahalla_Palace,nms01,5.0 of 5 bubbles,Jan 2021,Gem of a Palace,"What a gem of a palace! Well maintained and clean, the coronation hall is stunning with huge chandeliers and beautifully done up interiors! There are elaborate history charts adorning the walls of this Palace and the first floor has quaint furniture/ clothes, paintings and crockery of that era! The complex also houses the famous 1912 Rolls Royce Silver Ghost of the erstwhile Nizam.A MUST DO when in Hyderabad!"
Chowmahalla_Palace,DrKlair,5.0 of 5 bubbles,Oct 2020,Four palaces in one,"Recently reopened palace, has four parts. The coronation palace is very beautiful as is the palace which served as guest house for visiting royalty. The palace has also on display some antique cars including a 1912 silver ghost Rolls Royce."
Chowmahalla_Palace,Akshay_127,4.0 of 5 bubbles,Oct 2020,Heritage value,It is quiet an old palace which hold heritage and historic value in the history of Hyderabad as it was build by Nizam's.
Chowmahalla_Palace,TravelbuggIndia,5.0 of 5 bubbles,Oct 2019,Beautiful Palace,Chowmahalla Palace is just a stone's throw away from Charminar. It is closed on Friday so you can plan your visit accordingly. It showcases the splendid grandeur of the times when Nawabs ruled the city of Hyderabad.
Chowmahalla_Palace,shamoil29,5.0 of 5 bubbles,Nov 2019,Mind-Blowing,"The surroundings may not look that great but once you are in the premises of the palace, it is a new world all-together.  Lush gardens and beautiful chandeliers. It is a place one has to see to believe. "
Chowmahalla_Palace,Kaushik G,4.0 of 5 bubbles,Jun 2019 • Family,Beautiful Palace,"We had visited the beautiful Chowmahalla Palace which is located close to Charminar during our vacation in Hyderabad. Entrance tickets are priced at 20 rupees per person. As soon as we entered, beautiful lush green lawn decorated with fountains and trees caught our eye. We liked the architecture of the yellow colored Palace building from outside and inside we were mesmerized to see the beautiful hall decorated with giant elegant chandeliers. The main Palace building on the backside was ordinary."
Chowmahalla_Palace,chjprakash,4.0 of 5 bubbles,Nov 2019 • Friends,Hetitage,It's a beautiful palace maintained very well. There is a collection of vintage cars and buggies behind the palace e which look too royal.
Chowmahalla_Palace,Sue H,4.0 of 5 bubbles,Mar 2020,Spectacular,"Despite having to walk around wedding preparations, this Palace has a wonderful history. You walk from building to building, through lovely gardens which all add to the atmosphere ."
Chowmahalla_Palace,Talent P,4.0 of 5 bubbles,Feb 2020,One monument that in its intrinsic grandeur," Built over 200 years ago, Chowmahalla is renowned for its unique style and elegance. A synthesis of many architectural styles and influences,"
Chowmahalla_Palace,Sardev2014,4.0 of 5 bubbles,Mar 2020 • Solo,Definitely worth a visit,Large museum complex in centre of Hyderabad. Museum dedicated to the Nazims of Hyderabad. Museum is well maintained and has different rooms for each area of history. Particularly interesting to me was the old cars and weapons. Quite sad to see at the end how they capitulated and submitted to the British. 
Chowmahalla_Palace,Alok Kumar,5.0 of 5 bubbles,Mar 2020 • Solo,"Chowmala Place , Hyderabad.. the legacy of Nizams",The chowmala place Hyderabad is a must visit for history lovers.. u will feel the rich culture and heritage. of the  NIZAM.. 
Chowmahalla_Palace,Oneil,4.0 of 5 bubbles,Feb 2020,Pretty nice !!!,This was a pretty nice palace. Well-maintained. Lots of history alongside the portraits of the kings. Displays in not very well-lit rooms behind glasses  however resulted in poor visibility due to the glare from the sunlight outside. Loved the ceilings & some of their cars on display. Photos attached.
Chowmahalla_Palace,Curious785091,5.0 of 5 bubbles,Feb 2020,Great buildings for pictures - nice picnic grounds,"Loved seeing the palace, it's so pretty and you can see the beauty of things even though they are aging."
Chowmahalla_Palace,Polavarapu,5.0 of 5 bubbles,Apr 2019 • Friends,Chaumahal palace,"This palace is one of the old palaces in Hyderabad, constructed in the time of kings, we can see all the items and dresses used by kings in that time,, now also they kept as for visitors to have a look"
Chowmahalla_Palace,Kimmo M,4.0 of 5 bubbles,Feb 2020,Nice fortress,On of the best places to visit at Hyderabad.  Very nice scenery over the city. There you can also have some exercise by climbing up to the hill. 
Chowmahalla_Palace,rachelsdnl,5.0 of 5 bubbles,Jan 2020 • Friends,Mystical ,This is a beautiful palace built with much skill and craftsmanship. The interiors and so skillfully made that we are left awe struck. Wow is a understatement. It is wheel chair accessible and we can see the place in an hour or two. Very interesting and inspiring palace. 
Chowmahalla_Palace,AbhiMone,5.0 of 5 bubbles,Feb 2020 • Family,Takes you back in time,A lovely jewel in the middle of the old city. Takes around 1.5 to 2 hrs to complete . The vintage car collection is good
Chowmahalla_Palace,devendra k,4.0 of 5 bubbles,Feb 2020 • Friends,Magnificent,I had a chance to visit this magnificent place last week with my friend. It was amazing. You will experience the best of Nizam era and their taste for splendour. Palace is maintained well. It would have been good if there was a guide service to explain the details
Chowmahalla_Palace,Nathaniel J,5.0 of 5 bubbles,Feb 2020,Vacation ,So much history and historical presence. It really took you back in time of colonialism. I would highly recommend to walk the grounds first before you tour inside. 
Chowmahalla_Palace,JeffCarter,4.0 of 5 bubbles,Jan 2020 • Solo,An unexpected surprise,I visited this place on an afternoon that I was taking and several tourist attractions. I was pleasantly surprised with the palace it had beautiful grounds and an incredible main hall. I think they were setting up for a wedding. They were plenty of tourists and locals school groups during the facility. Did not cost very much to get in and was definitely worth a stop to see I would recommend adding this to any list of sites if you’re touring Hyderabad.
Chowmahalla_Palace,Vikas Singh,5.0 of 5 bubbles,Jan 2020,Must visit,"First things first. There is ample parking space inside the compound. So you can park your vehicles easily. There are no long queues to buy tickets. Photography is allowed on payment of a small fee. Do not be conned into hiring a guide because all exhibits are well explained and it is a nice stroll visiting the various palaces inside. Visit the Khilawat last because it is always crowded. If you can go early on a non weekend around 10 .30 when the place does not get too crowded. There is a nice shop inside the compound from where you can buy books and other souvenirs, The  canteen is about average and you can get tea , coffee, biscuits and sandwiches. There are clean washrooms inside the complex."
Chowmahalla_Palace,Galabackhome,4.0 of 5 bubbles,Jan 2020,Beautiful,"Would be a good place to stop for a few hours - rooms to wonder around, and a lawn to sit on. Beautiful perspectives. Once again we had fun being stopped by the other visitors to have our photo taken with them. An old collection of cars if that's of interest.Just slightly frustrated with a £10 charge to use a ""professional camera"" (not paid). Someone needs to tell the Indian authorities that many professional photographers use their phones."
Chowmahalla_Palace,MAJHARUL,5.0 of 5 bubbles,Jan 2020 • Solo,Very good ,"One of the most visited places of Hyderabad.  It's nearby Charminar.You can see vintage cars used by Nijams.Entry tickets for Indian is 60 rupees, and for Foreigners 200 rupees."
Chowmahalla_Palace,Mustan04,4.0 of 5 bubbles,Dec 2019,Beautiful Cultural Heritage Site,"This beautiful site takes you on a cultural trip into the pages of history of the lives of the Nizams of Hyderabad. It is fascinating to take a sneak peek into the grandeur of the Royal Palace which is nothing short of mesmerizing.In addition to the Palace, the fleet of Vintage Cars and Buggies owned by the Nizams got us completely awestruck. Also picked up a beautiful memento of our visit, from the gift shop."
Chowmahalla_Palace,Jajabor,5.0 of 5 bubbles,Aug 2019,Beautiful inside out!,"The Chowmahalla Palace is nothing more than a museum but a very beautiful one. Situated right next to the Charminar, it offers a much better tourist destination than its overhyped neighbour. Full of valuable antiques from the houses of the Nawabs of Hyderabad, the Chowmahalla Palace gives you an inside glimpse into the life of one of the richest families on planet earth."
Chowmahalla_Palace,iti_94,5.0 of 5 bubbles,Dec 2019,loved this palace,"This is such a beautiful place.we covered all the buildings,went upstairs to see the clothes and utensils and other items on display.saw the old clock tower.the beautiful landscape with fountains and trees was really beautiful"
Chowmahalla_Palace,Alia M,5.0 of 5 bubbles,Dec 2019 • Friends,Grand living,"Let me start by saying that it is a huge area to cover, so be ready to walk. For car enthusiasts, there is a display of vintage cars previously owned by the previous residents.For architecture enthusiasts, everything about this palace will awe you. Especially the details on the facade and ceilings.The palace is made up of several buildings. Each building serves a purpose (i.e, dinning hall, residency, etc).I reccommend stopping by the store inside, they have a beautiful selection of handmade products.P.s, lookout for the doorless balcony."
Chowmahalla_Palace,Aifaz,5.0 of 5 bubbles,Jan 2020 • Family,Chowmahalla palace,"Chowmahalla Palace is more beautiful than most historical buildings I have visited abroad. I had heard it was beautiful but did not think it would surprise me so much. Could not believe that such a beautiful architecture was tucked away in the heart of the city.Apart from the exotic beauty from the exterior, It also  has an exotic collection of articles, furniture, pictures,Islamic handwritten scriptures, chandeliers, vintage cars and much much more. It also has a history of the contributions made to the country by the various Nizams of Hyderabad... A must visit for sure❤️"
Chowmahalla_Palace,farzana i,3.0 of 5 bubbles,Oct 2019 • Friends,Interesting to see if you have time ,"This palace gives a glimpse of how the Nawabs used to live. Must have been quite grand in its days. Sad that it is no longer well maintained. I wouldn't say this is a ""Must see"", but interesting if you have the time. People ususlly do this palace and Golkonda fort in the same day. We visited the palace first then went to Golkondo to make it in time for sunset."
Chowmahalla_Palace,Hari,5.0 of 5 bubbles,Dec 2019 • Family,Beautiful place,"It's a beautiful place with lots of historical importance.It provides an insight to the royal Life.Has exhibits of royal crockery, ammunition, furniture etc"
Chowmahalla_Palace,007SureshHyd,5.0 of 5 bubbles,Dec 2019 • Family,Historic and must visit,Very  close to Charminar and has rich history and well displayed of ancient weapons and culture. Don't miss it car museum.
Chowmahalla_Palace,Sreedharan N,4.0 of 5 bubbles,Feb 2019,Palace of the Nizams,It is the palace of the Nizams of Hyderabad. The palace is unique for its style and elegance. Construction of the palace began in the late 18th century and over the decades a synthesis of many architectural styles and influences emerged.The clock above the main gate to Chowmahalla Palace is affectionately called Khilwat Clock. It has been ticking away for around 251 years.
Chowmahalla_Palace,Passi0nate_Traveller,4.0 of 5 bubbles,Dec 2019 • Friends,Good Palace ,"This is located around few 100 metres from charminar . Worth visit this Palace which has rich history . We can spend more than 2 hours where we have gardens, small vintage car museum , internal palace rooms with lot of stuffs of king Nizam including furnitures , Crockery etc., "
Chowmahalla_Palace,pushpa b,4.0 of 5 bubbles,Dec 2019 • Couples,Must go!,"It is a very pretty palace. If you love photography and history, you must go. They have some lovely vintage cars on display. "
Chowmahalla_Palace,Eber Shibin,3.0 of 5 bubbles,Oct 2019 • Family,Looks alright,"Decent looking place and well maintained lawns. However, the parking is extremely difficult to find. Poor traffic management by police. Its advised to visit here by rickshaws or cabs. "
Chowmahalla_Palace,JonasB,4.0 of 5 bubbles,Dec 2019,Great place,"Nice trip, the throne room is beatiful, a loot os places to take photo, the gift shop is little and do not have many options, the palace is near Charminar, but i do not advice to go alone to charminar if you are foreigner."
Chowmahalla_Palace,Prakash,4.0 of 5 bubbles,Oct 2019 • Family,Family trip,"Beautiful place, must see once with family. Easily can spend half day here. Good historical place..."
Chowmahalla_Palace,Mittal28,5.0 of 5 bubbles,Dec 2019 • Family,Nice palace,Do visit only once..cz all palace are one and the same..nothing as such to see..greenary is nice..same things are there
Chowmahalla_Palace,Rasik shah,5.0 of 5 bubbles,Dec 2019 • Couples,Chowmahalla palace,Nice and buetyfull palace. One king made big history and did great progress in his life . Very larger palaces
Chowmahalla_Palace,UnnatKotak,5.0 of 5 bubbles,Aug 2019,Just Great.....,"The way to the main palace was to go though the small doors was great we enjoyed the walk the arcitecture in windows and ceiling was good, the palace is well maintaind the glass fixtures and in the palace was amaizing the artifects lying there each ahd a adjoining not that gave a good knowlege of the artifect. over all it was good."
Chowmahalla_Palace,Aravind D,4.0 of 5 bubbles,Dec 2019,Nice Palace,Good Palace with lot of things to see. Do not miss to see the vintage cars which are displayed - they are awesome.
Chowmahalla_Palace,Kehren Eade,5.0 of 5 bubbles,Dec 2019 • Business,Perfect,"This Palace is likely beyond your wildest dreams! Drop Chandeliers in abundance, signs everywhere of the economic decadence of the reign of the rulers of the time. Incomparable beauty from a different era. I could not recommend this site more highly. Kehren, Australia"
Chowmahalla_Palace,Shalini N,3.0 of 5 bubbles,Oct 2019 • Family,Visit only if you have time,The Palace is situated near Charminar and hence you can visit it if you are done with your shopping near Charminar.  Not a well kept place and not much to see 
Chowmahalla_Palace,SundarRam54,4.0 of 5 bubbles,Nov 2019,Nizam Era Palace,"If you visit Charminar, you can walk across to this palace of Nizami era,made by Asaf Jah V ruler , and is modelled along lines of Shah of Tehran palace. The compound has huge beautiful fountains and well manicured lawns. Shade giving trees on the lawns will compel you to sit under them. There are two gigantic gates ,one for general public and another called Shahi Darwaza. The palace has huge collection of interesting pictures of the Charming Princesses of Nizam royalty. These pics of the  ladies of Turkish and Persian descent and Nizam’s collection of Vintage Luxury motor cars are ’must see’ exhibits here. Not all parts of palace are well maintained but there there are fairly decent washrooms , a well stacked canteen and memorabilia store in the palace. Ticket is Rs60 for Indians and Rs 200 foreigners ,with additional fee of Rs 50 for Camera. If you are so inclined, there is a photographer on the premises who will dress you up in princely attire for a pic shoot. "
Chowmahalla_Palace,Boris,4.0 of 5 bubbles,Oct 2019,Oasis amidst a huge town,"Nica place to have a walk, good ambience, very different from what you see outside, on the drive here"
Chowmahalla_Palace,Mancric,4.0 of 5 bubbles,Nov 2019 • Friends,Good place ,Visited this palace during my recent visit to Hyderabad. It was a short visit as we had a very little time in hand. Kindly keep at least 2-3 hours for this place. It's a must visit place in Hyderabad.
Chowmahalla_Palace,Noshf,4.0 of 5 bubbles,Nov 2019,A good half day visit,"Beautiful 4 palace residences of the Nawabs in one compound. The vintage Gold Rolls Royce, other cars & carriages have been maintained in original condition. Lovey manicured lawns & garden. "
Chowmahalla_Palace,Debbie N,3.0 of 5 bubbles,Nov 2019 • Family,Needs thorough maintenance,"Though the main palace is spruced up, the entire palace complex needs huge building maintenance. The complex is divided, other than the main palace, which is now a museum, into afzal Mahal, mehtab Mahal, buggee Khana/ vintage car gallery and clock tower. The main palace has the durbar hall with the masnad( throne) of the last nizam preserved along with their clothes, crockeries, armour and cars.  If you wish to see all, spend about 2- 3 hrs."
Chowmahalla_Palace,macedonboy,5.0 of 5 bubbles,Nov 2019,Palace of the Nizams of Hyderabad,"Chowmahalla Palace is the royal palace of the monarchs or Nizams of Hyderabad. Surprising for a royal palace of the former Maharajas, this palace is still owned by the titular Nizams, although they don’t actually live there anymore.Much of the building is built in an Indo-Islamic style, but there also seems to be Neoclassical and Renaissance influences too. The durbar hall is probably the best room of the palace as its exceptionally beautiful with a white throne, marble floors and bright crystal chandeliers. The best thing to see in Hyderabad"
