Tourist Attraction,Name,Rating,Date and criteria,Title,Review
D_G_S_Melkote_Park,SRIKAKOLAPU,5.0 of 5 bubbles,Dec 2019,Good without noice,Its pleasant and we have very less or no noise from vehicles.Parking space is present.Entry fee is there and monthly pass as well
D_G_S_Melkote_Park,Jitendra K,4.0 of 5 bubbles,Dec 2019 • Family,Natural place,"We went in evening time, I think before dark it is good place to go. We can sit on the benches available."
D_G_S_Melkote_Park,MathewsDcruz2017,5.0 of 5 bubbles,Oct 2017 • Friends,D.G.S Melkote Park,Nice park just visited this park can see that people and kids are been enjoying the garden nice area we can see that nice place for photography but photography is not allowed
D_G_S_Melkote_Park,gourishanker h,5.0 of 5 bubbles,Dec 2017 • Family,Decent location for family ,"A good place and park to visit with kids, well maintained by guards. opens in evening by 3pm with Rs5 entry ticketsThere is walking track, thanks HMDAlittle parking available for cars Location easily reached using google maps Combine this trip with weekly grocery from Spencer’s hyper which is 8mins drive. Thumbs up for now. "
D_G_S_Melkote_Park,mhussain_bohra,4.0 of 5 bubbles,Oct 2016 • Family,Great times,One of the best place to spend time with family. It has a nice walking path where one can either walk or jog and there are also small rides for children. Overall a great place.
D_G_S_Melkote_Park,higghligght shiva,3.0 of 5 bubbles,May 2016 • Family,Best park to relax,"v didn't plan 2 come here  v came 4 movie so its late that to 20 mins so nearby park is there  v eated and v gone 2 that place that to 1st v entered inside at  3pm its open i think best 2 go  at rainy season or evening  many birds and koyals were cmng whitling ,singing atmosphere in nice many r cmg 2 relax i think in that area nothing else park is there childrens play area is nice and small canteen ,toiilets, cool water at summer its very nice facilities overthere"
D_G_S_Melkote_Park,Dharanidhar13,5.0 of 5 bubbles,Apr 2016 • Solo,Awesome,It was really awesome...we can have great piece of mind.. Good for joggers..for family.. And friends. The maintenance was also good.. We can get foodies there.. The entry was 5rs only..!! A good spot for piece.
D_G_S_Melkote_Park,Shashank1961,4.0 of 5 bubbles,Sep 2015 • Friends,Good for Morning/Evening Walk,Entry fee is Rs.5. Monthly pass also available. Entry Free for Senior Citizens. Paid parking for cars & two wheelers also available. Very well maintained. Spread over 7 acres. Children play area OK. Security good as cameras are installed all over park.Skating area small but good. Closed from 11.30 AM to 3.30 PM. Open all days of the year. Separate path for joggers/walkers. A place to relax.
