Tourist Attraction,Name,Rating,Date and criteria,Title,Review
GVK_One_Mall,Repala S,4.0 of 5 bubbles,Nov 2016 • Friends,GOOD LOCATION FOR GATHERING.....,"Good place for shopping with family and have some food at the food court. It is one of the greatest, cutting edge shopping center in Hyderabad. Its resemble a remote shopping center. The aquarium in the ground floor is excellent ."
GVK_One_Mall,vipulagrawal1,4.0 of 5 bubbles,Jan 2017 • Family,"Very good food court,Aquarim at enterence is unique",I liked the setting of the mall specially cylindrical aquarium on Ground floor reception. Kids as well as adults take photos and view it. Food court has very good variety and outlets. Should visit if you have time.
GVK_One_Mall,Aditya A,5.0 of 5 bubbles,Oct 2016 • Couples,best mall,one of the best mall in hyderabad as well as in India ..the best thing of this mall is that it is suitable for each and everyone and it is at the centre of the city
GVK_One_Mall,Dinkar P,4.0 of 5 bubbles,Dec 2016 • Family,Good compact mall,Good compact mall with very good inox theatres.We went during Christmas time and it was well decked up with good activities for kids.It has the best economical brands and hence you can finish all your shopping at one go.Hard rock cafe is also present in this mall so you can combine your shopping spree with a good party towards the night.Has got good parking space considering that the mall is not built in a very large square feet area.
GVK_One_Mall,AI_2013,5.0 of 5 bubbles,Dec 2016 • Family,Best mall in Hyderabad,"Love this mall.. great shopping and dining options and a wonderful Spa and Hair Salon. Great place to spend a few hours shopping, eating and relaxing."
GVK_One_Mall,SamWorld,5.0 of 5 bubbles,Dec 2016 • Couples,Biggest in Hyderabad,"Very big mall with all type of brands... Clothes, accessories, food, gadgets, Starbucks, hard rock cafe... If you visit this mall you dont have to visit any other mall in Hyderabad... Well designed... And good place for hangout!!"
GVK_One_Mall,BinodMishra,4.0 of 5 bubbles,Dec 2016 • Friends,Good one ,We were there and roamed almost entire mall . Nice ambiance and accessibility . Almost all brands are there so easy reach .  
GVK_One_Mall,RamySafwat,4.0 of 5 bubbles,Nov 2016 • Friends,Good for souvenirs and general shopping,"Clean and just to the point, i like this mall vs the others in town as it doesn't confuse you with many shops selling same thing and have several souvenirs shops and Tommy kids. Its my preferred mall in town, just missing Lacoste to be perfect"
GVK_One_Mall,Georgio Valentino Rayala,4.0 of 5 bubbles,Jul 2016 • Friends,Great Mall,"Inspite of all the new malls that have opened up,this mall continues to be one of the best mall in Hyderabad.This mall not only has a good collection of International Brands but also has a good multiplex,fun zone,restaurants like Khaansaab and Hardrock cafe etc and also it's located in the Center of city."
GVK_One_Mall,antaryami2016,4.0 of 5 bubbles,Aug 2016 • Couples,One stop for all international brands,This place hosts a lot of international brands as well as internationally famous national brands. This a very good place for shopping. It does have a INOX & food court. So if you're looking for some fun on weekends especially evenings this is a great place!
GVK_One_Mall,stantp1916,5.0 of 5 bubbles,Oct 2016 • Couples,Very nice mall,"Very nice mall, though not very big in size. There was a lovely aquarium in the first floor. Hosts almost all big brands as well as small ones too. We ate in the food court. Food court is not very big but has variety of food."
GVK_One_Mall,Travelcalm,3.0 of 5 bubbles,Oct 2016 • Family,GVK one mall,Overwhelmingly too much of international brand shops one next to each other. Nothing unique unless you have a requirement to visit a particular brand shop
GVK_One_Mall,Prasad B,4.0 of 5 bubbles,Sep 2016 • Friends,Good place for relishing weekends:-),Nice architecture...State of art facilities and infrastructure.Presence of INOX is an add on one over the same.
GVK_One_Mall,Sanjaymit,3.0 of 5 bubbles,Sep 2016 • Family,Un clean restrooms neat food court,I visit this mall and watch all movies in its multiplex. I and my family usually enjoy quality time in its food court ( 3 rd floor) after movies and hence use rest room on this floor. But they are really unhygienic and unclean. A foul smell is a part of this rest room ( ladies) . It even doesn't have paper napkins to use after hand wash. The cleaners there are always busy in chatting n dressing themselves . I request concern authorities to rectify the matter which definitely is bringing bad name to entire mall.  
GVK_One_Mall,SKYLA S,4.0 of 5 bubbles,Sep 2016 • Friends,Good mall,"This is one of the good malls in the Hyderabad City.  Shopping - Good Branded Stores, Multiplex Screens, Good Choise of food. As the mall is located in a prime location and Movie screens are located in the 5th Floor you can expect the crowd through out the day. The mall is ideal for shopping/window shopping."
GVK_One_Mall,Abdul,4.0 of 5 bubbles,Sep 2016 • Couples,Shopping and dining Spree,"I been there last week, my favourites brands are there and also many eating joint's i like to be there again."
GVK_One_Mall,Satish R,4.0 of 5 bubbles,Aug 2016 • Family,Good mall,Awesome place to find decent brands and has ample parking too.Well laid mall where all shops are easily locatable.
GVK_One_Mall,Rimjhim B,4.0 of 5 bubbles,Mar 2016 • Friends,All under one roof,"This is one of the best malls in the Hyderabad City. There are shopping outlets of almost all major brands , food outlets with delicious food and movie screens. Basically the mall has everything under one roof to make your weekend."
GVK_One_Mall,SuvodipMoitra,4.0 of 5 bubbles,Aug 2016 • Friends,Good Mall,"Its a decent/good mall. But too far away from Hitec City/ Gachibowli area. It has a good brand presence, a hard rock cafe, shoppers stop, pubs, restaurants & a INOX. Good for people staying in Banjara Hills area."
