Tourist Attraction,Name,Rating,Date and criteria,Title,Review
Hyderabad_Botanical_Gardens,Kaushalps,5.0 of 5 bubbles,Nov 2021,Best Botonical garden,It used to be one of the best botonical gardens but now due to constuction this is being neglected .. Cycling is fun there.. Also there is a jogging trek for morning walk..birds do buzz here..overall place to be maintained..
Hyderabad_Botanical_Gardens,Anjana,4.0 of 5 bubbles,Jun 2021 • Friends,Walking,It’s a place in the middle of a city still another world…….close to nature n beautiful. Peaceful and well maintained a lovely place to start your day with a walk here
Hyderabad_Botanical_Gardens,Twinkle Sonar,4.0 of 5 bubbles,Dec 2019,hyderabad botanical garden,The Botannical Garden is a sprawling garden in the heart of Hyderabad city. amazing place one must visit once
Hyderabad_Botanical_Gardens,sow,4.0 of 5 bubbles,Dec 2019 • Family,Family time,Good place to visit n have can good time.peacefull place.for children it's best to spend time over here
Hyderabad_Botanical_Gardens,BhaskarVVB,5.0 of 5 bubbles,Jan 2020 • Solo,Multiple early morning health based trips,"Signed up for couch to 5k Hyderabad runners program being held 3 times a week since January 2020.As part of this program, I end up being there at 0600 am for about 90 minutes.There are quite a few health freaks trying to run, jog, walk, stroll with kids, stroll with spouse, play badminton, do yoga or just laze around to get free vitamin D.I took the monthly pass which makes it a little easier for this month.You get to drink some hot flavored health drink at the entrance. I cannot endorse as i haven't tried yet. However, do see folks relish it.All in all recommended as a good place early in the morning if you want some clean air and fresh surroundings.Happy botanicking & stay healthy."
Hyderabad_Botanical_Gardens,jainms,5.0 of 5 bubbles,Jan 2020,Nice garden,"well maintained park and suggested for regular walk as well, it has greenery and located in kondapur."
Hyderabad_Botanical_Gardens,Xyzz,5.0 of 5 bubbles,Mar 2019 • Friends,Botanical garden,Its nice place to go with Friends and family.. .. .. Its located near kondapur.. . Its large garden with benches.. . Food items not allowed inside. . Nice place for couples as well.. . Greenry Mentainted and you can find birds and Squirral around.. .
Hyderabad_Botanical_Gardens,Katzistan,2.0 of 5 bubbles,Jan 2020,Unrealized potential,"The gardens are not well-maintained, and there aren't very well-kept paths for walking. The pond is drained and muddy. Everything is dusty and unkempt. The children's playground is ok, but half the equipment is broken. It could be a really nice place if it was kept well."
Hyderabad_Botanical_Gardens,CuriousTraveller,5.0 of 5 bubbles,Feb 2019 • Solo,Beautiful greenery at Botanical Garden Kothaguda,"Its an awesome place where you can enjoy beautiful greenery with variety of plants that include variety of cactuses.very well maintained plants, trees, sheds to sit, view and relax under the tree shades.gardens is maintained very well.people also play shuttle.walking while looking at these beautiful plants is really worth. I wish to take my son next time."
Hyderabad_Botanical_Gardens,Srikanth M,4.0 of 5 bubbles,Dec 2019 • Family,Best place to visit in Week end ,It's a nice place to visit in weekend with children's.peaceful place with lot of Greenery.and also best for morning and evening walk.
Hyderabad_Botanical_Gardens,Krish,4.0 of 5 bubbles,Nov 2019,Cool place for jogging and hanging out with friends and family,"A good and serene place to spend evenings with family and friends, the place is kept clean so please do not litter.Entry fee Rs 25/adult Rs.10 for kids, and a monthly pass is 400It features an open gym and a lot of peacocks that are great to watch. Fun fact: A single round from the entrance, round through the Conservatory and back to entrance  is a distance of 3 km, with a lot of greenery making it a good place to jog. The only complaint is the small pond present could be cleaned to avoid the voluminous mosquitoes."
Hyderabad_Botanical_Gardens,Prudhvi,4.0 of 5 bubbles,Oct 2019 • Friends,Nice place to visit in free time.,The place is spread across many acres and nice greenery around the whole place. There are many recreational activities like arrow shooting. There are food court to eat. For those who want to stay there are cottages. You can spot many peacocks as you roam around the garden.
Hyderabad_Botanical_Gardens,Souji,5.0 of 5 bubbles,Sep 2019 • Family,Family visit,"It's a best place for children to know about the plants and also to have good time. The weather in evening is perfect for outdoor picnic with small children. We can get to know about all the tropical plants present in the region with their names tagged to the plants. With their scientific names too. It has a vast area with different shrubs, plants, trees and all."
Hyderabad_Botanical_Gardens,Prasad B,3.0 of 5 bubbles,Nov 2019,Place with a beauty but needs the renovation.,Botanical gardens is located near SLN terminus kondapur but it needs a impairment cum renovation to get the arena back.
Hyderabad_Botanical_Gardens,Traveller,3.0 of 5 bubbles,Dec 2018 • Family,Very beautiful and warm environment,"beautiful gardens and landscaping across all its infrastructure projects. And to underline their importance and inspire our younger generation, who are the future of India, we have given these gardens a collective identity that connects"
Hyderabad_Botanical_Gardens,Nitin A,1.0 of 5 bubbles,Oct 2019 • Family,Still thinking what is there to do here,"Tortoise shaped building with a basic gym , few walkways and stinking water bodies. A covered area of different varieties of cactus is all I could find in this place.There were so many possibilities to make this place an educational place for kids but sadly the place is nothing to offer for kids.It is more of a joggers park rather than anything botanical about it.Disappointed."
Hyderabad_Botanical_Gardens,Sashi555,4.0 of 5 bubbles,Mar 2019 • Family,Trip to Botonical Garden,We all are very happy to visit Hyderabad Botonical Garden and we enjoyed a much. Actually we are on scientific research on Botonical topic and it helped to some extent.actually we expect some other species.
Hyderabad_Botanical_Gardens,Srikanth,4.0 of 5 bubbles,Jun 2019 • Business,Friends with business,It is very good place to have business works.it is very peaceful were we can do our work so perfect and clear
Hyderabad_Botanical_Gardens,Naren,5.0 of 5 bubbles,Sep 2019 • Family,"Botanical garden, kondapur","Nice place to have fun with kids and family. Whoever want to do physical activities like Gym, warmups, walking.. for all this it's good place to join.. now a days governament has done fabulous job by maintaining the garden and greenary... Just have a fun"
Hyderabad_Botanical_Gardens,Dil,4.0 of 5 bubbles,Sep 2018 • Solo,Botanical garden,The botanical garden facilities the of a modern botanical garden to educate the people.it has 274 acres
Hyderabad_Botanical_Gardens,Hari Sri,5.0 of 5 bubbles,Jul 2019 • Family,Dinner,It was wonderful enjoying my dinner with my family. It's very tasty enjoyed the most delicious food.
Hyderabad_Botanical_Gardens,beyondtravel,4.0 of 5 bubbles,Jul 2019 • Family,Strollers delight,"Is a beautiful botanical Garden amidst kondapur hustle,  a perfect getaway especially for morning walk with long walk (3.5 kms)  accompanied by flora,  peacock,  birds and water bodies.  Not as informative tho as a student interest.  Have 6am-9am,  4 -6 pm for walkers at 25 entry fee with daily,  monthly,  yearly pass available.  Ample parking available.  They have other attractions thru the day including minigolf,  food court,  activities etc.  A good place to feel fresh"
Hyderabad_Botanical_Gardens,Wanderlust,3.0 of 5 bubbles,Apr 2019 • Couples,Average garden at Kondapur main road,"This is an average garden. One can go for running in mornings. Landscaping is good, but could be better. There is a small man made bridge where you click some good pics"
Hyderabad_Botanical_Gardens,Vikram,3.0 of 5 bubbles,May 2019,A park that has botanical plants and scope to do more,"This is one of the last few lung spaces in the HiTech / Gachibowli area of the twin cities. Amidst the concrete jungle, this garden has greenery and plants with medicinal value. This space could have been invested to yield more and provide more herbs as well as home to many species of insects, & birds. The lack of water for the plants is affecting many invaluable ones.   "
Hyderabad_Botanical_Gardens,SRIKAKOLAPU,5.0 of 5 bubbles,Dec 2018 • Friends,nice,It has some rare species of plants and a lot of greenery.Photography they say is restricted but people take pics here.Nice place to go once
Hyderabad_Botanical_Gardens,Dilip kumar,4.0 of 5 bubbles,Mar 2019 • Friends,Best to timepass,This place will make you time pass and make your time go away easily and will give a good feel of enjoyment.
Hyderabad_Botanical_Gardens,EkMusafir,3.0 of 5 bubbles,Mar 2019 • Family,Open Space For Recreation.,"The Botanical Gardens of Hyderabad, officially known as Sri Kotla Vijayabhaskara Reddy Botanical Gardens, is located on the Miyapur-Gachibowli Highway in the Kondapur area. There is a huge free parking lot for cars and two-wheelers.Upon entering you have to buy a ticket for ₹25 per person, and there is a stiff fee for photography and videography. It seems that these fees are meant for commercial shootings, but everyone was entering without paying for their cell-phone cameras, and many were taking selfies. If you are a regular morning walker you can buy a pass for ₹400 per month or ₹1500 for an annual pass.As you enter there are some life-like statues of animals and birds laid out in neat gardens. There are some demarcated areas for yoga, a wellness center, a party zone, skating rink, mini golf course, fitness center, an adventure arena, a video hall, conference hall, and an amphitheater. There are some cottages for rent and a Food Court which opens later in the day.The main walking track leads into a dry forest which is more brown rather than green. The track is made of a mixture of sand and gravel. The full round of the track is about 3.5 km. You can hear peacocks early in the morning, and if you are lucky you may even see some. Other smaller birds like bulbuls, babblers, sparrows, and bee-eaters can also be seen and heard.It is best to go early in the morning if you want to exercise your limbs. Compared to parks in other parts of the country, like Bangalore or Pune, the entry rates are very high, and the park is not so green and soothing to the eyes. The Telangana Forest Department should work on these aspects to make it a better experience for the nature lovers."
Hyderabad_Botanical_Gardens,Pradeep,5.0 of 5 bubbles,Oct 2018 • Friends,Awesome restaurant,We really enjoyed . what I ordered food taste is Soo good . I really like restaurant also. Customer service is good
Hyderabad_Botanical_Gardens,Rahul Mishra,4.0 of 5 bubbles,Feb 2019 • Couples,Fresh breeze in concrete forest,"If you are in Hitech City Hyderabad , then at least once you should go here for morning walk. Walkway, Food-zone, Swings, Adventure Activities, Photogenic Location Everything is here."
Hyderabad_Botanical_Gardens,Sunita S,4.0 of 5 bubbles,Feb 2019,Pretty interesting collection!!,"Loved the place for a morning walk, collection of nice plants and trees. It is a good study tour for kids to understand the different types of flora and fauna. Post renovation, has got better."
Hyderabad_Botanical_Gardens,Daniel T,4.0 of 5 bubbles,Jul 2018 • Solo,Nice place be amidst nature,"This is a nice place to keep young kids entertained, for walking, jogging activities. With the traffic n pollution around, this place gives a nice option to relax. Nice place for large groups as well"
Hyderabad_Botanical_Gardens,nik c,1.0 of 5 bubbles,Feb 2019 • Couples,Some people would call this extortion,Went to these gardens recently expecting to visit botanical gardens.When we went to buy entry tickets they wanted to charge the four of us the equivalent of $160 each for each of our cameras.   Needless to say we didn't go in.   Is this just another attempt to take advantage of tourists who might not know the value of the rupee exchange rate?
Hyderabad_Botanical_Gardens,SURESH babu,5.0 of 5 bubbles,Feb 2019 • Friends,Good,We are happy with their service and quality of food. We will definitely visit again and again. It's great pleasure to us.
Hyderabad_Botanical_Gardens,GBee,1.0 of 5 bubbles,Feb 2019 • Friends,"Very little to see, scamming tourists with cameras","They are charging upwards of 4000 rupees (£43, $56) just to take a camera into the 'gardens' - since no right-thinking local would pay even a fraction of that amount. I can only assume they are trying to scam clueless tourists who have no idea of the relative value of the rupee.Once inside you'll be glad you didn't pay that charge, because the ornate entrance is just hiding a very tiny space that contains nearly nothing to deserve the 'botanical garden' title. It's smaller than most parks in the city and lacking in botanical interest - you'll see more plant species in the nearby waste ground than you will inside the perimeter.There are a few attractions  for the kids - a mini-golf course and an adventure/activity area for which you'll pay extra."
Hyderabad_Botanical_Gardens,karthik D,1.0 of 5 bubbles,Jan 2019 • Friends,Worst Govt Policies,"Definitely it's a big thumbs-down 👎 for the tourists visiting here with their cameras. They are charging like 4000 to 8000 rupees to allow a camera. You know, a camera lens can be bought with that money. Too ridiculous to charge that much. If it is a commercial photo shoot or film making it would be appropriate to charge as they would be getting money from the shoots. But for family and friends to make some good memories and store them as photos, it is too much to charge those amounts. I saw foreigners arguing with the staff and even left the place as they found the charges are to high.  It's not only about this place,every where in hyderabad they are charging like this only. There are only few places in hyderabad to visit and due to this camera charges we are not able to visit any of them. It will surely impact the tourism in hyderabad over the course of time."
Hyderabad_Botanical_Gardens,Maït F,1.0 of 5 bubbles,Jan 2019 • Solo,Now extortionate for nature photographers :(,I came early in the morning for birdwatching with my pocket digital camera. The entry fee is still INR 25 but the camera fee has recently jumped from INR 500 to INR 4000-8000 (I was asked for 4000). The website hasn't been updated though...
Hyderabad_Botanical_Gardens,Bhagyashree S,4.0 of 5 bubbles,Jan 2019 • Family,Morning walk with family,Serene morning walk.it is very pleasant and entire park is free from pollution.Place good for exercise as well as meditation.Please visit.
Hyderabad_Botanical_Gardens,deepa v,4.0 of 5 bubbles,Sep 2018 • Family,Garden,It's a beautiful garden located in gachibowli area.. Very old... Full of greenery..a nice place to enjoy a day with family
Hyderabad_Botanical_Gardens,يونس يونس,5.0 of 5 bubbles,Jan 2018,Plants and trees,"They have all for all. For the adults as well as the young. It was great.I loved the train, the large size insects and the people. "
Hyderabad_Botanical_Gardens,SeshKomanduri,3.0 of 5 bubbles,Nov 2018 • Family,Too much concrete- dry place,"It seems to be a very popular place for walkers and joggers and people rave about it. I could not understand what the fuss was all about. In the quest for ''modernizing'', there are too many concrete structures that have been erected and the gardens no longer feel natural. The gardens itself are very dry and dusty.  Went for an early morning walk and came back with clothes covered in dust! Not a satisfying experience at all"
Hyderabad_Botanical_Gardens,dineshshradha,5.0 of 5 bubbles,Oct 2018 • Family,Good,Its a place to chill out with friends or family i loved it must go and do share your experience .I will recommend always find out places and review on TripAdvisor
Hyderabad_Botanical_Gardens,Mega B,4.0 of 5 bubbles,Oct 2018 • Friends,Well maintained park,"This park has improved immensely in last few years. With 25 Rs entry fees the open gym, walking/running path, play areas, adventure zones are more than one can expect.There's a small eatery, but not sure of quality of food provided.Overall a great park for morning or evening walks and kid's play."
Hyderabad_Botanical_Gardens,Ashish Kumar,4.0 of 5 bubbles,Aug 2018,Morning walk & bird watch,"The place is improving every month, with more maintenance activity going round & better public amenities being introduced.A wonderful place for morning walk, yoga or meditation, but noting unusual to call it a botanical garden."
Hyderabad_Botanical_Gardens,Trending T,4.0 of 5 bubbles,Aug 2018 • Friends,Best of the best gardens,This place has its own importance and has been registered as national park and it is very good for morning walk.
Hyderabad_Botanical_Gardens,njydlife,5.0 of 5 bubbles,Aug 2018 • Family,Remodelled,Best place to spend weekends with kids. Totally renovated. Amazingly carved landscapes are spcl attraction
Hyderabad_Botanical_Gardens,Ritesh J,5.0 of 5 bubbles,Aug 2018 • Family,Wonderful Place,"This place has been redeveloped recently and there are many adventure activities available at an extra charge. The charges are nominal. Entry fees for adults is 25 rupees and 10 for kids above 5 yrs. Below 5 years is free. This place is vast with food court, gardens, adventure activities, cactus garden, jogging track, open air gym, enclosed gym, party area and lot of open place etc. The pics you see are very old but I am uploading the new pics today. It's clean and maintained well. But I saw someone dropped empty tetra packs in the cactus garden. The government is trying it's best but it is the citizens who also need to drive the culture of cleanliness.Feel free to like my review if it helped you.Enjoy your visit.."
Hyderabad_Botanical_Gardens,Karthik Dasu,3.0 of 5 bubbles,Oct 2017 • Friends,Nice garden,"It is one of the better gardens in the city, very much near to the Gachibowli and Hitech City.Please do visit, if you are free."
Hyderabad_Botanical_Gardens,Abhilash K,5.0 of 5 bubbles,Jul 2018 • Friends,Great garden,Here we can found lot of species of the plants and even I found different types of flowers Nd even very old trees here
Hyderabad_Botanical_Gardens,Naveen Mittal,5.0 of 5 bubbles,Jul 2018 • Couples,Great park with good variety of plants,"It's good park. I went during a light rain. It was good experience. I saw good variety of plants, and a lot variety of cactus."
Hyderabad_Botanical_Gardens,suresh n,4.0 of 5 bubbles,Dec 2017 • Friends,The park has been designed beautifully with water bodies complementing the lush greenery of the place. ,"Botanical Garden of Hyderabad is also one of the interesting sights seeing  place  offering a refreshing setting and rich flora. Having been developed by the Forest Departments, Botanical Garden is situated in Madhapur near the Hi-tech City which is almost 16 km away from centre of the city.Botanical garden boasts of more than 600 varied species of plants. The garden is bestowed with dense flora with a few sparsely grown areas for visitors’ walking. Along with its vast flora variety, it also attracts many birds and insects, which further enhances the natural charm of this garden. Bamboo sector is the major attraction of the garden. All the bamboo trees have specific signboard with the scientific name and generic name of the trees. Another popular sector of the Botanical Garden is the Palm sector."
Hyderabad_Botanical_Gardens,vmsatheesh22,4.0 of 5 bubbles,Jun 2018 • Friends,Mmm,"Hyderabad  botanical garden,, a wonderful place to visit and enjoy the wonderful time, good atmosphere best "
Hyderabad_Botanical_Gardens,Rohit Reddy,4.0 of 5 bubbles,Dec 2017 • Family,Beautiful and Peaceful,"Very good and big place for family outings, kids play and for nature lovers. Only concern is parking is on the other side of road."
Hyderabad_Botanical_Gardens,njydlife,5.0 of 5 bubbles,May 2018 • Family,Multiple varieties of plants,A place for Multiple varieties of plants with green house ..also has boating facility. Generally crowded on weekends
Hyderabad_Botanical_Gardens,Ajitku,4.0 of 5 bubbles,Apr 2018 • Friends,Garden,It is a beautiful botanical garden available in Hyderabad. All types of tree and plants available here.
Hyderabad_Botanical_Gardens,pdborade,4.0 of 5 bubbles,Jan 2018 • Solo,Very nice place,Nice place in Hyderabad. You must visit whenever go to Hyderabad. You feel like natural feelings. Thanks
Hyderabad_Botanical_Gardens,Partha Sarathi M,1.0 of 5 bubbles,Apr 2018 • Couples,Too much money looting for camera,"The princes for photography are pathetic. Don't know how many people are affording it. How come they charge Rs 3000/- for photography? If mobiles phones are allowed what's wrong with DSLRs, since every phone has camera snow? They are looting too much mindlessly.In Hyderabad many such places even don't allow cameras. It's ridiculous. The reason is not yet clear. But such practices should be stopped, or they will be loosing their own credibility."
Hyderabad_Botanical_Gardens,Ravindra V,1.0 of 5 bubbles,Mar 2018 • Family,Waste of time,"I have given it earlier 3 stars and now it doesn't deserve even 1 star. We went there to have photoshoot for our kids. But once we went there we were shocked after seeing the photography charges. It is 3000 INR. Yes, you read it right. Where in the world does any park charge that much for taking photos. There is another ticket for photography for INR 500 if you are there between 5 am to 8 am. We didn't take the photography ticket (well, who will take it) and went in to spend some time. It's good that we didn't take it. There is not much greenery in the park and it is getting converted into concrete park. They are building some buildings (like gazebos etc) and making it more like a public park than a botanical garden. This garden has lost the points which it had for whatever greenery it had earlier. Total waste of time."
Hyderabad_Botanical_Gardens,Chandu C,3.0 of 5 bubbles,Mar 2018 • Family,Good one ,I would say that it is a good destination in Hyderabad and I would definitely recommend you all to have a visit and explore the garden 
Hyderabad_Botanical_Gardens,LadyRider,2.0 of 5 bubbles,Feb 2018 • Solo,"Under construction, good potential ","The garden is under construction now, so it is just a beginning of something very good.  Nothing to see at the moment, very small area to walk (I walked it all round in 10 minutes, the most of the area is closed). However there is lots of work in progress, so I’d like to return in about a year to see a big and nice organized garden. Keep going!"
Hyderabad_Botanical_Gardens,Travellove1025,5.0 of 5 bubbles,Mar 2017 • Couples,Good Bicycle track,It's a good park with well spread area. Ideal for picnicking with family and friends. It also has a good cycling track and you can rent bicycles from there and ride. The garden also has fun activities for kids.
Hyderabad_Botanical_Gardens,md hussain,5.0 of 5 bubbles,Jan 2018,My Golden Days were here,One of my fav places in hyd for nature seeing and picnic spots along with family. All greens everywhere and also there a pond with a scenic view. It has many plant species which are not found in common outdoors. I used to visit this place very often during my college days along with my friends. Lovely place :)
Hyderabad_Botanical_Gardens,Narasimha A,5.0 of 5 bubbles,Dec 2017 • Couples,For Relaxation,It is very peaceful place visit. Who are enjoying nature those people are going to this place . I njyd  a lot. I hope you  feeling like this
Hyderabad_Botanical_Gardens,Vijay R,4.0 of 5 bubbles,Nov 2017 • Friends,Visit for Botanical Gardens,Nice place for environmental lovers.Worth seeing it.Good variety of flowers exists here.Nice place for children they would love here to play.
Hyderabad_Botanical_Gardens,ravirjy,4.0 of 5 bubbles,Dec 2016 • Friends,Nice garden,We went to this place and had Nice with friends. The garden is neat and fresh air. Best place to visit for relaxation.
Hyderabad_Botanical_Gardens,lovetravelonly,5.0 of 5 bubbles,Aug 2017 • Family,Botanical Garden of Hyderabad,The Botanical gardens in Hyderabad has a wide variety of trees and plants. It is located near Hi-tech city- Gachibowli area. The entire area is cool and pleasant due to the rich green environment. Very good place for walk.
