Tourist Attraction,Name,Rating,Date and criteria,Title,Review
Hyderabad_Botanical_Gardens,CAKrishnaC,4.0 of 5 bubbles,Oct 2017 • Family,"Pocket of  fresh air in Kondapur area , plenty of greenery","Pocket of  fresh air in Kondapur area , plenty of greenery.10s of PeacocksWalking track is very good – about 3 kms.You should experience this nature ! Get your shoes on ! A god place to exercise,Yoga etc Park area for family and children,can have a picnic. Families come here for photoshoots of children..Explore this.Children play area is available.Children must watch the Tortoise House!2 ponds  have been made. Both were full in the monsoon of 2017.It was awesome to see it .Boating has just been introducedDiagonally Opposite the park ( on Botanical Garden Road) a cycling track/park is being started.Fitness freaks can makde good use of this. Pls donot carry plastic and dirty the park.Donot disturb the birds/peacocksSuggestions to dept :•	Fares have just been increased in October ( Rs 15 to rs 25 per entry).authorities should provide better amenities•	Improve toilets – bad condition, not in line with Swach Bharat•	Put proper signs of no. of kms in the walking track.This is v poor•	Put more seating stones inside the park •	The second park inside the park to be desilted and made bigger to store more water•	Fence the boundry of the lake – atleast temporarily, when the lake is full of water•	Introduce Fish in the ponds, so that it attracts birds•	Include more water birds in the lake – like ducks, swans etc •	Have more  children play area , include adventure activities in the park•	Encourage public to plant saplings in the park and take care of them•	Make it litter free area , no plastic.When lake was full, it was full of plastic bottles !Have more dustbins for public to throw waste. •	Invite public to contribute funds to the park maintenance"
Hyderabad_Botanical_Gardens,GANESHNIYER,3.0 of 5 bubbles,Oct 2017 • Family,"Small place, kids park","I visited with my son for a picnic. However, the gardens is in a small area. The lake was very muddy. Other lake was not properly maintained with plastic cover and bottles on the sides. There is a small kids park. Otherwise, nothing much is there."
Hyderabad_Botanical_Gardens,Saimanojguptha,5.0 of 5 bubbles,Jul 2017 • Friends,Good,Absolutely superb hotel - fantastic staff who were all so welcoming to my friend S. Beautiful guest-rooms & hotel. Amazing restaurants with great choice of top quality Indian or Italian foods. The food is so tasty...
Hyderabad_Botanical_Gardens,Gaurab2017,2.0 of 5 bubbles,May 2017 • Business,Badly maintained,Was excited to visit this place but the entire area is badly maintained. Popular for couples and lovers. Can give a miss.
Hyderabad_Botanical_Gardens,vmsatheesh22,5.0 of 5 bubbles,Sep 2017 • Friends,Super ,"Hyderabad botanical garden beautiful and enjoyable place, we all like the beautiful garden and beautiful flowers "
Hyderabad_Botanical_Gardens,sandeep g,3.0 of 5 bubbles,Apr 2017 • Business,plants,"you feel good if you are a natural and plant lover , you can see good number of verities of plants .."
Hyderabad_Botanical_Gardens,David D,1.0 of 5 bubbles,Jul 2017 • Family,Poorly maintained,"Very puzzled by positive reviews. There's potential here (or faded glory) but this park is cluttered by crumbling ""improvements"" and is very poorly maintained. No comparison to KBR National Park, which is model that should be followed. People are ""working"" but they're not doing any maintenance. Visitors are confined to a limited area. Trails to most of the park (which must be where peacocks have escaped to) have been closed the two times we've been here. Go with very low expectations. Sad because there's clear potential here and this area of the city would benefit from a nice park."
Hyderabad_Botanical_Gardens,Akanksh S,5.0 of 5 bubbles,Feb 2017 • Family,Variety of plants.,The bloomed up plants are best viewed both in day and night. The best time recommended to visit here is evening because you can enjoy the natural beauty of flowers in daylight and the colorful lights at the night.
Hyderabad_Botanical_Gardens,BRKanth,4.0 of 5 bubbles,Jan 2017 • Business,Time for Fresh Air,Place to be seen with family and Kids. They could see different plants and how they are grown. Better for evenings.
Hyderabad_Botanical_Gardens,Siva R,5.0 of 5 bubbles,Jun 2017 • Friends,Very good place,With family it is very good place for entertainment. We will see different types of plants and animals. For photos it is very good place. 
Hyderabad_Botanical_Gardens,Jikuza,4.0 of 5 bubbles,Feb 2017,Nice place to start the morning,"I have been to this park a few times and it has been a wonderful experience so far each time. It is a great place for morning walks/runs. I generally used a track which was about 400m, though once I went onto a track that was far far longer. Peacocks are very much a part of this garden."
Hyderabad_Botanical_Gardens,Travel-Adhikari,1.0 of 5 bubbles,May 2017 • Family,Visit to Botanical Garden,"Though we lived in Secunderabad for years we didn't know existence of a 'botanical garden'. We visited it after we came across the information. May be due to peak summer season, the greenery would have depleted and water in two small reservoirs had evaporated, apathy towards maintenance was glaring. Again the same belief that government run institutions are most inefficient and employees get in them just for the sake of constant source of income, was seen to be true. But we had a very enjoyable experience of watching full grown gorgeous male peacocks....about 7 of them. One was atop the wall at one end of the garden. After sitting there for some time it slipped into the other side and we followed through a gate (no signs about whether we can actually cross over) and penetrated through the dried bushes stealthily. In a small open space surrounded by dried up trees about 7 peacocks had assembled around their feeding site. Other than this there is not other charm in the garden. Sanjeevaiah Park beside Hussainsagar would perhaps be few notches better than this."
Hyderabad_Botanical_Gardens,SuvodipMoitra,4.0 of 5 bubbles,Apr 2017 • Business,Good Saturday Morning visit,This is so near to our place in Gachibowli. Yet we have hard ever gone there. Made it a point to go there last saturday with wife to enjoy the early morning walk. It was indeed a refreshing summer morning walk.
Hyderabad_Botanical_Gardens,PavRao,3.0 of 5 bubbles,Apr 2017 • Friends,Great place for a walk...but needs improvement,Loved the walk in the outer perimeter. Was surprised as to how large it actually is. The Botanical garden area itself isn't​ much and can be much better . Am happy that there is such a place in the city and can imagine how it'll be in time 
Hyderabad_Botanical_Gardens,Nate J,2.0 of 5 bubbles,Apr 2017 • Solo,Under Repairs,"I explored the botanical garden today and what little there is of it has fallen into disrepair.  There is some new material (bricks, dirt, etc.) scattered around so it appears that there is some work being done but they have a long ways to go.  Also, you are limited to a very small area of the garden; most of it is walled off."
Hyderabad_Botanical_Gardens,shivaraikod,3.0 of 5 bubbles,Jan 2017 • Couples,Good for students,This place is on my way to office so thought of paying a visit on my way back home. This seems to be good for botanical students to grasp real knowledge otherwise a one time visit
Hyderabad_Botanical_Gardens,Susan H,2.0 of 5 bubbles,Feb 2017 • Solo,Big Park in Concrete Jungle,"The bones of a well thought out Botanical garden are still present, but you'll have to look through creative eyes to see the what could be from the what is currently there. Currently more of a nice park for strolling. The three bus loads of children where having a great time racing through the paths surrounded by established trees and manicured lawn panels. Couples and groups of young 20 somethings where enjoying the benches and shade. A few labeled plant displays. Room for improvement."
Hyderabad_Botanical_Gardens,Dhwanit S,3.0 of 5 bubbles,Jan 2017 • Family,Average place but scope for improvement,It's a big place to walk around and relax. Not for summers. It needs lots of improvement and has potential to be one of the best place to visit.
Hyderabad_Botanical_Gardens,ReetaKarki,4.0 of 5 bubbles,Nov 2016 • Friends,Greenary around,Botanical garden gives you good greenary view around. Perfect for morning walk. Good place to take kids too.
Hyderabad_Botanical_Gardens,ads634,3.0 of 5 bubbles,Oct 2016 • Friends,Green place amont concrete.,"Garden is very green, but maintenance is very poor. They charge entry fee but not do proper maintenance. Good place for doing exercise. Feel less pollution."
Hyderabad_Botanical_Gardens,janardhan j,5.0 of 5 bubbles,Oct 2016 • Family,Super.........,In Hyderabad i like this very much than others in this garden so many variety of plants and trees and good nature
Hyderabad_Botanical_Gardens,Lav Dwivedi,4.0 of 5 bubbles,Jun 2016,"Green grounds, full of fresh air.","We enjoyed our Sunday evening at Botanical gardens.Pros: The greenery is picturesque and full of fresh air. We liked it to have long chats and click photos with friends. Photographers may find good view points here.Cons: Poor maintenance by the authorities. Because so many people visit this place on weekends, it's getting much of human waste which is making it look ugly sometimes. I guess cleaning and maintenance is not done properly. There used to be a drinking water tank which is not functional now."
Hyderabad_Botanical_Gardens,Veer2468,2.0 of 5 bubbles,Jun 2016 • Business,Not at all maintained,Very poor maintenance. Entry ticket and parking charges are high. No maintenance at all. Broken swings. 
Hyderabad_Botanical_Gardens,RachanaR18,4.0 of 5 bubbles,Sep 2016 • Friends,Stretches of green right in the heart of the city,The Botanical gardens has a wide varitey of trees and plants and is located near Hitech city- Gachibowli area. The entire area is cool because of this park.
Hyderabad_Botanical_Gardens,pjanil1968,3.0 of 5 bubbles,Aug 2016 • Family,Good for a walk,Nothing much to see here. Good place  for morning and evening walk. You can park vehicles in the opposite ground. Very near to Kothaguda junction.  Not a well maintained garden
Hyderabad_Botanical_Gardens,TravellingMe1234,3.0 of 5 bubbles,Sep 2016 • Couples,place to walk and work out,"ITs really not a place to visit, but apt for morning walks/ workout/yoga sessions. Recent rains helped to regain some of lost greenery and you can spot peacock/ other birds."
Hyderabad_Botanical_Gardens,Ravindra V,4.0 of 5 bubbles,Sep 2016 • Couples,Good place for walking but  ..,This place is very good for morning walk as you get to walk in a natural garden away from city's pollution. However it's pleasant only in the morning. Problem with this garden is it is not well maintained. There is a tortoise shape building built for maintaining cactus plants but that building is a mere storage room now. Most of the plants do not have names written which is very much needed for plant lovers. You can see some peacocks and birds roaming around in the park. Parking facility is not bad. There is entry ticket of 15 INR and car parking charges are 20 INR.
Hyderabad_Botanical_Gardens,Swetha Nagarjun S,5.0 of 5 bubbles,Aug 2016 • Couples,An excellent place for walk,"We were surprised when we came here for a walk. I did not know that amid the concrete jungle lies a real jungle. A haven for nature lovers and joggers, this botanical gardens is an excellent place to breathe in fresh air, exercise, yoga and fun activities for early go getters. We could even spot a few peacocks and hear different animal sounds. There are many plant species which we have not even heard of and colorful flowers that attracts the eye. A good place for ladies to do jogging and yoga. Starts at morning around 5 am and entry fee is rs 10."
Hyderabad_Botanical_Gardens,Sravan Vadde,3.0 of 5 bubbles,Jun 2016 • Family,okay place,the place was good but not interesting enough to make you want to come back again. good place to spend a couple of hours.
Hyderabad_Botanical_Gardens,Sanjeev K,4.0 of 5 bubbles,May 2016 • Family,Nice place for a walk,I certainly like going to this one as it is fairly well maintained and the only big one in concrete IT area
Hyderabad_Botanical_Gardens,AshishBansal82,4.0 of 5 bubbles,Sep 2015 • Family,Nice place for outing with family,"Nice place for outing with family during mornings. If you like runs , jogs or want to see peacocks or birds etc visit this place"
Hyderabad_Botanical_Gardens,bkumar123,2.0 of 5 bubbles,May 2016 • Friends,Not so good to visit,"Have been to Botanical gardens many times, but these days the management of garden has become very very poor causing lot of inconvenience to the visitors. All the grass have become dry, water wont run from the outlets. The pond also has become dry and has lost its charm. Only you can find college going boys & girls sitting at the farthest points engrossed in chatting etc."
Hyderabad_Botanical_Gardens,AswinAnu,3.0 of 5 bubbles,Dec 2015 • Friends,Good place to relax,Very small and good place to relax for a long time. Not a much to see in this garden. But can spend a good time with family and friends.
Hyderabad_Botanical_Gardens,Michael Anbumani,5.0 of 5 bubbles,May 2016 • Couples,Nice to visit,"Beautiful gardens & a very nice place to visit. Serene & refreshing to be here, especially during the hot season. The greenary is well maintain & gives the visitors a great impression of how people take care of the nature of God."
Hyderabad_Botanical_Gardens,sathish8281,5.0 of 5 bubbles,May 2016 • Friends,Good one to visit again,Me and my friends going to these restaurant on the coaction of celebrating party.we order some of the varieties this restaurant.good taste is like homely made.we are decided to visit again
