Tourist Attraction,Name,Rating,Date and criteria,Title,Review
Secunderabad_Clock_Tower,Niroop P,5.0 of 5 bubbles,Dec 2015 • Friends,Gr8 ancient architecture ,"A firman issued by Nizam Sikandar Jah established the city of Secunderabad after his name in 1806. [2] To honour the progress achieved by the British officers stationed atSecunderabad Cantonment in Hyderabad , the erstwhile British government established 10 acres (4.0 ha) of land for this purpose in 1860.[3] A 120-ft high clock tower was constructed in a park of 2.5 acres (1.0 ha) in 1896. [1] The tower was inaugurated by Resident Sir Trevor John Chichele Plowden on 1 February 1897. The clock on the tower was donated by Dewan Bahadur Seth Lachmi Narayan Ramgopal, a businessman. [2]In 2003, the tower was placed on a demolition list drawn up by the Municipal Corporation of Hyderabad to accommodate the increasing traffic. A senior official at this civic agency of the Government of Andhra Pradesh said that they were trying their best not to demolish this structure. [4] In 2006, the park housing the tower was chosen for renovation by the same agency. Carried out at a cost of ₹ 10 million (US$150,000), the park's size was reduced to widen the roads. In addition, the tower was renovated, the park was landscaped with lawns and hedges, and a waterfall was installed. The renovation was completed in 2005, and the park was inaugurated by then Chief Minister of Andhra Pradesh Y. S. Rajasekhara Reddy in 2006. [1][5] A martyr's memorial was also established inside the park in memory of the first police firing in 1969 during a separateTelangana agitation .[6] Within a year after this, two of the tower's four clocks experienced technical problems and stopped working. [3]The tower was declared a heritage structure in the twin cities of Hyderabad - Secunderabad.[3] It was as a result of the efforts put by the civic agency at sites like this tower that the proposal to seek UNESCO Heritage status for Hyderabad was revived. [7]In 2006, the 200-year celebrations of the formation of Secunderabad were organised by the Government of Andhra Pradesh. The clock tower was chosen as the subject of the logo, which was designed by a local firm. [8] The outline of the Clock Tower was first conceived by the students of a city architectural college. [9] A short cinema film of 9 minutes, 30 seconds by director Mani Shankar was released as a part of this celebration. The film, which relates the history of the city, features the clock tower in it.[10]The park housing the tower also served as a venue for promoting various citizen-centric events such as a children's film festival, [11] awareness programs among others. [12]"
Secunderabad_Clock_Tower,SMahesh3670,3.0 of 5 bubbles,Nov 2015 • Family,A plain old clock tower that is iconic to Secunderabad,"Other than it being over 100 years old, the tower per se has limited architectural intricacies or designs. It was originally part of a large park - but the park is long gone and it is now a small trimmed park in the middle of a big traffic zone. The best way is view it to drive past it - very limited space to walk around, given the vehicular and pedestrian movement around the place"
Secunderabad_Clock_Tower,sudmaha,3.0 of 5 bubbles,Mar 2015 • Couples,Just a clock tower.,A simple tower at secunderabad. i am sure no tourist would go specially to watch this. have nothing special. crowdy area.
Secunderabad_Clock_Tower,SRINIWAAS S,4.0 of 5 bubbles,Dec 2014 • Family,Secunderabad Clock Tower is a logo,"Secunderabad Clock Tower selected as logo, Constructed in 1860. A 120-ft high clock tower was constructed in a park of 2.5 acres in 1896. The tower was inaugurated by Resident Sir Trevor John Chichele Plowden on 1 February 1897. The clock on the tower was donated by Dewan Bahadur Seth Lachmi Narayan Ramgopal, a businessman"
Secunderabad_Clock_Tower,Amazing_Neo,3.0 of 5 bubbles,Sep 2015 • Friends,Where the time stops you stop,This is a central secunderabad monument / attraction with the clock put on the tower. The place has been renovated to great extent. Its all clean and green inside and being used a lot for all sorts of meetings. Really happy with the maintenance in and around this place.
Secunderabad_Clock_Tower,AbhiSan,2.0 of 5 bubbles,Sep 2015 • Family,100 year old clock tower.,An 100 year old clock tower in the park. Rarely one visits this place as part of the tourist attraction. However if you are interested in history of the secunderabad city - can give it a view.
Secunderabad_Clock_Tower,Krishnan S,4.0 of 5 bubbles,Sep 2015 • Friends,Standing Clock since years...,British period Clock tower recently renovated and lighting done. Thanks to Telangana Govt. celebrations. standing taller than the years passed and stores more memories of various incidences. a silent witness of the past glory of City of Hyderabad. good to visit in the late evenings to see the lightings.From Paradise circle it is exactly 1.3 kms. just before Hyderabad Regional Passport Office and Eastern side of famous Kamat Restaurant.
Secunderabad_Clock_Tower,ksB486SD,4.0 of 5 bubbles,Nov 2014 • Friends,Well built tower,"well built....... Located approx. less than a km from Secunderabad Railway station, you may spot this iconic tower in the midst of traffic and crowd. There are four clocks and all give right time since it was constructed in 1897."
Secunderabad_Clock_Tower,Praveen K,4.0 of 5 bubbles,Feb 2015 • Family,Secunderabad Clock Tower,The Famous Clock Tower in Secunderabad is a landmark in itself. It is over a centery old Clock Tower in the CBD of Secunderabad. The Clock tower is on a traffic island. 
Secunderabad_Clock_Tower,bishwaksen,3.0 of 5 bubbles,Jul 2015 • Solo,Not much to see,"If you get out of platform 1 of Secunderabad rail station and walk keeping the Alpha Restaurant and passport office to your left, you will reach the Clock Tower roundabout. On one side will be the iconic Garden restaurant. The clock Tower stands in the middle of a decently maintained garden. However there are quite a few homeless guys and drug addicts who sleep there so beware before exploring on your own."
Secunderabad_Clock_Tower,Suraj P,4.0 of 5 bubbles,Aug 2014 • Family,Nice Structure,"It is in the heart of Secunderabad (Twin City of Telangana's Capital City Hyderabad). Beautiful structure, can be seen during your drive to Secunderabad."
