Tourist Attraction,Name,Rating,Date and criteria,Title,Review
Secunderabad_Clock_Tower,Krishna Sandeep Siram,5.0 of 5 bubbles,Apr 2019,Reflection of Hyderabad's Heritage,This tower is very Old and this is near to secunderabad Railway station and its its not a must visit place but we can look at it while passing through the way.Its beauty can be witnessed at Night.
Secunderabad_Clock_Tower,NIL_MODI,2.0 of 5 bubbles,Mar 2019,have a hlance if passing by,obviously this clock tower is in Secunderabad and near to railway station. historical structure. we had just a glance when we were passing by.
Secunderabad_Clock_Tower,Tarun,4.0 of 5 bubbles,Jan 2020 • Solo,Secunderabad Clock Tower,It is situated in Secunderabad and very near to Secunderabad Railway Station. It is in the heart of Secunderabad. As per data available online the construction of it has started in 1860. It is maintained by GHMC. You must glance it when you visit Secunderabad Railway Station.
Secunderabad_Clock_Tower,LostMySelfTraveling,5.0 of 5 bubbles,Dec 2019 • Solo,can't forget this clock tower,"Can't forget this place,as I was a regular visitor to this place when I was learning computers. It is close to Navketan complex.Its not a great monument but useful for many people in those days where very few people used to have mobile phones. Still remember getting down at the tower from a running bus."
Secunderabad_Clock_Tower,PAGADALA MANJU,5.0 of 5 bubbles,Jul 2019 • Solo,Clock tower,This tower is very old and beautiful attraction in the center of the city.It's in the the center of city by connecting for different places
Secunderabad_Clock_Tower,OMKAR PAGADALA,5.0 of 5 bubbles,Oct 2019 • Solo,Clock Tower,As it is named as clock tower because a big clock is placed in an big pillar. And it is located in the centre of the road.
Secunderabad_Clock_Tower,amitthecreator,5.0 of 5 bubbles,May 2019,Secunderabad Clock Tower,"This tower is on SD road, nearby railway station. Nothing much to do about this, as this is a pretty old one. Clock is, however, working. Nearby areas you can hang around for shopping.Visited February 2015."
Secunderabad_Clock_Tower,jainms,4.0 of 5 bubbles,Nov 2018,Good one,"It's in Secunderabad near paradise junction, Old monument and historical place to visit those who travel Hyderabad for visiting can include this as one of place. "
Secunderabad_Clock_Tower,BRKanth,4.0 of 5 bubbles,Jan 2019 • Friends,Old monument,"This is one of the oldest monument which I have been seeing since childhood. Anyone going towards secbad, could see this clock tower."
Secunderabad_Clock_Tower,SRIKAKOLAPU,4.0 of 5 bubbles,Dec 2018 • Friends,heritage place,This is build almost 2 centuries back and considered by UNO as cultural heritage site and good to see these heritage places
Secunderabad_Clock_Tower,Mukta2016,4.0 of 5 bubbles,Jan 2019 • Family,Nice Clock Tower,The Secunderabad Clock tower was built during the colonial times and is presently only a landmark here. We just passed by it when driving by and found it very aesthetic in appearance.
Secunderabad_Clock_Tower,TravellingReddy,4.0 of 5 bubbles,Feb 2019 • Family,A symbol of British Cantonment near Secunderabad junction,This is now a traffic island and can be easily missed. It carries significance of being made to signify the start of cantonment and is in mid of a well maintained park surrounded by trees. Probably can be seen while encircling it 
Secunderabad_Clock_Tower,idea614354,4.0 of 5 bubbles,Feb 2019 • Friends,clock tower,very old historical clock tower this is. constructd in secunderabad. long back of many years for public use.
Secunderabad_Clock_Tower,SURESH babu,5.0 of 5 bubbles,Feb 2019 • Friends,Good,We are very good and happy to see the clock tower in Hyderabad.one of my favorite place I could see again and again
Secunderabad_Clock_Tower,Daniel T,3.0 of 5 bubbles,Oct 2018 • Business,Just a landmark now,"Sec'bad clock tower is now well known as a landmark for directions  :) As we zoom past this place, one hardly notices the architecture design and its past importance. It just stands at the junction. Nothing much to see here, just a one-time visit that too driving around this place would do."
Secunderabad_Clock_Tower,Dilip kumar,4.0 of 5 bubbles,Aug 2018 • Friends,just visit,this place will be visited by everyone whoever goes to secunderabad.This place is located at the junction to paradise.
Secunderabad_Clock_Tower,deepa v,4.0 of 5 bubbles,Jul 2018 • Solo,Landmark,It's a landmark in Secunderabad. Visited or rather passed by it many many times.Near to the railway station.
Secunderabad_Clock_Tower,chandrasekhar g,4.0 of 5 bubbles,Jun 2018 • Family,Landmark at secunderabad,Very near to secunderabad station.Hospitals are available near to clock tower.RTC bus facility is also available.
Secunderabad_Clock_Tower,TravelingGypsy0508,4.0 of 5 bubbles,Jul 2018 • Family,Worth a visit if you are a photographer,Good place to visit once. This structure is of historical significance in Secunderabad. Mostly crowded. Take your camera along and click pictures of the tower and surrounding garden.
Secunderabad_Clock_Tower,Karthik Dasu,4.0 of 5 bubbles,May 2018 • Friends,Decent place,It is decent place to visit in the city of Hyderabad.The place is located very near to the railway station.
Secunderabad_Clock_Tower,Trending T,4.0 of 5 bubbles,May 2018 • Friends,Visited almost 500-600 times,This place will be visited by everyone and it is nearer to secunderabad. This place is visited by many people and will be crowded by many people everytime.
Secunderabad_Clock_Tower,Devaa,4.0 of 5 bubbles,May 2018 • Solo,A journey to colonial era!!!,You can never miss this structure in the heart of Secundrabad if you are travelling to and from the station. This beautiful tower is now surrounded by a garden and it would be something to admire more if you are travelling by Metro in a few months time.
Secunderabad_Clock_Tower,AnjanManda,3.0 of 5 bubbles,Apr 2018 • Friends,Not a must see,"It is a famous land mark of Secunderabad. It is one of the oldest clock tower inaugurated in the year 1897.Started in 10 acres of land ,the park size is reduced drastically due to road widening. A martyr memorial is  established in the park.It is just a drive around spot nothing much to see."
Secunderabad_Clock_Tower,jmodi1981,4.0 of 5 bubbles,Apr 2018 • Family,Good Tower,This is very good tower for old remembrance at the place. you can see the place once visiting the near by place. 
Secunderabad_Clock_Tower,P M,5.0 of 5 bubbles,Mar 2018 • Friends,Amazing clock,"Such an amazing tower clock I visited that with freinds actually that time we are passing from that place and we got stuck in traffic that time, everyone noticed that clock so seriously like we are looking back to back to that clock and what was the time, what was the time. We noticed that older time how that clock was  made and how much space that clock has covered bla bla..so it is one of the best thing in Secunderabad."
Secunderabad_Clock_Tower,Ravindra V,4.0 of 5 bubbles,Apr 2017 • Family,Oldest landmark,This is one of the oldest and historical landmark in the twin city of Secunderabad. The clock always shows correct time.
Secunderabad_Clock_Tower,Abhilash K,4.0 of 5 bubbles,Feb 2018 • Friends,Nice,It is very nice place and a large tower with the clock and other great monument with lot of seen and many things
Secunderabad_Clock_Tower,Anamika K,4.0 of 5 bubbles,Nov 2017 • Couples,A good historical building to visit,Clock tower is one of the important sightseeing place in Hyderabad. Good to see these place here because it has some attracting power so many people are visiting these place.
Secunderabad_Clock_Tower,shivamsmh,4.0 of 5 bubbles,Jan 2017 • Family,Great,Standing all alone to symbolize the futility of our life and remind that time goes on. This can be noticed easily and is a piece of architecture.
Secunderabad_Clock_Tower,Sam S,3.0 of 5 bubbles,Nov 2017 • Business,The Clock on a tower in Secunderabad!,"I have worked for Tulip Telecom Co. Ltd., at its branch office in Navketan Towers located opposite to the clock tower. It was a wonderful experience to peep out during the tea breaks. The road on the eastern side goes to Uppal whereas west houses the Yashoda Hospital. The parade grounds can be reached easily just by crossing the Sardar Patel road. The southern side of the road from the tower goes to the Secunderabad railway station. There are a couple of Churches nearby it built in the British-Nizam era. On the west side of the road, there is Kamat Hotel, Post Office crossing, petrol pumps, cloth shops. Nearby Chenoy trade centre, regimental bazaar route takes you to the famous biryani serving Paradise hotel, Sindhi hotel or take a left to go to the tank bund."
Secunderabad_Clock_Tower,hingarajiya s,5.0 of 5 bubbles,Jan 2017 • Business,A landmark is located around the circle,"The Secunderabad Clock Tower is located in a small garden located in a busy intersection. located just a kilometer away from secunderabad railway station, constructed by British Governor General, the clock still working."
Secunderabad_Clock_Tower,naiduks24,5.0 of 5 bubbles,Sep 2017 • Couples,Ideally located around the circle,"Located just a kilometer away from secunderabad railway station, constructed by erstwhile British Governor General, the clock still working, amazing, a memorable."
Secunderabad_Clock_Tower,chasteboy,3.0 of 5 bubbles,Nov 2017 • Solo,Faded Glory!!,This is a very famous monument which has been neglected for many years. It's one of the iconic symbols which needs to be restored and highlighted.
Secunderabad_Clock_Tower,Manish K,3.0 of 5 bubbles,Oct 2017 • Solo,"A landmark, but not well-maintained","The Secunderabad Clock Tower is located in a small garden located in a busy intersection. A landmark dating back to the British times, this is today surrounded by hawkers and is not in too good a condition. One can see it from a distance, but need not necessarily take out time to go to it."
Secunderabad_Clock_Tower,Siva G,5.0 of 5 bubbles,Jul 2017 • Friends,For movie,Nice and historic place located in secunderabad and fewmetres away from secunderabad railway station
Secunderabad_Clock_Tower,Arvind Kumar Yerram,4.0 of 5 bubbles,Sep 2017 • Friends,Losing its historical charm,"This is a historical structure constructed well before India got its independence. This place no longer needs seperate time as every visit of Secunderabad would be incomplete without this.  This is now left on the road with no attention being given to it or its importance.  Slum dwellers and rag pickers frequent this place in the evening and nights.I wonder if this is the same place which has left us with wonderful memories since my childhood.  Amidst the never stopping traffic, this historical monument is slowly losing its charm.  The park which used to surround it and the herbs and flowers are long gone."
Secunderabad_Clock_Tower,venkatakarthik,4.0 of 5 bubbles,Sep 2016,Initially i didn't know that this is a historic place,"i came across this on my way to Secunderabad railway station and initially, i thought it was just a clock tower and nothing more but later I learnt that this was a historic place not that old but is used as a landmark there.Nothing fancy here it is just a clock tower"
Secunderabad_Clock_Tower,Mohammed Sohail Ahmed,4.0 of 5 bubbles,Aug 2017 • Solo,Secunderabad's identity,It's been here for a long period and in same condition. Now the structure is in danger due to pollution as it's in the middle of heavy traffic road. 
Secunderabad_Clock_Tower,sandeep g,2.0 of 5 bubbles,Apr 2017 • Business,clock tower,"it more of a spot than a tourist spot , don't plan exclusive to visit only this place . just a historic place "
Secunderabad_Clock_Tower,Ravikanthvadamala,3.0 of 5 bubbles,Aug 2017,Old Structure,It is located near to Secundrabad Railway Station. We pass through this tower once in a month at least. There is a small part also attached to it.
Secunderabad_Clock_Tower,Jimmy B,4.0 of 5 bubbles,Sep 2016,Interesting for few minutes,"Near the lake and the buddha, accessible by cab only, the clock tower has a very good old style.It seems very well preserved but only acessible from outside where there is a small park.You will need 10minutes, not more."
Secunderabad_Clock_Tower,Aravind M,4.0 of 5 bubbles,Jun 2017 • Friends,The Landmark of Secunderabad,"Built and functional since the times of Nizams, this iconic tower, is at the heart of the city ""Secunderabad."". It's clock is well maintained and has never been out of sync. During special occasions like the state formation day, the lighting and other decorations that are done, make this tower even ore attractive."
Secunderabad_Clock_Tower,aviditor,4.0 of 5 bubbles,May 2017 • Friends,Icon of Secunderabad,"Great build by the Britishers. Icon of Secunderabad. No place for you to stand and admire, As it is fenced on all sides and the main road surrounds the Clock Tower, with lot of traffic all the time. "
Secunderabad_Clock_Tower,renu_73,3.0 of 5 bubbles,May 2017 • Family,A landmark of hyderabad/secunderabad,A monument and landmark very well known around Hyderabad/Secunderabad.Part of the old world charm in the city.
Secunderabad_Clock_Tower,zap r,3.0 of 5 bubbles,May 2017 • Family,Not a must visit site,"1.  This is one of the oldest clock towers of the city.2.  Right in the middle of the junction.3.  The clock hardly works, needs maintenance4.  Very bust street, crowded.5.  Go, only if you are around secunderabad area.6. Not a fun place, the government cldve done a great job with it, but unfortunatly its just left unnoticed."
Secunderabad_Clock_Tower,Rao1940497,4.0 of 5 bubbles,Jan 2017 • Friends,A land mark,"Though a land mark junction in Secunderabad city that is a gate way road to the railway station, it has nothing much to offer. "
Secunderabad_Clock_Tower,Surya Katakam,3.0 of 5 bubbles,Dec 2016 • Solo,Historical Centre,This is one of the circle near Secunderabad railway station. Nothing special but historical place and seems to be nice
Secunderabad_Clock_Tower,anithaaravamuthan,4.0 of 5 bubbles,Jan 2017 • Family,Historical place!!!,Its a ancient and historial place in Hyderabad. Its one of the sight seeing place in Hyderabad. Must visit in early Morning.
Secunderabad_Clock_Tower,Gugan_Ilango,4.0 of 5 bubbles,Jan 2017 • Business,Beautiful clock tower in centre of city,The Secunderabad clock tower is a beautiful clock tower located at the centre of the city. a must visit in early morning for HDR Photo 
Secunderabad_Clock_Tower,Veeresh k,3.0 of 5 bubbles,Jan 2017 • Solo,History resembles...,One of ancient sight seeing point in HYD . It's just side by the road.  Easily accessible by everyone. Good looking in festival duration..
Secunderabad_Clock_Tower,mainhole07,4.0 of 5 bubbles,May 2016 • Friends,Tower,Old and beautiful seems must visit point in HYD and i had good time with my business colleagues. You can not stop yourself to visit out there.
Secunderabad_Clock_Tower,Dinkar P,3.0 of 5 bubbles,Dec 2016 • Family,Ancient delight ,Nothing much to see just that it's a small clock towers surrounded by some green space to spend sometime.Clock has been there for many decades and is a unique ancient Arti fact which gives a look of olden times.
Secunderabad_Clock_Tower,santosh2ind,5.0 of 5 bubbles,Mar 2016 • Friends,Clock tower,This tower is very tall and big tower in secunderabad. this is very famous tower in twin cities. in this tower we have four colocks.
Secunderabad_Clock_Tower,kodasrivatsa,4.0 of 5 bubbles,Dec 2016 • Family,old building,it is an old building of the earst while british era. is a famous landmark now. however has list its charm recently due to metro construction closeby and poor maintenance
Secunderabad_Clock_Tower,Rajib Ghosh,1.0 of 5 bubbles,Nov 2016 • Family,"Move along, there is nothing to see","Located a little less than a kilometre away from the Secunderabad Railway Station, the Clock Tower is no more than a round-about on a busy junction. Though it is surrounded by a small park, the park fence is locked up and the park generally only has a few alcoholics who lie on it's grass in their drunken stupor. The clock itself stopped working a long time ago and even if they allowed visitors access to the top of the tower, there would be nothing spectacular to view as all the buildings in it's vicinity are taller than the tower."
Secunderabad_Clock_Tower,aldinanthonyambosta,3.0 of 5 bubbles,Oct 2016 • Couples,Needs regular maintenance,Tourists end up just showing you the location without explaining the history behind it. They just build up crap and tell tourists. This place needs regular maintenance.
Secunderabad_Clock_Tower,jaggu536,5.0 of 5 bubbles,Sep 2016 • Couples,one of atttactions,this is a very big tower near secundrabad railway station. this is the main circle where it is the point of attactions for secundrabad
Secunderabad_Clock_Tower,nagesh1955,4.0 of 5 bubbles,Aug 2016 • Friends,visit of clock tower,"We have to see this in the time of Bonalu or Bathukamma , as those are state festivals, govt will decorate this with very much"
Secunderabad_Clock_Tower,Vankam S,5.0 of 5 bubbles,Sep 2016 • Friends,Evergreen,This tower is very nice and most natural This is near secunderabad railwaystation and everybody seening firstlook on this tower.This old clock tower
Secunderabad_Clock_Tower,KalyanSamrajyam,3.0 of 5 bubbles,Sep 2016 • Solo,Famous Clock tower ,"Clock tower is very famous and oldest in twin cities, though every city or town in India having this type of tower, probably build during British rule. Else Nothing SPL. "
Secunderabad_Clock_Tower,Ravin K,3.0 of 5 bubbles,Oct 2016 • Family,Nothing special,this is a standard clock tower and nothing special about it. wont go there just to see it.. if am passing its nice to see
Secunderabad_Clock_Tower,V V S Ganesh N,4.0 of 5 bubbles,Apr 2016 • Solo,History Representative,Secunderabad Clock tower is a History Representative.centrally situated and easily accessible for one and all.but this place is not so unique.
Secunderabad_Clock_Tower,pasunuri k,4.0 of 5 bubbles,Sep 2016 • Family,oldest,Clock tower is very famous constructed a long back around in 1860 it is the heritages structure of twin cities
Secunderabad_Clock_Tower,Omer M,2.0 of 5 bubbles,Jul 2016 • Family,Nice place,"It's an average place nothing unique, very well known to locals. Can see it while passing to any destination in Secunderabad."
Secunderabad_Clock_Tower,tari1982,3.0 of 5 bubbles,Aug 2016 • Business,nothing great,"just a normal clock tower when you look at it, it looks good at night because of the lights. needs some renovation."
Secunderabad_Clock_Tower,Krupali J,5.0 of 5 bubbles,Mar 2016 • Family,Amazing tower,Its historical place situated in Secundrabad near to railway station. I visited this place with my family. It was really nice visit and i really enjoyed.
Secunderabad_Clock_Tower,Anurag V,4.0 of 5 bubbles,Aug 2015 • Family,Beautiful tower,The tower is well designed and is surrounded by greenery even though it is in the middle of road.The tower is nearby station.
Secunderabad_Clock_Tower,SRINIWAAS S,4.0 of 5 bubbles,Feb 2016 • Family,Situted near to Secunderabad Railway station,"It is in the middle of the city, Telangana. Constructed in 1 February 1897 with 120ft. Center of attraction in busy roads. This is at a very close distance to secundrabad railway station.  Clocktower is having watch on all four sides of the pllar and these watches are showing correct time."
Secunderabad_Clock_Tower,Javid C,5.0 of 5 bubbles,Feb 2016,amazing place to visit,sucendarabad clock tower is one more symbol of history  this is another place in my list must visit amazing
Secunderabad_Clock_Tower,sai teja,3.0 of 5 bubbles,Jul 2016 • Family,Oldest Tower,It was constructed during british period and we cannot define it as a tourist place. one can just  have a view to know about it
Secunderabad_Clock_Tower,ST_INDIA,4.0 of 5 bubbles,Aug 2015 • Friends,Beautiful and very well maintained,Its a quite Beautiful clock with nice architecture and is very well maintained. Though the place is bit crowdy still you can have a visit.
Secunderabad_Clock_Tower,ravirjy,5.0 of 5 bubbles,Jun 2016 • Family,Nice view,Its nice view to see the clock tower in the middle of the junction near to secunderabad railway station.
Secunderabad_Clock_Tower,mmaglasang,3.0 of 5 bubbles,Feb 2016,Iconic,"Looking up to this preserved history will take you back to time when this part of the state probably was the citi center. Still today the area is alive with so much people, restaurants, churches and many service centers which are easily accessible and within reach."
Secunderabad_Clock_Tower,Saiprasad_2804,3.0 of 5 bubbles,Feb 2016,Amazing craftsmanship,The secunderabad clock tower is a historical monument..we will love the craftsmanship and this is one of the busy junction.
Secunderabad_Clock_Tower,640sameerp,2.0 of 5 bubbles,Jun 2016 • Friends,Old clock within city ,Do not get confused between Secunderabad clock tower and Hyderabad clock tower. Its ancient click which can easily spotted.
Secunderabad_Clock_Tower,superb114,5.0 of 5 bubbles,May 2016,Icon,Very famous landmark of the city located in the middle as it populated and surrounded by the offices and hotels missing the attraction which was there before.
Secunderabad_Clock_Tower,Ontheferry,4.0 of 5 bubbles,Apr 2016 • Couples,Its a clock tower! (with a bit of history),"If it looks like the sort of clock tower you might find in the middle of an English country town, there's good reason ... built by British soldiers garrisoned at Secunderabad. Its interesting if you're a totally history buff, but if not I'm NOT sure it would be worth a separate trip, the gardens surrounding looked nice, but you couldn't get in, which was a shame."
Secunderabad_Clock_Tower,Usha65,4.0 of 5 bubbles,Nov 2015 • Family,Elegant and Historical structure,Those who travel to Secunderabad generally do not miss this attraction. It is in the middle of the city and an elegant structure. Located in the centre of a park and it is a traffic island now. It catches the eye and is a historic place. Also considered as icon of Secunderabad.
Secunderabad_Clock_Tower,Rodabeh,3.0 of 5 bubbles,Mar 2016 • Family,View if in Secunderabad,"This is generally missed as a tourist attraction since it is located in between the busy cross road. It is a landmark in itself for Secunderabad. Not many activities around this but if you are in the area, it is worth to drive around it."
Secunderabad_Clock_Tower,pavankumarraju,4.0 of 5 bubbles,Jan 2016 • Solo,Clock Tower,Clock Tower is one of the old landmark situated near to Secunderabad. It is inside a small park in 4 roads junction.
Secunderabad_Clock_Tower,Harshith358,4.0 of 5 bubbles,Mar 2016 • Solo,One of Most Popular Landmarks in the City,This is one of oldest monuments in the city. Its located very close to the Secunderabad Railway Station.
Secunderabad_Clock_Tower,TerryfromToledo,4.0 of 5 bubbles,Feb 2016 • Business,Interesting to Drive By,My business associates have an office in this area and I drive by when I visit them. Interesting to observe. Not sure I'd make a special trip.
Secunderabad_Clock_Tower,sureshmohan,4.0 of 5 bubbles,Feb 2016 • Family,Iconic place for Secunderabad,"Very Famous Land mark,well maintained,only watch need's some attention,Good for selfie snaps,ver near to pass port center"
Secunderabad_Clock_Tower,Gowthamcivilion,3.0 of 5 bubbles,Nov 2015 • Friends,time for everyone!,It is present in the junction of the roads. You have visit while going in car and by walk. Not much to see.
Secunderabad_Clock_Tower,facebook112,5.0 of 5 bubbles,Jun 2015 • Solo,great hyderabad,we can see it during visit of secunderabad museum it is agreat place to visit  wecan see histrical monument
Secunderabad_Clock_Tower,Lakshminath,3.0 of 5 bubbles,Jan 2016 • Friends,First of all. Change the photograph it does not belong to clock tower of Secunderabad. It is of Mojamjahi Market .,"Secunderabad clock tower is almost - century old  and within a km distance from Railway station which is more than 160 years . It is one of the most busy  round abous in the twin cities of Hyderabad and Secunderabad . Martyrs memorial for Telagana fighters is in the round about. Electricity bill payment office is situated  which is an obnoxious location for an office.  Shifting out is ideal, poor feeding is done by ISKON @Rs 5/- every lunch collected byGHMC ."
Secunderabad_Clock_Tower,NilabhTripathy,3.0 of 5 bubbles,Dec 2015 • Solo,Just an old tower on road,"its just an old tower on the road towards secunderabad station. not much attractive. you can just see it while driving,"
Secunderabad_Clock_Tower,Praveen K,5.0 of 5 bubbles,Nov 2015 • Solo,Century Old Clock Tower,A Century old Clock Tower stands tall in the Center of the park. The Tower is a landmark in Secunderabad.
Secunderabad_Clock_Tower,Rachna W,3.0 of 5 bubbles,Dec 2015 • Family,You have the wrong picture. I'm a local. ,"The picture shown as the Secunderabad clock tower is actually of the Moazzam Jahi Market. One doesn't have to put the clock tower in the ""Must see"" list. There are several other things to see and do in Hyderabad. "
