Tourist Attraction,Name,Rating,Date and criteria,Title,Review
Sri_Ramakrishna_Math,Venkatesh M,5.0 of 5 bubbles,May 2017 • Solo,Vivekananda Institute of Human Excellence (VIHE) Programme,"I have been atteneded classess like how to overcome fear of failure & Personality Development course, that programe is very nice and i can say that this kind of programes most useful for all kind of people,once you atteneded you will get to know the change before and after classes.awasome motivational speeches by many legends. Following are the programs offered by the institute: 01) Communication Skills02) The Art of Public Speaking (students and professionals)03) Mind Management Techniques04) Yogasanas05) Value Oriention Programme for Students06) Joy of Meditation  - Theory & Practice07) Personality Development Course08) Steps to Build Self Confidence09) How to Over Come Fear of Failure10) Leadership Qualities11) Tabla12) Stress Management13) Drawing & Painting14) Devotional Music - (Vocal) Carnatic15) Parents Motivation Course	16) Vivekananda Bala Vikas Programme- Summer Camp for Children17) Value Oriention Programme for Youth	18) Personality Development workshop for IX and X Class Students19) Special One-day Conventions For Professional Groups Like Doctors, Nurses, Engineers etc.	20) Value Orientation Programme for Teachers21) Value Orientation Programme for Government/ Corporate Employees	22) Special Orientation Programmes for Rural Groups23) Residential Youth Camp	24) Youth Convention for Boys and Girls"
Sri_Ramakrishna_Math,Sriram R,5.0 of 5 bubbles,Jan 2017 • Family,PEACEFUL & RIGHT DESTINY FOR EVERYONE,"The Math is for the people who are interested to have a peaceful space with calm, serenity, divinity. This is the place with more greenery which pumps quality oxygen levels to everyone. Good for Meditation, enhancing skills in different arenas for youth, good to learn yoga and more for spirituality. Located  centrally and has access for most. It is a place meant for all who maintains some good discipline. Must visit this place once in their lifetime."
Sri_Ramakrishna_Math,Sourav S,4.0 of 5 bubbles,Jul 2016 • Couples,Ramkrishna Math,"Its a ritual for us to visit the local ramkrishmna math, wherever we go. The serenity makes your day with the evening arti, is a must."
Sri_Ramakrishna_Math,Shubhalaxmi,5.0 of 5 bubbles,Apr 2017 • Couples,"A serene , enlightening experience.....","THis place is quite specious, lot of spiritual activities are undertaken here... It has huge library, book- shop and a community hall for lectures etc...Vivekananda institute for human excellence  is in the same vicinity and connected with the youth- especially down trodden youth- for their over all development. One can visit this place at aarati time - around 7 pm- the experience is great. The local people visit in great numbers during this period...The Mandir on 1st floor has Bhagvan Ramakrishna Deo  in black - quite unique sculpture than any other Ramakrishna Math Centre.....The cleanliness, the quiatitude is commendable  even though people come in great numbers...."
Sri_Ramakrishna_Math,sudha966,5.0 of 5 bubbles,Feb 2017 • Family,Sri Ramakrishna Math,"a very neat and well maintained place.  calm and silence every where.  many language classes are conducted here.   also many discourses, yoga classes are undertaken."
Sri_Ramakrishna_Math,anithaaravamuthan,4.0 of 5 bubbles,Jan 2017 • Family,Knowledgeable place!!!,Its a very knowledgeable and learning place for all ages. Spoken english class is very famous. Wonderful place.
Sri_Ramakrishna_Math,yojanaredd,4.0 of 5 bubbles,Oct 2016 • Family,A place of discipline,"You can learn lot of courses here like meditation, music and languages. Fees are low and affordable to every one."
Sri_Ramakrishna_Math,kiranfortravel,5.0 of 5 bubbles,May 2016 • Family,Truly mesmerizing and enlightening,We are lucky to stay close to such a wonderful place. It is a must for eeveryone to get enrolled and have a visit to this place at least once.
Sri_Ramakrishna_Math,TADAKAMADLA A,5.0 of 5 bubbles,Jan 2017 • Business,Knowledge learning place,RK Math is very famous place for learning good things. Spoken english classes is very famous and the books in the math are very useful for humans.
Sri_Ramakrishna_Math,KGSAnil,5.0 of 5 bubbles,Nov 2016 • Friends,Place of Knowledge,Hai this is located in Lower Tank Bund and opposite to Indira Park. Here we can find a big library and a hospital which provide free service and also many personality developments classes to students at a nominal prices. Also we can find a book stall where we can find many books of Swami Vivekananda and other mythology books at a very low price.
Sri_Ramakrishna_Math,Praveen H,5.0 of 5 bubbles,Aug 2016 • Family,Epitome of Peace,"Shri Ramakrishna Math is the best place for Peace Lovers. One gets to see the cultural Heritage of Hinduism and also the Nuances of Mahabharat carved on Walls, the best place to know about the Positive Vibes in Life, This will surely make your nerves relaxing.."
Sri_Ramakrishna_Math,lankavignesh,4.0 of 5 bubbles,Apr 2016 • Family,calm skills,it is a good place for skills and a lot to learn from this sri ramakrishna math and it is very calm atmosphere.
Sri_Ramakrishna_Math,santosh2ind,5.0 of 5 bubbles,Sep 2016 • Friends,Ramakrishna math,It was constructed by swami vivekanandha by the memorial of it's guru ramakrishna paramahamsa.it is famous for spirtuvalilty .
Sri_Ramakrishna_Math,shirishasantosh,5.0 of 5 bubbles,Feb 2016 • Family,Ramakrishna math,This is constructed bu vivekanadha for his guru ramakrishna paramahamsa.this is very good place is in hyd
Sri_Ramakrishna_Math,Gowthamcivilion,4.0 of 5 bubbles,Dec 2016 • Solo,For a calm Mind!,"This is place for doing Meditation. This place is well maintained. Place for Disciples of Sri ramakrishna.  They provide several development programs, guest lectures and other activities."
Sri_Ramakrishna_Math,challasundararao,4.0 of 5 bubbles,Apr 2016 • Family,Experience calmness amidst busy city,"A place to meditate, a place to relax, a place to equip knowledge and in a nutshell this place is all in one place. Several valuable activities for self development, guest lectures by renowned speakers are being organised on continuous basis. Equipped with all infrastructure facilities and are open to all. Opined as a must visit place.  "
Sri_Ramakrishna_Math,jaggu536,5.0 of 5 bubbles,Nov 2016 • Family,school of skills,here we can finds many coachings and its very affordable for poor students to get join into the courses. i suggest students to join and grap more skills
Sri_Ramakrishna_Math,jainneha,5.0 of 5 bubbles,Nov 2016 • Family,Ramakrishna math .,This is a very beautiful and peaceful place .original is in Kolkata.but here is it more clean and nice . 
Sri_Ramakrishna_Math,rabindra_mukherjee,4.0 of 5 bubbles,Dec 2015 • Family,Calm atmosphere,You will find that you are in Belurmath. Everything happens on time. They are very punctual on time. Many people visit this place everyday. There is a nice bengali canteen just outside the Math.
Sri_Ramakrishna_Math,Santosh K,4.0 of 5 bubbles,Jul 2016 • Family,Very Peaceful place in the midst of city,"A very calm and serene place with temple, library, book stall and an institute offering training in foreign languages."
Sri_Ramakrishna_Math,nagesh1955,5.0 of 5 bubbles,Aug 2016 • Friends,Visit of Nice place,It is very peace full place in Hyderabad. They will provide hospitality also at free of cost. The location is very good. The service also very nice. They will provide good atmosphere for peace of mind
Sri_Ramakrishna_Math,superb114,4.0 of 5 bubbles,Aug 2016 • Friends,Place for a peace of mind,The place for very peaceful and there are some any books available if your disturbed then be there you can have a peaceful mind.
Sri_Ramakrishna_Math,SuvodipMoitra,5.0 of 5 bubbles,Aug 2016 • Friends,Peaceful,"Its indeed a very peaceful place near tank bund. It houses a temple sort of atmosphere for worshipping Ramkrishna, Sarada Devi & Vivekananda. It has a big ground also. Found it very calm & quite. During evening aarti, its a must GO."
Sri_Ramakrishna_Math,Ravi K,5.0 of 5 bubbles,Sep 2015 • Family,Peace and spiritual place,Its a good and great place in Hyderabad for peace and spiritual. its a full of greenery place.  So many books available. spending time in prayer hall is very happy
Sri_Ramakrishna_Math,Shivalinga G,4.0 of 5 bubbles,Sep 2015 • Family,Hyderabad Spiritual society,"One of the Spiritual society of Hyderabad Here in air also you can Swamy Vivekananda wordsVery discipline staffFree medical checkups  in evening timeFree food every day lunch timeSpoken English @less cost but some selection criteria is there for thatSo many books available here in library Every time they are offering  seminars with inspired people Meditation classes offering every time If you go here you can cover many other places like indira park , Lumbini park , birlatemple ...Most preferable with children"
Sri_Ramakrishna_Math,Bhargav C,4.0 of 5 bubbles,Mar 2016 • Family,place of peace and tranquility,They organize various language class and also classes for development of children and youth. This place is bubbling with activity and I frequently visit the place. You can also buy books of religious importance and also...
