Tourist Attraction,Name,Rating,Date and criteria,Title,Review
Sudha_Cars_Museum,menonCGN,2.0 of 5 bubbles,Sep 2017 • Friends,A misnomer!,I went there expecting to see vintage cars and vehicles of historical significance; but what the 'museum' had was crudely built replicas and some vehicles like a 1950 model Fiat! It is not a museum at all. I felt it as just a junk yard. Hence the choice of title for this review. My advice to the enthusiasts of automobiles or vintage vehicles; please do not waste your time and money by visiting this place while you are in Hyderabad.
Sudha_Cars_Museum,Santanu D,5.0 of 5 bubbles,Sep 2017,Definitely Visit. Its Awesome :),"I planned to visit this place and thought that few vintage cars will be there, but what I see was great. There are a lot of cars in working condition of different shapes and sizes totally unexpected. We spent around 3 hr to see all cars . there are 3 big halls accommodating more than 300 cars. All are working and maintained well. The entry ticket is 50 and for camera another 50INR . So Its a must visit place. Thanks"
Sudha_Cars_Museum,avenkat2016,3.0 of 5 bubbles,Oct 2017 • Family,"lots of different shaped ""cars""",tourist spot. visit only if you have young kids who like cars. funny to see attenders trying to upsell and hawk dvds at this location. basically a museum made up of one mans hobby.
Sudha_Cars_Museum,Nikhil Vashisht,5.0 of 5 bubbles,Aug 2017 • Business,Wow is the word for Mr. Sudha-Car !,"Amazingly awesome place, with a loads of unique/crazy cars. The designs varies from Brinjal, Handbag, Sofa, Bed, Lipstick, Helmet, Cup-Saucer etc. All cars are drive-able and the best part is the huge car installed at the gate. Enjoyed it to the fullest"
Sudha_Cars_Museum,Thakkarmeister,4.0 of 5 bubbles,Aug 2017 • Family,Fun place for the kids,"Our 4 year old enjoyed a lot. Lots of cars which are supposedly in running condition and come in a variety of shapes and sizes. Think in terms of Coputer shaped car, tennis ballo shaped car, Cup and Saucer shaped car...etc. There are some huge car models at the entrance that the children can climb into and play and take pictures. There is a small canteen on site serving water, soft drinks and chips. Worth the Rs 50 entry. We enjoyed just looking at the excitement of our son. "
Sudha_Cars_Museum,sharmasanjeev2017,4.0 of 5 bubbles,Aug 2017 • Family,Good place for kids who love cars or automobiles,Really nice display of working models of all sorts of cars.. that one can imagine. our kid just loved it.We reached little late beyond 6 when they close but they were kind enough to accommodate for kid sake.
Sudha_Cars_Museum,Suresh B,3.0 of 5 bubbles,Aug 2017 • Family,Not too great,"It's a private collection of cars in different shapes and sizes such as cricket bat, burger etc. All the cars are working models but you cannot drive them of course. They are shown working in a car event which is conducted once in two years. Nothing much to see unless you are a car enthusiast but it is close to zoo hence both the visits can be clubbed. It will take you about 30-45 minutes to see the museum. It is open from 9.30 AM to 6.30 PM and the ticket is priced at Rs. 50 for everyone over 3 years. if you want to click pictures then that costs extra."
Sudha_Cars_Museum,Chandrasekar R,3.0 of 5 bubbles,Aug 2017,Skills of an Individual,"As a part of One-day city tour organized by Royal Travels, visited this Cars Museum. Car lovers may like this place very much but for others, it does not look very great! "
Sudha_Cars_Museum,Pramod N,4.0 of 5 bubbles,Feb 2017 • Family,Innovative Car Designs,It great for children to watch innovative car designs made of many things. and hats off to the makers as well. only they should reduce the fees.
Sudha_Cars_Museum,Jimmy B,5.0 of 5 bubbles,Oct 2016,"unexpected museum, worth a visit","In Hyderabad, tourists may feel there is not much to do,  and this museum doens't come first in the suggestions.It's a mistake because it is very interesting to see how genious is the owner to build such strange ""cars"".Suitable for children:"
Sudha_Cars_Museum,BhautikVVaidya,4.0 of 5 bubbles,Jun 2017 • Family,A very unique palace having beautiful art made with cars,"If you like automobiles you should see Sudha Cars Museum at Hyderabad. It has unique ways of exhibiting cars made in shapes of pencils, pens, erasers, cups and other funny objects and, believe it or not, they all work! They are shown working in a car event. But you cannot take pictures because taking cameras is charged extra (more than the ticket of a person), which is not worth. There is even the biggest tricycle in the world (noted in the Guinness book of world records). There is also a huge car that is over two stories tall! It only takes about one hour to complete."
Sudha_Cars_Museum,debashreen2018,4.0 of 5 bubbles,Jul 2017 • Family,Nice experience,"We went to Hyderabad for medical check up. Got one day free and so went for local sightseeing. Sudha cars muesum is a unique place. Never seen such kind of cars. Good place to roam around and click some pictures of unique car designs like shoe car ,cake car, pencil car and laddu car with Ganesha. "
Sudha_Cars_Museum,Jamila N,5.0 of 5 bubbles,Aug 2016 • Family,Super car museum,This is a must visit for kids and adults both. It comes on the way to the zoo. It has a collection of all different types of cars and that to in working condition.
Sudha_Cars_Museum,Martin Short,4.0 of 5 bubbles,Jul 2017,Good for car fans,"It seems most of the cars in this museum if you can call it that were made by the owner and not originals, but saying that was an enjoyable few minutes as it isnt a large place. Cant say it is a must place to go but okay."
Sudha_Cars_Museum,James K,5.0 of 5 bubbles,Jul 2017 • Friends,Excellent Attraction,Most enjoyable visit to Hyderabad's best Car Museum and saw some really beautiful old and vintage Cars.  We met the owner of this museum at an event and were glad to take him up on his recommendation to visit the facility.  We were welcomed with great Indian hospitality.  Thank you so much.
Sudha_Cars_Museum,Lalbahadur,4.0 of 5 bubbles,Jun 2017 • Friends,unique place,"One of its kind and unique. Lots of Modified cars and running condition vehicle of different shapes like pen, bat, cup, flower, bed, house, football, cricket ball, cake etc etc. There are many interesting cars to see which i didnt found anywhere. Nice collection. A must visit of hyderabad."
Sudha_Cars_Museum,BRKanth,4.0 of 5 bubbles,Oct 2016 • Business,Man made new Machine Mesuem,Best place to see some hand crafted Cars with in the city limits. Good to visit along with Kids as they love them. Most of the vehicles are working.
Sudha_Cars_Museum,Rahul B,5.0 of 5 bubbles,Jun 2017,amazing,the collection of cars were amazing. most of them also work. kids will love it . could not see the biggest car from inside as there was some repair work going on
Sudha_Cars_Museum,Hiral Amodia,4.0 of 5 bubbles,May 2017 • Family,This is one place that fascinated us the most among all the places that we visited at Hyderabad.,"Charminar, Golkonda, Hussain Sagar, Ramoji, Biryani, Haleem, Samosa, Irani Chaai, Osmania Biscits, Karachi Bakey, Shopping… Like any other traveler, these were on our list of activities to be done at Hyderabad. But we were so fortunate that a friend suggested us to visit Sudhar Cars Museum and we obeyed him.This is one place that fascinated us the most among all the places that we visited at Hyderabad.About:Sudha Cars Museum is the first and only handmade Wacky Car Museum in the World. It is the brainchild of Mr. K. Sudhakar, a Guinness World Record Holder for making the Largest Tricycle in theWorld. Sudha Cars Museum location is highly accessible and is located very near to The Char Minar. Majority of the people there know the location and Google Maps is also accurate with its location.Sudha Cars Museum is the first and only handmade Wacky Car Museum in the World. It is the brainchild of Mr. K. Sudhakar, a Guinness World Record Holder for making the Largest Tricycle in theWorld. Sudha Cars Museum location is highly accessible and is located very near to The Char Minar. Majority of the people there know the location and Google Maps is also accurate with its location.Said this, it is not just another Car Museum displaying cars of different types and makes or vintage and sports cars.Your imagination will blow out by knowing that this is a huge museum that contains vehicle attractions in below categories:a). Whacky Cars/Vehicles: Handmade vehicles in shape of Burger, Pencil, Computer, Double Bed, Cricket Bat, Lipstick, Sofa Set, Toilet Seat … and what not. Leave yourself astonished at the sight of these creations of Mr K. Sudhakar which he has made by himself in his workshop. And the best part is that all these cars are in working condition. b). Vintage & Restored Cars/Vehicles: You will be able to see some exciting Vintage and Restored cars like – Fiat, Rolls Royce, Hindustan Motors, Moris etc. This will give a glimpse into the interesting cars of the past. c). Bikes and Cycles:Mr K Sudhakar holds are Guiness Records for making the Largets Tricycle in the World. Here you will be able to see cycles and tricycles in different shapes. Also you will see some adrenaline pumping bike modifications.d). Other: You will also be able to see some exciting stuffs like – Double Decker bus, toy train and toy cars, Modified electric cars, Bike-Cars and much more.All this exciting fun is at a humble 50 Rs entree fees for adults.I am intentionally keeping a small write-up for this post, as the pics will do a better justice.More about Sudha Cars Museum images & on their website."
Sudha_Cars_Museum,Arushi K,3.0 of 5 bubbles,Jun 2017 • Couples,"One time watch, nothing much",There is various design of car but it does not seems that interesting. Kids might find it little interesting but not for adult. Waste of money.
Sudha_Cars_Museum,Ambati K,4.0 of 5 bubbles,May 2017 • Family,Super,"In this musem we can see a lot a cars from first cars there are a huge cars like vintage,benz......etc"
Sudha_Cars_Museum,Rajesh358,3.0 of 5 bubbles,May 2017 • Family,It is worthless to visit as cars are too much far and no space to take pic.,"Price is high compare to other museum. All executives are unprofessional.You can't even touch the car and you can watch far from 10 feet ,even don't have much space to take good photographs. dust is all around and no proper cooling and space.  Even you can see in better way on internet pic. I will say that is full of wastage of time and money and effort. You will came to know ,after watching it personally."
Sudha_Cars_Museum,Sudha G,5.0 of 5 bubbles,Apr 2017 • Friends,Best for Kinds,"There are almost every model of vehicles viz vintage cars, every type of vehicles in the miniature of fruits, vegetables etc.  They are providing CD and books for the visitors @Rs.100 & 150 each."
Sudha_Cars_Museum,PrabalDas,4.0 of 5 bubbles,Apr 2017 • Family,Sooooo Many Cars.....,"A must see for the tourists especially children. There are lots of cars in different shapes & sizes like, cricket bat, tea cup, bed, pen and many more. Don't miss it."
Sudha_Cars_Museum,Bhrt,5.0 of 5 bubbles,Mar 2017 • Family,Amazing Place!,"An amazing display of the master creation of the world record holders master creation in the making of any i mean any kind of vehicle. He has made vehicle in the shape of ball,bat, condom,house etc..,. He has also made a three floor high tricycle and also there is this funky sitting bench made up of shock absorbers in this museum for public seating. A must visit if your visiting hyderabad on a tour."
Sudha_Cars_Museum,VipinSaini,5.0 of 5 bubbles,Jul 2016 • Business,Very Unique and Amazing Place to Visit if You Love Cars,Sudha Cars Museum is Nice Place to visit and Know the Creativity Level with The cars. Very Unique Concept. Amazing. Must Visit Once.
Sudha_Cars_Museum,san_vai,4.0 of 5 bubbles,Dec 2016 • Friends,passion rulled here,"good inspiration for someone who wants to do something different, how passion can mould  your life. worth giving some time. mostly Automotive modification. "
Sudha_Cars_Museum,Ashish Sabnis,5.0 of 5 bubbles,Mar 2017 • Family,One of its kind,"Sudha cars museum is totally unique. I haven't heard of such a museum at least in India. U can feel the passion of Mr.Sudhakar as you go around in the museum. Leisure viewing will take an hour. It's very close to the zoo and approx 2km from Chowmahalla palace. Kids, adults all will enjoy this museum visit."
Sudha_Cars_Museum,PK Das,4.0 of 5 bubbles,Jan 2017 • Family,Unique Museum,Innovation is the word comes in mind after visiting this place. The innovator of this museum has turned everything he likes into a car that too tested & certified. Thats why imagination & Innovation has no limit if have that guts too do it.Great place to visit without fail.
Sudha_Cars_Museum,jessicas1301,4.0 of 5 bubbles,Jan 2017,Hidden jem of Hyderabad!,"This place is certainly a hidden jem of Hyderabad! The customized cars are beautiful! Each is unique and well crafted. They are real cars, working condition, made in several shapes and sizes - cricket bat, ball, computer, sandal, lipstick, purse, etc. A place not to miss, especially if you have children and teens."
