Tourist Attraction,Name,Rating,Date and criteria,Title,Review
The_Forum_Sujana_Mall,Krishna,1.0 of 5 bubbles,Nov 2022 • Friends,Parking Chaos -Avoid Nexus Forum,Can anyone give mall parking to second car sales? Mall Management given to spinny complete 3 floors that from ground to 3 floors .how foolish ???? Keeping customer facility at bay..Already Mall lost its glory post covid .. though renovated..not par with other malls in the city and now this parking chaos....if you wanna hang out ... avoid Forum or Nexus now.
The_Forum_Sujana_Mall,PKB,5.0 of 5 bubbles,Jan 2022 • Friends,Overall Good,"It was good mall,no dowt. So many international brands Shop. Good movie theatre, fast food corner but only things need to improve is housekeeping cleaning"
The_Forum_Sujana_Mall,sk a,1.0 of 5 bubbles,Jan 2022 • Friends,Bad experience,The environment here is not friendly. I was sitting at a place hanging with my friends and doing my office work in my laptop. Someone from the staff came and put a card on the table without even a word and left.The card is mentioning not to work here which is disgusting .
The_Forum_Sujana_Mall,Loukya Gummadi,1.0 of 5 bubbles,Aug 2021,Central Store,"Forum Sujana mall is a really good place to visit with family or friends. But recently when I went to Central store, Sujana mall for shopping with my family, I had to wait for a really long time for the billing. At last I had to leave behind a pair of clothes as the casher said it would take them a lot of time to resolve the problem. The cost on the tags and the computer were also different (computer showing less cost then the tags). The casher claimed that the computer was not showing the MRP. I couldn't buy the shirt I really liked as they were unable to resolve the problem within time. I was late for my next tasks because of this. Altogether I didn't have a good experience in this shop at all. Hope you can resolve problems like this."
The_Forum_Sujana_Mall,Archana,5.0 of 5 bubbles,Jan 2021 • Family,2times,"hyderabadForum is quite complete, PVR multi screen, a games arcade, food-court, starbucks, TGIF, and all the retailers you would like to shop at. The mall has ample parking and the best is multilevel parking that gives you direct"
The_Forum_Sujana_Mall,vamsikrishna,5.0 of 5 bubbles,Jan 2020 • Business,Shopping cum movies cum eateries,"The Forum Sujana Mall Kukatpally Hyderabad which has become the epicentre of entertainment is located at K P H B Phase 9, Kukatpally, Hyderabad, Telangana and remains open between 10:30AM–11PM. It is 820,000 square feet totally and was established in the year 2014. It has stores inside of the mall with different kinds of food outlets likeDil Punjabi, CocaCola, cream store, Keventers, Kailash Parbat, sizzling joe, Tibb’s Frankie etc. The mall also helps in conducting live events for Forum Purple Run, Summer Mania, Meet & Greet Chhota Bheem, Forum Rock on, Christmas Carnival etc are some of the events. Some of its amenities include Restrooms, Prayer room, Wi Fi, ATM, Lost and Found, first aid room to name a few. Some of the shopping brands include Bata, Haans, Maarket 99, Accessorize, Forever 21, adidas, Sephora, Smaaash, All, Solly, AND, Arrow, arches, American Tourishter, Clarks to name a few.I recommend it.."
The_Forum_Sujana_Mall,Lucky143,5.0 of 5 bubbles,Feb 2020 • Friends,"Shopping malls, food stalls and movies mania","I love forum sujana pvr mall,I had a lot of memories in this place with my friends and family members,This mall had a lot of shopping experience with huge discounts ,And also food stalls like BURGER KING, KFC,PIZZA HUT ,DOMINOS,etcAnd i love burger king..When iam boring my first preference is forum pvr sujana mall for best movie experience..My best suggestion go and experience this mall.."
The_Forum_Sujana_Mall,Akillchowdary,5.0 of 5 bubbles,Feb 2020 • Friends,Shopping malls and PVR cinemas,"Lot of shopping malls with great offers and also great cinema experience with pvr cinemas,and also budget shopping cloth experience,Lot food stalls like burger king,pizza hut, subway,etc..are had..great time spending...."
The_Forum_Sujana_Mall,ellesse1952,5.0 of 5 bubbles,Feb 2020,"Neat and Clean Shopping Mall, with Universal Appeal","It is a fairly big shopping Mall, with a wide range of retail outlets, food court, stand-alone restaurants, a multiplex, hypermarket and entertainment options. It also has really spacious parking facilities, both for two and four wheelers. The Mall is quite neat and clean and has something to offer for all ages and tastes. It is very well located, amidst residential localities and in close proximity to the IT hub of Hyderabad. The Starbucks outlet offers a good opportunity to rest a while and enjoy a well deserved cup of coffee."
The_Forum_Sujana_Mall,sunil,5.0 of 5 bubbles,Jan 2020 • Friends,One place for all your needs,A very good mall with good options for food and beverages.We can go on shopping spree in this place .The only disappointing thing is the seats in pvr wch are very close without proper gapping between the rows.
The_Forum_Sujana_Mall,Supraja,5.0 of 5 bubbles,Jan 2020 • Friends,Good place for refreshment,I have been to sujana mall with my friends it was a very hectic day for us . But as we visited mall we felt refreshment
The_Forum_Sujana_Mall,Prudhvi,4.0 of 5 bubbles,Dec 2019 • Friends,Nice place to shop and have fun,It is located near to hitech city. It has several famous brand stores to shop. There is a food court to relax and have food. There is kid zone for kids to play and box office to watch cinemas
The_Forum_Sujana_Mall,Praveen,5.0 of 5 bubbles,Dec 2019 • Friends,Superb....,I visited every week in this mall. I will spend all day and enjoyed in the mall. Simply very good place for visiting.
The_Forum_Sujana_Mall,Karthik K,5.0 of 5 bubbles,Apr 2019,Good Collection of stores.,Has good connectivity for prime locations and has good range of stores. easily accessible through cheap modes of transportation.
The_Forum_Sujana_Mall,imprash_p,4.0 of 5 bubbles,Nov 2019 • Couples,Decent mall,"Its a decent mall located in kukatpally area, it has most of the national as well as International brands for apparels, food, toys, electronics and much more. There is a food court with good options, kid's zone and a citibank Atm also.This mall has a multiplex theatre also. If u are just looking for a cafe, Coffee Day and Star Bucks both are present. Overall a nice place for shopping and entertainment."
The_Forum_Sujana_Mall,Shastry,4.0 of 5 bubbles,Nov 2019 • Family,Loved it,Ample parking area is available which is good for easy exit and entry. This mall has all international popular brands mostly for women. Amenities are good.
The_Forum_Sujana_Mall,Sunil,4.0 of 5 bubbles,Dec 2018 • Friends,Decent mall,The mall is quite good and it’s located in famous area Banjara Hills where not Telugu celebrity stays. The mall is quite decent and it’s Looks really good and happening place in weekend 
The_Forum_Sujana_Mall,rihab k,4.0 of 5 bubbles,Oct 2019 • Couples,Banjara hills ,"It has good quality things of international Mark's and the price is reasonable. But the food restaurants with card bank just , not available by cash."
The_Forum_Sujana_Mall,Andukuri srinath,5.0 of 5 bubbles,Oct 2019 • Friends,Day full of entertainment,Good for spending full day. You can shop everything from clothes to electronics and movie to live events
The_Forum_Sujana_Mall,kaliprasadm2016,4.0 of 5 bubbles,Oct 2019,leisurely place,it is a good place to hang out. nice food court on the top floorMultiple screens.for watching movies. Shops are not crowded.
The_Forum_Sujana_Mall,dsingla2015,4.0 of 5 bubbles,Jul 2019 • Family,All under one roof,Nice place to hand out and shop about right from low end to high end designer stuff. Good eateries and fun place for kids too...
The_Forum_Sujana_Mall,annejang,4.0 of 5 bubbles,Mar 2019 • Family,Good Mall for Family Outing!,The food court is really good with lots of options. There is a zone for kids to play and my niece had a good time. Lots of ethnic wear shops as well as  a supermarket for household necessities. There are a many restaurants and trendy shops too .  This mall has everything for everyone.
The_Forum_Sujana_Mall,Arunkumar,5.0 of 5 bubbles,Sep 2019 • Friends,Nice place to hangout in weekends,"A place where entertainment, food ,games,shoping meet up. Can spend a great day for foodies ,movie lovers and shoppers .. "
The_Forum_Sujana_Mall,Anita Pradhan,5.0 of 5 bubbles,Feb 2019 • Solo,Nice Shopping Mall,"The only place to have a ZARA showroom in Hyderabad. The mall is quite big with lots of brand outlets and eateries. The card system for food court seems bit complicated and time consuming.  The parking facilities are good. Overall it has a variety of outlets and eateries and is a good place to shop, dine and enjoy with friends & family."
The_Forum_Sujana_Mall,Vishnu Teja,5.0 of 5 bubbles,Aug 2019 • Family,Family time,"Very good place to hang on with family. Nice to have shopping, watching movies, a good place in Hyderabad for recreation."
The_Forum_Sujana_Mall,Ratna Kamalakar V,3.0 of 5 bubbles,Aug 2019 • Family,Nothing great about it ,Parking is pathetic. Otherwise it is just like any other mall. Nothing bad or nothing great. Games zone is kinda okay. Food options are fair. Overall a decent place. 
The_Forum_Sujana_Mall,Mohankrishna Eluri,5.0 of 5 bubbles,Aug 2019 • Friends,Pvr is good,More chances of getting tickets because of more  Audi's and Food Court is good. Parking charges are more if didn't purchase anything and u spent more than 3 hours if u book a movie .
The_Forum_Sujana_Mall,Srisadhana,4.0 of 5 bubbles,Jul 2019 • Family,Excellent place,The entrance will speak a lot. It’s been great fun. Forum has lot of stores from worlds best selling brands. A whole day will be enough to spend.
The_Forum_Sujana_Mall,TabrezN,4.0 of 5 bubbles,Jul 2019,Spacious and friendly mall with good gentry,Easy drive to the place. Has excellent ambiance and is quite spacious and well organized. The choice of food is also great.
The_Forum_Sujana_Mall,jainms,5.0 of 5 bubbles,Mar 2019 • Couples,Sujana Mall,"One of the must visit mall in Hyderabad, very large and have several stores with several options. Cafeteria / food court is not that much good."
The_Forum_Sujana_Mall,Kuenzy,4.0 of 5 bubbles,May 2019 • Business,One-stop-shop,"This mall offers a wide range of options (shopping, grocery, food) at affordable prices. It's very accessible and is located at the heart of the city. It's so convenient to shop because it's only five minutes away from my hotel-Trident. I was surprised that one salesperson even remembered me the next day I went to the grocery to get more spices and chocolates. 😊 Kudos to the team."
The_Forum_Sujana_Mall,Dilip kumar,4.0 of 5 bubbles,Mar 2019 • Friends,One of the Biggest mall,This place has got variety of clothing showrooms and it has got good ambiance and you can spend a lot of time and have fun with your friends .
The_Forum_Sujana_Mall,Sujana,5.0 of 5 bubbles,Feb 2019 • Friends,Forum mall review,"Hi Mr. Dilip.

Thank you for your kind words. We hope to keep entertaining you and your friends and family, whenever you visit Forum Sujana. Hope you have a great time again on your next visit."
The_Forum_Sujana_Mall,Sakaray S,5.0 of 5 bubbles,Feb 2019 • Friends,The fashion city,"Hi Mr. Dilip.

Thank you for your kind words. We hope to keep entertaining you and your friends and family, whenever you visit Forum Sujana. Hope you have a great time again on your next visit."
The_Forum_Sujana_Mall,ramakrishnabanoth3,5.0 of 5 bubbles,Mar 2018 • Solo,One of the biggest malls in Hyd,"Visited krishna pearls and Jewellers in forum sujana mall ,Hyderabad  recently .. They have great collections and excellent customer service by Mr. Majumdar ."
The_Forum_Sujana_Mall,Daniel T,4.0 of 5 bubbles,Dec 2018 • Family,One of the big malls in Hyderabad,A tremendous place for shopping and also for having food feast.Can enjoy watching movies along with all the stuff above.Good place to have fun.
The_Forum_Sujana_Mall,Usha65,5.0 of 5 bubbles,Jan 2019,Nice mall with good collection of stores!!,"When it was first opened up for public, the shear size of this mall was too much to comprehend. One of the biggest malls in the city, its very organized and easy to navigate within. Each floor has separate escalators to go up or down. Many international brands have their stores here. Worth coming here for some upscale brand shopping."
The_Forum_Sujana_Mall,BhumiSanJose_CA,5.0 of 5 bubbles,Jan 2019 • Friends,Forum sujana,"Among the existing malls in Hyderabad, this one is a huge mall with almost all major branded shops, well maintained, neat and most of the time very clean. Food court is a good attraction in this mall. Great place for shopping and relaxed moments."
The_Forum_Sujana_Mall,Padma,3.0 of 5 bubbles,Jan 2019 • Friends,Good Mall,"Good experience and very clean, nice food court with all types of food options. Both indian stores and international stores."
The_Forum_Sujana_Mall,PariveshD,4.0 of 5 bubbles,Oct 2018 • Friends,Good One!,"Visited this place many times. Mostly on all weekends events will held here. As usual good shopping and food court is available. Of course forum is Hyderabads biggest mall as of and good number of movie screens also available.It would be better if any entertainment is provided for adults 😉 to like scary house , etc..,"
The_Forum_Sujana_Mall,Dinesh_cbe,,,,"All major brands are available at this mall. The food court is congested and does have a variety of food. If bored, good place to relax and rewind."
,,,,,"Good international and Indian brand stores here to shop apparels & accessories, food court with major chain of restaurants and movie screens also a part of this mall. Overall structure & lightings is pretty impressive."
The_Forum_Sujana_Mall,fozjon,4.0 of 5 bubbles,Nov 2018 • Couples,a pretty good mall,this is a big enough pretty good mall. They say that it is the best in Hyderabad. There were good food selections...they had what we wanted...and plenty of shops to visit.
The_Forum_Sujana_Mall,Flyer45102569272,5.0 of 5 bubbles,Nov 2018 • Friends,Best place for shopping and entertainment,"In these days malls have been talk of the town in every city, and it is the best place for shopping and screens are too good for watching movies..loved it!"
The_Forum_Sujana_Mall,Nilesh P,4.0 of 5 bubbles,Oct 2018 • Solo,Change of scene,"Having spent far too many days in my hotel I just needed a change of scene and decided to visit this mall.It was pleased to see a Starbucks at the entrance, just what I needed to help unwind before I explored the mall.I was quite pleased with the the mall overall.  A good selection of shops over three floors and a movie theatre on the top. I felt that some of the branded shops were then duplicated as concessions within larger shops but,  I could over look that.  The place was clean and tidy and that would just fine for now.I was impressed at the size of the food hall, didn’t eat anything but it was sizable."
The_Forum_Sujana_Mall,Adnan_Chowdhury67,4.0 of 5 bubbles,Oct 2018 • Friends,"Good mall, not as big as I envisioned ","As a visitor from Bangladesh, my son, his school friend and I got the chance to visit Forum mall.Its spacious, well represented with good outlets and well lighted.The food court is on the third floor. You have to buy coupons and use that to buy food. Any balance left can be converted back into cash. A good place to beat a few hours."
The_Forum_Sujana_Mall,anu reddy,4.0 of 5 bubbles,Dec 2017 • Family,Nice mall,Nice mall in kukatpally for movies food and fun.Kids have multiple games to play in the game zoneNice getaway during weekends
The_Forum_Sujana_Mall,beyondtravel,4.0 of 5 bubbles,Oct 2018 • Couples,Big mall and great ambience,"One of the biggest malls in city, centrally located with good shopping options, big food court, pvr and ample parking, definitely a mall to go"
The_Forum_Sujana_Mall,parusharouthud,4.0 of 5 bubbles,Aug 2018 • Family,Good location to get all fashion dresses at reasonable cost.,One of the good location to get many varieties of branded clothes and all fashion materials to suite to the up coming generations including many malls and theatres. The problem is congested car parking.
The_Forum_Sujana_Mall,Chetu1087,4.0 of 5 bubbles,Jun 2018 • Friends,Good mall experience,"I visited this place for shopping and for dinner. Most of the shops are available to fulfil your demands like Spar, Central and nice food court. Good place to hangout for some time."
The_Forum_Sujana_Mall,nama harish,5.0 of 5 bubbles,Jul 2018 • Friends,Shopping,I went this mall for every month good experience and fun here shopping games movies fun activities are available
The_Forum_Sujana_Mall,gauravdadhich,5.0 of 5 bubbles,May 2018,Best mall in Hyd,Mall is located in Kukatpally. Every brand is available. My favorite Indian restaurant (Rajdhani) is available here.
The_Forum_Sujana_Mall,Narasimha A,5.0 of 5 bubbles,Jul 2018 • Friends,One place with combo of many shopping and Entertainment options,Very lovable place .  so many clothes brands and food courts are available . there is nice parking available. Here PVR movie screens also available . so please visit once in hyd .
The_Forum_Sujana_Mall,Anshul G,4.0 of 5 bubbles,Jul 2018 • Family,"Nice mall with full of shopping,games & entertainment","I visited many times in the mall and feeling good because of nice ambience, good shops for all, game zone for kids, movie theater , food court. Only bad thing I experienced here smelly sizzlers food which should not be in the open space."
The_Forum_Sujana_Mall,Amir Sayeed,4.0 of 5 bubbles,Jun 2018 • Family,Spacious mall in Hyderabad,"At last, I found a nice mall in Hyderabad. It has good parking space. It is good for family and shopping. Stores have good collections of material. It has also got nice gaming zone for kids."
The_Forum_Sujana_Mall,Karthik Dasu,5.0 of 5 bubbles,Sep 2017 • Friends,best mall in Hyderabad,It is one of the best malls in Hyderabad. It is quite spacious and lot of options for shopping and food.
The_Forum_Sujana_Mall,deepa v,4.0 of 5 bubbles,May 2018 • Friends,Nice place to hang out,"Good place for shopping ..Many brands are available for clothing.good food outlets.There is a food court,children play area,movie theatre."
The_Forum_Sujana_Mall,prabavathi,5.0 of 5 bubbles,Apr 2018 • Family,Forum Sujana: Friendly Environment,Me and brother went to purchase. We are statisfied to purchase all kind of products. It is also good place to spend quality time with family and friends.
The_Forum_Sujana_Mall,drprapa,4.0 of 5 bubbles,Mar 2018 • Family,Great combo of different shops,"Lovely atmosphere with food out joints. Array of different brands . The best is Smaaash, spar.The coming project will make Hyderabad shake is IKEA. Good for children."
The_Forum_Sujana_Mall,Sujana,4.0 of 5 bubbles,Jan 2018 • Family,Nice shopping and leisure activity destination ,"Dear Guest, Thank you for taking out time to review us. We are glad that you like our mall. Continue visiting us with your friends & family!
"
The_Forum_Sujana_Mall,Ashok M,4.0 of 5 bubbles,Jan 2018 • Friends,Decent mall,"Dear Guest, Thank you for taking out time to review us. We are glad that you like our mall. Continue visiting us with your friends & family!
"
The_Forum_Sujana_Mall,Sujana,5.0 of 5 bubbles,Jan 2018 • Family,Best mall in Hyd,The forum sujana mall is a very nice shopping as well as leisure activity destination. It has all the top shopping brands. Food court is also good. Just felt that parking facility is not upto the mark. Otherwise a nice place to hangout. 
The_Forum_Sujana_Mall,Mohan Karthik,,,,"Dear Guest, Thank you for taking out time to review us. We are glad that you like our mall. Continue visiting us with your friends & family!"
The_Forum_Sujana_Mall,Sujana,,,,"Dear Guest, Thank you for taking out time to review us. We are glad that you like our mall. Continue visiting us with your friends & family!"
The_Forum_Sujana_Mall,370tibu,,,,"Has most of the major brands. The food court is nice, but they require you to buy a seperate card. Good place to shop.They are also running a vintage car show in the ground floor which was very interesting. "
The_Forum_Sujana_Mall,Sujana,,,,"Dear Guest, Thank you for taking out time to review us. We are glad that you like our mall and the Vintage Car Show, that took place at the mall. Continue visiting us with your friends & family! "
,,,,,"Dear Guest, Thank you for taking out time to review us. We are glad that you like our mall and the Vintage Car Show, that took place at the mall. Continue visiting us with your friends & family! "
,,,,,"Even according to European standards, this is a nice shopping centre. It has many stores and is nice and clean. The food court is however always overcrowded(too little room) and the system with loading the card is so stupid. Should have an opportunity to just buy from where you want to take food. Also Food court and the other restaurants could be a bit cleaner overall."
,,,,,"Dear Guest,

Thank you for taking out time to review us. We are glad that you like our mall. Continue visiting us.

We regret the inconvenience caused to you. The card system is there to ease the waiting time at the Food Counter & to make the billing more quicker. However, we do take your inputs and shall review the same."
,,,,,"Dear Guest,

Thank you for taking out time to review us. We are glad that you like our mall. Continue visiting us.

We regret the inconvenience caused to you. The card system is there to ease the waiting time at the Food Counter & to make the billing more quicker. However, we do take your inputs and shall review the same."
The_Forum_Sujana_Mall,pritam,5.0 of 5 bubbles,Jan 2018,Great Mall,This is a great mall. good collection of brands. Good location. Great food court and play zone for kids.
The_Forum_Sujana_Mall,Sujana,4.0 of 5 bubbles,Jan 2018 • Solo,"First Mall in India to have an ""IKEA"" store","Dear Guest, Thank you for taking out time to review us. We are glad that you like our mall. Continue visiting us with your friends & family! "
The_Forum_Sujana_Mall,Georgio Valentino Rayala,4.0 of 5 bubbles,Jan 2018 • Family,Evening with family and friends,"Dear Guest, Thank you for taking out time to review us. We are glad that you like our mall. Continue visiting us with your friends & family! "
The_Forum_Sujana_Mall,Sujana,4.0 of 5 bubbles,Dec 2017 • Solo,Big mall near Hitec city,"I am going back to this mall after two years and the best thing is the ""IKEA"" store has finally opened their doors for visitors here. I went inside the store and explored their furniture and it looks promising. Next I visited the ""Tang"" chinese restaurant on the fourth floor to have Lunch which had a great decor and I also enjoyed it's food. After that I visited the gaming area on the third floor of whose name I think is changed from ""SVM"" fun central to ""Smaaash"".Finally I visited the ""Spar"" hypermarket on the ground floor for grocery shopping and prior to that I went to my favorite place ""Cookie Man"" on first floor to eat Cookies and they were delicious."
The_Forum_Sujana_Mall,rads345,3.0 of 5 bubbles,Dec 2017 • Friends,average ,"Dear Guest, Thank you for your kind words of appreciation. We are glad that you like our mall. Continue visiting us with your friends & family!
"
The_Forum_Sujana_Mall,Sujana,5.0 of 5 bubbles,Dec 2017 • Couples,Loved this mall!,"Dear Guest, Thank you for your kind words of appreciation. We are glad that you like our mall. Continue visiting us with your friends & family!
"
The_Forum_Sujana_Mall,bose_rima,5.0 of 5 bubbles,Oct 2017 • Friends,Wonderful Mall With Great Appearance,Visited Zara and Starbucks in the Mall on 01 Jan 18. Zara looked as if a storm had just passed through it. Men's section was totally in disarray. There was no help from customer service. We couldn't pick what we wanted.Starbucks was good. Good choice of menu and very friendly atmosphere. We are Starbucks fans and they have never let us down.
The_Forum_Sujana_Mall,Sujana,3.0 of 5 bubbles,Oct 2017 • Family,"Huge mall, pretty neat","Dear Guest, Thank you for your valuable feedback. We shall definitely convey the same to the team at Zara's. We are glad that you like our mall. Continue visiting us with your friends & family!"
The_Forum_Sujana_Mall,someswar,5.0 of 5 bubbles,Sep 2017 • Family,Movie...Masti...Maaza...one at a Time...,"Dear Guest, Thank you for your valuable feedback. We shall definitely convey the same to the team at Zara's. We are glad that you like our mall. Continue visiting us with your friends & family!"
The_Forum_Sujana_Mall,Sujana,5.0 of 5 bubbles,Aug 2017 • Family,All in once at One Place,"The mall is large in size, houses a number of brands and attracts shoppers all year around. There are options for movies and food too."
The_Forum_Sujana_Mall,Timanastas67,,,,"Dear Guest, Thank you for taking out time to review us. We are glad that you like our mall. Continue visiting us with your friends & family!"
The_Forum_Sujana_Mall,Sujana,,,,"Dear Guest, Thank you for taking out time to review us. We are glad that you like our mall. Continue visiting us with your friends & family!"
The_Forum_Sujana_Mall,AAKASH VARMA,,,,"i went with my friends ,one of the biggest mall in hyderabad all brands are available but costly no offers,for time pass we can visit."
The_Forum_Sujana_Mall,Sujana,,,,"Dear Guest, Thank you for your valuable feedback. We shall definitely look into it. However, we are glad that you like our mall. Continue visiting us with your friends & family!"
