Tourist Attraction,Name,Rating,Date and criteria,Title,Review
Jain_Temple_Mumbai,AliceMargaret89,4.0 of 5 bubbles,Jan 2017 • Friends,A beautiful temple in the middle of Mumbai,"This temple was a beautiful piece of architecture and it was interesting to learn about Jainism. We weren't allowed to go into the temple itself, but the outside was beautiful and the chanting and incense wafting through the air was just enchanting."
Jain_Temple_Mumbai,Rschagrin,4.0 of 5 bubbles,Apr 2017 • Friends,Beautiful Temple,Beautiful temple and a very nice setting. A very peaceful environment with a very strict dress code.This is the only temple we visited in Mumbai.
Jain_Temple_Mumbai,nileshsavla2016,5.0 of 5 bubbles,Aug 2016 • Solo,a must visit but conditions apply,"It is a must visit place. But strict dress codes and Jain rituals are to be followed. However you can take the darshan, as they are open for all. A beautiful architectural structure "
Jain_Temple_Mumbai,Royal J,4.0 of 5 bubbles,Apr 2017 • Friends,Walkeshwar jain temple,"It's amongst the most holy temple in jain with very good monuments, architecture. Very peaceful place, there are also some more temples in walked hear but this one has some great belifs and people come here regularly."
Jain_Temple_Mumbai,Reg S,4.0 of 5 bubbles,Mar 2017 • Family,Beautiful Temple,Beautiful Temple and very peaceful to sit and observe.  Everyone we met who was worshipping at the Temple was extremely friendly and helpful and explained the prayers and rituals.
Jain_Temple_Mumbai,satobt,3.0 of 5 bubbles,Apr 2017 • Solo,Cool interior,This temple had a really cool interior.  The ceiling dome had especially cool paintings covering the entire circle. 
Jain_Temple_Mumbai,sunnyahuja4586,4.0 of 5 bubbles,Jan 2017 • Couples,Famous jain temple,This temple is very famous and favoured by jainiis in town. Also the jain temple in santacruz is very good.
Jain_Temple_Mumbai,TravvelBug,5.0 of 5 bubbles,Mar 2017 • Business,Beauty Revisited,"Beautiful temple located in Mumbai- it is a challenge to get to because it is located in a populated place similar to a downtown area.  No priest, just worshippers who pray for the goodness of others.  Did you know that Jain as religion believe that you should be a gift to others even in death, so there is a place called the tower of silence were a priest throws the dead body into a pit and the remains are eaten by carrion birds, thereby completing the circle of life.  This temple, you must be barefoot to enter and they ask that if a woman is on her cycle to not to enter (seriously it does ask that).  If you are visiting in the height of the sun, wear socks because the ground can be very hot.  While a small temple, it is very beautiful and peaceful."
Jain_Temple_Mumbai,Pramila B,4.0 of 5 bubbles,Jun 2016 • Friends,jain temple,"this place has an aura of serenity and peace, the tirthankar moortis and the architecture is beautiful"
Jain_Temple_Mumbai,yogindery,5.0 of 5 bubbles,Mar 2017 • Friends,Jain Temple - Mumbai,Jain Temple - Mumbai is situated at ridge road malabar hill famous sightseeing place for holy person.
Jain_Temple_Mumbai,pramila2016,5.0 of 5 bubbles,Feb 2017 • Friends,peaceful temple,"the jains worship here in the morning and evening, a peaceful ambience connects you to god,the architecture is very good."
Jain_Temple_Mumbai,Likes to travel,3.0 of 5 bubbles,Jan 2017 • Couples,Nice temple but many are nicer,Thsi was the first temple we visted in India and it was nice to see but we saw many grander ones during our 19 day tour. It was also odd how it was partially covered with a plastic canopy.
Jain_Temple_Mumbai,Kenyan Traveller,4.0 of 5 bubbles,Jan 2017 • Couples,What architecture!!,A lovely little temple on Malabar Hill. The Architecture and carvings are amazing and have to be seen.
Jain_Temple_Mumbai,EStruwig,5.0 of 5 bubbles,Jan 2017 • Couples,Beautiful Temple on Malibar Hill,"A Must see in Mumbai!Sat and looked at the Jains practising their religion....Wow!Beautiful architecture, colourful and and all over memorable experience"
Jain_Temple_Mumbai,Ashim M,3.0 of 5 bubbles,Jan 2017 • Family,Visited here with a Jain relative,"By Indian standards this little temple is a little underwhelming, but it is still heavily frequented and used.  It has quite a nice view from the rear.  It would be worth attending with someone who understands and can explain a little about Jain culture."
Jain_Temple_Mumbai,David R,5.0 of 5 bubbles,Jan 2017 • Solo,Tranquility,"Even after visiting this place, my understanding  of these people is still only surface deep. But just sitting in the courtyard observing their actions, surrounded by such beauty is quite an experience. "
Jain_Temple_Mumbai,MichaelChew,3.0 of 5 bubbles,Dec 2016 • Family,Small Jain temple,"This is a working Jain temple, so one needs to respect their religious customs. No shoes - hence useful to bring some socks - and shoulders and knees need to be covered. We were not allowed to enter the inner sanctuary and could only view from the doors."
Jain_Temple_Mumbai,jekingandhi,5.0 of 5 bubbles,Nov 2016 • Friends,must visit,"very good jain temple and they have also preserved its heritage ,very calm place and u can feel the vibrations also."
Jain_Temple_Mumbai,rakhid100,5.0 of 5 bubbles,Dec 2016 • Family,Peaceful. Great place to go,"We loved it. There were people to explain the meaning. Felt at peace. Jainism is the oldest religion which welcomes all without any rules. For respect, we ensured we wore long top and trousers. "
Jain_Temple_Mumbai,ChrisJS51,2.0 of 5 bubbles,Dec 2016 • Couples,Not the sort of place for believers in gender equality,"Basically, this is a sect based upon the worship of idols. They do not allow women on the premises during a certain time in their monthly cycle. One of the five tenets of their beliefs is celibacy, which makes one wonder how they continue."
Jain_Temple_Mumbai,david m,4.0 of 5 bubbles,Nov 2016 • Solo,small temple but worth a look,"this is a very interesting temple up on the hill , its small but has very good architectural features and is easily accessable"
Jain_Temple_Mumbai,frankandviv,4.0 of 5 bubbles,Nov 2016 • Friends,Peaceful visit,"A really peaceful feel about here,the temple's buildings were very ornate(unfortunately our cameras batteries ran out)with a Main Street just outside it was strange just how quiet it was,the inside of the temple was lovely and I would recommend a visit here."
