Tourist Attraction,Name,Rating,Date and criteria,Title,Review
Rajabai_Clock_Tower,prannnn,4.0 of 5 bubbles,Apr 2017 • Friends,Ancient Architecture well maintained,"Like any major university, this is Mumbai university's own clock tower which was built during the British era and the good part is, the iconic structure has been well maintained over generations. Today, this is one of the must see locations in case you happen to be in Mumbai. The place is located inside the campus which is very well connected to churchgate station and bus depot. Being a very prominent location in Mumbai, the place can be easily accessed. one may not be able to enter inside the tower but if you walk along the roadside, you would be a able to get a glimpse of this iconic building. In case you happen to have a good lens camera, then you would be able to get a better picture from the nearby oval maidan. Hence, in case you happen to be visiting Mumbai then do check out this place."
Rajabai_Clock_Tower,ClayF2,4.0 of 5 bubbles,Mar 2017 • Family,Left-over British influence,A nice structure.  A decent area.  We walked by.  I was surprised by the amount of colonial architecture around.  Maybe I should not have been.
Rajabai_Clock_Tower,arkharul,4.0 of 5 bubbles,Jun 2016 • Business,Oct2016,This is one of the tourist spots of Mumbai. It is good to see point rather than a must see point. Takes around 30 min at this spot.
Rajabai_Clock_Tower,Souvik S,4.0 of 5 bubbles,Apr 2017 • Family,A clock tower of great historic importance.,"This place, now turned into an University, has a great historical value. Entry to normal civillians inside the premises isn't allowed."
Rajabai_Clock_Tower,Akash Agrawal,3.0 of 5 bubbles,Aug 2016 • Friends,Just a clock tower of historic importance !!!,"Just a clock tower of historic importance !!! During the British Raj, it played the tunes of ""Rule Britannia"", ""God Save the King"", ""Home! Sweet Home!"" and ""A Handel Symphony"", out of a total of sixteen tunes, which changed four times a day. It currently chimes only one tune every 15 minutes."
Rajabai_Clock_Tower,Ronak S,5.0 of 5 bubbles,May 2016 • Family,old construction,The clock tower is situated in South Mumbai and goes back to pre-Independence time. Its still functional and one of the historical spots for kid/ school students
Rajabai_Clock_Tower,JBLEROUX,4.0 of 5 bubbles,Mar 2017 • Couples,Impressive,We were only on the outside so I can not give an in depth review but worth driving by.Grat area to stroll around.
Rajabai_Clock_Tower,Priyadarshan I,5.0 of 5 bubbles,Mar 2017 • Business,historic,amazing  experience of walking on the road in front of the tower and the clock starting its 8 o clock chimes.
Rajabai_Clock_Tower,Komal Lakhani - Shankar,5.0 of 5 bubbles,Dec 2016 • Solo,Its a landmark,Include it in your south bombay itenary. Easy to get to and doesnt take up a lot of time either. Its a part of the victorian acrtitecture built by the british
Rajabai_Clock_Tower,Maneck244,4.0 of 5 bubbles,Feb 2017 • Family,Takes you back a hundred years,"This clock tower is situated in South Mumbai - and is an emotional reminder of what it was like to live in ""Bombay"" - a time long before mobile phones or even before digital watches. If you are visiting the southern part of Mumbai - make sure you get to visit this attraction. It will take not more than 10 or 15 minutes to have a look, click a few pictures and move on. It leaves me with very good memories!"
Rajabai_Clock_Tower,anuradha2013,4.0 of 5 bubbles,Feb 2017 • Solo,Modelled on Big Ben London,"Sir George Gilbert Scott modelled it on Big Ben in London and took a little more than 9 years to finish in November 1878.A fusion of Venetian and Gothic styles, the tower has one of the best stained glass windows in the city.It is definitely one of the great Architectures of British Raj."
Rajabai_Clock_Tower,pradnya11,4.0 of 5 bubbles,Apr 2016 • Family,huge structure with british era charm,Its a huge clock tower that depicts bombay's old world architecture and charm .. its really worth a visit .. 
Rajabai_Clock_Tower,Keith E,4.0 of 5 bubbles,Feb 2017 • Friends,Nice to walk around,Nice structure- near some other nice buildings and parks in center of South Mumbai. Generally an area that is worth a look.
Rajabai_Clock_Tower,ashikivor,4.0 of 5 bubbles,Jan 2017 • Friends,Ancient Clock Tower,It is a tall building where there is an ancient beautiful clock. The clock is very much visible from a large distance also.
Rajabai_Clock_Tower,lezleyg2017,5.0 of 5 bubbles,Jan 2017 • Couples,a sight you will see,"this elegant building is made more elegant by the contrast of old and new tower blocks, side by side, it just works,,,,,,,"
Rajabai_Clock_Tower,normalguy2016,5.0 of 5 bubbles,Jan 2017 • Couples,One of Mumbai's great landmarks,"This almost look-a-like building similar to 'Big Ben (now the Queen Elizabeth tower, in London) is worth seeing for itself but also for being very close to Shivaji Park, an enormous space where upto ten cricket matches are played every waking moment, all with umpires ,separate boundaries and all player smartly dressed in their cricket whites.Here can see and feel the enthusiasm which is evident across India for 'the beautiful game,'"
Rajabai_Clock_Tower,Joll32,4.0 of 5 bubbles,Jan 2017 • Friends,Mumbai Big ben,Not so famous and big like Big ben but it worth it and near by is city field for sports and you can realx and watch Criket practice :)
Rajabai_Clock_Tower,ulurusunset,5.0 of 5 bubbles,Dec 2016 • Family,Very beautiful,"The University Clock Tower and the whole surroundings are very beautiful, full of palms and other trees. "
Rajabai_Clock_Tower,bryn222,4.0 of 5 bubbles,Jan 2017 • Couples,Amazing building,"Very nice building as there is a few around, very close to the high court too, a nice place to just walk around."
Rajabai_Clock_Tower,Ranjeet K,5.0 of 5 bubbles,Dec 2016 • Couples,Fabulous Venetian-Gothic structure near Kala Ghoda ,Bombay University was founded in 1857. Its Fort campus boasts of some beautiful buildings. Rajabai Tower & nearby structures were built in Venetian-Gothic style by the British. These are well maintained & are gorgeous looking.It's walking distance from Kala Ghoda which has fabulous restaurants.A must visit when in Mumbai/Bombay.
Rajabai_Clock_Tower,Sandeep M,5.0 of 5 bubbles,Dec 2016 • Friends,Clocktower within Mumbai University,This clocktower is located inside Mumbai University. The campus it is located on has a lot of other old historical buildings. Near the base of the clock tower is a plinth on which is inscribed the Preamble to the Constitution of India.
Rajabai_Clock_Tower,Yog83,5.0 of 5 bubbles,Jan 2016 • Friends,Must visit,Rajabai Tower near Mumbai University.It's mainly clock tower must visit place in Mumbai with good campus of University
Rajabai_Clock_Tower,Mikhil,4.0 of 5 bubbles,Nov 2016 • Friends,Stands like an icon,"It has become an icon in South Mumbai! Illuminated by beautiful colours at night, it resembles old architecture!"
Rajabai_Clock_Tower,rcjoshi,4.0 of 5 bubbles,Dec 2015 • Friends,Located in the confines of the Fort campus of the University of Mumbai.,"Nice views of tower at the evening and night, at that time lighting is magnificent, makes you feel like Oval or London. Designed by the architect of Big Ben tower, it has clock on all 4 sides"
Rajabai_Clock_Tower,Steve T,4.0 of 5 bubbles,Nov 2016 • Friends,Impressive ornate clock tower,Impressive ornate clock tower which can be seen widely from downtown Mumbai. A wonderful example of colonnial architecture with the clock tower resulting to last for generations.
Rajabai_Clock_Tower,MNescaped,3.0 of 5 bubbles,Nov 2016 • Friends,Colonial influence,This is being maintained well and does help as a landmark in the area. There are cricket fields nearby so makes for an inviting neighborhood to walk around in.
Rajabai_Clock_Tower,Spoons58,3.0 of 5 bubbles,Oct 2016 • Couples,Big Ben,"You can see this from the raod fro a quick view, it looks a bit like Big Ben.Its an atraction so no problem if you dont see it."
