Tourist Attraction,Name,Rating,Date and criteria,Title,Review
St_Michael_s_Church,GRETALEWIS,5.0 of 5 bubbles,Feb 2015 • Family,THE PLACE FOR WISHES,"St. Michael's Church in Mahim, Mumbai, is said to be in existence for many many years. The story goes that the statue of Mother Mary was found by the local fishermen and was installed in the church and that all wishes asked for are granted if you pray every Wednesday for 9 weeks in a row. Every Wednesday, which is reffered to as Novena Day, the devout from all religions, come to attend the Wednesday Mass and pray / ask for their wish (or ""Mannat"" as in Hindi) to be fulfilled. There is also a feast when all 9 continuous days there is mass held and the Feast is celebrated by one and all.Lots of hawkers selling not only Church items like candles and garlands, but every Wednesday, its like a mini fair with all kinds of home, clothes, personal items being hawked on the streets outside the church. A must visit if you want a good bargain and an experience so many things available on the streets.The 9 Novena wish is a known fact and people from all religions come here to ask for whatever it is that they may wish for."
St_Michael_s_Church,StacyVaz,4.0 of 5 bubbles,Jan 2015 • Family,Good for the Catholic Faithful,"No trip to Mumbai is complete without a Wednesday novena at 'Mahim Church' for the Catholic faithful. St. Michael's Church may not seem so special from the outside with its location, building or compound quite modern and non descript. However, once you step inside, you are blown over by the crowds who visit the church. It's quite a sight to see so many people united in their faith.If you are a devout catholic, I would highly recommend visiting this church."
St_Michael_s_Church,FacelessBureaucrat,3.0 of 5 bubbles,Feb 2015 • Solo,Not necessarily what you'd call a tourist attraction,"Yes, Wednesday novena services are very popular, and not just with the local Catholic community, but I'm puzzled as to why you would come to Mahim to see it. The church building itself is modern, although not particularly special - and although there has been a church on the site since 1534, you couldn't tell that.However, if you do want to see Catholicism practiced in an unlikely place, St Michael's is as good a place as any, just tell your taxi driver to take you to Mahim Church - they'll know which one you mean."
St_Michael_s_Church,UVed,4.0 of 5 bubbles,Apr 2014 • Friends,Wednesday Novina,"Popularly known as Mahim church, it is one of the biggest churces in Mumbai, you should visit this church of the Wednesday evening mass. Not a very pretty church but draws a lot of people because of the faith and the mass"
St_Michael_s_Church,Veena D,4.0 of 5 bubbles,Oct 2014 • Family,A Wednesday in Mahim,Our Lady of Perpetual Succor novenas are conducted on Wednesday here right from morning to evening.  This church draws devotees from all religions from everywhere.  On a Wednesday you can see and feel the inter-religious convergence here as people of all faiths gather to pray to Mary for their petitions.  Many come out of thanksgiving and devotion to Mary having found their hearts desire.  
St_Michael_s_Church,CanisHan,4.0 of 5 bubbles,Dec 2014 • Solo,Peaceful church,"C1 ( 2014.12.09 ) It was hard work to find this church. This church was attached to high school, I think. This church was very calm and peaceful. When I've visited this church, some people prayed reverently. I went to there for walk with feeling Indian people's life about 1 hour walking. This church was good, and walking in Indian street was more good."
St_Michael_s_Church,Azy S,5.0 of 5 bubbles,Nov 2014 • Friends,Find Peace in d Middle of Mumbai,"Its located right on d main road between bandra n mahim n thrs lots of traffic all day long but step inside d church n ul feel uv entered a diffrent world. Its a huge structure n very beautiful. Vey peaceful. Try visiting on a wednesday after noon during Novena, it will be very crowded but u can also enjoy d flea market which is thr on dose days. "
St_Michael_s_Church,Seema Shah,5.0 of 5 bubbles,Mar 2014 • Family,Good attraction specially for Christians,"A good place, to visit.Quite jam packed on Wednesday for novena. Good market runs around this area. "
St_Michael_s_Church,kayyum r,4.0 of 5 bubbles,Aug 2014 • Friends,Oldest church,"One of the oldest church in mahim every Wednesday their a huge mass pray over there all the Christian brother sister come their their is a school,also"
St_Michael_s_Church,sanjay735,5.0 of 5 bubbles,Sep 2014 • Friends,gods house,"st michaels church as you enter the church you feel  very calm and  at peace , your prayers are herd and fulfilled at this church and even your sins are forgiven if you pray from the depth of your heart "
St_Michael_s_Church,jyothi675,5.0 of 5 bubbles,Jan 2014 • Family,Holy Church,"The Church is at  Mahim. It is one of the church where people of all faith offer their prayers and put in their petition. Wednesday Novena is sacred and Mass is offered in English, Marathi and Konkani.  Special offering are made on this day. "
St_Michael_s_Church,apintolobo,5.0 of 5 bubbles,May 2014 • Family,FREQUENTED BY PEOPLE OF ALL FAITHS,The Church history goes back to the days of the Portuguese era. It was pulled down and a new Church was built in its place to accommodate the multitude of pilgrims that visit it every Wednesday to honour the Blessed Virgin at the hourly Novenas.The Annual Feast Day of the Blessed Virgin is celebrated on the 27th of June preceded by 9 days of Novenas. Though called St Michaels Church greater importance is laid on the Blessed Virgin. The Feast of the Patron Saint Michael is celebrated in September. There are scores of people who bear testimony of the miracles performed.
St_Michael_s_Church,Harold C,5.0 of 5 bubbles,Aug 2013 • Couples,Novena Prayers,Visit the church for peace of mind and body very famous for the wednesday novenas if going for a visit then avoid wednesdays close to bus and train station
