Tourist Attraction,Name,Rating,Date and criteria,Title,Review
St_Thomas_Cathedral_Mumbai,visithra,5.0 of 5 bubbles,Sep 2015 • Friends,Stunning,"this is one beautiful church. full of historical grave markers, take your time to read the notes of loved ones carved in them while you gasp in the beauty of the church. "
St_Thomas_Cathedral_Mumbai,Floyd A,5.0 of 5 bubbles,Aug 2015 • Business,Peaceful and one with the Lord,St. Thomas Cathedral which is over 200 years old is a must visit for any traveler. Located just behind Horniman circle and next to Asiatic Library. Its also a 10 minute walk from Churchgate station. The interiors of the church walls are graced with memories of English sailors and other personnel that were part of many wars while in India. It is also a grade 1 heritage structure.
St_Thomas_Cathedral_Mumbai,Enthusiastraveller,4.0 of 5 bubbles,Aug 2015 • Solo,Historical Church,This is a Cathedral Church and is named after St. Thomas. It is a very old and historical church in the city and is very close to the flora fountains. This church is easily accessible via CST / Churchgate railway station and is around 10-15 mins walk from there. The churchgate station is named after this only.
St_Thomas_Cathedral_Mumbai,B R S,4.0 of 5 bubbles,Oct 2015,The First Anglican Church of Mumbai,Named after Saint Thomas the church was consecrated in 1718 and  became a Cathedral in 1837 with the appointment of the first Bishop of Mumbai. The Area to the West of the Church is called Churchgate and is one of the oldest business districts of Mumbai. It is now an UNESCO Heritage Building.
St_Thomas_Cathedral_Mumbai,GuelphTraveller,4.0 of 5 bubbles,Sep 2015 • Solo,Interesting British Colonial Church,"The centre of Colonial Anglicanism located in the Colonial area near the old Town Hall and Horniman Circle. Consecrated in 1718 making it the city's oldest church it does have a 19th century look due to ""improvements"" made in the Victorian era. The church has stained glass windows and a restrained Anglican interior with many beautiful bas relief marble wall tablets commemorating the dead of the Raj. Well worth a visit."
St_Thomas_Cathedral_Mumbai,SuDooNZ,4.0 of 5 bubbles,Nov 2014 • Friends,Another Church,"Reflects the height of the British ""occupation"".  Fascinating architecturally and interesting social comment on the attitudes of the time.  Unbelievably the marble for the structures was imported when apparently it was actually available locally."
St_Thomas_Cathedral_Mumbai,Lavesh G,4.0 of 5 bubbles,Jul 2015 • Friends,Most historic.. most peaceful.. most recommended for cultural tourists...!!!,"Many people doesn't know that the Churchgate railway station gets its name from this Church.I has been a core part of the city's rich history. the architecture  is very beautiful, the stories are mesmerizing, read well on the net before visiting so as to realize what youy are experiencing when you get there."
St_Thomas_Cathedral_Mumbai,Oscar Varghese,4.0 of 5 bubbles,May 2015 • Solo,Beautiful church in the chaos of Mumbai,"If you've been to Horniman Circle its impossible to miss this church, please do go in admire the beauty and if possible have a chat with the padre. He's a brilliant guy who loves to talk to the people."
St_Thomas_Cathedral_Mumbai,Greg A,4.0 of 5 bubbles,Sep 2015 • Friends,Stunning architecture!,"This church is well worth the visit with stunning architecture and stained glass windows. Beautiful building with a lot of history, especially the Afghan wars."
St_Thomas_Cathedral_Mumbai,Floyd A,5.0 of 5 bubbles,Jul 2015 • Solo,One of the oldest Anglican churches in Mumbai,"St. Thomas Cathedral located at Churchgate and just before Horniman Circle is one of the oldest Anglican Churches in Bombay Its pews, altar and other elements date back to over a 100 years. Its walls are decorated with the names of British soldiers who stayed in India and were part of the wars during their stay here."
St_Thomas_Cathedral_Mumbai,animesh202,5.0 of 5 bubbles,Sep 2015 • Friends,Beautiful church,The single most peaceful place in an otherwise mad city of Bombay. Its a beautiful church and well kept.
St_Thomas_Cathedral_Mumbai,savs09,4.0 of 5 bubbles,May 2015 • Friends,"Of heritage, religion and spirituality","The church is built on an axis in line with Flora Fountain and Churchgate station. Interiors are washed in a beautiful quality of light. The light is filtered through the stained glass at the nave of the church. Outside, the buttresses hold the nave of the church. Hence, one must walk around the church outside to admire these study buttresses, not a very common feature in Mumbai."
St_Thomas_Cathedral_Mumbai,Alison H,5.0 of 5 bubbles,Aug 2015 • Solo,Beautiful,"Although I'm not religious, I found this church really peaceful and beautiful. The surrounding garden is also lovely.The added bonus is that it's just next door to the magnificent Horniman Park. "
St_Thomas_Cathedral_Mumbai,Liz T,4.0 of 5 bubbles,Sep 2015 • Family,Worth seeing an Anglican church,"This is one of the oldest cathedrals in Mumbai. This is definitely worth seeing for its architecture, it was completed in 1718 for the British settlers in Bombay and the first Anglican church."
St_Thomas_Cathedral_Mumbai,4saldanha,5.0 of 5 bubbles,Aug 2015 • Couples,unknown but beautoiful church,"very beautiful and peaceful church, with beautiful interiors and quiet place to pray to god, and review life"
St_Thomas_Cathedral_Mumbai,Zarin S,5.0 of 5 bubbles,Jun 2015 • Friends,St. Thomas Cathedral,Its one of the quietest place where one goes for peace of mind.  My old office used to be there.  At that time every day I used to visit this Cathedral.  Now whenever I go to Fountain for shopping I pay a visit to my favourite St. Thomas Cathedral.  A few minutes on entering this place I am at peace with myself.  I love it there.  In the morning at times I have heard the choir practicing.
St_Thomas_Cathedral_Mumbai,RAMESH K,5.0 of 5 bubbles,May 2015 • Solo,An oasis of absolute peace,St. Thomas Cathedral in Fort area of Mumbai is part of British history and is a beautiful heritage building. It was built as a church in 1718. Not many know that Churchgate station was named after this church bcoz the road from the station led to this church. It was converted into a Cathedral in 1837. In the bustling commercial district of Fort area it is an oasis of absolute peace. It is built in the gothic & classic style of architecture. The interiors of the cathedral are awesome. There is ample use of painted stained glasses. There r beautiful carved figures & sculptures in marble. This Cathedral was recipient of UNESCO award for heritage buildings. I spent nearly half an hour inside the cathedral today in absolute peace admiring the architectural wonder and being in communion with the Almighty. On your next visit to Fort area please do not forget to visit this place !!
St_Thomas_Cathedral_Mumbai,SUZANNE R,4.0 of 5 bubbles,May 2015,Serene tranquility,"Step inside the cathedral, and the chaos of Mumbai is a distant memory lThe cathedral is a haven of serene tranquility, where everything is forgotten, and you enter another world, wher you can wonder at its beauty  or quietly say a prayer "
St_Thomas_Cathedral_Mumbai,ushabanerji,5.0 of 5 bubbles,Jul 2015,Relic of the Raj,The magnificent St.Thomas Cathedral stand on what is now Veer Nariman road in the heart of the Fort district. This Anglican church has a  number of interesting plaques in memory of the Britishers who died in India.
St_Thomas_Cathedral_Mumbai,Mark D,5.0 of 5 bubbles,May 2015,A peaceful haven,"This cathedral was an amazing place to find in Mumbai, compared to many of the other buildings, this one is very plain inside, however this does give it a certain air of calmness and tranquility, especially with all the hussle and bussel outside. One feature of the interior is the number of fans to keep the congregation cool during the services. "
St_Thomas_Cathedral_Mumbai,vinodkhedkar,4.0 of 5 bubbles,May 2015 • Solo,Nice Architecture,"St. Thomas Cathedral, Mumbai, completed in 1718, is the first Anglican church in Mumbai (then called Bombay), to improve the ""moral standards"" of the growing British settlement. It is located on Veer Nariman Road, close to Horniman Circle Gardens and the Flora Fountain. Excellent architecture this place nice place for worship. They also give free versions of holy bible in different Indian languages."
St_Thomas_Cathedral_Mumbai,shek2005,4.0 of 5 bubbles,Feb 2015 • Friends,majestic!!,"Beautiful stainglass windows , majestic marble tombstones and in-memoriam plaques. quiet and peaceful. Lots of history in the foyer to readIt is a must visit if you are visiting Kala Ghoda. Close to Horniman Circle, its a UNESCO heritage site."
St_Thomas_Cathedral_Mumbai,Nergish2014,5.0 of 5 bubbles,Mar 2014 • Solo,Truly Majestic,"Walked into the cathedral while my family friends waited for their toddler to come out of the neighbouring Cathedral infant school. Spent half an hour inside marveling at the beautiful stainglass windows , majestic marble tombstones and in-memoriam plaques of long-gone British Indian citizens and the endless rows of pews. Just an unbelievable atmosphere in this church.  Furthermore the exterior of this fine building is beautifully maintained."
St_Thomas_Cathedral_Mumbai,TanyaThumbran,5.0 of 5 bubbles,,Simple,Our 1st church visited. It was quiet and peaceful. Lots of history in the foyer to read and in the sanctuary as well. A prayer request station where you can submit your written prayer request. Huge inside. Quite a few worshippers seated. 
St_Thomas_Cathedral_Mumbai,UVed,5.0 of 5 bubbles,Dec 2014 • Family,The first Anglican Church of Mumbai,"It has an impressive facade and is a must visit if you are visiting Kala Ghoda. Close to Horniman Circle, you should go check out the old stained glass with St  Thomas. Its a UNESCO heritage site."
St_Thomas_Cathedral_Mumbai,CanisHan,4.0 of 5 bubbles,Dec 2014 • Solo,Good Cathedral,"C1 ( 2014.12.10 ) This cathedral's structure was not harmonious with another building, I think, because this structure was Europe style. The cathedral was very calm and good. The atmosphere was reverant. This cathedral was not far from main attraction, so just 10 minutes walking, could go there."
St_Thomas_Cathedral_Mumbai,Neli K,4.0 of 5 bubbles,Nov 2014 • Friends,Stunning church,"St Thomas is an amazing building, and it can be found in a part of the city which has many other ones - apparently, Mumbai is the runner-up city in terms of number of Art deco buildings from the beginning of the 20th century, Stunning both inside and out!"
St_Thomas_Cathedral_Mumbai,kayyum r,4.0 of 5 bubbles,Aug 2014 • Friends,Best church,"St. Thomas Cathedral, Mumbai, completed in 1718, is the first Anglican church in Mumbai, to improve the ""moral standards"" of the growing British settlement. It is located on Veer Nariman Road, close to Horniman Circle Gardens and the Flora Fountain. "
St_Thomas_Cathedral_Mumbai,TPsingh,5.0 of 5 bubbles,Jul 2014 • Solo,Great place to visit,"Nice peaceful place in the middle of city which is full of people. Nice combination of art, history and religion. Good visit."
St_Thomas_Cathedral_Mumbai,jehenson81,4.0 of 5 bubbles,May 2014 • Friends,Nice Respite,"I have to say that this church was a welcome sight.  First off it was lovely, but it was also a great place to sit down out of the rain and have a few moments of silence.  The church was very clean and very large and airy."
St_Thomas_Cathedral_Mumbai,JFFJourneys,4.0 of 5 bubbles,Feb 2014 • Solo,Beautiful Cathedral,Be sure to walk up front.  On the right hand side is a special pew that has a plaque to designate where Mother Theresa sat.
St_Thomas_Cathedral_Mumbai,Creeping_Death_LA,4.0 of 5 bubbles,Sep 2013 • Family,Sunday mass,"After having coffee at Starbucks across the street we stopped by to take a look inside. The church is well maintained and they had a lot of parishioners inside. I usually look to see if they have a gift shop so I could send some items to my mother who is a devout Catholic, but I did not see one."
St_Thomas_Cathedral_Mumbai,GOAgaga,4.0 of 5 bubbles,Sep 2013,Anodyne,"The historic beauty of this Cathedral is gripping. Once you step in you would want to stay on more than a minute. The hymns and Psalm resound, giving it a soul."
St_Thomas_Cathedral_Mumbai,Praveen Patrick... P,5.0 of 5 bubbles,,We meet Every sunday at 8:00am 00919867285333,We meet Every sunday at 8:00am 00919867285333youth meetingworship time every sunday 8:45amJesus bless you
