Tourist Attraction,Name,Rating,Date and criteria,Title,Review
Town_Hall_Asiatic_Society_Library,Debarati D,4.0 of 5 bubbles,Dec 2014 • Friends,Majestic,"Town Hall (called Tondal in the 19th century) is one of the most majestic structures among the  heritage buildings in the city of Mumbai. One can say that this building represents one of the last architectural remnants of the Victorian Bombay (Mumbai). The Town Hall houses the 'Asiatic society of Bombay' (Mumbai), which is a public state library in the city. The Asiatic Society of Bombay, a learned society in the field of Asian studies, traces its origin to the Literary Society of Bombay which first met in Mumbai on November 26, 1804, and was founded by Sir James Mackintosh. It was formed with the intention of ""promoting useful knowledge, particularly such as is now immediately connected with India"". After the Royal Asiatic Society of Great Britain and Ireland was established in London in 1823, the Literary Society of Bombay became affiliated with it and was known as the Bombay Branch of the Royal Asiatic Society (BBRAS) since 1830. The Bombay Geographical Society merged with it in 1873, followed by the Anthropological Society of Bombay in 1896. In 1954, it was separated from the Royal Asiatic Society and renamed the Asiatic Society of Bombay.It is said that the Asiatic got many of its valuable books from authors and researchers who spent countless hours sitting in its halls writing their books. The literary renaissance of Western India started at the Asiatic Library. The building itself was completed in 1833. The entire construction was made of stones brought from England and was beautifully designed in a neo-classical fashion. Within the building, the floors are covered in ancient wood, the staircases are spiral and the terraces are adorned with beautiful wrought iron. The vestibule, and the Durbar Hall of the Asiatic Society are dotted with statues, busts and portraits of the outstanding scholars, administrators and philanthropists who contributed to the society, through their research papers, through donating money and their collections of rare books, manuscripts and other antiquities.There is a flight of 30 steps leading to a portico with eight doric columns which is the entrance of the Town Hall. This staircase is a popular venue for still photography and film/ad shoots. Elsewhere in the building photography is not allowed. The library has over a hundred thousand books out of lots of them are classified as rare and valuable. Apart from priceless articles, ancient manuscripts in Persian, Sanskrit and Prakrit, it also has a collection of rare coins. Permission is required to see these collectibles. Being a public library, it has a free reference library and reading room, open to everyone. In addition, it has over 200 newspapers from across the country for people to read. Some sections of the library are open only for members. I visited this place to attend a workshop organised during the Kala Ghoda festival.The vestibule entrance towards the left of the building, has a wrought iron divided regency staircase adorned with an amazing statue of the 19th century philanthropist Jagannath Sunkarseth. After making way through endless rows of books, one comes across the magnificent durbar hall towards the back of the building. It is used for hosting exhibitions,lectures and workshops. Oval in shape with fabric covered walls and a scheme of natural lighting, the durbar hall is topped by a dome. The roof is adorned with beautiful chandeliers and oil paintings of prominent personalities adorn the walls. This relic of our Colonial history faces a severe fund crunch. Certain areas have been rented out to Govt. offices like the Stamp Office. Some time ago, an 'adopt a book' scheme has been introduced to collect funds from the public. Active public support is required to preserve this beautiful legacy. There is lack of sufficient display information for visitors to this building. There is no reason why photography cannot be allowed in selected areas for a price instead of the current system where govt permission is reqd."
Town_Hall_Asiatic_Society_Library,Nergish2014,4.0 of 5 bubbles,,A special building!,"Though i did not go inside, I was captivated by the magnificence of this building from the sighting point at Horniman Circle. It is a bit like buildings built in Greco-British style but hard to categorise. Also it appeared to be excellently maintained. one of Bombay's leading attractions in my opinion!"
Town_Hall_Asiatic_Society_Library,weeblepimkin,4.0 of 5 bubbles,Aug 2014 • Family,Splendid setting with wonderful old books.,Went with my mum into the library. had always admired it from outside since its a majestic well maintained structure. We browsed through picture books of 19th century British India prints which was a really fulfilling two hours. Tons of old books and all the latest newspapers. A treat!
Town_Hall_Asiatic_Society_Library,gammo,5.0 of 5 bubbles,Nov 2014 • Solo,Great building housing a fine Library.,I work nearby and often drop in for a quick look at the various newspapers available.The building is now well maintained and really is one of British India's gifts to the city.Also the library houses many beautiful old rare books.
Town_Hall_Asiatic_Society_Library,Pradnya1710,5.0 of 5 bubbles,Jun 2014 • Family,Monument worth having pride!!!,"Town Hall is the most wonderful heritage structure in Mumbai. This place is within walk able distance form CST station facing Horiman circle. Constructed multiple decades ago, it is absolutely ocean of books and ideal spot for architecture photography. It could be heaven on earth for a bookworm person like me!!!It hosts one of the oldest and biggest library in Asia -- The Asiatic Society of Bombay. The library of the Society has over hundreds and thousands books out of which many are classified as rare and valuable. It also has priceless artifacts and ancient manuscripts in Persian, Sanskrit and Prakrit, mostly on paper but some on palm leaf. On Sundays and public holidays, bollywood film shootings are done here!!"
Town_Hall_Asiatic_Society_Library,sgbtours,3.0 of 5 bubbles,Jun 2014 • Solo,Tondal,"Town Hall is one of the most majestic structures among the other heritage buildings in the city of Mumbai. One can say that this building represents one of the last architectural remnants of the Victorian Bombay (Mumbai). The Town hall was colloquially called as 'Tondal' during the 19th century. The Town Hall houses the 'Asiatic society of Bombay' (Mumbai), which is a public state library in the city. For this reason, the structure is considered a storehouse of information. It faces the Horniman Circle Garden."
Town_Hall_Asiatic_Society_Library,Hrishikesh88,4.0 of 5 bubbles,Dec 2013 • Solo,Sea of Books,A beautiful building with tall Greco-Roman columns. An old public library and a good spot for architecture photography. It is lively in the morning with many intellectuals seen reading newspapers and intellectual discussions outside the library.
Town_Hall_Asiatic_Society_Library,vinodkhedkar,4.0 of 5 bubbles,Feb 2014 • Friends,Ocean of Books !,"The Asiatic Society of Bombay, a learned society in the field of Asian studies, is based in Mumbai, India.The library of the Society has over a hundred thousand books out of which 15,000 are classified as rare and valuable. It also has priceless artifacts and over 3,000 ancient manuscripts in Persian, Sanskrit and Prakrit, mostly on paper but some on palm leaf.On Sundays and public holidays,bollywood film shootings are done here."
Town_Hall_Asiatic_Society_Library,Bornav,3.0 of 5 bubbles,Sep 2013 • Solo,Often missed out by tourists,A beautiful colonial era building with tall Greco-Roman columns and a flight of stairs. An old public library and a good spot for architecture photography. It is lively in the morning with many intellectuals seen reading newspapers and intellectual discussions outside the library. 
Town_Hall_Asiatic_Society_Library,hotellinen,5.0 of 5 bubbles,Feb 2014 • Family,every tourist to mumbai must see town hall asiateic society library mumbai,in many  hindi films this town hall buliding of asiateic society been used as a prime location for hindi movies. this is located at a prime location of mumbai. just2 minutes walk from stock exchange of mumbai (BSE) bombay stock exchange.4 minutes walk from kala ghoda &  jehangir art gallery 3 minutes walk from lion gate .5 minutes walk from regal cinema colaba.6 minutes from gate way of india & hotel taj
Town_Hall_Asiatic_Society_Library,shaz,3.0 of 5 bubbles,Jan 2014 • Friends,"Library with great external structure, but no copy of Divine Comedy","The Asiatic library is free and great place to read books and newspapers. You have to sign it to go inside and photography is not allowed. The library is build in Greco roman style and has 8 Doric columns and 30 steps leading into the library.It has one of the two original copies of Dante's ""Divine Comedy"", though on inquiring at the office the staff mentioned that the copy is in the State Bank of India locker and hence not viewable, a shame for such a rare manuscript. The fee to become a member is Rs 1500 and you have to be referred by an existing member.The place is good for photographers since photographers can get creative with the 8 columns and the steps."
Town_Hall_Asiatic_Society_Library,Balakrishnan I,4.0 of 5 bubbles,Sep 2013 • Solo,British Style Building,"I go across this place daily en route to my office. Nice Arranged interiors. Loads of Books and Periodicals for enrichment of knowledge. Best thing is you are allowed to sit inside and view the books on production of ID proof, no need to be a member. Since it is situated on the main road, the place is always buzzing with activity. However if you are inside the library, the outside noise is totally silenced"
Town_Hall_Asiatic_Society_Library,Vidyadhar S,5.0 of 5 bubbles,Mar 2013,Good old Library !,"I have seen the library from inside , though I myself is not a member. I happened to be there fro some reference book. Building is very good peace of architect. "
Town_Hall_Asiatic_Society_Library,TheShis,3.0 of 5 bubbles,Mar 2013 • Couples,Ok for taking a look at the building. nothing more.,"This is an impressive building just next to Horniman Circle (yeah, such a circle actually exists in mumbai - what were they thinking...). :)While the facade of the building is truly impressive, it's almost impossible to get in as nobody knows the opening hours and information is simply not available."
Town_Hall_Asiatic_Society_Library,iamsoulman,3.0 of 5 bubbles,Sep 2012,Just OK,We were a group of 8 people and we could not get proper information about the place many people told we will have guides available there but we could not see any one there. but its ok for a visit
