Tourist Attraction,Name,Rating,Date and criteria,Title,Review
Town_Hall_Asiatic_Society_Library,drpiyushraj,5.0 of 5 bubbles,Aug 2021,Asiatic Library,"A colonial structure in Mumbai, one of the oldest library in town. Has a beautiful facade and is one of the major tourist attractions, many posing for pictures and even a lot of videos and Instagram reels being made here by many youngsters. "
Town_Hall_Asiatic_Society_Library,KiritK,4.0 of 5 bubbles,Nov 2019,Asiatic,The majestic facade of the building gives the area the Royal touch n is photographers choice for Photo Shoots n also during night time lighting adds to the decor
Town_Hall_Asiatic_Society_Library,Sachin K,5.0 of 5 bubbles,Aug 2019 • Family,Unique ,The Asiatic Society Library is located in South Mumbai and has historical significance. It was built by the British in the 19th century and it’s architecture is magnificent. It has been well maintained over time and worth visiting. 
Town_Hall_Asiatic_Society_Library,Hitesh S,5.0 of 5 bubbles,Jan 2019 • Family,One  of the Oldest Monuments in old city,"Big history with the place, bilt by britsih in 18 century, work as town hall in eighteens, now a hugh international iberary, nominal fee, excellent photoshoot. worth visit."
Town_Hall_Asiatic_Society_Library,dmplbksh90,4.0 of 5 bubbles,Apr 2019 • Friends,An old era,This place is heaven for those who love old buildings. The place was started building in 19th century and even today the building stand still. This shows excellent planning and quality of work in olden days. Do visit this place if you are at fort. Only members are allowed to enter the library. The membership costs 1500/- per annum + 2 member referrals.
Town_Hall_Asiatic_Society_Library,Hooray H,5.0 of 5 bubbles,Jan 2019 • Family,Beautiful Landmark,"I took some of my family to this area & they could not believe how beautiful & well maintained these buildings were.Finally, people are taking care of them.Well done, they are a treasure."
Town_Hall_Asiatic_Society_Library,Vivek Dhadha,5.0 of 5 bubbles,Nov 2018 • Solo,Unmissable Marvel,This unmissable classical marvel has been the seat of learning and inquiry over the centuries.Recently it has become the favourite spot for photo shoots.You will find several students along with retired folk in Asiatic society and it’s treasured library.
Town_Hall_Asiatic_Society_Library,BomiPardiwalla,4.0 of 5 bubbles,Jan 2019 • Family,Beautiful,"At Horniman Circle. its well-lit at night and quiet, Visit it during the day as its well kept and serene. Surely worth a visit for any tourist."
Town_Hall_Asiatic_Society_Library,MANCHIMASTER,5.0 of 5 bubbles,Dec 2018 • Solo,town hall,town hall is worth visiting. seen in many movies. Asiatic library ìs the biggest library and has largest collection of books. must visit
Town_Hall_Asiatic_Society_Library,Shoeb,4.0 of 5 bubbles,Oct 2018,Timeless,This probably is one of the most photographed place of the city.  Even lot of movies re shot. It houses a a very nice library.
Town_Hall_Asiatic_Society_Library,manojoza,4.0 of 5 bubbles,Nov 2018 • Solo,Classic Reading Point in Mega polis~Mumbai,"Asiatic Library is a part of Asiatic Society formed during british era for research and conservation of Indian past in several fields.Now the Asiatic Library is visibly little more active than the socity!. The 1804 A.D. Greco- Roman styled building atop a flight of over two dozens steps and supported by large eight columns behind which glass windows and doors of the reading section provide a magnificent view from a distance. Visitors are curiously attracted to at least have a look, a photo or a selfie.!The heritage building in all white has a terrific hall in centre,with double height,patterned ceiling and Chandeliers impressively hanging. The newspapers and magazines section is specious. Reference books available,Students and researchers have study sections on two sides.The furniture is Victorian. In the midst of fort area, besides Custom house and a stone's throw away from Jahangir Art gallery, Museum,etc.,it provides a gala time to spend on Reads among the bustling tourist spots.You can get refreshments at noon in the adjioning custom house canteen. This section of the building used to serve as Town Hall in pre independence era.I couldn't get how and why it was closed down. If converted to Town Hall, it can provide an excellent royal  facility for performing arts on  the edifice of this heritage Magnum. It is also sad that most of the space in the building is occupied by odd government offices. There are superb life-size Statues of British officers of the times inside which are worth a look for its masterful real to life projection that brings awe to the minds of visitors but are surrounded by cupboards of steel that might have government files inside.Municipal corporation of Mumbai needs to wake up to restore the artistic and scholarly utility of this magnificent building.Nevertheless a must visit just to have glimpse of a bygone era where pursuit of knowledge was made in a royal way!Manoj Oza"
Town_Hall_Asiatic_Society_Library,Mohammed Kadiyani,4.0 of 5 bubbles,May 2018 • Solo,Vintage and Beautiful,"It's a beautiful and one of oldest libraries in Mumbai .The structure is grand , houses thousands of books and well maintained. The staff is a bit sluggish and laidback .A push is required to get your basic work done .Lots of complications if you want to become a member here"
Town_Hall_Asiatic_Society_Library,gigikami,1.0 of 5 bubbles,Jul 2018 • Solo,Pitiful gender segregation. How dismal in this day and age!,"I went to the Asiatic Society to study, and with the idea that it might be nice to be a life member. The library is very pretty, and I love to visit them and study in a new place, especially when I have a giant paper due. Firstly, the library opens at 9:30am, but they don't tell you the Periodicals Room isn't finished being swept for an hour, so cool your jets in the foyer, and you must check your bag, so take out the laptop, all of your books and papers and lug them around, dangerously in peril of dropping to the parquetry floor. When you finally go in to the Periodicals Room balancing all your work you are told you need to be a member, yes, that was the plan. How do I do that? You need to fill out a membership form. May I have one? No, you need to talk to this lady. Where is the membership form please? 10 minues of confusion ensue. Not here. Well can I get one? We don't keep them here. They are kept on the other side of the library. Annoying but off I go. The membership form people do not arrive until 11am, and you need a passport (a current driver's license, with more information on it than a passport, is not good enough). She who treks around Mumbai with her passport in her bag is a sitting duck. That's what safes are for, aren't they? Also, we can't let you into the Periodicals Room, because you have to avail yourself of the references in the Periodicals Room with a daily student membership. You CAN NOT use your own psychology references, the internationally recognised, peer reviewed papers I have balanced in my arms and on my laptop (this seems ridiculous, and maybe a ruse to get me to leave). Perhaps I may use one of your references...(a ruse of my own to checkmate)...Can I become a life member? Yes, but...it takes a few weeks (checkmate). I'm leaving. Instead why don't you use the public library? Unhappy, but desperately needing to study, I go over and I could have used it from 9:30am - it's now 11:30. There is a large central area to sit in. Within seconds I am approached by a man and told to leave the area. Sorry, why? This section is for men! I say I'm sorry, this is just for men (I am utterly confused now)? Yes! Several men reading nothing but magazines scowl at me - get out! and point. Can a woman sit there? No. There? No. There? No. Only there - he points to a corner. That is the women's only section. It is a tiny corner of this giant glamorous library, hidden behind some junk-looking book cases so females have no view of the beautiful library which I am now starting to loathe, under fans blowing so hard you lose your hearing, and on ROUND plastic padded tables with broken lights in the center. It is designed to make your study impossible, and meanwhile there are a few miserable men sitting in the giant beautiful space reading magazines lounging on the lovely antique furniture. I loudly declare my horror at the pathetic space allocated to women, and tell the library that it is disgusting that so few men are doing nothing in the library but taking up the oxygen (to the delight of the two sweet ladies in the segregated section). A more sexist display I have never seen. I am all for cultural empathy, but this is 2018, not 1950. How on earth can the women of India progress if they are treated like this in a PUBLIC LIBRARY? Give it a miss if you are a woman. If you are a jerk, who likes to sit around reading magazines, basking in the glory of your flaccid nether-regions, and contemplating your naval, this is the place for you."
Town_Hall_Asiatic_Society_Library,Hooray H,5.0 of 5 bubbles,Mar 2018 • Solo,Absolutely stunning,What a beautiful building; not sure about the renovation/conservation but anyway Mumbaikers are blessed to have such a building especially opposite a beautiful garden.Compared to the new capitals of the world that only have concrete!
Town_Hall_Asiatic_Society_Library,Pris L,3.0 of 5 bubbles,Sep 2017 • Solo,Renovations and more outdated than expected,The actual library that can be visited is quite small and there were very few books in the cabinets. The books were quite outdated (there was a book on Yahoo!). There were a few older Indian men in the library reading newspapers though. The stairs outside were being renovated during my visit as well so I couldn't take any photos from the outside either.
Town_Hall_Asiatic_Society_Library,MohanAmin,4.0 of 5 bubbles,Jul 2017 • Family,A must visit Iconic place in the heart of the city,"This iconic Town Hall is a must visit place for all the visitors. Presently the spectacular steps of the Town Hall is under repairs. Its treasures of books and periodicals , ancient manuscripts, painted foils, coins, artifacts , maps and prints."
Town_Hall_Asiatic_Society_Library,Jvalant,4.0 of 5 bubbles,Mar 2017 • Solo,Pretty,Excellent building in the heritage precinct of Bombay - has a decent collection of books and is well maintained.
Town_Hall_Asiatic_Society_Library,ankeet_sinha,3.0 of 5 bubbles,Mar 2017 • Family,Good Photo Op,One of the monuments of Mumbai. It is very crowded in the day like the other places but peaceful in the night. Its an excellent place for a photo opportunity with its greek columns. Go in the night when there is less crowds and the city seems more peaceful. 
Town_Hall_Asiatic_Society_Library,Nikhil P,4.0 of 5 bubbles,Nov 2016 • Solo,Paradise for book lovers,"located in the fort area, its one of the most famous libraries in Mumbai area. It has got pretty huge collection of old books and manuscripts . It can be considered as paradise for book lovers only sore point is that it remains closed on Sundays. The architecture is another aspect which makes it pretty attractive."
Town_Hall_Asiatic_Society_Library,thrilladventure,4.0 of 5 bubbles,Jul 2016 • Friends,Inspired by the Greek and Roman architectural styles - definitely worth capturing!,"More than 3000 manuscripts in Sanskrit, Prakrit, Urdu and Persian along with priceless numismatic collection of 11829 coins add to the exceptional collection of the library.Presently known as the Asiatic Society of Bombay, this learned group was formed with the intention of promoting Asian literature, science and oriental arts."
Town_Hall_Asiatic_Society_Library,lynettejoeld,5.0 of 5 bubbles,Dec 2015 • Friends,Beautiful Architecture!,"- This place is actually familiar to most of them, who watch Bollywood movies. This is seen in most of the Hindi Films like Jaane tu ya Jaane Na - This place consists one of the oldest books and editions in the history - This place also attracts a lot of people who are fond of reading books, coin collection As this place also has a coins from the Mughal age"
Town_Hall_Asiatic_Society_Library,Aartichand,3.0 of 5 bubbles,Jul 2016 • Solo,Iconic Stairs,"This is actually a very large library which hosts a lot of old books, manuscripts and journals. One tends to see a lot people on the iconic stairs. This has become a historical landmark of Mumbai. The building is an old one and preserved as a heritage structure. Sometimes it is lit up at night."
Town_Hall_Asiatic_Society_Library,Pankaj0207,4.0 of 5 bubbles,Jun 2016,When one see in images cant believe such a beautiful library is in Mumbai!,"Awesome white building, mostly shown in the bollywood movies as the Court! Good place to click a couple of photographs out there :)"
Town_Hall_Asiatic_Society_Library,thatzamit,4.0 of 5 bubbles,Oct 2015 • Friends,Knowledge Bank,One of the best knowledge bank in Mumbai with great collection of antiques books. Very old & beautiful building.
Town_Hall_Asiatic_Society_Library,sahilagarwal,4.0 of 5 bubbles,Apr 2016,must go for those majestic staircase,"Town hall (more popularly known as asiatic library) is located near fort (behind horniman circle). it is a colonial building and very popular with city's photographers for various shoots including fun wedding related shoots etc. the entire area is quite nice to visit (especially during rains)..on a rainy day - enjoy a nice stroll, click some crazy pictures and end your evening with a hot cup of coffee at starbucks "
Town_Hall_Asiatic_Society_Library,percyvakil,3.0 of 5 bubbles,Sep 2015 • Solo,One of many old buildings around,"The Asiatic library is one of many old buildings in the area. The building itself, if cared for better would be a good thing. The library and the building are now a shadow of their past glory.Parking is difficult in the area if you're visiting by car."
Town_Hall_Asiatic_Society_Library,samir k s,5.0 of 5 bubbles,Jan 2016 • Friends,library is open to all.,"A collection of 800,000 antique volumes. One of them is a priceless first edition copy of Dante's 'Inferno.'  the most regal and elegant of Mumbai's heritage buildings. It houses the Asiatic Society,  when you visit pop over the road to the Horniman Circle Gardens... its beautiful .. huge structure ..victorian architecture"
Town_Hall_Asiatic_Society_Library,savio_pinto12,4.0 of 5 bubbles,Feb 2016 • Solo,Town Hall,"Town Hall is perhaps the most regal and elegant of Mumbai's heritage buildings. It houses the Asiatic Society, a library with a collection of 800,000 antique volumes. One of them is a priceless first edition copy of Dante's 'Inferno.' There is also an impressive numismatic collection of over 1,000 ancient coins and a rare gold mohur belonging to the Mughal Emperor Akbar. You need permission to look at these treasures, but the public library is open to all."
Town_Hall_Asiatic_Society_Library,Richard_in_England,3.0 of 5 bubbles,Jan 2016 • Solo,Nice steps and columns,A lovely impressive entrance setoff with the steps and Greek style columns.  Unfortunately as at 13/1/16 the library is temporarily shut so there's not a lot to see.My Tip: If the library's still shut when you visit pop over the road to the Horniman Circle Gardens.
Town_Hall_Asiatic_Society_Library,pradnya11,4.0 of 5 bubbles,May 2015 • Couples,art at its best,grabbing the memebership of this library aint an easy task but this is a monument to visit on the P dmello road .. its beautiful .. huge structure ..victorian architecture 
Town_Hall_Asiatic_Society_Library,Nish_SG,4.0 of 5 bubbles,Jan 2015,A landmark,"A nice building to have in South Mumbai- used in most movies as the ""stairs outside the courts"". Opposite to Horniman Circle."
Town_Hall_Asiatic_Society_Library,rohintonmn,3.0 of 5 bubbles,Dec 2015,Impressive architecture,"It is an old relic of the British Raj.With the availability of any kind of information on the net, the library has been rendered not that useful.In fact, this building has been shot in countless Indian movies for the beautiful backdrop it provides."
Town_Hall_Asiatic_Society_Library,itherocky,4.0 of 5 bubbles,Apr 2015 • Friends,Tall and handsome!,"The Town hall is an iconic landmark of Mumbai. Better known as the Asiatic Society library, this place is frequented by locals and foreigners alike.This place is more famous for it's regular occurences in Indian movies and Hindi tv serials"
Town_Hall_Asiatic_Society_Library,HarshitShah,5.0 of 5 bubbles,Nov 2015 • Family,Bollywood's favourite (Heritage building) ,"Thanks to the movie the place has been seen in so many movies as court,  parliament. Lots of events are arranged around the place. The recent renovation has given a new life to the structure. "
Town_Hall_Asiatic_Society_Library,visithra,5.0 of 5 bubbles,Sep 2015,beautiful old library,this is a must visit if you are a book lover. the building is stunning and so is the library. however the old part of the library cant be visited by non members. how does a tourist become a member ? it was dissapointing to not be allowed in to a place i have been wanting to see. in that way the library loses its charm. 
Town_Hall_Asiatic_Society_Library,Billythefish1,4.0 of 5 bubbles,Oct 2015 • Couples,Imposing building,"The Central Library, a modern imposing building which was somewhat harking back through the ages to what libraries used to be like. This is also the Town Hall and both can be accessed through the main door."
Town_Hall_Asiatic_Society_Library,Lavesh G,4.0 of 5 bubbles,Oct 2015 • Solo,Beautiful Iconic structure - Charming old school liabrary...!!!,Every passerby would gaze at this structure at least once.. such is the charm of this structure.plush white with elegant British design its a sight in the day as well as in the night.those stairs are recognizable to every Indian movie fan as they are featured in so many.the setup inside is a very old school library with high ceiling long fans and various reading sections.. the collection itself is nice.I would suggest to spare 15 mins for this experience.
Town_Hall_Asiatic_Society_Library,Enthusiastraveller,4.0 of 5 bubbles,Aug 2015 • Solo,Town hall Library,This Asiatic library hall is very old and iconic. It is very near the Horniman circle and to the Churchgate railway station.It hosts of various no. of books inside out of which there are old  and rare books collection as well. Its a good visit for the readers and is nicely maintained as well.
Town_Hall_Asiatic_Society_Library,GuelphTraveller,5.0 of 5 bubbles,Sep 2015 • Solo,Beautiful Neo-Classical Town Hall,In a city of mainly Gothic Revival public buildings the 1820s Town Hall building stands out as a Neo-Classical exception. It is a fine building and similar to other colonial buildings of the period such as the Cape Town City hall built in 1825. This temple style building is plain and features a colonnade of Doric Columns. There are some interesting interior rooms but the building is in need of restoration. It is now a public library.
Town_Hall_Asiatic_Society_Library,DilrukshiH,4.0 of 5 bubbles,Aug 2015 • Couples,An Iconic Building.,"The Town hall is an iconic building in Mumbai, The design is of the colonial era, which has been maintained well.Although we could not go inside due to lack of time, seeing the outside of this magnificent  heritage building was great.The public Library is housed in this building."
Town_Hall_Asiatic_Society_Library,NIR006,5.0 of 5 bubbles,Feb 2015 • Solo,Impressive,"Built more than a century ago...it feels great to sit down on its steps in the evening and watching the double decker buses go by...This landmark has been prominently showcased in many Bollywood movies over generations...Lage Raho Munna Bhai, Singham Returns..being amongst the recent ones...Its inspiring and impressive...a must-see for any Mumbaikar"
Town_Hall_Asiatic_Society_Library,buntee81,5.0 of 5 bubbles,Aug 2015,Old and Famous,the center of mumbai. just opposite of the very famous Horniman Circle and one of the biggest library of mumbai... nearby places like RBI and Horniman circle also are very famous places but siting on the stairs and getting a click is the best part of this famous monument. 
Town_Hall_Asiatic_Society_Library,ushabanerji,4.0 of 5 bubbles,Jul 2015,Magnificent Old World Monument,"The Asiatic Library ( formerly the Town Hall) stands on the edge of the old Fort, not far from the wall that still exists. On climbing up the broad stairs you can look across the beautiful Horniman Circle gardens all the way down to Flora Fountain and beyond.The library houses rare manuscripts and books in a magnificent building. The entire edifice is often featured in Bollywood movies.In reality many indigent youngsters have studied under its lights during exams."
Town_Hall_Asiatic_Society_Library,Mark D,5.0 of 5 bubbles,May 2015,Impressive building!,"A very impressive building from the outside, now used as a school according to our guide. I believe the building has had various uses, Town Hall, Library and now school. It is opposite a park, so you can use the trees to cool down once you have climbed up the steps. "
Town_Hall_Asiatic_Society_Library,Anita S,4.0 of 5 bubbles,Nov 2014 • Solo,Beautiful structure,Its one of the oldest and great structure in Mumbai.One shouldn't miss this if you are there to visit gate way and other places.I have always admired when ever i have crossed it.
Town_Hall_Asiatic_Society_Library,erica_mb_64,4.0 of 5 bubbles,Jun 2015 • Friends,cool!,"we entered through the side entrance as we had to visit the stamp office there. not postage but treasury. climbed a flight of stairs past some lovely statues into a quaint large hall. as is with indian libraries, there are just lines of cupboards full of books and stuff with reading spaces demarcated. it could have been laid out so much better and the good books put on display. as of now you really have to hunt for stuff. lovely entrance in front of course."
Town_Hall_Asiatic_Society_Library,devang s,5.0 of 5 bubbles,Jan 2015 • Family,Town hall library,"One of the oldest Asiatic library . lots of movie shooting has been done on this library stairs . it also has a huge amount of old books , for book lovers .lots of people study on the stairs of library ."
Town_Hall_Asiatic_Society_Library,HarshitShah,4.0 of 5 bubbles,Dec 2014 • Couples,Heritage Reading library,"The Library, Historic importance or Film location, whatever it be place is worth visit. We have seen this place in Hindi movies as High Court (Tezaab), Bluff master, Munna Bhai MBBS and till date it is still managed and maintained very well."
